"","variety","variety_ID","clone_ID","clone_num","year","bud_day","flow_day","ver_day","mat_day","notes","BB","FLOW","VER","MAT","review","DiffBudMat","DiffBudFlow","DiffFlowVer","DiffVerMat","DiffBudVer"
"1","Aramon_Noir","22","22Mpt1","",1958,"26/3/58","","","12/9/1958",NA,1958-03-26,NA,NA,1958-09-12,NA,170,NA,NA,NA,NA
"2","Aramon_Noir","22","22Mpt1","",1959,"21/3/59","","","14/9/59",NA,1959-03-21,NA,NA,1959-09-14,NA,177,NA,NA,NA,NA
"3","Aramon_Noir","22","22Mpt1","",1960,"9/3/1960","","","2/9/1961",NA,1960-03-09,NA,NA,1961-09-02,NA,542,NA,NA,NA,NA
"4","Aramon_Noir","22","22Mpt1","",1962,"5/4/1962","","","17/9/62",NA,1962-04-05,NA,NA,1962-09-17,NA,165,NA,NA,NA,NA
"5","Aramon_Noir","22","22Mpt1","",1963,"11/4/1963","","","23/9/63",NA,1963-04-11,NA,NA,1963-09-23,NA,165,NA,NA,NA,NA
"6","Aramon_Noir","22","22Mpt1","",1964,"1/4/1964","","","15/9/64",NA,1964-04-01,NA,NA,1964-09-15,NA,167,NA,NA,NA,NA
"7","Aramon_Noir","22","22Mpt1","",1965,"3/4/1965","","","20/9/65",NA,1965-04-03,NA,NA,1965-09-20,NA,170,NA,NA,NA,NA
"8","Aramon_Noir","22","22Mpt1","",1976,"","","2/8/1976","",NA,NA,NA,1976-08-02,NA,NA,NA,NA,NA,NA,NA
"9","Aramon_Noir","22","22Mpt1","",1977,"","","16/8/77","",NA,NA,NA,1977-08-16,NA,NA,NA,NA,NA,NA,NA
"10","Aramon_Noir","22","22Mpt1","",1978,"","","10/8/1978","",NA,NA,NA,1978-08-10,NA,NA,NA,NA,NA,NA,NA
"11","Aramon_Noir","22","22Mpt1","",1981,"26/3/81","","","",NA,1981-03-26,NA,NA,NA,NA,NA,NA,NA,NA,NA
"12","Aramon_Noir","22","22Mpt1","",1983,"22/3/83","","","",NA,1983-03-22,NA,NA,NA,NA,NA,NA,NA,NA,NA
"13","Aramon_Noir","22","22Mpt1","",1986,"24/3/86","","","",NA,1986-03-24,NA,NA,NA,NA,NA,NA,NA,NA,NA
"14","Aramon_Noir","22","22Mpt1","",1994,"","28/5/94","","",NA,NA,1994-05-28,NA,NA,NA,NA,NA,NA,NA,NA
"15","Aramon_Noir","22","22Mpt1","",1995,"","3/6/1995","","",NA,NA,1995-06-03,NA,NA,NA,NA,NA,NA,NA,NA
"16","Aramon_Noir","22","22Mpt1","",1996,"","3/6/1996","5/8/1996","",NA,NA,1996-06-03,1996-08-05,NA,NA,NA,NA,63,NA,NA
"17","Aramon_Noir","22","22Mpt1","",1997,"3/3/1997","17/5/97","4/8/1997","8/9/1997",NA,1997-03-03,1997-05-17,1997-08-04,1997-09-08,NA,189,75,79,35,154
"18","Aramon_Noir","22","22Mpt1","",1998,"18/3/98","27/5/98","4/8/1998","10/9/1998",NA,1998-03-18,1998-05-27,1998-08-04,1998-09-10,NA,176,70,69,37,139
"19","Aramon_Noir","22","22Mpt1","",1999,"17/3/99","27/5/99","10/8/1999","15/9/99",NA,1999-03-17,1999-05-27,1999-08-10,1999-09-15,NA,182,71,75,36,146
"20","Aramon_Noir","22","22Mpt1","",2000,"17/3/00","29/5/00","7/8/2000","18/9/00",NA,2000-03-17,2000-05-29,2000-08-07,2000-09-18,NA,185,73,70,42,143
"21","Aramon_Noir","22","22Mpt1","",2003,"17/3/03","30/5/03","8/8/2003","1/9/2003",NA,2003-03-17,2003-05-30,2003-08-08,2003-09-01,NA,168,74,70,24,144
"22","Aramon_Noir","22","22Mpt1","",2004,"16/3/04","7/6/2004","12/8/2004","24/8/04",NA,2004-03-16,2004-06-07,2004-08-12,2004-08-24,NA,161,83,66,12,149
"23","Aramon_Noir","22","22Mpt1","",2005,"1/4/2005","3/6/2005","11/8/2005","6/9/2005",NA,2005-04-01,2005-06-03,2005-08-11,2005-09-06,NA,158,63,69,26,132
"24","Aramon_Noir","22","22Mpt1","",2006,"21/3/06","26/3/06","8/8/2006","6/9/2006",NA,2006-03-21,2006-03-26,2006-08-08,2006-09-06,NA,169,5,135,29,140
"25","Aramon_Noir","22","22Mpt1","",2007,"8/3/2007","19/5/07","1/8/2007","29/8/07",NA,2007-03-08,2007-05-19,2007-08-01,2007-08-29,NA,174,72,74,28,146
"26","Aramon_Noir","22","22Mpt1","",2008,"1/3/2008","22/5/08","7/8/2008","28/8/08",NA,2008-03-01,2008-05-22,2008-08-07,2008-08-28,NA,180,82,77,21,159
"27","Aramon_Noir","22","22Mpt1","",2009,"10/3/2009","26/5/09","28/7/09","18/8/09",NA,2009-03-10,2009-05-26,2009-07-28,2009-08-18,NA,161,77,63,21,140
"28","Aramon_Noir","22","22Mpt2","",1956,"27/3/56","","","24/9/56",NA,1956-03-27,NA,NA,1956-09-24,NA,181,NA,NA,NA,NA
"29","Aramon_Noir","22","22Mpt2","",1957,"16/3/57","","","",NA,1957-03-16,NA,NA,NA,NA,NA,NA,NA,NA,NA
"30","Aramon_Noir","22","22Mpt2","",1958,"26/3/58","","","10/9/1958",NA,1958-03-26,NA,NA,1958-09-10,NA,168,NA,NA,NA,NA
"31","Aramon_Noir","22","22Mpt2","",1959,"16/3/59","","","12/9/1959",NA,1959-03-16,NA,NA,1959-09-12,NA,180,NA,NA,NA,NA
"32","Aramon_Noir","22","22Mpt2","",1960,"16/3/60","","","5/9/1960",NA,1960-03-16,NA,NA,1960-09-05,NA,173,NA,NA,NA,NA
"33","Aramon_Noir","22","22Mpt2","",1976,"","","9/8/1976","",NA,NA,NA,1976-08-09,NA,NA,NA,NA,NA,NA,NA
"34","Aramon_Noir","22","22Mpt2","",1977,"","","17/8/77","",NA,NA,NA,1977-08-17,NA,NA,NA,NA,NA,NA,NA
"35","Aramon_Noir","22","22Mpt2","",1978,"","","16/8/78","",NA,NA,NA,1978-08-16,NA,NA,NA,NA,NA,NA,NA
"36","Aramon_Noir","22","22Mpt2","",1981,"22/3/81","","","",NA,1981-03-22,NA,NA,NA,NA,NA,NA,NA,NA,NA
"37","Aramon_Noir","22","22Mpt2","",1983,"21/3/83","","","",NA,1983-03-21,NA,NA,NA,NA,NA,NA,NA,NA,NA
"38","Aramon_Noir","22","22Mpt2","",1986,"24/3/86","8/6/1987","6/8/1987","",NA,1986-03-24,1987-06-08,1987-08-06,NA,NA,NA,441,59,NA,500
"39","Aramon_Noir","22","22Mpt2","",1988,"15/3/88","3/6/1988","5/8/1988","12/9/1988",NA,1988-03-15,1988-06-03,1988-08-05,1988-09-12,NA,181,80,63,38,143
"40","Aramon_Noir","22","22Mpt2","",1989,"","26/5/89","1/8/1989","",NA,NA,1989-05-26,1989-08-01,NA,NA,NA,NA,67,NA,NA
"41","Aramon_Noir","22","22Mpt2","",1990,"","24/5/90","30/7/90","",NA,NA,1990-05-24,1990-07-30,NA,NA,NA,NA,67,NA,NA
"42","Aramon_Noir","22","22Mpt2","",1991,"","6/6/1991","13/8/91","",NA,NA,1991-06-06,1991-08-13,NA,NA,NA,NA,68,NA,NA
"43","Aramon_Noir","22","22Mpt2","",1992,"","28/5/92","4/8/1992","",NA,NA,1992-05-28,1992-08-04,NA,NA,NA,NA,68,NA,NA
"44","Aramon_Noir","22","22Mpt2","",1994,"","26/5/94","1/8/1994","",NA,NA,1994-05-26,1994-08-01,NA,NA,NA,NA,67,NA,NA
"45","Aramon_Noir","22","22Mpt2","",1996,"","","5/8/1996","",NA,NA,NA,1996-08-05,NA,NA,NA,NA,NA,NA,NA
"46","Aramon_Noir","22","22Mpt2","",1997,"3/3/1997","17/5/97","4/8/1997","8/9/1997",NA,1997-03-03,1997-05-17,1997-08-04,1997-09-08,NA,189,75,79,35,154
"47","Aramon_Noir","22","22Mpt2","",1998,"17/3/98","27/5/98","4/8/1998","10/9/1998",NA,1998-03-17,1998-05-27,1998-08-04,1998-09-10,NA,177,71,69,37,140
"48","Aramon_Noir","22","22Mpt2","",1999,"18/3/99","27/5/99","9/8/1999","15/9/99",NA,1999-03-18,1999-05-27,1999-08-09,1999-09-15,NA,181,70,74,37,144
"49","Aramon_Noir","22","22Mpt2","",2000,"18/3/00","29/5/00","7/8/2000","4/9/2000",NA,2000-03-18,2000-05-29,2000-08-07,2000-09-04,NA,170,72,70,28,142
"50","Aramon_Noir","22","22Mpt2","",2001,"10/3/2001","27/5/01","6/8/2001","28/8/01",NA,2001-03-10,2001-05-27,2001-08-06,2001-08-28,NA,171,78,71,22,149
"51","Aramon_Noir","22","22Mpt2","",2002,"13/3/02","27/5/02","1/8/2002","30/8/02",NA,2002-03-13,2002-05-27,2002-08-01,2002-08-30,NA,170,75,66,29,141
"52","Aramon_Noir","22","22Mpt2","",2003,"24/3/03","30/5/03","5/8/2003","27/8/03",NA,2003-03-24,2003-05-30,2003-08-05,2003-08-27,NA,156,67,67,22,134
"53","Aramon_Noir","22","22Mpt2","",2004,"21/3/04","4/6/2004","12/8/2004","31/8/04",NA,2004-03-21,2004-06-04,2004-08-12,2004-08-31,NA,163,75,69,19,144
"54","Aramon_Noir","22","22Mpt2","",2005,"4/4/2005","3/6/2005","8/8/2005","6/9/2005",NA,2005-04-04,2005-06-03,2005-08-08,2005-09-06,NA,155,60,66,29,126
"55","Aramon_Noir","22","22Mpt2","",2006,"26/3/06","28/5/06","4/8/2006","6/9/2006",NA,2006-03-26,2006-05-28,2006-08-04,2006-09-06,NA,164,63,68,33,131
"56","Aramon_Noir","22","22Mpt2","",2007,"7/3/2007","19/5/07","24/7/07","29/8/07",NA,2007-03-07,2007-05-19,2007-07-24,2007-08-29,NA,175,73,66,36,139
"57","Aramon_Noir","22","22Mpt2","",2008,"6/3/2008","25/5/08","7/8/2008","3/9/2008",NA,2008-03-06,2008-05-25,2008-08-07,2008-09-03,NA,181,80,74,27,154
"58","Aramon_Noir","22","22Mpt2","",2009,"15/3/09","26/5/09","27/7/09","24/8/09",NA,2009-03-15,2009-05-26,2009-07-27,2009-08-24,NA,162,72,62,28,134
"59","Aramon_Noir","22","22Mpt2","",2010,"24/3/10","31/5/10","2/8/2010","10/9/2010",NA,2010-03-24,2010-05-31,2010-08-02,2010-09-10,NA,170,68,63,39,131
"60","Aramon_Noir","22","22Mpt2","",2011,"12/3/2011","17/5/11","28/7/11","12/9/2011",NA,2011-03-12,2011-05-17,2011-07-28,2011-09-12,NA,184,66,72,46,138
"61","Aramon_Noir","22","22Mpt2","",2012,"19/3/12","28/5/12","1/8/2012","6/9/2012",NA,2012-03-19,2012-05-28,2012-08-01,2012-09-06,NA,171,70,65,36,135
"62","Aramon_Noir","22","22Mpt2","",2013,"20/3/13","6/6/2013","12/8/2013","",NA,2013-03-20,2013-06-06,2013-08-12,NA,NA,NA,78,67,NA,145
"63","Aramon_Noir","22","22Mpt3","",1956,"27/3/56","","","24/9/56",NA,1956-03-27,NA,NA,1956-09-24,NA,181,NA,NA,NA,NA
"64","Aramon_Noir","22","22Mpt3","",1957,"13/3/57","","","23/9/57",NA,1957-03-13,NA,NA,1957-09-23,NA,194,NA,NA,NA,NA
"65","Aramon_Noir","22","22Mpt3","",1958,"26/3/58","","","10/9/1958",NA,1958-03-26,NA,NA,1958-09-10,NA,168,NA,NA,NA,NA
"66","Aramon_Noir","22","22Mpt3","",1959,"17/3/59","","","12/9/1959",NA,1959-03-17,NA,NA,1959-09-12,NA,179,NA,NA,NA,NA
"67","Aramon_Noir","22","22Mpt3","",1960,"15/3/60","","","5/9/1960",NA,1960-03-15,NA,NA,1960-09-05,NA,174,NA,NA,NA,NA
"68","Aramon_Noir","22","22Mpt3","",1976,"","","12/8/1976","",NA,NA,NA,1976-08-12,NA,NA,NA,NA,NA,NA,NA
"69","Aramon_Noir","22","22Mpt3","",1977,"","","16/8/77","",NA,NA,NA,1977-08-16,NA,NA,NA,NA,NA,NA,NA
"70","Aramon_Noir","22","22Mpt3","",1978,"","","16/8/78","",NA,NA,NA,1978-08-16,NA,NA,NA,NA,NA,NA,NA
"71","Aramon_Noir","22","22Mpt3","",1981,"21/3/81","","","",NA,1981-03-21,NA,NA,NA,NA,NA,NA,NA,NA,NA
"72","Aramon_Noir","22","22Mpt3","",1983,"24/3/83","","","",NA,1983-03-24,NA,NA,NA,NA,NA,NA,NA,NA,NA
"73","Aramon_Noir","22","22Mpt3","",1986,"23/3/86","","","",NA,1986-03-23,NA,NA,NA,NA,NA,NA,NA,NA,NA
"74","Aramon_Noir","22","22Mpt3","",1988,"14/3/88","31/5/88","5/8/1988","12/9/1988",NA,1988-03-14,1988-05-31,1988-08-05,1988-09-12,NA,182,78,66,38,144
"75","Aramon_Noir","22","22Mpt3","",1989,"","24/5/89","1/8/1989","",NA,NA,1989-05-24,1989-08-01,NA,NA,NA,NA,69,NA,NA
"76","Aramon_Noir","22","22Mpt3","",1990,"","23/5/90","25/7/90","",NA,NA,1990-05-23,1990-07-25,NA,NA,NA,NA,63,NA,NA
"77","Aramon_Noir","22","22Mpt3","",1991,"","3/6/1991","13/8/91","",NA,NA,1991-06-03,1991-08-13,NA,NA,NA,NA,71,NA,NA
"78","Aramon_Noir","22","22Mpt3","",1992,"","28/5/92","4/8/1992","",NA,NA,1992-05-28,1992-08-04,NA,NA,NA,NA,68,NA,NA
"79","Aramon_Noir","22","22Mpt3","",1994,"","26/5/94","1/8/1994","",NA,NA,1994-05-26,1994-08-01,NA,NA,NA,NA,67,NA,NA
"80","Aramon_Noir","22","22Mpt3","",1995,"13/3/95","2/6/1995","10/8/1995","11/9/1995",NA,1995-03-13,1995-06-02,1995-08-10,1995-09-11,NA,182,81,69,32,150
"81","Aramon_Noir","22","22Mpt4","",1956,"27/3/56","","","24/9/56",NA,1956-03-27,NA,NA,1956-09-24,NA,181,NA,NA,NA,NA
"82","Aramon_Noir","22","22Mpt4","",1957,"9/3/1957","","","23/9/57",NA,1957-03-09,NA,NA,1957-09-23,NA,198,NA,NA,NA,NA
"83","Aramon_Noir","22","22Mpt4","",1958,"26/3/58","","","10/9/1958",NA,1958-03-26,NA,NA,1958-09-10,NA,168,NA,NA,NA,NA
"84","Aramon_Noir","22","22Mpt4","",1959,"13/3/59","","","12/9/1959",NA,1959-03-13,NA,NA,1959-09-12,NA,183,NA,NA,NA,NA
"85","Aramon_Noir","22","22Mpt4","",1960,"14/3/60","","","5/9/1960",NA,1960-03-14,NA,NA,1960-09-05,NA,175,NA,NA,NA,NA
"86","Aramon_Noir","22","22Mpt4","",1976,"","","5/8/1976","",NA,NA,NA,1976-08-05,NA,NA,NA,NA,NA,NA,NA
"87","Aramon_Noir","22","22Mpt4","",1977,"","","16/8/77","",NA,NA,NA,1977-08-16,NA,NA,NA,NA,NA,NA,NA
"88","Aramon_Noir","22","22Mpt4","",1978,"","","16/8/78","",NA,NA,NA,1978-08-16,NA,NA,NA,NA,NA,NA,NA
"89","Aramon_Noir","22","22Mpt4","",1981,"26/3/81","","","",NA,1981-03-26,NA,NA,NA,NA,NA,NA,NA,NA,NA
"90","Aramon_Noir","22","22Mpt4","",1983,"22/3/83","","","",NA,1983-03-22,NA,NA,NA,NA,NA,NA,NA,NA,NA
"91","Aramon_Noir","22","22Mpt4","",1986,"24/3/86","","","",NA,1986-03-24,NA,NA,NA,NA,NA,NA,NA,NA,NA
"92","Aramon_Noir","22","22Mpt4","",1988,"21/3/88","31/5/88","5/8/1988","19/9/88",NA,1988-03-21,1988-05-31,1988-08-05,1988-09-19,NA,182,71,66,45,137
"93","Aramon_Noir","22","22Mpt4","",1989,"","","","",NA,NA,NA,NA,NA,NA,NA,NA,NA,NA,NA
"94","Aramon_Noir","22","22Mpt4","",1990,"","","","",NA,NA,NA,NA,NA,NA,NA,NA,NA,NA,NA
"95","Aramon_Noir","22","22Mpt4","",1991,"","3/6/1991","13/8/91","",NA,NA,1991-06-03,1991-08-13,NA,NA,NA,NA,71,NA,NA
"96","Aramon_Noir","22","22Mpt4","",1992,"","28/5/92","4/8/1992","",NA,NA,1992-05-28,1992-08-04,NA,NA,NA,NA,68,NA,NA
"97","Aramon_Noir","22","22Mpt4","",1994,"","26/5/94","1/8/1994","",NA,NA,1994-05-26,1994-08-01,NA,NA,NA,NA,67,NA,NA
"98","Aramon_Noir","22","22Mpt4","",1995,"16/3/95","2/6/1995","10/8/1995","11/9/1995",NA,1995-03-16,1995-06-02,1995-08-10,1995-09-11,NA,179,78,69,32,147
"99","Aramon_Noir","22","22Mpt4","",1996,"","3/6/1996","","",NA,NA,1996-06-03,NA,NA,NA,NA,NA,NA,NA,NA
"100","Aramon_Noir","22","22Mpt5","",1956,"29/3/56","","","24/9/56",NA,1956-03-29,NA,NA,1956-09-24,NA,179,NA,NA,NA,NA
"101","Aramon_Noir","22","22Mpt5","",1957,"13/3/57","","","1/10/1957",NA,1957-03-13,NA,NA,1957-10-01,NA,202,NA,NA,NA,NA
"102","Aramon_Noir","22","22Mpt5","",1958,"26/3/58","","","10/9/1958",NA,1958-03-26,NA,NA,1958-09-10,NA,168,NA,NA,NA,NA
"103","Aramon_Noir","22","22Mpt5","",1959,"17/3/59","","","12/9/1959",NA,1959-03-17,NA,NA,1959-09-12,NA,179,NA,NA,NA,NA
"104","Aramon_Noir","22","22Mpt5","",1960,"12/3/1960","","","5/9/1960",NA,1960-03-12,NA,NA,1960-09-05,NA,177,NA,NA,NA,NA
"105","Aramon_Noir","22","22Mpt5","",1976,"","","12/8/1976","",NA,NA,NA,1976-08-12,NA,NA,NA,NA,NA,NA,NA
"106","Aramon_Noir","22","22Mpt5","",1977,"","","16/8/77","",NA,NA,NA,1977-08-16,NA,NA,NA,NA,NA,NA,NA
"107","Aramon_Noir","22","22Mpt5","",1978,"","","16/8/78","",NA,NA,NA,1978-08-16,NA,NA,NA,NA,NA,NA,NA
"108","Aramon_Noir","22","22Mpt5","",1981,"25/3/81","","","",NA,1981-03-25,NA,NA,NA,NA,NA,NA,NA,NA,NA
"109","Aramon_Noir","22","22Mpt5","",1983,"22/3/83","","","",NA,1983-03-22,NA,NA,NA,NA,NA,NA,NA,NA,NA
"110","Aramon_Noir","22","22Mpt5","",1986,"23/3/86","","","",NA,1986-03-23,NA,NA,NA,NA,NA,NA,NA,NA,NA
"111","Aramon_Noir","22","22Mpt5","",1987,"","6/6/1987","6/8/1987","",NA,NA,1987-06-06,1987-08-06,NA,NA,NA,NA,61,NA,NA
"112","Aramon_Noir","22","22Mpt5","",1988,"21/3/88","1/6/1988","1/8/1988","19/9/88",NA,1988-03-21,1988-06-01,1988-08-01,1988-09-19,NA,182,72,61,49,133
"113","Aramon_Noir","22","22Mpt5","",1995,"20/3/95","2/6/1995","16/8/95","11/9/1995",NA,1995-03-20,1995-06-02,1995-08-16,1995-09-11,NA,175,74,75,26,149
"114","Aramon_Noir","22","22Mpt5","",1996,"","3/6/1996","","",NA,NA,1996-06-03,NA,NA,NA,NA,NA,NA,NA,NA
"115","Aramon_Noir","22","22Mpt5","",2001,"11/3/2001","27/5/01","30/8/01","28/8/01",NA,2001-03-11,2001-05-27,2001-08-30,2001-08-28,NA,170,77,95,-2,172
"116","Aramon_Noir","22","22Mpt5","",2002,"12/3/2002","27/5/02","29/7/02","3/9/2002",NA,2002-03-12,2002-05-27,2002-07-29,2002-09-03,NA,175,76,63,36,139
"117","Aramon_Noir","22","22Mpt5","",2003,"23/3/03","30/5/03","5/8/2003","25/8/03",NA,2003-03-23,2003-05-30,2003-08-05,2003-08-25,NA,155,68,67,20,135
"118","Aramon_Noir","22","22Mpt5","",2004,"23/3/04","4/6/2004","12/8/2004","17/9/04",NA,2004-03-23,2004-06-04,2004-08-12,2004-09-17,NA,178,73,69,36,142
"119","Aramon_Noir","22","22Mpt5","",2005,"5/4/2005","5/6/2005","8/8/2005","10/9/2005",NA,2005-04-05,2005-06-05,2005-08-08,2005-09-10,NA,158,61,64,33,125
"120","Aramon_Noir","22","22Mpt5","",2006,"28/3/06","28/5/06","4/8/2006","6/9/2006",NA,2006-03-28,2006-05-28,2006-08-04,2006-09-06,NA,162,61,68,33,129
"121","Aramon_Noir","22","22Mpt5","",2007,"6/3/2007","16/5/07","24/7/07","29/8/07",NA,2007-03-06,2007-05-16,2007-07-24,2007-08-29,NA,176,71,69,36,140
"122","Aramon_Noir","22","22Mpt5","",2008,"10/3/2008","27/5/08","7/8/2008","3/9/2008",NA,2008-03-10,2008-05-27,2008-08-07,2008-09-03,NA,177,78,72,27,150
"123","Aramon_Noir","22","22Mpt5","",2009,"13/3/09","26/5/09","27/7/09","24/8/09",NA,2009-03-13,2009-05-26,2009-07-27,2009-08-24,NA,164,74,62,28,136
"124","Aramon_Noir","22","22Mpt5","",2010,"25/3/10","1/6/2010","2/8/2010","20/9/10",NA,2010-03-25,2010-06-01,2010-08-02,2010-09-20,NA,179,68,62,49,130
"125","Aramon_Noir","22","22Mpt5","",2011,"14/3/11","17/5/11","29/7/11","9/9/2011",NA,2011-03-14,2011-05-17,2011-07-29,2011-09-09,NA,179,64,73,42,137
"126","Aramon_Noir","22","22Mpt5","",2012,"21/3/12","28/5/12","3/8/2012","6/9/2012",NA,2012-03-21,2012-05-28,2012-08-03,2012-09-06,NA,169,68,67,34,135
"127","Aramon_Noir","22","22Mpt5","",2013,"21/3/13","3/6/2013","12/8/2013","",NA,2013-03-21,2013-06-03,2013-08-12,NA,NA,NA,74,70,NA,144
"128","Aramon_Noir","22","22Mpt6","",1956,"30/3/56","","","17/9/56",NA,1956-03-30,NA,NA,1956-09-17,NA,171,NA,NA,NA,NA
"129","Aramon_Noir","22","22Mpt6","",1957,"13/3/57","","","",NA,1957-03-13,NA,NA,NA,NA,NA,NA,NA,NA,NA
"130","Aramon_Noir","22","22Mpt6","",1958,"29/3/58","","","10/9/1958",NA,1958-03-29,NA,NA,1958-09-10,NA,165,NA,NA,NA,NA
"131","Aramon_Noir","22","22Mpt6","",1959,"20/3/59","","","12/9/1959",NA,1959-03-20,NA,NA,1959-09-12,NA,176,NA,NA,NA,NA
"132","Aramon_Noir","22","22Mpt6","",1960,"12/3/1960","","","5/9/1960",NA,1960-03-12,NA,NA,1960-09-05,NA,177,NA,NA,NA,NA
"133","Aramon_Noir","22","22Mpt7","",1956,"28/3/56","","","24/9/56",NA,1956-03-28,NA,NA,1956-09-24,NA,180,NA,NA,NA,NA
"134","Aramon_Noir","22","22Mpt7","",1957,"13/3/57","","","24/9/57",NA,1957-03-13,NA,NA,1957-09-24,NA,195,NA,NA,NA,NA
"135","Aramon_Noir","22","22Mpt7","",1958,"31/3/58","","","12/9/1958",NA,1958-03-31,NA,NA,1958-09-12,NA,165,NA,NA,NA,NA
"136","Aramon_Noir","22","22Mpt7","",1959,"22/3/59","","","12/9/1959",NA,1959-03-22,NA,NA,1959-09-12,NA,174,NA,NA,NA,NA
"137","Aramon_Noir","22","22Mpt7","",1960,"14/3/60","","","5/9/1960",NA,1960-03-14,NA,NA,1960-09-05,NA,175,NA,NA,NA,NA
"138","Aramon_Noir","22","22Mpt7","",1976,"","","12/8/1976","",NA,NA,NA,1976-08-12,NA,NA,NA,NA,NA,NA,NA
"139","Aramon_Noir","22","22Mpt7","",1977,"","","16/8/77","",NA,NA,NA,1977-08-16,NA,NA,NA,NA,NA,NA,NA
"140","Aramon_Noir","22","22Mpt7","",1978,"","","16/8/78","",NA,NA,NA,1978-08-16,NA,NA,NA,NA,NA,NA,NA
"141","Aramon_Noir","22","22Mpt7","",1979,"","31/5/79","","",NA,NA,1979-05-31,NA,NA,NA,NA,NA,NA,NA,NA
"142","Aramon_Noir","22","22Mpt7","",1980,"","5/6/1980","","",NA,NA,1980-06-05,NA,NA,NA,NA,NA,NA,NA,NA
"143","Aramon_Noir","22","22Mpt7","",1981,"25/3/81","5/6/1981","","",NA,1981-03-25,1981-06-05,NA,NA,NA,NA,72,NA,NA,NA
"144","Aramon_Noir","22","22Mpt7","",1982,"","28/5/82","","",NA,NA,1982-05-28,NA,NA,NA,NA,NA,NA,NA,NA
"145","Aramon_Noir","22","22Mpt7","",1983,"21/3/83","","","",NA,1983-03-21,NA,NA,NA,NA,NA,NA,NA,NA,NA
"146","Aramon_Noir","22","22Mpt7","",1986,"22/3/86","","","",NA,1986-03-22,NA,NA,NA,NA,NA,NA,NA,NA,NA
"147","Aramon_Noir","22","22Mpt7","",1987,"","7/6/1987","6/8/1987","",NA,NA,1987-06-07,1987-08-06,NA,NA,NA,NA,60,NA,NA
"148","Aramon_Noir","22","22Mpt7","",1988,"14/3/88","1/6/1988","1/8/1988","12/9/1988",NA,1988-03-14,1988-06-01,1988-08-01,1988-09-12,NA,182,79,61,42,140
"149","Aramon_Noir","22","22Mpt7","",1995,"13/3/95","2/6/1995","16/8/95","11/9/1995",NA,1995-03-13,1995-06-02,1995-08-16,1995-09-11,NA,182,81,75,26,156
"150","Aramon_Noir","22","22Mpt7","",1996,"","3/6/1996","","",NA,NA,1996-06-03,NA,NA,NA,NA,NA,NA,NA,NA
"151","Aramon_Noir","22","22Mpt7","",2001,"3/3/2001","29/5/01","6/8/2001","28/8/01",NA,2001-03-03,2001-05-29,2001-08-06,2001-08-28,NA,178,87,69,22,156
"152","Aramon_Noir","22","22Mpt7","",2002,"9/3/2002","31/5/02","6/8/2002","27/8/02",NA,2002-03-09,2002-05-31,2002-08-06,2002-08-27,NA,171,83,67,21,150
"153","Aramon_Noir","22","22Mpt7","",2003,"18/3/03","3/6/2003","5/8/2003","24/8/03",NA,2003-03-18,2003-06-03,2003-08-05,2003-08-24,NA,159,77,63,19,140
"154","Aramon_Noir","22","22Mpt7","",2004,"21/3/04","4/6/2004","12/8/2004","31/8/04",NA,2004-03-21,2004-06-04,2004-08-12,2004-08-31,NA,163,75,69,19,144
"155","Aramon_Noir","22","22Mpt7","",2005,"2/4/2005","6/6/2005","12/8/2005","6/9/2005",NA,2005-04-02,2005-06-06,2005-08-12,2005-09-06,NA,157,65,67,25,132
"156","Aramon_Noir","22","22Mpt7","",2006,"23/3/06","29/5/06","6/8/2006","6/9/2006",NA,2006-03-23,2006-05-29,2006-08-06,2006-09-06,NA,167,67,69,31,136
"157","Aramon_Noir","22","22Mpt7","",2007,"7/3/2007","19/5/07","1/8/2007","29/8/07",NA,2007-03-07,2007-05-19,2007-08-01,2007-08-29,NA,175,73,74,28,147
"158","Aramon_Noir","22","22Mpt7","",2008,"12/3/2008","28/5/08","7/8/2008","3/9/2008",NA,2008-03-12,2008-05-28,2008-08-07,2008-09-03,NA,175,77,71,27,148
"159","Aramon_Noir","22","22Mpt7","",2009,"14/3/09","26/5/09","30/7/09","1/9/2009",NA,2009-03-14,2009-05-26,2009-07-30,2009-09-01,NA,171,73,65,33,138
"160","Aramon_Noir","22","22Mpt7","",2010,"24/3/10","1/6/2010","9/8/2010","20/9/10",NA,2010-03-24,2010-06-01,2010-08-09,2010-09-20,NA,180,69,69,42,138
"161","Aramon_Noir","22","22Mpt7","",2011,"15/3/11","20/5/11","29/7/11","9/9/2011",NA,2011-03-15,2011-05-20,2011-07-29,2011-09-09,NA,178,66,70,42,136
"162","Aramon_Noir","22","22Mpt7","",2012,"16/3/12","28/5/12","3/8/2012","6/9/2012",NA,2012-03-16,2012-05-28,2012-08-03,2012-09-06,NA,174,73,67,34,140
"163","Aramon_Noir","22","22Mpt7","",2013,"21/3/13","10/6/2013","19/8/13","",NA,2013-03-21,2013-06-10,2013-08-19,NA,NA,NA,81,70,NA,151
"164","Aramon_Noir","22","22Mpt9","",1956,"28/3/56","","","10/9/1956",NA,1956-03-28,NA,NA,1956-09-10,NA,166,NA,NA,NA,NA
"165","Aramon_Noir","22","22Mpt9","",1957,"14/3/57","","","",NA,1957-03-14,NA,NA,NA,NA,NA,NA,NA,NA,NA
"166","Aramon_Noir","22","22Mpt9","",1958,"29/3/58","","","12/9/1958",NA,1958-03-29,NA,NA,1958-09-12,NA,167,NA,NA,NA,NA
"167","Aramon_Noir","22","22Mpt9","",1959,"19/3/59","","","12/9/1959",NA,1959-03-19,NA,NA,1959-09-12,NA,177,NA,NA,NA,NA
"168","Aramon_Noir","22","22Mpt9","",1960,"15/3/60","","","5/9/1960",NA,1960-03-15,NA,NA,1960-09-05,NA,174,NA,NA,NA,NA
"169","Aramon_Noir","22","22Mpt9","",1976,"","","9/8/1976","",NA,NA,NA,1976-08-09,NA,NA,NA,NA,NA,NA,NA
"170","Aramon_Noir","22","22Mpt9","",1977,"","","16/8/77","",NA,NA,NA,1977-08-16,NA,NA,NA,NA,NA,NA,NA
"171","Aramon_Noir","22","22Mpt9","",1978,"","","16/8/78","",NA,NA,NA,1978-08-16,NA,NA,NA,NA,NA,NA,NA
"172","Aramon_Noir","22","22Mpt9","",1981,"24/3/81","","","",NA,1981-03-24,NA,NA,NA,NA,NA,NA,NA,NA,NA
"173","Aramon_Noir","22","22Mpt9","",1983,"21/3/83","","","",NA,1983-03-21,NA,NA,NA,NA,NA,NA,NA,NA,NA
"174","Aramon_Noir","22","22Mpt9","",1986,"20/3/86","","","",NA,1986-03-20,NA,NA,NA,NA,NA,NA,NA,NA,NA
"175","Aramon_Noir","22","22Mpt9","",1987,"","8/6/1987","6/8/1987","",NA,NA,1987-06-08,1987-08-06,NA,NA,NA,NA,59,NA,NA
"176","Aramon_Noir","22","22Mpt9","",1988,"15/3/88","1/6/1988","5/8/1988","12/9/1988",NA,1988-03-15,1988-06-01,1988-08-05,1988-09-12,NA,181,78,65,38,143
"177","Aramon_Noir","22","22Mpt9","",1996,"","3/6/1996","","",NA,NA,1996-06-03,NA,NA,NA,NA,NA,NA,NA,NA
"178","Aramon_Noir","22","22Mpt9","",2010,"24/3/10","3/6/2010","2/8/2010","10/9/2010",NA,2010-03-24,2010-06-03,2010-08-02,2010-09-10,NA,170,71,60,39,131
"179","Aramon_Noir","22","22Mpt9","",2011,"13/3/11","18/5/11","28/7/11","15/9/11",NA,2011-03-13,2011-05-18,2011-07-28,2011-09-15,NA,186,66,71,49,137
"180","Aramon_Noir","22","22Mpt9","",2012,"17/3/12","29/5/12","3/8/2012","6/9/2012",NA,2012-03-17,2012-05-29,2012-08-03,2012-09-06,NA,173,73,66,34,139
"181","Aramon_Noir","22","22Mpt9","",2013,"19/3/13","6/6/2013","12/8/2013","",NA,2013-03-19,2013-06-06,2013-08-12,NA,NA,NA,79,67,NA,146
"182","Aramon_Noir","22","22Mpt10","",1958,"17/3/58","","","",NA,1958-03-17,NA,NA,NA,NA,NA,NA,NA,NA,NA
"183","Aramon_Noir","22","22Mpt10","",1959,"12/3/1959","","","24/8/59",NA,1959-03-12,NA,NA,1959-08-24,NA,165,NA,NA,NA,NA
"184","Aramon_Noir","22","22Mpt10","",1960,"5/3/1960","","","",NA,1960-03-05,NA,NA,NA,NA,NA,NA,NA,NA,NA
"185","Aramon_Noir","22","22Mpt10","",1961,"5/3/1961","","","21/8/61",NA,1961-03-05,NA,NA,1961-08-21,NA,169,NA,NA,NA,NA
"186","Aramon_Noir","22","22Mpt10","",1962,"30/3/62","","","17/9/62",NA,1962-03-30,NA,NA,1962-09-17,NA,171,NA,NA,NA,NA
"187","Aramon_Noir","22","22Mpt10","",1963,"5/4/1963","","","16/9/63",NA,1963-04-05,NA,NA,1963-09-16,NA,164,NA,NA,NA,NA
"188","Aramon_Noir","22","22Mpt10","",1964,"1/4/1964","","","15/9/64",NA,1964-04-01,NA,NA,1964-09-15,NA,167,NA,NA,NA,NA
"189","Aramon_Noir","22","22Mpt10","",1965,"29/3/65","","","20/9/65",NA,1965-03-29,NA,NA,1965-09-20,NA,175,NA,NA,NA,NA
"190","Aramon_Noir","22","22Mpt11","",1992,"19/3/92","25/5/92","30/7/92","7/9/1992",NA,1992-03-19,1992-05-25,1992-07-30,1992-09-07,NA,172,67,66,39,133
"191","Aramon_Noir","22","22Mpt11","",1993,"16/3/93","","","",NA,1993-03-16,NA,NA,NA,NA,NA,NA,NA,NA,NA
"192","Aramon_Noir","22","22Mpt11","",1994,"28/2/94","","","",NA,1994-02-28,NA,NA,NA,NA,NA,NA,NA,NA,NA
"193","Aramon_Noir","22","22Mpt11","",1995,"","30/5/95","16/8/95","7/9/1995",NA,NA,1995-05-30,1995-08-16,1995-09-07,NA,NA,NA,78,22,NA
"194","Aramon_Noir","22","22Mpt11","",2002,"1/3/2002","","","",NA,2002-03-01,NA,NA,NA,NA,NA,NA,NA,NA,NA
"195","Aramon_Noir","22","22Mpt11","",2003,"16/3/03","30/5/03","5/8/2003","30/8/03",NA,2003-03-16,2003-05-30,2003-08-05,2003-08-30,NA,167,75,67,25,142
"196","Aramon_Noir","22","22Mpt11","",2004,"15/3/04","4/6/2004","2/8/2004","24/8/04",NA,2004-03-15,2004-06-04,2004-08-02,2004-08-24,NA,162,81,59,22,140
"197","Aramon_Noir","22","22Mpt11","",2005,"30/3/05","2/6/2005","8/8/2005","31/8/05",NA,2005-03-30,2005-06-02,2005-08-08,2005-08-31,NA,154,64,67,23,131
"198","Aramon_Noir","22","22Mpt11","",2006,"21/3/06","28/5/06","8/8/2006","6/9/2006",NA,2006-03-21,2006-05-28,2006-08-08,2006-09-06,NA,169,68,72,29,140
"199","Aramon_Noir","22","22Mpt11","",2007,"4/3/2007","19/5/07","24/7/07","29/8/07",NA,2007-03-04,2007-05-19,2007-07-24,2007-08-29,NA,178,76,66,36,142
"200","Aramon_Noir","22","22Mpt11","",2008,"26/2/08","25/5/08","31/7/08","28/8/08",NA,2008-02-26,2008-05-25,2008-07-31,2008-08-28,NA,184,89,67,28,156
"201","Aramon_Noir","22","22Mpt11","",2009,"10/3/2009","","","",NA,2009-03-10,NA,NA,NA,NA,NA,NA,NA,NA,NA
"202","Aramon_Noir","22","2R1S101.105","",2013,"19/3/13","","","",NA,2013-03-19,NA,NA,NA,NA,NA,NA,NA,NA,NA
"203","Aramon_Noir","22","2R2S51.55","",2013,"20/3/13","","","",NA,2013-03-20,NA,NA,NA,NA,NA,NA,NA,NA,NA
"204","Aramon_Noir","22","2R2S66.70","",2013,"21/3/13","","","",NA,2013-03-21,NA,NA,NA,NA,NA,NA,NA,NA,NA
"205","Aramon_Noir","22","2R2S71.75","",2013,"21/3/3","","","",NA,0193-03-21,NA,NA,NA,NA,NA,NA,NA,NA,NA
"206","Cabernet_Sauvignon","322","322Mpt1","",1956,"3/4/1956","","","27/8/56",NA,1956-04-03,NA,NA,1956-08-27,NA,146,NA,NA,NA,NA
"207","Cabernet_Sauvignon","322","322Mpt1","",1957,"23/3/57","","","9/9/1957",NA,1957-03-23,NA,NA,1957-09-09,NA,170,NA,NA,NA,NA
"208","Cabernet_Sauvignon","322","322Mpt1","",1958,"","","","11/9/1958",NA,NA,NA,NA,1958-09-11,NA,NA,NA,NA,NA,NA
"209","Cabernet_Sauvignon","322","322Mpt1","",1959,"24/3/59","","","25/8/59",NA,1959-03-24,NA,NA,1959-08-25,NA,154,NA,NA,NA,NA
"210","Cabernet_Sauvignon","322","322Mpt1","",1960,"23/3/60","","","",NA,1960-03-23,NA,NA,NA,NA,NA,NA,NA,NA,NA
"211","Cabernet_Sauvignon","322","322Mpt2","",1956,"3/4/1956","","","27/8/56",NA,1956-04-03,NA,NA,1956-08-27,NA,146,NA,NA,NA,NA
"212","Cabernet_Sauvignon","322","322Mpt2","",1957,"21/3/57","","","9/9/1957",NA,1957-03-21,NA,NA,1957-09-09,NA,172,NA,NA,NA,NA
"213","Cabernet_Sauvignon","322","322Mpt2","",1958,"5/4/1958","","","11/9/1958",NA,1958-04-05,NA,NA,1958-09-11,NA,159,NA,NA,NA,NA
"214","Cabernet_Sauvignon","322","322Mpt2","",1959,"27/3/59","","","7/9/1959",NA,1959-03-27,NA,NA,1959-09-07,NA,164,NA,NA,NA,NA
"215","Cabernet_Sauvignon","322","322Mpt3","",1956,"31/3/56","","","27/8/56",NA,1956-03-31,NA,NA,1956-08-27,NA,149,NA,NA,NA,NA
"216","Cabernet_Sauvignon","322","322Mpt3","",1957,"19/3/57","","","9/9/1957",NA,1957-03-19,NA,NA,1957-09-09,NA,174,NA,NA,NA,NA
"217","Cabernet_Sauvignon","322","322Mpt3","",1958,"5/4/1958","","","11/9/1958",NA,1958-04-05,NA,NA,1958-09-11,NA,159,NA,NA,NA,NA
"218","Cabernet_Sauvignon","322","322Mpt3","",1959,"27/3/59","","","7/9/1959",NA,1959-03-27,NA,NA,1959-09-07,NA,164,NA,NA,NA,NA
"219","Cabernet_Sauvignon","322","322Mpt4","",1956,"3/4/1956","","","27/8/56",NA,1956-04-03,NA,NA,1956-08-27,NA,146,NA,NA,NA,NA
"220","Cabernet_Sauvignon","322","322Mpt4","",1957,"23/3/57","","","9/9/1957",NA,1957-03-23,NA,NA,1957-09-09,NA,170,NA,NA,NA,NA
"221","Cabernet_Sauvignon","322","322Mpt4","",1958,"3/4/1958","","","11/9/1958",NA,1958-04-03,NA,NA,1958-09-11,NA,161,NA,NA,NA,NA
"222","Cabernet_Sauvignon","322","322Mpt4","",1959,"30/3/59","","","7/9/1959",NA,1959-03-30,NA,NA,1959-09-07,NA,161,NA,NA,NA,NA
"223","Cabernet_Sauvignon","322","322Mpt4","",1976,"","","12/8/1976","",NA,NA,NA,1976-08-12,NA,NA,NA,NA,NA,NA,NA
"224","Cabernet_Sauvignon","322","322Mpt4","",1977,"","","12/8/1977","",NA,NA,NA,1977-08-12,NA,NA,NA,NA,NA,NA,NA
"225","Cabernet_Sauvignon","322","322Mpt4","",1978,"","","16/8/78","",NA,NA,NA,1978-08-16,NA,NA,NA,NA,NA,NA,NA
"226","Cabernet_Sauvignon","322","322Mpt4","",1993,"","1/6/1993","2/8/1993","",NA,NA,1993-06-01,1993-08-02,NA,NA,NA,NA,62,NA,NA
"227","Cabernet_Sauvignon","322","322Mpt4","",1994,"","24/5/94","8/8/1994","",NA,NA,1994-05-24,1994-08-08,NA,NA,NA,NA,76,NA,NA
"228","Cabernet_Sauvignon","322","322Mpt4","",1995,"3/4/1995","28/5/95","16/8/95","7/9/1995",NA,1995-04-03,1995-05-28,1995-08-16,1995-09-07,NA,157,55,80,22,135
"229","Cabernet_Sauvignon","322","322Mpt4","",1996,"28/3/96","29/5/96","7/8/1996","13/9/96",NA,1996-03-28,1996-05-29,1996-08-07,1996-09-13,NA,169,62,70,37,132
"230","Cabernet_Sauvignon","322","322Mpt4","",1997,"16/3/97","17/5/97","27/7/97","8/9/1997",NA,1997-03-16,1997-05-17,1997-07-27,1997-09-08,NA,176,62,71,43,133
"231","Cabernet_Sauvignon","322","322Mpt4","",1998,"1/4/1998","2/6/1998","7/8/1998","17/9/98",NA,1998-04-01,1998-06-02,1998-08-07,1998-09-17,NA,169,62,66,41,128
"232","Cabernet_Sauvignon","322","322Mpt4","",1999,"29/3/99","28/5/99","3/8/1999","15/9/99",NA,1999-03-29,1999-05-28,1999-08-03,1999-09-15,NA,170,60,67,43,127
"233","Cabernet_Sauvignon","322","322Mpt4","",2000,"7/4/2000","2/6/2000","31/7/00","28/8/00",NA,2000-04-07,2000-06-02,2000-07-31,2000-08-28,NA,143,56,59,28,115
"234","Cabernet_Sauvignon","322","322Mpt4","",2001,"24/3/01","24/5/01","30/7/01","",NA,2001-03-24,2001-05-24,2001-07-30,NA,NA,NA,61,67,NA,128
"235","Cabernet_Sauvignon","322","322Mpt4","",2002,"21/3/02","27/5/02","29/7/02","3/9/2002",NA,2002-03-21,2002-05-27,2002-07-29,2002-09-03,NA,166,67,63,36,130
"236","Cabernet_Sauvignon","322","322Mpt4","",2003,"2/4/2003","30/5/03","25/7/03","28/8/03",NA,2003-04-02,2003-05-30,2003-07-25,2003-08-28,NA,148,58,56,34,114
"237","Cabernet_Sauvignon","322","322Mpt4","",2004,"1/4/2004","4/6/2004","2/8/2004","13/9/04",NA,2004-04-01,2004-06-04,2004-08-02,2004-09-13,NA,165,64,59,42,123
"238","Cabernet_Sauvignon","322","322Mpt4","",2005,"14/4/05","3/6/2005","1/8/2005","6/9/2005",NA,2005-04-14,2005-06-03,2005-08-01,2005-09-06,NA,145,50,59,36,109
"239","Cabernet_Sauvignon","322","322Mpt4","",2006,"2/4/2006","27/5/06","28/7/06","16/8/06",NA,2006-04-02,2006-05-27,2006-07-28,2006-08-16,NA,136,55,62,19,117
"240","Cabernet_Sauvignon","322","322Mpt4","",2007,"27/3/07","24/5/07","20/7/07","3/9/2007",NA,2007-03-27,2007-05-24,2007-07-20,2007-09-03,NA,160,58,57,45,115
"241","Cabernet_Sauvignon","322","322Mpt4","",2008,"1/4/2008","29/5/08","31/7/08","27/8/08",NA,2008-04-01,2008-05-29,2008-07-31,2008-08-27,NA,148,58,63,27,121
"242","Cabernet_Sauvignon","322","322Mpt4","",2009,"30/3/09","26/5/09","21/7/09","1/9/2009",NA,2009-03-30,2009-05-26,2009-07-21,2009-09-01,NA,155,57,56,42,113
"243","Cabernet_Sauvignon","322","322Mpt4","",2010,"10/4/2010","3/6/2010","2/8/2010","10/9/2010",NA,2010-04-10,2010-06-03,2010-08-02,2010-09-10,NA,153,54,60,39,114
"244","Cabernet_Sauvignon","322","322Mpt4","",2011,"21/3/11","16/5/11","28/7/11","8/9/2011",NA,2011-03-21,2011-05-16,2011-07-28,2011-09-08,NA,171,56,73,42,129
"245","Cabernet_Sauvignon","322","322Mpt4","",2012,"31/3/12","31/5/12","6/8/2012","13/9/12",NA,2012-03-31,2012-05-31,2012-08-06,2012-09-13,NA,166,61,67,38,128
"246","Cabernet_Sauvignon","322","322Mpt5","",1956,"3/4/1956","","","20/8/56",NA,1956-04-03,NA,NA,1956-08-20,NA,139,NA,NA,NA,NA
"247","Cabernet_Sauvignon","322","322Mpt5","",1957,"21/3/57","","","9/9/1957",NA,1957-03-21,NA,NA,1957-09-09,NA,172,NA,NA,NA,NA
"248","Cabernet_Sauvignon","322","322Mpt5","",1958,"3/4/1958","","","11/9/1958",NA,1958-04-03,NA,NA,1958-09-11,NA,161,NA,NA,NA,NA
"249","Cabernet_Sauvignon","322","322Mpt5","",1959,"","","","25/8/59",NA,NA,NA,NA,1959-08-25,NA,NA,NA,NA,NA,NA
"250","Cabernet_Sauvignon","322","322Mpt6","",1956,"3/4/1956","","","27/8/56",NA,1956-04-03,NA,NA,1956-08-27,NA,146,NA,NA,NA,NA
"251","Cabernet_Sauvignon","322","322Mpt6","",1957,"23/3/57","","","9/9/1957",NA,1957-03-23,NA,NA,1957-09-09,NA,170,NA,NA,NA,NA
"252","Cabernet_Sauvignon","322","322Mpt6","",1958,"4/4/1958","","","11/9/1958",NA,1958-04-04,NA,NA,1958-09-11,NA,160,NA,NA,NA,NA
"253","Cabernet_Sauvignon","322","322Mpt6","",1959,"30/3/59","","","25/8/59",NA,1959-03-30,NA,NA,1959-08-25,NA,148,NA,NA,NA,NA
"254","Cabernet_Sauvignon","322","322Mpt7","",1956,"31/3/56","","","27/8/56",NA,1956-03-31,NA,NA,1956-08-27,NA,149,NA,NA,NA,NA
"255","Cabernet_Sauvignon","322","322Mpt7","",1957,"","","","14/9/57",NA,NA,NA,NA,1957-09-14,NA,NA,NA,NA,NA,NA
"256","Cabernet_Sauvignon","322","322Mpt7","",1958,"1/4/1958","","","11/9/1958",NA,1958-04-01,NA,NA,1958-09-11,NA,163,NA,NA,NA,NA
"257","Cabernet_Sauvignon","322","322Mpt7","",1959,"30/3/59","","","7/9/1959",NA,1959-03-30,NA,NA,1959-09-07,NA,161,NA,NA,NA,NA
"258","Cabernet_Sauvignon","322","322Mpt7","",1960,"24/3/60","","","",NA,1960-03-24,NA,NA,NA,NA,NA,NA,NA,NA,NA
"259","Cabernet_Sauvignon","322","322Mpt8","",1956,"3/4/1956","","","27/8/56",NA,1956-04-03,NA,NA,1956-08-27,NA,146,NA,NA,NA,NA
"260","Cabernet_Sauvignon","322","322Mpt8","",1957,"21/3/57","","","9/9/1957",NA,1957-03-21,NA,NA,1957-09-09,NA,172,NA,NA,NA,NA
"261","Cabernet_Sauvignon","322","322Mpt8","",1958,"5/4/1958","","","11/9/1958",NA,1958-04-05,NA,NA,1958-09-11,NA,159,NA,NA,NA,NA
"262","Cabernet_Sauvignon","322","322Mpt8","",1959,"27/3/59","","","7/9/1959",NA,1959-03-27,NA,NA,1959-09-07,NA,164,NA,NA,NA,NA
"263","Cabernet_Sauvignon","322","322Mpt8","",1976,"","","5/8/1976","",NA,NA,NA,1976-08-05,NA,NA,NA,NA,NA,NA,NA
"264","Cabernet_Sauvignon","322","322Mpt8","",1977,"","","12/8/1977","",NA,NA,NA,1977-08-12,NA,NA,NA,NA,NA,NA,NA
"265","Cabernet_Sauvignon","322","322Mpt8","",1978,"","","8/8/1978","",NA,NA,NA,1978-08-08,NA,NA,NA,NA,NA,NA,NA
"266","Cabernet_Sauvignon","322","322Mpt9","",1956,"3/4/1956","","","27/8/56",NA,1956-04-03,NA,NA,1956-08-27,NA,146,NA,NA,NA,NA
"267","Cabernet_Sauvignon","322","322Mpt9","",1957,"20/3/57","","","9/9/1957",NA,1957-03-20,NA,NA,1957-09-09,NA,173,NA,NA,NA,NA
"268","Cabernet_Sauvignon","322","322Mpt9","",1958,"3/4/1958","","","11/9/1958",NA,1958-04-03,NA,NA,1958-09-11,NA,161,NA,NA,NA,NA
"269","Cabernet_Sauvignon","322","322Mpt9","",1959,"","","","7/9/1959",NA,NA,NA,NA,1959-09-07,NA,NA,NA,NA,NA,NA
"270","Cabernet_Sauvignon","322","322Mpt10","",1956,"3/4/1956","","","27/8/56",NA,1956-04-03,NA,NA,1956-08-27,NA,146,NA,NA,NA,NA
"271","Cabernet_Sauvignon","322","322Mpt10","",1957,"23/3/57","","","9/9/1957",NA,1957-03-23,NA,NA,1957-09-09,NA,170,NA,NA,NA,NA
"272","Cabernet_Sauvignon","322","322Mpt10","",1958,"4/4/1958","","","11/9/1958",NA,1958-04-04,NA,NA,1958-09-11,NA,160,NA,NA,NA,NA
"273","Cabernet_Sauvignon","322","322Mpt10","",1959,"28/3/59","","","25/8/59",NA,1959-03-28,NA,NA,1959-08-25,NA,150,NA,NA,NA,NA
"274","Cabernet_Sauvignon","322","322Mpt11","",1958,"15/4/58","","","12/9/1958",NA,1958-04-15,NA,NA,1958-09-12,NA,150,NA,NA,NA,NA
"275","Cabernet_Sauvignon","322","322Mpt11","",1959,"4/4/1959","","","7/9/1959",NA,1959-04-04,NA,NA,1959-09-07,NA,156,NA,NA,NA,NA
"276","Cabernet_Sauvignon","322","322Mpt11","",1960,"27/3/60","","","12/9/1960",NA,1960-03-27,NA,NA,1960-09-12,NA,169,NA,NA,NA,NA
"277","Cabernet_Sauvignon","322","322Mpt11","",1961,"","","","2/9/1961",NA,NA,NA,NA,1961-09-02,NA,NA,NA,NA,NA,NA
"278","Cabernet_Sauvignon","322","322Mpt11","",1976,"","","6/8/1976","",NA,NA,NA,1976-08-06,NA,NA,NA,NA,NA,NA,NA
"279","Cabernet_Sauvignon","322","322Mpt11","",1977,"","","8/8/1977","",NA,NA,NA,1977-08-08,NA,NA,NA,NA,NA,NA,NA
"280","Cabernet_Sauvignon","322","322Mpt11","",1978,"","","17/8/78","",NA,NA,NA,1978-08-17,NA,NA,NA,NA,NA,NA,NA
"281","Cabernet_Sauvignon","322","322Mpt11","",1993,"","1/6/1993","2/8/1993","",NA,NA,1993-06-01,1993-08-02,NA,NA,NA,NA,62,NA,NA
"282","Cabernet_Sauvignon","322","322Mpt11","",1994,"","24/5/94","8/8/1994","",NA,NA,1994-05-24,1994-08-08,NA,NA,NA,NA,76,NA,NA
"283","Cabernet_Sauvignon","322","322Mpt11","",1995,"23/3/95","28/5/95","11/8/1995","",NA,1995-03-23,1995-05-28,1995-08-11,NA,NA,NA,66,75,NA,141
"284","Cabernet_Sauvignon","322","322Mpt11","",1996,"25/3/96","29/5/96","5/8/1996","",NA,1996-03-25,1996-05-29,1996-08-05,NA,NA,NA,65,68,NA,133
"285","Cabernet_Sauvignon","322","322Mpt11","",1997,"17/3/97","19/5/97","27/7/97","",NA,1997-03-17,1997-05-19,1997-07-27,NA,NA,NA,63,69,NA,132
"286","Cabernet_Sauvignon","322","322Mpt11","",1998,"27/3/98","27/5/98","4/8/1998","",NA,1998-03-27,1998-05-27,1998-08-04,NA,NA,NA,61,69,NA,130
"287","Cabernet_Sauvignon","322","322Mpt11","",1999,"28/3/99","28/5/99","27/7/99","",NA,1999-03-28,1999-05-28,1999-07-27,NA,NA,NA,61,60,NA,121
"288","Cabernet_Sauvignon","322","322Mpt11","",2000,"5/4/2000","29/5/00","7/8/2000","",NA,2000-04-05,2000-05-29,2000-08-07,NA,NA,NA,54,70,NA,124
"289","Cabernet_Sauvignon","322","322Mpt11","",2001,"19/3/01","27/5/01","23/7/01","28/8/01",NA,2001-03-19,2001-05-27,2001-07-23,2001-08-28,NA,162,69,57,36,126
"290","Cabernet_Sauvignon","322","322Mpt11","",2002,"21/3/02","27/5/02","29/7/02","30/8/02",NA,2002-03-21,2002-05-27,2002-07-29,2002-08-30,NA,162,67,63,32,130
"291","Cabernet_Sauvignon","322","322Mpt11","",2003,"3/4/2003","30/5/03","30/7/03","29/8/03",NA,2003-04-03,2003-05-30,2003-07-30,2003-08-29,NA,148,57,61,30,118
"292","Cabernet_Sauvignon","322","322Mpt11","",2004,"24/3/04","2/6/2004","2/8/2004","6/9/2004",NA,2004-03-24,2004-06-02,2004-08-02,2004-09-06,NA,166,70,61,35,131
"293","Cabernet_Sauvignon","322","322Mpt11","",2005,"13/4/05","5/6/2005","5/8/2005","6/9/2005",NA,2005-04-13,2005-06-05,2005-08-05,2005-09-06,NA,146,53,61,32,114
"294","Cabernet_Sauvignon","322","322Mpt11","",2006,"3/4/2006","27/5/06","31/7/06","6/9/2006",NA,2006-04-03,2006-05-27,2006-07-31,2006-09-06,NA,156,54,65,37,119
"295","Cabernet_Sauvignon","322","322Mpt11","",2007,"29/3/07","21/5/07","24/7/07","29/8/07",NA,2007-03-29,2007-05-21,2007-07-24,2007-08-29,NA,153,53,64,36,117
"296","Cabernet_Sauvignon","322","322Mpt11","",2008,"20/3/08","27/5/08","31/7/08","28/8/08",NA,2008-03-20,2008-05-27,2008-07-31,2008-08-28,NA,161,68,65,28,133
"297","Cabernet_Sauvignon","322","322Mpt11","",2009,"29/3/09","26/5/09","27/7/09","1/9/2009",NA,2009-03-29,2009-05-26,2009-07-27,2009-09-01,NA,156,58,62,36,120
"298","Cabernet_Sauvignon","322","322Mpt12","",1958,"8/4/1958","","","12/9/1958",NA,1958-04-08,NA,NA,1958-09-12,NA,157,NA,NA,NA,NA
"299","Cabernet_Sauvignon","322","322Mpt12","",1959,"3/4/1959","","","7/9/1959",NA,1959-04-03,NA,NA,1959-09-07,NA,157,NA,NA,NA,NA
"300","Cabernet_Sauvignon","322","322Mpt12","",1960,"23/3/60","","","12/9/1960",NA,1960-03-23,NA,NA,1960-09-12,NA,173,NA,NA,NA,NA
"301","Cabernet_Sauvignon","322","322Mpt12","",1961,"23/3/61","","","2/9/1961",NA,1961-03-23,NA,NA,1961-09-02,NA,163,NA,NA,NA,NA
"302","Cabernet_Sauvignon","322","322Mpt12","",1976,"","","6/8/1976","",NA,NA,NA,1976-08-06,NA,NA,NA,NA,NA,NA,NA
"303","Cabernet_Sauvignon","322","322Mpt12","",1977,"","","12/8/1977","",NA,NA,NA,1977-08-12,NA,NA,NA,NA,NA,NA,NA
"304","Cabernet_Sauvignon","322","322Mpt12","",1978,"","","17/8/78","",NA,NA,NA,1978-08-17,NA,NA,NA,NA,NA,NA,NA
"305","Cabernet_Sauvignon","322","322Mpt12","",1993,"","1/6/1993","2/8/1993","",NA,NA,1993-06-01,1993-08-02,NA,NA,NA,NA,62,NA,NA
"306","Cabernet_Sauvignon","322","322Mpt12","",1994,"","24/5/94","8/8/1994","",NA,NA,1994-05-24,1994-08-08,NA,NA,NA,NA,76,NA,NA
"307","Cabernet_Sauvignon","322","322Mpt12","",1995,"3/4/1995","28/5/95","11/8/1995","7/9/1995",NA,1995-04-03,1995-05-28,1995-08-11,1995-09-07,NA,157,55,75,27,130
"308","Cabernet_Sauvignon","322","322Mpt12","",1996,"1/4/1996","1/6/1996","7/8/1996","13/9/96",NA,1996-04-01,1996-06-01,1996-08-07,1996-09-13,NA,165,61,67,37,128
"309","Cabernet_Sauvignon","322","322Mpt12","",1997,"14/3/97","17/5/97","27/7/97","8/9/1997",NA,1997-03-14,1997-05-17,1997-07-27,1997-09-08,NA,178,64,71,43,135
"310","Cabernet_Sauvignon","322","322Mpt12","",1998,"28/3/98","27/5/98","4/8/1998","10/9/1998",NA,1998-03-28,1998-05-27,1998-08-04,1998-09-10,NA,166,60,69,37,129
"311","Cabernet_Sauvignon","322","322Mpt12","",1999,"24/3/99","28/5/99","3/8/1999","15/9/99",NA,1999-03-24,1999-05-28,1999-08-03,1999-09-15,NA,175,65,67,43,132
"312","Cabernet_Sauvignon","322","322Mpt12","",2000,"2/4/2000","29/5/00","31/7/00","28/8/00",NA,2000-04-02,2000-05-29,2000-07-31,2000-08-28,NA,148,57,63,28,120
"313","Cabernet_Sauvignon","322","322Mpt12","",2001,"21/3/01","27/5/01","30/7/01","",NA,2001-03-21,2001-05-27,2001-07-30,NA,NA,NA,67,64,NA,131
"314","Cabernet_Sauvignon","322","322Mpt12","",2002,"21/3/02","27/5/02","29/7/02","30/8/02",NA,2002-03-21,2002-05-27,2002-07-29,2002-08-30,NA,162,67,63,32,130
"315","Cabernet_Sauvignon","322","322Mpt12","",2003,"29/3/03","30/5/03","30/7/03","29/8/03",NA,2003-03-29,2003-05-30,2003-07-30,2003-08-29,NA,153,62,61,30,123
"316","Cabernet_Sauvignon","322","322Mpt12","",2004,"25/3/04","4/6/2004","2/8/2004","6/9/2004",NA,2004-03-25,2004-06-04,2004-08-02,2004-09-06,NA,165,71,59,35,130
"317","Cabernet_Sauvignon","322","322Mpt12","",2005,"13/4/05","5/6/2005","5/8/2005","4/9/2005",NA,2005-04-13,2005-06-05,2005-08-05,2005-09-04,NA,144,53,61,30,114
"318","Cabernet_Sauvignon","322","322Mpt12","",2006,"3/4/2006","27/5/06","28/7/06","31/8/06",NA,2006-04-03,2006-05-27,2006-07-28,2006-08-31,NA,150,54,62,34,116
"319","Cabernet_Sauvignon","322","322Mpt12","",2007,"29/3/07","24/5/07","1/8/2007","29/8/07",NA,2007-03-29,2007-05-24,2007-08-01,2007-08-29,NA,153,56,69,28,125
"320","Cabernet_Sauvignon","322","322Mpt12","",2008,"19/3/08","27/5/08","31/7/08","28/8/08",NA,2008-03-19,2008-05-27,2008-07-31,2008-08-28,NA,162,69,65,28,134
"321","Cabernet_Sauvignon","322","322Mpt12","",2009,"27/3/09","26/5/09","28/7/09","25/8/09",NA,2009-03-27,2009-05-26,2009-07-28,2009-08-25,NA,151,60,63,28,123
"322","Cabernet_Sauvignon","322","322Mpt12","",2010,"2/4/2010","31/5/10","2/8/2010","10/9/2010",NA,2010-04-02,2010-05-31,2010-08-02,2010-09-10,NA,161,59,63,39,122
"323","Cabernet_Sauvignon","322","322Mpt12","",2011,"26/3/11","16/5/11","25/7/11","",NA,2011-03-26,2011-05-16,2011-07-25,NA,NA,NA,51,70,NA,121
"324","Cabernet_Sauvignon","322","322Mpt12","",2012,"3/4/2012","31/5/12","1/8/2012","6/9/2012",NA,2012-04-03,2012-05-31,2012-08-01,2012-09-06,NA,156,58,62,36,120
"325","Cabernet_Sauvignon","322","322Mpt13","",1958,"9/4/1958","","","12/9/1958",NA,1958-04-09,NA,NA,1958-09-12,NA,156,NA,NA,NA,NA
"326","Cabernet_Sauvignon","322","322Mpt13","",1959,"2/4/1959","","","7/9/1959",NA,1959-04-02,NA,NA,1959-09-07,NA,158,NA,NA,NA,NA
"327","Cabernet_Sauvignon","322","322Mpt13","",1960,"24/3/60","","","12/9/1960",NA,1960-03-24,NA,NA,1960-09-12,NA,172,NA,NA,NA,NA
"328","Cabernet_Sauvignon","322","322Mpt13","",1961,"","","","2/9/1961",NA,NA,NA,NA,1961-09-02,NA,NA,NA,NA,NA,NA
"329","Cabernet_Sauvignon","322","322Mpt13","",1995,"","","","7/9/1995",NA,NA,NA,NA,1995-09-07,NA,NA,NA,NA,NA,NA
"330","Cabernet_Sauvignon","322","322Mpt14","",1956,"7/4/1956","","","17/9/56",NA,1956-04-07,NA,NA,1956-09-17,NA,163,NA,NA,NA,NA
"331","Cabernet_Sauvignon","322","322Mpt14","",1957,"23/3/57","","","17/9/57",NA,1957-03-23,NA,NA,1957-09-17,NA,178,NA,NA,NA,NA
"332","Cabernet_Sauvignon","322","322Mpt14","",1958,"8/4/1958","","","28/8/58",NA,1958-04-08,NA,NA,1958-08-28,NA,142,NA,NA,NA,NA
"333","Cabernet_Sauvignon","322","322Mpt14","",1959,"","","","19/8/59",NA,NA,NA,NA,1959-08-19,NA,NA,NA,NA,NA,NA
"334","Cabernet_Sauvignon","322","322Mpt14","",1960,"","","","31/8/60",NA,NA,NA,NA,1960-08-31,NA,NA,NA,NA,NA,NA
"335","Cabernet_Sauvignon","322","322Mpt14","",1976,"","","5/8/1976","",NA,NA,NA,1976-08-05,NA,NA,NA,NA,NA,NA,NA
"336","Cabernet_Sauvignon","322","322Mpt14","",1977,"","","12/8/1977","",NA,NA,NA,1977-08-12,NA,NA,NA,NA,NA,NA,NA
"337","Cabernet_Sauvignon","322","322Mpt14","",1978,"","","12/8/1978","",NA,NA,NA,1978-08-12,NA,NA,NA,NA,NA,NA,NA
"338","Cabernet_Sauvignon","322","322Mpt14","",1995,"3/4/1995","28/5/95","11/8/1995","",NA,1995-04-03,1995-05-28,1995-08-11,NA,NA,NA,55,75,NA,130
"339","Cabernet_Sauvignon","322","322Mpt14","",1998,"30/3/98","27/5/98","4/8/1998","10/9/1998",NA,1998-03-30,1998-05-27,1998-08-04,1998-09-10,NA,164,58,69,37,127
"340","Cabernet_Sauvignon","322","322Mpt14","",1999,"23/3/99","28/5/99","2/8/1999","7/9/1999",NA,1999-03-23,1999-05-28,1999-08-02,1999-09-07,NA,168,66,66,36,132
"341","Cabernet_Sauvignon","322","322Mpt14","",2000,"31/3/00","29/5/00","31/7/00","28/8/00",NA,2000-03-31,2000-05-29,2000-07-31,2000-08-28,NA,150,59,63,28,122
"342","Cabernet_Sauvignon","322","322Mpt14","",2010,"3/4/2010","31/5/10","","10/9/2010",NA,2010-04-03,2010-05-31,NA,2010-09-10,NA,160,58,NA,NA,NA
"343","Cabernet_Sauvignon","322","322Mpt14","",2011,"21/3/11","14/5/11","26/7/11","8/9/2011",NA,2011-03-21,2011-05-14,2011-07-26,2011-09-08,NA,171,54,73,44,127
"344","Cabernet_Sauvignon","322","322Mpt14","",2012,"31/3/12","28/5/12","1/8/2012","13/9/12",NA,2012-03-31,2012-05-28,2012-08-01,2012-09-13,NA,166,58,65,43,123
"345","Cabernet_Sauvignon","322","322Mpt15","",1958,"4/4/1958","","","5/9/1958",NA,1958-04-04,NA,NA,1958-09-05,NA,154,NA,NA,NA,NA
"346","Cabernet_Sauvignon","322","322Mpt15","",1959,"3/4/1959","","","7/9/1959",NA,1959-04-03,NA,NA,1959-09-07,NA,157,NA,NA,NA,NA
"347","Cabernet_Sauvignon","322","322Mpt15","",1960,"27/3/60","","","16/8/60",NA,1960-03-27,NA,NA,1960-08-16,NA,142,NA,NA,NA,NA
"348","Cabernet_Sauvignon","322","322Mpt15","",1961,"16/3/61","","","",NA,1961-03-16,NA,NA,NA,NA,NA,NA,NA,NA,NA
"349","Cabernet_Sauvignon","322","322Mpt15","",1962,"12/4/1962","","","",NA,1962-04-12,NA,NA,NA,NA,NA,NA,NA,NA,NA
"350","Cabernet_Sauvignon","322","322Mpt16","",1959,"3/4/1959","","","24/8/59",NA,1959-04-03,NA,NA,1959-08-24,NA,143,NA,NA,NA,NA
"351","Cabernet_Sauvignon","322","322Mpt16","",1960,"6/4/1960","","","12/9/1960",NA,1960-04-06,NA,NA,1960-09-12,NA,159,NA,NA,NA,NA
"352","Cabernet_Sauvignon","322","322Mpt16","",1961,"27/3/61","","","2/9/1961",NA,1961-03-27,NA,NA,1961-09-02,NA,159,NA,NA,NA,NA
"353","Cabernet_Sauvignon","322","322Mpt17","",1965,"5/4/1965","","","31/8/65",NA,1965-04-05,NA,NA,1965-08-31,NA,148,NA,NA,NA,NA
"354","Cabernet_Sauvignon","322","322Mpt17","",1966,"29/3/66","","","6/9/1966",NA,1966-03-29,NA,NA,1966-09-06,NA,161,NA,NA,NA,NA
"355","Cabernet_Sauvignon","322","322Mpt17","",1967,"24/3/67","","","30/8/67",NA,1967-03-24,NA,NA,1967-08-30,NA,159,NA,NA,NA,NA
"356","Cabernet_Sauvignon","322","322Mpt18","",1964,"4/4/1964","","","27/8/64",NA,1964-04-04,NA,NA,1964-08-27,NA,145,NA,NA,NA,NA
"357","Cabernet_Sauvignon","322","322Mpt18","",1965,"5/4/1965","","","31/8/65",NA,1965-04-05,NA,NA,1965-08-31,NA,148,NA,NA,NA,NA
"358","Cabernet_Sauvignon","322","322Mpt18","",1966,"30/3/66","","","6/9/1966",NA,1966-03-30,NA,NA,1966-09-06,NA,160,NA,NA,NA,NA
"359","Cabernet_Sauvignon","322","322Mpt19","",1964,"3/4/1964","","","24/8/64",NA,1964-04-03,NA,NA,1964-08-24,NA,143,NA,NA,NA,NA
"360","Cabernet_Sauvignon","322","322Mpt19","",1965,"5/4/1965","","","31/8/65",NA,1965-04-05,NA,NA,1965-08-31,NA,148,NA,NA,NA,NA
"361","Cabernet_Sauvignon","322","322Mpt19","",1966,"28/3/66","","","6/9/1966",NA,1966-03-28,NA,NA,1966-09-06,NA,162,NA,NA,NA,NA
"362","Cabernet_Sauvignon","322","322Mpt20","",1958,"26/3/58","","","",NA,1958-03-26,NA,NA,NA,NA,NA,NA,NA,NA,NA
"363","Cabernet_Sauvignon","322","322Mpt20","",1959,"28/3/59","","","24/8/59",NA,1959-03-28,NA,NA,1959-08-24,NA,149,NA,NA,NA,NA
"364","Cabernet_Sauvignon","322","322Mpt20","",1960,"18/3/60","","","16/8/60",NA,1960-03-18,NA,NA,1960-08-16,NA,151,NA,NA,NA,NA
"365","Cabernet_Sauvignon","322","322Mpt20","",1961,"15/3/61","","","2/9/1961",NA,1961-03-15,NA,NA,1961-09-02,NA,171,NA,NA,NA,NA
"366","Cabernet_Sauvignon","322","322Mpt20","",1962,"7/4/1962","","","3/9/1962",NA,1962-04-07,NA,NA,1962-09-03,NA,149,NA,NA,NA,NA
"367","Cabernet_Sauvignon","322","322Mpt20","",1965,"","","","6/9/1965",NA,NA,NA,NA,1965-09-06,NA,NA,NA,NA,NA,NA
"368","Cabernet_Sauvignon","322","322Mpt20","",1976,"","","8/8/1976","",NA,NA,NA,1976-08-08,NA,NA,NA,NA,NA,NA,NA
"369","Cabernet_Sauvignon","322","322Mpt20","",1977,"","","12/8/1977","",NA,NA,NA,1977-08-12,NA,NA,NA,NA,NA,NA,NA
"370","Cabernet_Sauvignon","322","322Mpt20","",1978,"","","17/8/78","",NA,NA,NA,1978-08-17,NA,NA,NA,NA,NA,NA,NA
"371","Cabernet_Sauvignon","322","322Mpt20","",2002,"20/3/02","27/5/02","29/7/02","30/8/02",NA,2002-03-20,2002-05-27,2002-07-29,2002-08-30,NA,163,68,63,32,131
"372","Cabernet_Sauvignon","322","322Mpt20","",2003,"31/3/03","30/5/03","25/7/03","25/8/03",NA,2003-03-31,2003-05-30,2003-07-25,2003-08-25,NA,147,60,56,31,116
"373","Cabernet_Sauvignon","322","322Mpt20","",2004,"24/3/04","2/6/2004","2/8/2004","31/8/04",NA,2004-03-24,2004-06-02,2004-08-02,2004-08-31,NA,160,70,61,29,131
"374","Cabernet_Sauvignon","322","322Mpt20","",2005,"4/4/2005","30/5/05","4/8/2005","2/9/2005",NA,2005-04-04,2005-05-30,2005-08-04,2005-09-02,NA,151,56,66,29,122
"375","Cabernet_Sauvignon","322","322Mpt20","",2006,"31/3/06","26/5/06","30/7/06","6/9/2006",NA,2006-03-31,2006-05-26,2006-07-30,2006-09-06,NA,159,56,65,38,121
"376","Cabernet_Sauvignon","322","322Mpt20","",2007,"14/3/07","18/5/07","20/7/07","3/9/2007",NA,2007-03-14,2007-05-18,2007-07-20,2007-09-03,NA,173,65,63,45,128
"377","Cabernet_Sauvignon","322","322Mpt20","",2008,"24/3/08","28/5/08","7/8/2008","27/8/08",NA,2008-03-24,2008-05-28,2008-08-07,2008-08-27,NA,156,65,71,20,136
"378","Cabernet_Sauvignon","322","322Mpt20","",2009,"21/3/09","29/5/09","27/7/09","1/9/2009",NA,2009-03-21,2009-05-29,2009-07-27,2009-09-01,NA,164,69,59,36,128
"379","Cabernet_Sauvignon","322","322Mpt20","",2010,"30/3/10","28/5/10","2/8/2010","10/9/2010",NA,2010-03-30,2010-05-28,2010-08-02,2010-09-10,NA,164,59,66,39,125
"380","Cabernet_Sauvignon","322","322Mpt20","",2011,"23/3/11","13/5/11","25/7/11","28/8/11",NA,2011-03-23,2011-05-13,2011-07-25,2011-08-28,NA,158,51,73,34,124
"381","Cabernet_Sauvignon","322","322Mpt20","",2012,"31/3/12","28/5/12","1/8/2012","13/9/12",NA,2012-03-31,2012-05-28,2012-08-01,2012-09-13,NA,166,58,65,43,123
"382","Cabernet_Sauvignon","322","322Mpt21","",1973,"12/4/1973","","","",NA,1973-04-12,NA,NA,NA,NA,NA,NA,NA,NA,NA
"383","Cabernet_Sauvignon","322","322Mpt22","",1974,"29/3/74","","","4/9/1974",NA,1974-03-29,NA,NA,1974-09-04,NA,159,NA,NA,NA,NA
"384","Cabernet_Sauvignon","322","322Mpt22","",1975,"28/3/75","","","16/9/75",NA,1975-03-28,NA,NA,1975-09-16,NA,172,NA,NA,NA,NA
"385","Cabernet_Sauvignon","322","322Mpt22","",1976,"","","18/8/80","31/8/76",NA,NA,NA,1980-08-18,1976-08-31,NA,NA,NA,NA,-1448,NA
"386","Cabernet_Sauvignon","322","322Mpt22","",1980,"","","17/8/81","",NA,NA,NA,1981-08-17,NA,NA,NA,NA,NA,NA,NA
"387","Cabernet_Sauvignon","322","322Mpt22","",1981,"","","30/7/82","",NA,NA,NA,1982-07-30,NA,NA,NA,NA,NA,NA,NA
"388","Cabernet_Sauvignon","322","322Mpt22","",1982,"","","","",NA,NA,NA,NA,NA,NA,NA,NA,NA,NA,NA
"389","Cabernet_Sauvignon","322","322Mpt22","",1992,"","26/5/92","","",NA,NA,1992-05-26,NA,NA,NA,NA,NA,NA,NA,NA
"390","Cabernet_Sauvignon","322","322Mpt22","",1994,"","24/5/94","","",NA,NA,1994-05-24,NA,NA,NA,NA,NA,NA,NA,NA
"391","Cabernet_Sauvignon","322","322Mpt22","",1995,"","3/6/1995","","",NA,NA,1995-06-03,NA,NA,NA,NA,NA,NA,NA,NA
"392","Cabernet_Sauvignon","322","322Mpt23","",1973,"","","","3/9/1973",NA,NA,NA,NA,1973-09-03,NA,NA,NA,NA,NA,NA
"393","Cabernet_Sauvignon","322","322Mpt23","",1974,"1/4/1974","","","4/9/1974",NA,1974-04-01,NA,NA,1974-09-04,NA,156,NA,NA,NA,NA
"394","Cabernet_Sauvignon","322","322Mpt23","",1975,"12/4/1975","","","4/9/1975",NA,1975-04-12,NA,NA,1975-09-04,NA,145,NA,NA,NA,NA
"395","Cabernet_Sauvignon","322","322Mpt23","",1976,"7/4/1976","","","",NA,1976-04-07,NA,NA,NA,NA,NA,NA,NA,NA,NA
"396","Cabernet_Sauvignon","322","322Mpt23","",1980,"","","18/8/80","",NA,NA,NA,1980-08-18,NA,NA,NA,NA,NA,NA,NA
"397","Cabernet_Sauvignon","322","322Mpt23","",1981,"","","10/8/1981","",NA,NA,NA,1981-08-10,NA,NA,NA,NA,NA,NA,NA
"398","Cabernet_Sauvignon","322","322Mpt23","",1982,"","","26/7/82","",NA,NA,NA,1982-07-26,NA,NA,NA,NA,NA,NA,NA
"399","Cabernet_Sauvignon","322","322Mpt23","",1987,"","7/6/1987","6/8/1987","21/9/87",NA,NA,1987-06-07,1987-08-06,1987-09-21,NA,NA,NA,60,46,NA
"400","Cabernet_Sauvignon","322","322Mpt23","",1988,"6/4/1988","30/5/88","4/8/1988","12/9/1988",NA,1988-04-06,1988-05-30,1988-08-04,1988-09-12,NA,159,54,66,39,120
"401","Cabernet_Sauvignon","322","322Mpt23","",1989,"4/4/1989","30/5/89","1/8/1989","30/8/89",NA,1989-04-04,1989-05-30,1989-08-01,1989-08-30,NA,148,56,63,29,119
"402","Cabernet_Sauvignon","322","322Mpt23","",1990,"","23/5/90","30/7/90","",NA,NA,1990-05-23,1990-07-30,NA,NA,NA,NA,68,NA,NA
"403","Cabernet_Sauvignon","322","322Mpt23","",1991,"","7/6/1991","13/8/91","",NA,NA,1991-06-07,1991-08-13,NA,NA,NA,NA,67,NA,NA
"404","Cabernet_Sauvignon","322","322Mpt23","",1992,"30/3/92","23/5/92","4/8/1992","10/9/1992",NA,1992-03-30,1992-05-23,1992-08-04,1992-09-10,NA,164,54,73,37,127
"405","Cabernet_Sauvignon","322","322Mpt23","",2002,"23/3/02","25/5/02","1/8/2002","3/9/2002",NA,2002-03-23,2002-05-25,2002-08-01,2002-09-03,NA,164,63,68,33,131
"406","Cabernet_Sauvignon","322","322Mpt23","",2003,"30/3/03","30/5/03","1/8/2003","1/9/2003",NA,2003-03-30,2003-05-30,2003-08-01,2003-09-01,NA,155,61,63,31,124
"407","Cabernet_Sauvignon","322","322Mpt23","",2004,"28/3/04","7/6/2004","2/8/2004","6/9/2004",NA,2004-03-28,2004-06-07,2004-08-02,2004-09-06,NA,162,71,56,35,127
"408","Cabernet_Sauvignon","322","322Mpt23","",2005,"15/4/05","3/6/2005","5/8/2005","5/9/2005",NA,2005-04-15,2005-06-03,2005-08-05,2005-09-05,NA,143,49,63,31,112
"409","Cabernet_Sauvignon","322","322Mpt23","",2006,"6/4/2006","28/5/06","2/8/2006","30/8/06",NA,2006-04-06,2006-05-28,2006-08-02,2006-08-30,NA,146,52,66,28,118
"410","Cabernet_Sauvignon","322","322Mpt23","",2007,"31/3/07","21/5/07","24/7/07","29/8/07",NA,2007-03-31,2007-05-21,2007-07-24,2007-08-29,NA,151,51,64,36,115
"411","Cabernet_Sauvignon","322","322Mpt23","",2008,"22/3/08","27/5/08","31/7/08","28/8/08",NA,2008-03-22,2008-05-27,2008-07-31,2008-08-28,NA,159,66,65,28,131
"412","Cabernet_Sauvignon","322","322Mpt23","",2009,"26/3/09","26/5/09","27/7/09","25/8/09",NA,2009-03-26,2009-05-26,2009-07-27,2009-08-25,NA,152,61,62,29,123
"413","Cabernet_Sauvignon","322","322Mpt23","",2010,"2/4/2010","30/5/10","2/8/2010","10/9/2010",NA,2010-04-02,2010-05-30,2010-08-02,2010-09-10,NA,161,58,64,39,122
"414","Cabernet_Sauvignon","322","322Mpt23","",2011,"3/4/2011","19/5/11","28/7/11","8/9/2011",NA,2011-04-03,2011-05-19,2011-07-28,2011-09-08,NA,158,46,70,42,116
"415","Cabernet_Sauvignon","322","322Mpt23","",2012,"3/4/2012","29/5/12","3/8/2012","31/8/12",NA,2012-04-03,2012-05-29,2012-08-03,2012-08-31,NA,150,56,66,28,122
"416","Cabernet_Sauvignon","322","322Mpt24","",1973,"","","","3/9/1973",NA,NA,NA,NA,1973-09-03,NA,NA,NA,NA,NA,NA
"417","Cabernet_Sauvignon","322","322Mpt24","",1974,"1/4/1974","","","4/9/1974",NA,1974-04-01,NA,NA,1974-09-04,NA,156,NA,NA,NA,NA
"418","Cabernet_Sauvignon","322","322Mpt24","",1975,"11/4/1975","","","4/9/1975",NA,1975-04-11,NA,NA,1975-09-04,NA,146,NA,NA,NA,NA
"419","Cabernet_Sauvignon","322","322Mpt24","",1976,"5/4/1976","","","",NA,1976-04-05,NA,NA,NA,NA,NA,NA,NA,NA,NA
"420","Cabernet_Sauvignon","322","322Mpt24","",1980,"","","18/8/80","",NA,NA,NA,1980-08-18,NA,NA,NA,NA,NA,NA,NA
"421","Cabernet_Sauvignon","322","322Mpt24","",1981,"","","10/8/1981","",NA,NA,NA,1981-08-10,NA,NA,NA,NA,NA,NA,NA
"422","Cabernet_Sauvignon","322","322Mpt24","",1982,"","","26/7/82","",NA,NA,NA,1982-07-26,NA,NA,NA,NA,NA,NA,NA
"423","Cabernet_Sauvignon","322","322Mpt24","",1987,"","6/6/1987","6/8/1987","21/9/87",NA,NA,1987-06-06,1987-08-06,1987-09-21,NA,NA,NA,61,46,NA
"424","Cabernet_Sauvignon","322","322Mpt24","",1988,"7/4/1988","30/5/88","4/8/1988","12/9/1988",NA,1988-04-07,1988-05-30,1988-08-04,1988-09-12,NA,158,53,66,39,119
"425","Cabernet_Sauvignon","322","322Mpt24","",1989,"4/4/1989","27/5/89","1/8/1989","30/8/89",NA,1989-04-04,1989-05-27,1989-08-01,1989-08-30,NA,148,53,66,29,119
"426","Cabernet_Sauvignon","322","322Mpt24","",1990,"","23/5/90","30/7/90","",NA,NA,1990-05-23,1990-07-30,NA,NA,NA,NA,68,NA,NA
"427","Cabernet_Sauvignon","322","322Mpt24","",1991,"","7/6/1991","13/8/91","",NA,NA,1991-06-07,1991-08-13,NA,NA,NA,NA,67,NA,NA
"428","Cabernet_Sauvignon","322","322Mpt24","",1992,"30/3/92","23/5/92","4/8/1992","7/9/1992",NA,1992-03-30,1992-05-23,1992-08-04,1992-09-07,NA,161,54,73,34,127
"429","Cabernet_Sauvignon","322","322Mpt25","",1974,"30/3/74","","","4/9/1974",NA,1974-03-30,NA,NA,1974-09-04,NA,158,NA,NA,NA,NA
"430","Cabernet_Sauvignon","322","322Mpt25","",1975,"11/4/1975","","","4/9/1975",NA,1975-04-11,NA,NA,1975-09-04,NA,146,NA,NA,NA,NA
"431","Cabernet_Sauvignon","322","322Mpt25","",1976,"5/4/1976","","","25/8/76",NA,1976-04-05,NA,NA,1976-08-25,NA,142,NA,NA,NA,NA
"432","Cabernet_Sauvignon","322","322Mpt25","",1980,"","","18/8/80","",NA,NA,NA,1980-08-18,NA,NA,NA,NA,NA,NA,NA
"433","Cabernet_Sauvignon","322","322Mpt25","",1981,"","","10/8/1981","",NA,NA,NA,1981-08-10,NA,NA,NA,NA,NA,NA,NA
"434","Cabernet_Sauvignon","322","322Mpt25","",1982,"","","26/7/82","",NA,NA,NA,1982-07-26,NA,NA,NA,NA,NA,NA,NA
"435","Cabernet_Sauvignon","322","322Mpt25","",1987,"","4/6/1987","6/8/1987","21/9/87",NA,NA,1987-06-04,1987-08-06,1987-09-21,NA,NA,NA,63,46,NA
"436","Cabernet_Sauvignon","322","322Mpt25","",1988,"7/4/1988","30/5/88","8/8/1988","12/9/1988",NA,1988-04-07,1988-05-30,1988-08-08,1988-09-12,NA,158,53,70,35,123
"437","Cabernet_Sauvignon","322","322Mpt25","",1989,"29/3/89","24/5/89","1/8/1989","30/8/89",NA,1989-03-29,1989-05-24,1989-08-01,1989-08-30,NA,154,56,69,29,125
"438","Cabernet_Sauvignon","322","322Mpt25","",1990,"","23/5/90","30/7/90","",NA,NA,1990-05-23,1990-07-30,NA,NA,NA,NA,68,NA,NA
"439","Cabernet_Sauvignon","322","322Mpt25","",1991,"","7/6/1991","13/8/91","",NA,NA,1991-06-07,1991-08-13,NA,NA,NA,NA,67,NA,NA
"440","Cabernet_Sauvignon","322","322Mpt25","",1992,"30/3/92","23/5/92","4/8/1992","7/9/1992",NA,1992-03-30,1992-05-23,1992-08-04,1992-09-07,NA,161,54,73,34,127
"441","Cabernet_Sauvignon","322","322Mpt26","",1974,"31/3/74","","","4/9/1974",NA,1974-03-31,NA,NA,1974-09-04,NA,157,NA,NA,NA,NA
"442","Cabernet_Sauvignon","322","322Mpt26","",1975,"14/4/75","","","9/9/1975",NA,1975-04-14,NA,NA,1975-09-09,NA,148,NA,NA,NA,NA
"443","Cabernet_Sauvignon","322","322Mpt26","",1976,"7/4/1976","","","25/8/76",NA,1976-04-07,NA,NA,1976-08-25,NA,140,NA,NA,NA,NA
"444","Cabernet_Sauvignon","322","322Mpt26","",1980,"","","18/8/80","",NA,NA,NA,1980-08-18,NA,NA,NA,NA,NA,NA,NA
"445","Cabernet_Sauvignon","322","322Mpt26","",1981,"","","10/8/1981","",NA,NA,NA,1981-08-10,NA,NA,NA,NA,NA,NA,NA
"446","Cabernet_Sauvignon","322","322Mpt26","",1982,"","","26/7/82","",NA,NA,NA,1982-07-26,NA,NA,NA,NA,NA,NA,NA
"447","Cabernet_Sauvignon","322","322Mpt26","",1987,"","3/6/1987","3/8/1987","14/9/87",NA,NA,1987-06-03,1987-08-03,1987-09-14,NA,NA,NA,61,42,NA
"448","Cabernet_Sauvignon","322","322Mpt26","",1988,"7/4/1988","29/5/88","4/8/1988","12/9/1988",NA,1988-04-07,1988-05-29,1988-08-04,1988-09-12,NA,158,52,67,39,119
"449","Cabernet_Sauvignon","322","322Mpt26","",1989,"31/3/89","24/5/89","1/8/1989","29/8/89",NA,1989-03-31,1989-05-24,1989-08-01,1989-08-29,NA,151,54,69,28,123
"450","Cabernet_Sauvignon","322","322Mpt26","",1990,"","23/5/90","30/7/90","",NA,NA,1990-05-23,1990-07-30,NA,NA,NA,NA,68,NA,NA
"451","Cabernet_Sauvignon","322","322Mpt26","",1991,"","5/6/1991","13/8/91","",NA,NA,1991-06-05,1991-08-13,NA,NA,NA,NA,69,NA,NA
"452","Cabernet_Sauvignon","322","322Mpt26","",1992,"2/4/1992","23/5/92","4/8/1992","14/9/92",NA,1992-04-02,1992-05-23,1992-08-04,1992-09-14,NA,165,51,73,41,124
"453","Cabernet_Sauvignon","322","322Mpt27","",1974,"30/3/74","","","4/9/1974",NA,1974-03-30,NA,NA,1974-09-04,NA,158,NA,NA,NA,NA
"454","Cabernet_Sauvignon","322","322Mpt27","",1975,"2/4/1975","","","4/9/1975",NA,1975-04-02,NA,NA,1975-09-04,NA,155,NA,NA,NA,NA
"455","Cabernet_Sauvignon","322","322Mpt27","",1976,"7/4/1976","","","25/8/76",NA,1976-04-07,NA,NA,1976-08-25,NA,140,NA,NA,NA,NA
"456","Cabernet_Sauvignon","322","322Mpt27","",1980,"","","18/8/80","",NA,NA,NA,1980-08-18,NA,NA,NA,NA,NA,NA,NA
"457","Cabernet_Sauvignon","322","322Mpt27","",1981,"","","10/8/1981","",NA,NA,NA,1981-08-10,NA,NA,NA,NA,NA,NA,NA
"458","Cabernet_Sauvignon","322","322Mpt27","",1982,"","","26/7/82","",NA,NA,NA,1982-07-26,NA,NA,NA,NA,NA,NA,NA
"459","Cabernet_Sauvignon","322","322Mpt27","",1992,"","25/5/92","","",NA,NA,1992-05-25,NA,NA,NA,NA,NA,NA,NA,NA
"460","Cabernet_Sauvignon","322","322Mpt27","",1994,"","24/5/94","","",NA,NA,1994-05-24,NA,NA,NA,NA,NA,NA,NA,NA
"461","Cabernet_Sauvignon","322","322Mpt27","",1995,"","26/5/95","","",NA,NA,1995-05-26,NA,NA,NA,NA,NA,NA,NA,NA
"462","Cabernet_Sauvignon","322","322Mpt28","",1973,"","","","27/8/73",NA,NA,NA,NA,1973-08-27,NA,NA,NA,NA,NA,NA
"463","Cabernet_Sauvignon","322","322Mpt28","",1974,"30/3/74","","","4/9/1974",NA,1974-03-30,NA,NA,1974-09-04,NA,158,NA,NA,NA,NA
"464","Cabernet_Sauvignon","322","322Mpt28","",1975,"28/3/75","","","4/9/1975",NA,1975-03-28,NA,NA,1975-09-04,NA,160,NA,NA,NA,NA
"465","Cabernet_Sauvignon","322","322Mpt28","",1976,"7/4/1976","","","",NA,1976-04-07,NA,NA,NA,NA,NA,NA,NA,NA,NA
"466","Cabernet_Sauvignon","322","322Mpt28","",1980,"","","18/8/80","",NA,NA,NA,1980-08-18,NA,NA,NA,NA,NA,NA,NA
"467","Cabernet_Sauvignon","322","322Mpt28","",1981,"","","17/8/81","",NA,NA,NA,1981-08-17,NA,NA,NA,NA,NA,NA,NA
"468","Cabernet_Sauvignon","322","322Mpt28","",1982,"","","30/7/82","",NA,NA,NA,1982-07-30,NA,NA,NA,NA,NA,NA,NA
"469","Cabernet_Sauvignon","322","322Mpt28","",1992,"","","","",NA,NA,NA,NA,NA,NA,NA,NA,NA,NA,NA
"470","Cabernet_Sauvignon","322","322Mpt28","",1994,"","","","",NA,NA,NA,NA,NA,NA,NA,NA,NA,NA,NA
"471","Cabernet_Sauvignon","322","322Mpt29","",1972,"24/3/72","","","",NA,1972-03-24,NA,NA,NA,NA,NA,NA,NA,NA,NA
"472","Cabernet_Sauvignon","322","322Mpt29","",1973,"9/4/1973","","","",NA,1973-04-09,NA,NA,NA,NA,NA,NA,NA,NA,NA
"473","Cabernet_Sauvignon","322","322Mpt29","",1974,"30/3/74","","","4/9/1974",NA,1974-03-30,NA,NA,1974-09-04,NA,158,NA,NA,NA,NA
"474","Cabernet_Sauvignon","322","322Mpt29","",1975,"","","","10/9/1975",NA,NA,NA,NA,1975-09-10,NA,NA,NA,NA,NA,NA
"475","Cabernet_Sauvignon","322","322Mpt29","",1976,"","","6/8/1976","",NA,NA,NA,1976-08-06,NA,NA,NA,NA,NA,NA,NA
"476","Cabernet_Sauvignon","322","322Mpt29","",1977,"","","16/8/77","",NA,NA,NA,1977-08-16,NA,NA,NA,NA,NA,NA,NA
"477","Cabernet_Sauvignon","322","322Mpt29","",1978,"","","17/8/78","",NA,NA,NA,1978-08-17,NA,NA,NA,NA,NA,NA,NA
"478","Cabernet_Sauvignon","322","322Mpt29","",1979,"","","","5/9/1979",NA,NA,NA,NA,1979-09-05,NA,NA,NA,NA,NA,NA
"479","Cabernet_Sauvignon","322","322Mpt30","",1992,"2/4/1992","21/5/92","26/7/92","14/9/92",NA,1992-04-02,1992-05-21,1992-07-26,1992-09-14,NA,165,49,66,50,115
"480","Cabernet_Sauvignon","322","322Mpt30","",1993,"5/4/1993","26/5/93","1/8/1993","6/9/1993",NA,1993-04-05,1993-05-26,1993-08-01,1993-09-06,NA,154,51,67,36,118
"481","Cabernet_Sauvignon","322","322Mpt30","",1994,"26/3/94","26/5/94","1/8/1994","12/9/1994",NA,1994-03-26,1994-05-26,1994-08-01,1994-09-12,NA,170,61,67,42,128
"482","Morrestal ","9","11S48","1",1956,"3/4/1956","","","3/9/1956",NA,1956-04-03,NA,NA,1956-09-03,NA,153,NA,NA,NA,NA
"483","Morrestal ","9","11S48","1",1957,"22/3/1957","","","16/9/57",NA,1957-03-22,NA,NA,1957-09-16,NA,178,NA,NA,NA,NA
"484","Morrestal ","9","11S48","1",1958,"2/4/1958","","","4/9/1958",NA,1958-04-02,NA,NA,1958-09-04,NA,155,NA,NA,NA,NA
"485","Morrestal ","9","11S48","1",1959,"27/3/59","","","25/8/59",NA,1959-03-27,NA,NA,1959-08-25,NA,151,NA,NA,NA,NA
"486","Morrestal ","9","10A68","2",1956,"2/4/1956","","","10/9/1956",NA,1956-04-02,NA,NA,1956-09-10,NA,161,NA,NA,NA,NA
"487","Morrestal ","9","10A68","2",1957,"19/3/57","","","9/9/1957",NA,1957-03-19,NA,NA,1957-09-09,NA,174,NA,NA,NA,NA
"488","Morrestal ","9","10A68","2",1958,"2/4/1958","","","29/8/58",NA,1958-04-02,NA,NA,1958-08-29,NA,149,NA,NA,NA,NA
"489","Morrestal ","9","13A141","3",1956,"20/3/56","","","11/9/1956",NA,1956-03-20,NA,NA,1956-09-11,NA,175,NA,NA,NA,NA
"490","Morrestal ","9","13A141","3",1957,"29/3/57","","","17/9/57",NA,1957-03-29,NA,NA,1957-09-17,NA,172,NA,NA,NA,NA
"491","Morrestal ","9","13A141","3",1958,"30/3/58","","","5/9/1958",NA,1958-03-30,NA,NA,1958-09-05,NA,159,NA,NA,NA,NA
"492","Morrestal ","9","13A141","3",1959,"21/3/59","","","31/8/59",NA,1959-03-21,NA,NA,1959-08-31,NA,163,NA,NA,NA,NA
"493","Morrestal ","9","13A141","3",1960,"","","","31/8/60",NA,NA,NA,NA,1960-08-31,NA,NA,NA,NA,NA,NA
"494","Morrestal ","9","13A141","3",1961,"","","","1/9/1961",NA,NA,NA,NA,1961-09-01,NA,NA,NA,NA,NA,NA
"495","Morrestal ","9","13A141","3",1962,"","","","3/9/1962",NA,NA,NA,NA,1962-09-03,NA,NA,NA,NA,NA,NA
"496","Morrestal ","9","13A141","3",1963,"","","","16/9/63",NA,NA,NA,NA,1963-09-16,NA,NA,NA,NA,NA,NA
"497","Morrestal ","9","13A141","3",1993,"","","","",NA,NA,NA,NA,NA,NA,NA,NA,NA,NA,NA
"498","Morrestal ","9","13A141","3",1994,"","30/5/94","","",NA,NA,1994-05-30,NA,NA,NA,NA,NA,NA,NA,NA
"499","Morrestal ","9","13A141","3",1995,"","31/5/95","","",NA,NA,1995-05-31,NA,NA,NA,NA,NA,NA,NA,NA
"500","Morrestal ","9","13A141","3",1996,"","6/6/1996","","",NA,NA,1996-06-06,NA,NA,NA,NA,NA,NA,NA,NA
"501","Morrestal ","9","511A8","4",1956,"28/3/56","","","3/9/1956",NA,1956-03-28,NA,NA,1956-09-03,NA,159,NA,NA,NA,NA
"502","Morrestal ","9","511A8","4",1957,"27/3/57","","","16/9/57",NA,1957-03-27,NA,NA,1957-09-16,NA,173,NA,NA,NA,NA
"503","Morrestal ","9","511A8","4",1958,"3/4/1958","","","12/9/1958",NA,1958-04-03,NA,NA,1958-09-12,NA,162,NA,NA,NA,NA
"504","Morrestal ","9","511A8","4",1959,"1/4/1959","","","25/8/59",NA,1959-04-01,NA,NA,1959-08-25,NA,146,NA,NA,NA,NA
"505","Morrestal ","9","511A8","4",1960,"29/3/60","","","",NA,1960-03-29,NA,NA,NA,NA,NA,NA,NA,NA,NA
"506","Morrestal ","9","511A8","4",1976,"","","5/8/1976","",NA,NA,NA,1976-08-05,NA,NA,NA,NA,NA,NA,NA
"507","Morrestal ","9","511A8","4",1977,"","","22/8/77","",NA,NA,NA,1977-08-22,NA,NA,NA,NA,NA,NA,NA
"508","Morrestal ","9","511A8","4",1978,"","","16/8/78","",NA,NA,NA,1978-08-16,NA,NA,NA,NA,NA,NA,NA
"509","Morrestal ","9","511A9","",1976,"","","5/8/1976","",NA,NA,NA,1976-08-05,NA,NA,NA,NA,NA,NA,NA
"510","Morrestal ","9","511A9","",1977,"","","16/8/77","",NA,NA,NA,1977-08-16,NA,NA,NA,NA,NA,NA,NA
"511","Morrestal ","9","511A9","",1978,"","","16/8/78","",NA,NA,NA,1978-08-16,NA,NA,NA,NA,NA,NA,NA
"512","Morrestal ","9","11S79","5",1956,"9/4/1956","","","17/9/56",NA,1956-04-09,NA,NA,1956-09-17,NA,161,NA,NA,NA,NA
"513","Morrestal ","9","11S79","5",1957,"29/3/57","","","16/9/57",NA,1957-03-29,NA,NA,1957-09-16,NA,171,NA,NA,NA,NA
"514","Morrestal ","9","11S79","5",1958,"8/4/1958","","","4/9/1958",NA,1958-04-08,NA,NA,1958-09-04,NA,149,NA,NA,NA,NA
"515","Morrestal ","9","9S142","6",1956,"","","","10/9/1956",NA,NA,NA,NA,1956-09-10,NA,NA,NA,NA,NA,NA
"516","Morrestal ","9","9S142","6",1957,"16/3/57","","","2/9/1957",NA,1957-03-16,NA,NA,1957-09-02,NA,170,NA,NA,NA,NA
"517","Morrestal ","9","9S142","6",1958,"31/3/58","","","28/8/58",NA,1958-03-31,NA,NA,1958-08-28,NA,150,NA,NA,NA,NA
"518","Morrestal ","9","9S142","6",1959,"27/3/59","","","",NA,1959-03-27,NA,NA,NA,NA,NA,NA,NA,NA,NA
"519","Morrestal ","9","9S142","6",1995,"","3/6/1995","","",NA,NA,1995-06-03,NA,NA,NA,NA,NA,NA,NA,NA
"520","Morrestal ","9","9S142","6",1996,"","6/6/1996","","",NA,NA,1996-06-06,NA,NA,NA,NA,NA,NA,NA,NA
"521","Morrestal ","9","16A147","7",1956,"","","","24/9/56",NA,NA,NA,NA,1956-09-24,NA,NA,NA,NA,NA,NA
"522","Morrestal ","9","16A147","7",1957,"18/3/57","","","2/9/1957",NA,1957-03-18,NA,NA,1957-09-02,NA,168,NA,NA,NA,NA
"523","Morrestal ","9","16A147","7",1958,"31/3/58","","","12/9/1958",NA,1958-03-31,NA,NA,1958-09-12,NA,165,NA,NA,NA,NA
"524","Morrestal ","9","16A147","7",1959,"31/3/60","","","",NA,1960-03-31,NA,NA,NA,NA,NA,NA,NA,NA,NA
"525","Morrestal ","9","16A147","7",1960,"24/3/61","","","",NA,1961-03-24,NA,NA,NA,NA,NA,NA,NA,NA,NA
"526","Morrestal ","9","16A147","7",1995,"","27/5/95","","",NA,NA,1995-05-27,NA,NA,NA,NA,NA,NA,NA,NA
"527","Morrestal ","9","16A147","7",1996,"","6/6/1996","","",NA,NA,1996-06-06,NA,NA,NA,NA,NA,NA,NA,NA
"528","Morrestal ","9","511S1","",1976,"","","9/8/1976","",NA,NA,NA,1976-08-09,NA,NA,NA,NA,NA,NA,NA
"529","Morrestal ","9","511S1","",1977,"","","22/8/77","",NA,NA,NA,1977-08-22,NA,NA,NA,NA,NA,NA,NA
"530","Morrestal ","9","511S1","",1978,"","","21/8/78","",NA,NA,NA,1978-08-21,NA,NA,NA,NA,NA,NA,NA
"531","Morrestal ","9","12S111","8",1956,"","","","24/9/56",NA,NA,NA,NA,1956-09-24,NA,NA,NA,NA,NA,NA
"532","Morrestal ","9","12S111","8",1957,"","","","",NA,NA,NA,NA,NA,NA,NA,NA,NA,NA,NA
"533","Morrestal ","9","12S111","8",1958,"26/3/58","","","",NA,1958-03-26,NA,NA,NA,NA,NA,NA,NA,NA,NA
"534","Morrestal ","9","12S111","8",1959,"25/3/59","","","25/8/59",NA,1959-03-25,NA,NA,1959-08-25,NA,153,NA,NA,NA,NA
"535","Morrestal ","9","12S111","8",1960,"19/3/60","","","5/9/1960",NA,1960-03-19,NA,NA,1960-09-05,NA,170,NA,NA,NA,NA
"536","Morrestal ","9","12S111","8",1961,"16/3/61","","","21/8/61",NA,1961-03-16,NA,NA,1961-08-21,NA,158,NA,NA,NA,NA
"537","Morrestal ","9","12S111","8",1962,"16/4/62","","","3/9/1962",NA,1962-04-16,NA,NA,1962-09-03,NA,140,NA,NA,NA,NA
"538","Morrestal ","9","11A90","9",NA,"","","","",NA,NA,NA,NA,NA,NA,NA,NA,NA,NA,NA
"539","Morrestal ","9","11S47","10",1956,"5/4/1956","","","",NA,1956-04-05,NA,NA,NA,NA,NA,NA,NA,NA,NA
"540","Morrestal ","9","11S47","10",1957,"20/3/57","","","",NA,1957-03-20,NA,NA,NA,NA,NA,NA,NA,NA,NA
"541","Morrestal ","9","11S47","10",1958,"6/4/1958","","","4/9/1958",NA,1958-04-06,NA,NA,1958-09-04,NA,151,NA,NA,NA,NA
"542","Morrestal ","9","710A6","11",1956,"30/3/56","","","17/9/56",NA,1956-03-30,NA,NA,1956-09-17,NA,171,NA,NA,NA,NA
"543","Morrestal ","9","710A6","11",1957,"20/3/57","","","16/9/57",NA,1957-03-20,NA,NA,1957-09-16,NA,180,NA,NA,NA,NA
"544","Morrestal ","9","710A6","11",1958,"4/4/1958","","","12/9/1958",NA,1958-04-04,NA,NA,1958-09-12,NA,161,NA,NA,NA,NA
"545","Morrestal ","9","710A6","11",1959,"28/3/1959","","","",NA,1959-03-28,NA,NA,NA,NA,NA,NA,NA,NA,NA
"546","Morrestal ","9","710A6","11",1976,"","","9/8/1976","",NA,NA,NA,1976-08-09,NA,NA,NA,NA,NA,NA,NA
"547","Morrestal ","9","710A6","11",1977,"","","22/8/77","",NA,NA,NA,1977-08-22,NA,NA,NA,NA,NA,NA,NA
"548","Morrestal ","9","710A6","11",1978,"","","28/8/78","",NA,NA,NA,1978-08-28,NA,NA,NA,NA,NA,NA,NA
"549","Morrestal ","9","720S4","",1976,"","","8/8/1976","",NA,NA,NA,1976-08-08,NA,NA,NA,NA,NA,NA,NA
"550","Morrestal ","9","720S4","",1977,"","","16/8/77","",NA,NA,NA,1977-08-16,NA,NA,NA,NA,NA,NA,NA
"551","Morrestal ","9","720S4","",1978,"","","17/8/78","",NA,NA,NA,1978-08-17,NA,NA,NA,NA,NA,NA,NA
"552","Morrestal ","9","720S5","",1976,"","","8/8/1976","",NA,NA,NA,1976-08-08,NA,NA,NA,NA,NA,NA,NA
"553","Morrestal ","9","720S5","",1977,"","","19/8/77","",NA,NA,NA,1977-08-19,NA,NA,NA,NA,NA,NA,NA
"554","Morrestal ","9","720S5","",1978,"","","17/8/78","",NA,NA,NA,1978-08-17,NA,NA,NA,NA,NA,NA,NA
"555","Morrestal ","9","131A2","12",1973,"16/4/73","","","23/9/1973",NA,1973-04-16,NA,NA,1973-09-23,NA,160,NA,NA,NA,NA
"556","Morrestal ","9","131A2","12",1974,"1/4/1974","","","22/9/1974",NA,1974-04-01,NA,NA,1974-09-22,NA,174,NA,NA,NA,NA
"557","Morrestal ","9","131A2","12",1975,"7/4/1975","","","4/9/1975",NA,1975-04-07,NA,NA,1975-09-04,NA,150,NA,NA,NA,NA
"558","Morrestal ","9","131A2","12",1980,"","","25/8/80","",NA,NA,NA,1980-08-25,NA,NA,NA,NA,NA,NA,NA
"559","Morrestal ","9","131A2","12",1981,"","","24/8/81","",NA,NA,NA,1981-08-24,NA,NA,NA,NA,NA,NA,NA
"560","Morrestal ","9","131A2","12",1982,"","","6/8/1982","",NA,NA,NA,1982-08-06,NA,NA,NA,NA,NA,NA,NA
"561","Morrestal ","9","131A2","12",1992,"","29/5/92","","",NA,NA,1992-05-29,NA,NA,NA,NA,NA,NA,NA,NA
"562","Morrestal ","9","131A2","12",1994,"","30/5/94","","",NA,NA,1994-05-30,NA,NA,NA,NA,NA,NA,NA,NA
"563","Morrestal ","9","131A2","12",1995,"","30/5/95","","",NA,NA,1995-05-30,NA,NA,NA,NA,NA,NA,NA,NA
"564","Morrestal ","9","122S3","13",1972,"12/4/1972","","","24/9/1972",NA,1972-04-12,NA,NA,1972-09-24,NA,165,NA,NA,NA,NA
"565","Morrestal ","9","122S3","13",1973,"4/4/1973","","","10/9/1973",NA,1973-04-04,NA,NA,1973-09-10,NA,159,NA,NA,NA,NA
"566","Morrestal ","9","122S3","13",1974,"4/4/1974","","","16/9/1974",NA,1974-04-04,NA,NA,1974-09-16,NA,165,NA,NA,NA,NA
"567","Morrestal ","9","122S3","13",1992,"","28/5/92","","",NA,NA,1992-05-28,NA,NA,NA,NA,NA,NA,NA,NA
"568","Morrestal ","9","122S3","13",1994,"","30/5/94","","",NA,NA,1994-05-30,NA,NA,NA,NA,NA,NA,NA,NA
"569","Morrestal ","9","122S3","13",1995,"","30/5/95","","",NA,NA,1995-05-30,NA,NA,NA,NA,NA,NA,NA,NA
"570","Morrestal ","9","1320S4","14",1971,"31/3/71","","","30/8/71",NA,1971-03-31,NA,NA,1971-08-30,NA,152,NA,NA,NA,NA
"571","Morrestal ","9","1320S4","14",1972,"9/4/1972","","","5/9/1972",NA,1972-04-09,NA,NA,1972-09-05,NA,149,NA,NA,NA,NA
"572","Morrestal ","9","1320S4","14",1973,"24/3/73","","","3/9/1973",NA,1973-03-24,NA,NA,1973-09-03,NA,163,NA,NA,NA,NA
"573","Morrestal ","9","1220S5","15",1971,"31/3/71","","","14/9/1971",NA,1971-03-31,NA,NA,1971-09-14,NA,167,NA,NA,NA,NA
"574","Morrestal ","9","1220S5","15",1973,"8/4/1972","","","3/9/1973",NA,1972-04-08,NA,NA,1973-09-03,NA,513,NA,NA,NA,NA
"575","Morrestal ","9","1220S5","15",1974,"24/3/73","","","4/9/1974",NA,1973-03-24,NA,NA,1974-09-04,NA,529,NA,NA,NA,NA
"576","Morrestal ","9","1220S5","15",1995,"","26/5/95","","",NA,NA,1995-05-26,NA,NA,NA,NA,NA,NA,NA,NA
"577","Morrestal ","9","1220S5","15",1996,"","6/6/1996","","",NA,NA,1996-06-06,NA,NA,NA,NA,NA,NA,NA,NA
"578","Morrestal ","9","437S4","16",1972,"29/3/72","","","11/9/1972",NA,1972-03-29,NA,NA,1972-09-11,NA,166,NA,NA,NA,NA
"579","Morrestal ","9","437S4","16",1973,"","","","17/9/1973",NA,NA,NA,NA,1973-09-17,NA,NA,NA,NA,NA,NA
"580","Morrestal ","9","437S4","16",1974,"5/4/1974","","","10/9/1974",NA,1974-04-05,NA,NA,1974-09-10,NA,158,NA,NA,NA,NA
"581","Morrestal ","9","437S4","16",1979,"","","16/8/79","",NA,NA,NA,1979-08-16,NA,NA,NA,NA,NA,NA,NA
"582","Morrestal ","9","437S4","16",1981,"","","17/8/81","",NA,NA,NA,1981-08-17,NA,NA,NA,NA,NA,NA,NA
"583","Morrestal ","9","437S4","16",1982,"","","2/8/1982","",NA,NA,NA,1982-08-02,NA,NA,NA,NA,NA,NA,NA
"584","Morrestal ","9","437S4","16",1995,"","3/6/1995","","",NA,NA,1995-06-03,NA,NA,NA,NA,NA,NA,NA,NA
"585","Morrestal ","9","437S4","16",1996,"","6/6/1996","","",NA,NA,1996-06-06,NA,NA,NA,NA,NA,NA,NA,NA
"586","Morrestal ","9","511S14","17",1973,"15/4/73","","","3/9/1973",NA,1973-04-15,NA,NA,1973-09-03,NA,141,NA,NA,NA,NA
"587","Morrestal ","9","511S14","17",1974,"31/3/74","","","16/9/74",NA,1974-03-31,NA,NA,1974-09-16,NA,169,NA,NA,NA,NA
"588","Morrestal ","9","511S14","17",1975,"4/4/1975","","","3/9/1975",NA,1975-04-04,NA,NA,1975-09-03,NA,152,NA,NA,NA,NA
"589","Morrestal ","9","511S14","17",1981,"","","17/8/81","",NA,NA,NA,1981-08-17,NA,NA,NA,NA,NA,NA,NA
"590","Morrestal ","9","511S14","17",1982,"","","9/8/1982","",NA,NA,NA,1982-08-09,NA,NA,NA,NA,NA,NA,NA
"591","Morrestal ","9","511S14","17",1983,"","","12/8/1983","",NA,NA,NA,1983-08-12,NA,NA,NA,NA,NA,NA,NA
"592","Morrestal ","9","511S14","17",1995,"","3/6/1995","","",NA,NA,1995-06-03,NA,NA,NA,NA,NA,NA,NA,NA
"593","Morrestal ","9","511S14","17",1996,"","6/6/1996","","",NA,NA,1996-06-06,NA,NA,NA,NA,NA,NA,NA,NA
"594","Morrestal ","9","521S8","18",1978,"28/3/78","","","11/9/1978",NA,1978-03-28,NA,NA,1978-09-11,NA,167,NA,NA,NA,NA
"595","Morrestal ","9","521S8","18",1979,"26/3/79","","","11/9/1979",NA,1979-03-26,NA,NA,1979-09-11,NA,169,NA,NA,NA,NA
"596","Morrestal ","9","521S8","18",1980,"9/4/1980","","","22/9/80",NA,1980-04-09,NA,NA,1980-09-22,NA,166,NA,NA,NA,NA
"597","Morrestal ","9","521S8","18",1981,"","","17/8/81","",NA,NA,NA,1981-08-17,NA,NA,NA,NA,NA,NA,NA
"598","Morrestal ","9","521S8","18",1982,"","","9/8/1982","",NA,NA,NA,1982-08-09,NA,NA,NA,NA,NA,NA,NA
"599","Morrestal ","9","521S8","18",1983,"","","17/8/83","",NA,NA,NA,1983-08-17,NA,NA,NA,NA,NA,NA,NA
"600","Morrestal ","9","521S8","18",1994,"","27/5/94","","",NA,NA,1994-05-27,NA,NA,NA,NA,NA,NA,NA,NA
"601","Morrestal ","9","521S8","18",1995,"","27/5/95","","",NA,NA,1995-05-27,NA,NA,NA,NA,NA,NA,NA,NA
"602","Morrestal ","9","12253?","",1980,"","","29/8/80","",NA,NA,NA,1980-08-29,NA,NA,NA,NA,NA,NA,NA
"603","Morrestal ","9","12253?","",1981,"","","9/8/1981","",NA,NA,NA,1981-08-09,NA,NA,NA,NA,NA,NA,NA
"604","Morrestal ","9","12253?","",1982,"","","30/7/82","",NA,NA,NA,1982-07-30,NA,NA,NA,NA,NA,NA,NA
"605","Morrestal ","9","414S8","19",1978,"15/3/78","","","19/9/78",NA,1978-03-15,NA,NA,1978-09-19,NA,188,NA,NA,NA,NA
"606","Morrestal ","9","414S8","19",1979,"28/3/79","","","5/9/1979",NA,1979-03-28,NA,NA,1979-09-05,NA,161,NA,NA,NA,NA
"607","Morrestal ","9","414S8","19",1980,"26/3/80","","1/9/1980","22/9/80",NA,1980-03-26,NA,1980-09-01,1980-09-22,NA,180,NA,NA,21,159
"608","Morrestal ","9","414S8","19",1982,"","","9/8/1982","",NA,NA,NA,1982-08-09,NA,NA,NA,NA,NA,NA,NA
"609","Morrestal ","9","414S8","19",1983,"","","12/8/1983","",NA,NA,NA,1983-08-12,NA,NA,NA,NA,NA,NA,NA
"610","Morrestal ","9","437A7","20",1974,"5/4/1974","","","28/8/1974",NA,1974-04-05,NA,NA,1974-08-28,NA,145,NA,NA,NA,NA
"611","Morrestal ","9","437A7","20",1976,"16/4/76","","","7/9/1976",NA,1976-04-16,NA,NA,1976-09-07,NA,144,NA,NA,NA,NA
"612","Morrestal ","9","437A7","20",1977,"23/4/77","","","12/9/1977",NA,1977-04-23,NA,NA,1977-09-12,NA,142,NA,NA,NA,NA
"613","Morrestal ","9","437A7","20",1979,"","","20/8/79","",NA,NA,NA,1979-08-20,NA,NA,NA,NA,NA,NA,NA
"614","Morrestal ","9","437A7","20",1980,"","","1/9/1980","",NA,NA,NA,1980-09-01,NA,NA,NA,NA,NA,NA,NA
"615","Morrestal ","9","437A7","20",1981,"","","26/8/81","",NA,NA,NA,1981-08-26,NA,NA,NA,NA,NA,NA,NA
"616","Morrestal ","9","718S3","21",1984,"14/4/84","","","24/9/84",NA,1984-04-14,NA,NA,1984-09-24,NA,163,NA,NA,NA,NA
"617","Morrestal ","9","718S3","21",1985,"5/4/1985","","","16/9/85",NA,1985-04-05,NA,NA,1985-09-16,NA,164,NA,NA,NA,NA
"618","Morrestal ","9","718S3","21",1986,"2/4/1986","","","8/9/1986",NA,1986-04-02,NA,NA,1986-09-08,NA,159,NA,NA,NA,NA
"619","Morrestal ","9","718S3","21",1987,"7/4/1987","11/6/1987","10/8/1987","14/9/87",NA,1987-04-07,1987-06-11,1987-08-10,1987-09-14,NA,160,65,60,35,125
"620","Morrestal ","9","718S3","21",1988,"","6/6/1988","12/8/1988","19/9/88",NA,NA,1988-06-06,1988-08-12,1988-09-19,NA,NA,NA,67,38,NA
"621","Morrestal ","9","718S3","21",1990,"","23/5/90","6/8/1990","",NA,NA,1990-05-23,1990-08-06,NA,NA,NA,NA,75,NA,NA
"622","Morrestal ","9","10R7s581585","22",1991,"2/4/1991","11/6/1991","23/8/91","16/9/94",NA,1991-04-02,1991-06-11,1991-08-23,1994-09-16,NA,1263,70,73,1120,143
"623","Morrestal ","9","10R7s581585","22",1992,"9/4/1992","31/5/92","17/8/92","21/9/92",NA,1992-04-09,1992-05-31,1992-08-17,1992-09-21,NA,165,52,78,35,130
"624","Morrestal ","9","10R7s581585","22",1994,"8/4/1994","4/6/1992","8/8/1994","12/9/1994",NA,1994-04-08,1992-06-04,1994-08-08,1994-09-12,NA,157,-673,795,35,122
"625","Listan","28","clsP14A13","1",1956,"","","","",NA,NA,NA,NA,NA,NA,NA,NA,NA,NA,NA
"626","Listan","28","clsP14A13","1",1957,"","","","",NA,NA,NA,NA,NA,NA,NA,NA,NA,NA,NA
"627","Listan","28","clsP14A13","1",1958,"5/9/1958","","","5/9/1958",NA,1958-09-05,NA,NA,1958-09-05,NA,0,NA,NA,NA,NA
"628","Listan","28","clsP14A13","1",1959,"12/8/1959","","","17/8/89",NA,1959-08-12,NA,NA,1989-08-17,NA,10963,NA,NA,NA,NA
"629","Listan","28","clsP14A13","1",1960,"8/8/1960","","","8/8/1960",NA,1960-08-08,NA,NA,1960-08-08,NA,0,NA,NA,NA,NA
"630","Listan","28","clsP14A13","1",1961,"14/8/61","","","14/8/61",NA,1961-08-14,NA,NA,1961-08-14,NA,0,NA,NA,NA,NA
"631","Listan","28","S2P14A6","2",1956,"10/9/1956","","","10/9/1956",NA,1956-09-10,NA,NA,1956-09-10,NA,0,NA,NA,NA,NA
"632","Listan","28","S2P14A6","2",1957,"26/8/57","","","26/8/57",NA,1957-08-26,NA,NA,1957-08-26,NA,0,NA,NA,NA,NA
"633","Listan","28","S2P14A6","2",1958,"21/8/58","","","21/8/58",NA,1958-08-21,NA,NA,1958-08-21,NA,0,NA,NA,NA,NA
"634","Listan","28","S2P14A6","2",1959,"","","","",NA,NA,NA,NA,NA,NA,NA,NA,NA,NA,NA
"635","Listan","28","S2P14A6","2",1960,"","","","",NA,NA,NA,NA,NA,NA,NA,NA,NA,NA,NA
"636","Listan","28","S2P14A6","2",1961,"","","","",NA,NA,NA,NA,NA,NA,NA,NA,NA,NA,NA
"637","Listan","28","S2P14A6","2",1994,"","28/5/94","","",NA,NA,1994-05-28,NA,NA,NA,NA,NA,NA,NA,NA
"638","Listan","28","S2P14A6","2",1995,"","30/5/95","","",NA,NA,1995-05-30,NA,NA,NA,NA,NA,NA,NA,NA
"639","Listan","28","S2P14A6","2",1995,"","2/6/1996","","",NA,NA,1996-06-02,NA,NA,NA,NA,NA,NA,NA,NA
"640","Listan","28","514A6","",1976,"","","29/7/76","",NA,NA,NA,1976-07-29,NA,NA,NA,NA,NA,NA,NA
"641","Listan","28","514A6","",1977,"","","8/8/1977","",NA,NA,NA,1977-08-08,NA,NA,NA,NA,NA,NA,NA
"642","Listan","28","514A6","",1978,"","","8/8/1978","",NA,NA,NA,1978-08-08,NA,NA,NA,NA,NA,NA,NA
"643","Listan","28","7S143","3",1956,"3/9/1956","","","3/9/1956",NA,1956-09-03,NA,NA,1956-09-03,NA,0,NA,NA,NA,NA
"644","Listan","28","7S143","3",1957,"20/8/57","","","20/8/57",NA,1957-08-20,NA,NA,1957-08-20,NA,0,NA,NA,NA,NA
"645","Listan","28","7S143","3",1958,"21/8/58","","","21/8/58",NA,1958-08-21,NA,NA,1958-08-21,NA,0,NA,NA,NA,NA
"646","Listan","28","7S143","3",1959,"","","","",NA,NA,NA,NA,NA,NA,NA,NA,NA,NA,NA
"647","Listan","28","7S143","3",1960,"","","","",NA,NA,NA,NA,NA,NA,NA,NA,NA,NA,NA
"648","Listan","28","7S143","3",1961,"","","","",NA,NA,NA,NA,NA,NA,NA,NA,NA,NA,NA
"649","Listan","28","7S144","4",1956,"","","","",NA,NA,NA,NA,NA,NA,NA,NA,NA,NA,NA
"650","Listan","28","7S144","4",1957,"26/8/57","","","26/8/57",NA,1957-08-26,NA,NA,1957-08-26,NA,0,NA,NA,NA,NA
"651","Listan","28","7S144","4",1958,"21/8/58","","","21/8/58",NA,1958-08-21,NA,NA,1958-08-21,NA,0,NA,NA,NA,NA
"652","Listan","28","7S144","4",1959,"21/8/59","","","18/8/59",NA,1959-08-21,NA,NA,1959-08-18,NA,-3,NA,NA,NA,NA
"653","Listan","28","7S144","4",1960,"","","","",NA,NA,NA,NA,NA,NA,NA,NA,NA,NA,NA
"654","Listan","28","7S144","4",1961,"","","","",NA,NA,NA,NA,NA,NA,NA,NA,NA,NA,NA
"655","Listan","28","7S145","5",1956,"10/9/1956","","","10/9/1956",NA,1956-09-10,NA,NA,1956-09-10,NA,0,NA,NA,NA,NA
"656","Listan","28","7S145","5",1957,"26/8/57","","","26/8/57",NA,1957-08-26,NA,NA,1957-08-26,NA,0,NA,NA,NA,NA
"657","Listan","28","7S145","5",1958,"21/8/58","","","21/8/58",NA,1958-08-21,NA,NA,1958-08-21,NA,0,NA,NA,NA,NA
"658","Listan","28","7S145","5",1959,"","","","",NA,NA,NA,NA,NA,NA,NA,NA,NA,NA,NA
"659","Listan","28","7S145","5",1960,"","","","",NA,NA,NA,NA,NA,NA,NA,NA,NA,NA,NA
"660","Listan","28","7S145","5",1961,"","","","",NA,NA,NA,NA,NA,NA,NA,NA,NA,NA,NA
"661","Listan","28","514A7","6",1956,"11/9/1956","","","11/9/1956",NA,1956-09-11,NA,NA,1956-09-11,NA,0,NA,NA,NA,NA
"662","Listan","28","514A7","6",1957,"27/8/57","","","27/8/57",NA,1957-08-27,NA,NA,1957-08-27,NA,0,NA,NA,NA,NA
"663","Listan","28","514A7","6",1958,"28/8/58","","","28/8/58",NA,1958-08-28,NA,NA,1958-08-28,NA,0,NA,NA,NA,NA
"664","Listan","28","514A7","6",1959,"","","","",NA,NA,NA,NA,NA,NA,NA,NA,NA,NA,NA
"665","Listan","28","514A7","6",1960,"","","","",NA,NA,NA,NA,NA,NA,NA,NA,NA,NA,NA
"666","Listan","28","514A7","6",1961,"","","","",NA,NA,NA,NA,NA,NA,NA,NA,NA,NA,NA
"667","Listan","28","514A7","6",1976,"","","29/7/76","",NA,NA,NA,1976-07-29,NA,NA,NA,NA,NA,NA,NA
"668","Listan","28","514A7","6",1977,"","","8/8/1977","",NA,NA,NA,1977-08-08,NA,NA,NA,NA,NA,NA,NA
"669","Listan","28","514A7","6",1978,"","","8/8/1978","",NA,NA,NA,1978-08-08,NA,NA,NA,NA,NA,NA,NA
"670","Listan","28","14A154","7",1956,"","","","11/9/1956",NA,NA,NA,NA,1956-09-11,NA,NA,NA,NA,NA,NA
"671","Listan","28","14A154","7",1957,"8/27/1957","","","27/8/57",NA,NA,NA,NA,1957-08-27,NA,NA,NA,NA,NA,NA
"672","Listan","28","14A154","7",1958,"12/9/1958","","","28/8/58",NA,1958-09-12,NA,NA,1958-08-28,NA,-15,NA,NA,NA,NA
"673","Listan","28","14A154","7",1959,"25/8/59","","","",NA,1959-08-25,NA,NA,NA,NA,NA,NA,NA,NA,NA
"674","Listan","28","14A154","7",1960,"","","","",NA,NA,NA,NA,NA,NA,NA,NA,NA,NA,NA
"675","Listan","28","14A154","7",1961,"","","","",NA,NA,NA,NA,NA,NA,NA,NA,NA,NA,NA
"676","Listan","28","7S130","8",1956,"","","","10/9/1956",NA,NA,NA,NA,1956-09-10,NA,NA,NA,NA,NA,NA
"677","Listan","28","7S130","8",1957,"","","","16/9/57",NA,NA,NA,NA,1957-09-16,NA,NA,NA,NA,NA,NA
"678","Listan","28","7S130","8",1958,"","","","21/8/58",NA,NA,NA,NA,1958-08-21,NA,NA,NA,NA,NA,NA
"679","Listan","28","7S130","8",1959,"","","","31/8/59",NA,NA,NA,NA,1959-08-31,NA,NA,NA,NA,NA,NA
"680","Listan","28","14A144","9",1957,"","","","27/8/57",NA,NA,NA,NA,1957-08-27,NA,NA,NA,NA,NA,NA
"681","Listan","28","14A144","9",1958,"","","","12/9/1958",NA,NA,NA,NA,1958-09-12,NA,NA,NA,NA,NA,NA
"682","Listan","28","14A144","9",1959,"","","","25/8/59",NA,NA,NA,NA,1959-08-25,NA,NA,NA,NA,NA,NA
"683","Listan","28","514A8","10",1956,"","","","",NA,NA,NA,NA,NA,NA,NA,NA,NA,NA,NA
"684","Listan","28","514A8","10",1957,"14/8/57","","","14/8/57",NA,1957-08-14,NA,NA,1957-08-14,NA,0,NA,NA,NA,NA
"685","Listan","28","514A8","10",1958,"5/9/1958","","","5/9/1958",NA,1958-09-05,NA,NA,1958-09-05,NA,0,NA,NA,NA,NA
"686","Listan","28","514A8","10",1959,"19/8/59","","","19/8/59",NA,1959-08-19,NA,NA,1959-08-19,NA,0,NA,NA,NA,NA
"687","Listan","28","514A8","10",1960,"31/8/60","","","31/8/60",NA,1960-08-31,NA,NA,1960-08-31,NA,0,NA,NA,NA,NA
"688","Listan","28","514A8","10",1961,"21/8/61","","","21/8/61",NA,1961-08-21,NA,NA,1961-08-21,NA,0,NA,NA,NA,NA
"689","Listan","28","514A8","10",1962,"","","","17/8/62",NA,NA,NA,NA,1962-08-17,NA,NA,NA,NA,NA,NA
"690","Listan","28","514A8","10",1995,"","3/6/1995","24/7/95","28/8/95",NA,NA,1995-06-03,1995-07-24,1995-08-28,NA,NA,NA,51,35,NA
"691","Listan","28","514A8","10",1996,"","5/6/1996","","",NA,NA,1996-06-05,NA,NA,NA,NA,NA,NA,NA,NA
"692","Listan","28","514A8","10",1976,"","","29/7/76","",NA,NA,NA,1976-07-29,NA,NA,NA,NA,NA,NA,NA
"693","Listan","28","514A8","10",1977,"","","8/8/1977","",NA,NA,NA,1977-08-08,NA,NA,NA,NA,NA,NA,NA
"694","Listan","28","514A8","10",1978,"","","8/8/1978","",NA,NA,NA,1978-08-08,NA,NA,NA,NA,NA,NA,NA
"695","Listan","28","514A9","11",1956,"","","","",NA,NA,NA,NA,NA,NA,NA,NA,NA,NA,NA
"696","Listan","28","514A9","11",1957,"14/8/57","","","14/8/57",NA,1957-08-14,NA,NA,1957-08-14,NA,0,NA,NA,NA,NA
"697","Listan","28","514A9","11",1958,"5/9/1958","","","5/9/1958",NA,1958-09-05,NA,NA,1958-09-05,NA,0,NA,NA,NA,NA
"698","Listan","28","514A9","11",1959,"19/8/59","","","19/8/59",NA,1959-08-19,NA,NA,1959-08-19,NA,0,NA,NA,NA,NA
"699","Listan","28","514A9","11",1960,"23/8/60","","","23/8/60",NA,1960-08-23,NA,NA,1960-08-23,NA,0,NA,NA,NA,NA
"700","Listan","28","514A9","11",1961,"21/8/61","","","21/8/61",NA,1961-08-21,NA,NA,1961-08-21,NA,0,NA,NA,NA,NA
"701","Listan","28","514A9","11",1962,"","","","3/9/1962",NA,NA,NA,NA,1962-09-03,NA,NA,NA,NA,NA,NA
"702","Listan","28","514A9","11",1996,"","4/6/1996","","",NA,NA,1996-06-04,NA,NA,NA,NA,NA,NA,NA,NA
"703","Listan","28","514A9","11",1976,"","","29/7/76","",NA,NA,NA,1976-07-29,NA,NA,NA,NA,NA,NA,NA
"704","Listan","28","514A9","11",1977,"","","22/8/1977","",NA,NA,NA,1977-08-22,NA,NA,NA,NA,NA,NA,NA
"705","Listan","28","514A9","11",1978,"","","12/8/1978","",NA,NA,NA,1978-08-12,NA,NA,NA,NA,NA,NA,NA
"706","Listan","28","clsP12A7","12",1956,"","","","",NA,NA,NA,NA,NA,NA,NA,NA,NA,NA,NA
"707","Listan","28","clsP12A7","12",1957,"","","","",NA,NA,NA,NA,NA,NA,NA,NA,NA,NA,NA
"708","Listan","28","clsP12A7","12",1958,"29/8/58","","","29/8/58",NA,1958-08-29,NA,NA,1958-08-29,NA,0,NA,NA,NA,NA
"709","Listan","28","clsP12A7","12",1959,"17/8/59","","","17/8/59",NA,1959-08-17,NA,NA,1959-08-17,NA,0,NA,NA,NA,NA
"710","Listan","28","clsP12A7","12",1960,"8/8/1960","","","8/8/1960",NA,1960-08-08,NA,NA,1960-08-08,NA,0,NA,NA,NA,NA
"711","Listan","28","clsP12A7","12",1961,"14/8/61","","","14/8/61",NA,1961-08-14,NA,NA,1961-08-14,NA,0,NA,NA,NA,NA
"712","Listan","28","11S94","13",1956,"1/10/1956","","","1/10/1956",NA,1956-10-01,NA,NA,1956-10-01,NA,0,NA,NA,NA,NA
"713","Listan","28","11S94","13",1957,"","","","",NA,NA,NA,NA,NA,NA,NA,NA,NA,NA,NA
"714","Listan","28","11S94","13",1958,"4/9/1958","","","6/9/1958",NA,1958-09-04,NA,NA,1958-09-06,NA,2,NA,NA,NA,NA
"715","Listan","28","11S94","13",1959,"19/8/59","","","19/8/59",NA,1959-08-19,NA,NA,1959-08-19,NA,0,NA,NA,NA,NA
"716","Listan","28","11S94","13",1960,"","","","",NA,NA,NA,NA,NA,NA,NA,NA,NA,NA,NA
"717","Listan","28","11S94","13",1961,"","","","",NA,NA,NA,NA,NA,NA,NA,NA,NA,NA,NA
"718","Listan","28","cl4P14A5","14",1956,"","","","",NA,NA,NA,NA,NA,NA,NA,NA,NA,NA,NA
"719","Listan","28","cl4P14A5","14",1957,"","","","",NA,NA,NA,NA,NA,NA,NA,NA,NA,NA,NA
"720","Listan","28","cl4P14A5","14",1958,"","","","",NA,NA,NA,NA,NA,NA,NA,NA,NA,NA,NA
"721","Listan","28","cl4P14A5","14",1959,"10/8/1959","","","10/8/1959",NA,1959-08-10,NA,NA,1959-08-10,NA,0,NA,NA,NA,NA
"722","Listan","28","cl4P14A5","14",1960,"1/8/1958","","","1/8/1960",NA,1958-08-01,NA,NA,1960-08-01,NA,731,NA,NA,NA,NA
"723","Listan","28","cl4P14A5","14",1961,"28/8/59","","","28/8/61",NA,1959-08-28,NA,NA,1961-08-28,NA,731,NA,NA,NA,NA
"724","Listan","28","cl4P14A5","14",1962,"","","","28/8/62",NA,NA,NA,NA,1962-08-28,NA,NA,NA,NA,NA,NA
"725","Listan","28","cl4P9A9","15",1956,"","","","",NA,NA,NA,NA,NA,NA,NA,NA,NA,NA,NA
"726","Listan","28","cl4P9A9","15",1957,"","","","",NA,NA,NA,NA,NA,NA,NA,NA,NA,NA,NA
"727","Listan","28","cl4P9A9","15",1958,"19/8/58","","","19/8/58",NA,1958-08-19,NA,NA,1958-08-19,NA,0,NA,NA,NA,NA
"728","Listan","28","cl4P9A9","15",1959,"31/8/59","","","31/8/59",NA,1959-08-31,NA,NA,1959-08-31,NA,0,NA,NA,NA,NA
"729","Listan","28","cl4P9A9","15",1960,"16/8/60","","","16/8/60",NA,1960-08-16,NA,NA,1960-08-16,NA,0,NA,NA,NA,NA
"730","Listan","28","cl4P9A9","15",1961,"14/8/61","","","14/8/61",NA,1961-08-14,NA,NA,1961-08-14,NA,0,NA,NA,NA,NA
"731","Listan","28","cl4P9A9","15",1962,"","","","21/8/1962",NA,NA,NA,NA,1962-08-21,NA,NA,NA,NA,NA,NA
"732","Listan","28","cl11P17A1","16",1956,"","","","",NA,NA,NA,NA,NA,NA,NA,NA,NA,NA,NA
"733","Listan","28","cl11P17A1","16",1957,"","","","",NA,NA,NA,NA,NA,NA,NA,NA,NA,NA,NA
"734","Listan","28","cl11P17A1","16",1958,"","","","",NA,NA,NA,NA,NA,NA,NA,NA,NA,NA,NA
"735","Listan","28","cl11P17A1","16",1959,"24/8/59","","","24/8/59",NA,1959-08-24,NA,NA,1959-08-24,NA,0,NA,NA,NA,NA
"736","Listan","28","cl11P17A1","16",1960,"22/8/60","","","22/8/60",NA,1960-08-22,NA,NA,1960-08-22,NA,0,NA,NA,NA,NA
"737","Listan","28","cl11P17A1","16",1961,"11/9/1961","","","11/9/1961",NA,1961-09-11,NA,NA,1961-09-11,NA,0,NA,NA,NA,NA
"738","Listan","28","cl4P13S2","17",1956,"","","","28/8/62",NA,NA,NA,NA,1962-08-28,NA,NA,NA,NA,NA,NA
"739","Listan","28","cl4P13S2","17",1957,"","","","",NA,NA,NA,NA,NA,NA,NA,NA,NA,NA,NA
"740","Listan","28","cl4P13S2","17",1958,"29/8/58","","","29/8/58",NA,1958-08-29,NA,NA,1958-08-29,NA,0,NA,NA,NA,NA
"741","Listan","28","cl4P13S2","17",1959,"24/8/59","","","24/8/59",NA,1959-08-24,NA,NA,1959-08-24,NA,0,NA,NA,NA,NA
"742","Listan","28","cl4P13S2","17",1960,"25/9/60","","","52/9/60",NA,1960-09-25,NA,NA,NA,NA,NA,NA,NA,NA,NA
"743","Listan","28","cl4P13S2","17",1961,"24/8/61","","","24/8/61",NA,1961-08-24,NA,NA,1961-08-24,NA,0,NA,NA,NA,NA
"744","Listan","28","cl4P13S2","17",1962,"","","","3/9/1962",NA,NA,NA,NA,1962-09-03,NA,NA,NA,NA,NA,NA
"745","Listan","28","1112S4","19",1968,"","","","",NA,NA,NA,NA,NA,NA,NA,NA,NA,NA,NA
"746","Listan","28","1112S4","19",1969,"","","","",NA,NA,NA,NA,NA,NA,NA,NA,NA,NA,NA
"747","Listan","28","1112S4","19",1970,"","","","",NA,NA,NA,NA,NA,NA,NA,NA,NA,NA,NA
"748","Listan","28","1112S4","19",1971,"23/8/71","","","23/8//71",NA,1971-08-23,NA,NA,NA,"Review this line",NA,NA,NA,NA,NA
"749","Listan","28","1112S4","19",1972,"5/9/1972","","","5/9/1972",NA,1972-09-05,NA,NA,1972-09-05,NA,0,NA,NA,NA,NA
"750","Listan","28","1112S4","19",1973,"16/8/73","","","14/8/73",NA,1973-08-16,NA,NA,1973-08-14,NA,-2,NA,NA,NA,NA
"751","Listan","28","1112S4","19",1976,"","","28/7/76","",NA,NA,NA,1976-07-28,NA,NA,NA,NA,NA,NA,NA
"752","Listan","28","1112S4","19",1977,"","","1/8/1977","",NA,NA,NA,1977-08-01,NA,NA,NA,NA,NA,NA,NA
"753","Listan","28","1112S4","19",1978,"","","1/8/1978","",NA,NA,NA,1978-08-01,NA,NA,NA,NA,NA,NA,NA
"754","Listan","28","1117S7","20",1968,"19/8/68","","","19/8/68",NA,1968-08-19,NA,NA,1968-08-19,NA,0,NA,NA,NA,NA
"755","Listan","28","1117S7","20",1969,"2/9/1969","","","2/9/1969",NA,1969-09-02,NA,NA,1969-09-02,NA,0,NA,NA,NA,NA
"756","Listan","28","1117S7","20",1970,"27/7/70","","","27/7/70",NA,1970-07-27,NA,NA,1970-07-27,NA,0,NA,NA,NA,NA
"757","Listan","28","1117S7","20",1971,"","","","",NA,NA,NA,NA,NA,NA,NA,NA,NA,NA,NA
"758","Listan","28","1117S7","20",1972,"","","","",NA,NA,NA,NA,NA,NA,NA,NA,NA,NA,NA
"759","Listan","28","1117S7","20",1973,"","","","",NA,NA,NA,NA,NA,NA,NA,NA,NA,NA,NA
"760","Listan","28","1117S7","20",1976,"","","23/7/76","",NA,NA,NA,1976-07-23,NA,NA,NA,NA,NA,NA,NA
"761","Listan","28","1117S7","20",1977,"","","9/8/1977","",NA,NA,NA,1977-08-09,NA,NA,NA,NA,NA,NA,NA
"762","Listan","28","1117S7","20",1978,"","","14/8/78","",NA,NA,NA,1978-08-14,NA,NA,NA,NA,NA,NA,NA
"763","Listan","28","1117S7","20",1996,"","4/6/1996","","",NA,NA,1996-06-04,NA,NA,NA,NA,NA,NA,NA,NA
"764","Listan","28","","21",1992,"","26/5/92","26/7/92","31/7/92",NA,NA,1992-05-26,1992-07-26,1992-07-31,NA,NA,NA,61,5,NA
"765","Listan","28","","21",1993,"","1/6/1993","25/7/93","30/8/93",NA,NA,1993-06-01,1993-07-25,1993-08-30,NA,NA,NA,54,36,NA
"766","Listan","28","","21",1994,"","28/5/94","21/7/94","5/9/1994",NA,NA,1994-05-28,1994-07-21,1994-09-05,NA,NA,NA,54,46,NA
"767","Beni Carlo","30","7A83","1",1956,"9/4/1956","","","1/10/1956",NA,1956-04-09,NA,NA,1956-10-01,NA,175,NA,NA,NA,NA
"768","Beni Carlo","30","7A83","1",1957,"21/3/57","","","1/10/1957",NA,1957-03-21,NA,NA,1957-10-01,NA,194,NA,NA,NA,NA
"769","Beni Carlo","30","7A83","1",1958,"5/4/1958","","","10/9/1958",NA,1958-04-05,NA,NA,1958-09-10,NA,158,NA,NA,NA,NA
"770","Beni Carlo","30","7A83","1",1959,"","","","12/9/1959",NA,NA,NA,NA,1959-09-12,NA,NA,NA,NA,NA,NA
"771","Beni Carlo","30","7A83","1",1969,"","","","",NA,NA,NA,NA,NA,NA,NA,NA,NA,NA,NA
"772","Beni Carlo","30","7A83","1",1970,"","","","",NA,NA,NA,NA,NA,NA,NA,NA,NA,NA,NA
"773","Beni Carlo","30","7A86","2",1956,"5/4/1956","","","1/10/1956",NA,1956-04-05,NA,NA,1956-10-01,NA,179,NA,NA,NA,NA
"774","Beni Carlo","30","7A86","2",1957,"25/3/57","","","1/10/1956",NA,1957-03-25,NA,NA,1956-10-01,NA,-175,NA,NA,NA,NA
"775","Beni Carlo","30","7A86","2",1958,"3/4/1958","","","18/9/58",NA,1958-04-03,NA,NA,1958-09-18,NA,168,NA,NA,NA,NA
"776","Beni Carlo","30","7A86","2",1959,"29/3/59","","","18/9/59",NA,1959-03-29,NA,NA,1959-09-18,NA,173,NA,NA,NA,NA
"777","Beni Carlo","30","7A86","2",1969,"","","","",NA,NA,NA,NA,NA,NA,NA,NA,NA,NA,NA
"778","Beni Carlo","30","7A86","2",1970,"","","","",NA,NA,NA,NA,NA,NA,NA,NA,NA,NA,NA
"779","Beni Carlo","30","7A86","2",1971,"","","","",NA,NA,NA,NA,NA,NA,NA,NA,NA,NA,NA
"780","Beni Carlo","30","7A85","3",1956,"5/4/1956","","","1/10/1956",NA,1956-04-05,NA,NA,1956-10-01,NA,179,NA,NA,NA,NA
"781","Beni Carlo","30","7A85","3",1957,"23/3/57","","","1/10/1956",NA,1957-03-23,NA,NA,1956-10-01,NA,-173,NA,NA,NA,NA
"782","Beni Carlo","30","7A85","3",1958,"4/4/1958","","","",NA,1958-04-04,NA,NA,NA,NA,NA,NA,NA,NA,NA
"783","Beni Carlo","30","7A85","3",1959,"","","","",NA,NA,NA,NA,NA,NA,NA,NA,NA,NA,NA
"784","Beni Carlo","30","7A85","3",1969,"","","","",NA,NA,NA,NA,NA,NA,NA,NA,NA,NA,NA
"785","Beni Carlo","30","7A85","3",1970,"","","","",NA,NA,NA,NA,NA,NA,NA,NA,NA,NA,NA
"786","Beni Carlo","30","7A85","3",1971,"","","","",NA,NA,NA,NA,NA,NA,NA,NA,NA,NA,NA
"787","Beni Carlo","30","514S3","4",1956,"6/4/1956","","","24/9/56",NA,1956-04-06,NA,NA,1956-09-24,NA,171,NA,NA,NA,NA
"788","Beni Carlo","30","514S3","4",1957,"23/3/57","","","",NA,1957-03-23,NA,NA,NA,NA,NA,NA,NA,NA,NA
"789","Beni Carlo","30","514S3","4",1958,"7/4/1958","","","10/9/1958",NA,1958-04-07,NA,NA,1958-09-10,NA,156,NA,NA,NA,NA
"790","Beni Carlo","30","514S3","4",1959,"","","","12/9/1959",NA,NA,NA,NA,1959-09-12,NA,NA,NA,NA,NA,NA
"791","Beni Carlo","30","514S3","4",1969,"","","","",NA,NA,NA,NA,NA,NA,NA,NA,NA,NA,NA
"792","Beni Carlo","30","514S3","4",1970,"","","","",NA,NA,NA,NA,NA,NA,NA,NA,NA,NA,NA
"793","Beni Carlo","30","514S3","4",1971,"","","","",NA,NA,NA,NA,NA,NA,NA,NA,NA,NA,NA
"794","Beni Carlo","30","514S3","4",1976,"","","5/8/1976","",NA,NA,NA,1976-08-05,NA,NA,NA,NA,NA,NA,NA
"795","Beni Carlo","30","514S3","4",1977,"","","16/8/77","",NA,NA,NA,1977-08-16,NA,NA,NA,NA,NA,NA,NA
"796","Beni Carlo","30","514S3","4",1978,"","","16/8/78","",NA,NA,NA,1978-08-16,NA,NA,NA,NA,NA,NA,NA
"797","Beni Carlo","30","514S3","4",1992,"","26/5/92","","",NA,NA,1992-05-26,NA,NA,NA,NA,NA,NA,NA,NA
"798","Beni Carlo","30","514S3","4",1995,"","2/6/1995","","",NA,NA,1995-06-02,NA,NA,NA,NA,NA,NA,NA,NA
"799","Beni Carlo","30","514S3","4",1996,"","4/6/1996","","",NA,NA,1996-06-04,NA,NA,NA,NA,NA,NA,NA,NA
"800","Beni Carlo","30","5A90","5",1956,"3/4/1956","","","8/10/1956",NA,1956-04-03,NA,NA,1956-10-08,NA,188,NA,NA,NA,NA
"801","Beni Carlo","30","5A90","5",1957,"27/3/57","","","23/9/57",NA,1957-03-27,NA,NA,1957-09-23,NA,180,NA,NA,NA,NA
"802","Beni Carlo","30","5A90","5",1958,"5/4/1958","","","3/9/1958",NA,1958-04-05,NA,NA,1958-09-03,NA,151,NA,NA,NA,NA
"803","Beni Carlo","30","5A90","5",1959,"26/3/59","","","12/9/1959",NA,1959-03-26,NA,NA,1959-09-12,NA,170,NA,NA,NA,NA
"804","Beni Carlo","30","53S9","6",1969,"25/3/69","","","29/9/69",NA,1969-03-25,NA,NA,1969-09-29,NA,188,NA,NA,NA,NA
"805","Beni Carlo","30","53S9","6",1970,"31/3/70","","","21/9/70",NA,1970-03-31,NA,NA,1970-09-21,NA,174,NA,NA,NA,NA
"806","Beni Carlo","30","53S9","6",1971,"3/4/1971","","","20/9/71",NA,1971-04-03,NA,NA,1971-09-20,NA,170,NA,NA,NA,NA
"807","Beni Carlo","30","53S9","6",1976,"","","","",NA,NA,NA,NA,NA,NA,NA,NA,NA,NA,NA
"808","Beni Carlo","30","53S9","6",1977,"","","5/8/1977","",NA,NA,NA,1977-08-05,NA,NA,NA,NA,NA,NA,NA
"809","Beni Carlo","30","53S9","6",1978,"","","16/8/78","",NA,NA,NA,1978-08-16,NA,NA,NA,NA,NA,NA,NA
"810","Beni Carlo","30","53S9","6",1996,"","3/6/1996","","",NA,NA,1996-06-03,NA,NA,NA,NA,NA,NA,NA,NA
"811","Counoise ","63","10S72","1",1956,"7/4/1956","","","17/9/56",NA,1956-04-07,NA,NA,1956-09-17,NA,163,NA,NA,NA,NA
"812","Counoise ","63","10S72","1",1957,"20/3/57","","","21/9/57",NA,1957-03-20,NA,NA,1957-09-21,NA,185,NA,NA,NA,NA
"813","Counoise ","63","10S72","1",1958,"12/4/1958","","","4/9/1958",NA,1958-04-12,NA,NA,1958-09-04,NA,145,NA,NA,NA,NA
"814","Counoise ","63","10S72","1",1959,"1/4/1959","","","7/9/1959",NA,1959-04-01,NA,NA,1959-09-07,NA,159,NA,NA,NA,NA
"815","Counoise ","63","10S72","1",1960,"","","","31/8/60",NA,NA,NA,NA,1960-08-31,NA,NA,NA,NA,NA,NA
"816","Counoise ","63","515S5","1",1956,"3/4/1956","","","10/9/1956",NA,1956-04-03,NA,NA,1956-09-10,NA,160,NA,NA,NA,NA
"817","Counoise ","63","515S5","2",1957,"19/3/57","","","23/9/57",NA,1957-03-19,NA,NA,1957-09-23,NA,188,NA,NA,NA,NA
"818","Counoise ","63","515S5","2",1958,"1/4/1958","","","10/9/1958",NA,1958-04-01,NA,NA,1958-09-10,NA,162,NA,NA,NA,NA
"819","Counoise ","63","515S5","2",1959,"","","","31/8/59",NA,NA,NA,NA,1959-08-31,NA,NA,NA,NA,NA,NA
"820","Counoise ","63","515S5","2",1995,"","2/6/1995","","",NA,NA,1995-06-02,NA,NA,NA,NA,NA,NA,NA,NA
"821","Counoise ","63","16A156","3",1956,"","","","17/9/56",NA,NA,NA,NA,1956-09-17,NA,NA,NA,NA,NA,NA
"822","Counoise ","63","16A156","3",1957,"12/3/1957","","","10/9/1957",NA,1957-03-12,NA,NA,1957-09-10,NA,182,NA,NA,NA,NA
"823","Counoise ","63","16A156","3",1958,"2/4/1958","","","28/8/58",NA,1958-04-02,NA,NA,1958-08-28,NA,148,NA,NA,NA,NA
"824","Counoise ","63","16A156","3",1959,"27/3/59","","","",NA,1959-03-27,NA,NA,NA,NA,NA,NA,NA,NA,NA
"825","Counoise ","63","16A156","3",1960,"20/3/60","","","",NA,1960-03-20,NA,NA,NA,NA,NA,NA,NA,NA,NA
"826","Counoise ","63","515S6","4",1956,"","","","11/9/1956",NA,NA,NA,NA,1956-09-11,NA,NA,NA,NA,NA,NA
"827","Counoise ","63","515S6","4",1957,"17/3/57","","","10/9/1957",NA,1957-03-17,NA,NA,1957-09-10,NA,177,NA,NA,NA,NA
"828","Counoise ","63","515S6","4",1958,"2/4/1958","","","28/8/58",NA,1958-04-02,NA,NA,1958-08-28,NA,148,NA,NA,NA,NA
"829","Counoise ","63","515S6","4",1959,"29/3/59","","","",NA,1959-03-29,NA,NA,NA,NA,NA,NA,NA,NA,NA
"830","Counoise ","63","515S6","4",1960,"20/3/60","","","",NA,1960-03-20,NA,NA,NA,NA,NA,NA,NA,NA,NA
"831","Counoise ","63","515S6","4",1995,"","7/6/1995","","",NA,NA,1995-06-07,NA,NA,NA,NA,NA,NA,NA,NA
"832","Counoise ","63","10S76","5",1956,"5/4/1956","","","17/9/56",NA,1956-04-05,NA,NA,1956-09-17,NA,165,NA,NA,NA,NA
"833","Counoise ","63","10S76","5",1957,"21/3/57","","","2/10/1957",NA,1957-03-21,NA,NA,1957-10-02,NA,195,NA,NA,NA,NA
"834","Counoise ","63","10S76","5",1958,"10/4/1958","","","4/9/1958",NA,1958-04-10,NA,NA,1958-09-04,NA,147,NA,NA,NA,NA
"835","Counoise ","63","10S76","5",1959,"2/4/1959","","","7/9/1959",NA,1959-04-02,NA,NA,1959-09-07,NA,158,NA,NA,NA,NA
"836","Counoise ","63","10S76","5",1960,"31/3/60","","","",NA,1960-03-31,NA,NA,NA,NA,NA,NA,NA,NA,NA
"837","Counoise ","63","10S76","5",1961,"","","","",NA,NA,NA,NA,NA,NA,NA,NA,NA,NA,NA
"838","Counoise ","63","10S76","5",1962,"","","","",NA,NA,NA,NA,NA,NA,NA,NA,NA,NA,NA
"839","Counoise ","63","9S111","6",1956,"2/4/1956","","","10/9/1956",NA,1956-04-02,NA,NA,1956-09-10,NA,161,NA,NA,NA,NA
"840","Counoise ","63","9S111","6",1957,"29/3/57","","","16/9/57",NA,1957-03-29,NA,NA,1957-09-16,NA,171,NA,NA,NA,NA
"841","Counoise ","63","9S111","6",1958,"1/4/1958","","","28/8/58",NA,1958-04-01,NA,NA,1958-08-28,NA,149,NA,NA,NA,NA
"842","Counoise ","63","9S111","6",1959,"31/3/59","","","7/9/1959",NA,1959-03-31,NA,NA,1959-09-07,NA,160,NA,NA,NA,NA
"843","Counoise ","63","9S111","6",1960,"24/3/60","","","",NA,1960-03-24,NA,NA,NA,NA,NA,NA,NA,NA,NA
"844","Counoise ","63","9S111","6",1961,"","","","",NA,NA,NA,NA,NA,NA,NA,NA,NA,NA,NA
"845","Counoise ","63","9S111","6",1962,"","","","",NA,NA,NA,NA,NA,NA,NA,NA,NA,NA,NA
"846","Counoise ","63","412S5","7",1958,"4/4/1958","","","",NA,1958-04-04,NA,NA,NA,NA,NA,NA,NA,NA,NA
"847","Counoise ","63","412S5","7",1959,"3/4/1959","","","",NA,1959-04-03,NA,NA,NA,NA,NA,NA,NA,NA,NA
"848","Counoise ","63","412S5","7",1960,"18/3/60","","","",NA,1960-03-18,NA,NA,NA,NA,NA,NA,NA,NA,NA
"849","Counoise ","63","412S5","7",1961,"27/3/61","","","28/8/61",NA,1961-03-27,NA,NA,1961-08-28,NA,154,NA,NA,NA,NA
"850","Counoise ","63","412S5","7",1962,"16/4/62","","","7/9/1962",NA,1962-04-16,NA,NA,1962-09-07,NA,144,NA,NA,NA,NA
"851","Counoise ","63","1120S6","8",1971,"8/4/1971","","","14/9/71",NA,1971-04-08,NA,NA,1971-09-14,NA,159,NA,NA,NA,NA
"852","Counoise ","63","1120S6","8",1972,"31/3/72","","","",NA,1972-03-31,NA,NA,NA,NA,NA,NA,NA,NA,NA
"853","Counoise ","63","1120S6","8",1973,"12/4/1973","","","10/9/1973",NA,1973-04-12,NA,NA,1973-09-10,NA,151,NA,NA,NA,NA
"854","Counoise ","63","1120S6","8",1974,"","","","10/9/1974",NA,NA,NA,NA,1974-09-10,NA,NA,NA,NA,NA,NA
"855","Counoise ","63","1120S8","10",1972,"","","","28/8/72",NA,NA,NA,NA,1972-08-28,NA,NA,NA,NA,NA,NA
"856","Counoise ","63","1120S8","10",1973,"","","","10/9/1973",NA,NA,NA,NA,1973-09-10,NA,NA,NA,NA,NA,NA
"857","Counoise ","63","1120S8","10",1974,"30/3/74","","","4/9/1974",NA,1974-03-30,NA,NA,1974-09-04,NA,158,NA,NA,NA,NA
"858","Counoise ","63","1120S8","10",1975,"28/3/75","","","",NA,1975-03-28,NA,NA,NA,NA,NA,NA,NA,NA,NA
"859","Counoise ","63","1120S8","10",1976,"28/3/76","","","",NA,1976-03-28,NA,NA,NA,NA,NA,NA,NA,NA,NA
"860","Counoise ","63","1120S9","11",1975,"","","","31/8/75",NA,NA,NA,NA,1975-08-31,NA,NA,NA,NA,NA,NA
"861","Counoise ","63","1120S9","11",1976,"","","","5/9/1976",NA,NA,NA,NA,1976-09-05,NA,NA,NA,NA,NA,NA
"862","Counoise ","63","1120S9","11",1977,"","","","11/9/1977",NA,NA,NA,NA,1977-09-11,NA,NA,NA,NA,NA,NA
"863","Counoise ","63","124A1","12",1969,"","","","10/9/1969",NA,NA,NA,NA,1969-09-10,NA,NA,NA,NA,NA,NA
"864","Counoise ","63","124A1","12",1970,"","","","1/9/1970",NA,NA,NA,NA,1970-09-01,NA,NA,NA,NA,NA,NA
"865","Counoise ","63","124A1","12",1971,"1/4/1971","","","20/9/71",NA,1971-04-01,NA,NA,1971-09-20,NA,172,NA,NA,NA,NA
"866","Counoise ","63","124A1","12",1972,"22/3/72","","","",NA,1972-03-22,NA,NA,NA,NA,NA,NA,NA,NA,NA
"867","Counoise ","63","124A1","12",1973,"31/3/73","","","",NA,1973-03-31,NA,NA,NA,NA,NA,NA,NA,NA,NA
"868","Counoise ","63","124A1","12",1974,"20/3/74","","","",NA,1974-03-20,NA,NA,NA,NA,NA,NA,NA,NA,NA
"869","Counoise ","63","140S3","13",1970,"13/4/70","","","",NA,1970-04-13,NA,NA,NA,NA,NA,NA,NA,NA,NA
"870","Counoise ","63","140S3","13",1971,"20/9/71","","","",NA,1971-09-20,NA,NA,NA,NA,NA,NA,NA,NA,NA
"871","Counoise ","63","140S3","13",1972,"29/3/72","","","",NA,1972-03-29,NA,NA,NA,NA,NA,NA,NA,NA,NA
"872","Counoise ","63","140S3","13",1975,"","","","4/9/1975",NA,NA,NA,NA,1975-09-04,NA,NA,NA,NA,NA,NA
"873","Counoise","63","140S3","13",1976,"","","","7/9/1976",NA,NA,NA,NA,1976-09-07,NA,NA,NA,NA,NA,NA
"874","Counoise","63","140S3","13",1977,"","","","19/9/77",NA,NA,NA,NA,1977-09-19,NA,NA,NA,NA,NA,NA
"875","Counoise","63","140S3","13",1992,"","28/5/92","","",NA,NA,1992-05-28,NA,NA,NA,NA,NA,NA,NA,NA
"876","Counoise","63","140S3","13",1994,"","30/5/94","","",NA,NA,1994-05-30,NA,NA,NA,NA,NA,NA,NA,NA
"877","Counoise","63","140S3","13",1995,"","3/6/1995","","",NA,NA,1995-06-03,NA,NA,NA,NA,NA,NA,NA,NA
"878","Counoise","63","721S12","14",1976,"2/4/1976","","","",NA,1976-04-02,NA,NA,NA,NA,NA,NA,NA,NA,NA
"879","Counoise","63","721S12","14",1977,"29/3/77","","","",NA,1977-03-29,NA,NA,NA,NA,NA,NA,NA,NA,NA
"880","Counoise","63","721S12","14",1978,"28/3/78","","","",NA,1978-03-28,NA,NA,NA,NA,NA,NA,NA,NA,NA
"881","Counoise","63","721S12","14",1979,"","","","1/9/1979",NA,NA,NA,NA,1979-09-01,NA,NA,NA,NA,NA,NA
"882","Counoise","63","721S12","14",1981,"","","","24/9/81",NA,NA,NA,NA,1981-09-24,NA,NA,NA,NA,NA,NA
"883","Counoise","63","721S12","14",1994,"","27/5/94","","",NA,NA,1994-05-27,NA,NA,NA,NA,NA,NA,NA,NA
"884","Counoise","63","721S12","14",1995,"","3/6/1995","","",NA,NA,1995-06-03,NA,NA,NA,NA,NA,NA,NA,NA
"885","Counoise","63","1558A2","15",1975,"","","","31/8/75",NA,NA,NA,NA,1975-08-31,NA,NA,NA,NA,NA,NA
"886","Counoise","63","1558A2","15",1976,"","","","26/9/76",NA,NA,NA,NA,1976-09-26,NA,NA,NA,NA,NA,NA
"887","Counoise","63","1558A2","15",1977,"","","","11/9/1977",NA,NA,NA,NA,1977-09-11,NA,NA,NA,NA,NA,NA
"888","Counoise","63","1558A2","15",1980,"27/3/80","","","",NA,1980-03-27,NA,NA,NA,NA,NA,NA,NA,NA,NA
"889","Counoise","63","1558A2","15",1981,"29/3/81","","","",NA,1981-03-29,NA,NA,NA,NA,NA,NA,NA,NA,NA
"890","Counoise","63","1558A2","15",1982,"1/4/1982","","","",NA,1982-04-01,NA,NA,NA,NA,NA,NA,NA,NA,NA
"891","Counoise","63","1415","",1973,"5/4/1973","","","",NA,1973-04-05,NA,NA,NA,NA,NA,NA,NA,NA,NA
"892","Counoise","63","1415","",1975,"2/4/1975","","","",NA,1975-04-02,NA,NA,NA,NA,NA,NA,NA,NA,NA
"893","Counoise","63","1415","",1976,"22/3/76","","","",NA,1976-03-22,NA,NA,NA,NA,NA,NA,NA,NA,NA
"894","GrenacheNoir","34","7A87 ","1",1956,"2/4/1956","","","17/9/56",NA,1956-04-02,NA,NA,1956-09-17,NA,168,NA,NA,NA,NA
"895","GrenacheNoir","34","7A87","1",1957,"15/3/57","","","16/9/57",NA,1957-03-15,NA,NA,1957-09-16,NA,185,NA,NA,NA,NA
"896","GrenacheNoir","34","7A87","1",1958,"1/4/1958","","","3/9/1958",NA,1958-04-01,NA,NA,1958-09-03,NA,155,NA,NA,NA,NA
"897","GrenacheNoir","34","7A87","1",1959,"25/3/59","","","",NA,1959-03-25,NA,NA,NA,NA,NA,NA,NA,NA,NA
"898","GrenacheNoir","34","7A95 ","2",1956,"3/4/1956","","","17/9/56",NA,1956-04-03,NA,NA,1956-09-17,NA,167,NA,NA,NA,NA
"899","GrenacheNoir","34","7A95","2",1957,"18/3/57","","","1/10/1957",NA,1957-03-18,NA,NA,1957-10-01,NA,197,NA,NA,NA,NA
"900","GrenacheNoir","34","7A95","2",1958,"31/3/58","","","3/9/1958",NA,1958-03-31,NA,NA,1958-09-03,NA,156,NA,NA,NA,NA
"901","GrenacheNoir","34","7A95","2",1959,"","","","31/8/59",NA,NA,NA,NA,1959-08-31,NA,NA,NA,NA,NA,NA
"902","GrenacheNoir","34","514S6","3",1956,"1/4/1956","","","4/9/1956",NA,1956-04-01,NA,NA,1956-09-04,NA,156,NA,NA,NA,NA
"903","GrenacheNoir","34","514S6","3",1957,"15/3/57","","","24/9/57",NA,1957-03-15,NA,NA,1957-09-24,NA,193,NA,NA,NA,NA
"904","GrenacheNoir","34","514S6","3",1958,"1/4/1958","","","1/10/1958",NA,1958-04-01,NA,NA,1958-10-01,NA,183,NA,NA,NA,NA
"905","GrenacheNoir","34","514S6","3",1959,"","","","3/9/1959",NA,NA,NA,NA,1959-09-03,NA,NA,NA,NA,NA,NA
"906","GrenacheNoir","34","514S6","3",1960,"","","","31/8/60",NA,NA,NA,NA,1960-08-31,NA,NA,NA,NA,NA,NA
"907","GrenacheNoir","34","514S6","3",1961,"","","","4/9/1961",NA,NA,NA,NA,1961-09-04,NA,NA,NA,NA,NA,NA
"908","GrenacheNoir","34","514S6","3",1962,"","","","3/9/1962",NA,NA,NA,NA,1962-09-03,NA,NA,NA,NA,NA,NA
"909","GrenacheNoir","34","514S6","3",1963,"","","","31/8/63",NA,NA,NA,NA,1963-08-31,NA,NA,NA,NA,NA,NA
"910","GrenacheNoir","34","514S6","3",1976,"","","12/8/1976","",NA,NA,NA,1976-08-12,NA,NA,NA,NA,NA,NA,NA
"911","GrenacheNoir","34","514S6","3",1977,"","","22/8/77","",NA,NA,NA,1977-08-22,NA,NA,NA,NA,NA,NA,NA
"912","GrenacheNoir","34","514S6","3",1978,"","","16/8/78","",NA,NA,NA,1978-08-16,NA,NA,NA,NA,NA,NA,NA
"913","GrenacheNoir","34","514S6","3",1979,"","1/6/1979","","",NA,NA,1979-06-01,NA,NA,NA,NA,NA,NA,NA,NA
"914","GrenacheNoir","34","514S6","3",1980,"","2/6/1980","","",NA,NA,1980-06-02,NA,NA,NA,NA,NA,NA,NA,NA
"915","GrenacheNoir","34","514S6","3",1981,"","3/6/1981","","",NA,NA,1981-06-03,NA,NA,NA,NA,NA,NA,NA,NA
"916","GrenacheNoir","34","514S6","3",1982,"","28/5/82","","",NA,NA,1982-05-28,NA,NA,NA,NA,NA,NA,NA,NA
"917","GrenacheNoir","34","514S6","3",1987,"","9/6/1987","","21/9/87",NA,NA,1987-06-09,NA,1987-09-21,NA,NA,NA,NA,NA,NA
"918","GrenacheNoir","34","514S6","3",1988,"","1/9/1988","","19/9/88",NA,NA,1988-09-01,NA,1988-09-19,NA,NA,NA,NA,NA,NA
"919","GrenacheNoir","34","514S6","3",1989,"","26/5/89","","4/9/1989",NA,NA,1989-05-26,NA,1989-09-04,NA,NA,NA,NA,NA,NA
"920","GrenacheNoir","34","514S6","3",1990,"","23/5/90","","",NA,NA,1990-05-23,NA,NA,NA,NA,NA,NA,NA,NA
"921","GrenacheNoir","34","514S6","3",1991,"","3/6/1991","","",NA,NA,1991-06-03,NA,NA,NA,NA,NA,NA,NA,NA
"922","GrenacheNoir","34","514S6","3",1992,"","26/5/92","","",NA,NA,1992-05-26,NA,NA,NA,NA,NA,NA,NA,NA
"923","GrenacheNoir","34","514S6","3",1994,"","26/5/94","","",NA,NA,1994-05-26,NA,NA,NA,NA,NA,NA,NA,NA
"924","GrenacheNoir","34","514S6","3",1996,"","29/5/96","","",NA,NA,1996-05-29,NA,NA,NA,NA,NA,NA,NA,NA
"925","GrenacheNoir","34","514S6","3",1997,"","17/5/97","","",NA,NA,1997-05-17,NA,NA,NA,NA,NA,NA,NA,NA
"926","GrenacheNoir","34","514S6","3",1998,"","22/5/98","","",NA,NA,1998-05-22,NA,NA,NA,NA,NA,NA,NA,NA
"927","GrenacheNoir","34","514S6","3",1999,"","28/5/99","","",NA,NA,1999-05-28,NA,NA,NA,NA,NA,NA,NA,NA
"928","GrenacheNoir","34","514S6","3",2000,"","29/5/00","","",NA,NA,2000-05-29,NA,NA,NA,NA,NA,NA,NA,NA
"929","GrenacheNoir","34","514S6","3",1997,"12/3/1997","","","",NA,1997-03-12,NA,NA,NA,NA,NA,NA,NA,NA,NA
"930","GrenacheNoir","34","514S6","3",1998,"31/3/98","","","",NA,1998-03-31,NA,NA,NA,NA,NA,NA,NA,NA,NA
"931","GrenacheNoir","34","514S7 ","4",1956,"2/4/1956","","","17/9/56",NA,1956-04-02,NA,NA,1956-09-17,NA,168,NA,NA,NA,NA
"932","GrenacheNoir","34","514S7","4",1957,"19/3/57","","","1/10/1957",NA,1957-03-19,NA,NA,1957-10-01,NA,196,NA,NA,NA,NA
"933","GrenacheNoir","34","514S7","4",1958,"14/3/58","","","3/9/1958",NA,1958-03-14,NA,NA,1958-09-03,NA,173,NA,NA,NA,NA
"934","GrenacheNoir","34","514S7","4",1959,"","","","31/8/59",NA,NA,NA,NA,1959-08-31,NA,NA,NA,NA,NA,NA
"935","GrenacheNoir","34","514S7","4",1960,"","","","31/8/60",NA,NA,NA,NA,1960-08-31,NA,NA,NA,NA,NA,NA
"936","GrenacheNoir","34","514S7","4",1976,"","","5/8/1976","",NA,NA,NA,1976-08-05,NA,NA,NA,NA,NA,NA,NA
"937","GrenacheNoir","34","514S7","4",1977,"","","16/8/77","",NA,NA,NA,1977-08-16,NA,NA,NA,NA,NA,NA,NA
"938","GrenacheNoir","34","514S7","4",1978,"","","16/8/78","",NA,NA,NA,1978-08-16,NA,NA,NA,NA,NA,NA,NA
"939","GrenacheNoir","34","514S7","4",1987,"","7/6/1987","","",NA,NA,1987-06-07,NA,NA,NA,NA,NA,NA,NA,NA
"940","GrenacheNoir","34","514S7","4",1988,"","1/6/1988","","",NA,NA,1988-06-01,NA,NA,NA,NA,NA,NA,NA,NA
"941","GrenacheNoir","34","514S7","4",1989,"","26/5/89","","",NA,NA,1989-05-26,NA,NA,NA,NA,NA,NA,NA,NA
"942","GrenacheNoir","34","514S7","4",1990,"","23/5/90","","",NA,NA,1990-05-23,NA,NA,NA,NA,NA,NA,NA,NA
"943","GrenacheNoir","34","514S7","4",1991,"","3/6/1991","","",NA,NA,1991-06-03,NA,NA,NA,NA,NA,NA,NA,NA
"944","GrenacheNoir","34","514S7","4",1992,"","26/5/92","","",NA,NA,1992-05-26,NA,NA,NA,NA,NA,NA,NA,NA
"945","GrenacheNoir","34","514S7","4",1994,"","26/5/94","","",NA,NA,1994-05-26,NA,NA,NA,NA,NA,NA,NA,NA
"946","GrenacheNoir","34","514S7","4",1995,"","29/5/95","","",NA,NA,1995-05-29,NA,NA,NA,NA,NA,NA,NA,NA
"947","GrenacheNoir","34","514S7","4",1999,"","25/5/99","","",NA,NA,1999-05-25,NA,NA,NA,NA,NA,NA,NA,NA
"948","GrenacheNoir","34","514S7","4",2000,"","29/5/00","","",NA,NA,2000-05-29,NA,NA,NA,NA,NA,NA,NA,NA
"949","GrenacheNoir","34","514S7","4",1998,"12/3/1998","","","",NA,1998-03-12,NA,NA,NA,NA,NA,NA,NA,NA,NA
"950","GrenacheNoir","34","514S7","4",1999,"31/2/99","","","",NA,NA,NA,NA,NA,NA,NA,NA,NA,NA,NA
"951","GrenacheNoir","34","514S7","4",1987,"","","","14/9/87",NA,NA,NA,NA,1987-09-14,NA,NA,NA,NA,NA,NA
"952","GrenacheNoir","34","514S7","4",1988,"","","","28/8/88",NA,NA,NA,NA,1988-08-28,NA,NA,NA,NA,NA,NA
"953","GrenacheNoir","34","514S7","4",1989,"","","","19/9/89",NA,NA,NA,NA,1989-09-19,NA,NA,NA,NA,NA,NA
"954","GrenacheNoir","34","7A98 ","5",1956,"3/4/1956","","","17/9/56",NA,1956-04-03,NA,NA,1956-09-17,NA,167,NA,NA,NA,NA
"955","GrenacheNoir","34","7A98","5",1957,"18/3/57","","","23/9/57",NA,1957-03-18,NA,NA,1957-09-23,NA,189,NA,NA,NA,NA
"956","GrenacheNoir","34","7A98","5",1958,"1/4/1958","","","3/9/1958",NA,1958-04-01,NA,NA,1958-09-03,NA,155,NA,NA,NA,NA
"957","GrenacheNoir","34","7A98","5",1959,"","","","31/8/59",NA,NA,NA,NA,1959-08-31,NA,NA,NA,NA,NA,NA
"958","GrenacheNoir","34","514S8","6",1956,"3/4/1956","","","17/9/56",NA,1956-04-03,NA,NA,1956-09-17,NA,167,NA,NA,NA,NA
"959","GrenacheNoir","34","514S8","6",1957,"17/3/57","","","23/9/57",NA,1957-03-17,NA,NA,1957-09-23,NA,190,NA,NA,NA,NA
"960","GrenacheNoir","34","514S8","6",1958,"29/3/58","","","3/9/1958",NA,1958-03-29,NA,NA,1958-09-03,NA,158,NA,NA,NA,NA
"961","GrenacheNoir","34","514S8","6",1959,"","","","7/9/1959",NA,NA,NA,NA,1959-09-07,NA,NA,NA,NA,NA,NA
"962","GrenacheNoir","34","514S8","6",1960,"","","","1/9/1960",NA,NA,NA,NA,1960-09-01,NA,NA,NA,NA,NA,NA
"963","GrenacheNoir","34","514S8","6",1961,"","","","31/8/61",NA,NA,NA,NA,1961-08-31,NA,NA,NA,NA,NA,NA
"964","GrenacheNoir","34","514S8","6",1962,"","","","31/8/62",NA,NA,NA,NA,1962-08-31,NA,NA,NA,NA,NA,NA
"965","GrenacheNoir","34","514S8","6",1963,"","","","31/8/63",NA,NA,NA,NA,1963-08-31,NA,NA,NA,NA,NA,NA
"966","GrenacheNoir","34","514S8","6",1964,"","","","4/9/1964",NA,NA,NA,NA,1964-09-04,NA,NA,NA,NA,NA,NA
"967","GrenacheNoir","34","514S8","6",1976,"","","9/8/1976","",NA,NA,NA,1976-08-09,NA,NA,NA,NA,NA,NA,NA
"968","GrenacheNoir","34","514S8","6",1977,"","","22/8/77","",NA,NA,NA,1977-08-22,NA,NA,NA,NA,NA,NA,NA
"969","GrenacheNoir","34","514S8","6",1978,"","","16/8/78","",NA,NA,NA,1978-08-16,NA,NA,NA,NA,NA,NA,NA
"970","GrenacheNoir","34","514S8","6",1987,"","7/6/1987","","21/9/87",NA,NA,1987-06-07,NA,1987-09-21,NA,NA,NA,NA,NA,NA
"971","GrenacheNoir","34","514S8","6",1988,"28/3/88","1/6/1988","","19/9/88",NA,1988-03-28,1988-06-01,NA,1988-09-19,NA,175,65,NA,NA,NA
"972","GrenacheNoir","34","514S8","6",1989,"20/3/89","29/5/89","","4/9/1989",NA,1989-03-20,1989-05-29,NA,1989-09-04,NA,168,70,NA,NA,NA
"973","GrenacheNoir","34","514S8","6",1990,"","23/5/90","","",NA,NA,1990-05-23,NA,NA,NA,NA,NA,NA,NA,NA
"974","GrenacheNoir","34","514S8","6",1991,"","3/6/1991","","",NA,NA,1991-06-03,NA,NA,NA,NA,NA,NA,NA,NA
"975","GrenacheNoir","34","514S8","6",1992,"","26/5/92","","",NA,NA,1992-05-26,NA,NA,NA,NA,NA,NA,NA,NA
"976","GrenacheNoir","34","514S8","6",1994,"","26/5/94","","",NA,NA,1994-05-26,NA,NA,NA,NA,NA,NA,NA,NA
"977","GrenacheNoir","34","514S8","6",1995,"23/3/95","2/6/1995","","",NA,1995-03-23,1995-06-02,NA,NA,NA,NA,71,NA,NA,NA
"978","GrenacheNoir","34","514S8","6",1996,"","29/5/96","","",NA,NA,1996-05-29,NA,NA,NA,NA,NA,NA,NA,NA
"979","GrenacheNoir","34","514S8","6",1997,"7/3/1997","27/5/97","","",NA,1997-03-07,1997-05-27,NA,NA,NA,NA,81,NA,NA,NA
"980","GrenacheNoir","34","514S8","6",1998,"21/3/98","27/5/98","","",NA,1998-03-21,1998-05-27,NA,NA,NA,NA,67,NA,NA,NA
"981","GrenacheNoir","34","514S8","6",1999,"21/3/99","27/5/99","","",NA,1999-03-21,1999-05-27,NA,NA,NA,NA,67,NA,NA,NA
"982","GrenacheNoir","34","514S8","6",2000,"28/3/00","2/6/2000","","",NA,2000-03-28,2000-06-02,NA,NA,NA,NA,66,NA,NA,NA
"983","GrenacheNoir","34","7A100 ","7",1956,"2/4/1956","","","17/9/56",NA,1956-04-02,NA,NA,1956-09-17,NA,168,NA,NA,NA,NA
"984","GrenacheNoir","34","7A100","7",1957,"12/3/1957","","","16/9/57",NA,1957-03-12,NA,NA,1957-09-16,NA,188,NA,NA,NA,NA
"985","GrenacheNoir","34","7A100","7",1958,"29/3/58","","","3/9/1958",NA,1958-03-29,NA,NA,1958-09-03,NA,158,NA,NA,NA,NA
"986","GrenacheNoir","34","7A101","8",1956,"2/4/1956","","","24/9/56",NA,1956-04-02,NA,NA,1956-09-24,NA,175,NA,NA,NA,NA
"987","GrenacheNoir","34","7A101","8",1957,"12/3/1957","","","23/9/57",NA,1957-03-12,NA,NA,1957-09-23,NA,195,NA,NA,NA,NA
"988","GrenacheNoir","34","7A101","8",1958,"29/3/58","","","10/9/1958",NA,1958-03-29,NA,NA,1958-09-10,NA,165,NA,NA,NA,NA
"989","GrenacheNoir","34","7A102 ","9",1956,"2/4/1956","","","24/9/56",NA,1956-04-02,NA,NA,1956-09-24,NA,175,NA,NA,NA,NA
"990","GrenacheNoir","34","7A102","9",1957,"21/3/57","","","16/9/57",NA,1957-03-21,NA,NA,1957-09-16,NA,179,NA,NA,NA,NA
"991","GrenacheNoir","34","7A102","9",1958,"2/4/1958","","","10/9/1958",NA,1958-04-02,NA,NA,1958-09-10,NA,161,NA,NA,NA,NA
"992","GrenacheNoir","34","514S9 -10","10",1956,"3/4/1956","","","4/9/1956",NA,1956-04-03,NA,NA,1956-09-04,NA,154,NA,NA,NA,NA
"993","GrenacheNoir","34","514S9","10",1957,"15/3/57","","","24/9/57",NA,1957-03-15,NA,NA,1957-09-24,NA,193,NA,NA,NA,NA
"994","GrenacheNoir","34","514S9","10",1958,"31/3/58","","","16/9/58",NA,1958-03-31,NA,NA,1958-09-16,NA,169,NA,NA,NA,NA
"995","GrenacheNoir","34","514S9","10",1959,"","","","10/9/1959",NA,NA,NA,NA,1959-09-10,NA,NA,NA,NA,NA,NA
"996","GrenacheNoir","34","514S9","10",1960,"","","","1/9/1960",NA,NA,NA,NA,1960-09-01,NA,NA,NA,NA,NA,NA
"997","GrenacheNoir","34","514S9","10",1961,"","","","31/8/61",NA,NA,NA,NA,1961-08-31,NA,NA,NA,NA,NA,NA
"998","GrenacheNoir","34","514S9","10",1962,"","","","31/8/62",NA,NA,NA,NA,1962-08-31,NA,NA,NA,NA,NA,NA
"999","GrenacheNoir","34","514S9","10",1976,"","","12/8/1976","",NA,NA,NA,1976-08-12,NA,NA,NA,NA,NA,NA,NA
"1000","GrenacheNoir","34","514S9","10",1977,"","","19/8/77","",NA,NA,NA,1977-08-19,NA,NA,NA,NA,NA,NA,NA
"1001","GrenacheNoir","34","514S9","10",1978,"","","16/8/78","",NA,NA,NA,1978-08-16,NA,NA,NA,NA,NA,NA,NA
"1002","GrenacheNoir","34","514S9","10",1987,"","8/6/1987","","14/9/87",NA,NA,1987-06-08,NA,1987-09-14,NA,NA,NA,NA,NA,NA
"1003","GrenacheNoir","34","514S9","10",1988,"30/3/88","3/6/1988","","19/9/88",NA,1988-03-30,1988-06-03,NA,1988-09-19,NA,173,65,NA,NA,NA
"1004","GrenacheNoir","34","514S9","10",1989,"20/3/89","29/5/89","","11/9/1989",NA,1989-03-20,1989-05-29,NA,1989-09-11,NA,175,70,NA,NA,NA
"1005","GrenacheNoir","34","514S9","10",1990,"","23/5/90","","",NA,NA,1990-05-23,NA,NA,NA,NA,NA,NA,NA,NA
"1006","GrenacheNoir","34","514S9","10",1991,"","6/6/1991","","",NA,NA,1991-06-06,NA,NA,NA,NA,NA,NA,NA,NA
"1007","GrenacheNoir","34","514S9","10",1992,"","26/5/92","","",NA,NA,1992-05-26,NA,NA,NA,NA,NA,NA,NA,NA
"1008","GrenacheNoir","34","514S9","10",1994,"","26/5/94","","",NA,NA,1994-05-26,NA,NA,NA,NA,NA,NA,NA,NA
"1009","GrenacheNoir","34","514S9","10",1995,"30/3/95","2/6/1995","","",NA,1995-03-30,1995-06-02,NA,NA,NA,NA,64,NA,NA,NA
"1010","GrenacheNoir","34","514S9","10",1996,"","29/5/96","","",NA,NA,1996-05-29,NA,NA,NA,NA,NA,NA,NA,NA
"1011","GrenacheNoir","34","514S9","10",1997,"9/3/1997","12/5/1997","","",NA,1997-03-09,1997-05-12,NA,NA,NA,NA,64,NA,NA,NA
"1012","GrenacheNoir","34","514S9","10",1998,"21/3/98","27/5/98","","",NA,1998-03-21,1998-05-27,NA,NA,NA,NA,67,NA,NA,NA
"1013","GrenacheNoir","34","514S9","10",1999,"2/4/1999","28/5/99","","",NA,1999-04-02,1999-05-28,NA,NA,NA,NA,56,NA,NA,NA
"1014","GrenacheNoir","34","514S9","10",2000,"","2/6/2000","","",NA,NA,2000-06-02,NA,NA,NA,NA,NA,NA,NA,NA
"1015","GrenacheNoir","34","7S55 -11","11",1956,"2/4/1956","","","17/9/56",NA,1956-04-02,NA,NA,1956-09-17,NA,168,NA,NA,NA,NA
"1016","GrenacheNoir","34","7S55","11",1957,"15/3/57","","","9/9/1957",NA,1957-03-15,NA,NA,1957-09-09,NA,178,NA,NA,NA,NA
"1017","GrenacheNoir","34","7S55","11",1958,"20/3/58","","","3/9/1956",NA,1958-03-20,NA,NA,1956-09-03,NA,-563,NA,NA,NA,NA
"1018","GrenacheNoir","34","cl4P2A2 -12","12",1958,"","","","5/9/1958",NA,NA,NA,NA,1958-09-05,NA,NA,NA,NA,NA,NA
"1019","GrenacheNoir","34","cl4P2A2","12",1959,"","","","12/9/1959",NA,NA,NA,NA,1959-09-12,NA,NA,NA,NA,NA,NA
"1020","GrenacheNoir","34","cl4P2A2","12",1960,"","","","16/8/60",NA,NA,NA,NA,1960-08-16,NA,NA,NA,NA,NA,NA
"1021","GrenacheNoir","34","cl4P2A2","12",1961,"","","","2/9/1961",NA,NA,NA,NA,1961-09-02,NA,NA,NA,NA,NA,NA
"1022","GrenacheNoir","34","cl4P2A2","12",1962,"","","","10/9/1962",NA,NA,NA,NA,1962-09-10,NA,NA,NA,NA,NA,NA
"1023","GrenacheNoir","34","11S149 -13","13",1957,"","","","10/9/1957",NA,NA,NA,NA,1957-09-10,NA,NA,NA,NA,NA,NA
"1024","GrenacheNoir","34","11S149","13",1958,"","","","4/9/1958",NA,NA,NA,NA,1958-09-04,NA,NA,NA,NA,NA,NA
"1025","GrenacheNoir","34","11S149","13",1959,"","","","31/8/59",NA,NA,NA,NA,1959-08-31,NA,NA,NA,NA,NA,NA
"1026","GrenacheNoir","34","11S149","13",1976,"","","5/8/1976","",NA,NA,NA,1976-08-05,NA,NA,NA,NA,NA,NA,NA
"1027","GrenacheNoir","34","11S149","13",1977,"","","22/8/77","",NA,NA,NA,1977-08-22,NA,NA,NA,NA,NA,NA,NA
"1028","GrenacheNoir","34","11S149","13",1978,"","","16/8/78","",NA,NA,NA,1978-08-16,NA,NA,NA,NA,NA,NA,NA
"1029","GrenacheNoir","34","11S149","13",1987,"","7/6/1987","","7/9/1987",NA,NA,1987-06-07,NA,1987-09-07,NA,NA,NA,NA,NA,NA
"1030","GrenacheNoir","34","11S149","13",1988,"","3/6/1988","","12/9/1988",NA,NA,1988-06-03,NA,1988-09-12,NA,NA,NA,NA,NA,NA
"1031","GrenacheNoir","34","8S78 -14","14",1956,"","","","24/9/56",NA,NA,NA,NA,1956-09-24,NA,NA,NA,NA,NA,NA
"1032","GrenacheNoir","34","8S78","14",1957,"","","","10/9/1957",NA,NA,NA,NA,1957-09-10,NA,NA,NA,NA,NA,NA
"1033","GrenacheNoir","34","8S78","14",1959,"","","","25/8/59",NA,NA,NA,NA,1959-08-25,NA,NA,NA,NA,NA,NA
"1034","GrenacheNoir","34","16A144 -15","15",1956,"","","","24/9/56",NA,NA,NA,NA,1956-09-24,NA,NA,NA,NA,NA,NA
"1035","GrenacheNoir","34","16A144","15",1957,"","","","2/9/1957",NA,NA,NA,NA,1957-09-02,NA,NA,NA,NA,NA,NA
"1036","GrenacheNoir","34","16A144","15",1958,"","","","5/9/1958",NA,NA,NA,NA,1958-09-05,NA,NA,NA,NA,NA,NA
"1037","GrenacheNoir","34","16A145 -16","16",1956,"","","","24/9/56",NA,NA,NA,NA,1956-09-24,NA,NA,NA,NA,NA,NA
"1038","GrenacheNoir","34","16A145","16",1957,"","","","17/9/57",NA,NA,NA,NA,1957-09-17,NA,NA,NA,NA,NA,NA
"1039","GrenacheNoir","34","16A145","16",1958,"","","","5/9/1958",NA,NA,NA,NA,1958-09-05,NA,NA,NA,NA,NA,NA
"1040","GrenacheNoir","34","cl12P11S1 -17","17",1958,"","","","31/8/58",NA,NA,NA,NA,1958-08-31,NA,NA,NA,NA,NA,NA
"1041","GrenacheNoir","34","cl12P11S1","17",1959,"","","","5/9/1959",NA,NA,NA,NA,1959-09-05,NA,NA,NA,NA,NA,NA
"1042","GrenacheNoir","34","cl12P11S1","17",1960,"","","","11/9/1960",NA,NA,NA,NA,1960-09-11,NA,NA,NA,NA,NA,NA
"1043","GrenacheNoir","34","16A151 -18","18",1956,"","","","24/9/56",NA,NA,NA,NA,1956-09-24,NA,NA,NA,NA,NA,NA
"1044","GrenacheNoir","34","16A151","18",1957,"","","","25/9/57",NA,NA,NA,NA,1957-09-25,NA,NA,NA,NA,NA,NA
"1045","GrenacheNoir","34","16A151","18",1958,"","","","5/9/1958",NA,NA,NA,NA,1958-09-05,NA,NA,NA,NA,NA,NA
"1046","GrenacheNoir","34","16A151","18",1959,"","","","25/8/59",NA,NA,NA,NA,1959-08-25,NA,NA,NA,NA,NA,NA
"1047","GrenacheNoir","34","16A151","18",1960,"","","","31/8/60",NA,NA,NA,NA,1960-08-31,NA,NA,NA,NA,NA,NA
"1048","GrenacheNoir","34","16A151","18",1961,"","","","21/8/61",NA,NA,NA,NA,1961-08-21,NA,NA,NA,NA,NA,NA
"1049","GrenacheNoir","34","16A151","18",1962,"","","","30/9/62",NA,NA,NA,NA,1962-09-30,NA,NA,NA,NA,NA,NA
"1050","GrenacheNoir","34","913A2 -21","21",1960,"","","","5/9/1960",NA,NA,NA,NA,1960-09-05,NA,NA,NA,NA,NA,NA
"1051","GrenacheNoir","34","913A2","21",1961,"","","","11/9/1961",NA,NA,NA,NA,1961-09-11,NA,NA,NA,NA,NA,NA
"1052","GrenacheNoir","34","913A2","21",1976,"","","6/8/1976","",NA,NA,NA,1976-08-06,NA,NA,NA,NA,NA,NA,NA
"1053","GrenacheNoir","34","913A2","21",1977,"","","22/8/1977","",NA,NA,NA,1977-08-22,NA,NA,NA,NA,NA,NA,NA
"1054","GrenacheNoir","34","913A2","21",1978,"","","22/8/1978","",NA,NA,NA,1978-08-22,NA,NA,NA,NA,NA,NA,NA
"1055","GrenacheNoir","34","913A2","21",1988,"","30/5/88","","19/9/88",NA,NA,1988-05-30,NA,1988-09-19,NA,NA,NA,NA,NA,NA
"1056","GrenacheNoir","34","1011S7 ","22",1963,"","","","10/9/1963",NA,NA,NA,NA,1963-09-10,NA,NA,NA,NA,NA,NA
"1057","GrenacheNoir","34","1011S7","22",1964,"","","","27/8/64",NA,NA,NA,NA,1964-08-27,NA,NA,NA,NA,NA,NA
"1058","GrenacheNoir","34","1011S7","22",1965,"","","","7/9/1965",NA,NA,NA,NA,1965-09-07,NA,NA,NA,NA,NA,NA
"1059","GrenacheNoir","34","721A11 ","23",1981,"","","","14/9/81",NA,NA,NA,NA,1981-09-14,NA,NA,NA,NA,NA,NA
"1060","GrenacheNoir","34","721A11","23",1983,"","","","13/9/83",NA,NA,NA,NA,1983-09-13,NA,NA,NA,NA,NA,NA
"1061","GrenacheNoir","34","721A11","23",1984,"","","","24/9/84",NA,NA,NA,NA,1984-09-24,NA,NA,NA,NA,NA,NA
"1062","GrenacheNoir","34","721A11","23",1994,"","25/5/94","","",NA,NA,1994-05-25,NA,NA,NA,NA,NA,NA,NA,NA
"1063","GrenacheNoir","34","721A11","23",1995,"","27/5/95","","",NA,NA,1995-05-27,NA,NA,NA,NA,NA,NA,NA,NA
"1064","GrenacheNoir","34","721A12 ","24",1981,"","","","14/9/81",NA,NA,NA,NA,1981-09-14,NA,NA,NA,NA,NA,NA
"1065","GrenacheNoir","34","721A12","24",1983,"","","","13/9/83",NA,NA,NA,NA,1983-09-13,NA,NA,NA,NA,NA,NA
"1066","GrenacheNoir","34","721A12","24",1984,"","","","24/9/84",NA,NA,NA,NA,1984-09-24,NA,NA,NA,NA,NA,NA
"1067","GrenacheNoir","34","721A12","24",1994,"","25/5/94","","",NA,NA,1994-05-25,NA,NA,NA,NA,NA,NA,NA,NA
"1068","GrenacheNoir","34","721A12","24",1995,"","30/5/95","","",NA,NA,1995-05-30,NA,NA,NA,NA,NA,NA,NA,NA
"1069","GrenacheNoir","34","416A2 ","25",1979,"","","","5/9/1979",NA,NA,NA,NA,1979-09-05,NA,NA,NA,NA,NA,NA
"1070","GrenacheNoir","34","416A2","25",1980,"","","25/8/80","23/9/80",NA,NA,NA,1980-08-25,1980-09-23,NA,NA,NA,NA,29,NA
"1071","GrenacheNoir","34","416A2","25",1981,"","","17/8/81","8/9/1981",NA,NA,NA,1981-08-17,1981-09-08,NA,NA,NA,NA,22,NA
"1072","GrenacheNoir","34","416A2","25",1982,"","","2/8/1982","",NA,NA,NA,1982-08-02,NA,NA,NA,NA,NA,NA,NA
"1073","GrenacheNoir","34","711s366370 -26","26",1989,"","28/5/89","","4/9/1989",NA,NA,1989-05-28,NA,1989-09-04,NA,NA,NA,NA,NA,NA
"1074","GrenacheNoir","34","711s366370","26",1990,"","23/5/90","","10/9/1990",NA,NA,1990-05-23,NA,1990-09-10,NA,NA,NA,NA,NA,NA
"1075","GrenacheNoir","34","711s366370","26",1991,"","8/6/1991","","23/9/91",NA,NA,1991-06-08,NA,1991-09-23,NA,NA,NA,NA,NA,NA
"1076","Aleatico","109","11A9 ","1",1956,"26/6/56","","","28/8/56",NA,1956-06-26,NA,NA,1956-08-28,NA,63,NA,NA,NA,NA
"1077","Aleatico","109","11A9 ","1",1957,"12/3/1957","","","13/8/57",NA,1957-03-12,NA,NA,1957-08-13,NA,154,NA,NA,NA,NA
"1078","Aleatico","109","11A9","1",1958,"27/3/58","","","18/8/58",NA,1958-03-27,NA,NA,1958-08-18,NA,144,NA,NA,NA,NA
"1079","Aleatico","109","11A9","1",1959,"","","","",NA,NA,NA,NA,NA,NA,NA,NA,NA,NA,NA
"1080","Aleatico","109","11A9","1",1960,"","","","",NA,NA,NA,NA,NA,NA,NA,NA,NA,NA,NA
"1081","Aleatico","109","11A9","1",1961,"","","","",NA,NA,NA,NA,NA,NA,NA,NA,NA,NA,NA
"1082","Aleatico","109","520A1","2",1956,"28/3/56","26/5/56","","10/9/1956",NA,1956-03-28,1956-05-26,NA,1956-09-10,NA,166,59,NA,NA,NA
"1083","Aleatico","109","520A1","2",1957,"16/3/57","2/6/1957","","27/8/57",NA,1957-03-16,1957-06-02,NA,1957-08-27,NA,164,78,NA,NA,NA
"1084","Aleatico","109","520A1","2",1958,"22/3/58","","","13/8/58",NA,1958-03-22,NA,NA,1958-08-13,NA,144,NA,NA,NA,NA
"1085","Aleatico","109","520A1","2",1959,"26/3/59","","","8/8/1959",NA,1959-03-26,NA,NA,1959-08-08,NA,135,NA,NA,NA,NA
"1086","Aleatico","109","520A1","2",1960,"15/3/60","","","",NA,1960-03-15,NA,NA,NA,NA,NA,NA,NA,NA,NA
"1087","Aleatico","109","520A1","2",1961,"","","","",NA,NA,NA,NA,NA,NA,NA,NA,NA,NA,NA
"1088","Aleatico","109","520A1","2",1976,"","","5/8/1976","",NA,NA,NA,1976-08-05,NA,NA,NA,NA,NA,NA,NA
"1089","Aleatico","109","520A1","2",1977,"","","16/8/77","",NA,NA,NA,1977-08-16,NA,NA,NA,NA,NA,NA,NA
"1090","Aleatico","109","520A1","2",1978,"","","16/8/78","",NA,NA,NA,1978-08-16,NA,NA,NA,NA,NA,NA,NA
"1091","Aleatico","109","1216S4","3",1956,"","","","",NA,NA,NA,NA,NA,NA,NA,NA,NA,NA,NA
"1092","Aleatico","109","1216S4","3",1957,"","","","",NA,NA,NA,NA,NA,NA,NA,NA,NA,NA,NA
"1093","Aleatico","109","1216S4","3",1958,"20/3/58","","","",NA,1958-03-20,NA,NA,NA,NA,NA,NA,NA,NA,NA
"1094","Aleatico","109","1216S4","3",1959,"18/3/59","","","7/9/1959",NA,1959-03-18,NA,NA,1959-09-07,NA,173,NA,NA,NA,NA
"1095","Aleatico","109","1216S4","3",1960,"16/3/60","","","29/8/60",NA,1960-03-16,NA,NA,1960-08-29,NA,166,NA,NA,NA,NA
"1096","Aleatico","109","1216S4","3",1961,"5/3/1961","","","21/8/61",NA,1961-03-05,NA,NA,1961-08-21,NA,169,NA,NA,NA,NA
"1097","Aleatico","109","1219A1","4",1970,"26/3/70","","","",NA,1970-03-26,NA,NA,NA,NA,NA,NA,NA,NA,NA
"1098","Aleatico","109","1219A1","4",1971,"","","","",NA,NA,NA,NA,NA,NA,NA,NA,NA,NA,NA
"1099","Aleatico","109","1219A1","4",1972,"24/3/72","","","5/9/1972",NA,1972-03-24,NA,NA,1972-09-05,NA,165,NA,NA,NA,NA
"1100","Aleatico","109","1219A1","4",1973,"7/4/1973","","","27/8/73",NA,1973-04-07,NA,NA,1973-08-27,NA,142,NA,NA,NA,NA
"1101","Aleatico","109","1219A1","4",1974,"","","","29/8/74",NA,NA,NA,NA,1974-08-29,NA,NA,NA,NA,NA,NA
"1102","Aleatico","109","1219A1","4",1976,"","","2/8/1976","",NA,NA,NA,1976-08-02,NA,NA,NA,NA,NA,NA,NA
"1103","Aleatico","109","1219A1","4",1977,"","","9/8/1977","",NA,NA,NA,1977-08-09,NA,NA,NA,NA,NA,NA,NA
"1104","Aleatico","109","1219A1","4",1978,"","","17/8/78","",NA,NA,NA,1978-08-17,NA,NA,NA,NA,NA,NA,NA
"1105","Aleatico","109","1219A2","5",1970,"","","","",NA,NA,NA,NA,NA,NA,NA,NA,NA,NA,NA
"1106","Aleatico","109","1219A2","5",1971,"1/4/1971","","","23/8/71",NA,1971-04-01,NA,NA,1971-08-23,NA,144,NA,NA,NA,NA
"1107","Aleatico","109","1219A2","5",1972,"17/3/72","","","",NA,1972-03-17,NA,NA,NA,NA,NA,NA,NA,NA,NA
"1108","Aleatico","109","1219A2","5",1973,"2/4/1973","","","21/8/73",NA,1973-04-02,NA,NA,1973-08-21,NA,141,NA,NA,NA,NA
"1109","Aleatico","109","1219A2","5",1974,"","","","29/8/74",NA,NA,NA,NA,1974-08-29,NA,NA,NA,NA,NA,NA
"1110","Aleatico","109","1219A2","5",1976,"","","8/8/1976","",NA,NA,NA,1976-08-08,NA,NA,NA,NA,NA,NA,NA
"1111","Aleatico","109","1219A2","5",1977,"","","16/8/77","",NA,NA,NA,1977-08-16,NA,NA,NA,NA,NA,NA,NA
"1112","Aleatico","109","1219A2","5",1978,"","","17/8/78","",NA,NA,NA,1978-08-17,NA,NA,NA,NA,NA,NA,NA
"1113","Aleatico","109","1219A3","6",1970,"25/3/70","26/5/70","","17/8/70",NA,1970-03-25,1970-05-26,NA,1970-08-17,NA,145,62,NA,NA,NA
"1114","Aleatico","109","1219A3","6",1971,"29/3/71","1/6/1971","","23/8/71",NA,1971-03-29,1971-06-01,NA,1971-08-23,NA,147,64,NA,NA,NA
"1115","Aleatico","109","1219A3","6",1972,"28/3/72","","","5/9/1972",NA,1972-03-28,NA,NA,1972-09-05,NA,161,NA,NA,NA,NA
"1116","Aleatico","109","1219A3","6",1973,"","","","",NA,NA,NA,NA,NA,NA,NA,NA,NA,NA,NA
"1117","Aleatico","109","1219A3","6",1974,"","","","",NA,NA,NA,NA,NA,NA,NA,NA,NA,NA,NA
"1118","Aleatico","109","1219A3","6",1976,"","","2/8/1976","",NA,NA,NA,1976-08-02,NA,NA,NA,NA,NA,NA,NA
"1119","Aleatico","109","1219A3","6",1977,"","","9/8/1977","",NA,NA,NA,1977-08-09,NA,NA,NA,NA,NA,NA,NA
"1120","Aleatico","109","1219A3","6",1978,"","","17/8/78","",NA,NA,NA,1978-08-17,NA,NA,NA,NA,NA,NA,NA
"1121","Aleatico","109","1219A5","7",1970,"","","","30/8/70",NA,NA,NA,NA,1970-08-30,NA,NA,NA,NA,NA,NA
"1122","Aleatico","109","1219A5","7",1971,"","","","",NA,NA,NA,NA,NA,NA,NA,NA,NA,NA,NA
"1123","Aleatico","109","1219A5","7",1972,"","","","21/8/72",NA,NA,NA,NA,1972-08-21,NA,NA,NA,NA,NA,NA
"1124","Aleatico","109","1219A5","7",1973,"20/3/73","","","29/8/73",NA,1973-03-20,NA,NA,1973-08-29,NA,162,NA,NA,NA,NA
"1125","Aleatico","109","1219A5","7",1974,"27/3/74","","","",NA,1974-03-27,NA,NA,NA,NA,NA,NA,NA,NA,NA
"1126","Aleatico","109","1219A5","7",1975,"24/3/75","","","",NA,1975-03-24,NA,NA,NA,NA,NA,NA,NA,NA,NA
"1127","Aleatico","109","1219A5","7",1976,"","","8/8/1976","",NA,NA,NA,1976-08-08,NA,NA,NA,NA,NA,NA,NA
"1128","Aleatico","109","1219A5","7",1977,"","","9/8/1977","",NA,NA,NA,1977-08-09,NA,NA,NA,NA,NA,NA,NA
"1129","Aleatico","109","1219A5","7",1978,"","","19/8/78","",NA,NA,NA,1978-08-19,NA,NA,NA,NA,NA,NA,NA
"1130","Aleatico","109","1219A6","8",1970,"","","","",NA,NA,NA,NA,NA,NA,NA,NA,NA,NA,NA
"1131","Aleatico","109","1219A6","8",1971,"","","","",NA,NA,NA,NA,NA,NA,NA,NA,NA,NA,NA
"1132","Aleatico","109","1219A6","8",1972,"","","","",NA,NA,NA,NA,NA,NA,NA,NA,NA,NA,NA
"1133","Aleatico","109","1219A6","8",1973,"","","","",NA,NA,NA,NA,NA,NA,NA,NA,NA,NA,NA
"1134","Aleatico","109","1219A6","8",1974,"","","","",NA,NA,NA,NA,NA,NA,NA,NA,NA,NA,NA
"1135","Aleatico","109","1219A7","9",1970,"","","","",NA,NA,NA,NA,NA,NA,NA,NA,NA,NA,NA
"1136","Aleatico","109","1219A7","9",1971,"","","","",NA,NA,NA,NA,NA,NA,NA,NA,NA,NA,NA
"1137","Aleatico","109","1219A7","9",1972,"","","","",NA,NA,NA,NA,NA,NA,NA,NA,NA,NA,NA
"1138","Aleatico","109","1219A7","9",1973,"","","","",NA,NA,NA,NA,NA,NA,NA,NA,NA,NA,NA
"1139","Aleatico","109","1219A7","9",1974,"","","","",NA,NA,NA,NA,NA,NA,NA,NA,NA,NA,NA
"1140","Aleatico","109","1219A8","10",1972,"10/3/1972","","","",NA,1972-03-10,NA,NA,NA,NA,NA,NA,NA,NA,NA
"1141","Aleatico","109","1219A8","10",1976,"15/3/76","","9/8/1977","25/8/76",NA,1976-03-15,NA,1977-08-09,1976-08-25,NA,163,NA,NA,-349,512
"1142","Aleatico","109","1219A8","10",1977,"17/3/77","","17/8/78","17/8/77",NA,1977-03-17,NA,1978-08-17,1977-08-17,NA,153,NA,NA,-365,518
"1143","Aleatico","109","1219A8","10",1978,"","","","28/8/78",NA,NA,NA,NA,1978-08-28,NA,NA,NA,NA,NA,NA
"1144","Aleatico","109","1219A8","10",1979,"","","","",NA,NA,NA,NA,NA,NA,NA,NA,NA,NA,NA
"1145","Aleatico","109","1219A9","11",1970,"23/3/70","","","",NA,1970-03-23,NA,NA,NA,NA,NA,NA,NA,NA,NA
"1146","Aleatico","109","1219A9","11",1971,"2/4/1971","","","23/8/71",NA,1971-04-02,NA,NA,1971-08-23,NA,143,NA,NA,NA,NA
"1147","Aleatico","109","1219A9","11",1972,"24/3/72","","","28/8/72",NA,1972-03-24,NA,NA,1972-08-28,NA,157,NA,NA,NA,NA
"1148","Aleatico","109","1219A9","11",1973,"","","","",NA,NA,NA,NA,NA,NA,NA,NA,NA,NA,NA
"1149","Aleatico","109","1219A9","11",1974,"","","","",NA,NA,NA,NA,NA,NA,NA,NA,NA,NA,NA
"1150","Aleatico","109","1219A9","11",1976,"","","8/8/1976","",NA,NA,NA,1976-08-08,NA,NA,NA,NA,NA,NA,NA
"1151","Aleatico","109","1219A9","11",1977,"","","9/8/1977","",NA,NA,NA,1977-08-09,NA,NA,NA,NA,NA,NA,NA
"1152","Aleatico","109","1219A9","11",1978,"","","17/8/78","",NA,NA,NA,1978-08-17,NA,NA,NA,NA,NA,NA,NA
"1153","Aleatico","109","1219A9","11",1979,"","","","5/9/1979",NA,NA,NA,NA,1979-09-05,NA,NA,NA,NA,NA,NA
"1154","Aleatico","109","1219S1","12",1970,"","","","",NA,NA,NA,NA,NA,NA,NA,NA,NA,NA,NA
"1155","Aleatico","109","1219S1","12",1971,"","","","",NA,NA,NA,NA,NA,NA,NA,NA,NA,NA,NA
"1156","Aleatico","109","1219S1","12",1972,"23/3/72","","","28/8/72",NA,1972-03-23,NA,NA,1972-08-28,NA,158,NA,NA,NA,NA
"1157","Aleatico","109","1219S1","12",1973,"30/3/73","","","3/9/1973",NA,1973-03-30,NA,NA,1973-09-03,NA,157,NA,NA,NA,NA
"1158","Aleatico","109","1219S1","12",1974,"30/3/74","","","29/8/74",NA,1974-03-30,NA,NA,1974-08-29,NA,152,NA,NA,NA,NA
"1159","Aleatico","109","R3s386.390","13",1994,"3/3/1994","24/5/94","1/8/1994","5/9/1994",NA,1994-03-03,1994-05-24,1994-08-01,1994-09-05,NA,186,82,69,35,151
"1160","Aleatico","109","R3s386.390","13",1995,"13/3/95","","","",NA,1995-03-13,NA,NA,NA,NA,NA,NA,NA,NA,NA
"1161","Sciacarello","125","515S6","1",1958,"1/4/1958","","","",NA,1958-04-01,NA,NA,NA,NA,NA,NA,NA,NA,NA
"1162","Sciacarello","125","515S6","1",1959,"31/3/59","","","31/8/59",NA,1959-03-31,NA,NA,1959-08-31,NA,153,NA,NA,NA,NA
"1163","Sciacarello","125","515S6","1",1960,"23/3/60","","","12/9/1960",NA,1960-03-23,NA,NA,1960-09-12,NA,173,NA,NA,NA,NA
"1164","Sciacarello","125","515S6","1",1961,"18/3/61","","","2/9/1961",NA,1961-03-18,NA,NA,1961-09-02,NA,168,NA,NA,NA,NA
"1165","Sciacarello","125","515S6","1",1962,"","","","17/9/62",NA,NA,NA,NA,1962-09-17,NA,NA,NA,NA,NA,NA
"1166","Sciacarello","125","515S6","1",1963,"","","","16/9/63",NA,NA,NA,NA,1963-09-16,NA,NA,NA,NA,NA,NA
"1167","Sciacarello","125","515S6","1",1964,"","","","15/9/64",NA,NA,NA,NA,1964-09-15,NA,NA,NA,NA,NA,NA
"1168","Sciacarello","125","515S6","1",1976,"","","2/8/1976","",NA,NA,NA,1976-08-02,NA,NA,NA,NA,NA,NA,NA
"1169","Sciacarello","125","515S6","1",1977,"","","9/8/1977","",NA,NA,NA,1977-08-09,NA,NA,NA,NA,NA,NA,NA
"1170","Sciacarello","125","515S6","1",1978,"","","10/8/1978","",NA,NA,NA,1978-08-10,NA,NA,NA,NA,NA,NA,NA
"1171","Sciacarello","125","515S6","1",1995,"","30/5/95","","",NA,NA,1995-05-30,NA,NA,NA,NA,NA,NA,NA,NA
"1172","Sciacarello","125","515S6","1",1996,"","1/6/1996","","",NA,NA,1996-06-01,NA,NA,NA,NA,NA,NA,NA,NA
"1173","Sciacarello","125","515S7","2",1958,"2/4/1958","","","12/9/1958",NA,1958-04-02,NA,NA,1958-09-12,NA,163,NA,NA,NA,NA
"1174","Sciacarello","125","515S7","2",1959,"30/3/59","","","31/8/59",NA,1959-03-30,NA,NA,1959-08-31,NA,154,NA,NA,NA,NA
"1175","Sciacarello","125","515S7","2",1960,"17/3/60","","","12/9/1960",NA,1960-03-17,NA,NA,1960-09-12,NA,179,NA,NA,NA,NA
"1176","Sciacarello","125","515S7","2",1961,"18/3/61","","","2/9/1961",NA,1961-03-18,NA,NA,1961-09-02,NA,168,NA,NA,NA,NA
"1177","Sciacarello","125","515S7","2",1962,"","","","",NA,NA,NA,NA,NA,NA,NA,NA,NA,NA,NA
"1178","Sciacarello","125","515S7","2",1963,"","","","",NA,NA,NA,NA,NA,NA,NA,NA,NA,NA,NA
"1179","Sciacarello","125","515S7","2",1964,"","","","",NA,NA,NA,NA,NA,NA,NA,NA,NA,NA,NA
"1180","Sciacarello","125","1019A1","3",1958,"","","","",NA,NA,NA,NA,NA,NA,NA,NA,NA,NA,NA
"1181","Sciacarello","125","1019A1","3",1959,"","","","",NA,NA,NA,NA,NA,NA,NA,NA,NA,NA,NA
"1182","Sciacarello","125","1019A1","3",1960,"25/3/60","","","23/8/60",NA,1960-03-25,NA,NA,1960-08-23,NA,151,NA,NA,NA,NA
"1183","Sciacarello","125","1019A1","3",1961,"","","","21/8/61",NA,NA,NA,NA,1961-08-21,NA,NA,NA,NA,NA,NA
"1184","Sciacarello","125","1019A1","3",1962,"","","","",NA,NA,NA,NA,NA,NA,NA,NA,NA,NA,NA
"1185","Sciacarello","125","1019A1","3",1963,"","","","",NA,NA,NA,NA,NA,NA,NA,NA,NA,NA,NA
"1186","Sciacarello","125","1019A1","3",1964,"","","","",NA,NA,NA,NA,NA,NA,NA,NA,NA,NA,NA
"1187","Sciacarello","125","912A4","4",1958,"","","","",NA,NA,NA,NA,NA,NA,NA,NA,NA,NA,NA
"1188","Sciacarello","125","912A4","4",1959,"19/3/59","","","24/8/59",NA,1959-03-19,NA,NA,1959-08-24,NA,158,NA,NA,NA,NA
"1189","Sciacarello","125","912A4","4",1960,"21/3/60","","","18/8/60",NA,1960-03-21,NA,NA,1960-08-18,NA,150,NA,NA,NA,NA
"1190","Sciacarello","125","912A4","4",1961,"16/3/61","","","",NA,1961-03-16,NA,NA,NA,NA,NA,NA,NA,NA,NA
"1191","Sciacarello","125","912A4","4",1962,"","","","",NA,NA,NA,NA,NA,NA,NA,NA,NA,NA,NA
"1192","Sciacarello","125","912A4","4",1963,"","","","",NA,NA,NA,NA,NA,NA,NA,NA,NA,NA,NA
"1193","Sciacarello","125","912A4","4",1964,"","","","",NA,NA,NA,NA,NA,NA,NA,NA,NA,NA,NA
"1194","Sciacarello","125","912A4","4",1976,"","","6/8/1976","",NA,NA,NA,1976-08-06,NA,NA,NA,NA,NA,NA,NA
"1195","Sciacarello","125","912A4","4",1977,"","","12/8/1977","",NA,NA,NA,1977-08-12,NA,NA,NA,NA,NA,NA,NA
"1196","Sciacarello","125","912A4","4",1978,"","","30/7/78","",NA,NA,NA,1978-07-30,NA,NA,NA,NA,NA,NA,NA
"1197","Sciacarello","125","515A10","5",1958,"26/3/58","","","",NA,1958-03-26,NA,NA,NA,NA,NA,NA,NA,NA,NA
"1198","Sciacarello","125","515A10","5",1959,"28/3/59","","","7/9/1959",NA,1959-03-28,NA,NA,1959-09-07,NA,163,NA,NA,NA,NA
"1199","Sciacarello","125","515A10","5",1960,"17/3/60","","","16/8/60",NA,1960-03-17,NA,NA,1960-08-16,NA,152,NA,NA,NA,NA
"1200","Sciacarello","125","515A10","5",1961,"","","","28/8/61",NA,NA,NA,NA,1961-08-28,NA,NA,NA,NA,NA,NA
"1201","Sciacarello","125","515A10","5",1962,"9/4/1962","","","",NA,1962-04-09,NA,NA,NA,NA,NA,NA,NA,NA,NA
"1202","Sciacarello","125","515A10","5",1963,"","","","",NA,NA,NA,NA,NA,NA,NA,NA,NA,NA,NA
"1203","Sciacarello","125","515A10","5",1964,"","","","",NA,NA,NA,NA,NA,NA,NA,NA,NA,NA,NA
"1204","Sciacarello","125","412S3","6",1958,"27/3/58","","","",NA,1958-03-27,NA,NA,NA,NA,NA,NA,NA,NA,NA
"1205","Sciacarello","125","412S3","6",1959,"26/3/59","","","7/9/1959",NA,1959-03-26,NA,NA,1959-09-07,NA,165,NA,NA,NA,NA
"1206","Sciacarello","125","412S3","6",1960,"20/3/60","","","5/9/1960",NA,1960-03-20,NA,NA,1960-09-05,NA,169,NA,NA,NA,NA
"1207","Sciacarello","125","412S3","6",1961,"16/3/61","","","2/9/1961",NA,1961-03-16,NA,NA,1961-09-02,NA,170,NA,NA,NA,NA
"1208","Sciacarello","125","412S3","6",1962,"10/4/1962","","","10/9/1962",NA,1962-04-10,NA,NA,1962-09-10,NA,153,NA,NA,NA,NA
"1209","Sciacarello","125","412S3","6",1963,"","","","",NA,NA,NA,NA,NA,NA,NA,NA,NA,NA,NA
"1210","Sciacarello","125","412S3","6",1964,"","","","",NA,NA,NA,NA,NA,NA,NA,NA,NA,NA,NA
"1211","Sciacarello","125","412S3","6",1976,"","","2/8/1976","",NA,NA,NA,1976-08-02,NA,NA,NA,NA,NA,NA,NA
"1212","Sciacarello","125","412S3","6",1977,"","","8/8/1977","",NA,NA,NA,1977-08-08,NA,NA,NA,NA,NA,NA,NA
"1213","Sciacarello","125","412S3","6",1978,"","","10/8/1978","",NA,NA,NA,1978-08-10,NA,NA,NA,NA,NA,NA,NA
"1214","Sciacarello","125","1220S9","7",1968,"","","","",NA,NA,NA,NA,NA,NA,NA,NA,NA,NA,NA
"1215","Sciacarello","125","1220S9","7",1969,"","","","",NA,NA,NA,NA,NA,NA,NA,NA,NA,NA,NA
"1216","Sciacarello","125","1220S9","7",1970,"31/3/70","","","",NA,1970-03-31,NA,NA,NA,NA,NA,NA,NA,NA,NA
"1217","Sciacarello","125","1220S9","7",1971,"7/4/1971","","","14/9/71",NA,1971-04-07,NA,NA,1971-09-14,NA,160,NA,NA,NA,NA
"1218","Sciacarello","125","1220S9","7",1972,"27/3/72","","","5/9/1972",NA,1972-03-27,NA,NA,1972-09-05,NA,162,NA,NA,NA,NA
"1219","Sciacarello","125","1220S9","7",1973,"","","","3/9/1973",NA,NA,NA,NA,1973-09-03,NA,NA,NA,NA,NA,NA
"1220","Sciacarello","125","1220S9","7",1974,"","","","",NA,NA,NA,NA,NA,NA,NA,NA,NA,NA,NA
"1221","Sciacarello","125","1220S9","7",1975,"","","","",NA,NA,NA,NA,NA,NA,NA,NA,NA,NA,NA
"1222","Sciacarello","125","1220S9","7",1976,"","","8/8/1976","",NA,NA,NA,1976-08-08,NA,NA,NA,NA,NA,NA,NA
"1223","Sciacarello","125","1220S9","7",1977,"","","16/8/1977","",NA,NA,NA,1977-08-16,NA,NA,NA,NA,NA,NA,NA
"1224","Sciacarello","125","1220S9","7",1978,"","","17/8/78","",NA,NA,NA,1978-08-17,NA,NA,NA,NA,NA,NA,NA
"1225","Sciacarello","125","1220S9","7",1979,"","","","",NA,NA,NA,NA,NA,NA,NA,NA,NA,NA,NA
"1226","Sciacarello","125","1220S9","7",1980,"","","","",NA,NA,NA,NA,NA,NA,NA,NA,NA,NA,NA
"1227","Sciacarello","125","1220S9","7",1981,"","","","",NA,NA,NA,NA,NA,NA,NA,NA,NA,NA,NA
"1228","Sciacarello","125","1220S9","7",1994,"","28/5/94","","",NA,NA,1994-05-28,NA,NA,NA,NA,NA,NA,NA,NA
"1229","Sciacarello","125","1221A1","8",1975,"24/3/75","","","26/8/75",NA,1975-03-24,NA,NA,1975-08-26,NA,155,NA,NA,NA,NA
"1230","Sciacarello","125","1221A1","8",1976,"","","","25/8/76",NA,NA,NA,NA,1976-08-25,NA,NA,NA,NA,NA,NA
"1231","Sciacarello","125","1221A1","8",1977,"13/3/77","","","",NA,1977-03-13,NA,NA,NA,NA,NA,NA,NA,NA,NA
"1232","Sciacarello","125","1221A1","8",1978,"23/3/78","","","",NA,1978-03-23,NA,NA,NA,NA,NA,NA,NA,NA,NA
"1233","Sciacarello","125","1221A1","8",1980,"","","","9/9/1980",NA,NA,NA,NA,1980-09-09,NA,NA,NA,NA,NA,NA
"1234","Sciacarello","125","1221A1","8",1983,"","","","",NA,NA,NA,NA,NA,NA,NA,NA,NA,NA,NA
"1235","Sciacarello","125","1221A1","8",1984,"","","","",NA,NA,NA,NA,NA,NA,NA,NA,NA,NA,NA
"1236","Sciacarello","125","1221A2","9",1975,"","","","",NA,NA,NA,NA,NA,NA,NA,NA,NA,NA,NA
"1237","Sciacarello","125","1221A2","9",1976,"","","","",NA,NA,NA,NA,NA,NA,NA,NA,NA,NA,NA
"1238","Sciacarello","125","1221A2","9",1978,"","","","",NA,NA,NA,NA,NA,NA,NA,NA,NA,NA,NA
"1239","Sciacarello","125","1221A2","9",1980,"","","","",NA,NA,NA,NA,NA,NA,NA,NA,NA,NA,NA
"1240","Sciacarello","125","1221A2","9",1983,"","","","",NA,NA,NA,NA,NA,NA,NA,NA,NA,NA,NA
"1241","Sciacarello","125","1221A2","9",1984,"","","","",NA,NA,NA,NA,NA,NA,NA,NA,NA,NA,NA
"1242","Sciacarello","125","1221A4","11",1975,"","","","",NA,NA,NA,NA,NA,NA,NA,NA,NA,NA,NA
"1243","Sciacarello","125","1221A4","11",1976,"","","","",NA,NA,NA,NA,NA,NA,NA,NA,NA,NA,NA
"1244","Sciacarello","125","1221A4","11",1978,"","","","28/8/78",NA,NA,NA,NA,1978-08-28,NA,NA,NA,NA,NA,NA
"1245","Sciacarello","125","1221A4","11",1980,"","","","9/9/1982",NA,NA,NA,NA,1982-09-09,NA,NA,NA,NA,NA,NA
"1246","Sciacarello","125","1221A4","11",1983,"","","","6/9/1983",NA,NA,NA,NA,1983-09-06,NA,NA,NA,NA,NA,NA
"1247","Sciacarello","125","1221A4","11",1984,"","","","",NA,NA,NA,NA,NA,NA,NA,NA,NA,NA,NA
"1248","Sciacarello","125","1221A5","12",1972,"24/3/72","","","",NA,1972-03-24,NA,NA,NA,NA,NA,NA,NA,NA,NA
"1249","Sciacarello","125","1221A5","12",1973,"3/4/1973","","","",NA,1973-04-03,NA,NA,NA,NA,NA,NA,NA,NA,NA
"1250","Sciacarello","125","1221A5","12",1974,"27/3/74","","","",NA,1974-03-27,NA,NA,NA,NA,NA,NA,NA,NA,NA
"1251","Sciacarello","125","1221A5","12",1975,"","","","",NA,NA,NA,NA,NA,NA,NA,NA,NA,NA,NA
"1252","Sciacarello","125","1221A5","12",1976,"","","","",NA,NA,NA,NA,NA,NA,NA,NA,NA,NA,NA
"1253","Sciacarello","125","1221A5","12",1978,"","","","",NA,NA,NA,NA,NA,NA,NA,NA,NA,NA,NA
"1254","Sciacarello","125","1221A5","12",1980,"","","","",NA,NA,NA,NA,NA,NA,NA,NA,NA,NA,NA
"1255","Sciacarello","125","1221A5","12",1983,"","","","31/8/83",NA,NA,NA,NA,1983-08-31,NA,NA,NA,NA,NA,NA
"1256","Sciacarello","125","1221A5","12",1984,"","","","11/9/1984",NA,NA,NA,NA,1984-09-11,NA,NA,NA,NA,NA,NA
"1257","Sciacarello","125","1221A6","13",1972,"25/3/72","","","",NA,1972-03-25,NA,NA,NA,NA,NA,NA,NA,NA,NA
"1258","Sciacarello","125","1221A6","13",1973,"","","","21/8/73",NA,NA,NA,NA,1973-08-21,NA,NA,NA,NA,NA,NA
"1259","Sciacarello","125","1221A6","13",1974,"26/3/74","","","29/8/74",NA,1974-03-26,NA,NA,1974-08-29,NA,156,NA,NA,NA,NA
"1260","Sciacarello","125","1221A6","13",1975,"24/3/75","","","3/9/1975",NA,1975-03-24,NA,NA,1975-09-03,NA,163,NA,NA,NA,NA
"1261","Sciacarello","125","1221A6","13",1976,"","","8/8/1976","",NA,NA,NA,1976-08-08,NA,NA,NA,NA,NA,NA,NA
"1262","Sciacarello","125","1221A6","13",1977,"","","16/8/77","",NA,NA,NA,1977-08-16,NA,NA,NA,NA,NA,NA,NA
"1263","Sciacarello","125","1221A6","13",1978,"","","17/8/78","",NA,NA,NA,1978-08-17,NA,NA,NA,NA,NA,NA,NA
"1264","Sciacarello","125","1221A7","14",1970,"1/4/1970","","","",NA,1970-04-01,NA,NA,NA,NA,NA,NA,NA,NA,NA
"1265","Sciacarello","125","1221A7","14",1971,"8/4/1971","","","20/9/71",NA,1971-04-08,NA,NA,1971-09-20,NA,165,NA,NA,NA,NA
"1266","Sciacarello","125","1221A7","14",1972,"27/3/72","","","5/9/1972",NA,1972-03-27,NA,NA,1972-09-05,NA,162,NA,NA,NA,NA
"1267","Sciacarello","125","1221A7","14",1973,"","","","24/8/73",NA,NA,NA,NA,1973-08-24,NA,NA,NA,NA,NA,NA
"1268","Sciacarello","125","1221A7","14",1976,"","","8/8/1976","",NA,NA,NA,1976-08-08,NA,NA,NA,NA,NA,NA,NA
"1269","Sciacarello","125","1221A7","14",1977,"","","16/8/77","",NA,NA,NA,1977-08-16,NA,NA,NA,NA,NA,NA,NA
"1270","Sciacarello","125","1221A7","14",1978,"","","17/8/78","",NA,NA,NA,1978-08-17,NA,NA,NA,NA,NA,NA,NA
"1271","Sciacarello","125","1221A8","15",1971,"","","","14/9/71",NA,NA,NA,NA,1971-09-14,NA,NA,NA,NA,NA,NA
"1272","Sciacarello","125","1221A8","15",1972,"20/3/72","","","28/8/72",NA,1972-03-20,NA,NA,1972-08-28,NA,161,NA,NA,NA,NA
"1273","Sciacarello","125","1221A8","15",1973,"9/4/1973","","","29/8/73",NA,1973-04-09,NA,NA,1973-08-29,NA,142,NA,NA,NA,NA
"1274","Sciacarello","125","1221A8","15",1974,"24/3/74","","","",NA,1974-03-24,NA,NA,NA,NA,NA,NA,NA,NA,NA
"1275","Sciacarello","125","1221A8","15",1976,"","","8/8/1976","",NA,NA,NA,1976-08-08,NA,NA,NA,NA,NA,NA,NA
"1276","Sciacarello","125","1221A8","15",1977,"","","9/8/1977","",NA,NA,NA,1977-08-09,NA,NA,NA,NA,NA,NA,NA
"1277","Sciacarello","125","1221A8","15",1978,"","","10/8/1978","",NA,NA,NA,1978-08-10,NA,NA,NA,NA,NA,NA,NA
"1278","Sciacarello","125","1221A9","16",1970,"26/3/70","","","",NA,1970-03-26,NA,NA,NA,NA,NA,NA,NA,NA,NA
"1279","Sciacarello","125","1221A9","16",1971,"","","","14/9/71",NA,NA,NA,NA,1971-09-14,NA,NA,NA,NA,NA,NA
"1280","Sciacarello","125","1221A9","16",1972,"20/3/72","","","",NA,1972-03-20,NA,NA,NA,NA,NA,NA,NA,NA,NA
"1281","Sciacarello","125","1221A9","16",1973,"3/4/1973","","","27/8/73",NA,1973-04-03,NA,NA,1973-08-27,NA,146,NA,NA,NA,NA
"1282","Sciacarello","125","1221A9","16",1974,"","","","4/9/1974",NA,NA,NA,NA,1974-09-04,NA,NA,NA,NA,NA,NA
"1283","Sciacarello","125","1221A9","16",1977,"","","12/8/1977","",NA,NA,NA,1977-08-12,NA,NA,NA,NA,NA,NA,NA
"1284","Sciacarello","125","1221A9","16",1978,"","","17/8/78","",NA,NA,NA,1978-08-17,NA,NA,NA,NA,NA,NA,NA
"1285","Sciacarello","125","414A8","17",1969,"3/4/1969","","","10/9/1969",NA,1969-04-03,NA,NA,1969-09-10,NA,160,NA,NA,NA,NA
"1286","Sciacarello","125","414A8","17",1970,"30/3/70","","","1/9/1970",NA,1970-03-30,NA,NA,1970-09-01,NA,155,NA,NA,NA,NA
"1287","Sciacarello","125","414A8","17",1971,"2/4/1971","","","21/9/71",NA,1971-04-02,NA,NA,1971-09-21,NA,172,NA,NA,NA,NA
"1288","Sciacarello","125","414A9","18",1969,"","","","10/9/1969",NA,NA,NA,NA,1969-09-10,NA,NA,NA,NA,NA,NA
"1289","Sciacarello","125","414A9","18",1970,"31/3/70","","","1/9/1970",NA,1970-03-31,NA,NA,1970-09-01,NA,154,NA,NA,NA,NA
"1290","Sciacarello","125","414A9","18",1971,"2/4/1971","","","21/9/71",NA,1971-04-02,NA,NA,1971-09-21,NA,172,NA,NA,NA,NA
"1291","Sciacarello","125","414A9","18",1972,"24/3/72","","","",NA,1972-03-24,NA,NA,NA,NA,NA,NA,NA,NA,NA
"1292","Sciacarello","125","414A9","18",1979,"6/8/1979","","","",NA,1979-08-06,NA,NA,NA,NA,NA,NA,NA,NA,NA
"1293","Sciacarello","125","414A9","18",1980,"12/8/1980","","","",NA,1980-08-12,NA,NA,NA,NA,NA,NA,NA,NA,NA
"1294","Sciacarello","125","414A9","18",1981,"3/8/1981","","","",NA,1981-08-03,NA,NA,NA,NA,NA,NA,NA,NA,NA
"1295","Sciacarello","125","416S13","19",1968,"29/3/68","","","",NA,1968-03-29,NA,NA,NA,NA,NA,NA,NA,NA,NA
"1296","Sciacarello","125","416S13","19",1969,"2/4/1969","","","18/9/69",NA,1969-04-02,NA,NA,1969-09-18,NA,169,NA,NA,NA,NA
"1297","Sciacarello","125","416S13","19",1970,"","","","17/8/70",NA,NA,NA,NA,1970-08-17,NA,NA,NA,NA,NA,NA
"1298","Sciacarello","125","416S13","19",1971,"","","","31/8/71",NA,NA,NA,NA,1971-08-31,NA,NA,NA,NA,NA,NA
"1299","Sciacarello","125","1220A6","20",1986,"31/3/86","","","1/9/1969",NA,1986-03-31,NA,NA,1969-09-01,NA,-6055,NA,NA,NA,NA
"1300","Sciacarello","125","1220A6","20",1989,"20/3/89","","","",NA,1989-03-20,NA,NA,NA,NA,NA,NA,NA,NA,NA
"1301","Sciacarello","125","1220A7","21",1975,"17/3/75","","","",NA,1975-03-17,NA,NA,NA,NA,NA,NA,NA,NA,NA
"1302","Sciacarello","125","1220A8","22",1969,"24/3/69","","","",NA,1969-03-24,NA,NA,NA,NA,NA,NA,NA,NA,NA
"1303","Sciacarello","125","1220A8","22",1970,"","","","",NA,NA,NA,NA,NA,NA,NA,NA,NA,NA,NA
"1304","Sciacarello","125","1220A8","22",1971,"29/3/71","","","",NA,1971-03-29,NA,NA,NA,NA,NA,NA,NA,NA,NA
"1305","Sciacarello","125","1220A8","22",1972,"24/3/72","","","",NA,1972-03-24,NA,NA,NA,NA,NA,NA,NA,NA,NA
"1306","Sciacarello","125","1220A8","22",1973,"","","","3/9/1973",NA,NA,NA,NA,1973-09-03,NA,NA,NA,NA,NA,NA
"1307","Sciacarello","125","1220A8","22",1974,"","","","29/8/74",NA,NA,NA,NA,1974-08-29,NA,NA,NA,NA,NA,NA
"1308","Sciacarello","125","1220A8","22",1975,"","","","26/8/75",NA,NA,NA,NA,1975-08-26,NA,NA,NA,NA,NA,NA
"1309","Sciacarello","125","1220A8","22",1976,"","","6/8/1976","",NA,NA,NA,1976-08-06,NA,NA,NA,NA,NA,NA,NA
"1310","Sciacarello","125","1220A8","22",1977,"","","13/8/77","",NA,NA,NA,1977-08-13,NA,NA,NA,NA,NA,NA,NA
"1311","Sciacarello","125","1220A8","22",1978,"","","17/8/78","",NA,NA,NA,1978-08-17,NA,NA,NA,NA,NA,NA,NA
"1312","Sciacarello","125","1220A9","23",1969,"24/3/69","","","",NA,1969-03-24,NA,NA,NA,NA,NA,NA,NA,NA,NA
"1313","Sciacarello","125","1220A9","23",1970,"25/3/70","","","",NA,1970-03-25,NA,NA,NA,NA,NA,NA,NA,NA,NA
"1314","Sciacarello","125","1220A9","23",1971,"5/4/1971","","","23/8/71",NA,1971-04-05,NA,NA,1971-08-23,NA,140,NA,NA,NA,NA
"1315","Sciacarello","125","1220A9","23",1972,"","","","5/9/1972",NA,NA,NA,NA,1972-09-05,NA,NA,NA,NA,NA,NA
"1316","Sciacarello","125","1220A9","23",1973,"","","","3/9/1973",NA,NA,NA,NA,1973-09-03,NA,NA,NA,NA,NA,NA
"1317","Sciacarello","125","1220S1","24",1971,"7/4/1971","","","",NA,1971-04-07,NA,NA,NA,NA,NA,NA,NA,NA,NA
"1318","Sciacarello","125","1220S1","24",1972,"26/3/72","","","",NA,1972-03-26,NA,NA,NA,NA,NA,NA,NA,NA,NA
"1319","Sciacarello","125","1220S1","24",1973,"3/4/1973","","","",NA,1973-04-03,NA,NA,NA,NA,NA,NA,NA,NA,NA
"1320","Sciacarello","125","1220S1","24",1974,"","","","29/8/74",NA,NA,NA,NA,1974-08-29,NA,NA,NA,NA,NA,NA
"1321","Sciacarello","125","1220S1","24",1975,"","","","26/8/75",NA,NA,NA,NA,1975-08-26,NA,NA,NA,NA,NA,NA
"1322","Sciacarello","125","1220S1","24",1976,"","","2/8/1976","25/8/76",NA,NA,NA,1976-08-02,1976-08-25,NA,NA,NA,NA,23,NA
"1323","Sciacarello","125","1220S1","24",1977,"","","13/8/77","",NA,NA,NA,1977-08-13,NA,NA,NA,NA,NA,NA,NA
"1324","Sciacarello","125","1220S1","24",1978,"","","5/8/1978","",NA,NA,NA,1978-08-05,NA,NA,NA,NA,NA,NA,NA
"1325","Sciacarello","125","1220S1","24",1995,"","3/6/1995","","",NA,NA,1995-06-03,NA,NA,NA,NA,NA,NA,NA,NA
"1326","Sciacarello","125","1220S1","24",1996,"","1/6/1996","","",NA,NA,1996-06-01,NA,NA,NA,NA,NA,NA,NA,NA
"1327","Sciacarello","125","1220S2","25",1979,"9/3/1979","","","",NA,1979-03-09,NA,NA,NA,NA,NA,NA,NA,NA,NA
"1328","Sciacarello","125","1220S2","25",1982,"11/3/1982","","","",NA,1982-03-11,NA,NA,NA,NA,NA,NA,NA,NA,NA
"1329","Sciacarello","125","1220S2","25",1983,"22/3/83","","","",NA,1983-03-22,NA,NA,NA,NA,NA,NA,NA,NA,NA
"1330","Sciacarello","125","1220S3","26",1971,"2/4/1971","","","",NA,1971-04-02,NA,NA,NA,NA,NA,NA,NA,NA,NA
"1331","Sciacarello","125","1220S3","26",1972,"24/3/72","","","",NA,1972-03-24,NA,NA,NA,NA,NA,NA,NA,NA,NA
"1332","Sciacarello","125","1220S3","26",1973,"3/4/1973","","","",NA,1973-04-03,NA,NA,NA,NA,NA,NA,NA,NA,NA
"1333","Sciacarello","125","1220S3","26",1974,"","","","29/8/74",NA,NA,NA,NA,1974-08-29,NA,NA,NA,NA,NA,NA
"1334","Sciacarello","125","1220S3","26",1975,"","","","",NA,NA,NA,NA,NA,NA,NA,NA,NA,NA,NA
"1335","Sciacarello","125","1220S3","26",1976,"","","","25/8/76",NA,NA,NA,NA,1976-08-25,NA,NA,NA,NA,NA,NA
"1336","Sciacarello","125","1220S3","26",1977,"","","","31/8/77",NA,NA,NA,NA,1977-08-31,NA,NA,NA,NA,NA,NA
"1337","Durif","159","62A4","1",1956,"5/4/1956","","","20/8/57",NA,1956-04-05,NA,NA,1957-08-20,NA,502,NA,NA,NA,NA
"1338","Durif","159","62A4","1",1957,"18/3/57","","","16/9/58",NA,1957-03-18,NA,NA,1958-09-16,NA,547,NA,NA,NA,NA
"1339","Durif","159","62A4","1",1958,"3/4/1958","","","20/8/58",NA,1958-04-03,NA,NA,1958-08-20,NA,139,NA,NA,NA,NA
"1340","Durif","159","62A4","1",1959,"","","","25/8/59",NA,NA,NA,NA,1959-08-25,NA,NA,NA,NA,NA,NA
"1341","Durif","159","62A4","1",1960,"","","","",NA,NA,NA,NA,NA,NA,NA,NA,NA,NA,NA
"1342","Durif","159","62A4","1",1961,"","","","",NA,NA,NA,NA,NA,NA,NA,NA,NA,NA,NA
"1343","Durif","159","10A84","4",1956,"3/4/1956","","","3/9/1956",NA,1956-04-03,NA,NA,1956-09-03,NA,153,NA,NA,NA,NA
"1344","Durif","159","10A84","4",1957,"20/3/57","","","24/9/57",NA,1957-03-20,NA,NA,1957-09-24,NA,188,NA,NA,NA,NA
"1345","Durif","159","10A84","4",1958,"1/4/1958","","","2/9/1958",NA,1958-04-01,NA,NA,1958-09-02,NA,154,NA,NA,NA,NA
"1346","Durif","159","10A84","4",1959,"","","","25/8/59",NA,NA,NA,NA,1959-08-25,NA,NA,NA,NA,NA,NA
"1347","Durif","159","10A84","4",1960,"","","","",NA,NA,NA,NA,NA,NA,NA,NA,NA,NA,NA
"1348","Durif","159","10A84","4",1961,"","","","",NA,NA,NA,NA,NA,NA,NA,NA,NA,NA,NA
"1349","Durif","159","8A104","5",1956,"27/3/56","","","27/8/56",NA,1956-03-27,NA,NA,1956-08-27,NA,153,NA,NA,NA,NA
"1350","Durif","159","8A104","5",1957,"18/3/57","","","9/9/1957",NA,1957-03-18,NA,NA,1957-09-09,NA,175,NA,NA,NA,NA
"1351","Durif","159","8A104","5",1958,"1/4/1958","","","3/9/1958",NA,1958-04-01,NA,NA,1958-09-03,NA,155,NA,NA,NA,NA
"1352","Durif","159","8A104","5",1959,"24/3/59","","","25/9/59",NA,1959-03-24,NA,NA,1959-09-25,NA,185,NA,NA,NA,NA
"1353","Durif","159","8A104","5",1960,"","","","",NA,NA,NA,NA,NA,NA,NA,NA,NA,NA,NA
"1354","Durif","159","8A104","5",1961,"","","","",NA,NA,NA,NA,NA,NA,NA,NA,NA,NA,NA
"1355","Durif","159","42A10","7",1958,"2/4/1958","","","28/8/58",NA,1958-04-02,NA,NA,1958-08-28,NA,148,NA,NA,NA,NA
"1356","Durif","159","42A10","7",1959,"27/3/59","","","31/8/59",NA,1959-03-27,NA,NA,1959-08-31,NA,157,NA,NA,NA,NA
"1357","Durif","159","42A10","7",1960,"16/3/60","","","29/8/60",NA,1960-03-16,NA,NA,1960-08-29,NA,166,NA,NA,NA,NA
"1358","Durif","159","42A10","7",1961,"","","","21/8/61",NA,NA,NA,NA,1961-08-21,NA,NA,NA,NA,NA,NA
"1359","Durif","159","9S115","9",1956,"","","","10/9/1956",NA,NA,NA,NA,1956-09-10,NA,NA,NA,NA,NA,NA
"1360","Durif","159","9S115","9",1957,"19/3/57","","","16/9/57",NA,1957-03-19,NA,NA,1957-09-16,NA,181,NA,NA,NA,NA
"1361","Durif","159","9S115","9",1958,"30/3/58","","","28/8/58",NA,1958-03-30,NA,NA,1958-08-28,NA,151,NA,NA,NA,NA
"1362","Durif","159","9S115","9",1959,"25/3/59","","","7/9/1959",NA,1959-03-25,NA,NA,1959-09-07,NA,166,NA,NA,NA,NA
"1363","Durif","159","9S115","9",1960,"","","","",NA,NA,NA,NA,NA,NA,NA,NA,NA,NA,NA
"1364","Durif","159","9S115","9",1961,"","","","",NA,NA,NA,NA,NA,NA,NA,NA,NA,NA,NA
"1365","Durif","159","15S155","10",1956,"","","","28/8/56",NA,NA,NA,NA,1956-08-28,NA,NA,NA,NA,NA,NA
"1366","Durif","159","15S155","10",1957,"14/3/57","","","2/9/1957",NA,1957-03-14,NA,NA,1957-09-02,NA,172,NA,NA,NA,NA
"1367","Durif","159","15S155","10",1958,"30/3/58","","","5/9/1958",NA,1958-03-30,NA,NA,1958-09-05,NA,159,NA,NA,NA,NA
"1368","Durif","159","15S155","10",1964,"26/3/64","","","19/8/64",NA,1964-03-26,NA,NA,1964-08-19,NA,146,NA,NA,NA,NA
"1369","Durif","159","15S155","10",1965,"18/3/65","","","30/8/65",NA,1965-03-18,NA,NA,1965-08-30,NA,165,NA,NA,NA,NA
"1370","Durif","159","15S155","10",1966,"25/2/66","","","23/8/66",NA,1966-02-25,NA,NA,1966-08-23,NA,179,NA,NA,NA,NA
"1371","Durif","159","15S155","10",1976,"","","","",NA,NA,NA,NA,NA,NA,NA,NA,NA,NA,NA
"1372","Durif","159","15S155","10",1977,"","","8/8/1977","",NA,NA,NA,1977-08-08,NA,NA,NA,NA,NA,NA,NA
"1373","Durif","159","15S155","10",1978,"","","8/8/1978","",NA,NA,NA,1978-08-08,NA,NA,NA,NA,NA,NA,NA
"1374","Durif","159","15S155","10",1996,"","3/6/1996","","",NA,NA,1996-06-03,NA,NA,NA,NA,NA,NA,NA,NA
"1375","Durif","159","15S155","10",1999,"22/3/99","25/5/99","27/7/99","22/3/99",NA,1999-03-22,1999-05-25,1999-07-27,1999-03-22,NA,0,64,63,-127,127
"1376","Durif","159","918S2","11",1965,"1/4/1965","","","",NA,1965-04-01,NA,NA,NA,NA,NA,NA,NA,NA,NA
"1377","Durif","159","918S2","11",1966,"11/3/1966","","","",NA,1966-03-11,NA,NA,NA,NA,NA,NA,NA,NA,NA
"1378","Durif","159","918S2","11",1967,"22/3/67","","","",NA,1967-03-22,NA,NA,NA,NA,NA,NA,NA,NA,NA
"1379","Durif","159","918S2","11",1976,"","","29/7/76","",NA,NA,NA,1976-07-29,NA,NA,NA,NA,NA,NA,NA
"1380","Durif","159","918S2","11",1977,"","","1/8/1977","",NA,NA,NA,1977-08-01,NA,NA,NA,NA,NA,NA,NA
"1381","Durif","159","918S2","11",1978,"","","9/8/1978","",NA,NA,NA,1978-08-09,NA,NA,NA,NA,NA,NA,NA
"1382","Durif","159","45A12","12",1970,"1/4/1970","","","7/9/1970",NA,1970-04-01,NA,NA,1970-09-07,NA,159,NA,NA,NA,NA
"1383","Durif","159","45A12","12",1971,"5/4/1971","","","7/9/1971",NA,1971-04-05,NA,NA,1971-09-07,NA,155,NA,NA,NA,NA
"1384","Durif","159","45A12","12",1972,"23/3/72","","","11/9/1972",NA,1972-03-23,NA,NA,1972-09-11,NA,172,NA,NA,NA,NA
"1385","Durif","159","45A12","12",1979,"","","30/7/79","",NA,NA,NA,1979-07-30,NA,NA,NA,NA,NA,NA,NA
"1386","Durif","159","45A12","12",1980,"","","11/8/1980","",NA,NA,NA,1980-08-11,NA,NA,NA,NA,NA,NA,NA
"1387","Durif","159","45A12","12",1981,"","","30/7/81","",NA,NA,NA,1981-07-30,NA,NA,NA,NA,NA,NA,NA
"1388","Marsanne","148","10A85","1",1956,"5/4/1956","","","",NA,1956-04-05,NA,NA,NA,NA,NA,NA,NA,NA,NA
"1389","Marsanne","148","10A85","1",1957,"14/3/57","","","",NA,1957-03-14,NA,NA,NA,NA,NA,NA,NA,NA,NA
"1390","Marsanne","148","10A85","1",1958,"27/3/58","","","",NA,1958-03-27,NA,NA,NA,NA,NA,NA,NA,NA,NA
"1391","Marsanne","148","10A85","1",1959,"18/3/59","","","",NA,1959-03-18,NA,NA,NA,NA,NA,NA,NA,NA,NA
"1392","Marsanne","148","10A85","1",1960,"","","","",NA,NA,NA,NA,NA,NA,NA,NA,NA,NA,NA
"1393","Marsanne","148","10A85","1",1961,"","","","",NA,NA,NA,NA,NA,NA,NA,NA,NA,NA,NA
"1394","Marsanne","148","10A85","1",1962,"","","","",NA,NA,NA,NA,NA,NA,NA,NA,NA,NA,NA
"1395","Marsanne","148","10A85","1",1963,"","","","",NA,NA,NA,NA,NA,NA,NA,NA,NA,NA,NA
"1396","Marsanne","148","10A85","1",1992,"","","","",NA,NA,NA,NA,NA,NA,NA,NA,NA,NA,NA
"1397","Marsanne","148","10A85","1",1993,"","","","",NA,NA,NA,NA,NA,NA,NA,NA,NA,NA,NA
"1398","Marsanne","148","10A85","1",1994,"","","","",NA,NA,NA,NA,NA,NA,NA,NA,NA,NA,NA
"1399","Marsanne","148","61A6","2",1956,"5/4/1956","","","",NA,1956-04-05,NA,NA,NA,NA,NA,NA,NA,NA,NA
"1400","Marsanne","148","61A6","2",1957,"18/3/57","","","",NA,1957-03-18,NA,NA,NA,NA,NA,NA,NA,NA,NA
"1401","Marsanne","148","61A6","2",1958,"3/4/1958","","","",NA,1958-04-03,NA,NA,NA,NA,NA,NA,NA,NA,NA
"1402","Marsanne","148","61A6","2",1959,"","","","",NA,NA,NA,NA,NA,NA,NA,NA,NA,NA,NA
"1403","Marsanne","148","61A6","2",1960,"","","","",NA,NA,NA,NA,NA,NA,NA,NA,NA,NA,NA
"1404","Marsanne","148","61A6","2",1961,"","","","",NA,NA,NA,NA,NA,NA,NA,NA,NA,NA,NA
"1405","Marsanne","148","61A6","2",1962,"","","","",NA,NA,NA,NA,NA,NA,NA,NA,NA,NA,NA
"1406","Marsanne","148","61A6","2",1963,"","","","",NA,NA,NA,NA,NA,NA,NA,NA,NA,NA,NA
"1407","Marsanne","148","61A6","2",1992,"","","","",NA,NA,NA,NA,NA,NA,NA,NA,NA,NA,NA
"1408","Marsanne","148","61A6","2",1993,"","","","",NA,NA,NA,NA,NA,NA,NA,NA,NA,NA,NA
"1409","Marsanne","148","61A6","2",1994,"","28/5/94","","",NA,NA,1994-05-28,NA,NA,NA,NA,NA,NA,NA,NA
"1410","Marsanne","148","61A6","2",1995,"","30/5/95","","",NA,NA,1995-05-30,NA,NA,NA,NA,NA,NA,NA,NA
"1411","Marsanne","148","61A6","2",1996,"","3/6/1996","","",NA,NA,1996-06-03,NA,NA,NA,NA,NA,NA,NA,NA
"1412","Marsanne","148","514S1","3",1956,"","","","",NA,NA,NA,NA,NA,NA,NA,NA,NA,NA,NA
"1413","Marsanne","148","514S1","3",1957,"","","","",NA,NA,NA,NA,NA,NA,NA,NA,NA,NA,NA
"1414","Marsanne","148","514S1","3",1958,"3/4/1958","","","",NA,1958-04-03,NA,NA,NA,NA,NA,NA,NA,NA,NA
"1415","Marsanne","148","514S1","3",1959,"28/3/59","","","18/8/59",NA,1959-03-28,NA,NA,1959-08-18,NA,143,NA,NA,NA,NA
"1416","Marsanne","148","514S1","3",1960,"26/3/60","","","16/8/60",NA,1960-03-26,NA,NA,1960-08-16,NA,143,NA,NA,NA,NA
"1417","Marsanne","148","514S1","3",1961,"18/3/61","","","",NA,1961-03-18,NA,NA,NA,NA,NA,NA,NA,NA,NA
"1418","Marsanne","148","514S1","3",1962,"","","","16/8/62",NA,NA,NA,NA,1962-08-16,NA,NA,NA,NA,NA,NA
"1419","Marsanne","148","514S1","3",1963,"","","","2/9/1963",NA,NA,NA,NA,1963-09-02,NA,NA,NA,NA,NA,NA
"1420","Marsanne","148","514S1","3",1992,"","","","",NA,NA,NA,NA,NA,NA,NA,NA,NA,NA,NA
"1421","Marsanne","148","514S1","3",1993,"","","","",NA,NA,NA,NA,NA,NA,NA,NA,NA,NA,NA
"1422","Marsanne","148","514S1","3",1994,"","28/5/94","","",NA,NA,1994-05-28,NA,NA,NA,NA,NA,NA,NA,NA
"1423","Marsanne","148","514S1","3",1995,"","30/5/95","","",NA,NA,1995-05-30,NA,NA,NA,NA,NA,NA,NA,NA
"1424","Marsanne","148","514S1","3",1996,"","3/6/1996","","",NA,NA,1996-06-03,NA,NA,NA,NA,NA,NA,NA,NA
"1425","Marsanne","148","61A5","5",1956,"2/4/1956","","","24/9/56",NA,1956-04-02,NA,NA,1956-09-24,NA,175,NA,NA,NA,NA
"1426","Marsanne","148","61A5","5",1957,"21/3/57","","","16/9/57",NA,1957-03-21,NA,NA,1957-09-16,NA,179,NA,NA,NA,NA
"1427","Marsanne","148","61A5","5",1958,"8/4/1958","","","27/8/58",NA,1958-04-08,NA,NA,1958-08-27,NA,141,NA,NA,NA,NA
"1428","Marsanne","148","61A5","5",1959,"24/3/59","","","18/8/59",NA,1959-03-24,NA,NA,1959-08-18,NA,147,NA,NA,NA,NA
"1429","Marsanne","148","61A5","5",1960,"22/3/60","","","23/8/60",NA,1960-03-22,NA,NA,1960-08-23,NA,154,NA,NA,NA,NA
"1430","Marsanne","148","61A5","5",1961,"","","","",NA,NA,NA,NA,NA,NA,NA,NA,NA,NA,NA
"1431","Marsanne","148","61A5","5",1962,"","","","",NA,NA,NA,NA,NA,NA,NA,NA,NA,NA,NA
"1432","Marsanne","148","61A5","5",1963,"","","","",NA,NA,NA,NA,NA,NA,NA,NA,NA,NA,NA
"1433","Marsanne","148","61A5","5",1992,"","","","",NA,NA,NA,NA,NA,NA,NA,NA,NA,NA,NA
"1434","Marsanne","148","61A5","5",1993,"","","","",NA,NA,NA,NA,NA,NA,NA,NA,NA,NA,NA
"1435","Marsanne","148","61A5","5",1994,"","","","",NA,NA,NA,NA,NA,NA,NA,NA,NA,NA,NA
"1436","Marsanne","148","43S11","7",1956,"","","","",NA,NA,NA,NA,NA,NA,NA,NA,NA,NA,NA
"1437","Marsanne","148","43S11","7",1957,"","","","",NA,NA,NA,NA,NA,NA,NA,NA,NA,NA,NA
"1438","Marsanne","148","43S11","7",1958,"4/4/1958","","","",NA,1958-04-04,NA,NA,NA,NA,NA,NA,NA,NA,NA
"1439","Marsanne","148","43S11","7",1959,"21/3/59","","","24/8/59",NA,1959-03-21,NA,NA,1959-08-24,NA,156,NA,NA,NA,NA
"1440","Marsanne","148","43S11","7",1960,"17/3/60","","","16/8/60",NA,1960-03-17,NA,NA,1960-08-16,NA,152,NA,NA,NA,NA
"1441","Marsanne","148","43S11","7",1961,"15/3/61","","","14/8/61",NA,1961-03-15,NA,NA,1961-08-14,NA,152,NA,NA,NA,NA
"1442","Marsanne","148","43S11","7",1962,"","","","",NA,NA,NA,NA,NA,NA,NA,NA,NA,NA,NA
"1443","Marsanne","148","43S11","7",1963,"","","","",NA,NA,NA,NA,NA,NA,NA,NA,NA,NA,NA
"1444","Marsanne","148","43S11","7",1992,"","","","",NA,NA,NA,NA,NA,NA,NA,NA,NA,NA,NA
"1445","Marsanne","148","43S11","7",1993,"","","","",NA,NA,NA,NA,NA,NA,NA,NA,NA,NA,NA
"1446","Marsanne","148","43S11","7",1994,"","","","",NA,NA,NA,NA,NA,NA,NA,NA,NA,NA,NA
"1447","Marsanne","148","416S12","8",1956,"","","","",NA,NA,NA,NA,NA,NA,NA,NA,NA,NA,NA
"1448","Marsanne","148","416S12","8",1957,"","","","",NA,NA,NA,NA,NA,NA,NA,NA,NA,NA,NA
"1449","Marsanne","148","416S12","8",1958,"","","","",NA,NA,NA,NA,NA,NA,NA,NA,NA,NA,NA
"1450","Marsanne","148","416S12","8",1959,"26/3/59","","","24/8/59",NA,1959-03-26,NA,NA,1959-08-24,NA,151,NA,NA,NA,NA
"1451","Marsanne","148","416S12","8",1960,"23/3/60","","","29/8/60",NA,1960-03-23,NA,NA,1960-08-29,NA,159,NA,NA,NA,NA
"1452","Marsanne","148","416S12","8",1961,"22/3/61","","","14/8/61",NA,1961-03-22,NA,NA,1961-08-14,NA,145,NA,NA,NA,NA
"1453","Marsanne","148","416S12","8",1962,"16/4/62","","","28/8/62",NA,1962-04-16,NA,NA,1962-08-28,NA,134,NA,NA,NA,NA
"1454","Marsanne","148","416S12","8",1963,"","","","",NA,NA,NA,NA,NA,NA,NA,NA,NA,NA,NA
"1455","Marsanne","148","416S12","8",1992,"","","","",NA,NA,NA,NA,NA,NA,NA,NA,NA,NA,NA
"1456","Marsanne","148","416S12","8",1993,"","","","",NA,NA,NA,NA,NA,NA,NA,NA,NA,NA,NA
"1457","Marsanne","148","416S12","8",1994,"","","","",NA,NA,NA,NA,NA,NA,NA,NA,NA,NA,NA
"1458","Marsanne","148","919S5","9",1956,"","","","",NA,NA,NA,NA,NA,NA,NA,NA,NA,NA,NA
"1459","Marsanne","148","919S5","9",1957,"","","","",NA,NA,NA,NA,NA,NA,NA,NA,NA,NA,NA
"1460","Marsanne","148","919S5","9",1958,"27/3/58","","","",NA,1958-03-27,NA,NA,NA,NA,NA,NA,NA,NA,NA
"1461","Marsanne","148","919S5","9",1959,"16/3/59","","","17/8/59",NA,1959-03-16,NA,NA,1959-08-17,NA,154,NA,NA,NA,NA
"1462","Marsanne","148","919S5","9",1960,"20/3/60","","","16/8/60",NA,1960-03-20,NA,NA,1960-08-16,NA,149,NA,NA,NA,NA
"1463","Marsanne","148","919S5","9",1961,"9/3/1961","","","21/8/61",NA,1961-03-09,NA,NA,1961-08-21,NA,165,NA,NA,NA,NA
"1464","Marsanne","148","919S5","9",1962,"7/4/1962","","","28/8/62",NA,1962-04-07,NA,NA,1962-08-28,NA,143,NA,NA,NA,NA
"1465","Marsanne","148","919S5","9",1963,"","","","",NA,NA,NA,NA,NA,NA,NA,NA,NA,NA,NA
"1466","Marsanne","148","919S5","9",1992,"","","","",NA,NA,NA,NA,NA,NA,NA,NA,NA,NA,NA
"1467","Marsanne","148","919S5","9",1993,"","","","",NA,NA,NA,NA,NA,NA,NA,NA,NA,NA,NA
"1468","Marsanne","148","919S5","9",1994,"","","","",NA,NA,NA,NA,NA,NA,NA,NA,NA,NA,NA
"1469","Marsanne","148","10Rg4s356.360","10",1956,"","","","",NA,NA,NA,NA,NA,NA,NA,NA,NA,NA,NA
"1470","Marsanne","148","10Rg4s356.360","10",1957,"","","","",NA,NA,NA,NA,NA,NA,NA,NA,NA,NA,NA
"1471","Marsanne","148","10Rg4s356.360","10",1958,"","","","",NA,NA,NA,NA,NA,NA,NA,NA,NA,NA,NA
"1472","Marsanne","148","10Rg4s356.360","10",1959,"","","","",NA,NA,NA,NA,NA,NA,NA,NA,NA,NA,NA
"1473","Marsanne","148","10Rg4s356.360","10",1960,"","","","",NA,NA,NA,NA,NA,NA,NA,NA,NA,NA,NA
"1474","Marsanne","148","10Rg4s356.360","10",1961,"","","","",NA,NA,NA,NA,NA,NA,NA,NA,NA,NA,NA
"1475","Marsanne","148","10Rg4s356.360","10",1962,"","","","",NA,NA,NA,NA,NA,NA,NA,NA,NA,NA,NA
"1476","Marsanne","148","10Rg4s356.360","10",1963,"","","","",NA,NA,NA,NA,NA,NA,NA,NA,NA,NA,NA
"1477","Marsanne","148","10Rg4s356.360","10",1992,"30/3/92","29/7/92","29/7/92","29/8/92",NA,1992-03-30,1992-07-29,1992-07-29,1992-08-29,NA,152,121,0,31,121
"1478","Marsanne","148","10Rg4s356.360","10",1993,"29/3/93","6/8/1993","6/8/1993","30/8/93",NA,1993-03-29,1993-08-06,1993-08-06,1993-08-30,NA,154,130,0,24,130
"1479","Marsanne","148","10Rg4s356.360","10",1994,"7/3/1994","30/5/94","1/8/1994","29/8/94",NA,1994-03-07,1994-05-30,1994-08-01,1994-08-29,NA,175,84,63,28,147
"1480","Roussanne","147","61A4","1",1956,"31/3/56","","","1/10/1956",NA,1956-03-31,NA,NA,1956-10-01,NA,184,NA,NA,NA,NA
"1481","Roussanne","147","61A4","1",1957,"20/3/57","","","16/9/57",NA,1957-03-20,NA,NA,1957-09-16,NA,180,NA,NA,NA,NA
"1482","Roussanne","147","61A4","1",1958,"3/4/1958","","","4/9/1958",NA,1958-04-03,NA,NA,1958-09-04,NA,154,NA,NA,NA,NA
"1483","Roussanne","147","61A4","1",1959,"25/3/59","","","31/8/59",NA,1959-03-25,NA,NA,1959-08-31,NA,159,NA,NA,NA,NA
"1484","Roussanne","147","61A4","1",1960,"","","","",NA,NA,NA,NA,NA,NA,NA,NA,NA,NA,NA
"1485","Roussanne","147","61A4","1",1961,"","","","",NA,NA,NA,NA,NA,NA,NA,NA,NA,NA,NA
"1486","Roussanne","147","61A4","1",1996,"","5/6/1996","","",NA,NA,1996-06-05,NA,NA,NA,NA,NA,NA,NA,NA
"1487","Roussanne","147","10A86","2",1956,"2/4/1956","","","17/9/56",NA,1956-04-02,NA,NA,1956-09-17,NA,168,NA,NA,NA,NA
"1488","Roussanne","147","10A86","2",1957,"18/3/57","","","9/9/1957",NA,1957-03-18,NA,NA,1957-09-09,NA,175,NA,NA,NA,NA
"1489","Roussanne","147","10A86","2",1958,"3/4/1958","","","4/9/1958",NA,1958-04-03,NA,NA,1958-09-04,NA,154,NA,NA,NA,NA
"1490","Roussanne","147","10A86","2",1959,"","","","",NA,NA,NA,NA,NA,NA,NA,NA,NA,NA,NA
"1491","Roussanne","147","10A86","2",1960,"","","","",NA,NA,NA,NA,NA,NA,NA,NA,NA,NA,NA
"1492","Roussanne","147","10A86","2",1961,"","","","",NA,NA,NA,NA,NA,NA,NA,NA,NA,NA,NA
"1493","Roussanne","147","416S10","4",1956,"","","","",NA,NA,NA,NA,NA,NA,NA,NA,NA,NA,NA
"1494","Roussanne","147","416S10","4",1957,"","","","",NA,NA,NA,NA,NA,NA,NA,NA,NA,NA,NA
"1495","Roussanne","147","416S10","4",1958,"","","","",NA,NA,NA,NA,NA,NA,NA,NA,NA,NA,NA
"1496","Roussanne","147","416S10","4",1959,"22/3/59","","","24/8/59",NA,1959-03-22,NA,NA,1959-08-24,NA,155,NA,NA,NA,NA
"1497","Roussanne","147","416S10","4",1960,"16/3/60","","","29/9/60",NA,1960-03-16,NA,NA,1960-09-29,NA,197,NA,NA,NA,NA
"1498","Roussanne","147","416S10","4",1961,"23/3/61","","","2/9/1961",NA,1961-03-23,NA,NA,1961-09-02,NA,163,NA,NA,NA,NA
"1499","Roussanne","147","416S10","4",1962,"12/4/1962","","","",NA,1962-04-12,NA,NA,NA,NA,NA,NA,NA,NA,NA
"1500","Roussanne","147","416S11","5",1956,"","","","",NA,NA,NA,NA,NA,NA,NA,NA,NA,NA,NA
"1501","Roussanne","147","416S11","5",1957,"","","","",NA,NA,NA,NA,NA,NA,NA,NA,NA,NA,NA
"1502","Roussanne","147","416S11","5",1958,"","","","",NA,NA,NA,NA,NA,NA,NA,NA,NA,NA,NA
"1503","Roussanne","147","416S11","5",1959,"22/3/59","","","24/8/59",NA,1959-03-22,NA,NA,1959-08-24,NA,155,NA,NA,NA,NA
"1504","Roussanne","147","416S11","5",1960,"18/3/60","","","22/8/60",NA,1960-03-18,NA,NA,1960-08-22,NA,157,NA,NA,NA,NA
"1505","Roussanne","147","416S11","5",1961,"21/3/61","","","2/9/1961",NA,1961-03-21,NA,NA,1961-09-02,NA,165,NA,NA,NA,NA
"1506","Roussanne","147","416S11","5",1962,"16/4/62","","","",NA,1962-04-16,NA,NA,NA,NA,NA,NA,NA,NA,NA
"1507","Roussanne","147","416S11","5",1989,"","30/5/89","6/8/1989","",NA,NA,1989-05-30,1989-08-06,NA,NA,NA,NA,68,NA,NA
"1508","Roussanne","147","416S11","5",1996,"","3/6/1996","","",NA,NA,1996-06-03,NA,NA,NA,NA,NA,NA,NA,NA
"1509","Roussanne","147","106S4","7",1963,"8/4/1963","","","10/9/1963",NA,1963-04-08,NA,NA,1963-09-10,NA,155,NA,NA,NA,NA
"1510","Roussanne","147","106S4","7",1964,"1/4/1964","","","1/9/1964",NA,1964-04-01,NA,NA,1964-09-01,NA,153,NA,NA,NA,NA
"1511","Roussanne","147","106S4","7",1965,"3/4/1965","","","7/9/1965",NA,1965-04-03,NA,NA,1965-09-07,NA,157,NA,NA,NA,NA
"1512","Roussanne","147","106S4","7",1996,"","3/6/1996","","",NA,NA,1996-06-03,NA,NA,NA,NA,NA,NA,NA,NA
"1513","Roussanne","147","1023S6","8",1963,"","","","",NA,NA,NA,NA,NA,NA,NA,NA,NA,NA,NA
"1514","Roussanne","147","1023S6","8",1964,"1/4/1964","","","27/8/64",NA,1964-04-01,NA,NA,1964-08-27,NA,148,NA,NA,NA,NA
"1515","Roussanne","147","1023S6","8",1965,"31/3/65","","","31/8/65",NA,1965-03-31,NA,NA,1965-08-31,NA,153,NA,NA,NA,NA
"1516","Roussanne","147","1023S6","8",1966,"26/3/66","","","30/8/66",NA,1966-03-26,NA,NA,1966-08-30,NA,157,NA,NA,NA,NA
"1517","Roussanne","147","721S7","9",1974,"","","","17/9/74",NA,NA,NA,NA,1974-09-17,NA,NA,NA,NA,NA,NA
"1518","Roussanne","147","721S7","9",1976,"","","","1/9/1975",NA,NA,NA,NA,1975-09-01,NA,NA,NA,NA,NA,NA
"1519","Roussanne","147","721S7","9",1977,"","","","31/8/77",NA,NA,NA,NA,1977-08-31,NA,NA,NA,NA,NA,NA
"1520","Roussanne","147","721S7","9",1982,"25/3/82","","","",NA,1982-03-25,NA,NA,NA,NA,NA,NA,NA,NA,NA
"1521","Roussanne","147","721S7","9",1983,"26/3/83","","","",NA,1983-03-26,NA,NA,NA,NA,NA,NA,NA,NA,NA
"1522","Roussanne","147","721S7","9",1984,"8/4/1984","","","",NA,1984-04-08,NA,NA,NA,NA,NA,NA,NA,NA,NA
"1523","Roussanne","147","721S7","9",1994,"","26/5/94","5/8/1994","",NA,NA,1994-05-26,1994-08-05,NA,NA,NA,NA,71,NA,NA
"1524","Roussanne","147","721S7","9",1995,"","27/5/95","7/8/1995","",NA,NA,1995-05-27,1995-08-07,NA,NA,NA,NA,72,NA,NA
"1525","Aligote","202","412S9","1",1956,"28/3/56","","","17/9/56",NA,1956-03-28,NA,NA,1956-09-17,NA,173,NA,NA,NA,NA
"1526","Aligote","202","412S9","1",1957,"16/3/57","","","16/9/57",NA,1957-03-16,NA,NA,1957-09-16,NA,184,NA,NA,NA,NA
"1527","Aligote","202","412S9","1",1958,"25/3/58","","","4/8/1958",NA,1958-03-25,NA,NA,1958-08-04,NA,132,NA,NA,NA,NA
"1528","Aligote","202","412S9","1",1959,"","","","",NA,NA,NA,NA,NA,NA,NA,NA,NA,NA,NA
"1529","Aligote","202","412S9","1",1964,"","","","",NA,NA,NA,NA,NA,NA,NA,NA,NA,NA,NA
"1530","Aligote","202","412S9","1",1965,"","","","",NA,NA,NA,NA,NA,NA,NA,NA,NA,NA,NA
"1531","Aligote","202","412S9","1",1966,"","","","",NA,NA,NA,NA,NA,NA,NA,NA,NA,NA,NA
"1532","Aligote","202","412S9","1",1996,"","29/5/96","","",NA,NA,1996-05-29,NA,NA,NA,NA,NA,NA,NA,NA
"1533","Aligote","202","8S100","3",1956,"27/3/56","","","17/9/56",NA,1956-03-27,NA,NA,1956-09-17,NA,174,NA,NA,NA,NA
"1534","Aligote","202","8S100","3",1957,"16/3/57","","","19/8/57",NA,1957-03-16,NA,NA,1957-08-19,NA,156,NA,NA,NA,NA
"1535","Aligote","202","8S100","3",1958,"19/3/58","","","21/8/58",NA,1958-03-19,NA,NA,1958-08-21,NA,155,NA,NA,NA,NA
"1536","Aligote","202","8S100","3",1959,"13/3/59","","","",NA,1959-03-13,NA,NA,NA,NA,NA,NA,NA,NA,NA
"1537","Aligote","202","8S100","3",1964,"","","","",NA,NA,NA,NA,NA,NA,NA,NA,NA,NA,NA
"1538","Aligote","202","8S100","3",1965,"","","","",NA,NA,NA,NA,NA,NA,NA,NA,NA,NA,NA
"1539","Aligote","202","8S100","3",1966,"","","","",NA,NA,NA,NA,NA,NA,NA,NA,NA,NA,NA
"1540","Aligote","202","cl10P20S3","4",1956,"","","","",NA,NA,NA,NA,NA,NA,NA,NA,NA,NA,NA
"1541","Aligote","202","cl10P20S3","4",1957,"","","","",NA,NA,NA,NA,NA,NA,NA,NA,NA,NA,NA
"1542","Aligote","202","cl10P20S3","4",1958,"","","","",NA,NA,NA,NA,NA,NA,NA,NA,NA,NA,NA
"1543","Aligote","202","cl10P20S3","4",1959,"","","","",NA,NA,NA,NA,NA,NA,NA,NA,NA,NA,NA
"1544","Aligote","202","cl10P20S3","4",1964,"26/3/64","","","18/8/64",NA,1964-03-26,NA,NA,1964-08-18,NA,145,NA,NA,NA,NA
"1545","Aligote","202","cl10P20S3","4",1965,"30/3/65","","","31/8/65",NA,1965-03-30,NA,NA,1965-08-31,NA,154,NA,NA,NA,NA
"1546","Aligote","202","cl10P20S3","4",1966,"21/3/66","","","18/8/66",NA,1966-03-21,NA,NA,1966-08-18,NA,150,NA,NA,NA,NA
"1547","Aligote","202","cl10P20S3","4",1996,"","29/5/96","","",NA,NA,1996-05-29,NA,NA,NA,NA,NA,NA,NA,NA
"1548","Aligote","202","2R11s451","5",2000,"15/3/2000","23/5/00","24/7/00","21/8/2000",NA,2000-03-15,2000-05-23,2000-07-24,2000-08-21,NA,159,69,62,28,131
"1549","Meunier","206","10S97","1",1956,"25/3/56","","","27/8/56",NA,1956-03-25,NA,NA,1956-08-27,NA,155,NA,NA,NA,NA
"1550","Meunier","206","10S97","1",1957,"14/3/57","","","20/8/57",NA,1957-03-14,NA,NA,1957-08-20,NA,159,NA,NA,NA,NA
"1551","Meunier","206","10S97","1",1958,"2/4/1958","","","21/8/58",NA,1958-04-02,NA,NA,1958-08-21,NA,141,NA,NA,NA,NA
"1552","Meunier","206","10S97","1",1959,"24/3/59","","","19/8/59",NA,1959-03-24,NA,NA,1959-08-19,NA,148,NA,NA,NA,NA
"1553","Meunier","206","10S97","1",1960,"14/3/60","","","",NA,1960-03-14,NA,NA,NA,NA,NA,NA,NA,NA,NA
"1554","Meunier","206","4P13A6","2",1956,"28/3/56","","","28/8/56",NA,1956-03-28,NA,NA,1956-08-28,NA,153,NA,NA,NA,NA
"1555","Meunier","206","4P13A6","2",1957,"15/3/57","","","19/8/57",NA,1957-03-15,NA,NA,1957-08-19,NA,157,NA,NA,NA,NA
"1556","Meunier","206","4P13A6","2",1958,"26/3/58","","","18/8/58",NA,1958-03-26,NA,NA,1958-08-18,NA,145,NA,NA,NA,NA
"1557","Meunier","206","4P13A6","2",1959,"","","","5/8/1957",NA,NA,NA,NA,1957-08-05,NA,NA,NA,NA,NA,NA
"1558","Meunier","206","4P13A6","2",1960,"","","","",NA,NA,NA,NA,NA,NA,NA,NA,NA,NA,NA
"1559","Meunier","206","8S148A4","3",1956,"","","","",NA,NA,NA,NA,NA,NA,NA,NA,NA,NA,NA
"1560","Meunier","206","8S148A4","3",1957,"","","","",NA,NA,NA,NA,NA,NA,NA,NA,NA,NA,NA
"1561","Meunier","206","8S148A4","3",1958,"","","","",NA,NA,NA,NA,NA,NA,NA,NA,NA,NA,NA
"1562","Meunier","206","8S148A4","3",1959,"","","","",NA,NA,NA,NA,NA,NA,NA,NA,NA,NA,NA
"1563","Meunier","206","8S148A4","3",1960,"","","","",NA,NA,NA,NA,NA,NA,NA,NA,NA,NA,NA
"1564","Meunier","206","8S148","4",1956,"","","","",NA,NA,NA,NA,NA,NA,NA,NA,NA,NA,NA
"1565","Meunier","206","8S148","4",1957,"","","","5/8/1957",NA,NA,NA,NA,1957-08-05,NA,NA,NA,NA,NA,NA
"1566","Meunier","206","8S148","4",1958,"24/3/58","","","18/8/58",NA,1958-03-24,NA,NA,1958-08-18,NA,147,NA,NA,NA,NA
"1567","Meunier","206","8S148","4",1959,"15/3/59","","","19/8/59",NA,1959-03-15,NA,NA,1959-08-19,NA,157,NA,NA,NA,NA
"1568","Meunier","206","8S148","4",1960,"14/3/60","","","",NA,1960-03-14,NA,NA,NA,NA,NA,NA,NA,NA,NA
"1569","Meunier","206","8S148","4",1961,"8/3/1961","","","",NA,1961-03-08,NA,NA,NA,NA,NA,NA,NA,NA,NA
"1570","Meunier","206","4P13A7","5",1956,"26/3/56","","","17/8/56",NA,1956-03-26,NA,NA,1956-08-17,NA,144,NA,NA,NA,NA
"1571","Meunier","206","4P13A7","5",1957,"10/3/1957","","","19/8/57",NA,1957-03-10,NA,NA,1957-08-19,NA,162,NA,NA,NA,NA
"1572","Meunier","206","4P13A7","5",1958,"22/3/58","","","19/9/58",NA,1958-03-22,NA,NA,1958-09-19,NA,181,NA,NA,NA,NA
"1573","Meunier","206","4P13A7","5",1959,"","","","12/8/1959",NA,NA,NA,NA,1959-08-12,NA,NA,NA,NA,NA,NA
"1574","Meunier","206","4P13A7","5",1960,"","","","1/8/1960",NA,NA,NA,NA,1960-08-01,NA,NA,NA,NA,NA,NA
"1575","Meunier","206","4P13A7","5",1976,"","","22/7/76","",NA,NA,NA,1976-07-22,NA,NA,NA,NA,NA,NA,NA
"1576","Meunier","206","4P13A7","5",1977,"","","1/8/1977","",NA,NA,NA,1977-08-01,NA,NA,NA,NA,NA,NA,NA
"1577","Meunier","206","4P13A7","5",1978,"","","31/7/78","",NA,NA,NA,1978-07-31,NA,NA,NA,NA,NA,NA,NA
"1578","Meunier","206","4P13A7","5",1996,"","29/5/96","","",NA,NA,1996-05-29,NA,NA,NA,NA,NA,NA,NA,NA
"1579","Meunier","206","cl4P2A8","6",1956,"","","","",NA,NA,NA,NA,NA,NA,NA,NA,NA,NA,NA
"1580","Meunier","206","cl4P2A8","6",1957,"","","","",NA,NA,NA,NA,NA,NA,NA,NA,NA,NA,NA
"1581","Meunier","206","cl4P2A8","6",1958,"4/4/1958","","","28/8/58",NA,1958-04-04,NA,NA,1958-08-28,NA,146,NA,NA,NA,NA
"1582","Meunier","206","cl4P2A8","6",1959,"19/3/59","","","17/8/59",NA,1959-03-19,NA,NA,1959-08-17,NA,151,NA,NA,NA,NA
"1583","Meunier","206","cl4P2A8","6",1960,"11/3/1960","","","1/8/1960",NA,1960-03-11,NA,NA,1960-08-01,NA,143,NA,NA,NA,NA
"1584","Meunier","206","cl4P2A8","6",1961,"9/3/1961","","","",NA,1961-03-09,NA,NA,NA,NA,NA,NA,NA,NA,NA
"1585","Meunier","206","9A63","7",1956,"28/3/56","","","28/8/58",NA,1956-03-28,NA,NA,1958-08-28,NA,883,NA,NA,NA,NA
"1586","Meunier","206","9A63","7",1957,"13/3/57","","","19/8/57",NA,1957-03-13,NA,NA,1957-08-19,NA,159,NA,NA,NA,NA
"1587","Meunier","206","9A63","7",1958,"22/3/58","","","18/8/58",NA,1958-03-22,NA,NA,1958-08-18,NA,149,NA,NA,NA,NA
"1588","Meunier","206","9A63","7",1959,"","","","19/8/59",NA,NA,NA,NA,1959-08-19,NA,NA,NA,NA,NA,NA
"1589","Meunier","206","9A63","7",1960,"","","","",NA,NA,NA,NA,NA,NA,NA,NA,NA,NA,NA
"1590","Meunier","206","510S6","8",1973,"","","","20/8/73",NA,NA,NA,NA,1973-08-20,NA,NA,NA,NA,NA,NA
"1591","Meunier","206","510S6","8",1974,"23/3/74","","","14/8/74",NA,1974-03-23,NA,NA,1974-08-14,NA,144,NA,NA,NA,NA
"1592","Meunier","206","510S6","8",1975,"15/3/75","","","19/8/75",NA,1975-03-15,NA,NA,1975-08-19,NA,157,NA,NA,NA,NA
"1593","Meunier","206","510S6","8",1976,"","","","",NA,NA,NA,NA,NA,NA,NA,NA,NA,NA,NA
"1594","Meunier","206","510S6","8",1981,"","","27/7/81","",NA,NA,NA,1981-07-27,NA,NA,NA,NA,NA,NA,NA
"1595","Meunier","206","510S6","8",1982,"","","19/7/82","",NA,NA,NA,1982-07-19,NA,NA,NA,NA,NA,NA,NA
"1596","Meunier","206","510S6","8",1983,"","","2/8/1983","",NA,NA,NA,1983-08-02,NA,NA,NA,NA,NA,NA,NA
"1597","Meunier","206","510S6","8",1996,"","2/6/1996","","",NA,NA,1996-06-02,NA,NA,NA,NA,NA,NA,NA,NA
"1598","Meunier","206","510S4","9",1973,"","","","27/8/73",NA,NA,NA,NA,1973-08-27,NA,NA,NA,NA,NA,NA
"1599","Meunier","206","510S4","9",1974,"24/3/74","","","14/8/74",NA,1974-03-24,NA,NA,1974-08-14,NA,143,NA,NA,NA,NA
"1600","Meunier","206","510S4","9",1975,"13/3/75","","","19/8/75",NA,1975-03-13,NA,NA,1975-08-19,NA,159,NA,NA,NA,NA
"1601","Meunier","206","510S4","9",1976,"","","","",NA,NA,NA,NA,NA,NA,NA,NA,NA,NA,NA
"1602","Meunier","206","510S4","9",1981,"","","24/7/81","",NA,NA,NA,1981-07-24,NA,NA,NA,NA,NA,NA,NA
"1603","Meunier","206","510S4","9",1982,"","","19/7/82","",NA,NA,NA,1982-07-19,NA,NA,NA,NA,NA,NA,NA
"1604","Meunier","206","510S4","9",1983,"","","2/8/1983","",NA,NA,NA,1983-08-02,NA,NA,NA,NA,NA,NA,NA
"1605","Meunier","206","510S4","9",1996,"","29/5/96","","",NA,NA,1996-05-29,NA,NA,NA,NA,NA,NA,NA,NA
"1606","Meunier","206","510S5","10",1973,"","","","20/8/73",NA,NA,NA,NA,1973-08-20,NA,NA,NA,NA,NA,NA
"1607","Meunier","206","510S5","10",1974,"24/3/74","","","14/8/74",NA,1974-03-24,NA,NA,1974-08-14,NA,143,NA,NA,NA,NA
"1608","Meunier","206","510S5","10",1975,"13/3/75","","","19/8/75",NA,1975-03-13,NA,NA,1975-08-19,NA,159,NA,NA,NA,NA
"1609","Meunier","206","510S5","10",1976,"","","","",NA,NA,NA,NA,NA,NA,NA,NA,NA,NA,NA
"1610","Meunier","206","510S5","10",1981,"","","27/7/81","",NA,NA,NA,1981-07-27,NA,NA,NA,NA,NA,NA,NA
"1611","Meunier","206","510S5","10",1982,"","","19/7/82","",NA,NA,NA,1982-07-19,NA,NA,NA,NA,NA,NA,NA
"1612","Meunier","206","510S5","10",1983,"","","2/8/1983","",NA,NA,NA,1983-08-02,NA,NA,NA,NA,NA,NA,NA
"1613","Meunier","206","510S5","10",1996,"","1/6/1996","","",NA,NA,1996-06-01,NA,NA,NA,NA,NA,NA,NA,NA
"1614","Meunier","206","134S6","11",1973,"","","","",NA,NA,NA,NA,NA,NA,NA,NA,NA,NA,NA
"1615","Meunier","206","134S6","11",1974,"","","","8/8/1974",NA,NA,NA,NA,1974-08-08,NA,NA,NA,NA,NA,NA
"1616","Meunier","206","134S6","11",1975,"26/3/75","","","13/8/75",NA,1975-03-26,NA,NA,1975-08-13,NA,140,NA,NA,NA,NA
"1617","Meunier","206","134S6","11",1976,"22/3/76","","","17/8/76",NA,1976-03-22,NA,NA,1976-08-17,NA,148,NA,NA,NA,NA
"1618","Meunier","206","134S6","11",1977,"15/3/77","","","",NA,1977-03-15,NA,NA,NA,NA,NA,NA,NA,NA,NA
"1619","Meunier","206","134S6","11",1980,"","","4/8/1980","",NA,NA,NA,1980-08-04,NA,NA,NA,NA,NA,NA,NA
"1620","Meunier","206","134S6","11",1981,"","","24/7/81","",NA,NA,NA,1981-07-24,NA,NA,NA,NA,NA,NA,NA
"1621","Meunier","206","134S6","11",1982,"","","19/7/82","",NA,NA,NA,1982-07-19,NA,NA,NA,NA,NA,NA,NA
"1622","Meunier","206","134S6","11",1992,"","24/5/92","","",NA,NA,1992-05-24,NA,NA,NA,NA,NA,NA,NA,NA
"1623","Meunier","206","134S6","11",1994,"","20/5/94","","",NA,NA,1994-05-20,NA,NA,NA,NA,NA,NA,NA,NA
"1624","Meunier","206","134S6","11",1995,"","22/5/95","","",NA,NA,1995-05-22,NA,NA,NA,NA,NA,NA,NA,NA
"1625","Meunier","206","135A1","12",1973,"","","","14/8/73",NA,NA,NA,NA,1973-08-14,NA,NA,NA,NA,NA,NA
"1626","Meunier","206","135A1","12",1974,"25/3/74","","","2/8/1974",NA,1974-03-25,NA,NA,1974-08-02,NA,130,NA,NA,NA,NA
"1627","Meunier","206","135A1","12",1975,"10/3/1975","","","",NA,1975-03-10,NA,NA,NA,NA,NA,NA,NA,NA,NA
"1628","Meunier","206","135A1","12",1976,"21/3/76","","","17/8/76",NA,1976-03-21,NA,NA,1976-08-17,NA,149,NA,NA,NA,NA
"1629","Meunier","206","135A1","12",1980,"","","4/8/1980","",NA,NA,NA,1980-08-04,NA,NA,NA,NA,NA,NA,NA
"1630","Meunier","206","135A1","12",1981,"","","27/7/81","",NA,NA,NA,1981-07-27,NA,NA,NA,NA,NA,NA,NA
"1631","Meunier","206","135A1","12",1982,"","","19/7/82","",NA,NA,NA,1982-07-19,NA,NA,NA,NA,NA,NA,NA
"1632","Meunier","206","135A1","12",1992,"","24/5/92","","",NA,NA,1992-05-24,NA,NA,NA,NA,NA,NA,NA,NA
"1633","Meunier","206","135A1","12",1994,"","20/5/94","","",NA,NA,1994-05-20,NA,NA,NA,NA,NA,NA,NA,NA
"1634","Meunier","206","135A1","12",1995,"","24/5/95","","",NA,NA,1995-05-24,NA,NA,NA,NA,NA,NA,NA,NA
"1635","Meunier","206","135A2","13",1973,"","","","14/8/73",NA,NA,NA,NA,1973-08-14,NA,NA,NA,NA,NA,NA
"1636","Meunier","206","135A2","13",1974,"27/3/74","","","8/8/1974",NA,1974-03-27,NA,NA,1974-08-08,NA,134,NA,NA,NA,NA
"1637","Meunier","206","135A2","13",1975,"10/3/1975","","","",NA,1975-03-10,NA,NA,NA,NA,NA,NA,NA,NA,NA
"1638","Meunier","206","135A2","13",1976,"18/3/76","","","10/8/1976",NA,1976-03-18,NA,NA,1976-08-10,NA,145,NA,NA,NA,NA
"1639","Meunier","206","135A2","13",1980,"","","28/8/80","",NA,NA,NA,1980-08-28,NA,NA,NA,NA,NA,NA,NA
"1640","Meunier","206","135A2","13",1981,"","","27/7/81","",NA,NA,NA,1981-07-27,NA,NA,NA,NA,NA,NA,NA
"1641","Meunier","206","135A2","13",1982,"","","19/7/82","",NA,NA,NA,1982-07-19,NA,NA,NA,NA,NA,NA,NA
"1642","Meunier","206","135A2","13",1992,"","24/5/92","","",NA,NA,1992-05-24,NA,NA,NA,NA,NA,NA,NA,NA
"1643","Meunier","206","135A2","13",1994,"","20/5/94","","",NA,NA,1994-05-20,NA,NA,NA,NA,NA,NA,NA,NA
"1644","Meunier","206","135A2","13",1995,"","24/5/95","","",NA,NA,1995-05-24,NA,NA,NA,NA,NA,NA,NA,NA
"1645","Meunier","206","128S4","14",1973,"","","","",NA,NA,NA,NA,NA,NA,NA,NA,NA,NA,NA
"1646","Meunier","206","128S4","14",1974,"","","","",NA,NA,NA,NA,NA,NA,NA,NA,NA,NA,NA
"1647","Meunier","206","128S4","14",1975,"","","","",NA,NA,NA,NA,NA,NA,NA,NA,NA,NA,NA
"1648","Meunier","206","128S4","14",1976,"","","","",NA,NA,NA,NA,NA,NA,NA,NA,NA,NA,NA
"1649","Meunier","206","128S4","14",1980,"","","8/8/1980","",NA,NA,NA,1980-08-08,NA,NA,NA,NA,NA,NA,NA
"1650","Meunier","206","128S4","14",1981,"","","12/7/1981","",NA,NA,NA,1981-07-12,NA,NA,NA,NA,NA,NA,NA
"1651","Meunier","206","128S4","14",1982,"","","6/8/1982","",NA,NA,NA,1982-08-06,NA,NA,NA,NA,NA,NA,NA
"1652","Meunier","206","128S4","14",1989,"","","","1/8/1989",NA,NA,NA,NA,1989-08-01,NA,NA,NA,NA,NA,NA
"1653","Meunier","206","128S4","14",1983,"","","","23/8/83",NA,NA,NA,NA,1983-08-23,NA,NA,NA,NA,NA,NA
"1654","Meunier","206","128S4","14",1984,"","","","24/8/84",NA,NA,NA,NA,1984-08-24,NA,NA,NA,NA,NA,NA
"1655","Meunier","206","128S4","14",1992,"","20/5/92","","",NA,NA,1992-05-20,NA,NA,NA,NA,NA,NA,NA,NA
"1656","Meunier","206","128S4","14",1994,"","24/5/94","","",NA,NA,1994-05-24,NA,NA,NA,NA,NA,NA,NA,NA
"1657","Meunier","206","128S4","14",1995,"","17/5/95","","",NA,NA,1995-05-17,NA,NA,NA,NA,NA,NA,NA,NA
"1658","Meunier","206","128S4","14",1996,"21/3/96","25/5/96","25/7/96","",NA,1996-03-21,1996-05-25,1996-07-25,NA,NA,NA,65,61,NA,126
"1659","Meunier","206","135A3","15",1973,"","","","",NA,NA,NA,NA,NA,NA,NA,NA,NA,NA,NA
"1660","Meunier","206","135A3","15",1974,"24/3/74","","","8/8/1974",NA,1974-03-24,NA,NA,1974-08-08,NA,137,NA,NA,NA,NA
"1661","Meunier","206","135A3","15",1975,"10/3/1975","","","13/8/75",NA,1975-03-10,NA,NA,1975-08-13,NA,156,NA,NA,NA,NA
"1662","Meunier","206","135A3","15",1976,"22/3/76","","","18/8/76",NA,1976-03-22,NA,NA,1976-08-18,NA,149,NA,NA,NA,NA
"1663","Meunier","206","135A3","15",1980,"","","4/8/1980","",NA,NA,NA,1980-08-04,NA,NA,NA,NA,NA,NA,NA
"1664","Meunier","206","135A3","15",1981,"","","24/7/81","",NA,NA,NA,1981-07-24,NA,NA,NA,NA,NA,NA,NA
"1665","Meunier","206","135A3","15",1982,"","","19/7/82","",NA,NA,NA,1982-07-19,NA,NA,NA,NA,NA,NA,NA
"1666","Meunier","206","135A3","15",1992,"","24/5/92","","",NA,NA,1992-05-24,NA,NA,NA,NA,NA,NA,NA,NA
"1667","Meunier","206","135A3","15",1994,"","20/5/94","","",NA,NA,1994-05-20,NA,NA,NA,NA,NA,NA,NA,NA
"1668","Meunier","206","135A3","15",1995,"","24/5/95","","",NA,NA,1995-05-24,NA,NA,NA,NA,NA,NA,NA,NA
"1669","Meunier","206","135A4","16",1973,"","","","",NA,NA,NA,NA,NA,NA,NA,NA,NA,NA,NA
"1670","Meunier","206","135A4","16",1974,"20/3/74","","","8/8/1974",NA,1974-03-20,NA,NA,1974-08-08,NA,141,NA,NA,NA,NA
"1671","Meunier","206","135A4","16",1975,"10/3/1975","","","13/8/75",NA,1975-03-10,NA,NA,1975-08-13,NA,156,NA,NA,NA,NA
"1672","Meunier","206","135A4","16",1976,"22/3/76","","","25/8/76",NA,1976-03-22,NA,NA,1976-08-25,NA,156,NA,NA,NA,NA
"1673","Meunier","206","135A4","16",1980,"","","4/8/1980","",NA,NA,NA,1980-08-04,NA,NA,NA,NA,NA,NA,NA
"1674","Meunier","206","135A4","16",1981,"","","20/7/81","",NA,NA,NA,1981-07-20,NA,NA,NA,NA,NA,NA,NA
"1675","Meunier","206","135A4","16",1982,"","","12/7/1982","",NA,NA,NA,1982-07-12,NA,NA,NA,NA,NA,NA,NA
"1676","Meunier","206","135A4","16",1992,"","23/5/92","","",NA,NA,1992-05-23,NA,NA,NA,NA,NA,NA,NA,NA
"1677","Meunier","206","135A4","16",1994,"","24/5/94","","",NA,NA,1994-05-24,NA,NA,NA,NA,NA,NA,NA,NA
"1678","Meunier","206","135A4","16",1995,"","24/5/95","","",NA,NA,1995-05-24,NA,NA,NA,NA,NA,NA,NA,NA
"1679","Meunier","206","133S3","17",1973,"","","","27/8/73",NA,NA,NA,NA,1973-08-27,NA,NA,NA,NA,NA,NA
"1680","Meunier","206","133S3","17",1974,"25/3/74","","","14/8/74",NA,1974-03-25,NA,NA,1974-08-14,NA,142,NA,NA,NA,NA
"1681","Meunier","206","133S3","17",1975,"12/3/1975","","","13/8/75",NA,1975-03-12,NA,NA,1975-08-13,NA,154,NA,NA,NA,NA
"1682","Meunier","206","133S3","17",1976,"18/3/76","","","",NA,1976-03-18,NA,NA,NA,NA,NA,NA,NA,NA,NA
"1683","Meunier","206","133S3","17",1980,"","","4/8/1980","",NA,NA,NA,1980-08-04,NA,NA,NA,NA,NA,NA,NA
"1684","Meunier","206","133S3","17",1981,"","","24/7/81","",NA,NA,NA,1981-07-24,NA,NA,NA,NA,NA,NA,NA
"1685","Meunier","206","133S3","17",1982,"","","22/7/82","",NA,NA,NA,1982-07-22,NA,NA,NA,NA,NA,NA,NA
"1686","Meunier","206","133S3","17",1992,"","20/5/92","","",NA,NA,1992-05-20,NA,NA,NA,NA,NA,NA,NA,NA
"1687","Meunier","206","133S3","17",1994,"","25/5/94","","",NA,NA,1994-05-25,NA,NA,NA,NA,NA,NA,NA,NA
"1688","Meunier","206","133S3","17",1995,"","25/5/95","","",NA,NA,1995-05-25,NA,NA,NA,NA,NA,NA,NA,NA
"1689","Meunier","206","132A2","18",1973,"","","","14/8/73",NA,NA,NA,NA,1973-08-14,NA,NA,NA,NA,NA,NA
"1690","Meunier","206","132A2","18",1974,"24/3/74","","","2/8/1974",NA,1974-03-24,NA,NA,1974-08-02,NA,131,NA,NA,NA,NA
"1691","Meunier","206","132A2","18",1975,"10/3/1975","","","19/8/75",NA,1975-03-10,NA,NA,1975-08-19,NA,162,NA,NA,NA,NA
"1692","Meunier","206","132A2","18",1976,"15/3/76","","","",NA,1976-03-15,NA,NA,NA,NA,NA,NA,NA,NA,NA
"1693","Meunier","206","132A2","18",1980,"","","28/7/80","",NA,NA,NA,1980-07-28,NA,NA,NA,NA,NA,NA,NA
"1694","Meunier","206","132A2","18",1981,"","","24/7/81","",NA,NA,NA,1981-07-24,NA,NA,NA,NA,NA,NA,NA
"1695","Meunier","206","132A2","18",1982,"","","12/7/1982","",NA,NA,NA,1982-07-12,NA,NA,NA,NA,NA,NA,NA
"1696","Meunier","206","132A2","18",1992,"","24/5/92","","",NA,NA,1992-05-24,NA,NA,NA,NA,NA,NA,NA,NA
"1697","Meunier","206","132A2","18",1994,"","24/5/94","","",NA,NA,1994-05-24,NA,NA,NA,NA,NA,NA,NA,NA
"1698","Meunier","206","132A2","18",1995,"","25/5/95","","",NA,NA,1995-05-25,NA,NA,NA,NA,NA,NA,NA,NA
"1699","Meunier","206","1321A7","19",1973,"","","","",NA,NA,NA,NA,NA,NA,NA,NA,NA,NA,NA
"1700","Meunier","206","1321A7","19",1974,"","","","",NA,NA,NA,NA,NA,NA,NA,NA,NA,NA,NA
"1701","Meunier","206","1321A7","19",1975,"","","","",NA,NA,NA,NA,NA,NA,NA,NA,NA,NA,NA
"1702","Meunier","206","1321A7","19",1976,"","","","",NA,NA,NA,NA,NA,NA,NA,NA,NA,NA,NA
"1703","Meunier","206","1426A1","20",1973,"","","","",NA,NA,NA,NA,NA,NA,NA,NA,NA,NA,NA
"1704","Meunier","206","1426A1","20",1974,"","","","",NA,NA,NA,NA,NA,NA,NA,NA,NA,NA,NA
"1705","Meunier","206","1426A1","20",1975,"","","","",NA,NA,NA,NA,NA,NA,NA,NA,NA,NA,NA
"1706","Meunier","206","1426A1","20",1976,"","","","",NA,NA,NA,NA,NA,NA,NA,NA,NA,NA,NA
"1707","Meunier","206","10RSs386","21",1994,"3/3/1994","16/5/94","21/7/94","8/8/1994",NA,1994-03-03,1994-05-16,1994-07-21,1994-08-08,NA,158,74,66,18,140
"1708","Meunier","206","10RSs386","21",1995,"13/3/95","23/5/95","20/7/95","16/8/95",NA,1995-03-13,1995-05-23,1995-07-20,1995-08-16,NA,156,71,58,27,129
"1709","Pinot blanc","194","cl5P14S6","1",1956,"","","","19/8/56",NA,NA,NA,NA,1956-08-19,NA,NA,NA,NA,NA,NA
"1710","Pinot blanc","194","cl5P14S6","1",1957,"","","","",NA,NA,NA,NA,NA,NA,NA,NA,NA,NA,NA
"1711","Pinot blanc","194","cl5P14S6","1",1958,"26/3/58","","","",NA,1958-03-26,NA,NA,NA,NA,NA,NA,NA,NA,NA
"1712","Pinot blanc","194","cl5P14S6","1",1959,"19/3/59","","","17/8/59",NA,1959-03-19,NA,NA,1959-08-17,NA,151,NA,NA,NA,NA
"1713","Pinot blanc","194","cl5P14S6","1",1960,"14/3/60","","","16/8/60",NA,1960-03-14,NA,NA,1960-08-16,NA,155,NA,NA,NA,NA
"1714","Pinot blanc","194","cl5P14S6","1",1961,"11/3/1961","","","",NA,1961-03-11,NA,NA,NA,NA,NA,NA,NA,NA,NA
"1715","Pinot blanc","194","cl5P14S6","1",1962,"5/4/1962","","","",NA,1962-04-05,NA,NA,NA,NA,NA,NA,NA,NA,NA
"1716","Pinot blanc","194","7S44","2",1956,"29/3/56","","","10/9/1956",NA,1956-03-29,NA,NA,1956-09-10,NA,165,NA,NA,NA,NA
"1717","Pinot blanc","194","7S44","2",1957,"13/3/57","","","20/8/57",NA,1957-03-13,NA,NA,1957-08-20,NA,160,NA,NA,NA,NA
"1718","Pinot blanc","194","7S44","2",1958,"29/3/58","","","20/8/59",NA,1958-03-29,NA,NA,1959-08-20,NA,509,NA,NA,NA,NA
"1719","Pinot blanc","194","7S45","3",1956,"29/3/56","","","10/9/1956",NA,1956-03-29,NA,NA,1956-09-10,NA,165,NA,NA,NA,NA
"1720","Pinot blanc","194","7S45","3",1957,"13/3/57","","","20/8/57",NA,1957-03-13,NA,NA,1957-08-20,NA,160,NA,NA,NA,NA
"1721","Pinot blanc","194","7S45","3",1958,"28/3/58","","","27/8/58",NA,1958-03-28,NA,NA,1958-08-27,NA,152,NA,NA,NA,NA
"1722","Pinot blanc","194","4P11S5","4",1956,"","","","21/8/56",NA,NA,NA,NA,1956-08-21,NA,NA,NA,NA,NA,NA
"1723","Pinot blanc","194","4P11S5","4",1957,"9/3/1957","","","12/8/1957",NA,1957-03-09,NA,NA,1957-08-12,NA,156,NA,NA,NA,NA
"1724","Pinot blanc","194","4P11S5","4",1958,"28/3/58","","","18/8/58",NA,1958-03-28,NA,NA,1958-08-18,NA,143,NA,NA,NA,NA
"1725","Pinot blanc","194","4P11S5","4",1959,"13/3/59","","","",NA,1959-03-13,NA,NA,NA,NA,NA,NA,NA,NA,NA
"1726","Pinot blanc","194","4P11S5","4",1960,"14/3/60","","","",NA,1960-03-14,NA,NA,NA,NA,NA,NA,NA,NA,NA
"1727","Pinot blanc","194","4P11S5","4",1961,"7/3/1961","","","",NA,1961-03-07,NA,NA,NA,NA,NA,NA,NA,NA,NA
"1728","Pinot blanc","194","4P11S5","4",1976,"","","29/7/76","",NA,NA,NA,1976-07-29,NA,NA,NA,NA,NA,NA,NA
"1729","Pinot blanc","194","4P11S5","4",1977,"","","5/8/1977","",NA,NA,NA,1977-08-05,NA,NA,NA,NA,NA,NA,NA
"1730","Pinot blanc","194","4P11S5","4",1978,"","","31/7/78","",NA,NA,NA,1978-07-31,NA,NA,NA,NA,NA,NA,NA
"1731","Pinot blanc","194","4P11S5","4",1996,"","26/5/96","","",NA,NA,1996-05-26,NA,NA,NA,NA,NA,NA,NA,NA
"1732","Pinot blanc","194","8A148","5",1956,"","","","21/8/56",NA,NA,NA,NA,1956-08-21,NA,NA,NA,NA,NA,NA
"1733","Pinot blanc","194","8A148","5",1957,"11/3/1957","","","12/8/1957",NA,1957-03-11,NA,NA,1957-08-12,NA,154,NA,NA,NA,NA
"1734","Pinot blanc","194","8A148","5",1958,"26/3/58","","","18/8/58",NA,1958-03-26,NA,NA,1958-08-18,NA,145,NA,NA,NA,NA
"1735","Pinot blanc","194","8A148","5",1959,"15/3/59","","","",NA,1959-03-15,NA,NA,NA,NA,NA,NA,NA,NA,NA
"1736","Pinot blanc","194","9S41","6",1956,"30/3/56","","","24/8/56",NA,1956-03-30,NA,NA,1956-08-24,NA,147,NA,NA,NA,NA
"1737","Pinot blanc","194","9S41","6",1957,"11/3/1957","","","19/8/57",NA,1957-03-11,NA,NA,1957-08-19,NA,161,NA,NA,NA,NA
"1738","Pinot blanc","194","9S41","6",1958,"27/3/58","","","27/8/59",NA,1958-03-27,NA,NA,1959-08-27,NA,518,NA,NA,NA,NA
"1739","Pinot blanc","194","9A28","7",1956,"28/3/56","","","17/9/56",NA,1956-03-28,NA,NA,1956-09-17,NA,173,NA,NA,NA,NA
"1740","Pinot blanc","194","9A28","7",1957,"13/3/57","","","13/8/57",NA,1957-03-13,NA,NA,1957-08-13,NA,153,NA,NA,NA,NA
"1741","Pinot blanc","194","9A28","7",1958,"","","","",NA,NA,NA,NA,NA,NA,NA,NA,NA,NA,NA
"1742","Pinot blanc","194","9A41","8",1956,"30/3/56","","","1/10/1956",NA,1956-03-30,NA,NA,1956-10-01,NA,185,NA,NA,NA,NA
"1743","Pinot blanc","194","9A41","8",1957,"16/3/57","","","19/8/57",NA,1957-03-16,NA,NA,1957-08-19,NA,156,NA,NA,NA,NA
"1744","Pinot blanc","194","9A41","8",1958,"28/3/58","","","21/8/58",NA,1958-03-28,NA,NA,1958-08-21,NA,146,NA,NA,NA,NA
"1745","Pinot blanc","194","9A41","8",1959,"18/3/59","","","19/8/59",NA,1959-03-18,NA,NA,1959-08-19,NA,154,NA,NA,NA,NA
"1746","Pinot blanc","194","9A41","8",1960,"10/3/1960","","","",NA,1960-03-10,NA,NA,NA,NA,NA,NA,NA,NA,NA
"1747","Pinot blanc","194","9A41","8",1961,"27/2/61","","","",NA,1961-02-27,NA,NA,NA,NA,NA,NA,NA,NA,NA
"1748","Pinot blanc","194","15A141","10",1956,"9/3/1956","","","28/8/56",NA,1956-03-09,NA,NA,1956-08-28,NA,172,NA,NA,NA,NA
"1749","Pinot blanc","194","15A141","10",1957,"22/3/57","","","14/8/57",NA,1957-03-22,NA,NA,1957-08-14,NA,145,NA,NA,NA,NA
"1750","Pinot blanc","194","15A141","10",1958,"14/3/58","","","19/8/58",NA,1958-03-14,NA,NA,1958-08-19,NA,158,NA,NA,NA,NA
"1751","Pinot blanc","194","15A141","10",1976,"","","29/7/76","",NA,NA,NA,1976-07-29,NA,NA,NA,NA,NA,NA,NA
"1752","Pinot blanc","194","15A141","10",1977,"","","8/8/1977","",NA,NA,NA,1977-08-08,NA,NA,NA,NA,NA,NA,NA
"1753","Pinot blanc","194","15A141","10",1978,"","","31/7/78","",NA,NA,NA,1978-07-31,NA,NA,NA,NA,NA,NA,NA
"1754","Pinot blanc","194","15A141","10",1996,"","26/5/96","","",NA,NA,1996-05-26,NA,NA,NA,NA,NA,NA,NA,NA
"1755","Pinot blanc","194","15A142","11",1956,"","","","28/8/56",NA,NA,NA,NA,1956-08-28,NA,NA,NA,NA,NA,NA
"1756","Pinot blanc","194","15A142","11",1957,"19/3/57","","","14/8/57",NA,1957-03-19,NA,NA,1957-08-14,NA,148,NA,NA,NA,NA
"1757","Pinot blanc","194","15A142","11",1958,"14/3/58","","","19/8/58",NA,1958-03-14,NA,NA,1958-08-19,NA,158,NA,NA,NA,NA
"1758","Pinot blanc","194","15A142","11",1959,"8/3/1959","","","",NA,1959-03-08,NA,NA,NA,NA,NA,NA,NA,NA,NA
"1759","Pinot blanc","194","15A142","11",1976,"","","29/7/76","",NA,NA,NA,1976-07-29,NA,NA,NA,NA,NA,NA,NA
"1760","Pinot blanc","194","15A142","11",1977,"","","16/8/1977","",NA,NA,NA,1977-08-16,NA,NA,NA,NA,NA,NA,NA
"1761","Pinot blanc","194","15A142","11",1978,"","","31/7/78","",NA,NA,NA,1978-07-31,NA,NA,NA,NA,NA,NA,NA
"1762","Pinot blanc","194","15A142","11",1996,"","26/5/96","","",NA,NA,1996-05-26,NA,NA,NA,NA,NA,NA,NA,NA
"1763","Pinot blanc","194","15A14301.3","12",1956,"","","","28/8/56",NA,NA,NA,NA,1956-08-28,NA,NA,NA,NA,NA,NA
"1764","Pinot blanc","194","15A14301.3","12",1957,"11/3/1957","","","14/8/57",NA,1957-03-11,NA,NA,1957-08-14,NA,156,NA,NA,NA,NA
"1765","Pinot blanc","194","15A14301.3","12",1958,"19/3/58","","","5/9/1958",NA,1958-03-19,NA,NA,1958-09-05,NA,170,NA,NA,NA,NA
"1766","Pinot blanc","194","15A14301.3","12",1959,"18/3/59","","","19/8/59",NA,1959-03-18,NA,NA,1959-08-19,NA,154,NA,NA,NA,NA
"1767","Pinot blanc","194","15A14301.3","12",1960,"20/3/60","","","",NA,1960-03-20,NA,NA,NA,NA,NA,NA,NA,NA,NA
"1768","Pinot blanc","194","15A14301.3","12",1961,"8/3/1961","","","",NA,1961-03-08,NA,NA,NA,NA,NA,NA,NA,NA,NA
"1769","Pinot blanc","194","15A144","13",1956,"","","","",NA,NA,NA,NA,NA,NA,NA,NA,NA,NA,NA
"1770","Pinot blanc","194","15A144","13",1957,"9/3/1957","","","14/8/57",NA,1957-03-09,NA,NA,1957-08-14,NA,158,NA,NA,NA,NA
"1771","Pinot blanc","194","15A144","13",1958,"","","","5/9/1958",NA,NA,NA,NA,1958-09-05,NA,NA,NA,NA,NA,NA
"1772","Pinot blanc","194","15A144","13",1959,"21/3/59","","","23/8/59",NA,1959-03-21,NA,NA,1959-08-23,NA,155,NA,NA,NA,NA
"1773","Pinot blanc","194","15A144","13",1960,"14/3/60","","","23/8/60",NA,1960-03-14,NA,NA,1960-08-23,NA,162,NA,NA,NA,NA
"1774","Pinot blanc","194","15A144","13",1961,"3/3/1961","","","",NA,1961-03-03,NA,NA,NA,NA,NA,NA,NA,NA,NA
"1775","Pinot blanc","194","15A144","13",1962,"2/4/1962","","","",NA,1962-04-02,NA,NA,NA,NA,NA,NA,NA,NA,NA
"1776","Pinot blanc","194","15A14304.5","14",1956,"","","","",NA,NA,NA,NA,NA,NA,NA,NA,NA,NA,NA
"1777","Pinot blanc","194","15A14304.5","14",1957,"","","","14/8/57",NA,NA,NA,NA,1957-08-14,NA,NA,NA,NA,NA,NA
"1778","Pinot blanc","194","15A14304.5","14",1958,"27/3/58","","","19/8/59",NA,1958-03-27,NA,NA,1959-08-19,NA,510,NA,NA,NA,NA
"1779","Pinot blanc","194","15A14304.5","14",1959,"14/3/59","","","19/8/60",NA,1959-03-14,NA,NA,1960-08-19,NA,524,NA,NA,NA,NA
"1780","Pinot blanc","194","15A14304.5","14",1960,"12/3/1960","","","",NA,1960-03-12,NA,NA,NA,NA,NA,NA,NA,NA,NA
"1781","Pinot blanc","194","15A14304.5","14",1961,"1/3/1961","","","",NA,1961-03-01,NA,NA,NA,NA,NA,NA,NA,NA,NA
"1782","Pinot blanc","194","151A145","15",1956,"","","","",NA,NA,NA,NA,NA,NA,NA,NA,NA,NA,NA
"1783","Pinot blanc","194","151A145","15",1957,"9/9/1957","","","14/8/57",NA,1957-09-09,NA,NA,1957-08-14,NA,-26,NA,NA,NA,NA
"1784","Pinot blanc","194","151A145","15",1958,"26/3/58","","","5/9/1958",NA,1958-03-26,NA,NA,1958-09-05,NA,163,NA,NA,NA,NA
"1785","Pinot blanc","194","151A145","15",1959,"21/3/59","","","19/8/59",NA,1959-03-21,NA,NA,1959-08-19,NA,151,NA,NA,NA,NA
"1786","Pinot blanc","194","151A145","15",1960,"12/3/1960","","","23/8/60",NA,1960-03-12,NA,NA,1960-08-23,NA,164,NA,NA,NA,NA
"1787","Pinot blanc","194","151A145","15",1962,"1/4/1962","","","",NA,1962-04-01,NA,NA,NA,NA,NA,NA,NA,NA,NA
"1788","Pinot blanc","194","151A145","15",1976,"","","29/7/76","",NA,NA,NA,1976-07-29,NA,NA,NA,NA,NA,NA,NA
"1789","Pinot blanc","194","151A145","15",1977,"","","8/8/1977","",NA,NA,NA,1977-08-08,NA,NA,NA,NA,NA,NA,NA
"1790","Pinot blanc","194","151A145","15",1978,"","","31/7/78","",NA,NA,NA,1978-07-31,NA,NA,NA,NA,NA,NA,NA
"1791","Pinot blanc","194","151A145","15",1996,"","29/5/96","","",NA,NA,1996-05-29,NA,NA,NA,NA,NA,NA,NA,NA
"1792","Pinot blanc","194","151A146","16",1956,"","","","28/8/56",NA,NA,NA,NA,1956-08-28,NA,NA,NA,NA,NA,NA
"1793","Pinot blanc","194","151A146","16",1957,"12/3/1957","","","14/8/57",NA,1957-03-12,NA,NA,1957-08-14,NA,155,NA,NA,NA,NA
"1794","Pinot blanc","194","151A146","16",1958,"28/3/58","","","5/9/1958",NA,1958-03-28,NA,NA,1958-09-05,NA,161,NA,NA,NA,NA
"1795","Pinot blanc","194","151A146","16",1959,"19/3/59","","","19/8/59",NA,1959-03-19,NA,NA,1959-08-19,NA,153,NA,NA,NA,NA
"1796","Pinot blanc","194","151A146","16",1960,"","","","",NA,NA,NA,NA,NA,NA,NA,NA,NA,NA,NA
"1797","Pinot blanc","194","151A147","17",1956,"","","","28/8/56",NA,NA,NA,NA,1956-08-28,NA,NA,NA,NA,NA,NA
"1798","Pinot blanc","194","151A147","17",1957,"5/3/1957","","","14/8/57",NA,1957-03-05,NA,NA,1957-08-14,NA,162,NA,NA,NA,NA
"1799","Pinot blanc","194","151A147","17",1958,"27/3/58","","","5/9/1958",NA,1958-03-27,NA,NA,1958-09-05,NA,162,NA,NA,NA,NA
"1800","Pinot blanc","194","151A147","17",1959,"14/3/59","","","19/8/59",NA,1959-03-14,NA,NA,1959-08-19,NA,158,NA,NA,NA,NA
"1801","Pinot blanc","194","151A147","17",1960,"12/3/1960","","","",NA,1960-03-12,NA,NA,NA,NA,NA,NA,NA,NA,NA
"1802","Pinot blanc","194","151A147","17",1961,"2/4/1961","","","",NA,1961-04-02,NA,NA,NA,NA,NA,NA,NA,NA,NA
"1803","Pinot blanc","194","151A148","18",1956,"","","","28/8/56",NA,NA,NA,NA,1956-08-28,NA,NA,NA,NA,NA,NA
"1804","Pinot blanc","194","151A148","18",1957,"5/3/1957","","","14/8/57",NA,1957-03-05,NA,NA,1957-08-14,NA,162,NA,NA,NA,NA
"1805","Pinot blanc","194","151A148","18",1958,"25/3/58","","","5/9/1958",NA,1958-03-25,NA,NA,1958-09-05,NA,164,NA,NA,NA,NA
"1806","Pinot blanc","194","151A148","18",1959,"21/3/59","","","19/8/59",NA,1959-03-21,NA,NA,1959-08-19,NA,151,NA,NA,NA,NA
"1807","Pinot blanc","194","151A148","18",1960,"13/3/60","","","",NA,1960-03-13,NA,NA,NA,NA,NA,NA,NA,NA,NA
"1808","Pinot blanc","194","14S124","19",1956,"25/3/56","","","17/9/56",NA,1956-03-25,NA,NA,1956-09-17,NA,176,NA,NA,NA,NA
"1809","Pinot blanc","194","14S124","19",1957,"8/3/1957","","","21/8/57",NA,1957-03-08,NA,NA,1957-08-21,NA,166,NA,NA,NA,NA
"1810","Pinot blanc","194","14S124","19",1958,"22/3/58","","","28/8/58",NA,1958-03-22,NA,NA,1958-08-28,NA,159,NA,NA,NA,NA
"1811","Pinot blanc","194","14S124","19",1959,"18/3/59","","","12/8/1959",NA,1959-03-18,NA,NA,1959-08-12,NA,147,NA,NA,NA,NA
"1812","Pinot blanc","194","14S124","19",1960,"12/3/1960","","","",NA,1960-03-12,NA,NA,NA,NA,NA,NA,NA,NA,NA
"1813","Pinot blanc","194","14S124","19",1961,"3/3/1961","","","",NA,1961-03-03,NA,NA,NA,NA,NA,NA,NA,NA,NA
"1814","Pinot blanc","194","14S124","19",1962,"2/4/1962","","","",NA,1962-04-02,NA,NA,NA,NA,NA,NA,NA,NA,NA
"1815","Pinot blanc","194","cl10P9A6","20",1963,"1/4/1963","","","20/8/63",NA,1963-04-01,NA,NA,1963-08-20,NA,141,NA,NA,NA,NA
"1816","Pinot blanc","194","cl10P9A6","20",1964,"31/3/64","","","11/8/1964",NA,1964-03-31,NA,NA,1964-08-11,NA,133,NA,NA,NA,NA
"1817","Pinot blanc","194","cl10P9A6","20",1965,"20/3/65","","","18/8/65",NA,1965-03-20,NA,NA,1965-08-18,NA,151,NA,NA,NA,NA
"1818","Pinot blanc","194","1319S8","21",1993,"18/3/93","24/5/93","25/5/93","17/8/93",NA,1993-03-18,1993-05-24,1993-05-25,1993-08-17,NA,152,67,1,84,68
"1819","Pinot blanc","194","1319S8","21",1994,"7/3/1994","19/5/94","24/5/94","8/8/1994",NA,1994-03-07,1994-05-19,1994-05-24,1994-08-08,NA,154,73,5,76,78
"1820","Pinot blanc","194","1319S8","21",1995,"6/3/1995","27/5/95","27/5/95","21/8/95",NA,1995-03-06,1995-05-27,1995-05-27,1995-08-21,NA,168,82,0,86,82
"1821","Pinot gris","195","9A62","1",1956,"28/3/56","","","28/8/56",NA,1956-03-28,NA,NA,1956-08-28,NA,153,NA,NA,NA,NA
"1822","Pinot gris","195","9A62","1",1957,"13/3/57","","","19/8/57",NA,1957-03-13,NA,NA,1957-08-19,NA,159,NA,NA,NA,NA
"1823","Pinot gris","195","9A62","1",1958,"30/3/58","","","21/8/58",NA,1958-03-30,NA,NA,1958-08-21,NA,144,NA,NA,NA,NA
"1824","Pinot gris","195","9A62","1",1959,"21/3/59","","","",NA,1959-03-21,NA,NA,NA,NA,NA,NA,NA,NA,NA
"1825","Pinot gris","195","9A62","1",1960,"","","","",NA,NA,NA,NA,NA,NA,NA,NA,NA,NA,NA
"1826","Pinot gris","195","9S43","2",1956,"28/3/56","","","28/8/56",NA,1956-03-28,NA,NA,1956-08-28,NA,153,NA,NA,NA,NA
"1827","Pinot gris","195","9S43","2",1957,"11/3/1957","","","12/8/1957",NA,1957-03-11,NA,NA,1957-08-12,NA,154,NA,NA,NA,NA
"1828","Pinot gris","195","9S43","2",1958,"29/3/58","","","18/8/58",NA,1958-03-29,NA,NA,1958-08-18,NA,142,NA,NA,NA,NA
"1829","Pinot gris","195","9S43","2",1959,"","","","",NA,NA,NA,NA,NA,NA,NA,NA,NA,NA,NA
"1830","Pinot gris","195","9S43","2",1960,"","","","",NA,NA,NA,NA,NA,NA,NA,NA,NA,NA,NA
"1831","Pinot gris","195","8S145","3",1956,"","","","",NA,NA,NA,NA,NA,NA,NA,NA,NA,NA,NA
"1832","Pinot gris","195","8S145","3",1957,"9/3/1957","","","19/8/57",NA,1957-03-09,NA,NA,1957-08-19,NA,163,NA,NA,NA,NA
"1833","Pinot gris","195","8S145","3",1958,"28/3/58","","","21/8/58",NA,1958-03-28,NA,NA,1958-08-21,NA,146,NA,NA,NA,NA
"1834","Pinot gris","195","8S145","3",1959,"16/3/59","","","11/8/1959",NA,1959-03-16,NA,NA,1959-08-11,NA,148,NA,NA,NA,NA
"1835","Pinot gris","195","8S145","3",1960,"14/3/60","","","",NA,1960-03-14,NA,NA,NA,NA,NA,NA,NA,NA,NA
"1836","Pinot gris","195","8S145","3",1961,"6/3/1961","","","",NA,1961-03-06,NA,NA,NA,NA,NA,NA,NA,NA,NA
"1837","Pinot gris","195","clP14A6","4",1956,"","","","",NA,NA,NA,NA,NA,NA,NA,NA,NA,NA,NA
"1838","Pinot gris","195","clP14A6","4",1957,"","","","",NA,NA,NA,NA,NA,NA,NA,NA,NA,NA,NA
"1839","Pinot gris","195","clP14A6","4",1958,"28/3/58","","","19/8/58",NA,1958-03-28,NA,NA,1958-08-19,NA,144,NA,NA,NA,NA
"1840","Pinot gris","195","clP14A6","4",1959,"16/3/59","","","17/8/59",NA,1959-03-16,NA,NA,1959-08-17,NA,154,NA,NA,NA,NA
"1841","Pinot gris","195","clP14A6","4",1960,"16/3/60","","","1/8/1960",NA,1960-03-16,NA,NA,1960-08-01,NA,138,NA,NA,NA,NA
"1842","Pinot gris","195","clP14A6","4",1961,"14/3/61","","","",NA,1961-03-14,NA,NA,NA,NA,NA,NA,NA,NA,NA
"1843","Pinot gris","195","411S9","5",1956,"30/3/56","","","3/9/1956",NA,1956-03-30,NA,NA,1956-09-03,NA,157,NA,NA,NA,NA
"1844","Pinot gris","195","411S9","5",1957,"9/3/1957","","","20/8/57",NA,1957-03-09,NA,NA,1957-08-20,NA,164,NA,NA,NA,NA
"1845","Pinot gris","195","411S9","5",1958,"27/3/58","","","20/8/58",NA,1958-03-27,NA,NA,1958-08-20,NA,146,NA,NA,NA,NA
"1846","Pinot gris","195","411S9","5",1959,"","","","",NA,NA,NA,NA,NA,NA,NA,NA,NA,NA,NA
"1847","Pinot gris","195","411S9","5",1960,"","","","",NA,NA,NA,NA,NA,NA,NA,NA,NA,NA,NA
"1848","Pinot gris","195","411S9","5",1996,"","26/5/96","","",NA,NA,1996-05-26,NA,NA,NA,NA,NA,NA,NA,NA
"1849","Pinot gris","195","412A3","6",1956,"30/3/56","","","3/9/1956",NA,1956-03-30,NA,NA,1956-09-03,NA,157,NA,NA,NA,NA
"1850","Pinot gris","195","412A3","6",1957,"13/3/57","","","20/8/57",NA,1957-03-13,NA,NA,1957-08-20,NA,160,NA,NA,NA,NA
"1851","Pinot gris","195","412A3","6",1958,"1/4/1958","","","20/8/58",NA,1958-04-01,NA,NA,1958-08-20,NA,141,NA,NA,NA,NA
"1852","Pinot gris","195","412A3","6",1959,"17/3/59","","","",NA,1959-03-17,NA,NA,NA,NA,NA,NA,NA,NA,NA
"1853","Pinot gris","195","412A3","6",1960,"","","","",NA,NA,NA,NA,NA,NA,NA,NA,NA,NA,NA
"1854","Pinot gris","195","412A3","6",1996,"","26/5/96","","",NA,NA,1996-05-26,NA,NA,NA,NA,NA,NA,NA,NA
"1855","Pinot gris","195","412A6","7",1956,"27/3/56","","","3/9/1956",NA,1956-03-27,NA,NA,1956-09-03,NA,160,NA,NA,NA,NA
"1856","Pinot gris","195","412A6","7",1957,"12/3/1957","","","20/8/57",NA,1957-03-12,NA,NA,1957-08-20,NA,161,NA,NA,NA,NA
"1857","Pinot gris","195","412A6","7",1958,"31/3/58","","","20/8/58",NA,1958-03-31,NA,NA,1958-08-20,NA,142,NA,NA,NA,NA
"1858","Pinot gris","195","412A6","7",1959,"17/3/59","","","",NA,1959-03-17,NA,NA,NA,NA,NA,NA,NA,NA,NA
"1859","Pinot gris","195","412A6","7",1960,"","","","",NA,NA,NA,NA,NA,NA,NA,NA,NA,NA,NA
"1860","Pinot gris","195","cl5P14A5","8",1956,"","","","",NA,NA,NA,NA,NA,NA,NA,NA,NA,NA,NA
"1861","Pinot gris","195","cl5P14A5","8",1957,"","","","",NA,NA,NA,NA,NA,NA,NA,NA,NA,NA,NA
"1862","Pinot gris","195","cl5P14A5","8",1958,"1/4/1958","","","19/8/58",NA,1958-04-01,NA,NA,1958-08-19,NA,140,NA,NA,NA,NA
"1863","Pinot gris","195","cl5P14A5","8",1959,"16/3/59","","","17/8/59",NA,1959-03-16,NA,NA,1959-08-17,NA,154,NA,NA,NA,NA
"1864","Pinot gris","195","cl5P14A5","8",1960,"16/3/60","","","1/8/1960",NA,1960-03-16,NA,NA,1960-08-01,NA,138,NA,NA,NA,NA
"1865","Pinot gris","195","cl5P14A5","8",1961,"14/3/61","","","",NA,1961-03-14,NA,NA,NA,NA,NA,NA,NA,NA,NA
"1866","Pinot gris","195","cl5P14A5","8",1962,"5/4/1962","","","",NA,1962-04-05,NA,NA,NA,NA,NA,NA,NA,NA,NA
"1867","Pinot gris","195","cl5P14A5","8",1996,"","26/5/96","","",NA,NA,1996-05-26,NA,NA,NA,NA,NA,NA,NA,NA
"1868","Pinot gris","195","9A65","9",1956,"28/3/56","","","21/8/56",NA,1956-03-28,NA,NA,1956-08-21,NA,146,NA,NA,NA,NA
"1869","Pinot gris","195","9A65","9",1957,"11/3/1957","","","19/8/57",NA,1957-03-11,NA,NA,1957-08-19,NA,161,NA,NA,NA,NA
"1870","Pinot gris","195","9A65","9",1958,"26/3/58","","","21/8/58",NA,1958-03-26,NA,NA,1958-08-21,NA,148,NA,NA,NA,NA
"1871","Pinot gris","195","9A65","9",1959,"","","","",NA,NA,NA,NA,NA,NA,NA,NA,NA,NA,NA
"1872","Pinot gris","195","9A65","9",1960,"","","","",NA,NA,NA,NA,NA,NA,NA,NA,NA,NA,NA
"1873","Pinot gris","195","10A93","10",1956,"","","","",NA,NA,NA,NA,NA,NA,NA,NA,NA,NA,NA
"1874","Pinot gris","195","10A93","10",1957,"","","","",NA,NA,NA,NA,NA,NA,NA,NA,NA,NA,NA
"1875","Pinot gris","195","10A93","10",1958,"","","","",NA,NA,NA,NA,NA,NA,NA,NA,NA,NA,NA
"1876","Pinot gris","195","10A93","10",1959,"","","","",NA,NA,NA,NA,NA,NA,NA,NA,NA,NA,NA
"1877","Pinot gris","195","10A93","10",1960,"","","","",NA,NA,NA,NA,NA,NA,NA,NA,NA,NA,NA
"1878","Pinot gris","195","7S35","11",1956,"","","","3/9/1956",NA,NA,NA,NA,1956-09-03,NA,NA,NA,NA,NA,NA
"1879","Pinot gris","195","7S35","11",1957,"14/3/57","","","20/8/57",NA,1957-03-14,NA,NA,1957-08-20,NA,159,NA,NA,NA,NA
"1880","Pinot gris","195","7S35","11",1958,"29/3/58","","","29/8/58",NA,1958-03-29,NA,NA,1958-08-29,NA,153,NA,NA,NA,NA
"1881","Pinot gris","195","7S35","11",1959,"17/3/59","","","",NA,1959-03-17,NA,NA,NA,NA,NA,NA,NA,NA,NA
"1882","Pinot gris","195","7S35","11",1960,"16/3/60","","","",NA,1960-03-16,NA,NA,NA,NA,NA,NA,NA,NA,NA
"1883","Pinot gris","195","15S142","12",1956,"","","","28/8/56",NA,NA,NA,NA,1956-08-28,NA,NA,NA,NA,NA,NA
"1884","Pinot gris","195","15S142","12",1957,"12/3/1957","","","14/8/57",NA,1957-03-12,NA,NA,1957-08-14,NA,155,NA,NA,NA,NA
"1885","Pinot gris","195","15S142","12",1958,"27/3/58","","","5/9/1958",NA,1958-03-27,NA,NA,1958-09-05,NA,162,NA,NA,NA,NA
"1886","Pinot gris","195","15S142","12",1959,"19/3/59","","","19/8/59",NA,1959-03-19,NA,NA,1959-08-19,NA,153,NA,NA,NA,NA
"1887","Pinot gris","195","15S142","12",1960,"","","","",NA,NA,NA,NA,NA,NA,NA,NA,NA,NA,NA
"1888","Pinot gris","195","15S143","13",1956,"","","","",NA,NA,NA,NA,NA,NA,NA,NA,NA,NA,NA
"1889","Pinot gris","195","15S143","13",1957,"","","","14/8/57",NA,NA,NA,NA,1957-08-14,NA,NA,NA,NA,NA,NA
"1890","Pinot gris","195","15S143","13",1958,"27/3/58","","","5/9/1958",NA,1958-03-27,NA,NA,1958-09-05,NA,162,NA,NA,NA,NA
"1891","Pinot gris","195","15S143","13",1959,"21/3/59","","","12/8/1959",NA,1959-03-21,NA,NA,1959-08-12,NA,144,NA,NA,NA,NA
"1892","Pinot gris","195","15S143","13",1960,"16/3/60","","","23/8/60",NA,1960-03-16,NA,NA,1960-08-23,NA,160,NA,NA,NA,NA
"1893","Pinot gris","195","15S143","13",1961,"","","","7/8/1961",NA,NA,NA,NA,1961-08-07,NA,NA,NA,NA,NA,NA
"1894","Pinot gris","195","15S143","13",1994,"","20/5/94","","",NA,NA,1994-05-20,NA,NA,NA,NA,NA,NA,NA,NA
"1895","Pinot gris","195","15S143","13",1995,"","27/5/95","","",NA,NA,1995-05-27,NA,NA,NA,NA,NA,NA,NA,NA
"1896","Pinot gris","195","15S143","13",1996,"","26/5/96","","",NA,NA,1996-05-26,NA,NA,NA,NA,NA,NA,NA,NA
"1897","Pinot gris","195","15S144","14",1956,"","","","",NA,NA,NA,NA,NA,NA,NA,NA,NA,NA,NA
"1898","Pinot gris","195","15S144","14",1957,"","","","14/8/57",NA,NA,NA,NA,1957-08-14,NA,NA,NA,NA,NA,NA
"1899","Pinot gris","195","15S144","14",1958,"27/3/58","","","5/9/1958",NA,1958-03-27,NA,NA,1958-09-05,NA,162,NA,NA,NA,NA
"1900","Pinot gris","195","15S144","14",1959,"21/3/59","","","12/8/1959",NA,1959-03-21,NA,NA,1959-08-12,NA,144,NA,NA,NA,NA
"1901","Pinot gris","195","15S144","14",1960,"16/3/60","","","23/8/60",NA,1960-03-16,NA,NA,1960-08-23,NA,160,NA,NA,NA,NA
"1902","Pinot gris","195","15S144","14",1961,"","","","7/8/1961",NA,NA,NA,NA,1961-08-07,NA,NA,NA,NA,NA,NA
"1903","Pinot gris","195","15S145","15",1956,"","","","28/8/56",NA,NA,NA,NA,1956-08-28,NA,NA,NA,NA,NA,NA
"1904","Pinot gris","195","15S145","15",1957,"9/3/1957","","","14/8/57",NA,1957-03-09,NA,NA,1957-08-14,NA,158,NA,NA,NA,NA
"1905","Pinot gris","195","15S145","15",1958,"22/3/58","","","5/9/1958",NA,1958-03-22,NA,NA,1958-09-05,NA,167,NA,NA,NA,NA
"1906","Pinot gris","195","15S145","15",1959,"14/3/59","","","12/8/1959",NA,1959-03-14,NA,NA,1959-08-12,NA,151,NA,NA,NA,NA
"1907","Pinot gris","195","15S145","15",1960,"","","","",NA,NA,NA,NA,NA,NA,NA,NA,NA,NA,NA
"1908","Pinot gris","195","15S146","16",1956,"","","","28/8/56",NA,NA,NA,NA,1956-08-28,NA,NA,NA,NA,NA,NA
"1909","Pinot gris","195","15S146","16",1957,"11/3/1957","","","14/8/57",NA,1957-03-11,NA,NA,1957-08-14,NA,156,NA,NA,NA,NA
"1910","Pinot gris","195","15S146","16",1958,"26/3/58","","","5/9/1958",NA,1958-03-26,NA,NA,1958-09-05,NA,163,NA,NA,NA,NA
"1911","Pinot gris","195","15S146","16",1959,"18/3/59","","","12/8/1959",NA,1959-03-18,NA,NA,1959-08-12,NA,147,NA,NA,NA,NA
"1912","Pinot gris","195","15S146","16",1960,"","","","",NA,NA,NA,NA,NA,NA,NA,NA,NA,NA,NA
"1913","Pinot gris","195","15S146","16",1996,"","26/5/96","","",NA,NA,1996-05-26,NA,NA,NA,NA,NA,NA,NA,NA
"1914","Pinot gris","195","15S147","17",1956,"","","","28/8/56",NA,NA,NA,NA,1956-08-28,NA,NA,NA,NA,NA,NA
"1915","Pinot gris","195","15S147","17",1957,"11/3/1957","","","14/8/57",NA,1957-03-11,NA,NA,1957-08-14,NA,156,NA,NA,NA,NA
"1916","Pinot gris","195","15S147","17",1958,"29/3/58","","","5/9/1958",NA,1958-03-29,NA,NA,1958-09-05,NA,160,NA,NA,NA,NA
"1917","Pinot gris","195","15S147","17",1959,"14/3/59","","","12/8/1959",NA,1959-03-14,NA,NA,1959-08-12,NA,151,NA,NA,NA,NA
"1918","Pinot gris","195","15S147","17",1960,"14/3/60","","","",NA,1960-03-14,NA,NA,NA,NA,NA,NA,NA,NA,NA
"1919","Pinot gris","195","15S148","18",1956,"","","","",NA,NA,NA,NA,NA,NA,NA,NA,NA,NA,NA
"1920","Pinot gris","195","15S148","18",1957,"9/3/1957","","","14/8/57",NA,1957-03-09,NA,NA,1957-08-14,NA,158,NA,NA,NA,NA
"1921","Pinot gris","195","15S148","18",1958,"27/3/58","","","5/9/1958",NA,1958-03-27,NA,NA,1958-09-05,NA,162,NA,NA,NA,NA
"1922","Pinot gris","195","15S148","18",1959,"18/3/59","","","12/8/1959",NA,1959-03-18,NA,NA,1959-08-12,NA,147,NA,NA,NA,NA
"1923","Pinot gris","195","15S148","18",1960,"","","","9/8/1960",NA,NA,NA,NA,1960-08-09,NA,NA,NA,NA,NA,NA
"1924","Pinot gris","195","15S148","18",1961,"","","","7/8/1961",NA,NA,NA,NA,1961-08-07,NA,NA,NA,NA,NA,NA
"1925","Pinot gris","195","14S121","19",1956,"26/3/56","","","17/9/56",NA,1956-03-26,NA,NA,1956-09-17,NA,175,NA,NA,NA,NA
"1926","Pinot gris","195","14S121","19",1957,"8/3/1957","","","2/9/1957",NA,1957-03-08,NA,NA,1957-09-02,NA,178,NA,NA,NA,NA
"1927","Pinot gris","195","14S121","19",1958,"27/3/58","","","19/8/58",NA,1958-03-27,NA,NA,1958-08-19,NA,145,NA,NA,NA,NA
"1928","Pinot gris","195","14S121","19",1959,"19/3/59","","","19/8/59",NA,1959-03-19,NA,NA,1959-08-19,NA,153,NA,NA,NA,NA
"1929","Pinot gris","195","14S121","19",1960,"","","","",NA,NA,NA,NA,NA,NA,NA,NA,NA,NA,NA
"1930","Pinot gris","195","9A119","20",1956,"29/3/56","","","28/8/56",NA,1956-03-29,NA,NA,1956-08-28,NA,152,NA,NA,NA,NA
"1931","Pinot gris","195","9A119","20",1957,"7/3/1957","","","19/8/57",NA,1957-03-07,NA,NA,1957-08-19,NA,165,NA,NA,NA,NA
"1932","Pinot gris","195","9A119","20",1958,"27/3/58","","","18/8/58",NA,1958-03-27,NA,NA,1958-08-18,NA,144,NA,NA,NA,NA
"1933","Pinot gris","195","9A119","20",1959,"19/3/59","","","",NA,1959-03-19,NA,NA,NA,NA,NA,NA,NA,NA,NA
"1934","Pinot gris","195","9A119","20",1960,"","","","",NA,NA,NA,NA,NA,NA,NA,NA,NA,NA,NA
"1935","Pinot gris","195","cl10P9A6","21",1963,"8/4/1963","","","",NA,1963-04-08,NA,NA,NA,NA,NA,NA,NA,NA,NA
"1936","Pinot gris","195","cl10P9A6","21",1964,"1/4/1964","","","11/8/1964",NA,1964-04-01,NA,NA,1964-08-11,NA,132,NA,NA,NA,NA
"1937","Pinot gris","195","cl10P9A6","21",1965,"30/3/65","","","18/8/65",NA,1965-03-30,NA,NA,1965-08-18,NA,141,NA,NA,NA,NA
"1938","Pinot gris","195","cl10P9A6","21",1966,"16/3/66","","","23/8/66",NA,1966-03-16,NA,NA,1966-08-23,NA,160,NA,NA,NA,NA
"1939","Pinot gris","195","cl10P9A6","21",1967,"","","","",NA,NA,NA,NA,NA,NA,NA,NA,NA,NA,NA
"1940","Pinot gris","195","cl10P11A8","22",1963,"28/3/63","","","21/8/63",NA,1963-03-28,NA,NA,1963-08-21,NA,146,NA,NA,NA,NA
"1941","Pinot gris","195","cl10P11A8","22",1964,"26/3/64","","","11/8/1964",NA,1964-03-26,NA,NA,1964-08-11,NA,138,NA,NA,NA,NA
"1942","Pinot gris","195","cl10P11A8","22",1965,"30/3/65","","","18/8/65",NA,1965-03-30,NA,NA,1965-08-18,NA,141,NA,NA,NA,NA
"1943","Pinot gris","195","cl10P11A8","22",1966,"16/3/66","","","",NA,1966-03-16,NA,NA,NA,NA,NA,NA,NA,NA,NA
"1944","Pinot gris","195","cl10P11A8","22",1967,"","","","",NA,NA,NA,NA,NA,NA,NA,NA,NA,NA,NA
"1945","Pinot gris","195","cl10P11A9","23",1963,"22/3/63","","","",NA,1963-03-22,NA,NA,NA,NA,NA,NA,NA,NA,NA
"1946","Pinot gris","195","cl10P11A9","23",1964,"","","","11/8/1964",NA,NA,NA,NA,1964-08-11,NA,NA,NA,NA,NA,NA
"1947","Pinot gris","195","cl10P11A9","23",1965,"31/3/65","","","18/8/65",NA,1965-03-31,NA,NA,1965-08-18,NA,140,NA,NA,NA,NA
"1948","Pinot gris","195","cl10P11A9","23",1966,"16/3/66","","","23/8/66",NA,1966-03-16,NA,NA,1966-08-23,NA,160,NA,NA,NA,NA
"1949","Pinot gris","195","cl10P11A9","23",1967,"","","","23/8/67",NA,NA,NA,NA,1967-08-23,NA,NA,NA,NA,NA,NA
"1950","Pinot gris","195","cl10P1558","24",1963,"","","","",NA,NA,NA,NA,NA,NA,NA,NA,NA,NA,NA
"1951","Pinot gris","195","cl10P1558","24",1964,"26/3/64","","","11/8/1964",NA,1964-03-26,NA,NA,1964-08-11,NA,138,NA,NA,NA,NA
"1952","Pinot gris","195","cl10P1558","24",1965,"24/3/65","","","19/8/65",NA,1965-03-24,NA,NA,1965-08-19,NA,148,NA,NA,NA,NA
"1953","Pinot gris","195","cl10P1558","24",1966,"16/3/66","","","30/8/66",NA,1966-03-16,NA,NA,1966-08-30,NA,167,NA,NA,NA,NA
"1954","Pinot gris","195","cl10P1558","24",1967,"","","","",NA,NA,NA,NA,NA,NA,NA,NA,NA,NA,NA
"1955","Pinot gris","195","cl10P1559","25",1963,"","","","",NA,NA,NA,NA,NA,NA,NA,NA,NA,NA,NA
"1956","Pinot gris","195","cl10P1559","25",1964,"26/3/64","","","11/8/1964",NA,1964-03-26,NA,NA,1964-08-11,NA,138,NA,NA,NA,NA
"1957","Pinot gris","195","cl10P1559","25",1965,"31/3/65","","","19/8/65",NA,1965-03-31,NA,NA,1965-08-19,NA,141,NA,NA,NA,NA
"1958","Pinot gris","195","cl10P1559","25",1966,"14/3/66","","","30/8/66",NA,1966-03-14,NA,NA,1966-08-30,NA,169,NA,NA,NA,NA
"1959","Pinot gris","195","cl10P1559","25",1967,"","","","",NA,NA,NA,NA,NA,NA,NA,NA,NA,NA,NA
"1960","Pinot gris","195","10R4s34","26",1992,"23/3/92","20/5/92","21/7/92","17/8/92",NA,1992-03-23,1992-05-20,1992-07-21,1992-08-17,NA,147,58,62,27,120
"1961","Pinot gris","195","10R4s34","26",1993,"18/3/93","26/5/93","25/7/93","16/8/93",NA,1993-03-18,1993-05-26,1993-07-25,1993-08-16,NA,151,69,60,22,129
"1962","Pinot gris","195","10R4s34","26",1994,"7/3/1994","25/5/94","25/7/94","16/8/94",NA,1994-03-07,1994-05-25,1994-07-25,1994-08-16,NA,162,79,61,22,140
"1963","CarignanNoir","18","18Mtp1","",1956,"4/4/1956",NA,NA,"10/9/1956",NA,1956-04-04,NA,NA,1956-09-10,NA,159,NA,NA,NA,NA
"1964","CarignanNoir","18","18Mtp1","",1957,"19/3/57",NA,NA,"9/9/1957",NA,1957-03-19,NA,NA,1957-09-09,NA,174,NA,NA,NA,NA
"1965","CarignanNoir","18","18Mtp1","",1958,"3/4/1958",NA,NA,"29/8/58",NA,1958-04-03,NA,NA,1958-08-29,NA,148,NA,NA,NA,NA
"1966","CarignanNoir","18","18Mtp1","",1959,"26/3/59",NA,NA,NA,NA,1959-03-26,NA,NA,NA,NA,NA,NA,NA,NA,NA
"1967","CarignanNoir","18","18Mtp1","",1960,"16/3/60",NA,NA,NA,NA,1960-03-16,NA,NA,NA,NA,NA,NA,NA,NA,NA
"1968","CarignanNoir","18","18Mtp1","",1990,"18/9/90",NA,"18/9/90","18/9/90",NA,1990-09-18,NA,1990-09-18,1990-09-18,NA,0,NA,NA,0,0
"1969","CarignanNoir","18","18Mtp1","",1992,"14/9/92",NA,"14/9/92","14/9/92",NA,1992-09-14,NA,1992-09-14,1992-09-14,NA,0,NA,NA,0,0
"1970","CarignanNoir","18","18Mtp1","",1993,"20/9/93",NA,"20/9/93","20/9/93",NA,1993-09-20,NA,1993-09-20,1993-09-20,NA,0,NA,NA,0,0
"1971","CarignanNoir","18","18Mtp2","",1956,"4/4/1956",NA,NA,"10/9/1956",NA,1956-04-04,NA,NA,1956-09-10,NA,159,NA,NA,NA,NA
"1972","CarignanNoir","18","18Mtp2","",1957,"19/3/57",NA,NA,"23/9/57",NA,1957-03-19,NA,NA,1957-09-23,NA,188,NA,NA,NA,NA
"1973","CarignanNoir","18","18Mtp2","",1958,"8/4/1958",NA,NA,"9/9/1958",NA,1958-04-08,NA,NA,1958-09-09,NA,154,NA,NA,NA,NA
"1974","CarignanNoir","18","18Mtp2","",1959,"24/3/59",NA,NA,"31/8/59",NA,1959-03-24,NA,NA,1959-08-31,NA,160,NA,NA,NA,NA
"1975","CarignanNoir","18","18Mtp2","",1960,"24/3/60",NA,NA,NA,NA,1960-03-24,NA,NA,NA,NA,NA,NA,NA,NA,NA
"1976","CarignanNoir","18","18Mtp2","",1972,NA,NA,NA,"25/9/72",NA,NA,NA,NA,1972-09-25,NA,NA,NA,NA,NA,NA
"1977","CarignanNoir","18","18Mtp2","",1976,"7/4/1976",NA,"12/8/1976",NA,NA,1976-04-07,NA,1976-08-12,NA,NA,NA,NA,NA,NA,127
"1978","CarignanNoir","18","18Mtp2","",1977,NA,NA,"30/8/77",NA,NA,NA,NA,1977-08-30,NA,NA,NA,NA,NA,NA,NA
"1979","CarignanNoir","18","18Mtp2","",1978,NA,NA,"21/8/78",NA,NA,NA,NA,1978-08-21,NA,NA,NA,NA,NA,NA,NA
"1980","CarignanNoir","18","18Mtp2","",1981,"27/3/81",NA,NA,NA,NA,1981-03-27,NA,NA,NA,NA,NA,NA,NA,NA,NA
"1981","CarignanNoir","18","18Mtp2","",1983,"1/4/1983",NA,NA,NA,NA,1983-04-01,NA,NA,NA,NA,NA,NA,NA,NA,NA
"1982","CarignanNoir","18","18Mtp2","",1986,"27/3/86",NA,NA,NA,NA,1986-03-27,NA,NA,NA,NA,NA,NA,NA,NA,NA
"1983","CarignanNoir","18","18Mtp2","",1988,"25/3/88","3/6/1988","11/8/1988","19/9/88",NA,1988-03-25,1988-06-03,1988-08-11,1988-09-19,NA,178,70,69,39,139
"1984","CarignanNoir","18","18Mtp2","",1989,"20/3/89","30/5/89","7/8/1989","11/9/1989",NA,1989-03-20,1989-05-30,1989-08-07,1989-09-11,NA,175,71,69,35,140
"1985","CarignanNoir","18","18Mtp2","",1990,"18/9/90","28/5/90","6/8/1990","18/9/90",NA,1990-09-18,1990-05-28,1990-08-06,1990-09-18,NA,0,-113,70,43,-43
"1986","CarignanNoir","18","18Mtp2","",1991,NA,"6/6/1991","16/8/91",NA,NA,NA,1991-06-06,1991-08-16,NA,NA,NA,NA,71,NA,NA
"1987","CarignanNoir","18","18Mtp2","",1992,"14/9/92","30/5/92","10/8/1992","14/9/92",NA,1992-09-14,1992-05-30,1992-08-10,1992-09-14,NA,0,-107,72,35,-35
"1988","CarignanNoir","18","18Mtp2","",1993,"20/9/93",NA,"20/9/93","20/9/93",NA,1993-09-20,NA,1993-09-20,1993-09-20,NA,0,NA,NA,0,0
"1989","CarignanNoir","18","18Mtp2","",1995,"16/3/95","2/6/1995","21/8/95","18/9/95",NA,1995-03-16,1995-06-02,1995-08-21,1995-09-18,NA,186,78,80,28,158
"1990","CarignanNoir","18","18Mtp3","",1956,"3/4/1956",NA,NA,"10/9/1956",NA,1956-04-03,NA,NA,1956-09-10,NA,160,NA,NA,NA,NA
"1991","CarignanNoir","18","18Mtp3","",1957,"17/3/57",NA,NA,"23/9/57",NA,1957-03-17,NA,NA,1957-09-23,NA,190,NA,NA,NA,NA
"1992","CarignanNoir","18","18Mtp3","",1958,"3/4/1958",NA,NA,"3/9/1958",NA,1958-04-03,NA,NA,1958-09-03,NA,153,NA,NA,NA,NA
"1993","CarignanNoir","18","18Mtp3","",1959,"24/3/59",NA,NA,"31/8/59",NA,1959-03-24,NA,NA,1959-08-31,NA,160,NA,NA,NA,NA
"1994","CarignanNoir","18","18Mtp3","",1960,"22/3/60",NA,NA,NA,NA,1960-03-22,NA,NA,NA,NA,NA,NA,NA,NA,NA
"1995","CarignanNoir","18","18Mtp3","",1972,NA,NA,NA,"18/9/75",NA,NA,NA,NA,1975-09-18,NA,NA,NA,NA,NA,NA
"1996","CarignanNoir","18","18Mtp3","",1976,"22/3/76",NA,"5/8/1976",NA,NA,1976-03-22,NA,1976-08-05,NA,NA,NA,NA,NA,NA,136
"1997","CarignanNoir","18","18Mtp3","",1977,NA,NA,"22/8/77",NA,NA,NA,NA,1977-08-22,NA,NA,NA,NA,NA,NA,NA
"1998","CarignanNoir","18","18Mtp3","",1978,NA,NA,"21/8/78",NA,NA,NA,NA,1978-08-21,NA,NA,NA,NA,NA,NA,NA
"1999","CarignanNoir","18","18Mtp3","",1981,"3/4/1981",NA,NA,NA,NA,1981-04-03,NA,NA,NA,NA,NA,NA,NA,NA,NA
"2000","CarignanNoir","18","18Mtp3","",1983,"31/3/83",NA,NA,NA,NA,1983-03-31,NA,NA,NA,NA,NA,NA,NA,NA,NA
"2001","CarignanNoir","18","18Mtp3","",1986,"1/4/1986",NA,NA,NA,NA,1986-04-01,NA,NA,NA,NA,NA,NA,NA,NA,NA
"2002","CarignanNoir","18","18Mtp3","",1987,NA,NA,"6/8/1987","14/9/87",NA,NA,NA,1987-08-06,1987-09-14,NA,NA,NA,NA,39,NA
"2003","CarignanNoir","18","18Mtp3","",1988,"27/3/88","3/6/1988","8/8/1988","19/9/88",NA,1988-03-27,1988-06-03,1988-08-08,1988-09-19,NA,176,68,66,42,134
"2004","CarignanNoir","18","18Mtp3","",1989,"23/3/89","27/5/89","7/8/1989","11/9/1989",NA,1989-03-23,1989-05-27,1989-08-07,1989-09-11,NA,172,65,72,35,137
"2005","CarignanNoir","18","18Mtp3","",1990,"18/9/90","28/5/90","6/8/1990","18/9/90",NA,1990-09-18,1990-05-28,1990-08-06,1990-09-18,NA,0,-113,70,43,-43
"2006","CarignanNoir","18","18Mtp3","",1991,NA,"6/6/1991","16/8/91",NA,NA,NA,1991-06-06,1991-08-16,NA,NA,NA,NA,71,NA,NA
"2007","CarignanNoir","18","18Mtp3","",1992,"14/9/92","30/5/92","10/8/1992","14/9/92",NA,1992-09-14,1992-05-30,1992-08-10,1992-09-14,NA,0,-107,72,35,-35
"2008","CarignanNoir","18","18Mtp3","",1993,"20/9/93",NA,"20/9/93","20/9/93",NA,1993-09-20,NA,1993-09-20,1993-09-20,NA,0,NA,NA,0,0
"2009","CarignanNoir","18","18Mtp3","",1995,"23/3/95","2/6/1995","16/8/95","18/9/95",NA,1995-03-23,1995-06-02,1995-08-16,1995-09-18,NA,179,71,75,33,146
"2010","CarignanNoir","18","18Mtp3","",1998,"23/3/98","27/5/98","7/8/1998","10/9/1998",NA,1998-03-23,1998-05-27,1998-08-07,1998-09-10,NA,171,65,72,34,137
"2011","CarignanNoir","18","18Mtp3","",1999,"23/3/99","27/5/99","3/8/1999","7/9/1999",NA,1999-03-23,1999-05-27,1999-08-03,1999-09-07,NA,168,65,68,35,133
"2012","CarignanNoir","18","18Mtp3","",2000,"22/3/00","26/5/00","16/8/00","28/8/00",NA,2000-03-22,2000-05-26,2000-08-16,2000-08-28,NA,159,65,82,12,147
"2013","CarignanNoir","18","18Mtp3","",2001,"13/3/01","27/5/01",NA,NA,NA,2001-03-13,2001-05-27,NA,NA,NA,NA,75,NA,NA,NA
"2014","CarignanNoir","18","18Mtp3","",2002,"13/3/02","25/5/02","29/7/02","23/8/02",NA,2002-03-13,2002-05-25,2002-07-29,2002-08-23,NA,163,73,65,25,138
"2015","CarignanNoir","18","18Mtp3","",2003,"23/3/03","30/5/03","5/8/2003","29/8/03",NA,2003-03-23,2003-05-30,2003-08-05,2003-08-29,NA,159,68,67,24,135
"2016","CarignanNoir","18","18Mtp3","",2004,"28/3/04","4/6/2004","2/8/2004","13/9/04",NA,2004-03-28,2004-06-04,2004-08-02,2004-09-13,NA,169,68,59,42,127
"2017","CarignanNoir","18","18Mtp3","",2005,"8/4/2005","5/6/2005","5/8/2005","6/9/2005",NA,2005-04-08,2005-06-05,2005-08-05,2005-09-06,NA,151,58,61,32,119
"2018","CarignanNoir","18","18Mtp3","",2006,"29/3/06","26/5/06","4/8/2006","6/9/2006",NA,2006-03-29,2006-05-26,2006-08-04,2006-09-06,NA,161,58,70,33,128
"2019","CarignanNoir","18","18Mtp3","",2007,"15/3/07","21/5/07","24/7/07","29/8/07",NA,2007-03-15,2007-05-21,2007-07-24,2007-08-29,NA,167,67,64,36,131
"2020","CarignanNoir","18","18Mtp3","",2008,"16/3/08","29/5/08","31/7/08","27/8/08",NA,2008-03-16,2008-05-29,2008-07-31,2008-08-27,NA,164,74,63,27,137
"2021","CarignanNoir","18","18Mtp3","",2009,"27/3/09","28/5/09","30/7/09","1/9/2009",NA,2009-03-27,2009-05-28,2009-07-30,2009-09-01,NA,158,62,63,33,125
"2022","CarignanNoir","18","18Mtp3","",2010,"30/3/10","3/6/2010","2/8/2010","10/9/2010",NA,2010-03-30,2010-06-03,2010-08-02,2010-09-10,NA,164,65,60,39,125
"2023","CarignanNoir","18","18Mtp3","",2011,"23/3/11","18/5/11","25/7/11","9/9/2011",NA,2011-03-23,2011-05-18,2011-07-25,2011-09-09,NA,170,56,68,46,124
"2024","CarignanNoir","18","18Mtp3","",2012,"30/3/12","30/5/12","31/7/12","13/9/12",NA,2012-03-30,2012-05-30,2012-07-31,2012-09-13,NA,167,61,62,44,123
"2025","CarignanNoir","18","18Mtp3","",2013,"1/4/2013","6/6/2013","12/8/2013",NA,NA,2013-04-01,2013-06-06,2013-08-12,NA,NA,NA,66,67,NA,133
"2026","CarignanNoir","18","18Mtp4","",1956,"3/4/1956",NA,NA,"24/9/56",NA,1956-04-03,NA,NA,1956-09-24,NA,174,NA,NA,NA,NA
"2027","CarignanNoir","18","18Mtp4","",1957,"17/3/57",NA,NA,"1/10/1957",NA,1957-03-17,NA,NA,1957-10-01,NA,198,NA,NA,NA,NA
"2028","CarignanNoir","18","18Mtp4","",1958,"1/4/1958",NA,NA,"3/9/1958",NA,1958-04-01,NA,NA,1958-09-03,NA,155,NA,NA,NA,NA
"2029","CarignanNoir","18","18Mtp4","",1959,"27/3/59",NA,NA,"31/8/59",NA,1959-03-27,NA,NA,1959-08-31,NA,157,NA,NA,NA,NA
"2030","CarignanNoir","18","18Mtp4","",1960,"21/3/60",NA,NA,NA,NA,1960-03-21,NA,NA,NA,NA,NA,NA,NA,NA,NA
"2031","CarignanNoir","18","18Mtp4","",1972,NA,NA,NA,"11/9/1972",NA,NA,NA,NA,1972-09-11,NA,NA,NA,NA,NA,NA
"2032","CarignanNoir","18","18Mtp4","",1977,NA,NA,"22/8/77",NA,NA,NA,NA,1977-08-22,NA,NA,NA,NA,NA,NA,NA
"2033","CarignanNoir","18","18Mtp4","",1978,NA,NA,"21/8/78",NA,NA,NA,NA,1978-08-21,NA,NA,NA,NA,NA,NA,NA
"2034","CarignanNoir","18","18Mtp4","",1981,"26/3/81",NA,NA,NA,NA,1981-03-26,NA,NA,NA,NA,NA,NA,NA,NA,NA
"2035","CarignanNoir","18","18Mtp4","",1983,"29/3/83",NA,NA,NA,NA,1983-03-29,NA,NA,NA,NA,NA,NA,NA,NA,NA
"2036","CarignanNoir","18","18Mtp4","",1990,"18/9/90",NA,"18/9/90","18/9/90",NA,1990-09-18,NA,1990-09-18,1990-09-18,NA,0,NA,NA,0,0
"2037","CarignanNoir","18","18Mtp4","",1992,"14/9/92",NA,"14/9/92","14/9/92",NA,1992-09-14,NA,1992-09-14,1992-09-14,NA,0,NA,NA,0,0
"2038","CarignanNoir","18","18Mtp4","",1993,"20/9/93",NA,"20/9/93","20/9/93",NA,1993-09-20,NA,1993-09-20,1993-09-20,NA,0,NA,NA,0,0
"2039","CarignanNoir","18","18Mtp4","",1998,"25/3/98","27/5/98","27/7/98","10/9/1998",NA,1998-03-25,1998-05-27,1998-07-27,1998-09-10,NA,169,63,61,45,124
"2040","CarignanNoir","18","18Mtp4","",1999,"27/3/99","29/5/99","3/8/1999","7/9/1999",NA,1999-03-27,1999-05-29,1999-08-03,1999-09-07,NA,164,63,66,35,129
"2041","CarignanNoir","18","18Mtp4","",2000,"28/3/00","29/5/00","31/7/00","28/8/00",NA,2000-03-28,2000-05-29,2000-07-31,2000-08-28,NA,153,62,63,28,125
"2042","CarignanNoir","18","18Mtp4","",2001,"19/3/01","27/5/01",NA,NA,NA,2001-03-19,2001-05-27,NA,NA,NA,NA,69,NA,NA,NA
"2043","CarignanNoir","18","18Mtp4","",2002,"20/3/02","31/5/02","29/7/02","3/9/2002",NA,2002-03-20,2002-05-31,2002-07-29,2002-09-03,NA,167,72,59,36,131
"2044","CarignanNoir","18","18Mtp4","",2003,"3/4/2003","6/6/2003","5/8/2003","28/8/03",NA,2003-04-03,2003-06-06,2003-08-05,2003-08-28,NA,147,64,60,23,124
"2045","CarignanNoir","18","18Mtp4","",2004,"30/3/04","4/6/2004","2/8/2004","13/9/04",NA,2004-03-30,2004-06-04,2004-08-02,2004-09-13,NA,167,66,59,42,125
"2046","CarignanNoir","18","18Mtp4","",2005,"8/4/2005","5/6/2005","8/8/2005","6/9/2005",NA,2005-04-08,2005-06-05,2005-08-08,2005-09-06,NA,151,58,64,29,122
"2047","CarignanNoir","18","18Mtp4","",2006,"3/4/2006","27/5/06","28/7/06","6/9/2006",NA,2006-04-03,2006-05-27,2006-07-28,2006-09-06,NA,156,54,62,40,116
"2048","CarignanNoir","18","18Mtp4","",2007,"17/3/07","21/5/07","24/7/07","20/8/07",NA,2007-03-17,2007-05-21,2007-07-24,2007-08-20,NA,156,65,64,27,129
"2049","CarignanNoir","18","18Mtp4","",2008,"19/3/08","2/6/2008","31/7/08","27/8/08",NA,2008-03-19,2008-06-02,2008-07-31,2008-08-27,NA,161,75,59,27,134
"2050","CarignanNoir","18","18Mtp4","",2009,"28/3/09","28/5/09","27/7/09","1/9/2009",NA,2009-03-28,2009-05-28,2009-07-27,2009-09-01,NA,157,61,60,36,121
"2051","CarignanNoir","18","18Mtp4","",2010,"2/4/2010","3/6/2010","2/8/2010","10/9/2010",NA,2010-04-02,2010-06-03,2010-08-02,2010-09-10,NA,161,62,60,39,122
"2052","CarignanNoir","18","18Mtp4","",2011,"24/3/11","20/5/11","22/7/11","9/9/2011",NA,2011-03-24,2011-05-20,2011-07-22,2011-09-09,NA,169,57,63,49,120
"2053","CarignanNoir","18","18Mtp4","",2012,"30/3/12","30/5/12","31/7/12","13/9/12",NA,2012-03-30,2012-05-30,2012-07-31,2012-09-13,NA,167,61,62,44,123
"2054","CarignanNoir","18","18Mtp4","",2013,"3/4/2013","6/6/2013","12/8/2013",NA,NA,2013-04-03,2013-06-06,2013-08-12,NA,NA,NA,64,67,NA,131
"2055","CarignanNoir","18","18Mtp5","",1956,NA,NA,NA,"24/9/56",NA,NA,NA,NA,1956-09-24,NA,NA,NA,NA,NA,NA
"2056","CarignanNoir","18","18Mtp5","",1957,"19/3/57",NA,NA,"23/9/57",NA,1957-03-19,NA,NA,1957-09-23,NA,188,NA,NA,NA,NA
"2057","CarignanNoir","18","18Mtp5","",1958,"31/3/58",NA,NA,"10/9/1958",NA,1958-03-31,NA,NA,1958-09-10,NA,163,NA,NA,NA,NA
"2058","CarignanNoir","18","18Mtp5","",1959,"29/3/59",NA,NA,NA,NA,1959-03-29,NA,NA,NA,NA,NA,NA,NA,NA,NA
"2059","CarignanNoir","18","18Mtp5","",1960,"19/3/60",NA,NA,NA,NA,1960-03-19,NA,NA,NA,NA,NA,NA,NA,NA,NA
"2060","CarignanNoir","18","18Mtp5","",1972,NA,NA,NA,"25/9/72",NA,NA,NA,NA,1972-09-25,NA,NA,NA,NA,NA,NA
"2061","CarignanNoir","18","18Mtp5","",1977,NA,NA,"22/8/77",NA,NA,NA,NA,1977-08-22,NA,NA,NA,NA,NA,NA,NA
"2062","CarignanNoir","18","18Mtp5","",1978,NA,NA,"21/8/78",NA,NA,NA,NA,1978-08-21,NA,NA,NA,NA,NA,NA,NA
"2063","CarignanNoir","18","18Mtp5","",1981,"25/3/81",NA,NA,NA,NA,1981-03-25,NA,NA,NA,NA,NA,NA,NA,NA,NA
"2064","CarignanNoir","18","18Mtp5","",1983,"31/3/83",NA,NA,NA,NA,1983-03-31,NA,NA,NA,NA,NA,NA,NA,NA,NA
"2065","CarignanNoir","18","18Mtp5","",1986,"28/3/86",NA,NA,NA,NA,1986-03-28,NA,NA,NA,NA,NA,NA,NA,NA,NA
"2066","CarignanNoir","18","18Mtp5","",1988,"25/3/88","3/6/1988","3/8/1988","19/9/88",NA,1988-03-25,1988-06-03,1988-08-03,1988-09-19,NA,178,70,61,47,131
"2067","CarignanNoir","18","18Mtp5","",1989,"16/3/89","27/5/89","7/8/1989","11/9/1989",NA,1989-03-16,1989-05-27,1989-08-07,1989-09-11,NA,179,72,72,35,144
"2068","CarignanNoir","18","18Mtp5","",1990,"18/9/90","26/5/90","6/8/1990","18/9/90",NA,1990-09-18,1990-05-26,1990-08-06,1990-09-18,NA,0,-115,72,43,-43
"2069","CarignanNoir","18","18Mtp5","",1992,"14/9/92",NA,"14/9/92","14/9/92",NA,1992-09-14,NA,1992-09-14,1992-09-14,NA,0,NA,NA,0,0
"2070","CarignanNoir","18","18Mtp5","",1993,"20/9/93",NA,"20/9/93","20/9/93",NA,1993-09-20,NA,1993-09-20,1993-09-20,NA,0,NA,NA,0,0
"2071","CarignanNoir","18","18Mtp6","",1956,"29/3/56",NA,NA,"17/9/56",NA,1956-03-29,NA,NA,1956-09-17,NA,172,NA,NA,NA,NA
"2072","CarignanNoir","18","18Mtp6","",1957,"15/3/57",NA,NA,"16/9/57",NA,1957-03-15,NA,NA,1957-09-16,NA,185,NA,NA,NA,NA
"2073","CarignanNoir","18","18Mtp6","",1958,"3/4/1958",NA,NA,"29/8/58",NA,1958-04-03,NA,NA,1958-08-29,NA,148,NA,NA,NA,NA
"2074","CarignanNoir","18","18Mtp6","",1959,"24/3/59",NA,NA,"31/8/59",NA,1959-03-24,NA,NA,1959-08-31,NA,160,NA,NA,NA,NA
"2075","CarignanNoir","18","18Mtp6","",1960,"16/3/60",NA,NA,NA,NA,1960-03-16,NA,NA,NA,NA,NA,NA,NA,NA,NA
"2076","CarignanNoir","18","18Mtp6","",1990,"18/9/90",NA,"18/9/90","18/9/90",NA,1990-09-18,NA,1990-09-18,1990-09-18,NA,0,NA,NA,0,0
"2077","CarignanNoir","18","18Mtp6","",1992,"14/9/92",NA,"14/9/92","14/9/92",NA,1992-09-14,NA,1992-09-14,1992-09-14,NA,0,NA,NA,0,0
"2078","CarignanNoir","18","18Mtp6","",1993,"20/9/93",NA,"20/9/93","20/9/93",NA,1993-09-20,NA,1993-09-20,1993-09-20,NA,0,NA,NA,0,0
"2079","CarignanNoir","18","18Mtp7","",1958,"27/3/58",NA,NA,NA,NA,1958-03-27,NA,NA,NA,NA,NA,NA,NA,NA,NA
"2080","CarignanNoir","18","18Mtp7","",1959,"28/3/59",NA,NA,NA,NA,1959-03-28,NA,NA,NA,NA,NA,NA,NA,NA,NA
"2081","CarignanNoir","18","18Mtp7","",1960,"14/3/60",NA,NA,NA,NA,1960-03-14,NA,NA,NA,NA,NA,NA,NA,NA,NA
"2082","CarignanNoir","18","18Mtp7","",1961,"1/4/1961",NA,NA,NA,NA,1961-04-01,NA,NA,NA,NA,NA,NA,NA,NA,NA
"2083","CarignanNoir","18","18Mtp7","",1963,"11/4/1963",NA,NA,"7/10/1963",NA,1963-04-11,NA,NA,1963-10-07,NA,179,NA,NA,NA,NA
"2084","CarignanNoir","18","18Mtp7","",1964,"4/4/1964",NA,NA,"10/9/1964",NA,1964-04-04,NA,NA,1964-09-10,NA,159,NA,NA,NA,NA
"2085","CarignanNoir","18","18Mtp7","",1965,"5/4/1965",NA,NA,"11/10/1965",NA,1965-04-05,NA,NA,1965-10-11,NA,189,NA,NA,NA,NA
"2086","CarignanNoir","18","18Mtp7","",1976,NA,NA,"13/8/76",NA,NA,NA,NA,1976-08-13,NA,NA,NA,NA,NA,NA,NA
"2087","CarignanNoir","18","18Mtp7","",1990,"18/9/90",NA,"18/9/90","18/9/90",NA,1990-09-18,NA,1990-09-18,1990-09-18,NA,0,NA,NA,0,0
"2088","CarignanNoir","18","18Mtp7","",1992,"14/9/92","28/5/92","10/8/1992","14/9/92",NA,1992-09-14,1992-05-28,1992-08-10,1992-09-14,NA,0,-109,74,35,-35
"2089","CarignanNoir","18","18Mtp7","",1993,"20/9/93",NA,"20/9/93","20/9/93",NA,1993-09-20,NA,1993-09-20,1993-09-20,NA,0,NA,NA,0,0
"2090","CarignanNoir","18","18Mtp7","",1995,NA,"3/6/1995","16/8/95",NA,NA,NA,1995-06-03,1995-08-16,NA,NA,NA,NA,74,NA,NA
"2091","CarignanNoir","18","18Mtp7","",1996,NA,"3/6/1996","5/8/1996",NA,NA,NA,1996-06-03,1996-08-05,NA,NA,NA,NA,63,NA,NA
"2092","CarignanNoir","18","18Mtp7","",1998,"30/3/98",NA,NA,NA,NA,1998-03-30,NA,NA,NA,NA,NA,NA,NA,NA,NA
"2093","CarignanNoir","18","18Mtp7","",1999,"26/3/99",NA,NA,NA,NA,1999-03-26,NA,NA,NA,NA,NA,NA,NA,NA,NA
"2094","CarignanNoir","18","18Mtp7","",2002,"25/3/02",NA,NA,NA,NA,2002-03-25,NA,NA,NA,NA,NA,NA,NA,NA,NA
"2095","CarignanNoir","18","18Mtp7","",2003,"4/4/2003","30/5/03","25/8/03",NA,NA,2003-04-04,2003-05-30,2003-08-25,NA,NA,NA,56,87,NA,143
"2096","CarignanNoir","18","18Mtp7","",2004,"29/3/04","2/6/2004",NA,"15/9/04",NA,2004-03-29,2004-06-02,NA,2004-09-15,NA,170,65,NA,NA,NA
"2097","CarignanNoir","18","18Mtp7","",2005,"12/4/2005","31/5/05",NA,NA,NA,2005-04-12,2005-05-31,NA,NA,NA,NA,49,NA,NA,NA
"2098","CarignanNoir","18","18Mtp7","",2006,"30/3/06",NA,NA,NA,NA,2006-03-30,NA,NA,NA,NA,NA,NA,NA,NA,NA
"2099","CarignanNoir","18","18Mtp7","",2007,"12/3/2007",NA,NA,NA,NA,2007-03-12,NA,NA,NA,NA,NA,NA,NA,NA,NA
"2100","CarignanNoir","18","18Mtp8","",1957,NA,NA,NA,"10/9/1957",NA,NA,NA,NA,1957-09-10,NA,NA,NA,NA,NA,NA
"2101","CarignanNoir","18","18Mtp8","",1958,"31/3/58",NA,NA,"18/9/58",NA,1958-03-31,NA,NA,1958-09-18,NA,171,NA,NA,NA,NA
"2102","CarignanNoir","18","18Mtp8","",1959,"27/3/59",NA,NA,"12/9/1959",NA,1959-03-27,NA,NA,1959-09-12,NA,169,NA,NA,NA,NA
"2103","CarignanNoir","18","18Mtp8","",1960,"16/3/60",NA,NA,NA,NA,1960-03-16,NA,NA,NA,NA,NA,NA,NA,NA,NA
"2104","CarignanNoir","18","18Mtp8","",1961,"10/3/1961",NA,NA,NA,NA,1961-03-10,NA,NA,NA,NA,NA,NA,NA,NA,NA
"2105","CarignanNoir","18","18Mtp8","",1963,"16/4/63",NA,NA,"23/9/63",NA,1963-04-16,NA,NA,1963-09-23,NA,160,NA,NA,NA,NA
"2106","CarignanNoir","18","18Mtp8","",1964,"6/4/1964",NA,NA,"16/9/64",NA,1964-04-06,NA,NA,1964-09-16,NA,163,NA,NA,NA,NA
"2107","CarignanNoir","18","18Mtp8","",1965,"9/4/1965",NA,NA,"27/9/65",NA,1965-04-09,NA,NA,1965-09-27,NA,171,NA,NA,NA,NA
"2108","CarignanNoir","18","18Mtp8","",1972,NA,NA,NA,"11/9/1972",NA,NA,NA,NA,1972-09-11,NA,NA,NA,NA,NA,NA
"2109","CarignanNoir","18","18Mtp8","",1976,NA,NA,"12/8/1976",NA,NA,NA,NA,1976-08-12,NA,NA,NA,NA,NA,NA,NA
"2110","CarignanNoir","18","18Mtp8","",1977,NA,NA,"16/8/77",NA,NA,NA,NA,1977-08-16,NA,NA,NA,NA,NA,NA,NA
"2111","CarignanNoir","18","18Mtp8","",1978,NA,NA,"21/8/78",NA,NA,NA,NA,1978-08-21,NA,NA,NA,NA,NA,NA,NA
"2112","CarignanNoir","18","18Mtp8","",1981,"5/4/1981",NA,NA,NA,NA,1981-04-05,NA,NA,NA,NA,NA,NA,NA,NA,NA
"2113","CarignanNoir","18","18Mtp8","",1983,"3/4/1983",NA,NA,NA,NA,1983-04-03,NA,NA,NA,NA,NA,NA,NA,NA,NA
"2114","CarignanNoir","18","18Mtp8","",1986,"5/4/1986",NA,NA,NA,NA,1986-04-05,NA,NA,NA,NA,NA,NA,NA,NA,NA
"2115","CarignanNoir","18","18Mtp8","",1987,NA,NA,"6/8/1987","21/9/87",NA,NA,NA,1987-08-06,1987-09-21,NA,NA,NA,NA,46,NA
"2116","CarignanNoir","18","18Mtp8","",1988,"30/3/88","3/6/1988","5/8/1988","19/9/88",NA,1988-03-30,1988-06-03,1988-08-05,1988-09-19,NA,173,65,63,45,128
"2117","CarignanNoir","18","18Mtp8","",1989,"27/3/89","30/5/89","7/8/1989","11/9/1989",NA,1989-03-27,1989-05-30,1989-08-07,1989-09-11,NA,168,64,69,35,133
"2118","CarignanNoir","18","18Mtp8","",1990,"18/9/90","23/5/90","6/8/1990","18/9/90",NA,1990-09-18,1990-05-23,1990-08-06,1990-09-18,NA,0,-118,75,43,-43
"2119","CarignanNoir","18","18Mtp8","",1991,NA,"6/6/1991","16/8/91",NA,NA,NA,1991-06-06,1991-08-16,NA,NA,NA,NA,71,NA,NA
"2120","CarignanNoir","18","18Mtp8","",1992,"14/9/92","28/5/92","10/8/1992","14/9/92",NA,1992-09-14,1992-05-28,1992-08-10,1992-09-14,NA,0,-109,74,35,-35
"2121","CarignanNoir","18","18Mtp8","",1993,"20/9/93",NA,"20/9/93","20/9/93",NA,1993-09-20,NA,1993-09-20,1993-09-20,NA,0,NA,NA,0,0
"2122","CarignanNoir","18","18Mtp8","",1994,NA,"28/5/94",NA,NA,NA,NA,1994-05-28,NA,NA,NA,NA,NA,NA,NA,NA
"2123","CarignanNoir","18","18Mtp8","",1995,"23/3/95","2/6/1995","16/8/95","18/9/95",NA,1995-03-23,1995-06-02,1995-08-16,1995-09-18,NA,179,71,75,33,146
"2124","CarignanNoir","18","18Mtp8","",1996,NA,"3/6/1996","5/8/1996",NA,NA,NA,1996-06-03,1996-08-05,NA,NA,NA,NA,63,NA,NA
"2125","CarignanNoir","18","18Mtp8","",1997,NA,"17/5/97","28/7/97",NA,NA,NA,1997-05-17,1997-07-28,NA,NA,NA,NA,72,NA,NA
"2126","CarignanNoir","18","18Mtp8","",1998,"27/3/98","2/6/1998","28/7/98","10/9/1998",NA,1998-03-27,1998-06-02,1998-07-28,1998-09-10,NA,167,67,56,44,123
"2127","CarignanNoir","18","18Mtp8","",1999,"22/3/99","31/5/99","2/8/1999","7/9/1999",NA,1999-03-22,1999-05-31,1999-08-02,1999-09-07,NA,169,70,63,36,133
"2128","CarignanNoir","18","18Mtp8","",2000,"28/3/00","2/6/2000","31/7/00","28/8/00",NA,2000-03-28,2000-06-02,2000-07-31,2000-08-28,NA,153,66,59,28,125
"2129","CarignanNoir","18","18Mtp8","",2001,"17/3/01","27/5/01",NA,NA,NA,2001-03-17,2001-05-27,NA,NA,NA,NA,71,NA,NA,NA
"2130","CarignanNoir","18","18Mtp8","",2002,"19/3/02","23/5/02","29/7/02","27/8/02",NA,2002-03-19,2002-05-23,2002-07-29,2002-08-27,NA,161,65,67,29,132
"2131","CarignanNoir","18","18Mtp8","",2003,"24/3/03","30/5/03","5/8/2003","28/8/03",NA,2003-03-24,2003-05-30,2003-08-05,2003-08-28,NA,157,67,67,23,134
"2132","CarignanNoir","18","18Mtp8","",2004,"20/3/04","4/6/2004","12/8/2004","6/9/2004",NA,2004-03-20,2004-06-04,2004-08-12,2004-09-06,NA,170,76,69,25,145
"2133","CarignanNoir","18","18Mtp8","",2005,"9/4/2005","3/6/2005","14/8/05","12/9/2005",NA,2005-04-09,2005-06-03,2005-08-14,2005-09-12,NA,156,55,72,29,127
"2134","CarignanNoir","18","18Mtp8","",2006,"30/3/06","29/5/06","16/8/06","14/9/06",NA,2006-03-30,2006-05-29,2006-08-16,2006-09-14,NA,168,60,79,29,139
"2135","CarignanNoir","18","18Mtp8","",2007,"12/3/2007","21/5/07","24/7/07","20/8/07",NA,2007-03-12,2007-05-21,2007-07-24,2007-08-20,NA,161,70,64,27,134
"2136","CarignanNoir","18","18Mtp8","",2008,"16/3/08","28/5/08","31/7/08","3/9/2008",NA,2008-03-16,2008-05-28,2008-07-31,2008-09-03,NA,171,73,64,34,137
"2137","CarignanNoir","18","18Mtp8","",2009,"23/3/09","28/5/09","30/7/09","1/9/2009",NA,2009-03-23,2009-05-28,2009-07-30,2009-09-01,NA,162,66,63,33,129
"2138","CarignanNoir","18","18Mtp8","",2010,"30/3/10","3/6/2010","2/8/2010","10/9/2010",NA,2010-03-30,2010-06-03,2010-08-02,2010-09-10,NA,164,65,60,39,125
"2139","CarignanNoir","18","18Mtp8","",2011,"25/3/11","20/5/11","28/7/11","15/9/11",NA,2011-03-25,2011-05-20,2011-07-28,2011-09-15,NA,174,56,69,49,125
"2140","CarignanNoir","18","18Mtp8","",2012,"29/3/12","29/5/12","1/8/2012","6/9/2012",NA,2012-03-29,2012-05-29,2012-08-01,2012-09-06,NA,161,61,64,36,125
"2141","CarignanNoir","18","18Mtp8","",2013,"31/3/13","10/6/2013","12/8/2013",NA,NA,2013-03-31,2013-06-10,2013-08-12,NA,NA,NA,71,63,NA,134
"2142","CarignanNoir","18","18Mtp9","",1958,"1/4/1958",NA,NA,"5/9/1958",NA,1958-04-01,NA,NA,1958-09-05,NA,157,NA,NA,NA,NA
"2143","CarignanNoir","18","18Mtp9","",1959,"29/3/59",NA,NA,"14/9/59",NA,1959-03-29,NA,NA,1959-09-14,NA,169,NA,NA,NA,NA
"2144","CarignanNoir","18","18Mtp9","",1960,"16/3/60",NA,NA,"12/9/1960",NA,1960-03-16,NA,NA,1960-09-12,NA,180,NA,NA,NA,NA
"2145","CarignanNoir","18","18Mtp9","",1961,"17/3/61",NA,NA,"2/9/1961",NA,1961-03-17,NA,NA,1961-09-02,NA,169,NA,NA,NA,NA
"2146","CarignanNoir","18","18Mtp9","",1962,"12/4/1962",NA,NA,NA,NA,1962-04-12,NA,NA,NA,NA,NA,NA,NA,NA,NA
"2147","CarignanNoir","18","18Mtp9","",1963,"15/4/63",NA,NA,"23/9/63",NA,1963-04-15,NA,NA,1963-09-23,NA,161,NA,NA,NA,NA
"2148","CarignanNoir","18","18Mtp9","",1964,"14/4/64",NA,NA,"23/9/64",NA,1964-04-14,NA,NA,1964-09-23,NA,162,NA,NA,NA,NA
"2149","CarignanNoir","18","18Mtp9","",1965,"7/4/1965",NA,NA,"27/9/67",NA,1965-04-07,NA,NA,1967-09-27,NA,903,NA,NA,NA,NA
"2150","CarignanNoir","18","18Mtp9","",1990,"18/9/90",NA,"18/9/90","18/9/90",NA,1990-09-18,NA,1990-09-18,1990-09-18,NA,0,NA,NA,0,0
"2151","CarignanNoir","18","18Mtp9","",1992,"14/9/92",NA,"14/9/92","14/9/92",NA,1992-09-14,NA,1992-09-14,1992-09-14,NA,0,NA,NA,0,0
"2152","CarignanNoir","18","18Mtp9","",1993,"20/9/93",NA,"20/9/93","20/9/93",NA,1993-09-20,NA,1993-09-20,1993-09-20,NA,0,NA,NA,0,0
"2153","CarignanNoir","18","18Mtp10","",1957,"12/3/1957",NA,NA,"17/9/57",NA,1957-03-12,NA,NA,1957-09-17,NA,189,NA,NA,NA,NA
"2154","CarignanNoir","18","18Mtp10","",1958,"30/3/58",NA,NA,"12/9/1958",NA,1958-03-30,NA,NA,1958-09-12,NA,166,NA,NA,NA,NA
"2155","CarignanNoir","18","18Mtp10","",1959,"28/3/59",NA,NA,"12/9/1959",NA,1959-03-28,NA,NA,1959-09-12,NA,168,NA,NA,NA,NA
"2156","CarignanNoir","18","18Mtp10","",1960,"18/3/60",NA,NA,NA,NA,1960-03-18,NA,NA,NA,NA,NA,NA,NA,NA,NA
"2157","CarignanNoir","18","18Mtp10","",1961,"3/3/1961",NA,NA,NA,NA,1961-03-03,NA,NA,NA,NA,NA,NA,NA,NA,NA
"2158","CarignanNoir","18","18Mtp10","",1962,"5/4/1962",NA,NA,NA,NA,1962-04-05,NA,NA,NA,NA,NA,NA,NA,NA,NA
"2159","CarignanNoir","18","18Mtp10","",1963,"7/4/1963",NA,NA,"16/9/63",NA,1963-04-07,NA,NA,1963-09-16,NA,162,NA,NA,NA,NA
"2160","CarignanNoir","18","18Mtp10","",1964,"6/4/1964",NA,NA,"11/9/1964",NA,1964-04-06,NA,NA,1964-09-11,NA,158,NA,NA,NA,NA
"2161","CarignanNoir","18","18Mtp10","",1965,"4/4/1965",NA,NA,"7/9/1965",NA,1965-04-04,NA,NA,1965-09-07,NA,156,NA,NA,NA,NA
"2162","CarignanNoir","18","18Mtp10","",1990,"18/9/90",NA,"18/9/90","18/9/90",NA,1990-09-18,NA,1990-09-18,1990-09-18,NA,0,NA,NA,0,0
"2163","CarignanNoir","18","18Mtp10","",1992,"14/9/92",NA,"14/9/92","14/9/92",NA,1992-09-14,NA,1992-09-14,1992-09-14,NA,0,NA,NA,0,0
"2164","CarignanNoir","18","18Mtp10","",1993,"20/9/93",NA,"20/9/93","20/9/93",NA,1993-09-20,NA,1993-09-20,1993-09-20,NA,0,NA,NA,0,0
"2165","CarignanNoir","18","18Mtp11","",1956,NA,NA,NA,"24/9/56",NA,NA,NA,NA,1956-09-24,NA,NA,NA,NA,NA,NA
"2166","CarignanNoir","18","18Mtp11","",1957,"12/3/1957",NA,NA,"10/9/1957",NA,1957-03-12,NA,NA,1957-09-10,NA,182,NA,NA,NA,NA
"2167","CarignanNoir","18","18Mtp11","",1958,"30/3/58",NA,NA,"5/9/1958",NA,1958-03-30,NA,NA,1958-09-05,NA,159,NA,NA,NA,NA
"2168","CarignanNoir","18","18Mtp11","",1959,"28/3/59",NA,NA,NA,NA,1959-03-28,NA,NA,NA,NA,NA,NA,NA,NA,NA
"2169","CarignanNoir","18","18Mtp11","",1960,"21/3/60",NA,NA,NA,NA,1960-03-21,NA,NA,NA,NA,NA,NA,NA,NA,NA
"2170","CarignanNoir","18","18Mtp11","",1961,"8/3/1961",NA,NA,NA,NA,1961-03-08,NA,NA,NA,NA,NA,NA,NA,NA,NA
"2171","CarignanNoir","18","18Mtp11","",1962,"6/4/1962",NA,NA,NA,NA,1962-04-06,NA,NA,NA,NA,NA,NA,NA,NA,NA
"2172","CarignanNoir","18","18Mtp11","",1963,"8/4/1963",NA,NA,"25/9/63",NA,1963-04-08,NA,NA,1963-09-25,NA,170,NA,NA,NA,NA
"2173","CarignanNoir","18","18Mtp11","",1964,"6/4/1964",NA,NA,"11/9/1964",NA,1964-04-06,NA,NA,1964-09-11,NA,158,NA,NA,NA,NA
"2174","CarignanNoir","18","18Mtp11","",1965,"7/4/1965",NA,NA,"20/9/65",NA,1965-04-07,NA,NA,1965-09-20,NA,166,NA,NA,NA,NA
"2175","CarignanNoir","18","18Mtp11","",1990,"18/9/90",NA,"18/9/90","18/9/90",NA,1990-09-18,NA,1990-09-18,1990-09-18,NA,0,NA,NA,0,0
"2176","CarignanNoir","18","18Mtp11","",1992,"14/9/92",NA,"14/9/92","14/9/92",NA,1992-09-14,NA,1992-09-14,1992-09-14,NA,0,NA,NA,0,0
"2177","CarignanNoir","18","18Mtp11","",1993,"20/9/93",NA,"20/9/93","20/9/93",NA,1993-09-20,NA,1993-09-20,1993-09-20,NA,0,NA,NA,0,0
"2178","CarignanNoir","18","18Mtp12","",1958,"4/4/1958",NA,NA,"12/9/1958",NA,1958-04-04,NA,NA,1958-09-12,NA,161,NA,NA,NA,NA
"2179","CarignanNoir","18","18Mtp12","",1959,"26/3/59",NA,NA,"12/9/1959",NA,1959-03-26,NA,NA,1959-09-12,NA,170,NA,NA,NA,NA
"2180","CarignanNoir","18","18Mtp12","",1960,"14/3/60",NA,NA,"5/9/1960",NA,1960-03-14,NA,NA,1960-09-05,NA,175,NA,NA,NA,NA
"2181","CarignanNoir","18","18Mtp12","",1961,"13/3/61",NA,NA,"28/8/61",NA,1961-03-13,NA,NA,1961-08-28,NA,168,NA,NA,NA,NA
"2182","CarignanNoir","18","18Mtp12","",1962,"10/4/1962",NA,NA,NA,NA,1962-04-10,NA,NA,NA,NA,NA,NA,NA,NA,NA
"2183","CarignanNoir","18","18Mtp12","",1963,"26/4/63",NA,NA,"16/9/63",NA,1963-04-26,NA,NA,1963-09-16,NA,143,NA,NA,NA,NA
"2184","CarignanNoir","18","18Mtp12","",1964,"15/4/64",NA,NA,"15/9/64",NA,1964-04-15,NA,NA,1964-09-15,NA,153,NA,NA,NA,NA
"2185","CarignanNoir","18","18Mtp12","",1965,"8/4/1965",NA,NA,"27/9/66",NA,1965-04-08,NA,NA,1966-09-27,NA,537,NA,NA,NA,NA
"2186","CarignanNoir","18","18Mtp12","",1990,"18/9/90",NA,"18/9/90","18/9/90",NA,1990-09-18,NA,1990-09-18,1990-09-18,NA,0,NA,NA,0,0
"2187","CarignanNoir","18","18Mtp12","",1992,"14/9/92",NA,"14/9/92","14/9/92",NA,1992-09-14,NA,1992-09-14,1992-09-14,NA,0,NA,NA,0,0
"2188","CarignanNoir","18","18Mtp12","",1993,"20/9/93",NA,"20/9/93","20/9/93",NA,1993-09-20,NA,1993-09-20,1993-09-20,NA,0,NA,NA,0,0
"2189","CarignanNoir","18","18Mtp13","",1956,"2/4/1956",NA,NA,NA,NA,1956-04-02,NA,NA,NA,NA,NA,NA,NA,NA,NA
"2190","CarignanNoir","18","18Mtp13","",1957,"13/3/57",NA,NA,"16/9/57",NA,1957-03-13,NA,NA,1957-09-16,NA,187,NA,NA,NA,NA
"2191","CarignanNoir","18","18Mtp13","",1958,"29/3/58",NA,NA,"4/9/1958",NA,1958-03-29,NA,NA,1958-09-04,NA,159,NA,NA,NA,NA
"2192","CarignanNoir","18","18Mtp13","",1959,"25/3/59",NA,NA,"12/9/1959",NA,1959-03-25,NA,NA,1959-09-12,NA,171,NA,NA,NA,NA
"2193","CarignanNoir","18","18Mtp13","",1960,"22/3/60",NA,NA,NA,NA,1960-03-22,NA,NA,NA,NA,NA,NA,NA,NA,NA
"2194","CarignanNoir","18","18Mtp13","",1961,"6/3/1961",NA,NA,NA,NA,1961-03-06,NA,NA,NA,NA,NA,NA,NA,NA,NA
"2195","CarignanNoir","18","18Mtp13","",1990,"18/9/90",NA,"18/9/90","18/9/90",NA,1990-09-18,NA,1990-09-18,1990-09-18,NA,0,NA,NA,0,0
"2196","CarignanNoir","18","18Mtp13","",1992,"14/9/92",NA,"14/9/92","14/9/92",NA,1992-09-14,NA,1992-09-14,1992-09-14,NA,0,NA,NA,0,0
"2197","CarignanNoir","18","18Mtp13","",1993,"20/9/93",NA,"20/9/93","20/9/93",NA,1993-09-20,NA,1993-09-20,1993-09-20,NA,0,NA,NA,0,0
"2198","CarignanNoir","18","18Mtp14","",1956,"3/4/1956",NA,NA,"24/9/56",NA,1956-04-03,NA,NA,1956-09-24,NA,174,NA,NA,NA,NA
"2199","CarignanNoir","18","18Mtp14","",1957,"16/3/57",NA,NA,"24/9/57",NA,1957-03-16,NA,NA,1957-09-24,NA,192,NA,NA,NA,NA
"2200","CarignanNoir","18","18Mtp14","",1958,"1/4/1958",NA,NA,"4/9/1958",NA,1958-04-01,NA,NA,1958-09-04,NA,156,NA,NA,NA,NA
"2201","CarignanNoir","18","18Mtp14","",1959,NA,NA,NA,"7/9/1959",NA,NA,NA,NA,1959-09-07,NA,NA,NA,NA,NA,NA
"2202","CarignanNoir","18","18Mtp14","",1972,NA,NA,NA,"18/9/72",NA,NA,NA,NA,1972-09-18,NA,NA,NA,NA,NA,NA
"2203","CarignanNoir","18","18Mtp14","",1976,NA,NA,"5/8/1976",NA,NA,NA,NA,1976-08-05,NA,NA,NA,NA,NA,NA,NA
"2204","CarignanNoir","18","18Mtp14","",1977,NA,NA,"18/8/77",NA,NA,NA,NA,1977-08-18,NA,NA,NA,NA,NA,NA,NA
"2205","CarignanNoir","18","18Mtp14","",1978,NA,NA,"16/8/78",NA,NA,NA,NA,1978-08-16,NA,NA,NA,NA,NA,NA,NA
"2206","CarignanNoir","18","18Mtp14","",1981,"1/4/1981",NA,NA,NA,NA,1981-04-01,NA,NA,NA,NA,NA,NA,NA,NA,NA
"2207","CarignanNoir","18","18Mtp14","",1983,"1/4/1983",NA,NA,NA,NA,1983-04-01,NA,NA,NA,NA,NA,NA,NA,NA,NA
"2208","CarignanNoir","18","18Mtp14","",1986,"29/3/86",NA,NA,NA,NA,1986-03-29,NA,NA,NA,NA,NA,NA,NA,NA,NA
"2209","CarignanNoir","18","18Mtp14","",1987,NA,"9/6/1987","6/8/1987","21/9/87",NA,NA,1987-06-09,1987-08-06,1987-09-21,NA,NA,NA,58,46,NA
"2210","CarignanNoir","18","18Mtp14","",1988,"27/3/88","3/6/1988","8/8/1988","19/9/88",NA,1988-03-27,1988-06-03,1988-08-08,1988-09-19,NA,176,68,66,42,134
"2211","CarignanNoir","18","18Mtp14","",1989,"23/3/89","30/5/89","7/8/1989","14/9/59",NA,1989-03-23,1989-05-30,1989-08-07,1959-09-14,NA,-10783,68,69,-10920,137
"2212","CarignanNoir","18","18Mtp14","",1990,"19/3/90","26/5/90","6/8/1990","10/9/1990",NA,1990-03-19,1990-05-26,1990-08-06,1990-09-10,NA,175,68,72,35,140
"2213","CarignanNoir","18","18Mtp14","",1991,"29/3/91","6/6/1991","16/8/91","23/9/91",NA,1991-03-29,1991-06-06,1991-08-16,1991-09-23,NA,178,69,71,38,140
"2214","CarignanNoir","18","18Mtp14","",1992,"26/3/92","28/5/92","10/8/1992","21/9/92",NA,1992-03-26,1992-05-28,1992-08-10,1992-09-21,NA,179,63,74,42,137
"2215","CarignanNoir","18","18Mtp14","",1993,"29/3/93","1/6/1993","9/8/1993","20/9/93",NA,1993-03-29,1993-06-01,1993-08-09,1993-09-20,NA,175,64,69,42,133
"2216","CarignanNoir","18","18Mtp14","",1994,"10/3/1994","30/5/94","8/8/1994","15/9/94",NA,1994-03-10,1994-05-30,1994-08-08,1994-09-15,NA,189,81,70,38,151
"2217","CarignanNoir","18","18Mtp14","",1995,"23/3/95","2/6/1995","16/8/95","18/9/95",NA,1995-03-23,1995-06-02,1995-08-16,1995-09-18,NA,179,71,75,33,146
"2218","CarignanNoir","18","18Mtp14","",1996,"25/3/96","2/6/1996","12/8/1996","22/9/96",NA,1996-03-25,1996-06-02,1996-08-12,1996-09-22,NA,181,69,71,41,140
"2219","CarignanNoir","18","18Mtp14","",1997,"7/3/1997","17/5/97","28/7/97","1/9/1997",NA,1997-03-07,1997-05-17,1997-07-28,1997-09-01,NA,178,71,72,35,143
"2220","CarignanNoir","18","18Mtp14","",2000,"22/3/00","5/6/2000","7/8/2000","4/9/2000",NA,2000-03-22,2000-06-05,2000-08-07,2000-09-04,NA,166,75,63,28,138
"2221","CarignanNoir","18","18Mtp15","",1990,"18/9/90",NA,"18/9/90","18/9/90",NA,1990-09-18,NA,1990-09-18,1990-09-18,NA,0,NA,NA,0,0
"2222","CarignanNoir","18","18Mtp15","",1992,"14/9/92",NA,"14/9/92","14/9/92",NA,1992-09-14,NA,1992-09-14,1992-09-14,NA,0,NA,NA,0,0
"2223","CarignanNoir","18","18Mtp15","",1993,"20/9/93",NA,"20/9/93","20/9/93",NA,1993-09-20,NA,1993-09-20,1993-09-20,NA,0,NA,NA,0,0
"2224","CarignanNoir","18","18Mtp16","",1971,"29/3/71",NA,NA,"20/9/71",NA,1971-03-29,NA,NA,1971-09-20,NA,175,NA,NA,NA,NA
"2225","CarignanNoir","18","18Mtp16","",1972,"24/3/72",NA,NA,"11/9/1972",NA,1972-03-24,NA,NA,1972-09-11,NA,171,NA,NA,NA,NA
"2226","CarignanNoir","18","18Mtp16","",1973,"3/4/1973",NA,NA,"3/9/1973",NA,1973-04-03,NA,NA,1973-09-03,NA,153,NA,NA,NA,NA
"2227","CarignanNoir","18","18Mtp16","",1976,NA,NA,"2/8/1976",NA,NA,NA,NA,1976-08-02,NA,NA,NA,NA,NA,NA,NA
"2228","CarignanNoir","18","18Mtp16","",1977,NA,NA,"16/8/77",NA,NA,NA,NA,1977-08-16,NA,NA,NA,NA,NA,NA,NA
"2229","CarignanNoir","18","18Mtp16","",1978,NA,NA,"17/8/78",NA,NA,NA,NA,1978-08-17,NA,NA,NA,NA,NA,NA,NA
"2230","CarignanNoir","18","18Mtp16","",1988,"24/3/88","3/6/1988","4/8/1988","12/9/1988",NA,1988-03-24,1988-06-03,1988-08-04,1988-09-12,NA,172,71,62,39,133
"2231","CarignanNoir","18","18Mtp16","",1990,"18/9/90",NA,"18/9/90","18/9/90",NA,1990-09-18,NA,1990-09-18,1990-09-18,NA,0,NA,NA,0,0
"2232","CarignanNoir","18","18Mtp16","",1992,"14/9/92",NA,"14/9/92","14/9/92",NA,1992-09-14,NA,1992-09-14,1992-09-14,NA,0,NA,NA,0,0
"2233","CarignanNoir","18","18Mtp16","",1993,"20/9/93",NA,"20/9/93","20/9/93",NA,1993-09-20,NA,1993-09-20,1993-09-20,NA,0,NA,NA,0,0
"2234","CarignanNoir","18","18Mtp16","",2001,"8/3/2001",NA,NA,NA,NA,2001-03-08,NA,NA,NA,NA,NA,NA,NA,NA,NA
"2235","CarignanNoir","18","18Mtp17","",1990,"18/9/90",NA,"18/9/90","18/9/90",NA,1990-09-18,NA,1990-09-18,1990-09-18,NA,0,NA,NA,0,0
"2236","CarignanNoir","18","18Mtp17","",1991,"21/3/91","5/6/1991","19/8/91","18/9/91",NA,1991-03-21,1991-06-05,1991-08-19,1991-09-18,NA,181,76,75,30,151
"2237","CarignanNoir","18","18Mtp17","",1992,"23/3/92","21/5/92","1/8/1992","14/9/92",NA,1992-03-23,1992-05-21,1992-08-01,1992-09-14,NA,175,59,72,44,131
"2238","CarignanNoir","18","18Mtp17","",1993,"25/3/93","2/6/1993","9/8/1993","20/9/93",NA,1993-03-25,1993-06-02,1993-08-09,1993-09-20,NA,179,69,68,42,137
"2239","CarignanNoir","18","18Mtp17","",1994,"10/3/1994",NA,NA,"12/9/1994",NA,1994-03-10,NA,NA,1994-09-12,NA,186,NA,NA,NA,NA
"2240","CarignanNoir","18","18Mtp17","",2002,"14/3/02",NA,NA,NA,NA,2002-03-14,NA,NA,NA,NA,NA,NA,NA,NA,NA
"2241","CarignanNoir","18","18Mtp17","",2003,"28/3/03","3/6/2003","5/8/2003","2/9/2003",NA,2003-03-28,2003-06-03,2003-08-05,2003-09-02,NA,158,67,63,28,130
"2242","CarignanNoir","18","18Mtp17","",2004,"22/3/04","4/6/2004","12/8/2004","6/9/2004",NA,2004-03-22,2004-06-04,2004-08-12,2004-09-06,NA,168,74,69,25,143
"2243","CarignanNoir","18","18Mtp17","",2005,"6/4/2005","4/6/2005","8/8/2005","6/9/2005",NA,2005-04-06,2005-06-04,2005-08-08,2005-09-06,NA,153,59,65,29,124
"2244","CarignanNoir","18","18Mtp17","",2006,"30/3/06","29/5/06","4/8/2006","6/9/2006",NA,2006-03-30,2006-05-29,2006-08-04,2006-09-06,NA,160,60,67,33,127
"2245","CarignanNoir","18","18Mtp17","",2007,"9/3/2007",NA,NA,NA,NA,2007-03-09,NA,NA,NA,NA,NA,NA,NA,NA,NA
"2246","CarignanNoir","18","18Mtp17","",2008,"13/3/08","29/5/08","31/7/08","3/9/2008",NA,2008-03-13,2008-05-29,2008-07-31,2008-09-03,NA,174,77,63,34,140
"2247","CarignanNoir","18","18Mtp17","",2009,"17/3/09",NA,NA,NA,NA,2009-03-17,NA,NA,NA,NA,NA,NA,NA,NA,NA
"2248","CarignanNoir","18","18Mtp17","",2010,"23/3/10","3/6/2010","2/8/2010","2/9/2010",NA,2010-03-23,2010-06-03,2010-08-02,2010-09-02,NA,163,72,60,31,132
"2249","CarignanNoir","18","18Mtp17","",2011,"17/3/11","17/5/11","30/7/11","8/9/2011",NA,2011-03-17,2011-05-17,2011-07-30,2011-09-08,NA,175,61,74,40,135
"2250","CarignanNoir","18","18Mtp17","",2012,"19/3/12","28/5/12","1/8/2012","6/9/2012",NA,2012-03-19,2012-05-28,2012-08-01,2012-09-06,NA,171,70,65,36,135
"2251","CarignanNoir","18","18Mtp17","",2013,"28/3/13","9/6/2013","6/8/2013",NA,NA,2013-03-28,2013-06-09,2013-08-06,NA,NA,NA,73,58,NA,131
"2252","CarignanNoir","18","18Mtp18","",1984,NA,NA,NA,"24/9/84",NA,NA,NA,NA,1984-09-24,NA,NA,NA,NA,NA,NA
"2253","CarignanNoir","18","18Mtp18","",1985,"5/4/1985",NA,NA,"10/9/1985",NA,1985-04-05,NA,NA,1985-09-10,NA,158,NA,NA,NA,NA
"2254","CarignanNoir","18","18Mtp18","",1986,"31/3/86",NA,NA,"15/9/86",NA,1986-03-31,NA,NA,1986-09-15,NA,168,NA,NA,NA,NA
"2255","CarignanNoir","18","18Mtp18","",1987,"3/4/1987","11/6/1987","10/8/1987","21/9/87",NA,1987-04-03,1987-06-11,1987-08-10,1987-09-21,NA,171,69,60,42,129
"2256","CarignanNoir","18","18Mtp18","",1988,NA,"3/6/1988","12/8/1988","19/9/88",NA,NA,1988-06-03,1988-08-12,1988-09-19,NA,NA,NA,70,38,NA
"2257","CarignanNoir","18","18Mtp18","",1990,"18/9/90","21/5/90","6/8/1990","18/9/90",NA,1990-09-18,1990-05-21,1990-08-06,1990-09-18,NA,0,-120,77,43,-43
"2258","CarignanNoir","18","18Mtp18","",1992,"14/9/92",NA,"14/9/92","14/9/92",NA,1992-09-14,NA,1992-09-14,1992-09-14,NA,0,NA,NA,0,0
"2259","CarignanNoir","18","18Mtp18","",1993,"20/9/93",NA,"20/9/93","20/9/93",NA,1993-09-20,NA,1993-09-20,1993-09-20,NA,0,NA,NA,0,0
"2260","CarignanNoir","18","18Mtp19","",1990,"18/9/90",NA,"18/9/90","18/9/90",NA,1990-09-18,NA,1990-09-18,1990-09-18,NA,0,NA,NA,0,0
"2261","CarignanNoir","18","18Mtp19","",1991,"21/3/91","11/6/1991","19/8/91","16/9/91",NA,1991-03-21,1991-06-11,1991-08-19,1991-09-16,NA,179,82,69,28,151
"2262","CarignanNoir","18","18Mtp19","",1992,"27/3/92",NA,"14/9/92","14/9/92",NA,1992-03-27,NA,1992-09-14,1992-09-14,NA,171,NA,NA,0,171
"2263","CarignanNoir","18","18Mtp19","",1993,"27/3/93","4/6/1993","9/8/1993","20/9/93",NA,1993-03-27,1993-06-04,1993-08-09,1993-09-20,NA,177,69,66,42,135
"2264","CarignanNoir","18","18Mtp19","",1994,NA,"28/5/94","8/8/1994","12/9/1994",NA,NA,1994-05-28,1994-08-08,1994-09-12,NA,NA,NA,72,35,NA
"2265","CarignanNoir","18","18Mtp19","",2001,"9/3/2001",NA,NA,NA,NA,2001-03-09,NA,NA,NA,NA,NA,NA,NA,NA,NA
"2266","CarignanNoir","18","18Mtp19","",2010,"27/3/10","3/6/2010","2/8/2010","2/9/2010",NA,2010-03-27,2010-06-03,2010-08-02,2010-09-02,NA,159,68,60,31,128
"2267","CarignanNoir","18","18Mtp19","",2011,"23/3/11","18/5/11","27/7/11","8/9/2011",NA,2011-03-23,2011-05-18,2011-07-27,2011-09-08,NA,169,56,70,43,126
"2268","CarignanNoir","18","18Mtp19","",2012,"30/3/12","29/5/12","30/7/12","6/9/2012",NA,2012-03-30,2012-05-29,2012-07-30,2012-09-06,NA,160,60,62,38,122
"2269","CarignanNoir","18","18Mtp19","",2013,"30/3/13","10/6/2013","6/8/2013",NA,NA,2013-03-30,2013-06-10,2013-08-06,NA,NA,NA,72,57,NA,129
"2270","CarignanNoir","18","18Mtp20","",1989,"23/3/89","30/5/89","8/8/1989","11/9/1989",NA,1989-03-23,1989-05-30,1989-08-08,1989-09-11,NA,172,68,70,34,138
"2271","CarignanNoir","18","18Mtp20","",1990,"8/3/1990","23/5/90","30/7/90","18/9/90",NA,1990-03-08,1990-05-23,1990-07-30,1990-09-18,NA,194,76,68,50,144
"2272","CarignanNoir","18","18Mtp20","",1991,"21/3/91","11/6/1991","19/8/91","19/9/91",NA,1991-03-21,1991-06-11,1991-08-19,1991-09-19,NA,182,82,69,31,151
"2273","CarignanNoir","18","18Mtp20","",1992,"14/9/92",NA,"14/9/92","14/9/92",NA,1992-09-14,NA,1992-09-14,1992-09-14,NA,0,NA,NA,0,0
"2274","CarignanNoir","18","18Mtp20","",1993,"20/9/93",NA,"20/9/93","20/9/93",NA,1993-09-20,NA,1993-09-20,1993-09-20,NA,0,NA,NA,0,0
"2275","CarignanNoir","18","18Mtp21","",1990,"8/3/1990","23/5/90","30/7/90","18/9/90",NA,1990-03-08,1990-05-23,1990-07-30,1990-09-18,NA,194,76,68,50,144
"2276","CarignanNoir","18","18Mtp21","",1991,"18/3/91","8/6/1991","19/8/91","23/9/91",NA,1991-03-18,1991-06-08,1991-08-19,1991-09-23,NA,189,82,72,35,154
"2277","CarignanNoir","18","18Mtp21","",1992,"23/3/92","26/5/92","1/8/1992","14/9/92",NA,1992-03-23,1992-05-26,1992-08-01,1992-09-14,NA,175,64,67,44,131
"2278","CarignanNoir","18","18Mtp21","",1993,"20/9/93",NA,"20/9/93","20/9/93",NA,1993-09-20,NA,1993-09-20,1993-09-20,NA,0,NA,NA,0,0
"2279","CarignanNoir","18","18Mtp22","",1990,"12/3/1990","25/5/90","30/7/90","18/9/90",NA,1990-03-12,1990-05-25,1990-07-30,1990-09-18,NA,190,74,66,50,140
"2280","CarignanNoir","18","18Mtp22","",1991,"26/3/91",NA,NA,NA,NA,1991-03-26,NA,NA,NA,NA,NA,NA,NA,NA,NA
"2281","CarignanNoir","18","18Mtp22","",1992,"30/3/92","30/5/92","5/8/1992","14/9/92",NA,1992-03-30,1992-05-30,1992-08-05,1992-09-14,NA,168,61,67,40,128
"2282","CarignanNoir","18","18Mtp22","",1993,"20/9/93","4/6/1993","9/8/1993","20/9/93",NA,1993-09-20,1993-06-04,1993-08-09,1993-09-20,NA,0,-108,66,42,-42
"2283","CarignanNoir","18","2R2S6.10","",2013,"1/4/2013","","","",NA,2013-04-01,NA,NA,NA,NA,NA,NA,NA,NA,NA
"2284","CarignanNoir","18","2R2S11.15","",2013,"3/4/2013","","","",NA,2013-04-03,NA,NA,NA,NA,NA,NA,NA,NA,NA
"2285","CarignanNoir","18","2R2S26-30","",2013,"31/3/2013","","","",NA,2013-03-31,NA,NA,NA,NA,NA,NA,NA,NA,NA
"2286","CarignanNoir","18","7R2S361.361","",2013,"28/3/2013","","","",NA,2013-03-28,NA,NA,NA,NA,NA,NA,NA,NA,NA
"2287","CarignanNoir","18","7R8S331.335","",2013,"30/3/2013","","","",NA,2013-03-30,NA,NA,NA,NA,NA,NA,NA,NA,NA
"2288","Chardonnay","199","199Mtp1","",1956,NA,NA,NA,"24/9/56",NA,NA,NA,NA,1956-09-24,NA,NA,NA,NA,NA,NA
"2289","Chardonnay","199","199Mtp1","",1957,"13/3/57",NA,NA,"26/8/57",NA,1957-03-13,NA,NA,1957-08-26,NA,166,NA,NA,NA,NA
"2290","Chardonnay","199","199Mtp1","",1958,"28/3/58",NA,NA,"3/9/1958",NA,1958-03-28,NA,NA,1958-09-03,NA,159,NA,NA,NA,NA
"2291","Chardonnay","199","199Mtp1","",1959,"15/3/59",NA,NA,"31/8/59",NA,1959-03-15,NA,NA,1959-08-31,NA,169,NA,NA,NA,NA
"2292","Chardonnay","199","199Mtp1","",1960,"12/3/1960",NA,NA,NA,NA,1960-03-12,NA,NA,NA,NA,NA,NA,NA,NA,NA
"2293","Chardonnay","199","199Mtp1","",1976,NA,NA,"22/7/76",NA,NA,NA,NA,1976-07-22,NA,NA,NA,NA,NA,NA,NA
"2294","Chardonnay","199","199Mtp1","",1977,NA,NA,"8/8/1977",NA,NA,NA,NA,1977-08-08,NA,NA,NA,NA,NA,NA,NA
"2295","Chardonnay","199","199Mtp1","",1978,NA,NA,"5/8/1978",NA,NA,NA,NA,1978-08-05,NA,NA,NA,NA,NA,NA,NA
"2296","Chardonnay","199","199Mtp1","",1979,NA,"24/5/79",NA,NA,NA,NA,1979-05-24,NA,NA,NA,NA,NA,NA,NA,NA
"2297","Chardonnay","199","199Mtp1","",1980,NA,"30/5/80",NA,NA,NA,NA,1980-05-30,NA,NA,NA,NA,NA,NA,NA,NA
"2298","Chardonnay","199","199Mtp1","",1981,NA,"29/5/81",NA,NA,NA,NA,1981-05-29,NA,NA,NA,NA,NA,NA,NA,NA
"2299","Chardonnay","199","199Mtp1","",1982,NA,"23/5/82",NA,NA,NA,NA,1982-05-23,NA,NA,NA,NA,NA,NA,NA,NA
"2300","Chardonnay","199","199Mtp1","",1987,NA,"30/5/87","30/7/87","24/8/87",NA,NA,1987-05-30,1987-07-30,1987-08-24,NA,NA,NA,61,25,NA
"2301","Chardonnay","199","199Mtp1","",1996,"11/3/1996",NA,NA,NA,NA,1996-03-11,NA,NA,NA,NA,NA,NA,NA,NA,NA
"2302","Chardonnay","199","199Mtp1","",2000,"10/3/2000","29/5/00","24/7/00","28/8/00",NA,2000-03-10,2000-05-29,2000-07-24,2000-08-28,NA,171,80,56,35,136
"2303","Chardonnay","199","199Mtp2","",1958,"28/3/58",NA,NA,"29/8/58",NA,1958-03-28,NA,NA,1958-08-29,NA,154,NA,NA,NA,NA
"2304","Chardonnay","199","199Mtp2","",1959,"14/3/59",NA,NA,"3/8/1959",NA,1959-03-14,NA,NA,1959-08-03,NA,142,NA,NA,NA,NA
"2305","Chardonnay","199","199Mtp2","",1960,"7/3/1960",NA,NA,"8/8/1960",NA,1960-03-07,NA,NA,1960-08-08,NA,154,NA,NA,NA,NA
"2306","Chardonnay","199","199Mtp2","",1961,"3/3/1961",NA,NA,"14/8/61",NA,1961-03-03,NA,NA,1961-08-14,NA,164,NA,NA,NA,NA
"2307","Chardonnay","199","199Mtp3","",1958,"14/3/58",NA,NA,NA,NA,1958-03-14,NA,NA,NA,NA,NA,NA,NA,NA,NA
"2308","Chardonnay","199","199Mtp3","",1959,"10/3/1959",NA,NA,"11/8/1959",NA,1959-03-10,NA,NA,1959-08-11,NA,154,NA,NA,NA,NA
"2309","Chardonnay","199","199Mtp3","",1960,"12/3/1960",NA,NA,NA,NA,1960-03-12,NA,NA,NA,NA,NA,NA,NA,NA,NA
"2310","Chardonnay","199","199Mtp4","",1956,NA,NA,NA,"27/8/56",NA,NA,NA,NA,1956-08-27,NA,NA,NA,NA,NA,NA
"2311","Chardonnay","199","199Mtp4","",1957,"7/3/1957",NA,NA,NA,NA,1957-03-07,NA,NA,NA,NA,NA,NA,NA,NA,NA
"2312","Chardonnay","199","199Mtp4","",1958,"29/3/58",NA,NA,"21/8/58",NA,1958-03-29,NA,NA,1958-08-21,NA,145,NA,NA,NA,NA
"2313","Chardonnay","199","199Mtp4","",1959,"12/3/1959",NA,NA,NA,NA,1959-03-12,NA,NA,NA,NA,NA,NA,NA,NA,NA
"2314","Chardonnay","199","199Mtp4","",1960,"11/3/1960",NA,NA,"2/8/1960",NA,1960-03-11,NA,NA,1960-08-02,NA,144,NA,NA,NA,NA
"2315","Chardonnay","199","199Mtp4","",1961,"2/3/1961",NA,NA,NA,NA,1961-03-02,NA,NA,NA,NA,NA,NA,NA,NA,NA
"2316","Chardonnay","199","199Mtp4","",1976,NA,NA,"29/7/76",NA,NA,NA,NA,1976-07-29,NA,NA,NA,NA,NA,NA,NA
"2317","Chardonnay","199","199Mtp4","",1977,NA,NA,"8/8/1977",NA,NA,NA,NA,1977-08-08,NA,NA,NA,NA,NA,NA,NA
"2318","Chardonnay","199","199Mtp4","",1978,NA,NA,"5/8/1978",NA,NA,NA,NA,1978-08-05,NA,NA,NA,NA,NA,NA,NA
"2319","Chardonnay","199","199Mtp4","",1987,NA,"1/6/1987","30/7/87","24/8/87",NA,NA,1987-06-01,1987-07-30,1987-08-24,NA,NA,NA,59,25,NA
"2320","Chardonnay","199","199Mtp4","",1995,"16/3/95","23/5/95","1/8/1995","26/8/95",NA,1995-03-16,1995-05-23,1995-08-01,1995-08-26,NA,163,68,70,25,138
"2321","Chardonnay","199","199Mtp4","",1996,"11/3/1996","26/5/96","28/7/96",NA,NA,1996-03-11,1996-05-26,1996-07-28,NA,NA,NA,76,63,NA,139
"2322","Chardonnay","199","199Mtp4","",1997,"2/3/1997","12/5/1997","13/7/97","11/8/1997",NA,1997-03-02,1997-05-12,1997-07-13,1997-08-11,NA,162,71,62,29,133
"2323","Chardonnay","199","199Mtp4","",2000,"11/3/2000","19/5/00","24/7/00","17/8/00",NA,2000-03-11,2000-05-19,2000-07-24,2000-08-17,NA,159,69,66,24,135
"2324","Chardonnay","199","199Mtp5","",1956,NA,NA,NA,"21/8/56",NA,NA,NA,NA,1956-08-21,NA,NA,NA,NA,NA,NA
"2325","Chardonnay","199","199Mtp5","",1957,"7/3/1957",NA,NA,"19/8/57",NA,1957-03-07,NA,NA,1957-08-19,NA,165,NA,NA,NA,NA
"2326","Chardonnay","199","199Mtp5","",1958,"19/3/58",NA,NA,"21/8/58",NA,1958-03-19,NA,NA,1958-08-21,NA,155,NA,NA,NA,NA
"2327","Chardonnay","199","199Mtp5","",1959,"11/3/1959",NA,NA,"19/8/59",NA,1959-03-11,NA,NA,1959-08-19,NA,161,NA,NA,NA,NA
"2328","Chardonnay","199","199Mtp5","",1960,"8/3/1960",NA,NA,NA,NA,1960-03-08,NA,NA,NA,NA,NA,NA,NA,NA,NA
"2329","Chardonnay","199","199Mtp6","",1956,NA,NA,NA,"21/8/56",NA,NA,NA,NA,1956-08-21,NA,NA,NA,NA,NA,NA
"2330","Chardonnay","199","199Mtp6","",1958,"26/3/58",NA,NA,NA,NA,1958-03-26,NA,NA,NA,NA,NA,NA,NA,NA,NA
"2331","Chardonnay","199","199Mtp6","",1959,"10/3/1959",NA,NA,"18/8/59",NA,1959-03-10,NA,NA,1959-08-18,NA,161,NA,NA,NA,NA
"2332","Chardonnay","199","199Mtp6","",1960,"8/3/1960",NA,NA,NA,NA,1960-03-08,NA,NA,NA,NA,NA,NA,NA,NA,NA
"2333","Chardonnay","199","199Mtp6","",1963,"25/3/63",NA,NA,"20/8/63",NA,1963-03-25,NA,NA,1963-08-20,NA,148,NA,NA,NA,NA
"2334","Chardonnay","199","199Mtp6","",1964,NA,NA,NA,"1/9/1964",NA,NA,NA,NA,1964-09-01,NA,NA,NA,NA,NA,NA
"2335","Chardonnay","199","199Mtp6","",1983,NA,NA,"5/8/1983",NA,NA,NA,NA,1983-08-05,NA,NA,NA,NA,NA,NA,NA
"2336","Chardonnay","199","199Mtp6","",1984,NA,NA,"6/8/1984",NA,NA,NA,NA,1984-08-06,NA,NA,NA,NA,NA,NA,NA
"2337","Chardonnay","199","199Mtp6","",1985,NA,NA,"1/8/1985",NA,NA,NA,NA,1985-08-01,NA,NA,NA,NA,NA,NA,NA
"2338","Chardonnay","199","199Mtp6","",1988,NA,NA,"28/7/88",NA,NA,NA,NA,1988-07-28,NA,NA,NA,NA,NA,NA,NA
"2339","Chardonnay","199","199Mtp7","",1956,NA,NA,NA,"24/9/56",NA,NA,NA,NA,1956-09-24,NA,NA,NA,NA,NA,NA
"2340","Chardonnay","199","199Mtp7","",1957,"13/3/57",NA,NA,"26/8/57",NA,1957-03-13,NA,NA,1957-08-26,NA,166,NA,NA,NA,NA
"2341","Chardonnay","199","199Mtp7","",1958,"28/3/58",NA,NA,"3/9/1958",NA,1958-03-28,NA,NA,1958-09-03,NA,159,NA,NA,NA,NA
"2342","Chardonnay","199","199Mtp7","",1959,"17/3/59",NA,NA,"31/8/59",NA,1959-03-17,NA,NA,1959-08-31,NA,167,NA,NA,NA,NA
"2343","Chardonnay","199","199Mtp8","",1956,NA,NA,NA,"17/9/56",NA,NA,NA,NA,1956-09-17,NA,NA,NA,NA,NA,NA
"2344","Chardonnay","199","199Mtp8","",1957,"19/3/57",NA,NA,"19/8/57",NA,1957-03-19,NA,NA,1957-08-19,NA,153,NA,NA,NA,NA
"2345","Chardonnay","199","199Mtp8","",1958,"29/3/58",NA,NA,"27/8/58",NA,1958-03-29,NA,NA,1958-08-27,NA,151,NA,NA,NA,NA
"2346","Chardonnay","199","199Mtp8","",1959,"16/3/59",NA,NA,"31/8/59",NA,1959-03-16,NA,NA,1959-08-31,NA,168,NA,NA,NA,NA
"2347","Chardonnay","199","199Mtp8","",1960,"12/3/1960",NA,NA,NA,NA,1960-03-12,NA,NA,NA,NA,NA,NA,NA,NA,NA
"2348","Chardonnay","199","199Mtp8","",1961,"7/3/1961",NA,NA,NA,NA,1961-03-07,NA,NA,NA,NA,NA,NA,NA,NA,NA
"2349","Chardonnay","199","199Mtp9","",1957,NA,NA,NA,"19/8/57",NA,NA,NA,NA,1957-08-19,NA,NA,NA,NA,NA,NA
"2350","Chardonnay","199","199Mtp9","",1958,"19/3/58",NA,NA,"27/8/58",NA,1958-03-19,NA,NA,1958-08-27,NA,161,NA,NA,NA,NA
"2351","Chardonnay","199","199Mtp9","",1959,"13/3/59",NA,NA,"25/8/59",NA,1959-03-13,NA,NA,1959-08-25,NA,165,NA,NA,NA,NA
"2352","Chardonnay","199","199Mtp9","",1960,"8/3/1960",NA,NA,NA,NA,1960-03-08,NA,NA,NA,NA,NA,NA,NA,NA,NA
"2353","Chardonnay","199","199Mtp11","",1956,NA,NA,NA,"27/8/56",NA,NA,NA,NA,1956-08-27,NA,NA,NA,NA,NA,NA
"2354","Chardonnay","199","199Mtp11","",1957,"9/3/1957",NA,NA,NA,NA,1957-03-09,NA,NA,NA,NA,NA,NA,NA,NA,NA
"2355","Chardonnay","199","199Mtp11","",1958,NA,NA,NA,"27/8/58",NA,NA,NA,NA,1958-08-27,NA,NA,NA,NA,NA,NA
"2356","Chardonnay","199","199Mtp11","",1959,"13/3/59",NA,NA,"19/8/59",NA,1959-03-13,NA,NA,1959-08-19,NA,159,NA,NA,NA,NA
"2357","Chardonnay","199","199Mtp11","",1960,"8/3/1960",NA,NA,NA,NA,1960-03-08,NA,NA,NA,NA,NA,NA,NA,NA,NA
"2358","Chardonnay","199","199Mtp12","",1956,NA,NA,NA,"10/9/1956",NA,NA,NA,NA,1956-09-10,NA,NA,NA,NA,NA,NA
"2359","Chardonnay","199","199Mtp12","",1957,"7/3/1957",NA,NA,"19/8/57",NA,1957-03-07,NA,NA,1957-08-19,NA,165,NA,NA,NA,NA
"2360","Chardonnay","199","199Mtp12","",1958,"19/3/58",NA,NA,"21/8/58",NA,1958-03-19,NA,NA,1958-08-21,NA,155,NA,NA,NA,NA
"2361","Chardonnay","199","199Mtp12","",1959,"13/3/59",NA,NA,NA,NA,1959-03-13,NA,NA,NA,NA,NA,NA,NA,NA,NA
"2362","Chardonnay","199","199Mtp12","",1976,NA,NA,"22/7/76",NA,NA,NA,NA,1976-07-22,NA,NA,NA,NA,NA,NA,NA
"2363","Chardonnay","199","199Mtp12","",1977,NA,NA,"8/8/1977",NA,NA,NA,NA,1977-08-08,NA,NA,NA,NA,NA,NA,NA
"2364","Chardonnay","199","199Mtp12","",1978,NA,NA,"5/8/1978",NA,NA,NA,NA,1978-08-05,NA,NA,NA,NA,NA,NA,NA
"2365","Chardonnay","199","199Mtp12","",1987,NA,"3/6/1987","30/7/87","17/8/87",NA,NA,1987-06-03,1987-07-30,1987-08-17,NA,NA,NA,57,18,NA
"2366","Chardonnay","199","199Mtp12","",1994,NA,"25/5/94",NA,NA,NA,NA,1994-05-25,NA,NA,NA,NA,NA,NA,NA,NA
"2367","Chardonnay","199","199Mtp12","",1995,"13/3/95","24/5/95","1/8/1995","26/8/95",NA,1995-03-13,1995-05-24,1995-08-01,1995-08-26,NA,166,72,69,25,141
"2368","Chardonnay","199","199Mtp12","",1996,"11/3/1996","26/5/96","28/7/96",NA,NA,1996-03-11,1996-05-26,1996-07-28,NA,NA,NA,76,63,NA,139
"2369","Chardonnay","199","199Mtp12","",1997,"1/3/1997",NA,NA,NA,NA,1997-03-01,NA,NA,NA,NA,NA,NA,NA,NA,NA
"2370","Chardonnay","199","199Mtp12","",1998,"11/3/1998","22/5/98","24/7/98","17/8/98",NA,1998-03-11,1998-05-22,1998-07-24,1998-08-17,NA,159,72,63,24,135
"2371","Chardonnay","199","199Mtp12","",1999,"11/3/1999","25/5/99","27/7/99","17/8/99",NA,1999-03-11,1999-05-25,1999-07-27,1999-08-17,NA,159,75,63,21,138
"2372","Chardonnay","199","199Mtp12","",2000,"22/3/00","2/6/2000","31/7/00","28/8/00",NA,2000-03-22,2000-06-02,2000-07-31,2000-08-28,NA,159,72,59,28,131
"2373","Chardonnay","199","199Mtp12","",2001,"5/3/2001","24/5/01","23/7/01","28/8/01",NA,2001-03-05,2001-05-24,2001-07-23,2001-08-28,NA,176,80,60,36,140
"2374","Chardonnay","199","199Mtp12","",2002,"12/3/2002","27/5/02","29/7/02","20/8/02",NA,2002-03-12,2002-05-27,2002-07-29,2002-08-20,NA,161,76,63,22,139
"2375","Chardonnay","199","199Mtp12","",2003,"24/3/03","26/5/03","22/7/03","13/8/03",NA,2003-03-24,2003-05-26,2003-07-22,2003-08-13,NA,142,63,57,22,120
"2376","Chardonnay","199","199Mtp12","",2004,"19/3/04","2/6/2004","2/8/2004","24/8/04",NA,2004-03-19,2004-06-02,2004-08-02,2004-08-24,NA,158,75,61,22,136
"2377","Chardonnay","199","199Mtp12","",2005,"31/3/05","30/5/05","29/7/05","23/8/05",NA,2005-03-31,2005-05-30,2005-07-29,2005-08-23,NA,145,60,60,25,120
"2378","Chardonnay","199","199Mtp12","",2006,"26/3/06","23/5/06","24/7/06","11/8/2006",NA,2006-03-26,2006-05-23,2006-07-24,2006-08-11,NA,138,58,62,18,120
"2379","Chardonnay","199","199Mtp12","",2007,"6/3/2007","21/5/07","24/7/07","29/8/07",NA,2007-03-06,2007-05-21,2007-07-24,2007-08-29,NA,176,76,64,36,140
"2380","Chardonnay","199","199Mtp12","",2008,"12/3/2008","22/5/08","31/7/08","27/8/08",NA,2008-03-12,2008-05-22,2008-07-31,2008-08-27,NA,168,71,70,27,141
"2381","Chardonnay","199","199Mtp12","",2009,"16/3/09","22/5/09","21/7/09","18/8/09",NA,2009-03-16,2009-05-22,2009-07-21,2009-08-18,NA,155,67,60,28,127
"2382","Chardonnay","199","199Mtp12","",2010,"28/3/10","31/5/10","26/7/10","10/9/2010",NA,2010-03-28,2010-05-31,2010-07-26,2010-09-10,NA,166,64,56,46,120
"2383","Chardonnay","199","199Mtp12","",2011,"17/3/11","14/5/11","22/7/11","25/8/11",NA,2011-03-17,2011-05-14,2011-07-22,2011-08-25,NA,161,58,69,34,127
"2384","Chardonnay","199","199Mtp12","",2012,"26/3/12","25/5/12","26/7/12","6/9/2012",NA,2012-03-26,2012-05-25,2012-07-26,2012-09-06,NA,164,60,62,42,122
"2385","Chardonnay","199","199Mtp13","",1956,NA,NA,NA,"21/8/56",NA,NA,NA,NA,1956-08-21,NA,NA,NA,NA,NA,NA
"2386","Chardonnay","199","199Mtp13","",1957,"7/3/1957",NA,NA,"13/8/57",NA,1957-03-07,NA,NA,1957-08-13,NA,159,NA,NA,NA,NA
"2387","Chardonnay","199","199Mtp13","",1958,"21/3/58",NA,NA,"21/8/58",NA,1958-03-21,NA,NA,1958-08-21,NA,153,NA,NA,NA,NA
"2388","Chardonnay","199","199Mtp13","",1959,"13/3/59",NA,NA,NA,NA,1959-03-13,NA,NA,NA,NA,NA,NA,NA,NA,NA
"2389","Chardonnay","199","199Mtp13","",1999,"9/3/1999",NA,NA,NA,NA,1999-03-09,NA,NA,NA,NA,NA,NA,NA,NA,NA
"2390","Chardonnay","199","199Mtp14","",1956,NA,NA,NA,"21/8/56",NA,NA,NA,NA,1956-08-21,NA,NA,NA,NA,NA,NA
"2391","Chardonnay","199","199Mtp14","",1957,"7/3/1957",NA,NA,"19/8/57",NA,1957-03-07,NA,NA,1957-08-19,NA,165,NA,NA,NA,NA
"2392","Chardonnay","199","199Mtp14","",1958,"19/3/58",NA,NA,"21/8/58",NA,1958-03-19,NA,NA,1958-08-21,NA,155,NA,NA,NA,NA
"2393","Chardonnay","199","199Mtp14","",1959,"13/3/59",NA,NA,NA,NA,1959-03-13,NA,NA,NA,NA,NA,NA,NA,NA,NA
"2394","Chardonnay","199","199Mtp14","",1976,NA,NA,"29/7/76",NA,NA,NA,NA,1976-07-29,NA,NA,NA,NA,NA,NA,NA
"2395","Chardonnay","199","199Mtp14","",1977,NA,NA,"16/8/77",NA,NA,NA,NA,1977-08-16,NA,NA,NA,NA,NA,NA,NA
"2396","Chardonnay","199","199Mtp14","",1978,NA,NA,"31/7/78",NA,NA,NA,NA,1978-07-31,NA,NA,NA,NA,NA,NA,NA
"2397","Chardonnay","199","199Mtp14","",1987,NA,"4/6/1987","30/7/87","24/8/87",NA,NA,1987-06-04,1987-07-30,1987-08-24,NA,NA,NA,56,25,NA
"2398","Chardonnay","199","199Mtp14","",2001,"12/3/2001",NA,NA,NA,NA,2001-03-12,NA,NA,NA,NA,NA,NA,NA,NA,NA
"2399","Chardonnay","199","199Mtp14","",2002,"17/3/02","23/5/02","1/8/2002","20/8/02",NA,2002-03-17,2002-05-23,2002-08-01,2002-08-20,NA,156,67,70,19,137
"2400","Chardonnay","199","199Mtp14","",2003,"25/3/03","23/5/03","29/7/03","18/8/03",NA,2003-03-25,2003-05-23,2003-07-29,2003-08-18,NA,146,59,67,20,126
"2401","Chardonnay","199","199Mtp14","",2004,"23/3/04","2/6/2004","2/8/2004","24/8/04",NA,2004-03-23,2004-06-02,2004-08-02,2004-08-24,NA,154,71,61,22,132
"2402","Chardonnay","199","199Mtp14","",2005,"4/4/2005","30/5/05","31/7/05","26/8/05",NA,2005-04-04,2005-05-30,2005-07-31,2005-08-26,NA,144,56,62,26,118
"2403","Chardonnay","199","199Mtp14","",2006,"26/3/06","23/5/06","24/7/06","16/8/06",NA,2006-03-26,2006-05-23,2006-07-24,2006-08-16,NA,143,58,62,23,120
"2404","Chardonnay","199","199Mtp14","",2007,"11/3/2007","20/5/07","20/7/07","29/8/07",NA,2007-03-11,2007-05-20,2007-07-20,2007-08-29,NA,171,70,61,40,131
"2405","Chardonnay","199","199Mtp14","",2008,"15/3/08","22/5/08","31/7/08","27/8/08",NA,2008-03-15,2008-05-22,2008-07-31,2008-08-27,NA,165,68,70,27,138
"2406","Chardonnay","199","199Mtp14","",2009,"16/3/09","22/5/09","27/7/09","18/8/09",NA,2009-03-16,2009-05-22,2009-07-27,2009-08-18,NA,155,67,66,22,133
"2407","Chardonnay","199","199Mtp14","",2010,"26/3/10","28/5/10","26/7/10","2/9/2010",NA,2010-03-26,2010-05-28,2010-07-26,2010-09-02,NA,160,63,59,38,122
"2408","Chardonnay","199","199Mtp14","",2011,"17/3/11","12/5/2011","24/7/11","25/8/11",NA,2011-03-17,2011-05-12,2011-07-24,2011-08-25,NA,161,56,73,32,129
"2409","Chardonnay","199","199Mtp14","",2012,"26/3/12","25/5/12","28/7/12","30/8/12",NA,2012-03-26,2012-05-25,2012-07-28,2012-08-30,NA,157,60,64,33,124
"2410","Chardonnay","199","199Mtp15","",1956,NA,NA,NA,"21/8/56",NA,NA,NA,NA,1956-08-21,NA,NA,NA,NA,NA,NA
"2411","Chardonnay","199","199Mtp15","",1957,"9/3/1957",NA,NA,"19/8/57",NA,1957-03-09,NA,NA,1957-08-19,NA,163,NA,NA,NA,NA
"2412","Chardonnay","199","199Mtp15","",1958,"26/3/58",NA,NA,"21/8/58",NA,1958-03-26,NA,NA,1958-08-21,NA,148,NA,NA,NA,NA
"2413","Chardonnay","199","199Mtp15","",1959,"11/3/1959",NA,NA,NA,NA,1959-03-11,NA,NA,NA,NA,NA,NA,NA,NA,NA
"2414","Chardonnay","199","199Mtp15","",1960,"12/3/1960",NA,NA,NA,NA,1960-03-12,NA,NA,NA,NA,NA,NA,NA,NA,NA
"2415","Chardonnay","199","199Mtp15","",1961,"3/3/1961",NA,NA,NA,NA,1961-03-03,NA,NA,NA,NA,NA,NA,NA,NA,NA
"2416","Chardonnay","199","199Mtp15","",1976,NA,NA,"29/7/76",NA,NA,NA,NA,1976-07-29,NA,NA,NA,NA,NA,NA,NA
"2417","Chardonnay","199","199Mtp15","",1977,NA,NA,"8/8/1977",NA,NA,NA,NA,1977-08-08,NA,NA,NA,NA,NA,NA,NA
"2418","Chardonnay","199","199Mtp15","",1978,NA,NA,"5/8/1978",NA,NA,NA,NA,1978-08-05,NA,NA,NA,NA,NA,NA,NA
"2419","Chardonnay","199","199Mtp15","",1996,"18/3/96",NA,NA,NA,NA,1996-03-18,NA,NA,NA,NA,NA,NA,NA,NA,NA
"2420","Chardonnay","199","199Mtp16","",1956,"25/3/56",NA,NA,"24/9/56",NA,1956-03-25,NA,NA,1956-09-24,NA,183,NA,NA,NA,NA
"2421","Chardonnay","199","199Mtp16","",1957,"11/3/1957",NA,NA,"17/9/57",NA,1957-03-11,NA,NA,1957-09-17,NA,190,NA,NA,NA,NA
"2422","Chardonnay","199","199Mtp16","",1958,"22/3/58",NA,NA,"19/9/58",NA,1958-03-22,NA,NA,1958-09-19,NA,181,NA,NA,NA,NA
"2423","Chardonnay","199","199Mtp17","",1956,"26/3/56",NA,NA,"24/9/56",NA,1956-03-26,NA,NA,1956-09-24,NA,182,NA,NA,NA,NA
"2424","Chardonnay","199","199Mtp17","",1957,"10/3/1957",NA,NA,"17/9/57",NA,1957-03-10,NA,NA,1957-09-17,NA,191,NA,NA,NA,NA
"2425","Chardonnay","199","199Mtp17","",1958,"29/3/58",NA,NA,"22/8/58",NA,1958-03-29,NA,NA,1958-08-22,NA,146,NA,NA,NA,NA
"2426","Chardonnay","199","199Mtp17","",1959,"18/3/59",NA,NA,"12/8/1959",NA,1959-03-18,NA,NA,1959-08-12,NA,147,NA,NA,NA,NA
"2427","Chardonnay","199","199Mtp17","",1960,"10/3/1960",NA,NA,"1/8/1960",NA,1960-03-10,NA,NA,1960-08-01,NA,144,NA,NA,NA,NA
"2428","Chardonnay","199","199Mtp17","",1961,"27/2/61",NA,NA,"1/8/1960",NA,1961-02-27,NA,NA,1960-08-01,NA,-210,NA,NA,NA,NA
"2429","Chardonnay","199","199Mtp18","",1956,"27/3/56",NA,NA,"17/9/56",NA,1956-03-27,NA,NA,1956-09-17,NA,174,NA,NA,NA,NA
"2430","Chardonnay","199","199Mtp18","",1957,"13/3/57",NA,NA,"19/8/57",NA,1957-03-13,NA,NA,1957-08-19,NA,159,NA,NA,NA,NA
"2431","Chardonnay","199","199Mtp18","",1958,"29/3/58",NA,NA,"4/9/1958",NA,1958-03-29,NA,NA,1958-09-04,NA,159,NA,NA,NA,NA
"2432","Chardonnay","199","199Mtp18","",1959,"25/3/59",NA,NA,"31/8/59",NA,1959-03-25,NA,NA,1959-08-31,NA,159,NA,NA,NA,NA
"2433","Chardonnay","199","199Mtp18","",1960,"15/3/60",NA,NA,NA,NA,1960-03-15,NA,NA,NA,NA,NA,NA,NA,NA,NA
"2434","Chardonnay","199","199Mtp19","",1958,"20/3/58",NA,NA,"29/8/58",NA,1958-03-20,NA,NA,1958-08-29,NA,162,NA,NA,NA,NA
"2435","Chardonnay","199","199Mtp19","",1959,"16/3/59",NA,NA,"24/8/59",NA,1959-03-16,NA,NA,1959-08-24,NA,161,NA,NA,NA,NA
"2436","Chardonnay","199","199Mtp19","",1960,"16/3/60",NA,NA,"16/8/60",NA,1960-03-16,NA,NA,1960-08-16,NA,153,NA,NA,NA,NA
"2437","Chardonnay","199","199Mtp19","",1961,"9/3/1961",NA,NA,"14/8/61",NA,1961-03-09,NA,NA,1961-08-14,NA,158,NA,NA,NA,NA
"2438","Chardonnay","199","199Mtp19","",1962,"5/4/1962",NA,NA,NA,NA,1962-04-05,NA,NA,NA,NA,NA,NA,NA,NA,NA
"2439","Chardonnay","199","199Mtp20","",1957,NA,NA,NA,"19/8/67",NA,NA,NA,NA,1967-08-19,NA,NA,NA,NA,NA,NA
"2440","Chardonnay","199","199Mtp20","",1958,"21/3/58",NA,NA,"21/8/58",NA,1958-03-21,NA,NA,1958-08-21,NA,153,NA,NA,NA,NA
"2441","Chardonnay","199","199Mtp20","",1959,"11/3/1959",NA,NA,"19/8/59",NA,1959-03-11,NA,NA,1959-08-19,NA,161,NA,NA,NA,NA
"2442","Chardonnay","199","199Mtp20","",1960,"7/3/1960",NA,NA,NA,NA,1960-03-07,NA,NA,NA,NA,NA,NA,NA,NA,NA
"2443","Chardonnay","199","199Mtp21","",1963,"1/4/1963",NA,NA,"10/9/1963",NA,1963-04-01,NA,NA,1963-09-10,NA,162,NA,NA,NA,NA
"2444","Chardonnay","199","199Mtp21","",1964,"26/3/64",NA,NA,"27/8/64",NA,1964-03-26,NA,NA,1964-08-27,NA,154,NA,NA,NA,NA
"2445","Chardonnay","199","199Mtp21","",1965,"27/3/65",NA,NA,"18/8/65",NA,1965-03-27,NA,NA,1965-08-18,NA,144,NA,NA,NA,NA
"2446","Chardonnay","199","199Mtp21","",1979,NA,NA,"6/8/1979",NA,NA,NA,NA,1979-08-06,NA,NA,NA,NA,NA,NA,NA
"2447","Chardonnay","199","199Mtp21","",1980,NA,NA,"18/8/80",NA,NA,NA,NA,1980-08-18,NA,NA,NA,NA,NA,NA,NA
"2448","Chardonnay","199","199Mtp21","",1981,NA,NA,"3/8/1981",NA,NA,NA,NA,1981-08-03,NA,NA,NA,NA,NA,NA,NA
"2449","Chardonnay","199","199Mtp21","",1996,"18/3/96",NA,NA,NA,NA,1996-03-18,NA,NA,NA,NA,NA,NA,NA,NA,NA
"2450","Chardonnay","199","199Mtp21","",1998,"14/3/98","22/5/98","21/7/98","17/8/98",NA,1998-03-14,1998-05-22,1998-07-21,1998-08-17,NA,156,69,60,27,129
"2451","Chardonnay","199","199Mtp21","",1999,"10/3/1999","28/5/99","30/7/99","24/8/99",NA,1999-03-10,1999-05-28,1999-07-30,1999-08-24,NA,167,79,63,25,142
"2452","Chardonnay","199","199Mtp22","",1963,"18/3/63",NA,NA,NA,NA,1963-03-18,NA,NA,NA,NA,NA,NA,NA,NA,NA
"2453","Chardonnay","199","199Mtp22","",1964,"23/3/64",NA,NA,"27/8/64",NA,1964-03-23,NA,NA,1964-08-27,NA,157,NA,NA,NA,NA
"2454","Chardonnay","199","199Mtp22","",1965,"24/3/65",NA,NA,"18/8/65",NA,1965-03-24,NA,NA,1965-08-18,NA,147,NA,NA,NA,NA
"2455","Chardonnay","199","199Mtp23","",1963,"28/3/63",NA,NA,"20/8/63",NA,1963-03-28,NA,NA,1963-08-20,NA,145,NA,NA,NA,NA
"2456","Chardonnay","199","199Mtp23","",1964,"26/3/64",NA,NA,"1/9/1964",NA,1964-03-26,NA,NA,1964-09-01,NA,159,NA,NA,NA,NA
"2457","Chardonnay","199","199Mtp23","",1965,"24/3/65",NA,NA,"18/8/65",NA,1965-03-24,NA,NA,1965-08-18,NA,147,NA,NA,NA,NA
"2458","Chardonnay","199","199Mtp24","",1963,"28/3/63",NA,NA,"20/8/63",NA,1963-03-28,NA,NA,1963-08-20,NA,145,NA,NA,NA,NA
"2459","Chardonnay","199","199Mtp24","",1964,"26/3/64",NA,NA,"20/8/64",NA,1964-03-26,NA,NA,1964-08-20,NA,147,NA,NA,NA,NA
"2460","Chardonnay","199","199Mtp24","",1965,"27/3/65",NA,NA,"25/8/65",NA,1965-03-27,NA,NA,1965-08-25,NA,151,NA,NA,NA,NA
"2461","Chardonnay","199","199Mtp25","",1958,"17/3/58",NA,NA,"12/8/1958",NA,1958-03-17,NA,NA,1958-08-12,NA,148,NA,NA,NA,NA
"2462","Chardonnay","199","199Mtp25","",1959,"16/3/59",NA,NA,"17/8/59",NA,1959-03-16,NA,NA,1959-08-17,NA,154,NA,NA,NA,NA
"2463","Chardonnay","199","199Mtp25","",1960,"11/3/1960",NA,NA,"16/8/60",NA,1960-03-11,NA,NA,1960-08-16,NA,158,NA,NA,NA,NA
"2464","Chardonnay","199","199Mtp25","",1961,"4/3/1961",NA,NA,NA,NA,1961-03-04,NA,NA,NA,NA,NA,NA,NA,NA,NA
"2465","Chardonnay","199","199Mtp26","",1964,"26/3/64",NA,NA,"24/8/64",NA,1964-03-26,NA,NA,1964-08-24,NA,151,NA,NA,NA,NA
"2466","Chardonnay","199","199Mtp26","",1965,"30/3/65",NA,NA,"18/8/65",NA,1965-03-30,NA,NA,1965-08-18,NA,141,NA,NA,NA,NA
"2467","Chardonnay","199","199Mtp26","",1966,"16/3/66",NA,NA,"30/8/66",NA,1966-03-16,NA,NA,1966-08-30,NA,167,NA,NA,NA,NA
"2468","Chardonnay","199","199Mtp26","",1979,NA,NA,"30/7/79",NA,NA,NA,NA,1979-07-30,NA,NA,NA,NA,NA,NA,NA
"2469","Chardonnay","199","199Mtp26","",1980,NA,NA,"11/8/1980",NA,NA,NA,NA,1980-08-11,NA,NA,NA,NA,NA,NA,NA
"2470","Chardonnay","199","199Mtp26","",1981,NA,NA,"27/7/81",NA,NA,NA,NA,1981-07-27,NA,NA,NA,NA,NA,NA,NA
"2471","Chardonnay","199","199Mtp27","",1964,"26/3/64",NA,NA,"17/8/64",NA,1964-03-26,NA,NA,1964-08-17,NA,144,NA,NA,NA,NA
"2472","Chardonnay","199","199Mtp27","",1965,"27/3/65",NA,NA,"18/8/65",NA,1965-03-27,NA,NA,1965-08-18,NA,144,NA,NA,NA,NA
"2473","Chardonnay","199","199Mtp27","",1966,"15/3/66",NA,NA,"30/8/66",NA,1966-03-15,NA,NA,1966-08-30,NA,168,NA,NA,NA,NA
"2474","Chardonnay","199","199Mtp28","",1964,"26/3/64",NA,NA,NA,NA,1964-03-26,NA,NA,NA,NA,NA,NA,NA,NA,NA
"2475","Chardonnay","199","199Mtp28","",1965,"31/3/65",NA,NA,NA,NA,1965-03-31,NA,NA,NA,NA,NA,NA,NA,NA,NA
"2476","Chardonnay","199","199Mtp29","",1964,"26/3/64",NA,NA,"24/8/64",NA,1964-03-26,NA,NA,1964-08-24,NA,151,NA,NA,NA,NA
"2477","Chardonnay","199","199Mtp29","",1965,"31/3/65",NA,NA,"18/8/65",NA,1965-03-31,NA,NA,1965-08-18,NA,140,NA,NA,NA,NA
"2478","Chardonnay","199","199Mtp29","",1966,"15/3/66",NA,NA,"30/8/66",NA,1966-03-15,NA,NA,1966-08-30,NA,168,NA,NA,NA,NA
"2479","Chardonnay","199","199Mtp29","",1979,NA,NA,"30/7/79",NA,NA,NA,NA,1979-07-30,NA,NA,NA,NA,NA,NA,NA
"2480","Chardonnay","199","199Mtp29","",1981,NA,NA,"3/8/1981",NA,NA,NA,NA,1981-08-03,NA,NA,NA,NA,NA,NA,NA
"2481","Chardonnay","199","199Mtp29","",2002,"11/3/2002","23/5/02","22/7/02","30/8/02",NA,2002-03-11,2002-05-23,2002-07-22,2002-08-30,NA,172,73,60,39,133
"2482","Chardonnay","199","199Mtp29","",2003,"26/3/03","30/5/03","18/7/03","13/8/03",NA,2003-03-26,2003-05-30,2003-07-18,2003-08-13,NA,140,65,49,26,114
"2483","Chardonnay","199","199Mtp29","",2004,"19/3/04","4/6/2004","2/8/2004","24/8/04",NA,2004-03-19,2004-06-04,2004-08-02,2004-08-24,NA,158,77,59,22,136
"2484","Chardonnay","199","199Mtp29","",2005,"31/3/05","30/5/05","31/7/05","22/8/05",NA,2005-03-31,2005-05-30,2005-07-31,2005-08-22,NA,144,60,62,22,122
"2485","Chardonnay","199","199Mtp29","",2006,"26/3/06","24/5/06","31/7/06","16/8/06",NA,2006-03-26,2006-05-24,2006-07-31,2006-08-16,NA,143,59,68,16,127
"2486","Chardonnay","199","199Mtp29","",2007,"7/3/2007","16/5/07","20/7/07","14/8/07",NA,2007-03-07,2007-05-16,2007-07-20,2007-08-14,NA,160,70,65,25,135
"2487","Chardonnay","199","199Mtp29","",2008,"4/3/2008","21/5/08","31/7/08","20/8/08",NA,2008-03-04,2008-05-21,2008-07-31,2008-08-20,NA,169,78,71,20,149
"2488","Chardonnay","199","199Mtp29","",2009,"16/3/09","22/5/09","21/7/09","25/8/09",NA,2009-03-16,2009-05-22,2009-07-21,2009-08-25,NA,162,67,60,35,127
"2489","Chardonnay","199","199Mtp29","",2010,"25/3/10","27/5/10","2/8/2010","27/8/10",NA,2010-03-25,2010-05-27,2010-08-02,2010-08-27,NA,155,63,67,25,130
"2490","Chardonnay","199","199Mtp29","",2011,"16/3/11","11/5/2011","23/7/11","18/8/11",NA,2011-03-16,2011-05-11,2011-07-23,2011-08-18,NA,155,56,73,26,129
"2491","Chardonnay","199","199Mtp29","",2012,"20/3/12","25/5/12","28/7/12","30/8/12",NA,2012-03-20,2012-05-25,2012-07-28,2012-08-30,NA,163,66,64,33,130
"2492","Chardonnay","199","199Mtp30","",1964,"26/3/64",NA,NA,"24/8/64",NA,1964-03-26,NA,NA,1964-08-24,NA,151,NA,NA,NA,NA
"2493","Chardonnay","199","199Mtp30","",1965,"27/3/65",NA,NA,"18/8/65",NA,1965-03-27,NA,NA,1965-08-18,NA,144,NA,NA,NA,NA
"2494","Chardonnay","199","199Mtp30","",1966,"15/3/66",NA,NA,"30/8/66",NA,1966-03-15,NA,NA,1966-08-30,NA,168,NA,NA,NA,NA
"2495","Chardonnay","199","199Mtp30","",1979,NA,NA,"30/7/79",NA,NA,NA,NA,1979-07-30,NA,NA,NA,NA,NA,NA,NA
"2496","Chardonnay","199","199Mtp30","",1980,NA,NA,"11/8/1980",NA,NA,NA,NA,1980-08-11,NA,NA,NA,NA,NA,NA,NA
"2497","Chardonnay","199","199Mtp30","",1981,NA,NA,"3/8/1981",NA,NA,NA,NA,1981-08-03,NA,NA,NA,NA,NA,NA,NA
"2498","Chardonnay","199","199Mtp31","",1964,"30/3/64",NA,NA,"24/8/64",NA,1964-03-30,NA,NA,1964-08-24,NA,147,NA,NA,NA,NA
"2499","Chardonnay","199","199Mtp31","",1965,"27/3/65",NA,NA,"18/8/65",NA,1965-03-27,NA,NA,1965-08-18,NA,144,NA,NA,NA,NA
"2500","Chardonnay","199","199Mtp31","",1966,"16/3/66",NA,NA,"30/8/66",NA,1966-03-16,NA,NA,1966-08-30,NA,167,NA,NA,NA,NA
"2501","Chardonnay","199","199Mtp31","",1979,NA,NA,"2/8/1979",NA,NA,NA,NA,1979-08-02,NA,NA,NA,NA,NA,NA,NA
"2502","Chardonnay","199","199Mtp31","",1980,NA,NA,"18/8/80",NA,NA,NA,NA,1980-08-18,NA,NA,NA,NA,NA,NA,NA
"2503","Chardonnay","199","199Mtp31","",1981,NA,NA,"3/8/1981",NA,NA,NA,NA,1981-08-03,NA,NA,NA,NA,NA,NA,NA
"2504","Chardonnay","199","199Mtp31","",2001,"8/3/2001","24/5/01","23/7/01","28/8/01",NA,2001-03-08,2001-05-24,2001-07-23,2001-08-28,NA,173,77,60,36,137
"2505","Chardonnay","199","199Mtp31","",2002,"11/3/2002","27/5/02","29/7/02","30/8/02",NA,2002-03-11,2002-05-27,2002-07-29,2002-08-30,NA,172,77,63,32,140
"2506","Chardonnay","199","199Mtp31","",2003,"20/3/03","26/5/03","18/7/03","14/8/03",NA,2003-03-20,2003-05-26,2003-07-18,2003-08-14,NA,147,67,53,27,120
"2507","Chardonnay","199","199Mtp31","",2004,"20/3/04",NA,NA,NA,NA,2004-03-20,NA,NA,NA,NA,NA,NA,NA,NA,NA
"2508","Chardonnay","199","199Mtp31","",2005,"31/3/05","31/5/05","29/7/05","22/8/05",NA,2005-03-31,2005-05-31,2005-07-29,2005-08-22,NA,144,61,59,24,120
"2509","Chardonnay","199","199Mtp31","",2006,"24/3/06","25/5/06","24/7/06","11/8/2006",NA,2006-03-24,2006-05-25,2006-07-24,2006-08-11,NA,140,62,60,18,122
"2510","Chardonnay","199","199Mtp31","",2007,"6/3/2007",NA,NA,NA,NA,2007-03-06,NA,NA,NA,NA,NA,NA,NA,NA,NA
"2511","Chardonnay","199","199Mtp31","",2008,"2/3/2008","22/5/08","7/8/2008","20/8/08",NA,2008-03-02,2008-05-22,2008-08-07,2008-08-20,NA,171,81,77,13,158
"2512","Chardonnay","199","199Mtp31","",2009,"12/3/2009",NA,NA,NA,NA,2009-03-12,NA,NA,NA,NA,NA,NA,NA,NA,NA
"2513","Chardonnay","199","199Mtp31","",2010,"22/3/10","27/5/10","2/8/2010","27/8/10",NA,2010-03-22,2010-05-27,2010-08-02,2010-08-27,NA,158,66,67,25,133
"2514","Chardonnay","199","199Mtp31","",2011,"9/3/2011","9/5/2011","20/7/11","18/8/11",NA,2011-03-09,2011-05-09,2011-07-20,2011-08-18,NA,162,61,72,29,133
"2515","Chardonnay","199","199Mtp31","",2012,"16/3/12","26/5/12","3/8/2012","24/8/12",NA,2012-03-16,2012-05-26,2012-08-03,2012-08-24,NA,161,71,69,21,140
"2516","Chardonnay","199","199Mtp32","",1964,"30/3/64",NA,NA,"24/8/64",NA,1964-03-30,NA,NA,1964-08-24,NA,147,NA,NA,NA,NA
"2517","Chardonnay","199","199Mtp32","",1965,"5/4/1965",NA,NA,"11/8/1965",NA,1965-04-05,NA,NA,1965-08-11,NA,128,NA,NA,NA,NA
"2518","Chardonnay","199","199Mtp32","",1966,"14/3/66",NA,NA,"30/8/66",NA,1966-03-14,NA,NA,1966-08-30,NA,169,NA,NA,NA,NA
"2519","Chardonnay","199","199Mtp33","",1964,"26/3/64",NA,NA,"17/8/64",NA,1964-03-26,NA,NA,1964-08-17,NA,144,NA,NA,NA,NA
"2520","Chardonnay","199","199Mtp33","",1965,"27/3/65",NA,NA,"17/8/65",NA,1965-03-27,NA,NA,1965-08-17,NA,143,NA,NA,NA,NA
"2521","Chardonnay","199","199Mtp33","",1966,"16/3/66",NA,NA,NA,NA,1966-03-16,NA,NA,NA,NA,NA,NA,NA,NA,NA
"2522","Chardonnay","199","199Mtp33","",1967,NA,NA,NA,"30/8/67",NA,NA,NA,NA,1967-08-30,NA,NA,NA,NA,NA,NA
"2523","Chardonnay","199","199Mtp33","",1979,NA,NA,"2/8/1979",NA,NA,NA,NA,1979-08-02,NA,NA,NA,NA,NA,NA,NA
"2524","Chardonnay","199","199Mtp33","",1980,NA,NA,"11/8/1980",NA,NA,NA,NA,1980-08-11,NA,NA,NA,NA,NA,NA,NA
"2525","Chardonnay","199","199Mtp33","",1981,NA,NA,"3/8/1981",NA,NA,NA,NA,1981-08-03,NA,NA,NA,NA,NA,NA,NA
"2526","Chardonnay","199","199Mtp34","",1964,"26/3/64",NA,NA,"17/8/64",NA,1964-03-26,NA,NA,1964-08-17,NA,144,NA,NA,NA,NA
"2527","Chardonnay","199","199Mtp34","",1965,"27/3/65",NA,NA,"18/8/65",NA,1965-03-27,NA,NA,1965-08-18,NA,144,NA,NA,NA,NA
"2528","Chardonnay","199","199Mtp34","",1966,"16/3/66",NA,NA,"30/8/66",NA,1966-03-16,NA,NA,1966-08-30,NA,167,NA,NA,NA,NA
"2529","Chardonnay","199","199Mtp34","",1979,NA,NA,"30/7/79",NA,NA,NA,NA,1979-07-30,NA,NA,NA,NA,NA,NA,NA
"2530","Chardonnay","199","199Mtp34","",1980,NA,NA,"11/8/1980",NA,NA,NA,NA,1980-08-11,NA,NA,NA,NA,NA,NA,NA
"2531","Chardonnay","199","199Mtp34","",1981,NA,NA,"3/8/1981",NA,NA,NA,NA,1981-08-03,NA,NA,NA,NA,NA,NA,NA
"2532","Chardonnay","199","199Mtp34","",2000,"8/3/2000","17/5/00","13/7/00","17/8/00",NA,2000-03-08,2000-05-17,2000-07-13,2000-08-17,NA,162,70,57,35,127
"2533","Chardonnay","199","199Mtp35","",1964,"26/3/64",NA,NA,"17/8/64",NA,1964-03-26,NA,NA,1964-08-17,NA,144,NA,NA,NA,NA
"2534","Chardonnay","199","199Mtp35","",1965,"27/3/65",NA,NA,"18/8/65",NA,1965-03-27,NA,NA,1965-08-18,NA,144,NA,NA,NA,NA
"2535","Chardonnay","199","199Mtp35","",1966,"12/3/1966",NA,NA,"30/8/66",NA,1966-03-12,NA,NA,1966-08-30,NA,171,NA,NA,NA,NA
"2536","Chardonnay","199","199Mtp36","",1963,"26/3/63",NA,NA,"13/8/63",NA,1963-03-26,NA,NA,1963-08-13,NA,140,NA,NA,NA,NA
"2537","Chardonnay","199","199Mtp36","",1964,"26/3/64",NA,NA,"1/9/1964",NA,1964-03-26,NA,NA,1964-09-01,NA,159,NA,NA,NA,NA
"2538","Chardonnay","199","199Mtp36","",1965,"26/3/65",NA,NA,"7/9/1965",NA,1965-03-26,NA,NA,1965-09-07,NA,165,NA,NA,NA,NA
"2539","Chardonnay","199","199Mtp37","",1963,"22/3/63",NA,NA,NA,NA,1963-03-22,NA,NA,NA,NA,NA,NA,NA,NA,NA
"2540","Chardonnay","199","199Mtp37","",1964,"1/4/1964",NA,NA,"27/8/64",NA,1964-04-01,NA,NA,1964-08-27,NA,148,NA,NA,NA,NA
"2541","Chardonnay","199","199Mtp37","",1965,"27/3/65",NA,NA,"18/8/65",NA,1965-03-27,NA,NA,1965-08-18,NA,144,NA,NA,NA,NA
"2542","Chardonnay","199","199Mtp37","",1966,"16/3/66",NA,NA,"30/8/66",NA,1966-03-16,NA,NA,1966-08-30,NA,167,NA,NA,NA,NA
"2543","Chardonnay","199","199Mtp38","",1964,NA,NA,NA,"19/8/64",NA,NA,NA,NA,1964-08-19,NA,NA,NA,NA,NA,NA
"2544","Chardonnay","199","199Mtp38","",1965,"27/3/65",NA,NA,"30/8/65",NA,1965-03-27,NA,NA,1965-08-30,NA,156,NA,NA,NA,NA
"2545","Chardonnay","199","199Mtp38","",1966,"9/3/1966",NA,NA,"23/8/66",NA,1966-03-09,NA,NA,1966-08-23,NA,167,NA,NA,NA,NA
"2546","Chardonnay","199","199Mtp38","",1967,"11/3/1967",NA,NA,NA,NA,1967-03-11,NA,NA,NA,NA,NA,NA,NA,NA,NA
"2547","Chardonnay","199","199Mtp38","",1976,NA,NA,"23/7/76",NA,NA,NA,NA,1976-07-23,NA,NA,NA,NA,NA,NA,NA
"2548","Chardonnay","199","199Mtp38","",1977,NA,NA,"1/8/1977",NA,NA,NA,NA,1977-08-01,NA,NA,NA,NA,NA,NA,NA
"2549","Chardonnay","199","199Mtp38","",1978,NA,NA,"10/8/1978",NA,NA,NA,NA,1978-08-10,NA,NA,NA,NA,NA,NA,NA
"2550","Chardonnay","199","199Mtp39","",1973,NA,NA,NA,"27/8/73",NA,NA,NA,NA,1973-08-27,NA,NA,NA,NA,NA,NA
"2551","Chardonnay","199","199Mtp39","",1974,"20/3/74",NA,NA,"28/8/74",NA,1974-03-20,NA,NA,1974-08-28,NA,161,NA,NA,NA,NA
"2552","Chardonnay","199","199Mtp39","",1975,"10/3/1975",NA,NA,"26/8/75",NA,1975-03-10,NA,NA,1975-08-26,NA,169,NA,NA,NA,NA
"2553","Chardonnay","199","199Mtp39","",1976,"15/3/76",NA,NA,NA,NA,1976-03-15,NA,NA,NA,NA,NA,NA,NA,NA,NA
"2554","Chardonnay","199","199Mtp39","",1980,NA,NA,"4/8/1980",NA,NA,NA,NA,1980-08-04,NA,NA,NA,NA,NA,NA,NA
"2555","Chardonnay","199","199Mtp39","",1981,NA,NA,"17/8/81",NA,NA,NA,NA,1981-08-17,NA,NA,NA,NA,NA,NA,NA
"2556","Chardonnay","199","199Mtp39","",1982,NA,NA,"19/7/82",NA,NA,NA,NA,1982-07-19,NA,NA,NA,NA,NA,NA,NA
"2557","Chardonnay","199","199Mtp39","",1988,NA,"25/5/88",NA,NA,NA,NA,1988-05-25,NA,NA,NA,NA,NA,NA,NA,NA
"2558","Chardonnay","199","199Mtp39","",1994,NA,"20/5/94",NA,NA,NA,NA,1994-05-20,NA,NA,NA,NA,NA,NA,NA,NA
"2559","Chardonnay","199","199Mtp39","",1995,NA,"30/5/95",NA,NA,NA,NA,1995-05-30,NA,NA,NA,NA,NA,NA,NA,NA
"2560","Chardonnay","199","199Mtp39","",2002,"14/3/02","27/5/02","1/8/2002","27/8/02",NA,2002-03-14,2002-05-27,2002-08-01,2002-08-27,NA,166,74,66,26,140
"2561","Chardonnay","199","199Mtp39","",2003,"17/3/03","23/5/03","18/7/03","13/8/03",NA,2003-03-17,2003-05-23,2003-07-18,2003-08-13,NA,149,67,56,26,123
"2562","Chardonnay","199","199Mtp39","",2004,"23/3/04","2/6/2004","2/8/2004","24/8/04",NA,2004-03-23,2004-06-02,2004-08-02,2004-08-24,NA,154,71,61,22,132
"2563","Chardonnay","199","199Mtp39","",2005,"31/3/05","30/5/05","1/8/2005","30/8/05",NA,2005-03-31,2005-05-30,2005-08-01,2005-08-30,NA,152,60,63,29,123
"2564","Chardonnay","199","199Mtp39","",2006,"23/3/06","22/5/06","27/7/06","16/8/06",NA,2006-03-23,2006-05-22,2006-07-27,2006-08-16,NA,146,60,66,20,126
"2565","Chardonnay","199","199Mtp39","",2007,"12/3/2007","14/5/07","20/7/07","20/8/07",NA,2007-03-12,2007-05-14,2007-07-20,2007-08-20,NA,161,63,67,31,130
"2566","Chardonnay","199","199Mtp39","",2008,"7/3/2008","19/5/08","31/7/08","28/8/08",NA,2008-03-07,2008-05-19,2008-07-31,2008-08-28,NA,174,73,73,28,146
"2567","Chardonnay","199","199Mtp39","",2009,"10/3/2009","19/5/09","21/7/09","14/8/09",NA,2009-03-10,2009-05-19,2009-07-21,2009-08-14,NA,157,70,63,24,133
"2568","Chardonnay","199","199Mtp39","",2010,"24/3/10","27/5/10","26/7/10","27/8/10",NA,2010-03-24,2010-05-27,2010-07-26,2010-08-27,NA,156,64,60,32,124
"2569","Chardonnay","199","199Mtp39","",2011,"25/3/11","12/5/2011","18/7/11","26/8/11",NA,2011-03-25,2011-05-12,2011-07-18,2011-08-26,NA,154,48,67,39,115
"2570","Chardonnay","199","199Mtp39","",2012,"20/3/12","23/5/12","26/7/12","21/8/12",NA,2012-03-20,2012-05-23,2012-07-26,2012-08-21,NA,154,64,64,26,128
"2571","Chasselas","585","585Mtp1","",1960,"4/3/1960",NA,NA,NA,NA,1960-03-04,NA,NA,NA,NA,NA,NA,NA,NA,NA
"2572","Chasselas","585","585Mtp1","",1961,"23/2/61",NA,NA,NA,NA,1961-02-23,NA,NA,NA,NA,NA,NA,NA,NA,NA
"2573","Chasselas","585","585Mtp2","",1956,"30/3/56",NA,NA,"8/8/1956",NA,1956-03-30,NA,NA,1956-08-08,NA,131,NA,NA,NA,NA
"2574","Chasselas","585","585Mtp2","",1957,"13/3/57",NA,NA,"13/8/57",NA,1957-03-13,NA,NA,1957-08-13,NA,153,NA,NA,NA,NA
"2575","Chasselas","585","585Mtp2","",1958,"28/3/58",NA,NA,"11/8/1958",NA,1958-03-28,NA,NA,1958-08-11,NA,136,NA,NA,NA,NA
"2576","Chasselas","585","585Mtp2","",1959,"13/3/59",NA,NA,"10/8/1959",NA,1959-03-13,NA,NA,1959-08-10,NA,150,NA,NA,NA,NA
"2577","Chasselas","585","585Mtp2","",1960,"10/3/1960",NA,NA,"1/8/1960",NA,1960-03-10,NA,NA,1960-08-01,NA,144,NA,NA,NA,NA
"2578","Chasselas","585","585Mtp3","",1958,"28/3/58",NA,NA,"29/8/58",NA,1958-03-28,NA,NA,1958-08-29,NA,154,NA,NA,NA,NA
"2579","Chasselas","585","585Mtp3","",1959,"19/3/59",NA,NA,"3/8/1959",NA,1959-03-19,NA,NA,1959-08-03,NA,137,NA,NA,NA,NA
"2580","Chasselas","585","585Mtp3","",1960,"11/3/1960",NA,NA,"1/8/1960",NA,1960-03-11,NA,NA,1960-08-01,NA,143,NA,NA,NA,NA
"2581","Chasselas","585","585Mtp4","",1958,"24/3/58",NA,NA,"19/8/58",NA,1958-03-24,NA,NA,1958-08-19,NA,148,NA,NA,NA,NA
"2582","Chasselas","585","585Mtp4","",1959,"14/3/59",NA,NA,"10/8/1959",NA,1959-03-14,NA,NA,1959-08-10,NA,149,NA,NA,NA,NA
"2583","Chasselas","585","585Mtp4","",1960,"9/3/1960",NA,NA,"8/8/1960",NA,1960-03-09,NA,NA,1960-08-08,NA,152,NA,NA,NA,NA
"2584","Chasselas","585","585Mtp4","",1961,"12/3/1961",NA,NA,"14/8/61",NA,1961-03-12,NA,NA,1961-08-14,NA,155,NA,NA,NA,NA
"2585","Chasselas","585","585Mtp5","",1957,"7/3/1957",NA,NA,NA,NA,1957-03-07,NA,NA,NA,NA,NA,NA,NA,NA,NA
"2586","Chasselas","585","585Mtp5","",1958,"21/3/58",NA,NA,"18/8/58",NA,1958-03-21,NA,NA,1958-08-18,NA,150,NA,NA,NA,NA
"2587","Chasselas","585","585Mtp5","",1959,"9/3/1959",NA,NA,"10/8/1959",NA,1959-03-09,NA,NA,1959-08-10,NA,154,NA,NA,NA,NA
"2588","Chasselas","585","585Mtp5","",1960,"7/3/1960",NA,NA,NA,NA,1960-03-07,NA,NA,NA,NA,NA,NA,NA,NA,NA
"2589","Chasselas","585","585Mtp5","",1961,"27/2/61",NA,NA,"7/8/1961",NA,1961-02-27,NA,NA,1961-08-07,NA,161,NA,NA,NA,NA
"2590","Chasselas","585","585Mtp6","",1956,"23/3/56",NA,NA,"13/8/56",NA,1956-03-23,NA,NA,1956-08-13,NA,143,NA,NA,NA,NA
"2591","Chasselas","585","585Mtp6","",1957,"9/3/1957",NA,NA,"13/8/57",NA,1957-03-09,NA,NA,1957-08-13,NA,157,NA,NA,NA,NA
"2592","Chasselas","585","585Mtp6","",1958,"21/3/58",NA,NA,"21/8/58",NA,1958-03-21,NA,NA,1958-08-21,NA,153,NA,NA,NA,NA
"2593","Chasselas","585","585Mtp6","",1959,"17/3/59",NA,NA,"10/8/1959",NA,1959-03-17,NA,NA,1959-08-10,NA,146,NA,NA,NA,NA
"2594","Chasselas","585","585Mtp6","",1960,"10/3/1960",NA,NA,"1/8/1960",NA,1960-03-10,NA,NA,1960-08-01,NA,144,NA,NA,NA,NA
"2595","Chasselas","585","585Mtp6","",1961,"5/3/1961",NA,NA,"7/8/1961",NA,1961-03-05,NA,NA,1961-08-07,NA,155,NA,NA,NA,NA
"2596","Chasselas","585","585Mtp6","",1962,"31/3/62",NA,NA,NA,NA,1962-03-31,NA,NA,NA,NA,NA,NA,NA,NA,NA
"2597","Chasselas","585","585Mtp6","",1963,"31/3/63",NA,NA,NA,NA,1963-03-31,NA,NA,NA,NA,NA,NA,NA,NA,NA
"2598","Chasselas","585","585Mtp6","",1964,"28/3/64",NA,NA,NA,NA,1964-03-28,NA,NA,NA,NA,NA,NA,NA,NA,NA
"2599","Chasselas","585","585Mtp6","",1965,"26/3/65",NA,NA,NA,NA,1965-03-26,NA,NA,NA,NA,NA,NA,NA,NA,NA
"2600","Chasselas","585","585Mtp6","",1972,NA,NA,NA,"17/8/82",NA,NA,NA,NA,1982-08-17,NA,NA,NA,NA,NA,NA
"2601","Chasselas","585","585Mtp6","",1977,NA,NA,"25/7/77",NA,NA,NA,NA,1977-07-25,NA,NA,NA,NA,NA,NA,NA
"2602","Chasselas","585","585Mtp6","",1978,NA,NA,"31/7/78",NA,NA,NA,NA,1978-07-31,NA,NA,NA,NA,NA,NA,NA
"2603","Chasselas","585","585Mtp6","",1979,"12/3/1979",NA,NA,NA,NA,1979-03-12,NA,NA,NA,NA,NA,NA,NA,NA,NA
"2604","Chasselas","585","585Mtp6","",1989,"24/3/89","31/5/89",NA,"16/8/89",NA,1989-03-24,1989-05-31,NA,1989-08-16,NA,145,68,NA,NA,NA
"2605","Chasselas","585","585Mtp6","",1990,"1/3/1990","22/5/90","14/7/90","8/8/1990",NA,1990-03-01,1990-05-22,1990-07-14,1990-08-08,NA,160,82,53,25,135
"2606","Chasselas","585","585Mtp6","",1991,"18/3/91","31/5/91","26/7/91","13/8/91",NA,1991-03-18,1991-05-31,1991-07-26,1991-08-13,NA,148,74,56,18,130
"2607","Chasselas","585","585Mtp6","",1992,"19/3/92","22/5/92","16/7/92","10/8/1992",NA,1992-03-19,1992-05-22,1992-07-16,1992-08-10,NA,144,64,55,25,119
"2608","Chasselas","585","585Mtp6","",1993,"18/3/93","28/5/93","19/7/93","13/8/93",NA,1993-03-18,1993-05-28,1993-07-19,1993-08-13,NA,148,71,52,25,123
"2609","Chasselas","585","585Mtp6","",1994,"3/3/1994","22/5/94","11/7/1994","8/8/1994",NA,1994-03-03,1994-05-22,1994-07-11,1994-08-08,NA,158,80,50,28,130
"2610","Chasselas","585","585Mtp6","",1995,"13/3/95","26/5/95","20/7/95","16/8/95",NA,1995-03-13,1995-05-26,1995-07-20,1995-08-16,NA,156,74,55,27,129
"2611","Chasselas","585","585Mtp6","",1996,"18/3/96","30/5/96","17/7/96","16/8/96",NA,1996-03-18,1996-05-30,1996-07-17,1996-08-16,NA,151,73,48,30,121
"2612","Chasselas","585","585Mtp6","",1997,"1/3/1997","15/5/97","7/7/1997","28/7/97",NA,1997-03-01,1997-05-15,1997-07-07,1997-07-28,NA,149,75,53,21,128
"2613","Chasselas","585","585Mtp6","",1998,"15/3/98","22/5/98","17/7/98","10/8/1998",NA,1998-03-15,1998-05-22,1998-07-17,1998-08-10,NA,148,68,56,24,124
"2614","Chasselas","585","585Mtp6","",1999,"17/3/99","24/5/99","15/7/99","10/8/1999",NA,1999-03-17,1999-05-24,1999-07-15,1999-08-10,NA,146,68,52,26,120
"2615","Chasselas","585","585Mtp6","",2000,"15/3/00","29/5/00","24/7/00","17/8/00",NA,2000-03-15,2000-05-29,2000-07-24,2000-08-17,NA,155,75,56,24,131
"2616","Chasselas","585","585Mtp6","",2001,"5/3/2001",NA,"8/7/2001",NA,NA,2001-03-05,NA,2001-07-08,NA,NA,NA,NA,NA,NA,125
"2617","Chasselas","585","585Mtp6","",2002,"15/3/02",NA,"5/7/2002","20/8/02",NA,2002-03-15,NA,2002-07-05,2002-08-20,NA,158,NA,NA,46,112
"2618","Chasselas","585","585Mtp6","",2003,"23/3/03",NA,"18/7/03","11/8/2003",NA,2003-03-23,NA,2003-07-18,2003-08-11,NA,141,NA,NA,24,117
"2619","Chasselas","585","585Mtp6","",2004,"22/3/04",NA,"28/7/04","24/8/04",NA,2004-03-22,NA,2004-07-28,2004-08-24,NA,155,NA,NA,27,128
"2620","Chasselas","585","585Mtp6","",2005,"2/4/2005",NA,"25/7/05","26/8/05",NA,2005-04-02,NA,2005-07-25,2005-08-26,NA,146,NA,NA,32,114
"2621","Chasselas","585","585Mtp6","",2006,"29/3/06",NA,"20/7/06","11/8/2006",NA,2006-03-29,NA,2006-07-20,2006-08-11,NA,135,NA,NA,22,113
"2622","Chasselas","585","585Mtp6","",2007,"10/3/2007",NA,NA,NA,NA,2007-03-10,NA,NA,NA,NA,NA,NA,NA,NA,NA
"2623","Chasselas","585","585Mtp7","",1957,"12/3/1957",NA,NA,"13/8/57",NA,1957-03-12,NA,NA,1957-08-13,NA,154,NA,NA,NA,NA
"2624","Chasselas","585","585Mtp7","",1958,"21/3/58",NA,NA,"11/8/1958",NA,1958-03-21,NA,NA,1958-08-11,NA,143,NA,NA,NA,NA
"2625","Chasselas","585","585Mtp7","",1959,"15/3/59",NA,NA,"10/8/1959",NA,1959-03-15,NA,NA,1959-08-10,NA,148,NA,NA,NA,NA
"2626","Chasselas","585","585Mtp7","",1960,"7/3/1960",NA,NA,"2/8/1960",NA,1960-03-07,NA,NA,1960-08-02,NA,148,NA,NA,NA,NA
"2627","Chasselas","585","585Mtp7","",1961,"6/3/1961",NA,NA,"7/8/1961",NA,1961-03-06,NA,NA,1961-08-07,NA,154,NA,NA,NA,NA
"2628","Chasselas","585","585Mtp7","",1962,"31/3/62",NA,NA,NA,NA,1962-03-31,NA,NA,NA,NA,NA,NA,NA,NA,NA
"2629","Chasselas","585","585Mtp7","",1963,"30/3/63",NA,NA,NA,NA,1963-03-30,NA,NA,NA,NA,NA,NA,NA,NA,NA
"2630","Chasselas","585","585Mtp7","",1964,"29/3/64",NA,NA,NA,NA,1964-03-29,NA,NA,NA,NA,NA,NA,NA,NA,NA
"2631","Chasselas","585","585Mtp7","",1965,"22/3/65",NA,NA,NA,NA,1965-03-22,NA,NA,NA,NA,NA,NA,NA,NA,NA
"2632","Chasselas","585","585Mtp7","",1976,NA,NA,"22/7/76",NA,NA,NA,NA,1976-07-22,NA,NA,NA,NA,NA,NA,NA
"2633","Chasselas","585","585Mtp7","",1977,NA,NA,"18/7/77",NA,NA,NA,NA,1977-07-18,NA,NA,NA,NA,NA,NA,NA
"2634","Chasselas","585","585Mtp7","",1979,"12/3/1979",NA,"23/7/79",NA,NA,1979-03-12,NA,1979-07-23,NA,NA,NA,NA,NA,NA,133
"2635","Chasselas","585","585Mtp7","",1982,"11/3/1982",NA,NA,NA,NA,1982-03-11,NA,NA,NA,NA,NA,NA,NA,NA,NA
"2636","Chasselas","585","585Mtp7","",1985,"30/3/85",NA,NA,NA,NA,1985-03-30,NA,NA,NA,NA,NA,NA,NA,NA,NA
"2637","Chasselas","585","585Mtp7","",1986,"24/3/86",NA,NA,NA,NA,1986-03-24,NA,NA,NA,NA,NA,NA,NA,NA,NA
"2638","Chasselas","585","585Mtp7","",1987,NA,"6/6/1987","25/7/87","17/8/87",NA,NA,1987-06-06,1987-07-25,1987-08-17,NA,NA,NA,49,23,NA
"2639","Chasselas","585","585Mtp7","",1988,"22/3/88","30/5/88","23/7/88","12/8/1988",NA,1988-03-22,1988-05-30,1988-07-23,1988-08-12,NA,143,69,54,20,123
"2640","Chasselas","585","585Mtp7","",1989,"24/3/89","29/5/89","17/7/89","13/8/89",NA,1989-03-24,1989-05-29,1989-07-17,1989-08-13,NA,142,66,49,27,115
"2641","Chasselas","585","585Mtp7","",1990,"8/3/1990","23/5/90","12/7/1990","8/8/1990",NA,1990-03-08,1990-05-23,1990-07-12,1990-08-08,NA,153,76,50,27,126
"2642","Chasselas","585","585Mtp7","",1991,"21/3/91","31/5/91","22/7/91","15/8/91",NA,1991-03-21,1991-05-31,1991-07-22,1991-08-15,NA,147,71,52,24,123
"2643","Chasselas","585","585Mtp7","",1992,"23/3/92","22/5/92","20/7/92","10/8/1992",NA,1992-03-23,1992-05-22,1992-07-20,1992-08-10,NA,140,60,59,21,119
"2644","Chasselas","585","585Mtp7","",1993,"22/3/93","31/5/93","19/7/93","13/8/93",NA,1993-03-22,1993-05-31,1993-07-19,1993-08-13,NA,144,70,49,25,119
"2645","Chasselas","585","585Mtp7","",1994,"7/3/1994","26/5/94","15/7/94","8/8/1994",NA,1994-03-07,1994-05-26,1994-07-15,1994-08-08,NA,154,80,50,24,130
"2646","Chasselas","585","585Mtp7","",1995,"16/3/95","26/5/95","20/7/95","16/8/95",NA,1995-03-16,1995-05-26,1995-07-20,1995-08-16,NA,153,71,55,27,126
"2647","Chasselas","585","585Mtp7","",1996,"11/3/1996","31/5/96","15/7/96","16/8/96",NA,1996-03-11,1996-05-31,1996-07-15,1996-08-16,NA,158,81,45,32,126
"2648","Chasselas","585","585Mtp7","",1997,"2/3/1997","14/5/97","5/7/1997","28/7/97",NA,1997-03-02,1997-05-14,1997-07-05,1997-07-28,NA,148,73,52,23,125
"2649","Chasselas","585","585Mtp7","",1998,"12/3/1998","22/5/98","16/7/98","10/8/1998",NA,1998-03-12,1998-05-22,1998-07-16,1998-08-10,NA,151,71,55,25,126
"2650","Chasselas","585","585Mtp7","",1999,"14/3/99","24/5/99","15/7/99","10/8/1999",NA,1999-03-14,1999-05-24,1999-07-15,1999-08-10,NA,149,71,52,26,123
"2651","Chasselas","585","585Mtp7","",2000,"17/3/00","29/5/00","17/7/00","17/8/00",NA,2000-03-17,2000-05-29,2000-07-17,2000-08-17,NA,153,73,49,31,122
"2652","Chasselas","585","585Mtp8","",1956,"24/3/56",NA,NA,"20/8/56",NA,1956-03-24,NA,NA,1956-08-20,NA,149,NA,NA,NA,NA
"2653","Chasselas","585","585Mtp8","",1957,"12/3/1957",NA,NA,"13/8/57",NA,1957-03-12,NA,NA,1957-08-13,NA,154,NA,NA,NA,NA
"2654","Chasselas","585","585Mtp8","",1958,"23/3/58",NA,NA,"5/8/1958",NA,1958-03-23,NA,NA,1958-08-05,NA,135,NA,NA,NA,NA
"2655","Chasselas","585","585Mtp8","",1959,"17/3/59",NA,NA,"10/8/1959",NA,1959-03-17,NA,NA,1959-08-10,NA,146,NA,NA,NA,NA
"2656","Chasselas","585","585Mtp8","",1960,"13/3/60",NA,NA,"2/8/1960",NA,1960-03-13,NA,NA,1960-08-02,NA,142,NA,NA,NA,NA
"2657","Chasselas","585","585Mtp8","",1961,"7/3/1961",NA,NA,"7/8/1961",NA,1961-03-07,NA,NA,1961-08-07,NA,153,NA,NA,NA,NA
"2658","Chasselas","585","585Mtp8","",1962,"2/4/1962",NA,NA,NA,NA,1962-04-02,NA,NA,NA,NA,NA,NA,NA,NA,NA
"2659","Chasselas","585","585Mtp8","",1963,"31/3/63",NA,NA,NA,NA,1963-03-31,NA,NA,NA,NA,NA,NA,NA,NA,NA
"2660","Chasselas","585","585Mtp8","",1964,"30/3/64",NA,NA,NA,NA,1964-03-30,NA,NA,NA,NA,NA,NA,NA,NA,NA
"2661","Chasselas","585","585Mtp8","",1965,"22/3/65",NA,NA,NA,NA,1965-03-22,NA,NA,NA,NA,NA,NA,NA,NA,NA
"2662","Chasselas","585","585Mtp8","",1977,NA,NA,"18/7/77",NA,NA,NA,NA,1977-07-18,NA,NA,NA,NA,NA,NA,NA
"2663","Chasselas","585","585Mtp8","",1979,"12/3/1979",NA,NA,NA,NA,1979-03-12,NA,NA,NA,NA,NA,NA,NA,NA,NA
"2664","Chasselas","585","585Mtp8","",1988,"17/3/88","1/6/1988","25/7/88","12/8/1988",NA,1988-03-17,1988-06-01,1988-07-25,1988-08-12,NA,148,76,54,18,130
"2665","Chasselas","585","585Mtp8","",1989,"13/3/89","1/6/1989","17/7/89","8/8/1989",NA,1989-03-13,1989-06-01,1989-07-17,1989-08-08,NA,148,80,46,22,126
"2666","Chasselas","585","585Mtp8","",1994,NA,NA,NA,"8/8/1994",NA,NA,NA,NA,1994-08-08,NA,NA,NA,NA,NA,NA
"2667","Chasselas","585","585Mtp8","",2002,"18/3/02","23/5/02","12/7/2002","20/8/02",NA,2002-03-18,2002-05-23,2002-07-12,2002-08-20,NA,155,66,50,39,116
"2668","Chasselas","585","585Mtp8","",2003,"24/3/03","25/5/03","18/7/03","11/8/2003",NA,2003-03-24,2003-05-25,2003-07-18,2003-08-11,NA,140,62,54,24,116
"2669","Chasselas","585","585Mtp8","",2004,"22/3/04","4/6/2004","28/7/04","24/8/04",NA,2004-03-22,2004-06-04,2004-07-28,2004-08-24,NA,155,74,54,27,128
"2670","Chasselas","585","585Mtp8","",2005,"5/4/2005","30/5/05","25/7/05","26/8/05",NA,2005-04-05,2005-05-30,2005-07-25,2005-08-26,NA,143,55,56,32,111
"2671","Chasselas","585","585Mtp8","",2006,"30/3/06","27/5/06","20/7/06","11/8/2006",NA,2006-03-30,2006-05-27,2006-07-20,2006-08-11,NA,134,58,54,22,112
"2672","Chasselas","585","585Mtp8","",2007,"11/3/2007","18/5/07","12/7/2007","13/8/07",NA,2007-03-11,2007-05-18,2007-07-12,2007-08-13,NA,155,68,55,32,123
"2673","Chasselas","585","585Mtp8","",2008,"13/3/08","25/5/08","24/7/08","13/8/08",NA,2008-03-13,2008-05-25,2008-07-24,2008-08-13,NA,153,73,60,20,133
"2674","Chasselas","585","585Mtp8","",2009,"18/3/09",NA,NA,NA,NA,2009-03-18,NA,NA,NA,NA,NA,NA,NA,NA,NA
"2675","Chasselas","585","585Mtp8","",2010,"30/3/10","31/5/10","19/7/10","27/8/10",NA,2010-03-30,2010-05-31,2010-07-19,2010-08-27,NA,150,62,49,39,111
"2676","Chasselas","585","585Mtp8","",2011,"19/3/11","15/5/11","9/7/2011","17/8/11",NA,2011-03-19,2011-05-15,2011-07-09,2011-08-17,NA,151,57,55,39,112
"2677","Chasselas","585","585Mtp8","",2012,"28/3/12","29/5/12","26/7/12","16/8/12",NA,2012-03-28,2012-05-29,2012-07-26,2012-08-16,NA,141,62,58,21,120
"2678","Chasselas","585","585Mtp8","",2013,"25/3/13","6/6/2013","26/7/13",NA,NA,2013-03-25,2013-06-06,2013-07-26,NA,NA,NA,73,50,NA,123
"2679","Chasselas","585","585Mtp9","",1956,"26/3/56",NA,NA,"27/8/56",NA,1956-03-26,NA,NA,1956-08-27,NA,154,NA,NA,NA,NA
"2680","Chasselas","585","585Mtp9","",1957,"17/3/57",NA,NA,"13/8/57",NA,1957-03-17,NA,NA,1957-08-13,NA,149,NA,NA,NA,NA
"2681","Chasselas","585","585Mtp9","",1958,"29/3/58",NA,NA,"27/8/58",NA,1958-03-29,NA,NA,1958-08-27,NA,151,NA,NA,NA,NA
"2682","Chasselas","585","585Mtp9","",1959,"19/3/59",NA,NA,"18/8/59",NA,1959-03-19,NA,NA,1959-08-18,NA,152,NA,NA,NA,NA
"2683","Chasselas","585","585Mtp9","",1960,"14/3/60",NA,NA,"9/8/1960",NA,1960-03-14,NA,NA,1960-08-09,NA,148,NA,NA,NA,NA
"2684","Chasselas","585","585Mtp9","",1968,"18/3/68",NA,NA,NA,NA,1968-03-18,NA,NA,NA,NA,NA,NA,NA,NA,NA
"2685","Chasselas","585","585Mtp9","",1969,"24/3/69",NA,NA,NA,NA,1969-03-24,NA,NA,NA,NA,NA,NA,NA,NA,NA
"2686","Chasselas","585","585Mtp9","",1970,"25/3/70",NA,NA,NA,NA,1970-03-25,NA,NA,NA,NA,NA,NA,NA,NA,NA
"2687","Chasselas","585","585Mtp9","",1971,"28/3/71",NA,NA,NA,NA,1971-03-28,NA,NA,NA,NA,NA,NA,NA,NA,NA
"2688","Chasselas","585","585Mtp9","",1977,NA,NA,"18/7/77",NA,NA,NA,NA,1977-07-18,NA,NA,NA,NA,NA,NA,NA
"2689","Chasselas","585","585Mtp9","",1979,"12/3/1979",NA,NA,NA,NA,1979-03-12,NA,NA,NA,NA,NA,NA,NA,NA,NA
"2690","Chasselas","585","585Mtp9","",1982,"8/3/1982",NA,NA,NA,NA,1982-03-08,NA,NA,NA,NA,NA,NA,NA,NA,NA
"2691","Chasselas","585","585Mtp9","",1987,NA,"5/6/1987","27/7/87","17/8/87",NA,NA,1987-06-05,1987-07-27,1987-08-17,NA,NA,NA,52,21,NA
"2692","Chasselas","585","585Mtp10","",1956,"24/3/56",NA,NA,"3/9/1956",NA,1956-03-24,NA,NA,1956-09-03,NA,163,NA,NA,NA,NA
"2693","Chasselas","585","585Mtp10","",1957,"11/3/1957",NA,NA,"19/8/57",NA,1957-03-11,NA,NA,1957-08-19,NA,161,NA,NA,NA,NA
"2694","Chasselas","585","585Mtp10","",1958,"21/3/58",NA,NA,"5/8/1958",NA,1958-03-21,NA,NA,1958-08-05,NA,137,NA,NA,NA,NA
"2695","Chasselas","585","585Mtp10","",1959,"16/3/59",NA,NA,"4/8/1959",NA,1959-03-16,NA,NA,1959-08-04,NA,141,NA,NA,NA,NA
"2696","Chasselas","585","585Mtp10","",1960,"10/3/1960",NA,NA,"1/8/1960",NA,1960-03-10,NA,NA,1960-08-01,NA,144,NA,NA,NA,NA
"2697","Chasselas","585","585Mtp11","",1956,NA,NA,NA,"20/8/56",NA,NA,NA,NA,1956-08-20,NA,NA,NA,NA,NA,NA
"2698","Chasselas","585","585Mtp11","",1957,"11/3/1957",NA,NA,"13/8/57",NA,1957-03-11,NA,NA,1957-08-13,NA,155,NA,NA,NA,NA
"2699","Chasselas","585","585Mtp11","",1958,"21/3/58",NA,NA,"11/8/1958",NA,1958-03-21,NA,NA,1958-08-11,NA,143,NA,NA,NA,NA
"2700","Chasselas","585","585Mtp11","",1959,"17/3/59",NA,NA,"18/8/59",NA,1959-03-17,NA,NA,1959-08-18,NA,154,NA,NA,NA,NA
"2701","Chasselas","585","585Mtp11","",1960,"15/3/60",NA,NA,"2/8/1960",NA,1960-03-15,NA,NA,1960-08-02,NA,140,NA,NA,NA,NA
"2702","Chasselas","585","585Mtp11","",1961,"7/3/1961",NA,NA,"14/8/61",NA,1961-03-07,NA,NA,1961-08-14,NA,160,NA,NA,NA,NA
"2703","Chasselas","585","585Mtp11","",1979,"7/3/1979",NA,NA,NA,NA,1979-03-07,NA,NA,NA,NA,NA,NA,NA,NA,NA
"2704","Chasselas","585","585Mtp11","",1989,"24/3/89","31/5/89",NA,"16/8/89",NA,1989-03-24,1989-05-31,NA,1989-08-16,NA,145,68,NA,NA,NA
"2705","Chasselas","585","585Mtp11","",1990,NA,"24/5/90","16/7/90","9/8/1990",NA,NA,1990-05-24,1990-07-16,1990-08-09,NA,NA,NA,53,24,NA
"2706","Chasselas","585","585Mtp12","",1956,NA,NA,NA,"20/8/56",NA,NA,NA,NA,1956-08-20,NA,NA,NA,NA,NA,NA
"2707","Chasselas","585","585Mtp12","",1957,"9/3/1957",NA,NA,"5/8/1957",NA,1957-03-09,NA,NA,1957-08-05,NA,149,NA,NA,NA,NA
"2708","Chasselas","585","585Mtp12","",1958,"21/3/58",NA,NA,"11/8/1958",NA,1958-03-21,NA,NA,1958-08-11,NA,143,NA,NA,NA,NA
"2709","Chasselas","585","585Mtp12","",1959,"17/3/59",NA,NA,"10/8/1959",NA,1959-03-17,NA,NA,1959-08-10,NA,146,NA,NA,NA,NA
"2710","Chasselas","585","585Mtp12","",1960,"14/3/60",NA,NA,"2/8/1960",NA,1960-03-14,NA,NA,1960-08-02,NA,141,NA,NA,NA,NA
"2711","Chasselas","585","585Mtp12","",1961,"8/3/1961",NA,NA,"7/8/1961",NA,1961-03-08,NA,NA,1961-08-07,NA,152,NA,NA,NA,NA
"2712","Chasselas","585","585Mtp13","",1956,NA,NA,NA,"20/8/56",NA,NA,NA,NA,1956-08-20,NA,NA,NA,NA,NA,NA
"2713","Chasselas","585","585Mtp13","",1957,"7/3/1957",NA,NA,"5/8/1957",NA,1957-03-07,NA,NA,1957-08-05,NA,151,NA,NA,NA,NA
"2714","Chasselas","585","585Mtp13","",1958,NA,NA,NA,"5/8/1958",NA,NA,NA,NA,1958-08-05,NA,NA,NA,NA,NA,NA
"2715","Chasselas","585","585Mtp13","",1959,"11/3/1959",NA,NA,"10/8/1959",NA,1959-03-11,NA,NA,1959-08-10,NA,152,NA,NA,NA,NA
"2716","Chasselas","585","585Mtp13","",1960,"8/3/1960",NA,NA,"2/8/1960",NA,1960-03-08,NA,NA,1960-08-02,NA,147,NA,NA,NA,NA
"2717","Chasselas","585","585Mtp13","",1961,"27/2/61",NA,NA,"7/8/1961",NA,1961-02-27,NA,NA,1961-08-07,NA,161,NA,NA,NA,NA
"2718","Chasselas","585","585Mtp13","",1989,"20/3/89","31/5/89",NA,"16/8/89",NA,1989-03-20,1989-05-31,NA,1989-08-16,NA,149,72,NA,NA,NA
"2719","Chasselas","585","585Mtp13","",1990,"8/3/1990","22/5/90","13/7/90","8/8/1990",NA,1990-03-08,1990-05-22,1990-07-13,1990-08-08,NA,153,75,52,26,127
"2720","Chasselas","585","585Mtp13","",1991,"18/3/91","30/5/91","26/7/91","15/8/91",NA,1991-03-18,1991-05-30,1991-07-26,1991-08-15,NA,150,73,57,20,130
"2721","Chasselas","585","585Mtp13","",1992,"19/3/92","22/5/92","17/7/92","10/8/1992",NA,1992-03-19,1992-05-22,1992-07-17,1992-08-10,NA,144,64,56,24,120
"2722","Chasselas","585","585Mtp13","",1993,"16/3/93",NA,NA,NA,NA,1993-03-16,NA,NA,NA,NA,NA,NA,NA,NA,NA
"2723","Chasselas","585","585Mtp13","",1994,"3/3/1994","22/5/94","15/7/94","8/8/1994",NA,1994-03-03,1994-05-22,1994-07-15,1994-08-08,NA,158,80,54,24,134
"2724","Chasselas","585","585Mtp13","",2010,"31/3/10","3/6/2010","26/7/10","27/8/10",NA,2010-03-31,2010-06-03,2010-07-26,2010-08-27,NA,149,64,53,32,117
"2725","Chasselas","585","585Mtp13","",2011,"20/3/11","16/5/11","18/7/11","18/8/11",NA,2011-03-20,2011-05-16,2011-07-18,2011-08-18,NA,151,57,63,31,120
"2726","Chasselas","585","585Mtp13","",2012,"29/3/12","30/5/12","26/7/12","20/8/12",NA,2012-03-29,2012-05-30,2012-07-26,2012-08-20,NA,144,62,57,25,119
"2727","Chasselas","585","585Mtp14","",1956,NA,NA,NA,"20/8/56",NA,NA,NA,NA,1956-08-20,NA,NA,NA,NA,NA,NA
"2728","Chasselas","585","585Mtp14","",1957,"9/3/1957",NA,NA,"5/8/1957",NA,1957-03-09,NA,NA,1957-08-05,NA,149,NA,NA,NA,NA
"2729","Chasselas","585","585Mtp14","",1958,"21/3/58",NA,NA,"5/8/1958",NA,1958-03-21,NA,NA,1958-08-05,NA,137,NA,NA,NA,NA
"2730","Chasselas","585","585Mtp14","",1959,"15/3/59",NA,NA,"27/7/59",NA,1959-03-15,NA,NA,1959-07-27,NA,134,NA,NA,NA,NA
"2731","Chasselas","585","585Mtp14","",1960,"8/3/1960",NA,NA,"2/8/1960",NA,1960-03-08,NA,NA,1960-08-02,NA,147,NA,NA,NA,NA
"2732","Chasselas","585","585Mtp14","",1961,"6/3/1961",NA,NA,"7/8/1961",NA,1961-03-06,NA,NA,1961-08-07,NA,154,NA,NA,NA,NA
"2733","Chasselas","585","585Mtp15","",1957,"9/3/1957",NA,NA,"13/8/57",NA,1957-03-09,NA,NA,1957-08-13,NA,157,NA,NA,NA,NA
"2734","Chasselas","585","585Mtp15","",1958,NA,NA,NA,"21/8/58",NA,NA,NA,NA,1958-08-21,NA,NA,NA,NA,NA,NA
"2735","Chasselas","585","585Mtp15","",1959,"17/3/59",NA,NA,"3/8/1959",NA,1959-03-17,NA,NA,1959-08-03,NA,139,NA,NA,NA,NA
"2736","Chasselas","585","585Mtp15","",1960,"8/3/1960",NA,NA,"2/8/1960",NA,1960-03-08,NA,NA,1960-08-02,NA,147,NA,NA,NA,NA
"2737","Chasselas","585","585Mtp15","",1961,"3/3/1961",NA,NA,"7/8/1961",NA,1961-03-03,NA,NA,1961-08-07,NA,157,NA,NA,NA,NA
"2738","Chasselas","585","585Mtp18","",1956,NA,NA,NA,"13/8/56",NA,NA,NA,NA,1956-08-13,NA,NA,NA,NA,NA,NA
"2739","Chasselas","585","585Mtp18","",1957,"7/3/1957",NA,NA,"5/8/1957",NA,1957-03-07,NA,NA,1957-08-05,NA,151,NA,NA,NA,NA
"2740","Chasselas","585","585Mtp18","",1958,"21/3/58",NA,NA,"5/8/1958",NA,1958-03-21,NA,NA,1958-08-05,NA,137,NA,NA,NA,NA
"2741","Chasselas","585","585Mtp18","",1959,"15/3/59",NA,NA,"18/8/59",NA,1959-03-15,NA,NA,1959-08-18,NA,156,NA,NA,NA,NA
"2742","Chasselas","585","585Mtp18","",1960,"6/3/1960",NA,NA,"2/8/1960",NA,1960-03-06,NA,NA,1960-08-02,NA,149,NA,NA,NA,NA
"2743","Chasselas","585","585Mtp18","",1961,"3/3/1961",NA,NA,"7/8/1961",NA,1961-03-03,NA,NA,1961-08-07,NA,157,NA,NA,NA,NA
"2744","Chasselas","585","585Mtp19","",1956,NA,NA,NA,"13/8/56",NA,NA,NA,NA,1956-08-13,NA,NA,NA,NA,NA,NA
"2745","Chasselas","585","585Mtp19","",1957,"9/3/1957",NA,NA,"5/8/1957",NA,1957-03-09,NA,NA,1957-08-05,NA,149,NA,NA,NA,NA
"2746","Chasselas","585","585Mtp19","",1958,"21/3/58",NA,NA,"5/8/1958",NA,1958-03-21,NA,NA,1958-08-05,NA,137,NA,NA,NA,NA
"2747","Chasselas","585","585Mtp19","",1959,"17/3/59",NA,NA,"10/8/1959",NA,1959-03-17,NA,NA,1959-08-10,NA,146,NA,NA,NA,NA
"2748","Chasselas","585","585Mtp19","",1960,"8/3/1960",NA,NA,"26/7/60",NA,1960-03-08,NA,NA,1960-07-26,NA,140,NA,NA,NA,NA
"2749","Chasselas","585","585Mtp19","",1961,"6/3/1961",NA,NA,"7/8/1961",NA,1961-03-06,NA,NA,1961-08-07,NA,154,NA,NA,NA,NA
"2750","Chasselas","585","585Mtp20","",1956,NA,NA,NA,"20/8/56",NA,NA,NA,NA,1956-08-20,NA,NA,NA,NA,NA,NA
"2751","Chasselas","585","585Mtp20","",1957,"9/3/1957",NA,NA,"13/8/57",NA,1957-03-09,NA,NA,1957-08-13,NA,157,NA,NA,NA,NA
"2752","Chasselas","585","585Mtp20","",1958,"26/3/58",NA,NA,"21/8/58",NA,1958-03-26,NA,NA,1958-08-21,NA,148,NA,NA,NA,NA
"2753","Chasselas","585","585Mtp20","",1959,"17/3/59",NA,NA,"10/8/1959",NA,1959-03-17,NA,NA,1959-08-10,NA,146,NA,NA,NA,NA
"2754","Chasselas","585","585Mtp20","",1960,"7/3/1960",NA,NA,"9/8/1960",NA,1960-03-07,NA,NA,1960-08-09,NA,155,NA,NA,NA,NA
"2755","Chasselas","585","585Mtp20","",1961,"6/3/1961",NA,NA,"7/8/1961",NA,1961-03-06,NA,NA,1961-08-07,NA,154,NA,NA,NA,NA
"2756","Chasselas","585","585Mtp21","",1956,NA,NA,NA,"8/8/1956",NA,NA,NA,NA,1956-08-08,NA,NA,NA,NA,NA,NA
"2757","Chasselas","585","585Mtp21","",1957,"9/3/1957",NA,NA,"5/8/1957",NA,1957-03-09,NA,NA,1957-08-05,NA,149,NA,NA,NA,NA
"2758","Chasselas","585","585Mtp21","",1958,"28/3/58",NA,NA,"18/8/58",NA,1958-03-28,NA,NA,1958-08-18,NA,143,NA,NA,NA,NA
"2759","Chasselas","585","585Mtp21","",1959,"13/3/59",NA,NA,"3/8/1959",NA,1959-03-13,NA,NA,1959-08-03,NA,143,NA,NA,NA,NA
"2760","Chasselas","585","585Mtp21","",1960,"8/3/1960",NA,NA,"2/8/1960",NA,1960-03-08,NA,NA,1960-08-02,NA,147,NA,NA,NA,NA
"2761","Chasselas","585","585Mtp21","",1961,"6/3/1961",NA,NA,"7/8/1961",NA,1961-03-06,NA,NA,1961-08-07,NA,154,NA,NA,NA,NA
"2762","Chasselas","585","585Mtp22","",1956,NA,NA,NA,"13/8/56",NA,NA,NA,NA,1956-08-13,NA,NA,NA,NA,NA,NA
"2763","Chasselas","585","585Mtp22","",1957,"7/3/1957",NA,NA,"5/8/1957",NA,1957-03-07,NA,NA,1957-08-05,NA,151,NA,NA,NA,NA
"2764","Chasselas","585","585Mtp22","",1958,"23/3/58",NA,NA,"18/8/58",NA,1958-03-23,NA,NA,1958-08-18,NA,148,NA,NA,NA,NA
"2765","Chasselas","585","585Mtp22","",1959,"13/3/59",NA,NA,"10/8/1959",NA,1959-03-13,NA,NA,1959-08-10,NA,150,NA,NA,NA,NA
"2766","Chasselas","585","585Mtp22","",1960,"8/3/1960",NA,NA,"2/8/1960",NA,1960-03-08,NA,NA,1960-08-02,NA,147,NA,NA,NA,NA
"2767","Chasselas","585","585Mtp22","",1961,"3/3/1961",NA,NA,"7/8/1961",NA,1961-03-03,NA,NA,1961-08-07,NA,157,NA,NA,NA,NA
"2768","Chasselas","585","585Mtp22","",1976,NA,NA,"16/7/76",NA,NA,NA,NA,1976-07-16,NA,NA,NA,NA,NA,NA,NA
"2769","Chasselas","585","585Mtp22","",1977,NA,NA,"29/7/77",NA,NA,NA,NA,1977-07-29,NA,NA,NA,NA,NA,NA,NA
"2770","Chasselas","585","585Mtp22","",1978,NA,NA,"1/8/1978",NA,NA,NA,NA,1978-08-01,NA,NA,NA,NA,NA,NA,NA
"2771","Chasselas","585","585Mtp22","",1990,NA,"20/5/90","9/7/1990",NA,NA,NA,1990-05-20,1990-07-09,NA,NA,NA,NA,50,NA,NA
"2772","Chasselas","585","585Mtp22","",1991,NA,"30/5/91","26/7/91",NA,NA,NA,1991-05-30,1991-07-26,NA,NA,NA,NA,57,NA,NA
"2773","Chasselas","585","585Mtp22","",1992,"19/3/92","22/5/92","17/7/92","10/8/1992",NA,1992-03-19,1992-05-22,1992-07-17,1992-08-10,NA,144,64,56,24,120
"2774","Chasselas","585","585Mtp22","",1994,"7/3/1994","22/5/94","15/7/94","8/8/1994",NA,1994-03-07,1994-05-22,1994-07-15,1994-08-08,NA,154,76,54,24,130
"2775","Chasselas","585","585Mtp22","",1995,"20/3/95",NA,NA,"16/8/95",NA,1995-03-20,NA,NA,1995-08-16,NA,149,NA,NA,NA,NA
"2776","Chasselas","585","585Mtp23","",1956,NA,NA,NA,"13/8/56",NA,NA,NA,NA,1956-08-13,NA,NA,NA,NA,NA,NA
"2777","Chasselas","585","585Mtp23","",1957,"9/3/1957",NA,NA,"5/8/1957",NA,1957-03-09,NA,NA,1957-08-05,NA,149,NA,NA,NA,NA
"2778","Chasselas","585","585Mtp23","",1958,"22/3/58",NA,NA,"11/8/1958",NA,1958-03-22,NA,NA,1958-08-11,NA,142,NA,NA,NA,NA
"2779","Chasselas","585","585Mtp23","",1959,"13/3/59",NA,NA,"3/8/1959",NA,1959-03-13,NA,NA,1959-08-03,NA,143,NA,NA,NA,NA
"2780","Chasselas","585","585Mtp23","",1960,"8/3/1960",NA,NA,"2/8/1960",NA,1960-03-08,NA,NA,1960-08-02,NA,147,NA,NA,NA,NA
"2781","Chasselas","585","585Mtp23","",1961,"3/3/1961",NA,NA,"7/8/1961",NA,1961-03-03,NA,NA,1961-08-07,NA,157,NA,NA,NA,NA
"2782","Chasselas","585","585Mtp24","",1956,NA,NA,NA,"20/8/56",NA,NA,NA,NA,1956-08-20,NA,NA,NA,NA,NA,NA
"2783","Chasselas","585","585Mtp24","",1957,"9/3/1957",NA,NA,"5/8/1957",NA,1957-03-09,NA,NA,1957-08-05,NA,149,NA,NA,NA,NA
"2784","Chasselas","585","585Mtp24","",1958,"21/3/58",NA,NA,"11/8/1958",NA,1958-03-21,NA,NA,1958-08-11,NA,143,NA,NA,NA,NA
"2785","Chasselas","585","585Mtp24","",1959,"15/3/59",NA,NA,"10/8/1959",NA,1959-03-15,NA,NA,1959-08-10,NA,148,NA,NA,NA,NA
"2786","Chasselas","585","585Mtp24","",1960,"10/3/1960",NA,NA,"2/8/1960",NA,1960-03-10,NA,NA,1960-08-02,NA,145,NA,NA,NA,NA
"2787","Chasselas","585","585Mtp24","",1961,"2/3/1961",NA,NA,"7/8/1961",NA,1961-03-02,NA,NA,1961-08-07,NA,158,NA,NA,NA,NA
"2788","Chasselas","585","585Mtp25","",1956,"26/3/56",NA,NA,"8/8/1956",NA,1956-03-26,NA,NA,1956-08-08,NA,135,NA,NA,NA,NA
"2789","Chasselas","585","585Mtp25","",1957,"11/3/1957",NA,NA,"13/8/57",NA,1957-03-11,NA,NA,1957-08-13,NA,155,NA,NA,NA,NA
"2790","Chasselas","585","585Mtp25","",1958,"26/3/58",NA,NA,"18/8/58",NA,1958-03-26,NA,NA,1958-08-18,NA,145,NA,NA,NA,NA
"2791","Chasselas","585","585Mtp25","",1959,"20/3/59",NA,NA,"10/8/1959",NA,1959-03-20,NA,NA,1959-08-10,NA,143,NA,NA,NA,NA
"2792","Chasselas","585","585Mtp25","",1960,"14/3/60",NA,NA,"26/7/60",NA,1960-03-14,NA,NA,1960-07-26,NA,134,NA,NA,NA,NA
"2793","Chasselas","585","585Mtp26","",1956,"27/3/56",NA,NA,"8/8/1956",NA,1956-03-27,NA,NA,1956-08-08,NA,134,NA,NA,NA,NA
"2794","Chasselas","585","585Mtp26","",1957,"8/3/1957",NA,NA,"13/8/57",NA,1957-03-08,NA,NA,1957-08-13,NA,158,NA,NA,NA,NA
"2795","Chasselas","585","585Mtp26","",1958,"23/3/58",NA,NA,"18/8/58",NA,1958-03-23,NA,NA,1958-08-18,NA,148,NA,NA,NA,NA
"2796","Chasselas","585","585Mtp26","",1959,"13/3/59",NA,NA,"10/8/1959",NA,1959-03-13,NA,NA,1959-08-10,NA,150,NA,NA,NA,NA
"2797","Chasselas","585","585Mtp26","",1960,"14/3/60",NA,NA,"26/7/60",NA,1960-03-14,NA,NA,1960-07-26,NA,134,NA,NA,NA,NA
"2798","Chasselas","585","585Mtp27","",1956,"27/3/56",NA,NA,"22/8/56",NA,1956-03-27,NA,NA,1956-08-22,NA,148,NA,NA,NA,NA
"2799","Chasselas","585","585Mtp27","",1957,"12/3/1957",NA,NA,"19/8/57",NA,1957-03-12,NA,NA,1957-08-19,NA,160,NA,NA,NA,NA
"2800","Chasselas","585","585Mtp27","",1958,"24/3/58",NA,NA,"6/8/1958",NA,1958-03-24,NA,NA,1958-08-06,NA,135,NA,NA,NA,NA
"2801","Chasselas","585","585Mtp27","",1959,"20/3/59",NA,NA,"12/8/1959",NA,1959-03-20,NA,NA,1959-08-12,NA,145,NA,NA,NA,NA
"2802","Chasselas","585","585Mtp27","",1960,"10/3/1960",NA,NA,"1/8/1960",NA,1960-03-10,NA,NA,1960-08-01,NA,144,NA,NA,NA,NA
"2803","Chasselas","585","585Mtp27","",1961,"1/3/1961",NA,NA,"7/8/1961",NA,1961-03-01,NA,NA,1961-08-07,NA,159,NA,NA,NA,NA
"2804","Chasselas","585","585Mtp28","",1957,"9/3/1957",NA,NA,"12/8/1957",NA,1957-03-09,NA,NA,1957-08-12,NA,156,NA,NA,NA,NA
"2805","Chasselas","585","585Mtp28","",1958,"21/3/58",NA,NA,"5/8/1958",NA,1958-03-21,NA,NA,1958-08-05,NA,137,NA,NA,NA,NA
"2806","Chasselas","585","585Mtp28","",1959,"15/3/59",NA,NA,"10/8/1959",NA,1959-03-15,NA,NA,1959-08-10,NA,148,NA,NA,NA,NA
"2807","Chasselas","585","585Mtp28","",1960,"8/3/1960",NA,NA,"9/8/1960",NA,1960-03-08,NA,NA,1960-08-09,NA,154,NA,NA,NA,NA
"2808","Chasselas","585","585Mtp28","",1961,"3/3/1961",NA,NA,"21/8/61",NA,1961-03-03,NA,NA,1961-08-21,NA,171,NA,NA,NA,NA
"2809","Chasselas","585","585Mtp28","",1967,"8/3/1967",NA,NA,NA,NA,1967-03-08,NA,NA,NA,NA,NA,NA,NA,NA,NA
"2810","Chasselas","585","585Mtp28","",1968,"20/3/68",NA,NA,NA,NA,1968-03-20,NA,NA,NA,NA,NA,NA,NA,NA,NA
"2811","Chasselas","585","585Mtp28","",1969,"22/3/69",NA,NA,NA,NA,1969-03-22,NA,NA,NA,NA,NA,NA,NA,NA,NA
"2812","Chasselas","585","585Mtp28","",1979,"12/3/1979",NA,NA,NA,NA,1979-03-12,NA,NA,NA,NA,NA,NA,NA,NA,NA
"2813","Chasselas","585","585Mtp28","",1982,"8/3/1982",NA,NA,NA,NA,1982-03-08,NA,NA,NA,NA,NA,NA,NA,NA,NA
"2814","Chasselas","585","585Mtp28","",1987,NA,"5/6/1987","30/7/87","17/8/87",NA,NA,1987-06-05,1987-07-30,1987-08-17,NA,NA,NA,55,18,NA
"2815","Chasselas","585","585Mtp28","",1990,NA,"22/5/90","16/7/90","9/8/1990",NA,NA,1990-05-22,1990-07-16,1990-08-09,NA,NA,NA,55,24,NA
"2816","Chasselas","585","585Mtp28","",1995,NA,"26/5/95",NA,NA,NA,NA,1995-05-26,NA,NA,NA,NA,NA,NA,NA,NA
"2817","Chasselas","585","585Mtp28","",1996,NA,"28/5/96",NA,NA,NA,NA,1996-05-28,NA,NA,NA,NA,NA,NA,NA,NA
"2818","Chasselas","585","585Mtp29","",1956,NA,NA,NA,"27/8/56",NA,NA,NA,NA,1956-08-27,NA,NA,NA,NA,NA,NA
"2819","Chasselas","585","585Mtp29","",1957,"15/3/57",NA,NA,"12/8/1957",NA,1957-03-15,NA,NA,1957-08-12,NA,150,NA,NA,NA,NA
"2820","Chasselas","585","585Mtp29","",1958,"21/3/58",NA,NA,"3/9/1958",NA,1958-03-21,NA,NA,1958-09-03,NA,166,NA,NA,NA,NA
"2821","Chasselas","585","585Mtp29","",1959,"15/3/59",NA,NA,"10/8/1959",NA,1959-03-15,NA,NA,1959-08-10,NA,148,NA,NA,NA,NA
"2822","Chasselas","585","585Mtp29","",1960,"14/3/60",NA,NA,"9/8/1960",NA,1960-03-14,NA,NA,1960-08-09,NA,148,NA,NA,NA,NA
"2823","Chasselas","585","585Mtp29","",1961,"8/3/1961",NA,NA,"21/8/61",NA,1961-03-08,NA,NA,1961-08-21,NA,166,NA,NA,NA,NA
"2824","Chasselas","585","585Mtp30","",1956,NA,NA,NA,"27/8/56",NA,NA,NA,NA,1956-08-27,NA,NA,NA,NA,NA,NA
"2825","Chasselas","585","585Mtp30","",1957,NA,NA,NA,"12/8/1957",NA,NA,NA,NA,1957-08-12,NA,NA,NA,NA,NA,NA
"2826","Chasselas","585","585Mtp30","",1958,"21/3/58",NA,NA,"27/8/58",NA,1958-03-21,NA,NA,1958-08-27,NA,159,NA,NA,NA,NA
"2827","Chasselas","585","585Mtp30","",1960,"12/3/1960",NA,NA,NA,NA,1960-03-12,NA,NA,NA,NA,NA,NA,NA,NA,NA
"2828","Chasselas","585","585Mtp30","",1961,"8/3/1961",NA,NA,"21/8/61",NA,1961-03-08,NA,NA,1961-08-21,NA,166,NA,NA,NA,NA
"2829","Chasselas","585","585Mtp33","",1958,"17/3/58",NA,NA,NA,NA,1958-03-17,NA,NA,NA,NA,NA,NA,NA,NA,NA
"2830","Chasselas","585","585Mtp33","",1959,"9/3/1959",NA,NA,"3/8/1959",NA,1959-03-09,NA,NA,1959-08-03,NA,147,NA,NA,NA,NA
"2831","Chasselas","585","585Mtp33","",1960,"11/3/1960",NA,NA,"8/8/1960",NA,1960-03-11,NA,NA,1960-08-08,NA,150,NA,NA,NA,NA
"2832","Chasselas","585","585Mtp33","",1961,"13/3/61",NA,NA,"21/8/61",NA,1961-03-13,NA,NA,1961-08-21,NA,161,NA,NA,NA,NA
"2833","Chasselas","585","585Mtp34","",1958,"24/3/58",NA,NA,NA,NA,1958-03-24,NA,NA,NA,NA,NA,NA,NA,NA,NA
"2834","Chasselas","585","585Mtp34","",1959,"16/3/59",NA,NA,"3/8/1959",NA,1959-03-16,NA,NA,1959-08-03,NA,140,NA,NA,NA,NA
"2835","Chasselas","585","585Mtp34","",1960,"11/3/1960",NA,NA,"8/8/1960",NA,1960-03-11,NA,NA,1960-08-08,NA,150,NA,NA,NA,NA
"2836","Chasselas","585","585Mtp34","",1961,"14/3/61",NA,NA,NA,NA,1961-03-14,NA,NA,NA,NA,NA,NA,NA,NA,NA
"2837","Chasselas","585","585Mtp35","",1958,"24/3/58",NA,NA,NA,NA,1958-03-24,NA,NA,NA,NA,NA,NA,NA,NA,NA
"2838","Chasselas","585","585Mtp35","",1959,"12/3/1959",NA,NA,"17/8/59",NA,1959-03-12,NA,NA,1959-08-17,NA,158,NA,NA,NA,NA
"2839","Chasselas","585","585Mtp35","",1960,"7/3/1960",NA,NA,"8/8/1960",NA,1960-03-07,NA,NA,1960-08-08,NA,154,NA,NA,NA,NA
"2840","Chasselas","585","585Mtp35","",1961,"6/3/1961",NA,NA,NA,NA,1961-03-06,NA,NA,NA,NA,NA,NA,NA,NA,NA
"2841","Chasselas","585","585Mtp36","",1958,"20/3/58",NA,NA,"13/8/58",NA,1958-03-20,NA,NA,1958-08-13,NA,146,NA,NA,NA,NA
"2842","Chasselas","585","585Mtp36","",1959,"9/3/1959",NA,NA,"28/7/59",NA,1959-03-09,NA,NA,1959-07-28,NA,141,NA,NA,NA,NA
"2843","Chasselas","585","585Mtp36","",1960,"11/3/1960",NA,NA,"8/8/1960",NA,1960-03-11,NA,NA,1960-08-08,NA,150,NA,NA,NA,NA
"2844","Chasselas","585","585Mtp36","",1961,"11/3/1961",NA,NA,"14/8/61",NA,1961-03-11,NA,NA,1961-08-14,NA,156,NA,NA,NA,NA
"2845","Chasselas","585","585Mtp37","",1958,"27/3/58",NA,NA,"19/8/58",NA,1958-03-27,NA,NA,1958-08-19,NA,145,NA,NA,NA,NA
"2846","Chasselas","585","585Mtp37","",1959,"19/3/59",NA,NA,"3/8/1959",NA,1959-03-19,NA,NA,1959-08-03,NA,137,NA,NA,NA,NA
"2847","Chasselas","585","585Mtp37","",1960,"14/3/60",NA,NA,"8/8/1960",NA,1960-03-14,NA,NA,1960-08-08,NA,147,NA,NA,NA,NA
"2848","Chasselas","585","585Mtp37","",1961,"16/3/61",NA,NA,"2/9/1961",NA,1961-03-16,NA,NA,1961-09-02,NA,170,NA,NA,NA,NA
"2849","Chasselas","585","585Mtp38","",1958,"30/3/58",NA,NA,NA,NA,1958-03-30,NA,NA,NA,NA,NA,NA,NA,NA,NA
"2850","Chasselas","585","585Mtp38","",1959,"31/3/59",NA,NA,"3/8/1959",NA,1959-03-31,NA,NA,1959-08-03,NA,125,NA,NA,NA,NA
"2851","Chasselas","585","585Mtp38","",1960,"18/3/60",NA,NA,NA,NA,1960-03-18,NA,NA,NA,NA,NA,NA,NA,NA,NA
"2852","Chasselas","585","585Mtp38","",1961,"16/3/61",NA,NA,"14/8/61",NA,1961-03-16,NA,NA,1961-08-14,NA,151,NA,NA,NA,NA
"2853","Chasselas","585","585Mtp40","",1961,"4/3/1961",NA,NA,"14/8/61",NA,1961-03-04,NA,NA,1961-08-14,NA,163,NA,NA,NA,NA
"2854","Chasselas","585","585Mtp40","",1968,"11/3/1968",NA,NA,NA,NA,1968-03-11,NA,NA,NA,NA,NA,NA,NA,NA,NA
"2855","Chasselas","585","585Mtp40","",1975,"3/3/1975",NA,NA,NA,NA,1975-03-03,NA,NA,NA,NA,NA,NA,NA,NA,NA
"2856","Chasselas","585","585Mtp40","",1979,NA,NA,NA,"6/8/1979",NA,NA,NA,NA,1979-08-06,NA,NA,NA,NA,NA,NA
"2857","Chasselas","585","585Mtp40","",1981,NA,NA,NA,"11/8/1981",NA,NA,NA,NA,1981-08-11,NA,NA,NA,NA,NA,NA
"2858","Chasselas","585","585Mtp40","",2008,"16/3/08","27/5/08","24/7/08","20/8/08",NA,2008-03-16,2008-05-27,2008-07-24,2008-08-20,NA,157,72,58,27,130
"2859","Chasselas","585","585Mtp40","",2009,"20/3/09","26/5/09","21/7/09",NA,NA,2009-03-20,2009-05-26,2009-07-21,NA,NA,NA,67,56,NA,123
"2860","Chasselas","585","585Mtp40","",2010,"31/3/10","3/6/2010","26/7/10","26/8/10",NA,2010-03-31,2010-06-03,2010-07-26,2010-08-26,NA,148,64,53,31,117
"2861","Chasselas","585","585Mtp40","",2011,"17/3/11","15/5/11","9/7/2011","17/8/11",NA,2011-03-17,2011-05-15,2011-07-09,2011-08-17,NA,153,59,55,39,114
"2862","Chasselas","585","585Mtp40","",2012,"27/3/12","31/5/12","24/7/12","16/8/12",NA,2012-03-27,2012-05-31,2012-07-24,2012-08-16,NA,142,65,54,23,119
"2863","Chasselas","585","585Mtp40","",2013,"26/3/13","7/6/2013","26/7/13",NA,NA,2013-03-26,2013-06-07,2013-07-26,NA,NA,NA,73,49,NA,122
"2864","Chasselas","585","585Mtp41","",1961,"5/3/1961",NA,NA,NA,NA,1961-03-05,NA,NA,NA,NA,NA,NA,NA,NA,NA
"2865","Chasselas","585","585Mtp41","",1974,NA,NA,NA,"8/8/1974",NA,NA,NA,NA,1974-08-08,NA,NA,NA,NA,NA,NA
"2866","Chasselas","585","585Mtp41","",1976,NA,NA,NA,"2/8/1976",NA,NA,NA,NA,1976-08-02,NA,NA,NA,NA,NA,NA
"2867","Chasselas","585","585Mtp41","",1978,"11/3/1978",NA,NA,"10/8/1978",NA,1978-03-11,NA,NA,1978-08-10,NA,152,NA,NA,NA,NA
"2868","Chasselas","585","585Mtp42","",1961,"27/2/61",NA,NA,NA,NA,1961-02-27,NA,NA,NA,NA,NA,NA,NA,NA,NA
"2869","Chasselas","585","585Mtp42","",1968,"15/3/68",NA,NA,NA,NA,1968-03-15,NA,NA,NA,NA,NA,NA,NA,NA,NA
"2870","Chasselas","585","585Mtp42","",1969,"21/3/69",NA,NA,NA,NA,1969-03-21,NA,NA,NA,NA,NA,NA,NA,NA,NA
"2871","Chasselas","585","585Mtp42","",1970,"25/3/70",NA,NA,NA,NA,1970-03-25,NA,NA,NA,NA,NA,NA,NA,NA,NA
"2872","Chasselas","585","585Mtp42","",1972,NA,NA,NA,"28/8/72",NA,NA,NA,NA,1972-08-28,NA,NA,NA,NA,NA,NA
"2873","Chasselas","585","585Mtp42","",1973,NA,NA,NA,"8/8/1973",NA,NA,NA,NA,1973-08-08,NA,NA,NA,NA,NA,NA
"2874","Chasselas","585","585Mtp42","",1974,NA,NA,NA,"8/8/1974",NA,NA,NA,NA,1974-08-08,NA,NA,NA,NA,NA,NA
"2875","Chasselas","585","585Mtp42","",1977,NA,NA,"25/7/77",NA,NA,NA,NA,1977-07-25,NA,NA,NA,NA,NA,NA,NA
"2876","Chasselas","585","585Mtp42","",2010,"31/3/10","3/6/2010","19/7/10","27/8/10",NA,2010-03-31,2010-06-03,2010-07-19,2010-08-27,NA,149,64,46,39,110
"2877","Chasselas","585","585Mtp42","",2011,"20/3/11","15/5/11","9/7/2011","17/8/11",NA,2011-03-20,2011-05-15,2011-07-09,2011-08-17,NA,150,56,55,39,111
"2878","Chasselas","585","585Mtp42","",2012,"27/3/12","29/5/12","26/7/12","16/8/12",NA,2012-03-27,2012-05-29,2012-07-26,2012-08-16,NA,142,63,58,21,121
"2879","Chasselas","585","585Mtp42","",2013,"26/3/13","6/6/2013","26/7/13",NA,NA,2013-03-26,2013-06-06,2013-07-26,NA,NA,NA,72,50,NA,122
"2880","Chasselas","585","585Mtp43","",1960,NA,NA,NA,"2/8/1960",NA,NA,NA,NA,1960-08-02,NA,NA,NA,NA,NA,NA
"2881","Chasselas","585","585Mtp43","",1961,"6/3/1961",NA,NA,"14/8/61",NA,1961-03-06,NA,NA,1961-08-14,NA,161,NA,NA,NA,NA
"2882","Chasselas","585","585Mtp44","",1961,"5/3/1961",NA,NA,NA,NA,1961-03-05,NA,NA,NA,NA,NA,NA,NA,NA,NA
"2883","Chasselas","585","585Mtp44","",1974,NA,NA,NA,"8/8/1974",NA,NA,NA,NA,1974-08-08,NA,NA,NA,NA,NA,NA
"2884","Chasselas","585","585Mtp44","",1975,NA,NA,NA,"13/8/75",NA,NA,NA,NA,1975-08-13,NA,NA,NA,NA,NA,NA
"2885","Chasselas","585","585Mtp44","",1976,NA,NA,NA,"10/8/1976",NA,NA,NA,NA,1976-08-10,NA,NA,NA,NA,NA,NA
"2886","Chasselas","585","585Mtp44","",1977,NA,NA,"18/7/77",NA,NA,NA,NA,1977-07-18,NA,NA,NA,NA,NA,NA,NA
"2887","Chasselas","585","585Mtp44","",1979,"17/3/79",NA,NA,NA,NA,1979-03-17,NA,NA,NA,NA,NA,NA,NA,NA,NA
"2888","Chasselas","585","585Mtp44","",1999,"14/3/99",NA,NA,NA,NA,1999-03-14,NA,NA,NA,NA,NA,NA,NA,NA,NA
"2889","Chasselas","585","585Mtp44","",2010,"31/3/10","3/6/2010","26/7/10","27/8/10",NA,2010-03-31,2010-06-03,2010-07-26,2010-08-27,NA,149,64,53,32,117
"2890","Chasselas","585","585Mtp44","",2011,"17/3/11","16/5/11","11/7/2011","17/8/11",NA,2011-03-17,2011-05-16,2011-07-11,2011-08-17,NA,153,60,56,37,116
"2891","Chasselas","585","585Mtp44","",2012,"28/3/12","29/5/12","26/7/12","20/8/12",NA,2012-03-28,2012-05-29,2012-07-26,2012-08-20,NA,145,62,58,25,120
"2892","Chasselas","585","585Mtp44","",2013,"24/3/13","6/6/2013","26/7/13",NA,NA,2013-03-24,2013-06-06,2013-07-26,NA,NA,NA,74,50,NA,124
"2893","Chasselas","585","585Mtp45","",1961,"11/3/1961",NA,NA,"14/8/61",NA,1961-03-11,NA,NA,1961-08-14,NA,156,NA,NA,NA,NA
"2894","Chasselas","585","585Mtp45","",1967,"8/3/1967",NA,NA,NA,NA,1967-03-08,NA,NA,NA,NA,NA,NA,NA,NA,NA
"2895","Chasselas","585","585Mtp45","",1968,"20/3/68",NA,NA,"12/8/1968",NA,1968-03-20,NA,NA,1968-08-12,NA,145,NA,NA,NA,NA
"2896","Chasselas","585","585Mtp45","",1969,"21/3/69",NA,NA,"19/8/69",NA,1969-03-21,NA,NA,1969-08-19,NA,151,NA,NA,NA,NA
"2897","Chasselas","585","585Mtp45","",1977,NA,NA,"25/7/77",NA,NA,NA,NA,1977-07-25,NA,NA,NA,NA,NA,NA,NA
"2898","Chasselas","585","585Mtp45","",1989,NA,"26/5/89","17/7/89",NA,NA,NA,1989-05-26,1989-07-17,NA,NA,NA,NA,52,NA,NA
"2899","Chasselas","585","585Mtp45","",1990,NA,"20/5/90","12/7/1990",NA,NA,NA,1990-05-20,1990-07-12,NA,NA,NA,NA,53,NA,NA
"2900","Chasselas","585","585Mtp45","",1991,NA,"1/6/1991","26/7/91",NA,NA,NA,1991-06-01,1991-07-26,NA,NA,NA,NA,55,NA,NA
"2901","Chasselas","585","585Mtp45","",1992,"23/3/92","22/5/92","13/7/92","10/8/1992",NA,1992-03-23,1992-05-22,1992-07-13,1992-08-10,NA,140,60,52,28,112
"2902","Chasselas","585","585Mtp45","",1993,NA,"31/5/93","19/7/93",NA,NA,NA,1993-05-31,1993-07-19,NA,NA,NA,NA,49,NA,NA
"2903","Chasselas","585","585Mtp46","",1961,"5/3/1961",NA,NA,"14/8/61",NA,1961-03-05,NA,NA,1961-08-14,NA,162,NA,NA,NA,NA
"2904","Chasselas","585","585Mtp46","",1967,"11/3/1967",NA,NA,NA,NA,1967-03-11,NA,NA,NA,NA,NA,NA,NA,NA,NA
"2905","Chasselas","585","585Mtp46","",1968,"22/3/68",NA,NA,NA,NA,1968-03-22,NA,NA,NA,NA,NA,NA,NA,NA,NA
"2906","Chasselas","585","585Mtp46","",1969,"22/3/69",NA,NA,NA,NA,1969-03-22,NA,NA,NA,NA,NA,NA,NA,NA,NA
"2907","Chasselas","585","585Mtp46","",1973,NA,NA,NA,"14/8/73",NA,NA,NA,NA,1973-08-14,NA,NA,NA,NA,NA,NA
"2908","Chasselas","585","585Mtp46","",1974,NA,NA,NA,"8/8/1974",NA,NA,NA,NA,1974-08-08,NA,NA,NA,NA,NA,NA
"2909","Chasselas","585","585Mtp46","",1976,NA,NA,"23/7/76",NA,NA,NA,NA,1976-07-23,NA,NA,NA,NA,NA,NA,NA
"2910","Chasselas","585","585Mtp46","",1977,NA,NA,"18/7/77",NA,NA,NA,NA,1977-07-18,NA,NA,NA,NA,NA,NA,NA
"2911","Chasselas","585","585Mtp46","",1979,"17/3/79",NA,NA,NA,NA,1979-03-17,NA,NA,NA,NA,NA,NA,NA,NA,NA
"2912","Chasselas","585","585Mtp46","",1989,"13/3/89","26/5/89","24/7/89",NA,NA,1989-03-13,1989-05-26,1989-07-24,NA,NA,NA,74,59,NA,133
"2913","Chasselas","585","585Mtp46","",1990,"5/3/1990","20/5/90","9/7/1990","4/8/1990",NA,1990-03-05,1990-05-20,1990-07-09,1990-08-04,NA,152,76,50,26,126
"2914","Chasselas","585","585Mtp46","",1991,"18/3/91","1/6/1991","26/7/91","16/8/91",NA,1991-03-18,1991-06-01,1991-07-26,1991-08-16,NA,151,75,55,21,130
"2915","Chasselas","585","585Mtp46","",1992,"19/3/92","22/5/92","19/7/92","10/8/1992",NA,1992-03-19,1992-05-22,1992-07-19,1992-08-10,NA,144,64,58,22,122
"2916","Chasselas","585","585Mtp46","",1996,"11/3/1996",NA,NA,NA,NA,1996-03-11,NA,NA,NA,NA,NA,NA,NA,NA,NA
"2917","Chasselas","585","585Mtp46","",1997,"10/3/1997","17/5/97","8/7/1997","21/7/97",NA,1997-03-10,1997-05-17,1997-07-08,1997-07-21,NA,133,68,52,13,120
"2918","Chasselas","585","585Mtp46","",1998,"5/3/1998",NA,NA,NA,NA,1998-03-05,NA,NA,NA,NA,NA,NA,NA,NA,NA
"2919","Chasselas","585","585Mtp46","",1999,"14/3/99","23/5/99","12/7/1999","17/8/99",NA,1999-03-14,1999-05-23,1999-07-12,1999-08-17,NA,156,70,50,36,120
"2920","Chasselas","585","585Mtp46","",2000,"20/3/00","29/5/00","20/7/00","21/7/00",NA,2000-03-20,2000-05-29,2000-07-20,2000-07-21,NA,123,70,52,1,122
"2921","Chasselas","585","585Mtp47","",1958,"29/3/58",NA,NA,"13/8/58",NA,1958-03-29,NA,NA,1958-08-13,NA,137,NA,NA,NA,NA
"2922","Chasselas","585","585Mtp47","",1959,"16/3/59",NA,NA,"3/8/1959",NA,1959-03-16,NA,NA,1959-08-03,NA,140,NA,NA,NA,NA
"2923","Chasselas","585","585Mtp47","",1960,"11/3/1960",NA,NA,"1/8/1960",NA,1960-03-11,NA,NA,1960-08-01,NA,143,NA,NA,NA,NA
"2924","Chasselas","585","585Mtp47","",1961,"6/3/1961",NA,NA,NA,NA,1961-03-06,NA,NA,NA,NA,NA,NA,NA,NA,NA
"2925","Chasselas","585","585Mtp48","",1956,"29/3/56",NA,NA,"31/7/56",NA,1956-03-29,NA,NA,1956-07-31,NA,124,NA,NA,NA,NA
"2926","Chasselas","585","585Mtp48","",1957,"7/3/1957",NA,NA,"5/8/1957",NA,1957-03-07,NA,NA,1957-08-05,NA,151,NA,NA,NA,NA
"2927","Chasselas","585","585Mtp48","",1958,"24/3/58",NA,NA,"6/8/1958",NA,1958-03-24,NA,NA,1958-08-06,NA,135,NA,NA,NA,NA
"2928","Chasselas","585","585Mtp48","",1959,"18/3/59",NA,NA,NA,NA,1959-03-18,NA,NA,NA,NA,NA,NA,NA,NA,NA
"2929","Chasselas","585","585Mtp48","",1960,"10/3/1960",NA,NA,NA,NA,1960-03-10,NA,NA,NA,NA,NA,NA,NA,NA,NA
"2930","Chasselas","585","585Mtp48","",1961,"2/3/1961",NA,NA,NA,NA,1961-03-02,NA,NA,NA,NA,NA,NA,NA,NA,NA
"2931","Chasselas","585","585Mtp49","",1956,NA,NA,NA,"31/7/56",NA,NA,NA,NA,1956-07-31,NA,NA,NA,NA,NA,NA
"2932","Chasselas","585","585Mtp49","",1957,"9/3/1957",NA,NA,"13/8/57",NA,1957-03-09,NA,NA,1957-08-13,NA,157,NA,NA,NA,NA
"2933","Chasselas","585","585Mtp49","",1958,"24/3/58",NA,NA,"5/8/1958",NA,1958-03-24,NA,NA,1958-08-05,NA,134,NA,NA,NA,NA
"2934","Chasselas","585","585Mtp49","",1959,"13/3/59",NA,NA,"18/8/59",NA,1959-03-13,NA,NA,1959-08-18,NA,158,NA,NA,NA,NA
"2935","Chasselas","585","585Mtp50","",1958,"26/3/58",NA,NA,"19/8/58",NA,1958-03-26,NA,NA,1958-08-19,NA,146,NA,NA,NA,NA
"2936","Chasselas","585","585Mtp50","",1959,"17/3/59",NA,NA,"3/8/1959",NA,1959-03-17,NA,NA,1959-08-03,NA,139,NA,NA,NA,NA
"2937","Chasselas","585","585Mtp50","",1960,"14/3/60",NA,NA,"1/8/1960",NA,1960-03-14,NA,NA,1960-08-01,NA,140,NA,NA,NA,NA
"2938","Chasselas","585","585Mtp51","",1959,"16/3/59",NA,NA,"3/8/1959",NA,1959-03-16,NA,NA,1959-08-03,NA,140,NA,NA,NA,NA
"2939","Chasselas","585","585Mtp51","",1960,"9/3/1960",NA,NA,"1/8/1960",NA,1960-03-09,NA,NA,1960-08-01,NA,145,NA,NA,NA,NA
"2940","Chasselas","585","585Mtp51","",1961,"13/3/61",NA,NA,"14/8/61",NA,1961-03-13,NA,NA,1961-08-14,NA,154,NA,NA,NA,NA
"2941","Chasselas","585","585Mtp52","",1956,"28/3/56",NA,NA,"21/8/56",NA,1956-03-28,NA,NA,1956-08-21,NA,146,NA,NA,NA,NA
"2942","Chasselas","585","585Mtp52","",1957,"12/3/1957",NA,NA,"19/8/57",NA,1957-03-12,NA,NA,1957-08-19,NA,160,NA,NA,NA,NA
"2943","Chasselas","585","585Mtp52","",1958,NA,NA,NA,"6/8/1958",NA,NA,NA,NA,1958-08-06,NA,NA,NA,NA,NA,NA
"2944","Chasselas","585","585Mtp52","",1959,"21/3/59",NA,NA,"9/8/1959",NA,1959-03-21,NA,NA,1959-08-09,NA,141,NA,NA,NA,NA
"2945","Chasselas","585","585Mtp52","",1960,"6/3/1960",NA,NA,"7/8/1960",NA,1960-03-06,NA,NA,1960-08-07,NA,154,NA,NA,NA,NA
"2946","Chasselas","585","585Mtp52","",1961,"6/3/1961",NA,NA,NA,NA,1961-03-06,NA,NA,NA,NA,NA,NA,NA,NA,NA
"2947","Chasselas","585","585Mtp57","",1958,"27/3/58",NA,NA,"19/8/58",NA,1958-03-27,NA,NA,1958-08-19,NA,145,NA,NA,NA,NA
"2948","Chasselas","585","585Mtp57","",1959,"28/3/59",NA,NA,"3/8/1959",NA,1959-03-28,NA,NA,1959-08-03,NA,128,NA,NA,NA,NA
"2949","Chasselas","585","585Mtp57","",1960,"18/3/60",NA,NA,"8/8/1960",NA,1960-03-18,NA,NA,1960-08-08,NA,143,NA,NA,NA,NA
"2950","Chasselas","585","585Mtp57","",1961,"15/3/61",NA,NA,"14/8/61",NA,1961-03-15,NA,NA,1961-08-14,NA,152,NA,NA,NA,NA
"2951","Chasselas","585","585Mtp58","",1964,"23/3/64",NA,NA,"4/8/1964",NA,1964-03-23,NA,NA,1964-08-04,NA,134,NA,NA,NA,NA
"2952","Chasselas","585","585Mtp58","",1965,"27/3/65",NA,NA,"5/8/1965",NA,1965-03-27,NA,NA,1965-08-05,NA,131,NA,NA,NA,NA
"2953","Chasselas","585","585Mtp58","",1966,"10/3/1966",NA,NA,"10/8/1966",NA,1966-03-10,NA,NA,1966-08-10,NA,153,NA,NA,NA,NA
"2954","Chasselas","585","585Mtp58","",1967,"14/3/67",NA,NA,NA,NA,1967-03-14,NA,NA,NA,NA,NA,NA,NA,NA,NA
"2955","Chasselas","585","585Mtp58","",1968,"24/3/68",NA,NA,"12/8/1968",NA,1968-03-24,NA,NA,1968-08-12,NA,141,NA,NA,NA,NA
"2956","Chasselas","585","585Mtp58","",1969,"22/3/69",NA,NA,"26/8/69",NA,1969-03-22,NA,NA,1969-08-26,NA,157,NA,NA,NA,NA
"2957","Chasselas","585","585Mtp58","",1970,"26/3/70",NA,NA,NA,NA,1970-03-26,NA,NA,NA,NA,NA,NA,NA,NA,NA
"2958","Chasselas","585","585Mtp58","",1971,"30/3/71",NA,NA,NA,NA,1971-03-30,NA,NA,NA,NA,NA,NA,NA,NA,NA
"2959","Chasselas","585","585Mtp58","",1972,"19/3/72",NA,NA,"17/8/72",NA,1972-03-19,NA,NA,1972-08-17,NA,151,NA,NA,NA,NA
"2960","Chasselas","585","585Mtp58","",1973,"30/3/73",NA,NA,NA,NA,1973-03-30,NA,NA,NA,NA,NA,NA,NA,NA,NA
"2961","Chasselas","585","585Mtp58","",1974,"19/3/74",NA,NA,NA,NA,1974-03-19,NA,NA,NA,NA,NA,NA,NA,NA,NA
"2962","Chasselas","585","585Mtp58","",1976,"13/3/76",NA,NA,NA,NA,1976-03-13,NA,NA,NA,NA,NA,NA,NA,NA,NA
"2963","Chasselas","585","585Mtp58","",1978,"11/3/1978",NA,NA,NA,NA,1978-03-11,NA,NA,NA,NA,NA,NA,NA,NA,NA
"2964","Chasselas","585","585Mtp58","",1979,"19/3/79",NA,"23/7/79",NA,NA,1979-03-19,NA,1979-07-23,NA,NA,NA,NA,NA,NA,126
"2965","Chasselas","585","585Mtp58","",1980,"19/3/80",NA,"1/8/1980",NA,NA,1980-03-19,NA,1980-08-01,NA,NA,NA,NA,NA,NA,135
"2966","Chasselas","585","585Mtp58","",1981,"24/3/81",NA,"20/7/81",NA,NA,1981-03-24,NA,1981-07-20,NA,NA,NA,NA,NA,NA,118
"2967","Chasselas","585","585Mtp58","",1982,"18/3/82",NA,"12/7/1982",NA,NA,1982-03-18,NA,1982-07-12,NA,NA,NA,NA,NA,NA,116
"2968","Chasselas","585","585Mtp58","",1983,"24/3/83",NA,NA,NA,NA,1983-03-24,NA,NA,NA,NA,NA,NA,NA,NA,NA
"2969","Chasselas","585","585Mtp58","",1985,"1/4/1985",NA,NA,NA,NA,1985-04-01,NA,NA,NA,NA,NA,NA,NA,NA,NA
"2970","Chasselas","585","585Mtp58","",1986,"26/3/86",NA,NA,NA,NA,1986-03-26,NA,NA,NA,NA,NA,NA,NA,NA,NA
"2971","Chasselas","585","585Mtp58","",1987,NA,"4/6/1987","24/7/87","20/8/87",NA,NA,1987-06-04,1987-07-24,1987-08-20,NA,NA,NA,50,27,NA
"2972","Chasselas","585","585Mtp58","",1988,"25/3/88","31/5/88","24/7/88","16/8/88",NA,1988-03-25,1988-05-31,1988-07-24,1988-08-16,NA,144,67,54,23,121
"2973","Chasselas","585","585Mtp58","",1995,NA,"29/5/95",NA,NA,NA,NA,1995-05-29,NA,NA,NA,NA,NA,NA,NA,NA
"2974","Chasselas","585","585Mtp58","",1996,NA,"29/5/96",NA,NA,NA,NA,1996-05-29,NA,NA,NA,NA,NA,NA,NA,NA
"2975","Chasselas","585","585Mtp59","",1964,"26/3/64",NA,NA,"11/8/1964",NA,1964-03-26,NA,NA,1964-08-11,NA,138,NA,NA,NA,NA
"2976","Chasselas","585","585Mtp59","",1965,"27/3/65",NA,NA,"12/8/1965",NA,1965-03-27,NA,NA,1965-08-12,NA,138,NA,NA,NA,NA
"2977","Chasselas","585","585Mtp59","",1966,"12/3/1966",NA,NA,"10/8/1966",NA,1966-03-12,NA,NA,1966-08-10,NA,151,NA,NA,NA,NA
"2978","Chasselas","585","585Mtp59","",1967,"12/3/1967",NA,NA,NA,NA,1967-03-12,NA,NA,NA,NA,NA,NA,NA,NA,NA
"2979","Chasselas","585","585Mtp59","",1968,"24/3/68",NA,NA,NA,NA,1968-03-24,NA,NA,NA,NA,NA,NA,NA,NA,NA
"2980","Chasselas","585","585Mtp59","",1969,"25/3/69",NA,NA,"26/8/69",NA,1969-03-25,NA,NA,1969-08-26,NA,154,NA,NA,NA,NA
"2981","Chasselas","585","585Mtp59","",1972,NA,NA,NA,"17/8/72",NA,NA,NA,NA,1972-08-17,NA,NA,NA,NA,NA,NA
"2982","Chasselas","585","585Mtp59","",1979,NA,NA,"23/7/79",NA,NA,NA,NA,1979-07-23,NA,NA,NA,NA,NA,NA,NA
"2983","Chasselas","585","585Mtp59","",1980,NA,NA,"28/7/80",NA,NA,NA,NA,1980-07-28,NA,NA,NA,NA,NA,NA,NA
"2984","Chasselas","585","585Mtp59","",1981,"26/3/81",NA,"24/7/81",NA,NA,1981-03-26,NA,1981-07-24,NA,NA,NA,NA,NA,NA,120
"2985","Chasselas","585","585Mtp59","",1982,NA,NA,"15/7/82",NA,NA,NA,NA,1982-07-15,NA,NA,NA,NA,NA,NA,NA
"2986","Chasselas","585","585Mtp59","",1983,"25/3/83",NA,"29/7/83",NA,NA,1983-03-25,NA,1983-07-29,NA,NA,NA,NA,NA,NA,126
"2987","Chasselas","585","585Mtp59","",1986,"28/3/86",NA,NA,NA,NA,1986-03-28,NA,NA,NA,NA,NA,NA,NA,NA,NA
"2988","Chasselas","585","585Mtp59","",1987,NA,"10/6/1987","25/7/88","17/8/87",NA,NA,1987-06-10,1988-07-25,1987-08-17,NA,NA,NA,411,-343,NA
"2989","Chasselas","585","585Mtp59","",1988,"28/3/88","1/6/1988","23/7/89","12/8/1988",NA,1988-03-28,1988-06-01,1989-07-23,1988-08-12,NA,137,65,417,-345,482
"2990","Chasselas","585","585Mtp60","",1964,NA,NA,NA,"11/8/1964",NA,NA,NA,NA,1964-08-11,NA,NA,NA,NA,NA,NA
"2991","Chasselas","585","585Mtp60","",1965,"27/3/65",NA,NA,"12/8/1965",NA,1965-03-27,NA,NA,1965-08-12,NA,138,NA,NA,NA,NA
"2992","Chasselas","585","585Mtp60","",1966,"16/3/66",NA,NA,"10/8/1966",NA,1966-03-16,NA,NA,1966-08-10,NA,147,NA,NA,NA,NA
"2993","Chasselas","585","585Mtp60","",1967,"13/3/67",NA,NA,NA,NA,1967-03-13,NA,NA,NA,NA,NA,NA,NA,NA,NA
"2994","Chasselas","585","585Mtp60","",1968,"27/3/68",NA,NA,"19/8/68",NA,1968-03-27,NA,NA,1968-08-19,NA,145,NA,NA,NA,NA
"2995","Chasselas","585","585Mtp60","",1969,"27/3/69",NA,NA,NA,NA,1969-03-27,NA,NA,NA,NA,NA,NA,NA,NA,NA
"2996","Chasselas","585","585Mtp60","",1972,NA,NA,NA,"21/8/72",NA,NA,NA,NA,1972-08-21,NA,NA,NA,NA,NA,NA
"2997","Chasselas","585","585Mtp61","",1964,"26/3/64",NA,NA,"11/8/1964",NA,1964-03-26,NA,NA,1964-08-11,NA,138,NA,NA,NA,NA
"2998","Chasselas","585","585Mtp61","",1965,"27/3/65",NA,NA,"11/8/1965",NA,1965-03-27,NA,NA,1965-08-11,NA,137,NA,NA,NA,NA
"2999","Chasselas","585","585Mtp61","",1966,"12/3/1966",NA,NA,"10/8/1966",NA,1966-03-12,NA,NA,1966-08-10,NA,151,NA,NA,NA,NA
"3000","Chasselas","585","585Mtp61","",1967,"12/3/1967",NA,NA,"9/8/1967",NA,1967-03-12,NA,NA,1967-08-09,NA,150,NA,NA,NA,NA
"3001","Chasselas","585","585Mtp61","",1968,"24/3/68",NA,NA,NA,NA,1968-03-24,NA,NA,NA,NA,NA,NA,NA,NA,NA
"3002","Chasselas","585","585Mtp61","",1969,"24/3/69",NA,NA,"19/8/69",NA,1969-03-24,NA,NA,1969-08-19,NA,148,NA,NA,NA,NA
"3003","Chasselas","585","585Mtp61","",1972,NA,NA,NA,"17/8/72",NA,NA,NA,NA,1972-08-17,NA,NA,NA,NA,NA,NA
"3004","Chasselas","585","585Mtp62","",1964,"26/3/64",NA,NA,NA,NA,1964-03-26,NA,NA,NA,NA,NA,NA,NA,NA,NA
"3005","Chasselas","585","585Mtp62","",1965,"27/3/65",NA,NA,"12/8/1965",NA,1965-03-27,NA,NA,1965-08-12,NA,138,NA,NA,NA,NA
"3006","Chasselas","585","585Mtp62","",1966,"14/3/66",NA,NA,"10/8/1966",NA,1966-03-14,NA,NA,1966-08-10,NA,149,NA,NA,NA,NA
"3007","Chasselas","585","585Mtp62","",1967,"10/3/1967",NA,NA,NA,NA,1967-03-10,NA,NA,NA,NA,NA,NA,NA,NA,NA
"3008","Chasselas","585","585Mtp62","",1968,"25/3/68",NA,NA,"19/8/68",NA,1968-03-25,NA,NA,1968-08-19,NA,147,NA,NA,NA,NA
"3009","Chasselas","585","585Mtp62","",1969,"23/3/69",NA,NA,"26/8/69",NA,1969-03-23,NA,NA,1969-08-26,NA,156,NA,NA,NA,NA
"3010","Chasselas","585","585Mtp62","",1971,"29/3/71",NA,NA,NA,NA,1971-03-29,NA,NA,NA,NA,NA,NA,NA,NA,NA
"3011","Chasselas","585","585Mtp62","",1972,"19/3/72",NA,NA,"21/8/72",NA,1972-03-19,NA,NA,1972-08-21,NA,155,NA,NA,NA,NA
"3012","Chasselas","585","585Mtp62","",1973,"29/3/73",NA,NA,NA,NA,1973-03-29,NA,NA,NA,NA,NA,NA,NA,NA,NA
"3013","Chasselas","585","585Mtp62","",1974,"21/3/74",NA,NA,NA,NA,1974-03-21,NA,NA,NA,NA,NA,NA,NA,NA,NA
"3014","Chasselas","585","585Mtp62","",1976,"18/3/76",NA,NA,NA,NA,1976-03-18,NA,NA,NA,NA,NA,NA,NA,NA,NA
"3015","Chasselas","585","585Mtp62","",1978,"11/3/1978",NA,NA,NA,NA,1978-03-11,NA,NA,NA,NA,NA,NA,NA,NA,NA
"3016","Chasselas","585","585Mtp62","",1979,"15/3/79",NA,"23/7/79",NA,NA,1979-03-15,NA,1979-07-23,NA,NA,NA,NA,NA,NA,130
"3017","Chasselas","585","585Mtp62","",1980,"23/3/80",NA,"1/8/1980",NA,NA,1980-03-23,NA,1980-08-01,NA,NA,NA,NA,NA,NA,131
"3018","Chasselas","585","585Mtp62","",1981,"26/3/81",NA,"24/7/81",NA,NA,1981-03-26,NA,1981-07-24,NA,NA,NA,NA,NA,NA,120
"3019","Chasselas","585","585Mtp62","",1982,"18/3/82",NA,"15/7/82",NA,NA,1982-03-18,NA,1982-07-15,NA,NA,NA,NA,NA,NA,119
"3020","Chasselas","585","585Mtp62","",1983,"29/3/83",NA,"29/7/83",NA,NA,1983-03-29,NA,1983-07-29,NA,NA,NA,NA,NA,NA,122
"3021","Chasselas","585","585Mtp62","",1985,"3/4/1985",NA,NA,NA,NA,1985-04-03,NA,NA,NA,NA,NA,NA,NA,NA,NA
"3022","Chasselas","585","585Mtp62","",1986,"27/3/86",NA,NA,NA,NA,1986-03-27,NA,NA,NA,NA,NA,NA,NA,NA,NA
"3023","Chasselas","585","585Mtp62","",1987,NA,"9/6/1987","26/7/87","17/8/87",NA,NA,1987-06-09,1987-07-26,1987-08-17,NA,NA,NA,47,22,NA
"3024","Chasselas","585","585Mtp62","",1988,"25/3/88","1/6/1988","24/7/88","16/8/88",NA,1988-03-25,1988-06-01,1988-07-24,1988-08-16,NA,144,68,53,23,121
"3025","Chasselas","585","585Mtp62","",1994,NA,"25/5/94",NA,NA,NA,NA,1994-05-25,NA,NA,NA,NA,NA,NA,NA,NA
"3026","Chasselas","585","585Mtp62","",1995,"16/3/95","27/5/95","17/7/95","16/8/95",NA,1995-03-16,1995-05-27,1995-07-17,1995-08-16,NA,153,72,51,30,123
"3027","Chasselas","585","585Mtp62","",1996,"18/3/96",NA,NA,NA,NA,1996-03-18,NA,NA,NA,NA,NA,NA,NA,NA,NA
"3028","Chasselas","585","585Mtp62","",1997,NA,"21/5/97","20/7/97","4/8/1997",NA,NA,1997-05-21,1997-07-20,1997-08-04,NA,NA,NA,60,15,NA
"3029","Chasselas","585","585Mtp62","",1998,"16/3/98",NA,NA,NA,NA,1998-03-16,NA,NA,NA,NA,NA,NA,NA,NA,NA
"3030","Chasselas","585","585Mtp62","",1999,"16/3/99",NA,NA,NA,NA,1999-03-16,NA,NA,NA,NA,NA,NA,NA,NA,NA
"3031","Chasselas","585","585Mtp62","",2001,"7/3/2001","24/5/01","8/7/2001","17/8/01",NA,2001-03-07,2001-05-24,2001-07-08,2001-08-17,NA,163,78,45,40,123
"3032","Chasselas","585","585Mtp62","",2002,"17/3/02","23/5/02","22/7/02","20/8/02",NA,2002-03-17,2002-05-23,2002-07-22,2002-08-20,NA,156,67,60,29,127
"3033","Chasselas","585","585Mtp62","",2003,"26/3/03","26/5/03","18/7/03","11/8/2003",NA,2003-03-26,2003-05-26,2003-07-18,2003-08-11,NA,138,61,53,24,114
"3034","Chasselas","585","585Mtp62","",2004,"23/3/04","4/6/2004","28/7/04","24/8/04",NA,2004-03-23,2004-06-04,2004-07-28,2004-08-24,NA,154,73,54,27,127
"3035","Chasselas","585","585Mtp62","",2005,"2/4/2005","30/5/05","27/7/05","29/8/05",NA,2005-04-02,2005-05-30,2005-07-27,2005-08-29,NA,149,58,58,33,116
"3036","Chasselas","585","585Mtp62","",2006,"28/3/06","26/5/06","20/7/06","11/8/2006",NA,2006-03-28,2006-05-26,2006-07-20,2006-08-11,NA,136,59,55,22,114
"3037","Chasselas","585","585Mtp62","",2007,"14/3/07","19/5/07",NA,NA,NA,2007-03-14,2007-05-19,NA,NA,NA,NA,66,NA,NA,NA
"3038","Chasselas","585","585Mtp62","",2008,"13/3/08","24/5/08","24/7/08","20/8/08",NA,2008-03-13,2008-05-24,2008-07-24,2008-08-20,NA,160,72,61,27,133
"3039","Chasselas","585","585Mtp62","",2009,"19/3/09",NA,NA,NA,NA,2009-03-19,NA,NA,NA,NA,NA,NA,NA,NA,NA
"3040","Chasselas","585","585Mtp62","",2010,"29/3/10","31/5/10","19/7/10","27/8/10",NA,2010-03-29,2010-05-31,2010-07-19,2010-08-27,NA,151,63,49,39,112
"3041","Chasselas","585","585Mtp62","",2011,"17/3/11","13/5/11","12/7/2011","17/8/11",NA,2011-03-17,2011-05-13,2011-07-12,2011-08-17,NA,153,57,60,36,117
"3042","Chasselas","585","585Mtp62","",2012,"29/3/12","29/5/12","24/7/12","20/8/12",NA,2012-03-29,2012-05-29,2012-07-24,2012-08-20,NA,144,61,56,27,117
"3043","Chasselas","585","585Mtp62","",2013,"27/3/13",NA,"26/7/13",NA,NA,2013-03-27,NA,2013-07-26,NA,NA,NA,NA,NA,NA,121
"3044","Chasselas","585","585Mtp63","",1964,"26/3/64",NA,NA,NA,NA,1964-03-26,NA,NA,NA,NA,NA,NA,NA,NA,NA
"3045","Chasselas","585","585Mtp63","",1965,"31/3/65",NA,NA,"5/8/1965",NA,1965-03-31,NA,NA,1965-08-05,NA,127,NA,NA,NA,NA
"3046","Chasselas","585","585Mtp63","",1966,"13/3/66",NA,NA,"10/8/1966",NA,1966-03-13,NA,NA,1966-08-10,NA,150,NA,NA,NA,NA
"3047","Chasselas","585","585Mtp63","",1967,"13/3/67",NA,NA,"2/8/1967",NA,1967-03-13,NA,NA,1967-08-02,NA,142,NA,NA,NA,NA
"3048","Chasselas","585","585Mtp63","",1968,"24/3/68",NA,NA,"12/8/1968",NA,1968-03-24,NA,NA,1968-08-12,NA,141,NA,NA,NA,NA
"3049","Chasselas","585","585Mtp63","",1969,"25/3/69",NA,NA,"19/8/69",NA,1969-03-25,NA,NA,1969-08-19,NA,147,NA,NA,NA,NA
"3050","Chasselas","585","585Mtp63","",1972,NA,NA,NA,"21/8/72",NA,NA,NA,NA,1972-08-21,NA,NA,NA,NA,NA,NA
"3051","Chasselas","585","585Mtp64","",1964,"1/4/1964",NA,NA,NA,NA,1964-04-01,NA,NA,NA,NA,NA,NA,NA,NA,NA
"3052","Chasselas","585","585Mtp64","",1965,"27/3/65",NA,NA,"5/8/1965",NA,1965-03-27,NA,NA,1965-08-05,NA,131,NA,NA,NA,NA
"3053","Chasselas","585","585Mtp64","",1966,"7/3/1966",NA,NA,"10/8/1966",NA,1966-03-07,NA,NA,1966-08-10,NA,156,NA,NA,NA,NA
"3054","Chasselas","585","585Mtp64","",1967,"10/3/1967",NA,NA,"2/8/1967",NA,1967-03-10,NA,NA,1967-08-02,NA,145,NA,NA,NA,NA
"3055","Chasselas","585","585Mtp64","",1968,"24/3/68",NA,NA,NA,NA,1968-03-24,NA,NA,NA,NA,NA,NA,NA,NA,NA
"3056","Chasselas","585","585Mtp64","",1969,"23/3/69",NA,NA,"26/8/69",NA,1969-03-23,NA,NA,1969-08-26,NA,156,NA,NA,NA,NA
"3057","Chasselas","585","585Mtp64","",1972,NA,NA,NA,"17/8/72",NA,NA,NA,NA,1972-08-17,NA,NA,NA,NA,NA,NA
"3058","Chasselas","585","585Mtp65","",1964,"20/3/64",NA,NA,"11/8/1964",NA,1964-03-20,NA,NA,1964-08-11,NA,144,NA,NA,NA,NA
"3059","Chasselas","585","585Mtp65","",1965,"27/3/65",NA,NA,"5/8/1965",NA,1965-03-27,NA,NA,1965-08-05,NA,131,NA,NA,NA,NA
"3060","Chasselas","585","585Mtp65","",1966,"10/3/1966",NA,NA,"10/8/1966",NA,1966-03-10,NA,NA,1966-08-10,NA,153,NA,NA,NA,NA
"3061","Chasselas","585","585Mtp65","",1967,"9/3/1967",NA,NA,NA,NA,1967-03-09,NA,NA,NA,NA,NA,NA,NA,NA,NA
"3062","Chasselas","585","585Mtp65","",1968,"26/3/68",NA,NA,NA,NA,1968-03-26,NA,NA,NA,NA,NA,NA,NA,NA,NA
"3063","Chasselas","585","585Mtp65","",1969,"22/3/69",NA,NA,"26/8/69",NA,1969-03-22,NA,NA,1969-08-26,NA,157,NA,NA,NA,NA
"3064","Chasselas","585","585Mtp65","",1970,"27/3/70",NA,NA,NA,NA,1970-03-27,NA,NA,NA,NA,NA,NA,NA,NA,NA
"3065","Chasselas","585","585Mtp65","",1971,"1/4/1971",NA,NA,NA,NA,1971-04-01,NA,NA,NA,NA,NA,NA,NA,NA,NA
"3066","Chasselas","585","585Mtp65","",1972,"19/3/72",NA,NA,"17/8/72",NA,1972-03-19,NA,NA,1972-08-17,NA,151,NA,NA,NA,NA
"3067","Chasselas","585","585Mtp65","",1973,"30/3/73",NA,NA,NA,NA,1973-03-30,NA,NA,NA,NA,NA,NA,NA,NA,NA
"3068","Chasselas","585","585Mtp65","",1974,"19/3/74",NA,NA,NA,NA,1974-03-19,NA,NA,NA,NA,NA,NA,NA,NA,NA
"3069","Chasselas","585","585Mtp65","",1976,"15/3/76",NA,NA,NA,NA,1976-03-15,NA,NA,NA,NA,NA,NA,NA,NA,NA
"3070","Chasselas","585","585Mtp65","",1978,"11/3/1978",NA,NA,NA,NA,1978-03-11,NA,NA,NA,NA,NA,NA,NA,NA,NA
"3071","Chasselas","585","585Mtp65","",1979,"17/3/79",NA,"23/7/79",NA,NA,1979-03-17,NA,1979-07-23,NA,NA,NA,NA,NA,NA,128
"3072","Chasselas","585","585Mtp65","",1980,"20/3/80",NA,"28/7/80",NA,NA,1980-03-20,NA,1980-07-28,NA,NA,NA,NA,NA,NA,130
"3073","Chasselas","585","585Mtp65","",1981,"25/3/81",NA,"20/7/81",NA,NA,1981-03-25,NA,1981-07-20,NA,NA,NA,NA,NA,NA,117
"3074","Chasselas","585","585Mtp65","",1982,"15/3/82",NA,"12/7/1982",NA,NA,1982-03-15,NA,1982-07-12,NA,NA,NA,NA,NA,NA,119
"3075","Chasselas","585","585Mtp65","",1983,"22/3/83",NA,"22/7/83",NA,NA,1983-03-22,NA,1983-07-22,NA,NA,NA,NA,NA,NA,122
"3076","Chasselas","585","585Mtp65","",1985,"29/3/85",NA,NA,NA,NA,1985-03-29,NA,NA,NA,NA,NA,NA,NA,NA,NA
"3077","Chasselas","585","585Mtp65","",1986,"24/3/86",NA,NA,NA,NA,1986-03-24,NA,NA,NA,NA,NA,NA,NA,NA,NA
"3078","Chasselas","585","585Mtp65","",1987,NA,"5/6/1987","24/7/87","17/8/87",NA,NA,1987-06-05,1987-07-24,1987-08-17,NA,NA,NA,49,24,NA
"3079","Chasselas","585","585Mtp65","",1988,"25/3/88","30/5/88","23/7/88","12/8/1988",NA,1988-03-25,1988-05-30,1988-07-23,1988-08-12,NA,140,66,54,20,120
"3080","Chasselas","585","585Mtp65","",1995,NA,"29/5/95",NA,NA,NA,NA,1995-05-29,NA,NA,NA,NA,NA,NA,NA,NA
"3081","Chasselas","585","585Mtp66","",1964,"20/3/64",NA,NA,"11/8/1964",NA,1964-03-20,NA,NA,1964-08-11,NA,144,NA,NA,NA,NA
"3082","Chasselas","585","585Mtp66","",1965,"31/3/65",NA,NA,"5/8/1965",NA,1965-03-31,NA,NA,1965-08-05,NA,127,NA,NA,NA,NA
"3083","Chasselas","585","585Mtp66","",1966,"13/3/66",NA,NA,"10/8/1966",NA,1966-03-13,NA,NA,1966-08-10,NA,150,NA,NA,NA,NA
"3084","Chasselas","585","585Mtp66","",1967,"15/3/67",NA,NA,NA,NA,1967-03-15,NA,NA,NA,NA,NA,NA,NA,NA,NA
"3085","Chasselas","585","585Mtp66","",1968,"28/3/68",NA,NA,"12/8/1968",NA,1968-03-28,NA,NA,1968-08-12,NA,137,NA,NA,NA,NA
"3086","Chasselas","585","585Mtp66","",1969,"29/3/69",NA,NA,"26/8/69",NA,1969-03-29,NA,NA,1969-08-26,NA,150,NA,NA,NA,NA
"3087","Chasselas","585","585Mtp66","",1970,"30/3/70",NA,NA,NA,NA,1970-03-30,NA,NA,NA,NA,NA,NA,NA,NA,NA
"3088","Chasselas","585","585Mtp66","",1971,"1/4/1971",NA,NA,NA,NA,1971-04-01,NA,NA,NA,NA,NA,NA,NA,NA,NA
"3089","Chasselas","585","585Mtp66","",1972,"19/3/72",NA,NA,"17/8/72",NA,1972-03-19,NA,NA,1972-08-17,NA,151,NA,NA,NA,NA
"3090","Chasselas","585","585Mtp66","",1973,"30/3/73",NA,NA,NA,NA,1973-03-30,NA,NA,NA,NA,NA,NA,NA,NA,NA
"3091","Chasselas","585","585Mtp66","",1974,"21/3/74",NA,NA,NA,NA,1974-03-21,NA,NA,NA,NA,NA,NA,NA,NA,NA
"3092","Chasselas","585","585Mtp66","",1976,"18/3/76",NA,NA,NA,NA,1976-03-18,NA,NA,NA,NA,NA,NA,NA,NA,NA
"3093","Chasselas","585","585Mtp66","",1978,"11/3/1978",NA,NA,NA,NA,1978-03-11,NA,NA,NA,NA,NA,NA,NA,NA,NA
"3094","Chasselas","585","585Mtp66","",1979,"18/3/79",NA,"17/7/79",NA,NA,1979-03-18,NA,1979-07-17,NA,NA,NA,NA,NA,NA,121
"3095","Chasselas","585","585Mtp66","",1980,"24/3/80",NA,"1/8/1980",NA,NA,1980-03-24,NA,1980-08-01,NA,NA,NA,NA,NA,NA,130
"3096","Chasselas","585","585Mtp66","",1981,"27/3/81",NA,"24/7/81",NA,NA,1981-03-27,NA,1981-07-24,NA,NA,NA,NA,NA,NA,119
"3097","Chasselas","585","585Mtp66","",1982,"22/3/82",NA,"12/7/1982",NA,NA,1982-03-22,NA,1982-07-12,NA,NA,NA,NA,NA,NA,112
"3098","Chasselas","585","585Mtp66","",1983,"27/3/83",NA,"25/7/83",NA,NA,1983-03-27,NA,1983-07-25,NA,NA,NA,NA,NA,NA,120
"3099","Chasselas","585","585Mtp66","",1985,"1/4/1985",NA,NA,NA,NA,1985-04-01,NA,NA,NA,NA,NA,NA,NA,NA,NA
"3100","Chasselas","585","585Mtp66","",1986,"27/3/86",NA,NA,NA,NA,1986-03-27,NA,NA,NA,NA,NA,NA,NA,NA,NA
"3101","Chasselas","585","585Mtp66","",1987,NA,"5/6/1987","24/7/87","20/8/87",NA,NA,1987-06-05,1987-07-24,1987-08-20,NA,NA,NA,49,27,NA
"3102","Chasselas","585","585Mtp66","",1988,"25/3/88","31/5/88","22/7/88","16/8/88",NA,1988-03-25,1988-05-31,1988-07-22,1988-08-16,NA,144,67,52,25,119
"3103","Chasselas","585","585Mtp67","",1964,"20/3/64",NA,NA,"4/8/1964",NA,1964-03-20,NA,NA,1964-08-04,NA,137,NA,NA,NA,NA
"3104","Chasselas","585","585Mtp67","",1965,"31/3/65",NA,NA,"5/8/1965",NA,1965-03-31,NA,NA,1965-08-05,NA,127,NA,NA,NA,NA
"3105","Chasselas","585","585Mtp67","",1966,"12/3/1966",NA,NA,"10/8/1966",NA,1966-03-12,NA,NA,1966-08-10,NA,151,NA,NA,NA,NA
"3106","Chasselas","585","585Mtp67","",1967,"10/3/1967",NA,NA,NA,NA,1967-03-10,NA,NA,NA,NA,NA,NA,NA,NA,NA
"3107","Chasselas","585","585Mtp67","",1968,"24/3/68",NA,NA,"12/8/1968",NA,1968-03-24,NA,NA,1968-08-12,NA,141,NA,NA,NA,NA
"3108","Chasselas","585","585Mtp67","",1969,"24/3/69",NA,NA,"12/8/1969",NA,1969-03-24,NA,NA,1969-08-12,NA,141,NA,NA,NA,NA
"3109","Chasselas","585","585Mtp67","",1970,"29/3/70",NA,NA,NA,NA,1970-03-29,NA,NA,NA,NA,NA,NA,NA,NA,NA
"3110","Chasselas","585","585Mtp67","",1971,"31/3/71",NA,NA,NA,NA,1971-03-31,NA,NA,NA,NA,NA,NA,NA,NA,NA
"3111","Chasselas","585","585Mtp67","",1972,"19/3/72",NA,NA,"17/8/72",NA,1972-03-19,NA,NA,1972-08-17,NA,151,NA,NA,NA,NA
"3112","Chasselas","585","585Mtp67","",1973,"30/3/73",NA,NA,NA,NA,1973-03-30,NA,NA,NA,NA,NA,NA,NA,NA,NA
"3113","Chasselas","585","585Mtp67","",1974,"21/3/74",NA,NA,NA,NA,1974-03-21,NA,NA,NA,NA,NA,NA,NA,NA,NA
"3114","Chasselas","585","585Mtp67","",1976,"13/3/76",NA,NA,NA,NA,1976-03-13,NA,NA,NA,NA,NA,NA,NA,NA,NA
"3115","Chasselas","585","585Mtp67","",1978,"11/3/1978",NA,NA,NA,NA,1978-03-11,NA,NA,NA,NA,NA,NA,NA,NA,NA
"3116","Chasselas","585","585Mtp67","",1979,"15/3/79",NA,"23/7/79",NA,NA,1979-03-15,NA,1979-07-23,NA,NA,NA,NA,NA,NA,130
"3117","Chasselas","585","585Mtp67","",1980,"20/3/80",NA,"1/8/1980",NA,NA,1980-03-20,NA,1980-08-01,NA,NA,NA,NA,NA,NA,134
"3118","Chasselas","585","585Mtp67","",1981,"24/3/81",NA,"20/7/81",NA,NA,1981-03-24,NA,1981-07-20,NA,NA,NA,NA,NA,NA,118
"3119","Chasselas","585","585Mtp67","",1982,"17/3/82",NA,"5/7/1982",NA,NA,1982-03-17,NA,1982-07-05,NA,NA,NA,NA,NA,NA,110
"3120","Chasselas","585","585Mtp67","",1983,"28/3/83",NA,"22/7/83",NA,NA,1983-03-28,NA,1983-07-22,NA,NA,NA,NA,NA,NA,116
"3121","Chasselas","585","585Mtp67","",1985,"1/4/1985",NA,NA,NA,NA,1985-04-01,NA,NA,NA,NA,NA,NA,NA,NA,NA
"3122","Chasselas","585","585Mtp67","",1986,"24/3/86",NA,NA,NA,NA,1986-03-24,NA,NA,NA,NA,NA,NA,NA,NA,NA
"3123","Chasselas","585","585Mtp67","",1987,NA,"9/6/1987","24/7/87","17/8/87",NA,NA,1987-06-09,1987-07-24,1987-08-17,NA,NA,NA,45,24,NA
"3124","Chasselas","585","585Mtp67","",1988,"25/3/88","30/5/88","22/7/88","12/8/1988",NA,1988-03-25,1988-05-30,1988-07-22,1988-08-12,NA,140,66,53,21,119
"3125","Chasselas","585","585Mtp67","",1994,NA,"25/5/94",NA,NA,NA,NA,1994-05-25,NA,NA,NA,NA,NA,NA,NA,NA
"3126","Chasselas","585","585Mtp67","",1995,"16/3/95",NA,NA,"16/8/95",NA,1995-03-16,NA,NA,1995-08-16,NA,153,NA,NA,NA,NA
"3127","Chasselas","585","585Mtp67","",1996,"16/3/96",NA,NA,NA,NA,1996-03-16,NA,NA,NA,NA,NA,NA,NA,NA,NA
"3128","Chasselas","585","585Mtp67","",1997,"6/3/1997","17/5/97","8/7/1997","27/7/97",NA,1997-03-06,1997-05-17,1997-07-08,1997-07-27,NA,143,72,52,19,124
"3129","Chasselas","585","585Mtp67","",1998,"16/3/98",NA,NA,NA,NA,1998-03-16,NA,NA,NA,NA,NA,NA,NA,NA,NA
"3130","Chasselas","585","585Mtp67","",1999,"19/3/99","24/5/99","8/7/1999","10/8/1999",NA,1999-03-19,1999-05-24,1999-07-08,1999-08-10,NA,144,66,45,33,111
"3131","Chasselas","585","585Mtp67","",2000,"15/3/00","29/5/00","17/7/00","17/8/00",NA,2000-03-15,2000-05-29,2000-07-17,2000-08-17,NA,155,75,49,31,124
"3132","Chasselas","585","585Mtp67","",2010,"1/4/2010","3/6/2010","19/7/10","27/8/10",NA,2010-04-01,2010-06-03,2010-07-19,2010-08-27,NA,148,63,46,39,109
"3133","Chasselas","585","585Mtp67","",2011,"17/3/11","14/5/11","11/7/2011","17/8/11",NA,2011-03-17,2011-05-14,2011-07-11,2011-08-17,NA,153,58,58,37,116
"3134","Chasselas","585","585Mtp67","",2012,"27/3/12","29/5/12","26/7/12","20/8/12",NA,2012-03-27,2012-05-29,2012-07-26,2012-08-20,NA,146,63,58,25,121
"3135","Chasselas","585","585Mtp68","",1964,"20/3/64",NA,NA,"4/8/1964",NA,1964-03-20,NA,NA,1964-08-04,NA,137,NA,NA,NA,NA
"3136","Chasselas","585","585Mtp68","",1965,"27/3/65",NA,NA,"5/8/1965",NA,1965-03-27,NA,NA,1965-08-05,NA,131,NA,NA,NA,NA
"3137","Chasselas","585","585Mtp68","",1966,"12/3/1966",NA,NA,"10/8/1966",NA,1966-03-12,NA,NA,1966-08-10,NA,151,NA,NA,NA,NA
"3138","Chasselas","585","585Mtp68","",1967,"10/3/1967",NA,NA,NA,NA,1967-03-10,NA,NA,NA,NA,NA,NA,NA,NA,NA
"3139","Chasselas","585","585Mtp68","",1968,"26/3/68",NA,NA,"12/8/1968",NA,1968-03-26,NA,NA,1968-08-12,NA,139,NA,NA,NA,NA
"3140","Chasselas","585","585Mtp68","",1969,"25/3/69",NA,NA,"12/8/1969",NA,1969-03-25,NA,NA,1969-08-12,NA,140,NA,NA,NA,NA
"3141","Chasselas","585","585Mtp68","",1970,"28/3/70",NA,NA,NA,NA,1970-03-28,NA,NA,NA,NA,NA,NA,NA,NA,NA
"3142","Chasselas","585","585Mtp68","",1971,"30/3/71",NA,NA,NA,NA,1971-03-30,NA,NA,NA,NA,NA,NA,NA,NA,NA
"3143","Chasselas","585","585Mtp68","",1972,"20/3/72",NA,NA,"17/8/72",NA,1972-03-20,NA,NA,1972-08-17,NA,150,NA,NA,NA,NA
"3144","Chasselas","585","585Mtp68","",1973,"1/7/1973",NA,NA,NA,NA,1973-07-01,NA,NA,NA,NA,NA,NA,NA,NA,NA
"3145","Chasselas","585","585Mtp68","",1974,"22/3/74",NA,NA,NA,NA,1974-03-22,NA,NA,NA,NA,NA,NA,NA,NA,NA
"3146","Chasselas","585","585Mtp68","",1976,"16/3/76",NA,NA,NA,NA,1976-03-16,NA,NA,NA,NA,NA,NA,NA,NA,NA
"3147","Chasselas","585","585Mtp68","",1979,"19/3/79",NA,"23/7/79",NA,NA,1979-03-19,NA,1979-07-23,NA,NA,NA,NA,NA,NA,126
"3148","Chasselas","585","585Mtp68","",1980,"24/3/80",NA,"28/7/80",NA,NA,1980-03-24,NA,1980-07-28,NA,NA,NA,NA,NA,NA,126
"3149","Chasselas","585","585Mtp68","",1981,"27/3/81",NA,"17/7/81",NA,NA,1981-03-27,NA,1981-07-17,NA,NA,NA,NA,NA,NA,112
"3150","Chasselas","585","585Mtp68","",1982,"17/3/82",NA,"5/7/1982",NA,NA,1982-03-17,NA,1982-07-05,NA,NA,NA,NA,NA,NA,110
"3151","Chasselas","585","585Mtp68","",1983,"24/3/83",NA,"22/7/83",NA,NA,1983-03-24,NA,1983-07-22,NA,NA,NA,NA,NA,NA,120
"3152","Chasselas","585","585Mtp68","",1984,"5/4/1984",NA,NA,NA,NA,1984-04-05,NA,NA,NA,NA,NA,NA,NA,NA,NA
"3153","Chasselas","585","585Mtp68","",1985,"1/4/1985",NA,NA,NA,NA,1985-04-01,NA,NA,NA,NA,NA,NA,NA,NA,NA
"3154","Chasselas","585","585Mtp68","",1986,"26/3/86",NA,NA,NA,NA,1986-03-26,NA,NA,NA,NA,NA,NA,NA,NA,NA
"3155","Chasselas","585","585Mtp68","",1987,NA,"10/6/1987","24/7/87","17/8/87",NA,NA,1987-06-10,1987-07-24,1987-08-17,NA,NA,NA,44,24,NA
"3156","Chasselas","585","585Mtp68","",1988,"25/3/88","30/5/88","22/7/88","12/8/1988",NA,1988-03-25,1988-05-30,1988-07-22,1988-08-12,NA,140,66,53,21,119
"3157","Chasselas","585","585Mtp69","",1964,NA,NA,NA,"4/8/1964",NA,NA,NA,NA,1964-08-04,NA,NA,NA,NA,NA,NA
"3158","Chasselas","585","585Mtp69","",1965,"29/3/65",NA,NA,"5/8/1965",NA,1965-03-29,NA,NA,1965-08-05,NA,129,NA,NA,NA,NA
"3159","Chasselas","585","585Mtp69","",1966,"12/3/1966",NA,NA,"10/8/1966",NA,1966-03-12,NA,NA,1966-08-10,NA,151,NA,NA,NA,NA
"3160","Chasselas","585","585Mtp69","",1967,"13/3/67",NA,NA,NA,NA,1967-03-13,NA,NA,NA,NA,NA,NA,NA,NA,NA
"3161","Chasselas","585","585Mtp69","",1968,"25/3/68",NA,NA,"6/8/1968",NA,1968-03-25,NA,NA,1968-08-06,NA,134,NA,NA,NA,NA
"3162","Chasselas","585","585Mtp69","",1969,"22/3/69",NA,NA,"12/8/1969",NA,1969-03-22,NA,NA,1969-08-12,NA,143,NA,NA,NA,NA
"3163","Chasselas","585","585Mtp69","",1972,NA,NA,NA,"17/8/72",NA,NA,NA,NA,1972-08-17,NA,NA,NA,NA,NA,NA
"3164","Chasselas","585","585Mtp70","",1964,"24/3/64",NA,NA,"31/7/64",NA,1964-03-24,NA,NA,1964-07-31,NA,129,NA,NA,NA,NA
"3165","Chasselas","585","585Mtp70","",1965,"31/3/65",NA,NA,"5/8/1965",NA,1965-03-31,NA,NA,1965-08-05,NA,127,NA,NA,NA,NA
"3166","Chasselas","585","585Mtp70","",1966,"12/3/1966",NA,NA,"10/8/1966",NA,1966-03-12,NA,NA,1966-08-10,NA,151,NA,NA,NA,NA
"3167","Chasselas","585","585Mtp70","",1967,"10/3/1967",NA,NA,NA,NA,1967-03-10,NA,NA,NA,NA,NA,NA,NA,NA,NA
"3168","Chasselas","585","585Mtp70","",1968,"27/3/68",NA,NA,"6/8/1968",NA,1968-03-27,NA,NA,1968-08-06,NA,132,NA,NA,NA,NA
"3169","Chasselas","585","585Mtp70","",1969,"27/3/69",NA,NA,"12/8/1969",NA,1969-03-27,NA,NA,1969-08-12,NA,138,NA,NA,NA,NA
"3170","Chasselas","585","585Mtp70","",1970,"29/3/70",NA,NA,NA,NA,1970-03-29,NA,NA,NA,NA,NA,NA,NA,NA,NA
"3171","Chasselas","585","585Mtp70","",1971,"31/3/71",NA,NA,NA,NA,1971-03-31,NA,NA,NA,NA,NA,NA,NA,NA,NA
"3172","Chasselas","585","585Mtp70","",1972,"20/3/72",NA,NA,"17/8/72",NA,1972-03-20,NA,NA,1972-08-17,NA,150,NA,NA,NA,NA
"3173","Chasselas","585","585Mtp70","",1973,"29/3/73",NA,NA,NA,NA,1973-03-29,NA,NA,NA,NA,NA,NA,NA,NA,NA
"3174","Chasselas","585","585Mtp70","",1974,"19/3/74",NA,NA,NA,NA,1974-03-19,NA,NA,NA,NA,NA,NA,NA,NA,NA
"3175","Chasselas","585","585Mtp70","",1976,"17/3/76",NA,NA,NA,NA,1976-03-17,NA,NA,NA,NA,NA,NA,NA,NA,NA
"3176","Chasselas","585","585Mtp70","",1978,"11/3/1978",NA,NA,NA,NA,1978-03-11,NA,NA,NA,NA,NA,NA,NA,NA,NA
"3177","Chasselas","585","585Mtp70","",1979,"18/3/79",NA,"23/7/79",NA,NA,1979-03-18,NA,1979-07-23,NA,NA,NA,NA,NA,NA,127
"3178","Chasselas","585","585Mtp70","",1980,"24/3/80",NA,"1/8/1980",NA,NA,1980-03-24,NA,1980-08-01,NA,NA,NA,NA,NA,NA,130
"3179","Chasselas","585","585Mtp70","",1981,"27/3/81",NA,"23/7/81",NA,NA,1981-03-27,NA,1981-07-23,NA,NA,NA,NA,NA,NA,118
"3180","Chasselas","585","585Mtp70","",1982,"18/3/82",NA,"12/7/1982",NA,NA,1982-03-18,NA,1982-07-12,NA,NA,NA,NA,NA,NA,116
"3181","Chasselas","585","585Mtp70","",1983,"24/3/83",NA,"22/7/83",NA,NA,1983-03-24,NA,1983-07-22,NA,NA,NA,NA,NA,NA,120
"3182","Chasselas","585","585Mtp70","",1984,"2/4/1984",NA,NA,NA,NA,1984-04-02,NA,NA,NA,NA,NA,NA,NA,NA,NA
"3183","Chasselas","585","585Mtp70","",1985,"1/4/1985",NA,NA,"16/8/95",NA,1985-04-01,NA,NA,1995-08-16,NA,3789,NA,NA,NA,NA
"3184","Chasselas","585","585Mtp70","",1986,"26/3/86",NA,NA,NA,NA,1986-03-26,NA,NA,NA,NA,NA,NA,NA,NA,NA
"3185","Chasselas","585","585Mtp70","",1987,NA,"7/6/1987","24/7/87","17/8/87",NA,NA,1987-06-07,1987-07-24,1987-08-17,NA,NA,NA,47,24,NA
"3186","Chasselas","585","585Mtp70","",1988,"25/3/88","30/5/88","23/7/88","12/8/1988",NA,1988-03-25,1988-05-30,1988-07-23,1988-08-12,NA,140,66,54,20,120
"3187","Chasselas","585","585Mtp70","",1994,NA,"25/5/94",NA,NA,NA,NA,1994-05-25,NA,NA,NA,NA,NA,NA,NA,NA
"3188","Chasselas","585","585Mtp70","",1995,"20/3/95","27/3/95","20/7/95","16/8/95",NA,1995-03-20,1995-03-27,1995-07-20,1995-08-16,NA,149,7,115,27,122
"3189","Chasselas","585","585Mtp70","",1996,"22/3/96",NA,NA,NA,NA,1996-03-22,NA,NA,NA,NA,NA,NA,NA,NA,NA
"3190","Chasselas","585","585Mtp70","",1997,"2/3/1997","14/5/97","3/7/1997","21/7/97",NA,1997-03-02,1997-05-14,1997-07-03,1997-07-21,NA,141,73,50,18,123
"3191","Chasselas","585","585Mtp70","",1998,"15/3/98","27/5/98","16/7/98","10/8/1998",NA,1998-03-15,1998-05-27,1998-07-16,1998-08-10,NA,148,73,50,25,123
"3192","Chasselas","585","585Mtp70","",1999,"17/3/99","24/5/99","10/7/1999","7/8/1999",NA,1999-03-17,1999-05-24,1999-07-10,1999-08-07,NA,143,68,47,28,115
"3193","Chasselas","585","585Mtp70","",2000,"18/3/00","30/5/00","21/7/00","17/8/00",NA,2000-03-18,2000-05-30,2000-07-21,2000-08-17,NA,152,73,52,27,125
"3194","Chasselas","585","585Mtp70","",2001,"4/3/2001","24/5/01","11/7/2001","17/8/01",NA,2001-03-04,2001-05-24,2001-07-11,2001-08-17,NA,166,81,48,37,129
"3195","Chasselas","585","585Mtp70","",2002,"14/3/02","31/5/02","15/7/02","20/8/02",NA,2002-03-14,2002-05-31,2002-07-15,2002-08-20,NA,159,78,45,36,123
"3196","Chasselas","585","585Mtp70","",2003,"24/3/03","30/5/03","22/7/03","13/8/03",NA,2003-03-24,2003-05-30,2003-07-22,2003-08-13,NA,142,67,53,22,120
"3197","Chasselas","585","585Mtp70","",2004,"19/3/04","4/6/2004","28/7/04","19/8/04",NA,2004-03-19,2004-06-04,2004-07-28,2004-08-19,NA,153,77,54,22,131
"3198","Chasselas","585","585Mtp70","",2005,"2/4/2005","3/6/2005","29/7/05","22/8/05",NA,2005-04-02,2005-06-03,2005-07-29,2005-08-22,NA,142,62,56,24,118
"3199","Chasselas","585","585Mtp70","",2006,"26/3/06","27/5/06","22/7/06","8/8/2006",NA,2006-03-26,2006-05-27,2006-07-22,2006-08-08,NA,135,62,56,17,118
"3200","Chasselas","585","585Mtp70","",2007,"8/3/2007","19/5/07","12/7/2007","13/8/07",NA,2007-03-08,2007-05-19,2007-07-12,2007-08-13,NA,158,72,54,32,126
"3201","Chasselas","585","585Mtp70","",2008,"4/3/2008","23/5/08",NA,NA,NA,2008-03-04,2008-05-23,NA,NA,NA,NA,80,NA,NA,NA
"3202","Chasselas","585","585Mtp70","",2009,"19/3/09",NA,NA,NA,NA,2009-03-19,NA,NA,NA,NA,NA,NA,NA,NA,NA
"3203","Chasselas","585","585Mtp71","",1964,"26/3/64",NA,NA,"4/8/1964",NA,1964-03-26,NA,NA,1964-08-04,NA,131,NA,NA,NA,NA
"3204","Chasselas","585","585Mtp71","",1965,"31/3/65",NA,NA,"5/8/1965",NA,1965-03-31,NA,NA,1965-08-05,NA,127,NA,NA,NA,NA
"3205","Chasselas","585","585Mtp71","",1966,"14/3/66",NA,NA,"10/8/1966",NA,1966-03-14,NA,NA,1966-08-10,NA,149,NA,NA,NA,NA
"3206","Chasselas","585","585Mtp71","",1967,"18/3/67",NA,NA,NA,NA,1967-03-18,NA,NA,NA,NA,NA,NA,NA,NA,NA
"3207","Chasselas","585","585Mtp71","",1968,"25/3/68",NA,NA,"12/8/1968",NA,1968-03-25,NA,NA,1968-08-12,NA,140,NA,NA,NA,NA
"3208","Chasselas","585","585Mtp71","",1969,"25/3/69",NA,NA,"26/8/69",NA,1969-03-25,NA,NA,1969-08-26,NA,154,NA,NA,NA,NA
"3209","Chasselas","585","585Mtp71","",1972,NA,NA,NA,"21/8/72",NA,NA,NA,NA,1972-08-21,NA,NA,NA,NA,NA,NA
"3210","Chasselas","585","585Mtp72","",1964,"26/3/64",NA,NA,NA,NA,1964-03-26,NA,NA,NA,NA,NA,NA,NA,NA,NA
"3211","Chasselas","585","585Mtp72","",1965,"31/3/65",NA,NA,"5/8/1965",NA,1965-03-31,NA,NA,1965-08-05,NA,127,NA,NA,NA,NA
"3212","Chasselas","585","585Mtp72","",1966,"12/3/1966",NA,NA,"10/8/1966",NA,1966-03-12,NA,NA,1966-08-10,NA,151,NA,NA,NA,NA
"3213","Chasselas","585","585Mtp72","",1967,"14/3/67",NA,NA,NA,NA,1967-03-14,NA,NA,NA,NA,NA,NA,NA,NA,NA
"3214","Chasselas","585","585Mtp72","",1968,"27/3/68",NA,NA,"12/8/1968",NA,1968-03-27,NA,NA,1968-08-12,NA,138,NA,NA,NA,NA
"3215","Chasselas","585","585Mtp72","",1969,"25/3/69",NA,NA,"19/8/69",NA,1969-03-25,NA,NA,1969-08-19,NA,147,NA,NA,NA,NA
"3216","Chasselas","585","585Mtp72","",1972,NA,NA,NA,"21/8/72",NA,NA,NA,NA,1972-08-21,NA,NA,NA,NA,NA,NA
"3217","Chasselas","585","585Mtp72","",1979,NA,NA,"23/7/79",NA,NA,NA,NA,1979-07-23,NA,NA,NA,NA,NA,NA,NA
"3218","Chasselas","585","585Mtp72","",1980,NA,NA,"1/8/1980",NA,NA,NA,NA,1980-08-01,NA,NA,NA,NA,NA,NA,NA
"3219","Chasselas","585","585Mtp72","",1981,"27/3/81",NA,"24/7/81",NA,NA,1981-03-27,NA,1981-07-24,NA,NA,NA,NA,NA,NA,119
"3220","Chasselas","585","585Mtp72","",1982,NA,NA,"15/7/82",NA,NA,NA,NA,1982-07-15,NA,NA,NA,NA,NA,NA,NA
"3221","Chasselas","585","585Mtp72","",1983,"29/3/83",NA,"29/7/83",NA,NA,1983-03-29,NA,1983-07-29,NA,NA,NA,NA,NA,NA,122
"3222","Chasselas","585","585Mtp72","",1986,"28/3/86",NA,NA,NA,NA,1986-03-28,NA,NA,NA,NA,NA,NA,NA,NA,NA
"3223","Chasselas","585","585Mtp72","",1987,NA,"7/6/1987","26/7/87","17/8/87",NA,NA,1987-06-07,1987-07-26,1987-08-17,NA,NA,NA,49,22,NA
"3224","Chasselas","585","585Mtp72","",1988,"30/3/88","1/6/1988","24/7/88","16/8/88",NA,1988-03-30,1988-06-01,1988-07-24,1988-08-16,NA,139,63,53,23,116
"3225","Chasselas","585","585Mtp73","",1965,"27/3/65",NA,NA,"5/8/1965",NA,1965-03-27,NA,NA,1965-08-05,NA,131,NA,NA,NA,NA
"3226","Chasselas","585","585Mtp73","",1966,"14/3/66",NA,NA,"10/8/1966",NA,1966-03-14,NA,NA,1966-08-10,NA,149,NA,NA,NA,NA
"3227","Chasselas","585","585Mtp73","",1967,"13/3/67",NA,NA,"17/8/67",NA,1967-03-13,NA,NA,1967-08-17,NA,157,NA,NA,NA,NA
"3228","Chasselas","585","585Mtp73","",1968,"25/3/68",NA,NA,"12/8/1968",NA,1968-03-25,NA,NA,1968-08-12,NA,140,NA,NA,NA,NA
"3229","Chasselas","585","585Mtp73","",1969,"25/3/69",NA,NA,"19/8/69",NA,1969-03-25,NA,NA,1969-08-19,NA,147,NA,NA,NA,NA
"3230","Chasselas","585","585Mtp73","",1972,NA,NA,NA,"17/8/72",NA,NA,NA,NA,1972-08-17,NA,NA,NA,NA,NA,NA
"3231","Chasselas","585","585Mtp74","",1964,"22/3/64",NA,NA,"11/8/1964",NA,1964-03-22,NA,NA,1964-08-11,NA,142,NA,NA,NA,NA
"3232","Chasselas","585","585Mtp74","",1965,"27/3/65",NA,NA,"5/8/1965",NA,1965-03-27,NA,NA,1965-08-05,NA,131,NA,NA,NA,NA
"3233","Chasselas","585","585Mtp74","",1966,"12/3/1966",NA,NA,"10/8/1966",NA,1966-03-12,NA,NA,1966-08-10,NA,151,NA,NA,NA,NA
"3234","Chasselas","585","585Mtp74","",1967,"13/3/67",NA,NA,NA,NA,1967-03-13,NA,NA,NA,NA,NA,NA,NA,NA,NA
"3235","Chasselas","585","585Mtp74","",1968,"27/3/68",NA,NA,"12/8/1968",NA,1968-03-27,NA,NA,1968-08-12,NA,138,NA,NA,NA,NA
"3236","Chasselas","585","585Mtp74","",1969,"25/3/69",NA,NA,"19/8/69",NA,1969-03-25,NA,NA,1969-08-19,NA,147,NA,NA,NA,NA
"3237","Chasselas","585","585Mtp74","",1972,NA,NA,NA,"21/8/72",NA,NA,NA,NA,1972-08-21,NA,NA,NA,NA,NA,NA
"3238","Chasselas","585","585Mtp75","",1964,"23/3/64",NA,NA,"4/8/1964",NA,1964-03-23,NA,NA,1964-08-04,NA,134,NA,NA,NA,NA
"3239","Chasselas","585","585Mtp75","",1965,"27/3/65",NA,NA,"12/8/1965",NA,1965-03-27,NA,NA,1965-08-12,NA,138,NA,NA,NA,NA
"3240","Chasselas","585","585Mtp75","",1966,"10/3/1966",NA,NA,"10/8/1966",NA,1966-03-10,NA,NA,1966-08-10,NA,153,NA,NA,NA,NA
"3241","Chasselas","585","585Mtp75","",1967,"10/3/1967",NA,NA,NA,NA,1967-03-10,NA,NA,NA,NA,NA,NA,NA,NA,NA
"3242","Chasselas","585","585Mtp75","",1968,"25/3/68",NA,NA,NA,NA,1968-03-25,NA,NA,NA,NA,NA,NA,NA,NA,NA
"3243","Chasselas","585","585Mtp75","",1969,"25/3/69",NA,NA,"26/8/69",NA,1969-03-25,NA,NA,1969-08-26,NA,154,NA,NA,NA,NA
"3244","Chasselas","585","585Mtp75","",1970,"28/3/70",NA,NA,NA,NA,1970-03-28,NA,NA,NA,NA,NA,NA,NA,NA,NA
"3245","Chasselas","585","585Mtp75","",1971,"29/3/71",NA,NA,NA,NA,1971-03-29,NA,NA,NA,NA,NA,NA,NA,NA,NA
"3246","Chasselas","585","585Mtp75","",1972,"18/3/72",NA,NA,"17/8/72",NA,1972-03-18,NA,NA,1972-08-17,NA,152,NA,NA,NA,NA
"3247","Chasselas","585","585Mtp75","",1973,"28/3/73",NA,NA,NA,NA,1973-03-28,NA,NA,NA,NA,NA,NA,NA,NA,NA
"3248","Chasselas","585","585Mtp75","",1974,"22/3/74",NA,NA,NA,NA,1974-03-22,NA,NA,NA,NA,NA,NA,NA,NA,NA
"3249","Chasselas","585","585Mtp75","",1976,"15/3/76",NA,NA,NA,NA,1976-03-15,NA,NA,NA,NA,NA,NA,NA,NA,NA
"3250","Chasselas","585","585Mtp75","",1978,"11/3/1978",NA,NA,NA,NA,1978-03-11,NA,NA,NA,NA,NA,NA,NA,NA,NA
"3251","Chasselas","585","585Mtp75","",1979,"17/3/79",NA,"23/7/79",NA,NA,1979-03-17,NA,1979-07-23,NA,NA,NA,NA,NA,NA,128
"3252","Chasselas","585","585Mtp75","",1980,"20/3/80",NA,"1/8/1980",NA,NA,1980-03-20,NA,1980-08-01,NA,NA,NA,NA,NA,NA,134
"3253","Chasselas","585","585Mtp75","",1981,"24/3/81",NA,"24/7/81",NA,NA,1981-03-24,NA,1981-07-24,NA,NA,NA,NA,NA,NA,122
"3254","Chasselas","585","585Mtp75","",1982,"18/3/82",NA,"15/7/82",NA,NA,1982-03-18,NA,1982-07-15,NA,NA,NA,NA,NA,NA,119
"3255","Chasselas","585","585Mtp75","",1983,"25/3/83",NA,NA,NA,NA,1983-03-25,NA,NA,NA,NA,NA,NA,NA,NA,NA
"3256","Chasselas","585","585Mtp75","",1985,"31/3/85",NA,NA,NA,NA,1985-03-31,NA,NA,NA,NA,NA,NA,NA,NA,NA
"3257","Chasselas","585","585Mtp75","",1986,"26/3/86",NA,NA,NA,NA,1986-03-26,NA,NA,NA,NA,NA,NA,NA,NA,NA
"3258","Chasselas","585","585Mtp75","",1988,"25/3/88","31/5/88","22/7/88","16/8/88",NA,1988-03-25,1988-05-31,1988-07-22,1988-08-16,NA,144,67,52,25,119
"3259","Chasselas","585","585Mtp75","",1995,NA,"29/5/95",NA,NA,NA,NA,1995-05-29,NA,NA,NA,NA,NA,NA,NA,NA
"3260","Chasselas","585","585Mtp75","",2000,"15/3/00",NA,NA,NA,NA,2000-03-15,NA,NA,NA,NA,NA,NA,NA,NA,NA
"3261","Chasselas","585","585Mtp76","",1964,NA,NA,NA,"4/8/1964",NA,NA,NA,NA,1964-08-04,NA,NA,NA,NA,NA,NA
"3262","Chasselas","585","585Mtp76","",1965,"27/3/65",NA,NA,"12/8/1965",NA,1965-03-27,NA,NA,1965-08-12,NA,138,NA,NA,NA,NA
"3263","Chasselas","585","585Mtp76","",1966,"7/3/1966",NA,NA,"10/8/1966",NA,1966-03-07,NA,NA,1966-08-10,NA,156,NA,NA,NA,NA
"3264","Chasselas","585","585Mtp76","",1967,"15/3/67",NA,NA,NA,NA,1967-03-15,NA,NA,NA,NA,NA,NA,NA,NA,NA
"3265","Chasselas","585","585Mtp76","",1968,"25/3/68",NA,NA,NA,NA,1968-03-25,NA,NA,NA,NA,NA,NA,NA,NA,NA
"3266","Chasselas","585","585Mtp76","",1969,"27/3/69",NA,NA,"2/9/1969",NA,1969-03-27,NA,NA,1969-09-02,NA,159,NA,NA,NA,NA
"3267","Chasselas","585","585Mtp76","",1972,NA,NA,NA,"21/8/72",NA,NA,NA,NA,1972-08-21,NA,NA,NA,NA,NA,NA
"3268","Chasselas","585","585Mtp77","",1964,"26/3/64",NA,NA,"4/8/1964",NA,1964-03-26,NA,NA,1964-08-04,NA,131,NA,NA,NA,NA
"3269","Chasselas","585","585Mtp77","",1965,"27/3/65",NA,NA,"5/8/1965",NA,1965-03-27,NA,NA,1965-08-05,NA,131,NA,NA,NA,NA
"3270","Chasselas","585","585Mtp77","",1966,"7/3/1966",NA,NA,"10/8/1966",NA,1966-03-07,NA,NA,1966-08-10,NA,156,NA,NA,NA,NA
"3271","Chasselas","585","585Mtp77","",1967,"13/3/67",NA,NA,NA,NA,1967-03-13,NA,NA,NA,NA,NA,NA,NA,NA,NA
"3272","Chasselas","585","585Mtp77","",1968,"25/3/68",NA,NA,NA,NA,1968-03-25,NA,NA,NA,NA,NA,NA,NA,NA,NA
"3273","Chasselas","585","585Mtp77","",1969,"25/3/69",NA,NA,"26/8/69",NA,1969-03-25,NA,NA,1969-08-26,NA,154,NA,NA,NA,NA
"3274","Chasselas","585","585Mtp77","",1972,NA,NA,NA,"17/8/72",NA,NA,NA,NA,1972-08-17,NA,NA,NA,NA,NA,NA
"3275","Chasselas","585","585Mtp78","",1964,"20/3/64",NA,NA,"4/8/1964",NA,1964-03-20,NA,NA,1964-08-04,NA,137,NA,NA,NA,NA
"3276","Chasselas","585","585Mtp78","",1965,"31/3/65",NA,NA,"5/8/1965",NA,1965-03-31,NA,NA,1965-08-05,NA,127,NA,NA,NA,NA
"3277","Chasselas","585","585Mtp78","",1966,"12/3/1966",NA,NA,"10/8/1966",NA,1966-03-12,NA,NA,1966-08-10,NA,151,NA,NA,NA,NA
"3278","Chasselas","585","585Mtp78","",1967,"13/3/67",NA,NA,NA,NA,1967-03-13,NA,NA,NA,NA,NA,NA,NA,NA,NA
"3279","Chasselas","585","585Mtp78","",1968,"25/3/68",NA,NA,NA,NA,1968-03-25,NA,NA,NA,NA,NA,NA,NA,NA,NA
"3280","Chasselas","585","585Mtp78","",1969,"24/3/69",NA,NA,"19/8/69",NA,1969-03-24,NA,NA,1969-08-19,NA,148,NA,NA,NA,NA
"3281","Chasselas","585","585Mtp78","",1972,NA,NA,NA,"21/8/72",NA,NA,NA,NA,1972-08-21,NA,NA,NA,NA,NA,NA
"3282","Chasselas","585","585Mtp79","",1960,"9/3/1960",NA,NA,NA,NA,1960-03-09,NA,NA,NA,NA,NA,NA,NA,NA,NA
"3283","Chasselas","585","585Mtp79","",1961,NA,NA,NA,"14/8/61",NA,NA,NA,NA,1961-08-14,NA,NA,NA,NA,NA,NA
"3284","Chasselas","585","585Mtp79","",1967,"6/3/1967",NA,NA,NA,NA,1967-03-06,NA,NA,NA,NA,NA,NA,NA,NA,NA
"3285","Chasselas","585","585Mtp79","",1968,"18/3/68",NA,NA,NA,NA,1968-03-18,NA,NA,NA,NA,NA,NA,NA,NA,NA
"3286","Chasselas","585","585Mtp79","",1969,"24/3/69",NA,NA,NA,NA,1969-03-24,NA,NA,NA,NA,NA,NA,NA,NA,NA
"3287","Chasselas","585","585Mtp79","",1970,"25/3/70",NA,NA,NA,NA,1970-03-25,NA,NA,NA,NA,NA,NA,NA,NA,NA
"3288","Chasselas","585","585Mtp80","",1971,"25/3/71",NA,NA,NA,NA,1971-03-25,NA,NA,NA,NA,NA,NA,NA,NA,NA
"3289","Chasselas","585","585Mtp80","",1973,"28/3/73",NA,NA,NA,NA,1973-03-28,NA,NA,NA,NA,NA,NA,NA,NA,NA
"3290","Chasselas","585","585Mtp80","",1974,"16/3/74",NA,NA,"8/8/1974",NA,1974-03-16,NA,NA,1974-08-08,NA,145,NA,NA,NA,NA
"3291","Chasselas","585","585Mtp80","",1975,NA,NA,NA,"13/8/75",NA,NA,NA,NA,1975-08-13,NA,NA,NA,NA,NA,NA
"3292","Chasselas","585","585Mtp80","",1976,NA,NA,"23/7/76",NA,NA,NA,NA,1976-07-23,NA,NA,NA,NA,NA,NA,NA
"3293","Chasselas","585","585Mtp80","",1977,NA,NA,"1/8/1977",NA,NA,NA,NA,1977-08-01,NA,NA,NA,NA,NA,NA,NA
"3294","Chasselas","585","585Mtp80","",1982,"8/3/1982",NA,NA,NA,NA,1982-03-08,NA,NA,NA,NA,NA,NA,NA,NA,NA
"3295","Chasselas","585","585Mtp80","",1985,"25/3/85",NA,NA,NA,NA,1985-03-25,NA,NA,NA,NA,NA,NA,NA,NA,NA
"3296","Chasselas","585","585Mtp80","",1986,"23/3/86",NA,NA,NA,NA,1986-03-23,NA,NA,NA,NA,NA,NA,NA,NA,NA
"3297","Chasselas","585","585Mtp80","",1987,NA,NA,NA,"21/8/87",NA,NA,NA,NA,1987-08-21,NA,NA,NA,NA,NA,NA
"3298","Chasselas","585","585Mtp80","",1988,"21/3/88","1/6/1988","25/7/88","12/8/1988",NA,1988-03-21,1988-06-01,1988-07-25,1988-08-12,NA,144,72,54,18,126
"3299","Chasselas","585","585Mtp80","",1989,"13/3/89","26/5/89",NA,NA,NA,1989-03-13,1989-05-26,NA,NA,NA,NA,74,NA,NA,NA
"3300","Chasselas","585","585Mtp80","",1990,"12/3/1990","20/5/90","12/7/1990","6/8/1990",NA,1990-03-12,1990-05-20,1990-07-12,1990-08-06,NA,147,69,53,25,122
"3301","Chasselas","585","585Mtp80","",1991,"18/3/91","31/5/91","26/7/81","15/8/91",NA,1991-03-18,1991-05-31,1981-07-26,1991-08-15,NA,150,74,-3596,3672,-3522
"3302","Chasselas","585","585Mtp80","",1992,"19/3/92","22/5/92","24/7/92","10/8/1992",NA,1992-03-19,1992-05-22,1992-07-24,1992-08-10,NA,144,64,63,17,127
"3303","Chasselas","585","585Mtp80","",1993,"22/3/93","1/6/1993","25/7/93","13/8/93",NA,1993-03-22,1993-06-01,1993-07-25,1993-08-13,NA,144,71,54,19,125
"3304","Chasselas","585","585Mtp80","",1994,"7/3/1994","22/5/94","18/7/94","8/8/1994",NA,1994-03-07,1994-05-22,1994-07-18,1994-08-08,NA,154,76,57,21,133
"3305","Chasselas","585","585Mtp80","",1995,"16/3/95","29/5/95","20/7/95","16/8/95",NA,1995-03-16,1995-05-29,1995-07-20,1995-08-16,NA,153,74,52,27,126
"3306","Chasselas","585","585Mtp81","",1971,"25/3/71",NA,NA,NA,NA,1971-03-25,NA,NA,NA,NA,NA,NA,NA,NA,NA
"3307","Chasselas","585","585Mtp81","",1972,"6/3/1972",NA,NA,NA,NA,1972-03-06,NA,NA,NA,NA,NA,NA,NA,NA,NA
"3308","Chasselas","585","585Mtp81","",1973,"29/3/73",NA,NA,NA,NA,1973-03-29,NA,NA,NA,NA,NA,NA,NA,NA,NA
"3309","Chasselas","585","585Mtp81","",1974,NA,NA,NA,"8/8/1974",NA,NA,NA,NA,1974-08-08,NA,NA,NA,NA,NA,NA
"3310","Chasselas","585","585Mtp81","",1975,NA,NA,NA,"13/8/75",NA,NA,NA,NA,1975-08-13,NA,NA,NA,NA,NA,NA
"3311","Chasselas","585","585Mtp81","",1976,NA,NA,NA,"10/8/1976",NA,NA,NA,NA,1976-08-10,NA,NA,NA,NA,NA,NA
"3312","Chasselas","585","585Mtp81","",1977,NA,NA,"25/7/77",NA,NA,NA,NA,1977-07-25,NA,NA,NA,NA,NA,NA,NA
"3313","Chasselas","585","585Mtp81","",1982,"15/3/82",NA,NA,NA,NA,1982-03-15,NA,NA,NA,NA,NA,NA,NA,NA,NA
"3314","Chasselas","585","585Mtp81","",1986,"24/3/86",NA,NA,NA,NA,1986-03-24,NA,NA,NA,NA,NA,NA,NA,NA,NA
"3315","Chasselas","585","585Mtp81","",1988,"21/3/88","1/6/1988","22/7/88","12/8/1988",NA,1988-03-21,1988-06-01,1988-07-22,1988-08-12,NA,144,72,51,21,123
"3316","Chasselas","585","585Mtp81","",1989,"13/3/89","26/5/89","17/7/89","8/8/1989",NA,1989-03-13,1989-05-26,1989-07-17,1989-08-08,NA,148,74,52,22,126
"3317","Chasselas","585","585Mtp81","",1990,"8/3/1990","20/5/90","9/7/1990","7/8/1990",NA,1990-03-08,1990-05-20,1990-07-09,1990-08-07,NA,152,73,50,29,123
"3318","Chasselas","585","585Mtp81","",1991,"18/3/91","31/5/91","23/7/91","15/8/91",NA,1991-03-18,1991-05-31,1991-07-23,1991-08-15,NA,150,74,53,23,127
"3319","Chasselas","585","585Mtp81","",1992,"19/3/92","22/5/92","19/7/92","10/8/1992",NA,1992-03-19,1992-05-22,1992-07-19,1992-08-10,NA,144,64,58,22,122
"3320","Chasselas","585","585Mtp81","",1993,"22/3/93","31/5/93","25/7/93","13/8/93",NA,1993-03-22,1993-05-31,1993-07-25,1993-08-13,NA,144,70,55,19,125
"3321","Chasselas","585","585Mtp81","",1994,"7/3/1994","22/5/94","18/7/94","8/8/1994",NA,1994-03-07,1994-05-22,1994-07-18,1994-08-08,NA,154,76,57,21,133
"3322","Chasselas","585","585Mtp81","",1995,"16/3/95","29/5/95","20/7/95","16/8/95",NA,1995-03-16,1995-05-29,1995-07-20,1995-08-16,NA,153,74,52,27,126
"3323","Chasselas","585","585Mtp82","",1969,"17/3/69",NA,NA,NA,NA,1969-03-17,NA,NA,NA,NA,NA,NA,NA,NA,NA
"3324","Chasselas","585","585Mtp82","",1970,"26/3/70",NA,NA,NA,NA,1970-03-26,NA,NA,NA,NA,NA,NA,NA,NA,NA
"3325","Chasselas","585","585Mtp82","",1971,"29/3/71",NA,NA,"23/8/71",NA,1971-03-29,NA,NA,1971-08-23,NA,147,NA,NA,NA,NA
"3326","Chasselas","585","585Mtp82","",1973,"26/3/73",NA,NA,NA,NA,1973-03-26,NA,NA,NA,NA,NA,NA,NA,NA,NA
"3327","Chasselas","585","585Mtp82","",1977,NA,NA,"25/7/77",NA,NA,NA,NA,1977-07-25,NA,NA,NA,NA,NA,NA,NA
"3328","Chasselas","585","585Mtp82","",1982,"8/3/1982",NA,NA,NA,NA,1982-03-08,NA,NA,NA,NA,NA,NA,NA,NA,NA
"3329","Chasselas","585","585Mtp82","",1985,"27/3/85",NA,NA,NA,NA,1985-03-27,NA,NA,NA,NA,NA,NA,NA,NA,NA
"3330","Chasselas","585","585Mtp82","",1986,"24/3/86",NA,NA,NA,NA,1986-03-24,NA,NA,NA,NA,NA,NA,NA,NA,NA
"3331","Chasselas","585","585Mtp82","",1987,NA,NA,NA,"21/8/87",NA,NA,NA,NA,1987-08-21,NA,NA,NA,NA,NA,NA
"3332","Chasselas","585","585Mtp82","",1988,NA,NA,NA,"14/8/88",NA,NA,NA,NA,1988-08-14,NA,NA,NA,NA,NA,NA
"3333","Chasselas","585","585Mtp82","",1989,"13/3/89","26/5/89","17/7/89","11/8/1989",NA,1989-03-13,1989-05-26,1989-07-17,1989-08-11,NA,151,74,52,25,126
"3334","Chasselas","585","585Mtp83","",1966,NA,NA,NA,"30/8/66",NA,NA,NA,NA,1966-08-30,NA,NA,NA,NA,NA,NA
"3335","Chasselas","585","585Mtp83","",1967,NA,NA,NA,"8/8/1967",NA,NA,NA,NA,1967-08-08,NA,NA,NA,NA,NA,NA
"3336","Chasselas","585","585Mtp83","",1968,"23/3/68",NA,NA,NA,NA,1968-03-23,NA,NA,NA,NA,NA,NA,NA,NA,NA
"3337","Chasselas","585","585Mtp83","",1969,"23/3/69",NA,NA,"19/8/69",NA,1969-03-23,NA,NA,1969-08-19,NA,149,NA,NA,NA,NA
"3338","Chasselas","585","585Mtp83","",1970,"23/3/70",NA,NA,"24/8/70",NA,1970-03-23,NA,NA,1970-08-24,NA,154,NA,NA,NA,NA
"3339","Chasselas","585","585Mtp83","",1972,NA,NA,NA,"21/8/72",NA,NA,NA,NA,1972-08-21,NA,NA,NA,NA,NA,NA
"3340","Chasselas","585","585Mtp84","",1966,NA,NA,NA,"18/8/66",NA,NA,NA,NA,1966-08-18,NA,NA,NA,NA,NA,NA
"3341","Chasselas","585","585Mtp84","",1967,NA,NA,NA,"8/8/1967",NA,NA,NA,NA,1967-08-08,NA,NA,NA,NA,NA,NA
"3342","Chasselas","585","585Mtp84","",1968,"21/3/68",NA,NA,NA,NA,1968-03-21,NA,NA,NA,NA,NA,NA,NA,NA,NA
"3343","Chasselas","585","585Mtp84","",1969,"24/3/69",NA,NA,"19/8/68",NA,1969-03-24,NA,NA,1968-08-19,NA,-217,NA,NA,NA,NA
"3344","Chasselas","585","585Mtp84","",1970,"26/3/70",NA,NA,"24/8/70",NA,1970-03-26,NA,NA,1970-08-24,NA,151,NA,NA,NA,NA
"3345","Chasselas","585","585Mtp84","",1972,NA,NA,NA,"21/8/72",NA,NA,NA,NA,1972-08-21,NA,NA,NA,NA,NA,NA
"3346","Chasselas","585","585Mtp85","",1967,NA,NA,NA,"8/8/1967",NA,NA,NA,NA,1967-08-08,NA,NA,NA,NA,NA,NA
"3347","Chasselas","585","585Mtp85","",1969,NA,NA,NA,"19/8/69",NA,NA,NA,NA,1969-08-19,NA,NA,NA,NA,NA,NA
"3348","Chasselas","585","585Mtp85","",1970,NA,NA,NA,"17/8/70",NA,NA,NA,NA,1970-08-17,NA,NA,NA,NA,NA,NA
"3349","Chasselas","585","585Mtp85","",1972,NA,NA,NA,"16/8/72",NA,NA,NA,NA,1972-08-16,NA,NA,NA,NA,NA,NA
"3350","Chasselas","585","585Mtp87","",1977,"5/3/1977",NA,NA,"10/8/1977",NA,1977-03-05,NA,NA,1977-08-10,NA,158,NA,NA,NA,NA
"3351","Chasselas","585","585Mtp87","",1978,"11/3/1978",NA,NA,"17/8/78",NA,1978-03-11,NA,NA,1978-08-17,NA,159,NA,NA,NA,NA
"3352","Chasselas","585","585Mtp87","",1979,"13/3/79",NA,NA,"8/8/1979",NA,1979-03-13,NA,NA,1979-08-08,NA,148,NA,NA,NA,NA
"3353","Chasselas","585","585Mtp87","",1981,NA,NA,NA,"14/8/81",NA,NA,NA,NA,1981-08-14,NA,NA,NA,NA,NA,NA
"3354","Chasselas","585","585Mtp87","",1992,NA,"23/5/92","18/7/92",NA,NA,NA,1992-05-23,1992-07-18,NA,NA,NA,NA,56,NA,NA
"3355","Chasselas","585","585Mtp87","",1995,NA,"27/5/95","20/7/95","16/8/95",NA,NA,1995-05-27,1995-07-20,1995-08-16,NA,NA,NA,54,27,NA
"3356","Chasselas","585","585Mtp87","",1996,"18/3/96",NA,NA,NA,NA,1996-03-18,NA,NA,NA,NA,NA,NA,NA,NA,NA
"3357","Chasselas","585","585Mtp87","",1997,"28/2/97","14/5/97","8/7/1997","27/7/97",NA,1997-02-28,1997-05-14,1997-07-08,1997-07-27,NA,149,75,55,19,130
"3358","Chasselas","585","585Mtp88","",1982,"8/3/1982",NA,NA,NA,NA,1982-03-08,NA,NA,NA,NA,NA,NA,NA,NA,NA
"3359","Chasselas","585","585Mtp88","",1985,"27/3/85",NA,NA,NA,NA,1985-03-27,NA,NA,NA,NA,NA,NA,NA,NA,NA
"3360","Chasselas","585","585Mtp88","",1987,"24/3/87",NA,NA,NA,NA,1987-03-24,NA,NA,NA,NA,NA,NA,NA,NA,NA
"3361","Chasselas","585","585Mtp90","",2002,"13/3/02","23/5/02","9/7/2002","20/8/02",NA,2002-03-13,2002-05-23,2002-07-09,2002-08-20,NA,160,71,47,42,118
"3362","Chasselas","585","585Mtp90","",2003,"26/3/03","30/5/03","18/7/03","8/8/2003",NA,2003-03-26,2003-05-30,2003-07-18,2003-08-08,NA,135,65,49,21,114
"3363","Chasselas","585","585Mtp90","",2004,"19/3/04","2/6/2004","28/7/04","24/8/04",NA,2004-03-19,2004-06-02,2004-07-28,2004-08-24,NA,158,75,56,27,131
"3364","Chasselas","585","585Mtp90","",2005,"31/3/05","31/5/05","25/7/05","23/8/05",NA,2005-03-31,2005-05-31,2005-07-25,2005-08-23,NA,145,61,55,29,116
"3365","Chasselas","585","585Mtp90","",2006,"24/3/06","26/5/06","22/7/06","8/8/2006",NA,2006-03-24,2006-05-26,2006-07-22,2006-08-08,NA,137,63,57,17,120
"3366","Chasselas","585","585Mtp90","",2007,"7/3/2007","18/5/07","12/7/2007","13/8/07",NA,2007-03-07,2007-05-18,2007-07-12,2007-08-13,NA,159,72,55,32,127
"3367","Chasselas","585","585Mtp90","",2008,"7/3/2008","23/5/08","17/7/08","13/8/08",NA,2008-03-07,2008-05-23,2008-07-17,2008-08-13,NA,159,77,55,27,132
"3368","Chasselas","585","585Mtp90","",2009,"16/3/09","28/5/09","17/7/09","17/8/09",NA,2009-03-16,2009-05-28,2009-07-17,2009-08-17,NA,154,73,50,31,123
"3369","Chasselas","585","585Mtp90","",2010,"25/3/10","27/5/10","26/7/10","27/8/10",NA,2010-03-25,2010-05-27,2010-07-26,2010-08-27,NA,155,63,60,32,123
"3370","Chasselas","585","585Mtp90","",2011,"11/3/2011","11/5/2011","11/7/2011","18/8/11",NA,2011-03-11,2011-05-11,2011-07-11,2011-08-18,NA,160,61,61,38,122
"3371","Chasselas","585","585Mtp90","",2012,"26/3/12","26/5/12","20/7/12","16/8/12",NA,2012-03-26,2012-05-26,2012-07-20,2012-08-16,NA,143,61,55,27,116
"3372","Chasselas","585","585Mtp90","",2013,"22/3/13","3/6/2013","26/7/13",NA,NA,2013-03-22,2013-06-03,2013-07-26,NA,NA,NA,73,53,NA,126
"3373","Chasselas","585","585Mtp91","",2002,"10/3/2002","27/5/02","9/7/2002","20/8/02",NA,2002-03-10,2002-05-27,2002-07-09,2002-08-20,NA,163,78,43,42,121
"3374","Chasselas","585","585Mtp91","",2003,"22/3/03","26/5/03","18/7/03","11/8/2003",NA,2003-03-22,2003-05-26,2003-07-18,2003-08-11,NA,142,65,53,24,118
"3375","Chasselas","585","585Mtp91","",2004,"20/3/04","2/6/2004","28/7/04","24/8/04",NA,2004-03-20,2004-06-02,2004-07-28,2004-08-24,NA,157,74,56,27,130
"3376","Chasselas","585","585Mtp91","",2005,"1/4/2005","31/5/05","25/7/05","28/8/05",NA,2005-04-01,2005-05-31,2005-07-25,2005-08-28,NA,149,60,55,34,115
"3377","Chasselas","585","585Mtp91","",2006,"24/3/06","25/5/06","24/7/06","8/8/2006",NA,2006-03-24,2006-05-25,2006-07-24,2006-08-08,NA,137,62,60,15,122
"3378","Chasselas","585","585Mtp91","",2007,"6/3/2007",NA,"17/7/07","14/8/07",NA,2007-03-06,NA,2007-07-17,2007-08-14,NA,161,NA,NA,28,133
"3379","Chasselas","585","585Mtp91","",2008,"4/3/2008","23/5/08","17/7/08","13/8/08",NA,2008-03-04,2008-05-23,2008-07-17,2008-08-13,NA,162,80,55,27,135
"3380","Chasselas","585","585Mtp91","",2009,"13/3/09","2/6/2009","21/7/09","17/8/09",NA,2009-03-13,2009-06-02,2009-07-21,2009-08-17,NA,157,81,49,27,130
"3381","Chasselas","585","585Mtp91","",2010,"23/3/10","3/6/2010","26/7/11","27/8/10",NA,2010-03-23,2010-06-03,2011-07-26,2010-08-27,NA,157,72,418,-333,490
"3382","Chasselas","585","585Mtp91","",2011,"13/3/11","10/5/2011","12/7/2011","18/8/11",NA,2011-03-13,2011-05-10,2011-07-12,2011-08-18,NA,158,58,63,37,121
"3383","Chasselas","585","585Mtp91","",2012,"27/3/12","26/5/12","20/7/12","16/8/12",NA,2012-03-27,2012-05-26,2012-07-20,2012-08-16,NA,142,60,55,27,115
"3384","Chasselas","585","585Mtp91","",2013,"21/3/13","3/6/2013","26/7/13",NA,NA,2013-03-21,2013-06-03,2013-07-26,NA,NA,NA,74,53,NA,127
"3385","Chasselas","585","585Mtp89","",1974,"16/3/74",NA,"24/7/74","2/8/1974",NA,1974-03-16,NA,1974-07-24,1974-08-02,NA,139,NA,NA,9,130
"3386","Chasselas","585","585Mtp89","",1975,"6/3/1975",NA,"28/7/75","13/8/75",NA,1975-03-06,NA,1975-07-28,1975-08-13,NA,160,NA,NA,16,144
"3387","Chasselas","585","585Mtp89","",1976,"18/3/76",NA,"20/7/76","10/8/1976",NA,1976-03-18,NA,1976-07-20,1976-08-10,NA,145,NA,NA,21,124
"3388","GrenacheNoir","34","34Mtp1","",1956,"2/4/1956",NA,NA,"17/9/56",NA,1956-04-02,NA,NA,1956-09-17,NA,168,NA,NA,NA,NA
"3389","GrenacheNoir","34","34Mtp1","",1957,"15/3/57",NA,NA,"16/9/57",NA,1957-03-15,NA,NA,1957-09-16,NA,185,NA,NA,NA,NA
"3390","GrenacheNoir","34","34Mtp1","",1958,"1/4/1958",NA,NA,"3/9/1958",NA,1958-04-01,NA,NA,1958-09-03,NA,155,NA,NA,NA,NA
"3391","GrenacheNoir","34","34Mtp1","",2000,"25/3/00",NA,NA,NA,NA,2000-03-25,NA,NA,NA,NA,NA,NA,NA,NA,NA
"3392","GrenacheNoir","34","34Mtp2","",1956,"3/4/1956",NA,NA,"17/9/56",NA,1956-04-03,NA,NA,1956-09-17,NA,167,NA,NA,NA,NA
"3393","GrenacheNoir","34","34Mtp2","",1957,"18/3/57",NA,NA,"1/10/1957",NA,1957-03-18,NA,NA,1957-10-01,NA,197,NA,NA,NA,NA
"3394","GrenacheNoir","34","34Mtp2","",1958,"31/3/58",NA,NA,"3/9/1958",NA,1958-03-31,NA,NA,1958-09-03,NA,156,NA,NA,NA,NA
"3395","GrenacheNoir","34","34Mtp2","",1959,NA,NA,NA,"31/8/59",NA,NA,NA,NA,1959-08-31,NA,NA,NA,NA,NA,NA
"3396","GrenacheNoir","34","34Mtp3","",1956,"1/4/1956",NA,NA,"24/9/56",NA,1956-04-01,NA,NA,1956-09-24,NA,176,NA,NA,NA,NA
"3397","GrenacheNoir","34","34Mtp3","",1957,"15/3/57",NA,NA,"1/10/1957",NA,1957-03-15,NA,NA,1957-10-01,NA,200,NA,NA,NA,NA
"3398","GrenacheNoir","34","34Mtp3","",1958,"1/4/1958",NA,NA,"3/9/1958",NA,1958-04-01,NA,NA,1958-09-03,NA,155,NA,NA,NA,NA
"3399","GrenacheNoir","34","34Mtp3","",1959,NA,NA,NA,"31/8/59",NA,NA,NA,NA,1959-08-31,NA,NA,NA,NA,NA,NA
"3400","GrenacheNoir","34","34Mtp3","",1976,NA,NA,"12/8/1976",NA,NA,NA,NA,1976-08-12,NA,NA,NA,NA,NA,NA,NA
"3401","GrenacheNoir","34","34Mtp3","",1977,NA,NA,"22/8/77",NA,NA,NA,NA,1977-08-22,NA,NA,NA,NA,NA,NA,NA
"3402","GrenacheNoir","34","34Mtp3","",1978,NA,NA,"16/8/78",NA,NA,NA,NA,1978-08-16,NA,NA,NA,NA,NA,NA,NA
"3403","GrenacheNoir","34","34Mtp3","",1987,NA,"9/6/1987","6/8/1987","21/9/87",NA,NA,1987-06-09,1987-08-06,1987-09-21,NA,NA,NA,58,46,NA
"3404","GrenacheNoir","34","34Mtp3","",1988,"28/3/88","1/6/1988","5/8/1988","19/9/88",NA,1988-03-28,1988-06-01,1988-08-05,1988-09-19,NA,175,65,65,45,130
"3405","GrenacheNoir","34","34Mtp3","",1989,"20/3/89","26/5/89","2/8/1989","4/9/1989",NA,1989-03-20,1989-05-26,1989-08-02,1989-09-04,NA,168,67,68,33,135
"3406","GrenacheNoir","34","34Mtp3","",1990,"19/3/90","23/5/90","31/7/90","3/9/1990",NA,1990-03-19,1990-05-23,1990-07-31,1990-09-03,NA,168,65,69,34,134
"3407","GrenacheNoir","34","34Mtp3","",1991,"29/3/91","3/6/1991","15/8/91","12/9/1991",NA,1991-03-29,1991-06-03,1991-08-15,1991-09-12,NA,167,66,73,28,139
"3408","GrenacheNoir","34","34Mtp3","",1992,"26/3/92","26/5/92","10/8/1992","7/9/1992",NA,1992-03-26,1992-05-26,1992-08-10,1992-09-07,NA,165,61,76,28,137
"3409","GrenacheNoir","34","34Mtp3","",1993,"25/3/93","28/5/93","9/8/1993","13/9/93",NA,1993-03-25,1993-05-28,1993-08-09,1993-09-13,NA,172,64,73,35,137
"3410","GrenacheNoir","34","34Mtp3","",1994,"14/3/94","26/5/94","1/8/1994","5/9/1994",NA,1994-03-14,1994-05-26,1994-08-01,1994-09-05,NA,175,73,67,35,140
"3411","GrenacheNoir","34","34Mtp3","",1995,"27/3/95","2/6/1995","12/8/1995","11/9/1995",NA,1995-03-27,1995-06-02,1995-08-12,1995-09-11,NA,168,67,71,30,138
"3412","GrenacheNoir","34","34Mtp3","",1996,"18/3/96","29/5/96","12/8/1996","12/9/1996",NA,1996-03-18,1996-05-29,1996-08-12,1996-09-12,NA,178,72,75,31,147
"3413","GrenacheNoir","34","34Mtp3","",1997,"3/3/1997","17/5/97","27/7/97","1/9/1997",NA,1997-03-03,1997-05-17,1997-07-27,1997-09-01,NA,182,75,71,36,146
"3414","GrenacheNoir","34","34Mtp3","",1998,"4/3/1998","22/5/98","4/8/1998","3/9/1998",NA,1998-03-04,1998-05-22,1998-08-04,1998-09-03,NA,183,79,74,30,153
"3415","GrenacheNoir","34","34Mtp3","",1999,"18/3/99","28/5/99","3/8/1999","31/8/99",NA,1999-03-18,1999-05-28,1999-08-03,1999-08-31,NA,166,71,67,28,138
"3416","GrenacheNoir","34","34Mtp3","",2000,"25/3/00","29/5/00","7/8/2000","4/9/2000",NA,2000-03-25,2000-05-29,2000-08-07,2000-09-04,NA,163,65,70,28,135
"3417","GrenacheNoir","34","34Mtp3","",2001,"14/3/01","27/5/01","6/8/2001","28/8/01",NA,2001-03-14,2001-05-27,2001-08-06,2001-08-28,NA,167,74,71,22,145
"3418","GrenacheNoir","34","34Mtp3","",2002,"12/3/2002",NA,NA,NA,NA,2002-03-12,NA,NA,NA,NA,NA,NA,NA,NA,NA
"3419","GrenacheNoir","34","34Mtp3","",2003,"26/3/03","30/5/03","5/8/2003","23/8/03",NA,2003-03-26,2003-05-30,2003-08-05,2003-08-23,NA,150,65,67,18,132
"3420","GrenacheNoir","34","34Mtp3","",2004,"21/3/04","4/6/2004","2/8/2004","24/8/04",NA,2004-03-21,2004-06-04,2004-08-02,2004-08-24,NA,156,75,59,22,134
"3421","GrenacheNoir","34","34Mtp3","",2005,"1/4/2005","2/6/2005","5/8/2005","30/8/05",NA,2005-04-01,2005-06-02,2005-08-05,2005-08-30,NA,151,62,64,25,126
"3422","GrenacheNoir","34","34Mtp3","",2006,"26/3/06","26/5/06","2/8/2006","30/8/06",NA,2006-03-26,2006-05-26,2006-08-02,2006-08-30,NA,157,61,68,28,129
"3423","GrenacheNoir","34","34Mtp3","",2007,"11/3/2007","20/5/07","24/7/07","20/8/07",NA,2007-03-11,2007-05-20,2007-07-24,2007-08-20,NA,162,70,65,27,135
"3424","GrenacheNoir","34","34Mtp3","",2008,"5/3/2008","28/5/08","31/7/08","27/8/08",NA,2008-03-05,2008-05-28,2008-07-31,2008-08-27,NA,175,84,64,27,148
"3425","GrenacheNoir","34","34Mtp3","",2009,"21/3/09","26/5/09","27/7/09","18/8/09",NA,2009-03-21,2009-05-26,2009-07-27,2009-08-18,NA,150,66,62,22,128
"3426","GrenacheNoir","34","34Mtp3","",2010,"24/3/10","31/5/10","2/8/2010","2/9/2010",NA,2010-03-24,2010-05-31,2010-08-02,2010-09-02,NA,162,68,63,31,131
"3427","GrenacheNoir","34","34Mtp3","",2011,"18/3/11","17/5/11","25/7/11","18/8/11",NA,2011-03-18,2011-05-17,2011-07-25,2011-08-18,NA,153,60,69,24,129
"3428","GrenacheNoir","34","34Mtp3","",2012,"18/3/12","29/5/12","3/8/2012","6/9/2012",NA,2012-03-18,2012-05-29,2012-08-03,2012-09-06,NA,172,72,66,34,138
"3429","GrenacheNoir","34","34Mtp4","",1956,"2/4/1956",NA,NA,"17/9/56",NA,1956-04-02,NA,NA,1956-09-17,NA,168,NA,NA,NA,NA
"3430","GrenacheNoir","34","34Mtp4","",1957,"19/3/57",NA,NA,"1/10/1957",NA,1957-03-19,NA,NA,1957-10-01,NA,196,NA,NA,NA,NA
"3431","GrenacheNoir","34","34Mtp4","",1958,"1/4/1958",NA,NA,"3/9/1958",NA,1958-04-01,NA,NA,1958-09-03,NA,155,NA,NA,NA,NA
"3432","GrenacheNoir","34","34Mtp4","",1959,NA,NA,NA,"31/8/59",NA,NA,NA,NA,1959-08-31,NA,NA,NA,NA,NA,NA
"3433","GrenacheNoir","34","34Mtp4","",1976,NA,NA,"5/8/1976",NA,NA,NA,NA,1976-08-05,NA,NA,NA,NA,NA,NA,NA
"3434","GrenacheNoir","34","34Mtp4","",1977,NA,NA,"16/8/77",NA,NA,NA,NA,1977-08-16,NA,NA,NA,NA,NA,NA,NA
"3435","GrenacheNoir","34","34Mtp4","",1978,NA,NA,"16/8/78",NA,NA,NA,NA,1978-08-16,NA,NA,NA,NA,NA,NA,NA
"3436","GrenacheNoir","34","34Mtp4","",1987,NA,"7/6/1987","6/8/1987","14/9/87",NA,NA,1987-06-07,1987-08-06,1987-09-14,NA,NA,NA,60,39,NA
"3437","GrenacheNoir","34","34Mtp4","",1988,"30/3/88","1/6/1988","5/8/1988","19/9/88",NA,1988-03-30,1988-06-01,1988-08-05,1988-09-19,NA,173,63,65,45,128
"3438","GrenacheNoir","34","34Mtp4","",1989,"20/3/89","26/5/89","1/8/1989","28/8/89",NA,1989-03-20,1989-05-26,1989-08-01,1989-08-28,NA,161,67,67,27,134
"3439","GrenacheNoir","34","34Mtp4","",1990,"19/3/90","23/5/90","31/7/90","3/9/1990",NA,1990-03-19,1990-05-23,1990-07-31,1990-09-03,NA,168,65,69,34,134
"3440","GrenacheNoir","34","34Mtp4","",1991,"25/3/91","3/6/1991","13/8/91","12/9/1991",NA,1991-03-25,1991-06-03,1991-08-13,1991-09-12,NA,171,70,71,30,141
"3441","GrenacheNoir","34","34Mtp4","",1992,"23/3/92","26/5/92","4/8/1992","7/9/1992",NA,1992-03-23,1992-05-26,1992-08-04,1992-09-07,NA,168,64,70,34,134
"3442","GrenacheNoir","34","34Mtp4","",1993,"25/3/93","28/5/93","9/8/1993","13/9/93",NA,1993-03-25,1993-05-28,1993-08-09,1993-09-13,NA,172,64,73,35,137
"3443","GrenacheNoir","34","34Mtp4","",1994,"14/3/94","26/5/94","1/8/1994","5/9/1994",NA,1994-03-14,1994-05-26,1994-08-01,1994-09-05,NA,175,73,67,35,140
"3444","GrenacheNoir","34","34Mtp4","",1995,"23/3/95","29/5/95","12/8/1995","11/9/1995",NA,1995-03-23,1995-05-29,1995-08-12,1995-09-11,NA,172,67,75,30,142
"3445","GrenacheNoir","34","34Mtp4","",1998,"12/3/1998",NA,NA,NA,NA,1998-03-12,NA,NA,NA,NA,NA,NA,NA,NA,NA
"3446","GrenacheNoir","34","34Mtp4","",1999,"19/3/99","25/5/99","30/7/99","31/8/99",NA,1999-03-19,1999-05-25,1999-07-30,1999-08-31,NA,165,67,66,32,133
"3447","GrenacheNoir","34","34Mtp4","",2000,"31/3/00","29/5/00","7/8/2000",NA,NA,2000-03-31,2000-05-29,2000-08-07,NA,NA,NA,59,70,NA,129
"3448","GrenacheNoir","34","34Mtp5","",1956,"3/4/1956",NA,NA,"17/9/56",NA,1956-04-03,NA,NA,1956-09-17,NA,167,NA,NA,NA,NA
"3449","GrenacheNoir","34","34Mtp5","",1957,"18/3/57",NA,NA,"23/9/57",NA,1957-03-18,NA,NA,1957-09-23,NA,189,NA,NA,NA,NA
"3450","GrenacheNoir","34","34Mtp5","",1958,"1/4/1958",NA,NA,"3/9/1958",NA,1958-04-01,NA,NA,1958-09-03,NA,155,NA,NA,NA,NA
"3451","GrenacheNoir","34","34Mtp5","",1959,NA,NA,NA,"31/8/59",NA,NA,NA,NA,1959-08-31,NA,NA,NA,NA,NA,NA
"3452","GrenacheNoir","34","34Mtp6","",1956,"3/4/1956",NA,NA,"17/9/56",NA,1956-04-03,NA,NA,1956-09-17,NA,167,NA,NA,NA,NA
"3453","GrenacheNoir","34","34Mtp6","",1957,"17/3/57",NA,NA,"23/9/57",NA,1957-03-17,NA,NA,1957-09-23,NA,190,NA,NA,NA,NA
"3454","GrenacheNoir","34","34Mtp6","",1958,"29/3/58",NA,NA,"3/9/1958",NA,1958-03-29,NA,NA,1958-09-03,NA,158,NA,NA,NA,NA
"3455","GrenacheNoir","34","34Mtp6","",1959,NA,NA,NA,"7/9/1959",NA,NA,NA,NA,1959-09-07,NA,NA,NA,NA,NA,NA
"3456","GrenacheNoir","34","34Mtp6","",1976,NA,NA,"9/8/1976",NA,NA,NA,NA,1976-08-09,NA,NA,NA,NA,NA,NA,NA
"3457","GrenacheNoir","34","34Mtp6","",1977,NA,NA,"22/8/77",NA,NA,NA,NA,1977-08-22,NA,NA,NA,NA,NA,NA,NA
"3458","GrenacheNoir","34","34Mtp6","",1978,NA,NA,"16/8/78",NA,NA,NA,NA,1978-08-16,NA,NA,NA,NA,NA,NA,NA
"3459","GrenacheNoir","34","34Mtp6","",1987,NA,"7/6/1987","6/8/1987","21/9/87",NA,NA,1987-06-07,1987-08-06,1987-09-21,NA,NA,NA,60,46,NA
"3460","GrenacheNoir","34","34Mtp6","",1988,"28/3/88","1/6/1988","8/8/1988","19/9/88",NA,1988-03-28,1988-06-01,1988-08-08,1988-09-19,NA,175,65,68,42,133
"3461","GrenacheNoir","34","34Mtp6","",1989,"20/3/89","29/5/89","5/8/1989","4/9/1989",NA,1989-03-20,1989-05-29,1989-08-05,1989-09-04,NA,168,70,68,30,138
"3462","GrenacheNoir","34","34Mtp6","",1990,NA,"23/5/90","31/7/90",NA,NA,NA,1990-05-23,1990-07-31,NA,NA,NA,NA,69,NA,NA
"3463","GrenacheNoir","34","34Mtp6","",1991,NA,"3/6/1991","13/8/91",NA,NA,NA,1991-06-03,1991-08-13,NA,NA,NA,NA,71,NA,NA
"3464","GrenacheNoir","34","34Mtp6","",1992,NA,"26/5/92","10/8/1992",NA,NA,NA,1992-05-26,1992-08-10,NA,NA,NA,NA,76,NA,NA
"3465","GrenacheNoir","34","34Mtp6","",1994,NA,"26/5/94","1/8/1994",NA,NA,NA,1994-05-26,1994-08-01,NA,NA,NA,NA,67,NA,NA
"3466","GrenacheNoir","34","34Mtp6","",1995,"23/3/95","2/6/1995","12/8/1995",NA,NA,1995-03-23,1995-06-02,1995-08-12,NA,NA,NA,71,71,NA,142
"3467","GrenacheNoir","34","34Mtp6","",1996,NA,"29/5/96","12/8/1996",NA,NA,NA,1996-05-29,1996-08-12,NA,NA,NA,NA,75,NA,NA
"3468","GrenacheNoir","34","34Mtp6","",1997,"7/3/1997","17/5/97","27/7/97","1/9/1997",NA,1997-03-07,1997-05-17,1997-07-27,1997-09-01,NA,178,71,71,36,142
"3469","GrenacheNoir","34","34Mtp6","",1998,"21/3/98","27/5/98","4/8/1998","31/8/98",NA,1998-03-21,1998-05-27,1998-08-04,1998-08-31,NA,163,67,69,27,136
"3470","GrenacheNoir","34","34Mtp6","",1999,"21/3/99","27/5/99","3/8/1999","31/8/99",NA,1999-03-21,1999-05-27,1999-08-03,1999-08-31,NA,163,67,68,28,135
"3471","GrenacheNoir","34","34Mtp6","",2000,"28/3/00","29/5/00","7/8/2000","4/9/2000",NA,2000-03-28,2000-05-29,2000-08-07,2000-09-04,NA,160,62,70,28,132
"3472","GrenacheNoir","34","34Mtp6","",2001,"13/3/01","24/5/01","3/8/2001","28/8/01",NA,2001-03-13,2001-05-24,2001-08-03,2001-08-28,NA,168,72,71,25,143
"3473","GrenacheNoir","34","34Mtp6","",2002,"15/3/02","23/5/02","29/7/02","27/8/02",NA,2002-03-15,2002-05-23,2002-07-29,2002-08-27,NA,165,69,67,29,136
"3474","GrenacheNoir","34","34Mtp6","",2003,"29/3/03","30/5/03","5/8/2003","23/8/03",NA,2003-03-29,2003-05-30,2003-08-05,2003-08-23,NA,147,62,67,18,129
"3475","GrenacheNoir","34","34Mtp6","",2004,"24/3/04","4/6/2004","12/8/2004","6/9/2004",NA,2004-03-24,2004-06-04,2004-08-12,2004-09-06,NA,166,72,69,25,141
"3476","GrenacheNoir","34","34Mtp6","",2005,"5/4/2005","2/6/2005","5/8/2005","30/8/05",NA,2005-04-05,2005-06-02,2005-08-05,2005-08-30,NA,147,58,64,25,122
"3477","GrenacheNoir","34","34Mtp6","",2006,"28/3/06","26/5/06","31/7/06","30/8/06",NA,2006-03-28,2006-05-26,2006-07-31,2006-08-30,NA,155,59,66,30,125
"3478","GrenacheNoir","34","34Mtp6","",2007,"15/3/07","19/5/07","24/7/07","20/8/07",NA,2007-03-15,2007-05-19,2007-07-24,2007-08-20,NA,158,65,66,27,131
"3479","GrenacheNoir","34","34Mtp6","",2008,"13/3/08","29/5/08","7/8/2008","27/8/08",NA,2008-03-13,2008-05-29,2008-08-07,2008-08-27,NA,167,77,70,20,147
"3480","GrenacheNoir","34","34Mtp6","",2009,"24/3/09","25/5/09","27/7/09","25/8/09",NA,2009-03-24,2009-05-25,2009-07-27,2009-08-25,NA,154,62,63,29,125
"3481","GrenacheNoir","34","34Mtp6","",2010,"29/3/10","1/6/2010","5/8/2010","10/9/2010",NA,2010-03-29,2010-06-01,2010-08-05,2010-09-10,NA,165,64,65,36,129
"3482","GrenacheNoir","34","34Mtp6","",2011,"23/3/11","18/5/11","28/7/11","30/9/11",NA,2011-03-23,2011-05-18,2011-07-28,2011-09-30,NA,191,56,71,64,127
"3483","GrenacheNoir","34","34Mtp6","",2012,"30/3/12","29/5/12","3/8/2012","3/9/2012",NA,2012-03-30,2012-05-29,2012-08-03,2012-09-03,NA,157,60,66,31,126
"3484","GrenacheNoir","34","34Mtp7","",1956,"2/4/1956",NA,NA,"17/9/56",NA,1956-04-02,NA,NA,1956-09-17,NA,168,NA,NA,NA,NA
"3485","GrenacheNoir","34","34Mtp7","",1957,"12/3/1957",NA,NA,"16/9/57",NA,1957-03-12,NA,NA,1957-09-16,NA,188,NA,NA,NA,NA
"3486","GrenacheNoir","34","34Mtp7","",1958,"29/3/58",NA,NA,"3/9/1958",NA,1958-03-29,NA,NA,1958-09-03,NA,158,NA,NA,NA,NA
"3487","GrenacheNoir","34","34Mtp8","",1956,"2/4/1956",NA,NA,"24/9/56",NA,1956-04-02,NA,NA,1956-09-24,NA,175,NA,NA,NA,NA
"3488","GrenacheNoir","34","34Mtp8","",1957,"21/3/57",NA,NA,"23/9/57",NA,1957-03-21,NA,NA,1957-09-23,NA,186,NA,NA,NA,NA
"3489","GrenacheNoir","34","34Mtp8","",1958,"2/4/1958",NA,NA,"10/9/1958",NA,1958-04-02,NA,NA,1958-09-10,NA,161,NA,NA,NA,NA
"3490","GrenacheNoir","34","34Mtp8","",1959,"24/3/59",NA,NA,NA,NA,1959-03-24,NA,NA,NA,NA,NA,NA,NA,NA,NA
"3491","GrenacheNoir","34","34Mtp9","",1956,"2/4/1956",NA,NA,"24/9/56",NA,1956-04-02,NA,NA,1956-09-24,NA,175,NA,NA,NA,NA
"3492","GrenacheNoir","34","34Mtp9","",1957,"18/3/57",NA,NA,"16/9/57",NA,1957-03-18,NA,NA,1957-09-16,NA,182,NA,NA,NA,NA
"3493","GrenacheNoir","34","34Mtp9","",1958,"28/3/58",NA,NA,"10/9/1958",NA,1958-03-28,NA,NA,1958-09-10,NA,166,NA,NA,NA,NA
"3494","GrenacheNoir","34","34Mtp10","",1956,"3/4/1956",NA,NA,"24/9/56",NA,1956-04-03,NA,NA,1956-09-24,NA,174,NA,NA,NA,NA
"3495","GrenacheNoir","34","34Mtp10","",1957,"15/3/57",NA,NA,"16/9/57",NA,1957-03-15,NA,NA,1957-09-16,NA,185,NA,NA,NA,NA
"3496","GrenacheNoir","34","34Mtp10","",1958,"31/3/58",NA,NA,"10/9/1958",NA,1958-03-31,NA,NA,1958-09-10,NA,163,NA,NA,NA,NA
"3497","GrenacheNoir","34","34Mtp10","",1976,NA,NA,"12/8/1976",NA,NA,NA,NA,1976-08-12,NA,NA,NA,NA,NA,NA,NA
"3498","GrenacheNoir","34","34Mtp10","",1977,NA,NA,"19/8/77",NA,NA,NA,NA,1977-08-19,NA,NA,NA,NA,NA,NA,NA
"3499","GrenacheNoir","34","34Mtp10","",1978,NA,NA,"16/8/78",NA,NA,NA,NA,1978-08-16,NA,NA,NA,NA,NA,NA,NA
"3500","GrenacheNoir","34","34Mtp10","",1987,NA,"8/6/1987","6/8/1987","14/9/87",NA,NA,1987-06-08,1987-08-06,1987-09-14,NA,NA,NA,59,39,NA
"3501","GrenacheNoir","34","34Mtp10","",1988,"30/3/88","3/6/1988","8/8/1988","19/9/88",NA,1988-03-30,1988-06-03,1988-08-08,1988-09-19,NA,173,65,66,42,131
"3502","GrenacheNoir","34","34Mtp10","",1989,"20/3/89","29/5/89","5/8/1989","11/9/1989",NA,1989-03-20,1989-05-29,1989-08-05,1989-09-11,NA,175,70,68,37,138
"3503","GrenacheNoir","34","34Mtp10","",1990,"19/3/90","23/5/90","31/7/90","3/9/1990",NA,1990-03-19,1990-05-23,1990-07-31,1990-09-03,NA,168,65,69,34,134
"3504","GrenacheNoir","34","34Mtp10","",1991,"25/3/91","6/6/1991","13/8/91","12/9/1991",NA,1991-03-25,1991-06-06,1991-08-13,1991-09-12,NA,171,73,68,30,141
"3505","GrenacheNoir","34","34Mtp10","",1992,"26/3/92","26/5/92","10/8/1992","7/9/1992",NA,1992-03-26,1992-05-26,1992-08-10,1992-09-07,NA,165,61,76,28,137
"3506","GrenacheNoir","34","34Mtp10","",1993,"25/3/93","28/5/93","9/8/1993","13/9/93",NA,1993-03-25,1993-05-28,1993-08-09,1993-09-13,NA,172,64,73,35,137
"3507","GrenacheNoir","34","34Mtp10","",1994,"10/3/1994","26/5/94","1/8/1994","5/9/1994",NA,1994-03-10,1994-05-26,1994-08-01,1994-09-05,NA,179,77,67,35,144
"3508","GrenacheNoir","34","34Mtp10","",1995,"30/3/95","2/6/1995","12/8/1995","11/9/1995",NA,1995-03-30,1995-06-02,1995-08-12,1995-09-11,NA,165,64,71,30,135
"3509","GrenacheNoir","34","34Mtp10","",1996,"25/3/96","29/5/96","6/8/1996","16/9/96",NA,1996-03-25,1996-05-29,1996-08-06,1996-09-16,NA,175,65,69,41,134
"3510","GrenacheNoir","34","34Mtp10","",1997,"9/3/1997","12/5/1997","28/7/97","1/9/1997",NA,1997-03-09,1997-05-12,1997-07-28,1997-09-01,NA,176,64,77,35,141
"3511","GrenacheNoir","34","34Mtp10","",1998,"21/3/98","27/5/98","4/8/1998","31/8/98",NA,1998-03-21,1998-05-27,1998-08-04,1998-08-31,NA,163,67,69,27,136
"3512","GrenacheNoir","34","34Mtp10","",1999,"17/3/99","28/5/99","3/8/1999","31/8/99",NA,1999-03-17,1999-05-28,1999-08-03,1999-08-31,NA,167,72,67,28,139
"3513","GrenacheNoir","34","34Mtp10","",2000,"2/4/2000","2/6/2000","7/8/2000","4/9/2000",NA,2000-04-02,2000-06-02,2000-08-07,2000-09-04,NA,155,61,66,28,127
"3514","GrenacheNoir","34","34Mtp10","",2001,"20/3/01","27/5/01","6/8/2001","6/9/2001",NA,2001-03-20,2001-05-27,2001-08-06,2001-09-06,NA,170,68,71,31,139
"3515","GrenacheNoir","34","34Mtp10","",2002,"18/3/02","23/5/02","29/7/02","27/8/02",NA,2002-03-18,2002-05-23,2002-07-29,2002-08-27,NA,162,66,67,29,133
"3516","GrenacheNoir","34","34Mtp10","",2003,"3/4/2003","3/6/2003","5/8/2003","25/8/03",NA,2003-04-03,2003-06-03,2003-08-05,2003-08-25,NA,144,61,63,20,124
"3517","GrenacheNoir","34","34Mtp10","",2004,"25/3/04","4/6/2004","12/8/2004","6/9/2004",NA,2004-03-25,2004-06-04,2004-08-12,2004-09-06,NA,165,71,69,25,140
"3518","GrenacheNoir","34","34Mtp10","",2005,"8/4/2005","3/6/2005","8/8/2005","2/9/2005",NA,2005-04-08,2005-06-03,2005-08-08,2005-09-02,NA,147,56,66,25,122
"3519","GrenacheNoir","34","34Mtp10","",2006,"29/3/06","28/5/06","31/7/06","21/8/06",NA,2006-03-29,2006-05-28,2006-07-31,2006-08-21,NA,145,60,64,21,124
"3520","GrenacheNoir","34","34Mtp10","",2007,"16/3/07","18/5/07","24/7/07","20/8/07",NA,2007-03-16,2007-05-18,2007-07-24,2007-08-20,NA,157,63,67,27,130
"3521","GrenacheNoir","34","34Mtp11","",1956,"2/4/1956",NA,NA,"17/9/56",NA,1956-04-02,NA,NA,1956-09-17,NA,168,NA,NA,NA,NA
"3522","GrenacheNoir","34","34Mtp11","",1957,"15/3/57",NA,NA,"9/9/1957",NA,1957-03-15,NA,NA,1957-09-09,NA,178,NA,NA,NA,NA
"3523","GrenacheNoir","34","34Mtp11","",1958,"30/3/58",NA,NA,"3/9/1958",NA,1958-03-30,NA,NA,1958-09-03,NA,157,NA,NA,NA,NA
"3524","GrenacheNoir","34","34Mtp12","",1958,"2/4/1958",NA,NA,"5/9/1958",NA,1958-04-02,NA,NA,1958-09-05,NA,156,NA,NA,NA,NA
"3525","GrenacheNoir","34","34Mtp12","",1959,"27/3/59",NA,NA,"12/9/1959",NA,1959-03-27,NA,NA,1959-09-12,NA,169,NA,NA,NA,NA
"3526","GrenacheNoir","34","34Mtp12","",1960,"18/3/60",NA,NA,"16/8/60",NA,1960-03-18,NA,NA,1960-08-16,NA,151,NA,NA,NA,NA
"3527","GrenacheNoir","34","34Mtp12","",1961,NA,NA,NA,"2/9/1961",NA,NA,NA,NA,1961-09-02,NA,NA,NA,NA,NA,NA
"3528","GrenacheNoir","34","34Mtp12","",1962,NA,NA,NA,"10/9/1962",NA,NA,NA,NA,1962-09-10,NA,NA,NA,NA,NA,NA
"3529","GrenacheNoir","34","34Mtp13","",1957,NA,NA,NA,"10/9/1957",NA,NA,NA,NA,1957-09-10,NA,NA,NA,NA,NA,NA
"3530","GrenacheNoir","34","34Mtp13","",1958,"29/3/58",NA,NA,"4/9/1958",NA,1958-03-29,NA,NA,1958-09-04,NA,159,NA,NA,NA,NA
"3531","GrenacheNoir","34","34Mtp13","",1959,"21/3/59",NA,NA,"31/8/59",NA,1959-03-21,NA,NA,1959-08-31,NA,163,NA,NA,NA,NA
"3532","GrenacheNoir","34","34Mtp13","",1961,"7/3/1961",NA,NA,NA,NA,1961-03-07,NA,NA,NA,NA,NA,NA,NA,NA,NA
"3533","GrenacheNoir","34","34Mtp13","",1976,NA,NA,"5/8/1976",NA,NA,NA,NA,1976-08-05,NA,NA,NA,NA,NA,NA,NA
"3534","GrenacheNoir","34","34Mtp13","",1977,NA,NA,"22/8/77",NA,NA,NA,NA,1977-08-22,NA,NA,NA,NA,NA,NA,NA
"3535","GrenacheNoir","34","34Mtp13","",1978,NA,NA,"16/8/78",NA,NA,NA,NA,1978-08-16,NA,NA,NA,NA,NA,NA,NA
"3536","GrenacheNoir","34","34Mtp13","",1987,NA,"7/6/1987","6/8/1987","7/9/1987",NA,NA,1987-06-07,1987-08-06,1987-09-07,NA,NA,NA,60,32,NA
"3537","GrenacheNoir","34","34Mtp13","",1988,"7/4/1988","3/6/1988","8/8/1988","12/9/1988",NA,1988-04-07,1988-06-03,1988-08-08,1988-09-12,NA,158,57,66,35,123
"3538","GrenacheNoir","34","34Mtp14","",1956,NA,NA,NA,"24/9/56",NA,NA,NA,NA,1956-09-24,NA,NA,NA,NA,NA,NA
"3539","GrenacheNoir","34","34Mtp14","",1957,"9/3/1957",NA,NA,"10/9/1957",NA,1957-03-09,NA,NA,1957-09-10,NA,185,NA,NA,NA,NA
"3540","GrenacheNoir","34","34Mtp14","",1959,NA,NA,NA,"25/8/59",NA,NA,NA,NA,1959-08-25,NA,NA,NA,NA,NA,NA
"3541","GrenacheNoir","34","34Mtp14","",1960,"12/3/1960",NA,NA,NA,NA,1960-03-12,NA,NA,NA,NA,NA,NA,NA,NA,NA
"3542","GrenacheNoir","34","34Mtp15","",1956,NA,NA,NA,"24/9/56",NA,NA,NA,NA,1956-09-24,NA,NA,NA,NA,NA,NA
"3543","GrenacheNoir","34","34Mtp15","",1957,"12/3/1957",NA,NA,"2/9/1957",NA,1957-03-12,NA,NA,1957-09-02,NA,174,NA,NA,NA,NA
"3544","GrenacheNoir","34","34Mtp15","",1958,"31/3/58",NA,NA,"5/9/1958",NA,1958-03-31,NA,NA,1958-09-05,NA,158,NA,NA,NA,NA
"3545","GrenacheNoir","34","34Mtp15","",1959,"27/3/59",NA,NA,NA,NA,1959-03-27,NA,NA,NA,NA,NA,NA,NA,NA,NA
"3546","GrenacheNoir","34","34Mtp15","",1960,"19/3/60",NA,NA,NA,NA,1960-03-19,NA,NA,NA,NA,NA,NA,NA,NA,NA
"3547","GrenacheNoir","34","34Mtp17","",1958,"28/3/58",NA,NA,NA,NA,1958-03-28,NA,NA,NA,NA,NA,NA,NA,NA,NA
"3548","GrenacheNoir","34","34Mtp17","",1959,"26/3/59",NA,NA,"31/8/59",NA,1959-03-26,NA,NA,1959-08-31,NA,158,NA,NA,NA,NA
"3549","GrenacheNoir","34","34Mtp17","",1960,"21/3/60",NA,NA,"5/9/1960",NA,1960-03-21,NA,NA,1960-09-05,NA,168,NA,NA,NA,NA
"3550","GrenacheNoir","34","34Mtp17","",1961,"16/3/61",NA,NA,"11/9/1961",NA,1961-03-16,NA,NA,1961-09-11,NA,179,NA,NA,NA,NA
"3551","GrenacheNoir","34","34Mtp18","",1956,NA,NA,NA,"24/9/56",NA,NA,NA,NA,1956-09-24,NA,NA,NA,NA,NA,NA
"3552","GrenacheNoir","34","34Mtp18","",1957,"11/3/1957",NA,NA,"25/9/57",NA,1957-03-11,NA,NA,1957-09-25,NA,198,NA,NA,NA,NA
"3553","GrenacheNoir","34","34Mtp18","",1958,"29/3/58",NA,NA,"5/9/1958",NA,1958-03-29,NA,NA,1958-09-05,NA,160,NA,NA,NA,NA
"3554","GrenacheNoir","34","34Mtp18","",1959,"21/3/59",NA,NA,"25/8/59",NA,1959-03-21,NA,NA,1959-08-25,NA,157,NA,NA,NA,NA
"3555","GrenacheNoir","34","34Mtp18","",1960,NA,NA,NA,"31/8/60",NA,NA,NA,NA,1960-08-31,NA,NA,NA,NA,NA,NA
"3556","GrenacheNoir","34","34Mtp18","",1961,NA,NA,NA,"21/8/61",NA,NA,NA,NA,1961-08-21,NA,NA,NA,NA,NA,NA
"3557","GrenacheNoir","34","34Mtp18","",1962,NA,NA,NA,"30/9/62",NA,NA,NA,NA,1962-09-30,NA,NA,NA,NA,NA,NA
"3558","GrenacheNoir","34","34Mtp21","",1960,NA,NA,NA,"5/9/1960",NA,NA,NA,NA,1960-09-05,NA,NA,NA,NA,NA,NA
"3559","GrenacheNoir","34","34Mtp21","",1961,"9/3/1961",NA,NA,"11/9/1961",NA,1961-03-09,NA,NA,1961-09-11,NA,186,NA,NA,NA,NA
"3560","GrenacheNoir","34","34Mtp21","",1976,NA,NA,"6/8/1976",NA,NA,NA,NA,1976-08-06,NA,NA,NA,NA,NA,NA,NA
"3561","GrenacheNoir","34","34Mtp21","",1977,NA,NA,"22/8/77",NA,NA,NA,NA,1977-08-22,NA,NA,NA,NA,NA,NA,NA
"3562","GrenacheNoir","34","34Mtp21","",1978,NA,NA,"22/8/78",NA,NA,NA,NA,1978-08-22,NA,NA,NA,NA,NA,NA,NA
"3563","GrenacheNoir","34","34Mtp21","",1988,"25/3/88","30/5/88","8/8/1988","19/9/88",NA,1988-03-25,1988-05-30,1988-08-08,1988-09-19,NA,178,66,70,42,136
"3564","GrenacheNoir","34","34Mtp22","",1963,"1/4/1963",NA,NA,"10/9/1963",NA,1963-04-01,NA,NA,1963-09-10,NA,162,NA,NA,NA,NA
"3565","GrenacheNoir","34","34Mtp22","",1964,"1/4/1964",NA,NA,"27/8/64",NA,1964-04-01,NA,NA,1964-08-27,NA,148,NA,NA,NA,NA
"3566","GrenacheNoir","34","34Mtp22","",1965,"31/3/65",NA,NA,"7/9/1965",NA,1965-03-31,NA,NA,1965-09-07,NA,160,NA,NA,NA,NA
"3567","GrenacheNoir","34","34Mtp22","",1966,"16/3/66",NA,NA,NA,NA,1966-03-16,NA,NA,NA,NA,NA,NA,NA,NA,NA
"3568","GrenacheNoir","34","34Mtp23","",1980,"14/3/80",NA,NA,NA,NA,1980-03-14,NA,NA,NA,NA,NA,NA,NA,NA,NA
"3569","GrenacheNoir","34","34Mtp23","",1981,"29/3/81",NA,NA,"14/9/81",NA,1981-03-29,NA,NA,1981-09-14,NA,169,NA,NA,NA,NA
"3570","GrenacheNoir","34","34Mtp23","",1982,"28/3/82",NA,NA,NA,NA,1982-03-28,NA,NA,NA,NA,NA,NA,NA,NA,NA
"3571","GrenacheNoir","34","34Mtp23","",1983,NA,NA,NA,"13/9/83",NA,NA,NA,NA,1983-09-13,NA,NA,NA,NA,NA,NA
"3572","GrenacheNoir","34","34Mtp23","",1984,NA,NA,NA,"24/9/84",NA,NA,NA,NA,1984-09-24,NA,NA,NA,NA,NA,NA
"3573","GrenacheNoir","34","34Mtp23","",1994,NA,"25/5/94","1/8/1994",NA,NA,NA,1994-05-25,1994-08-01,NA,NA,NA,NA,68,NA,NA
"3574","GrenacheNoir","34","34Mtp23","",1995,NA,"27/5/95","7/8/1995",NA,NA,NA,1995-05-27,1995-08-07,NA,NA,NA,NA,72,NA,NA
"3575","GrenacheNoir","34","34Mtp23","",2002,"13/3/02","27/5/02","25/7/02","27/8/02",NA,2002-03-13,2002-05-27,2002-07-25,2002-08-27,NA,167,75,59,33,134
"3576","GrenacheNoir","34","34Mtp23","",2003,"23/3/03","30/5/03","5/8/2003","30/8/03",NA,2003-03-23,2003-05-30,2003-08-05,2003-08-30,NA,160,68,67,25,135
"3577","GrenacheNoir","34","34Mtp23","",2004,"21/3/04","2/6/2004","2/8/2004","6/9/2004",NA,2004-03-21,2004-06-02,2004-08-02,2004-09-06,NA,169,73,61,35,134
"3578","GrenacheNoir","34","34Mtp23","",2005,"2/4/2005","1/6/2005","7/8/2005","31/8/05",NA,2005-04-02,2005-06-01,2005-08-07,2005-08-31,NA,151,60,67,24,127
"3579","GrenacheNoir","34","34Mtp23","",2006,"25/3/06","26/5/06","6/8/2006","31/8/06",NA,2006-03-25,2006-05-26,2006-08-06,2006-08-31,NA,159,62,72,25,134
"3580","GrenacheNoir","34","34Mtp23","",2007,"11/3/2007","20/5/07","1/8/2007","14/8/07",NA,2007-03-11,2007-05-20,2007-08-01,2007-08-14,NA,156,70,73,13,143
"3581","GrenacheNoir","34","34Mtp23","",2008,"1/3/2008","22/5/08","7/8/2008","3/9/2008",NA,2008-03-01,2008-05-22,2008-08-07,2008-09-03,NA,186,82,77,27,159
"3582","GrenacheNoir","34","34Mtp23","",2009,"19/3/09","26/5/09","3/8/2009","25/8/09",NA,2009-03-19,2009-05-26,2009-08-03,2009-08-25,NA,159,68,69,22,137
"3583","GrenacheNoir","34","34Mtp24","",1980,"14/3/80",NA,NA,NA,NA,1980-03-14,NA,NA,NA,NA,NA,NA,NA,NA,NA
"3584","GrenacheNoir","34","34Mtp24","",1981,"25/3/81",NA,NA,"14/9/81",NA,1981-03-25,NA,NA,1981-09-14,NA,173,NA,NA,NA,NA
"3585","GrenacheNoir","34","34Mtp24","",1982,"28/3/82",NA,NA,NA,NA,1982-03-28,NA,NA,NA,NA,NA,NA,NA,NA,NA
"3586","GrenacheNoir","34","34Mtp24","",1983,NA,NA,NA,"13/9/83",NA,NA,NA,NA,1983-09-13,NA,NA,NA,NA,NA,NA
"3587","GrenacheNoir","34","34Mtp24","",1984,NA,NA,NA,"24/9/84",NA,NA,NA,NA,1984-09-24,NA,NA,NA,NA,NA,NA
"3588","GrenacheNoir","34","34Mtp24","",1994,NA,"25/5/94","1/8/1994",NA,NA,NA,1994-05-25,1994-08-01,NA,NA,NA,NA,68,NA,NA
"3589","GrenacheNoir","34","34Mtp24","",1995,NA,"30/5/95","16/8/95",NA,NA,NA,1995-05-30,1995-08-16,NA,NA,NA,NA,78,NA,NA
"3590","GrenacheNoir","34","34Mtp25","",1977,"10/3/1977",NA,NA,NA,NA,1977-03-10,NA,NA,NA,NA,NA,NA,NA,NA,NA
"3591","GrenacheNoir","34","34Mtp25","",1978,"12/3/1978",NA,NA,NA,NA,1978-03-12,NA,NA,NA,NA,NA,NA,NA,NA,NA
"3592","GrenacheNoir","34","34Mtp25","",1979,"15/3/79",NA,NA,"5/9/1978",NA,1979-03-15,NA,NA,1978-09-05,NA,-191,NA,NA,NA,NA
"3593","GrenacheNoir","34","34Mtp25","",1980,NA,NA,"25/8/80","22/9/80",NA,NA,NA,1980-08-25,1980-09-22,NA,NA,NA,NA,28,NA
"3594","GrenacheNoir","34","34Mtp25","",1981,NA,NA,"17/8/81","8/9/1981",NA,NA,NA,1981-08-17,1981-09-08,NA,NA,NA,NA,22,NA
"3595","GrenacheNoir","34","34Mtp25","",1982,NA,NA,"2/8/1982",NA,NA,NA,NA,1982-08-02,NA,NA,NA,NA,NA,NA,NA
"3596","GrenacheNoir","34","34Mtp26","",1989,"20/3/89","28/5/89","8/8/1989","4/9/1989",NA,1989-03-20,1989-05-28,1989-08-08,1989-09-04,NA,168,69,72,27,141
"3597","GrenacheNoir","34","34Mtp26","",1990,"19/3/90","23/5/90","30/7/90","10/9/1990",NA,1990-03-19,1990-05-23,1990-07-30,1990-09-10,NA,175,65,68,42,133
"3598","GrenacheNoir","34","34Mtp26","",1991,"26/3/91","8/6/1991","13/8/91","23/9/91",NA,1991-03-26,1991-06-08,1991-08-13,1991-09-23,NA,181,74,66,41,140
"3599","GrenacheNoir","34","34Mtp26","",2001,"11/3/2001","24/5/01","30/7/01","28/8/01",NA,2001-03-11,2001-05-24,2001-07-30,2001-08-28,NA,170,74,67,29,141
"3600","GrenacheNoir","34","34Mtp26","",2002,"10/3/2002","27/5/02","1/8/2002","30/8/02",NA,2002-03-10,2002-05-27,2002-08-01,2002-08-30,NA,173,78,66,29,144
"3601","GrenacheNoir","34","34Mtp26","",2003,"22/3/03","30/5/03","5/8/2003","1/9/2003",NA,2003-03-22,2003-05-30,2003-08-05,2003-09-01,NA,163,69,67,27,136
"3602","GrenacheNoir","34","34Mtp26","",2004,"18/3/04","4/6/2004","2/8/2004","6/9/2004",NA,2004-03-18,2004-06-04,2004-08-02,2004-09-06,NA,172,78,59,35,137
"3603","GrenacheNoir","34","34Mtp26","",2005,"31/3/05","1/6/2005","5/8/2005","2/9/2005",NA,2005-03-31,2005-06-01,2005-08-05,2005-09-02,NA,155,62,65,28,127
"3604","GrenacheNoir","34","34Mtp26","",2006,"27/3/06","27/5/06","31/7/06","21/8/06",NA,2006-03-27,2006-05-27,2006-07-31,2006-08-21,NA,147,61,65,21,126
"3605","GrenacheNoir","34","34Mtp26","",2007,"9/3/2007","20/5/07","24/7/07","14/8/07",NA,2007-03-09,2007-05-20,2007-07-24,2007-08-14,NA,158,72,65,21,137
"3606","GrenacheNoir","34","34Mtp26","",2008,"12/3/2008","22/5/08","7/8/2008","28/8/08",NA,2008-03-12,2008-05-22,2008-08-07,2008-08-28,NA,169,71,77,21,148
"3607","GrenacheNoir","34","34Mtp26","",2009,"21/3/09","26/5/09","30/7/09","25/8/09",NA,2009-03-21,2009-05-26,2009-07-30,2009-08-25,NA,157,66,65,26,131
"3608","GrenacheNoir","34","34Mtp26","",2010,"26/3/10","27/5/10","2/8/2010","26/8/10",NA,2010-03-26,2010-05-27,2010-08-02,2010-08-26,NA,153,62,67,24,129
"3609","GrenacheNoir","34","34Mtp26","",2011,"18/3/11","15/5/11","29/7/11","25/8/11",NA,2011-03-18,2011-05-15,2011-07-29,2011-08-25,NA,160,58,75,27,133
"3610","GrenacheNoir","34","34Mtp26","",2012,"27/3/12","27/5/12","31/7/12","30/8/12",NA,2012-03-27,2012-05-27,2012-07-31,2012-08-30,NA,156,61,65,30,126
"3611","Merlot","326","326Mtp2","",1958,"28/3/58",NA,NA,NA,NA,1958-03-28,NA,NA,NA,NA,NA,NA,NA,NA,NA
"3612","Merlot","326","326Mtp2","",1959,"23/3/59",NA,NA,"18/8/59",NA,1959-03-23,NA,NA,1959-08-18,NA,148,NA,NA,NA,NA
"3613","Merlot","326","326Mtp2","",1960,"20/3/60",NA,NA,"29/8/60",NA,1960-03-20,NA,NA,1960-08-29,NA,162,NA,NA,NA,NA
"3614","Merlot","326","326Mtp2","",1961,"16/3/61",NA,NA,"2/9/1961",NA,1961-03-16,NA,NA,1961-09-02,NA,170,NA,NA,NA,NA
"3615","Merlot","326","326Mtp2","",1976,NA,NA,"29/7/76",NA,NA,NA,NA,1976-07-29,NA,NA,NA,NA,NA,NA,NA
"3616","Merlot","326","326Mtp2","",1977,NA,NA,"8/8/1977",NA,NA,NA,NA,1977-08-08,NA,NA,NA,NA,NA,NA,NA
"3617","Merlot","326","326Mtp2","",1978,NA,NA,"17/8/78",NA,NA,NA,NA,1978-08-17,NA,NA,NA,NA,NA,NA,NA
"3618","Merlot","326","326Mtp2","",1994,NA,"28/5/94",NA,NA,NA,NA,1994-05-28,NA,NA,NA,NA,NA,NA,NA,NA
"3619","Merlot","326","326Mtp2","",1995,"14/3/95","26/5/95","7/8/1995","4/9/1995",NA,1995-03-14,1995-05-26,1995-08-07,1995-09-04,NA,174,73,73,28,146
"3620","Merlot","326","326Mtp2","",1998,"19/3/98","27/5/98","27/7/98","3/9/1998",NA,1998-03-19,1998-05-27,1998-07-27,1998-09-03,NA,168,69,61,38,130
"3621","Merlot","326","326Mtp2","",1999,"14/3/99","22/5/99","27/7/99","24/8/99",NA,1999-03-14,1999-05-22,1999-07-27,1999-08-24,NA,163,69,66,28,135
"3622","Merlot","326","326Mtp2","",2000,"25/3/00","29/5/00","27/7/00","21/8/00",NA,2000-03-25,2000-05-29,2000-07-27,2000-08-21,NA,149,65,59,25,124
"3623","Merlot","326","326Mtp2","",2001,"12/3/2001","26/5/01","25/7/01","28/8/01",NA,2001-03-12,2001-05-26,2001-07-25,2001-08-28,NA,169,75,60,34,135
"3624","Merlot","326","326Mtp2","",2002,"11/3/2002","23/5/02","25/7/02","25/8/02",NA,2002-03-11,2002-05-23,2002-07-25,2002-08-25,NA,167,73,63,31,136
"3625","Merlot","326","326Mtp2","",2003,"24/3/03","28/5/03","22/7/03","20/8/03",NA,2003-03-24,2003-05-28,2003-07-22,2003-08-20,NA,149,65,55,29,120
"3626","Merlot","326","326Mtp2","",2004,"22/3/04","2/6/2004","2/8/2004","24/8/04",NA,2004-03-22,2004-06-02,2004-08-02,2004-08-24,NA,155,72,61,22,133
"3627","Merlot","326","326Mtp2","",2005,"7/4/2005","30/5/05","29/7/05","25/8/05",NA,2005-04-07,2005-05-30,2005-07-29,2005-08-25,NA,140,53,60,27,113
"3628","Merlot","326","326Mtp2","",2006,"29/3/06","23/5/06","23/7/06","12/8/2006",NA,2006-03-29,2006-05-23,2006-07-23,2006-08-12,NA,136,55,61,20,116
"3629","Merlot","326","326Mtp2","",2007,"12/3/2007","18/5/07","20/7/07","29/8/07",NA,2007-03-12,2007-05-18,2007-07-20,2007-08-29,NA,170,67,63,40,130
"3630","Merlot","326","326Mtp2","",2008,"15/3/08","23/5/08","31/7/08","21/8/08",NA,2008-03-15,2008-05-23,2008-07-31,2008-08-21,NA,159,69,69,21,138
"3631","Merlot","326","326Mtp2","",2009,"19/3/09","24/5/09","19/7/09","21/8/09",NA,2009-03-19,2009-05-24,2009-07-19,2009-08-21,NA,155,66,56,33,122
"3632","Merlot","326","326Mtp2","",2010,"29/3/10","28/5/10","2/8/2010","26/8/10",NA,2010-03-29,2010-05-28,2010-08-02,2010-08-26,NA,150,60,66,24,126
"3633","Merlot","326","326Mtp2","",2011,"18/3/11","11/5/2011","22/7/11","31/8/11",NA,2011-03-18,2011-05-11,2011-07-22,2011-08-31,NA,166,54,72,40,126
"3634","Merlot","326","326Mtp2","",2012,"27/3/12","25/5/12","24/7/12","30/8/12",NA,2012-03-27,2012-05-25,2012-07-24,2012-08-30,NA,156,59,60,37,119
"3635","Merlot","326","326Mtp2","",2013,"23/3/13",NA,NA,NA,NA,2013-03-23,NA,NA,NA,NA,NA,NA,NA,NA,NA
"3636","Merlot","326","326Mtp3","",1959,"26/3/59",NA,NA,"24/8/59",NA,1959-03-26,NA,NA,1959-08-24,NA,151,NA,NA,NA,NA
"3637","Merlot","326","326Mtp3","",1960,"16/3/60",NA,NA,"15/8/60",NA,1960-03-16,NA,NA,1960-08-15,NA,152,NA,NA,NA,NA
"3638","Merlot","326","326Mtp3","",1961,"13/3/61",NA,NA,"2/9/1961",NA,1961-03-13,NA,NA,1961-09-02,NA,173,NA,NA,NA,NA
"3639","Merlot","326","326Mtp3","",1962,"5/4/1962",NA,NA,NA,NA,1962-04-05,NA,NA,NA,NA,NA,NA,NA,NA,NA
"3640","Merlot","326","326Mtp4","",1959,"19/3/59",NA,NA,"24/8/59",NA,1959-03-19,NA,NA,1959-08-24,NA,158,NA,NA,NA,NA
"3641","Merlot","326","326Mtp4","",1960,"20/3/60",NA,NA,"15/8/60",NA,1960-03-20,NA,NA,1960-08-15,NA,148,NA,NA,NA,NA
"3642","Merlot","326","326Mtp4","",1961,"13/3/61",NA,NA,"2/9/1961",NA,1961-03-13,NA,NA,1961-09-02,NA,173,NA,NA,NA,NA
"3643","Merlot","326","326Mtp4","",1962,"5/4/1962",NA,NA,"26/8/62",NA,1962-04-05,NA,NA,1962-08-26,NA,143,NA,NA,NA,NA
"3644","Merlot","326","326Mtp4","",1976,NA,NA,"29/7/76",NA,NA,NA,NA,1976-07-29,NA,NA,NA,NA,NA,NA,NA
"3645","Merlot","326","326Mtp4","",1977,NA,NA,"9/8/1977",NA,NA,NA,NA,1977-08-09,NA,NA,NA,NA,NA,NA,NA
"3646","Merlot","326","326Mtp4","",1978,NA,NA,"17/8/78",NA,NA,NA,NA,1978-08-17,NA,NA,NA,NA,NA,NA,NA
"3647","Merlot","326","326Mtp4","",1998,"16/3/98","22/5/98","27/7/98","3/9/1998",NA,1998-03-16,1998-05-22,1998-07-27,1998-09-03,NA,171,67,66,38,133
"3648","Merlot","326","326Mtp4","",1999,"13/3/99","25/5/99","3/8/1999","24/8/99",NA,1999-03-13,1999-05-25,1999-08-03,1999-08-24,NA,164,73,70,21,143
"3649","Merlot","326","326Mtp4","",2000,"17/3/00","26/5/00","31/7/00","21/8/00",NA,2000-03-17,2000-05-26,2000-07-31,2000-08-21,NA,157,70,66,21,136
"3650","Merlot","326","326Mtp4","",2001,"3/3/2001","24/5/01","30/7/01",NA,NA,2001-03-03,2001-05-24,2001-07-30,NA,NA,NA,82,67,NA,149
"3651","Merlot","326","326Mtp4","",2002,"9/3/2002","26/5/02","29/7/02","23/8/02",NA,2002-03-09,2002-05-26,2002-07-29,2002-08-23,NA,167,78,64,25,142
"3652","Merlot","326","326Mtp4","",2003,"23/3/03","30/5/03","25/7/03","18/8/03",NA,2003-03-23,2003-05-30,2003-07-25,2003-08-18,NA,148,68,56,24,124
"3653","Merlot","326","326Mtp4","",2004,"22/3/04","4/6/2004","2/8/2004","24/8/04",NA,2004-03-22,2004-06-04,2004-08-02,2004-08-24,NA,155,74,59,22,133
"3654","Merlot","326","326Mtp4","",2005,"31/3/05","29/5/05","29/7/05","23/8/05",NA,2005-03-31,2005-05-29,2005-07-29,2005-08-23,NA,145,59,61,25,120
"3655","Merlot","326","326Mtp4","",2006,"24/3/06","22/5/06","28/7/06","16/8/06",NA,2006-03-24,2006-05-22,2006-07-28,2006-08-16,NA,145,59,67,19,126
"3656","Merlot","326","326Mtp4","",2007,"9/3/2007","22/5/07",NA,NA,NA,2007-03-09,2007-05-22,NA,NA,NA,NA,74,NA,NA,NA
"3657","Merlot","326","326Mtp4","",2008,"12/3/2008","22/5/08","31/7/08","27/8/08",NA,2008-03-12,2008-05-22,2008-07-31,2008-08-27,NA,168,71,70,27,141
"3658","Merlot","326","326Mtp4","",2009,"13/3/09","22/5/09","21/7/09","14/8/09",NA,2009-03-13,2009-05-22,2009-07-21,2009-08-14,NA,154,70,60,24,130
"3659","Merlot","326","326Mtp4","",2010,"27/3/10","27/5/10","2/8/2010","26/8/10",NA,2010-03-27,2010-05-27,2010-08-02,2010-08-26,NA,152,61,67,24,128
"3660","Merlot","326","326Mtp4","",2011,"16/3/11","11/5/2011","20/7/11","31/8/11",NA,2011-03-16,2011-05-11,2011-07-20,2011-08-31,NA,168,56,70,42,126
"3661","Merlot","326","326Mtp4","",2012,"24/3/12","25/5/12","26/7/12","20/8/12",NA,2012-03-24,2012-05-25,2012-07-26,2012-08-20,NA,149,62,62,25,124
"3662","Merlot","326","326Mtp4","",2013,"22/3/13",NA,NA,NA,NA,2013-03-22,NA,NA,NA,NA,NA,NA,NA,NA,NA
"3663","Merlot","326","326Mtp5","",1965,"31/3/65",NA,NA,"31/8/65",NA,1965-03-31,NA,NA,1965-08-31,NA,153,NA,NA,NA,NA
"3664","Merlot","326","326Mtp5","",1966,"16/3/66",NA,NA,"10/8/1966",NA,1966-03-16,NA,NA,1966-08-10,NA,147,NA,NA,NA,NA
"3665","Merlot","326","326Mtp5","",1967,"13/3/67",NA,NA,"30/8/67",NA,1967-03-13,NA,NA,1967-08-30,NA,170,NA,NA,NA,NA
"3666","Merlot","326","326Mtp5","",1979,NA,NA,"6/8/1979",NA,NA,NA,NA,1979-08-06,NA,NA,NA,NA,NA,NA,NA
"3667","Merlot","326","326Mtp5","",1980,NA,NA,"25/8/80",NA,NA,NA,NA,1980-08-25,NA,NA,NA,NA,NA,NA,NA
"3668","Merlot","326","326Mtp5","",1981,NA,NA,"3/8/1981",NA,NA,NA,NA,1981-08-03,NA,NA,NA,NA,NA,NA,NA
"3669","Merlot","326","326Mtp6","",1959,NA,NA,NA,"18/8/59",NA,NA,NA,NA,1959-08-18,NA,NA,NA,NA,NA,NA
"3670","Merlot","326","326Mtp6","",1960,"15/3/60",NA,NA,"23/8/60",NA,1960-03-15,NA,NA,1960-08-23,NA,161,NA,NA,NA,NA
"3671","Merlot","326","326Mtp6","",1966,"4/3/1966",NA,NA,NA,NA,1966-03-04,NA,NA,NA,NA,NA,NA,NA,NA,NA
"3672","Merlot","326","326Mtp6","",1968,"20/3/68",NA,NA,NA,NA,1968-03-20,NA,NA,NA,NA,NA,NA,NA,NA,NA
"3673","Merlot","326","326Mtp6","",1969,NA,NA,NA,"2/9/1969",NA,NA,NA,NA,1969-09-02,NA,NA,NA,NA,NA,NA
"3674","Merlot","326","326Mtp6","",1978,NA,NA,"16/8/78",NA,NA,NA,NA,1978-08-16,NA,NA,NA,NA,NA,NA,NA
"3675","Merlot","326","326Mtp6","",1980,NA,NA,"8/8/1980",NA,NA,NA,NA,1980-08-08,NA,NA,NA,NA,NA,NA,NA
"3676","Merlot","326","326Mtp7","",1981,"23/3/81",NA,NA,NA,NA,1981-03-23,NA,NA,NA,NA,NA,NA,NA,NA,NA
"3677","Merlot","326","326Mtp7","",1982,"8/3/1982",NA,NA,NA,NA,1982-03-08,NA,NA,NA,NA,NA,NA,NA,NA,NA
"3678","Merlot","326","326Mtp7","",1983,"22/3/83",NA,NA,"31/8/83",NA,1983-03-22,NA,NA,1983-08-31,NA,162,NA,NA,NA,NA
"3679","Merlot","326","326Mtp7","",1987,NA,NA,NA,"21/8/87",NA,NA,NA,NA,1987-08-21,NA,NA,NA,NA,NA,NA
"3680","Merlot","326","326Mtp8","",1982,"15/3/82",NA,"26/7/82",NA,NA,1982-03-15,NA,1982-07-26,NA,NA,NA,NA,NA,NA,133
"3681","Merlot","326","326Mtp8","",1983,"24/3/83",NA,"2/8/1983","31/8/83",NA,1983-03-24,NA,1983-08-02,1983-08-31,NA,160,NA,NA,29,131
"3682","Merlot","326","326Mtp8","",1984,"29/3/84",NA,"9/8/1984",NA,NA,1984-03-29,NA,1984-08-09,NA,NA,NA,NA,NA,NA,133
"3683","Merlot","326","326Mtp8","",1985,NA,NA,NA,"21/8/85",NA,NA,NA,NA,1985-08-21,NA,NA,NA,NA,NA,NA
"3684","Merlot","326","326Mtp8","",1986,NA,NA,NA,"1/9/1986",NA,NA,NA,NA,1986-09-01,NA,NA,NA,NA,NA,NA
"3685","Merlot","326","326Mtp8","",2010,"28/3/10",NA,NA,NA,NA,2010-03-28,NA,NA,NA,NA,NA,NA,NA,NA,NA
"3686","Merlot","326","326Mtp8","",2011,"13/3/11",NA,NA,NA,NA,2011-03-13,NA,NA,NA,NA,NA,NA,NA,NA,NA
"3687","Merlot","326","326Mtp8","",2012,"22/3/12",NA,NA,NA,NA,2012-03-22,NA,NA,NA,NA,NA,NA,NA,NA,NA
"3688","PinotNoir","193","193Mtp1","",1958,"26/3/58",NA,NA,"19/8/58",NA,1958-03-26,NA,NA,1958-08-19,NA,146,NA,NA,NA,NA
"3689","PinotNoir","193","193Mtp1","",1959,"21/3/59",NA,NA,"17/8/59",NA,1959-03-21,NA,NA,1959-08-17,NA,149,NA,NA,NA,NA
"3690","PinotNoir","193","193Mtp1","",1960,"15/3/60",NA,NA,"1/8/1960",NA,1960-03-15,NA,NA,1960-08-01,NA,139,NA,NA,NA,NA
"3691","PinotNoir","193","193Mtp1","",1976,NA,NA,"29/7/76",NA,NA,NA,NA,1976-07-29,NA,NA,NA,NA,NA,NA,NA
"3692","PinotNoir","193","193Mtp1","",1978,NA,NA,"5/8/1978",NA,NA,NA,NA,1978-08-05,NA,NA,NA,NA,NA,NA,NA
"3693","PinotNoir","193","193Mtp1","",1980,NA,NA,"28/7/80",NA,NA,NA,NA,1980-07-28,NA,NA,NA,NA,NA,NA,NA
"3694","PinotNoir","193","193Mtp1","",1989,NA,"22/5/89","22/7/89",NA,NA,NA,1989-05-22,1989-07-22,NA,NA,NA,NA,61,NA,NA
"3695","PinotNoir","193","193Mtp1","",1994,NA,"19/5/94","25/7/94",NA,NA,NA,1994-05-19,1994-07-25,NA,NA,NA,NA,67,NA,NA
"3696","PinotNoir","193","193Mtp1","",1995,NA,"27/5/95",NA,NA,NA,NA,1995-05-27,NA,NA,NA,NA,NA,NA,NA,NA
"3697","PinotNoir","193","193Mtp1","",1996,"18/3/96","26/5/96","25/7/96","26/8/96",NA,1996-03-18,1996-05-26,1996-07-25,1996-08-26,NA,161,69,60,32,129
"3698","PinotNoir","193","193Mtp1","",2001,"11/3/2001","18/5/01","23/7/01","28/8/01",NA,2001-03-11,2001-05-18,2001-07-23,2001-08-28,NA,170,68,66,36,134
"3699","PinotNoir","193","193Mtp1","",2002,"13/3/02","23/5/02","25/7/02","8/8/2002",NA,2002-03-13,2002-05-23,2002-07-25,2002-08-08,NA,148,71,63,14,134
"3700","PinotNoir","193","193Mtp1","",2003,"22/3/03","23/5/03","22/7/03","18/8/03",NA,2003-03-22,2003-05-23,2003-07-22,2003-08-18,NA,149,62,60,27,122
"3701","PinotNoir","193","193Mtp1","",2004,"17/3/04","2/6/2004","28/7/04","19/8/04",NA,2004-03-17,2004-06-02,2004-07-28,2004-08-19,NA,155,77,56,22,133
"3702","PinotNoir","193","193Mtp1","",2005,"1/4/2005","30/5/05","27/7/05","22/8/05",NA,2005-04-01,2005-05-30,2005-07-27,2005-08-22,NA,143,59,58,26,117
"3703","PinotNoir","193","193Mtp1","",2006,"26/3/06","23/5/06","21/7/06","8/8/2006",NA,2006-03-26,2006-05-23,2006-07-21,2006-08-08,NA,135,58,59,18,117
"3704","PinotNoir","193","193Mtp1","",2007,"6/3/2007","15/5/07","17/7/07","13/8/07",NA,2007-03-06,2007-05-15,2007-07-17,2007-08-13,NA,160,70,63,27,133
"3705","PinotNoir","193","193Mtp1","",2008,"6/3/2008","19/5/08","24/7/08","13/8/08",NA,2008-03-06,2008-05-19,2008-07-24,2008-08-13,NA,160,74,66,20,140
"3706","PinotNoir","193","193Mtp1","",2009,"17/3/09","22/5/09","17/7/09","17/8/09",NA,2009-03-17,2009-05-22,2009-07-17,2009-08-17,NA,153,66,56,31,122
"3707","PinotNoir","193","193Mtp2","",1956,NA,NA,NA,"21/8/56",NA,NA,NA,NA,1956-08-21,NA,NA,NA,NA,NA,NA
"3708","PinotNoir","193","193Mtp2","",1957,"9/3/1957",NA,NA,"5/8/1957",NA,1957-03-09,NA,NA,1957-08-05,NA,149,NA,NA,NA,NA
"3709","PinotNoir","193","193Mtp2","",1958,"27/3/58",NA,NA,"21/8/58",NA,1958-03-27,NA,NA,1958-08-21,NA,147,NA,NA,NA,NA
"3710","PinotNoir","193","193Mtp2","",1959,"17/3/59",NA,NA,NA,NA,1959-03-17,NA,NA,NA,NA,NA,NA,NA,NA,NA
"3711","PinotNoir","193","193Mtp2","",1976,NA,NA,"22/7/76",NA,NA,NA,NA,1976-07-22,NA,NA,NA,NA,NA,NA,NA
"3712","PinotNoir","193","193Mtp2","",1977,NA,NA,"1/8/1977",NA,NA,NA,NA,1977-08-01,NA,NA,NA,NA,NA,NA,NA
"3713","PinotNoir","193","193Mtp2","",1978,NA,NA,"8/8/1978",NA,NA,NA,NA,1978-08-08,NA,NA,NA,NA,NA,NA,NA
"3714","PinotNoir","193","193Mtp2","",1979,NA,NA,"30/7/79",NA,NA,NA,NA,1979-07-30,NA,NA,NA,NA,NA,NA,NA
"3715","PinotNoir","193","193Mtp2","",1980,NA,NA,"28/7/80",NA,NA,NA,NA,1980-07-28,NA,NA,NA,NA,NA,NA,NA
"3716","PinotNoir","193","193Mtp2","",1982,NA,NA,"19/7/82",NA,NA,NA,NA,1982-07-19,NA,NA,NA,NA,NA,NA,NA
"3717","PinotNoir","193","193Mtp2","",1983,NA,NA,"2/8/1983",NA,NA,NA,NA,1983-08-02,NA,NA,NA,NA,NA,NA,NA
"3718","PinotNoir","193","193Mtp2","",1984,NA,NA,"6/8/1984",NA,NA,NA,NA,1984-08-06,NA,NA,NA,NA,NA,NA,NA
"3719","PinotNoir","193","193Mtp2","",1985,NA,NA,"1/8/1985",NA,NA,NA,NA,1985-08-01,NA,NA,NA,NA,NA,NA,NA
"3720","PinotNoir","193","193Mtp2","",1987,NA,"2/6/1987","3/8/1987","24/8/87",NA,NA,1987-06-02,1987-08-03,1987-08-24,NA,NA,NA,62,21,NA
"3721","PinotNoir","193","193Mtp2","",1988,"20/3/88","26/5/88","25/7/88","16/8/88",NA,1988-03-20,1988-05-26,1988-07-25,1988-08-16,NA,149,67,60,22,127
"3722","PinotNoir","193","193Mtp2","",1989,NA,"22/5/89","24/7/89",NA,NA,NA,1989-05-22,1989-07-24,NA,NA,NA,NA,63,NA,NA
"3723","PinotNoir","193","193Mtp2","",1990,NA,"19/5/90","19/7/90",NA,NA,NA,1990-05-19,1990-07-19,NA,NA,NA,NA,61,NA,NA
"3724","PinotNoir","193","193Mtp2","",1991,NA,"28/5/91","30/7/91",NA,NA,NA,1991-05-28,1991-07-30,NA,NA,NA,NA,63,NA,NA
"3725","PinotNoir","193","193Mtp2","",1992,"23/3/92","22/5/92","22/7/92","17/8/92",NA,1992-03-23,1992-05-22,1992-07-22,1992-08-17,NA,147,60,61,26,121
"3726","PinotNoir","193","193Mtp2","",1994,"10/3/1994","18/5/94","20/7/94","22/8/94",NA,1994-03-10,1994-05-18,1994-07-20,1994-08-22,NA,165,69,63,33,132
"3727","PinotNoir","193","193Mtp2","",1995,"20/3/95","23/5/95","24/7/95","21/8/95",NA,1995-03-20,1995-05-23,1995-07-24,1995-08-21,NA,154,64,62,28,126
"3728","PinotNoir","193","193Mtp2","",1996,"18/3/96","26/5/96","25/7/96","20/8/96",NA,1996-03-18,1996-05-26,1996-07-25,1996-08-20,NA,155,69,60,26,129
"3729","PinotNoir","193","193Mtp2","",1997,"10/3/1997","5/5/1997","8/7/1997","11/8/1997",NA,1997-03-10,1997-05-05,1997-07-08,1997-08-11,NA,154,56,64,34,120
"3730","PinotNoir","193","193Mtp3","",1976,NA,NA,"29/7/76",NA,NA,NA,NA,1976-07-29,NA,NA,NA,NA,NA,NA,NA
"3731","PinotNoir","193","193Mtp3","",1977,NA,NA,"1/8/1977",NA,NA,NA,NA,1977-08-01,NA,NA,NA,NA,NA,NA,NA
"3732","PinotNoir","193","193Mtp3","",1978,NA,NA,"31/7/78",NA,NA,NA,NA,1978-07-31,NA,NA,NA,NA,NA,NA,NA
"3733","PinotNoir","193","193Mtp4","",1957,NA,NA,NA,"5/8/1957",NA,NA,NA,NA,1957-08-05,NA,NA,NA,NA,NA,NA
"3734","PinotNoir","193","193Mtp4","",1958,"21/3/58",NA,NA,"18/8/58",NA,1958-03-21,NA,NA,1958-08-18,NA,150,NA,NA,NA,NA
"3735","PinotNoir","193","193Mtp4","",1959,"17/3/59",NA,NA,"11/8/1959",NA,1959-03-17,NA,NA,1959-08-11,NA,147,NA,NA,NA,NA
"3736","PinotNoir","193","193Mtp4","",1960,"12/3/1960",NA,NA,NA,NA,1960-03-12,NA,NA,NA,NA,NA,NA,NA,NA,NA
"3737","PinotNoir","193","193Mtp5","",1957,"6/3/1957",NA,NA,"19/8/57",NA,1957-03-06,NA,NA,1957-08-19,NA,166,NA,NA,NA,NA
"3738","PinotNoir","193","193Mtp5","",1958,"21/3/58",NA,NA,"18/8/58",NA,1958-03-21,NA,NA,1958-08-18,NA,150,NA,NA,NA,NA
"3739","PinotNoir","193","193Mtp5","",1959,"17/3/59",NA,NA,"11/8/1959",NA,1959-03-17,NA,NA,1959-08-11,NA,147,NA,NA,NA,NA
"3740","PinotNoir","193","193Mtp6","",1956,NA,NA,NA,"21/8/56",NA,NA,NA,NA,1956-08-21,NA,NA,NA,NA,NA,NA
"3741","PinotNoir","193","193Mtp6","",1957,NA,NA,NA,"19/8/57",NA,NA,NA,NA,1957-08-19,NA,NA,NA,NA,NA,NA
"3742","PinotNoir","193","193Mtp6","",1958,"29/3/58",NA,NA,"18/8/58",NA,1958-03-29,NA,NA,1958-08-18,NA,142,NA,NA,NA,NA
"3743","PinotNoir","193","193Mtp6","",1959,"13/3/59",NA,NA,NA,NA,1959-03-13,NA,NA,NA,NA,NA,NA,NA,NA,NA
"3744","PinotNoir","193","193Mtp6","",1960,"14/3/60",NA,NA,NA,NA,1960-03-14,NA,NA,NA,NA,NA,NA,NA,NA,NA
"3745","PinotNoir","193","193Mtp6","",1976,NA,NA,"29/7/76",NA,NA,NA,NA,1976-07-29,NA,NA,NA,NA,NA,NA,NA
"3746","PinotNoir","193","193Mtp6","",1977,NA,NA,"1/8/1977",NA,NA,NA,NA,1977-08-01,NA,NA,NA,NA,NA,NA,NA
"3747","PinotNoir","193","193Mtp6","",1978,NA,NA,"8/8/1978",NA,NA,NA,NA,1978-08-08,NA,NA,NA,NA,NA,NA,NA
"3748","PinotNoir","193","193Mtp6","",1979,NA,NA,"30/7/79",NA,NA,NA,NA,1979-07-30,NA,NA,NA,NA,NA,NA,NA
"3749","PinotNoir","193","193Mtp6","",1980,NA,NA,"28/7/80",NA,NA,NA,NA,1980-07-28,NA,NA,NA,NA,NA,NA,NA
"3750","PinotNoir","193","193Mtp6","",1982,NA,NA,"19/7/82",NA,NA,NA,NA,1982-07-19,NA,NA,NA,NA,NA,NA,NA
"3751","PinotNoir","193","193Mtp6","",1983,NA,NA,"2/8/1983",NA,NA,NA,NA,1983-08-02,NA,NA,NA,NA,NA,NA,NA
"3752","PinotNoir","193","193Mtp6","",1984,NA,NA,"6/8/1984",NA,NA,NA,NA,1984-08-06,NA,NA,NA,NA,NA,NA,NA
"3753","PinotNoir","193","193Mtp6","",1985,NA,NA,"1/8/1985",NA,NA,NA,NA,1985-08-01,NA,NA,NA,NA,NA,NA,NA
"3754","PinotNoir","193","193Mtp6","",1987,NA,"2/6/1987","3/8/1987","17/8/87",NA,NA,1987-06-02,1987-08-03,1987-08-17,NA,NA,NA,62,14,NA
"3755","PinotNoir","193","193Mtp6","",1988,"16/3/88","26/5/88","25/7/88","16/8/88",NA,1988-03-16,1988-05-26,1988-07-25,1988-08-16,NA,153,71,60,22,131
"3756","PinotNoir","193","193Mtp6","",1989,NA,"24/5/89","24/7/89",NA,NA,NA,1989-05-24,1989-07-24,NA,NA,NA,NA,61,NA,NA
"3757","PinotNoir","193","193Mtp6","",1990,NA,"18/5/90","19/7/90",NA,NA,NA,1990-05-18,1990-07-19,NA,NA,NA,NA,62,NA,NA
"3758","PinotNoir","193","193Mtp6","",1991,NA,"3/6/1991","30/7/91",NA,NA,NA,1991-06-03,1991-07-30,NA,NA,NA,NA,57,NA,NA
"3759","PinotNoir","193","193Mtp6","",1992,"23/3/92","22/5/92","22/7/92","17/8/92",NA,1992-03-23,1992-05-22,1992-07-22,1992-08-17,NA,147,60,61,26,121
"3760","PinotNoir","193","193Mtp6","",1994,"3/3/1994","18/5/94","21/7/94","22/8/94",NA,1994-03-03,1994-05-18,1994-07-21,1994-08-22,NA,172,76,64,32,140
"3761","PinotNoir","193","193Mtp6","",1995,"13/3/95","23/5/95","24/7/95","21/8/95",NA,1995-03-13,1995-05-23,1995-07-24,1995-08-21,NA,161,71,62,28,133
"3762","PinotNoir","193","193Mtp6","",1996,"18/3/96","26/5/96","25/7/96","20/8/96",NA,1996-03-18,1996-05-26,1996-07-25,1996-08-20,NA,155,69,60,26,129
"3763","PinotNoir","193","193Mtp6","",1997,"1/3/1997","5/5/1997","8/7/1997","11/8/1997",NA,1997-03-01,1997-05-05,1997-07-08,1997-08-11,NA,163,65,64,34,129
"3764","PinotNoir","193","193Mtp6","",1998,"18/3/98","22/5/98","20/7/98","17/8/98",NA,1998-03-18,1998-05-22,1998-07-20,1998-08-17,NA,152,65,59,28,124
"3765","PinotNoir","193","193Mtp6","",1999,"14/3/99","23/5/99","19/7/99","24/8/99",NA,1999-03-14,1999-05-23,1999-07-19,1999-08-24,NA,163,70,57,36,127
"3766","PinotNoir","193","193Mtp6","",2000,"24/3/00","29/5/00","24/7/00","17/8/00",NA,2000-03-24,2000-05-29,2000-07-24,2000-08-17,NA,146,66,56,24,122
"3767","PinotNoir","193","193Mtp8","",1956,"27/3/56",NA,NA,"10/9/1956",NA,1956-03-27,NA,NA,1956-09-10,NA,167,NA,NA,NA,NA
"3768","PinotNoir","193","193Mtp8","",1957,"10/3/1957",NA,NA,"19/8/57",NA,1957-03-10,NA,NA,1957-08-19,NA,162,NA,NA,NA,NA
"3769","PinotNoir","193","193Mtp8","",1958,"28/3/58",NA,NA,"18/8/58",NA,1958-03-28,NA,NA,1958-08-18,NA,143,NA,NA,NA,NA
"3770","PinotNoir","193","193Mtp9","",1956,"28/3/56",NA,NA,"14/8/56",NA,1956-03-28,NA,NA,1956-08-14,NA,139,NA,NA,NA,NA
"3771","PinotNoir","193","193Mtp9","",1957,"10/3/1957",NA,NA,"19/8/57",NA,1957-03-10,NA,NA,1957-08-19,NA,162,NA,NA,NA,NA
"3772","PinotNoir","193","193Mtp9","",1958,"24/3/58",NA,NA,"18/8/58",NA,1958-03-24,NA,NA,1958-08-18,NA,147,NA,NA,NA,NA
"3773","PinotNoir","193","193Mtp10","",1956,"30/3/56",NA,NA,"14/8/56",NA,1956-03-30,NA,NA,1956-08-14,NA,137,NA,NA,NA,NA
"3774","PinotNoir","193","193Mtp10","",1957,"13/3/57",NA,NA,"19/8/57",NA,1957-03-13,NA,NA,1957-08-19,NA,159,NA,NA,NA,NA
"3775","PinotNoir","193","193Mtp10","",1958,"26/3/58",NA,NA,"18/8/58",NA,1958-03-26,NA,NA,1958-08-18,NA,145,NA,NA,NA,NA
"3776","PinotNoir","193","193Mtp11","",1958,"26/3/58",NA,NA,"19/8/58",NA,1958-03-26,NA,NA,1958-08-19,NA,146,NA,NA,NA,NA
"3777","PinotNoir","193","193Mtp11","",1959,"16/3/59",NA,NA,"10/8/1959",NA,1959-03-16,NA,NA,1959-08-10,NA,147,NA,NA,NA,NA
"3778","PinotNoir","193","193Mtp11","",1960,"14/3/60",NA,NA,"1/8/1960",NA,1960-03-14,NA,NA,1960-08-01,NA,140,NA,NA,NA,NA
"3779","PinotNoir","193","193Mtp11","",1961,NA,NA,NA,"14/8/61",NA,NA,NA,NA,1961-08-14,NA,NA,NA,NA,NA,NA
"3780","PinotNoir","193","193Mtp12","",1956,"28/3/56",NA,NA,"10/9/1956",NA,1956-03-28,NA,NA,1956-09-10,NA,166,NA,NA,NA,NA
"3781","PinotNoir","193","193Mtp12","",1957,"13/3/57",NA,NA,"19/8/57",NA,1957-03-13,NA,NA,1957-08-19,NA,159,NA,NA,NA,NA
"3782","PinotNoir","193","193Mtp12","",1958,"25/3/58",NA,NA,"18/8/58",NA,1958-03-25,NA,NA,1958-08-18,NA,146,NA,NA,NA,NA
"3783","PinotNoir","193","193Mtp13","",1956,"28/3/56",NA,NA,"21/8/56",NA,1956-03-28,NA,NA,1956-08-21,NA,146,NA,NA,NA,NA
"3784","PinotNoir","193","193Mtp13","",1957,"13/3/57",NA,NA,"19/8/57",NA,1957-03-13,NA,NA,1957-08-19,NA,159,NA,NA,NA,NA
"3785","PinotNoir","193","193Mtp13","",1958,"27/3/58",NA,NA,"18/8/58",NA,1958-03-27,NA,NA,1958-08-18,NA,144,NA,NA,NA,NA
"3786","PinotNoir","193","193Mtp14","",1956,"28/3/56",NA,NA,"14/8/56",NA,1956-03-28,NA,NA,1956-08-14,NA,139,NA,NA,NA,NA
"3787","PinotNoir","193","193Mtp14","",1957,"13/3/57",NA,NA,"19/8/57",NA,1957-03-13,NA,NA,1957-08-19,NA,159,NA,NA,NA,NA
"3788","PinotNoir","193","193Mtp14","",1958,"28/3/58",NA,NA,"19/8/58",NA,1958-03-28,NA,NA,1958-08-19,NA,144,NA,NA,NA,NA
"3789","PinotNoir","193","193Mtp15","",1956,"28/3/56",NA,NA,"14/8/56",NA,1956-03-28,NA,NA,1956-08-14,NA,139,NA,NA,NA,NA
"3790","PinotNoir","193","193Mtp15","",1957,"11/3/1957",NA,NA,"19/8/57",NA,1957-03-11,NA,NA,1957-08-19,NA,161,NA,NA,NA,NA
"3791","PinotNoir","193","193Mtp15","",1958,"29/3/58",NA,NA,"27/8/58",NA,1958-03-29,NA,NA,1958-08-27,NA,151,NA,NA,NA,NA
"3792","PinotNoir","193","193Mtp16","",1956,NA,NA,NA,"27/8/56",NA,NA,NA,NA,1956-08-27,NA,NA,NA,NA,NA,NA
"3793","PinotNoir","193","193Mtp16","",1957,"9/3/1957",NA,NA,"19/8/57",NA,1957-03-09,NA,NA,1957-08-19,NA,163,NA,NA,NA,NA
"3794","PinotNoir","193","193Mtp16","",1958,"29/3/58",NA,NA,"21/8/58",NA,1958-03-29,NA,NA,1958-08-21,NA,145,NA,NA,NA,NA
"3795","PinotNoir","193","193Mtp16","",1959,"13/3/59",NA,NA,NA,NA,1959-03-13,NA,NA,NA,NA,NA,NA,NA,NA,NA
"3796","PinotNoir","193","193Mtp16","",1960,"12/3/1960",NA,NA,NA,NA,1960-03-12,NA,NA,NA,NA,NA,NA,NA,NA,NA
"3797","PinotNoir","193","193Mtp16","",1961,"27/2/61",NA,NA,NA,NA,1961-02-27,NA,NA,NA,NA,NA,NA,NA,NA,NA
"3798","PinotNoir","193","193Mtp17","",1956,NA,NA,NA,"27/8/56",NA,NA,NA,NA,1956-08-27,NA,NA,NA,NA,NA,NA
"3799","PinotNoir","193","193Mtp17","",1957,"9/3/1957",NA,NA,"19/8/57",NA,1957-03-09,NA,NA,1957-08-19,NA,163,NA,NA,NA,NA
"3800","PinotNoir","193","193Mtp17","",1958,"26/3/58",NA,NA,"21/8/58",NA,1958-03-26,NA,NA,1958-08-21,NA,148,NA,NA,NA,NA
"3801","PinotNoir","193","193Mtp17","",1959,"11/3/1959",NA,NA,NA,NA,1959-03-11,NA,NA,NA,NA,NA,NA,NA,NA,NA
"3802","PinotNoir","193","193Mtp17","",1960,"12/3/1960",NA,NA,NA,NA,1960-03-12,NA,NA,NA,NA,NA,NA,NA,NA,NA
"3803","PinotNoir","193","193Mtp17","",1961,"6/3/1961",NA,NA,NA,NA,1961-03-06,NA,NA,NA,NA,NA,NA,NA,NA,NA
"3804","PinotNoir","193","193Mtp18","",1956,"26/3/56",NA,NA,"14/8/56",NA,1956-03-26,NA,NA,1956-08-14,NA,141,NA,NA,NA,NA
"3805","PinotNoir","193","193Mtp18","",1957,"13/3/57",NA,NA,"12/8/1957",NA,1957-03-13,NA,NA,1957-08-12,NA,152,NA,NA,NA,NA
"3806","PinotNoir","193","193Mtp18","",1958,"28/3/58",NA,NA,"18/8/58",NA,1958-03-28,NA,NA,1958-08-18,NA,143,NA,NA,NA,NA
"3807","PinotNoir","193","193Mtp18","",1959,"19/3/59",NA,NA,NA,NA,1959-03-19,NA,NA,NA,NA,NA,NA,NA,NA,NA
"3808","PinotNoir","193","193Mtp18","",1976,NA,NA,"29/7/76",NA,NA,NA,NA,1976-07-29,NA,NA,NA,NA,NA,NA,NA
"3809","PinotNoir","193","193Mtp18","",1977,NA,NA,"5/8/1977",NA,NA,NA,NA,1977-08-05,NA,NA,NA,NA,NA,NA,NA
"3810","PinotNoir","193","193Mtp18","",1978,NA,NA,"8/8/1978",NA,NA,NA,NA,1978-08-08,NA,NA,NA,NA,NA,NA,NA
"3811","PinotNoir","193","193Mtp18","",1979,NA,NA,"30/7/79",NA,NA,NA,NA,1979-07-30,NA,NA,NA,NA,NA,NA,NA
"3812","PinotNoir","193","193Mtp18","",1980,NA,NA,"4/8/1980",NA,NA,NA,NA,1980-08-04,NA,NA,NA,NA,NA,NA,NA
"3813","PinotNoir","193","193Mtp18","",1982,NA,NA,"19/7/82",NA,NA,NA,NA,1982-07-19,NA,NA,NA,NA,NA,NA,NA
"3814","PinotNoir","193","193Mtp18","",1983,NA,NA,"2/8/1983",NA,NA,NA,NA,1983-08-02,NA,NA,NA,NA,NA,NA,NA
"3815","PinotNoir","193","193Mtp18","",1984,NA,NA,"6/8/1984",NA,NA,NA,NA,1984-08-06,NA,NA,NA,NA,NA,NA,NA
"3816","PinotNoir","193","193Mtp18","",1985,NA,NA,"1/8/1985",NA,NA,NA,NA,1985-08-01,NA,NA,NA,NA,NA,NA,NA
"3817","PinotNoir","193","193Mtp18","",1996,NA,"26/5/96",NA,NA,NA,NA,1996-05-26,NA,NA,NA,NA,NA,NA,NA,NA
"3818","PinotNoir","193","193Mtp18","",1998,"17/3/98","22/5/98","21/7/98","17/8/98",NA,1998-03-17,1998-05-22,1998-07-21,1998-08-17,NA,153,66,60,27,126
"3819","PinotNoir","193","193Mtp18","",1999,"17/3/99","22/5/99","19/7/99","24/8/99",NA,1999-03-17,1999-05-22,1999-07-19,1999-08-24,NA,160,66,58,36,124
"3820","PinotNoir","193","193Mtp18","",2000,"21/3/00","26/5/00","24/7/00","17/8/00",NA,2000-03-21,2000-05-26,2000-07-24,2000-08-17,NA,149,66,59,24,125
"3821","PinotNoir","193","193Mtp21","",1956,"30/3/56",NA,NA,"14/8/56",NA,1956-03-30,NA,NA,1956-08-14,NA,137,NA,NA,NA,NA
"3822","PinotNoir","193","193Mtp21","",1957,"13/3/57",NA,NA,"19/8/57",NA,1957-03-13,NA,NA,1957-08-19,NA,159,NA,NA,NA,NA
"3823","PinotNoir","193","193Mtp21","",1958,"28/3/58",NA,NA,"18/8/58",NA,1958-03-28,NA,NA,1958-08-18,NA,143,NA,NA,NA,NA
"3824","PinotNoir","193","193Mtp22","",1956,"26/3/56",NA,NA,"27/8/56",NA,1956-03-26,NA,NA,1956-08-27,NA,154,NA,NA,NA,NA
"3825","PinotNoir","193","193Mtp22","",1957,"11/3/1957",NA,NA,"12/8/1957",NA,1957-03-11,NA,NA,1957-08-12,NA,154,NA,NA,NA,NA
"3826","PinotNoir","193","193Mtp22","",1958,"29/3/58",NA,NA,"18/8/58",NA,1958-03-29,NA,NA,1958-08-18,NA,142,NA,NA,NA,NA
"3827","PinotNoir","193","193Mtp22","",1959,"25/3/59",NA,NA,NA,NA,1959-03-25,NA,NA,NA,NA,NA,NA,NA,NA,NA
"3828","PinotNoir","193","193Mtp22","",1960,"18/3/60",NA,NA,NA,NA,1960-03-18,NA,NA,NA,NA,NA,NA,NA,NA,NA
"3829","PinotNoir","193","193Mtp23","",1956,"28/3/56",NA,NA,"27/8/56",NA,1956-03-28,NA,NA,1956-08-27,NA,152,NA,NA,NA,NA
"3830","PinotNoir","193","193Mtp23","",1957,"7/3/1957",NA,NA,"19/8/57",NA,1957-03-07,NA,NA,1957-08-19,NA,165,NA,NA,NA,NA
"3831","PinotNoir","193","193Mtp23","",1958,"26/3/58",NA,NA,"18/8/58",NA,1958-03-26,NA,NA,1958-08-18,NA,145,NA,NA,NA,NA
"3832","PinotNoir","193","193Mtp24","",1956,"28/3/56",NA,NA,"28/8/56",NA,1956-03-28,NA,NA,1956-08-28,NA,153,NA,NA,NA,NA
"3833","PinotNoir","193","193Mtp24","",1957,"12/3/1957",NA,NA,"19/8/57",NA,1957-03-12,NA,NA,1957-08-19,NA,160,NA,NA,NA,NA
"3834","PinotNoir","193","193Mtp24","",1958,"25/3/58",NA,NA,"21/8/58",NA,1958-03-25,NA,NA,1958-08-21,NA,149,NA,NA,NA,NA
"3835","PinotNoir","193","193Mtp25","",1956,"28/3/56",NA,NA,"10/9/1956",NA,1956-03-28,NA,NA,1956-09-10,NA,166,NA,NA,NA,NA
"3836","PinotNoir","193","193Mtp25","",1957,"10/3/1957",NA,NA,"19/8/57",NA,1957-03-10,NA,NA,1957-08-19,NA,162,NA,NA,NA,NA
"3837","PinotNoir","193","193Mtp25","",1958,"28/3/58",NA,NA,"18/8/58",NA,1958-03-28,NA,NA,1958-08-18,NA,143,NA,NA,NA,NA
"3838","PinotNoir","193","193Mtp26","",1956,"28/3/56",NA,NA,"14/8/56",NA,1956-03-28,NA,NA,1956-08-14,NA,139,NA,NA,NA,NA
"3839","PinotNoir","193","193Mtp26","",1957,"7/3/1957",NA,NA,"19/8/57",NA,1957-03-07,NA,NA,1957-08-19,NA,165,NA,NA,NA,NA
"3840","PinotNoir","193","193Mtp26","",1958,"28/3/58",NA,NA,"21/8/58",NA,1958-03-28,NA,NA,1958-08-21,NA,146,NA,NA,NA,NA
"3841","PinotNoir","193","193Mtp27","",1956,"25/3/56",NA,NA,"14/8/56",NA,1956-03-25,NA,NA,1956-08-14,NA,142,NA,NA,NA,NA
"3842","PinotNoir","193","193Mtp27","",1957,"10/3/1957",NA,NA,"12/8/1957",NA,1957-03-10,NA,NA,1957-08-12,NA,155,NA,NA,NA,NA
"3843","PinotNoir","193","193Mtp27","",1958,"25/3/58",NA,NA,"18/8/58",NA,1958-03-25,NA,NA,1958-08-18,NA,146,NA,NA,NA,NA
"3844","PinotNoir","193","193Mtp28","",1956,"30/3/56",NA,NA,"21/8/56",NA,1956-03-30,NA,NA,1956-08-21,NA,144,NA,NA,NA,NA
"3845","PinotNoir","193","193Mtp28","",1957,"15/3/57",NA,NA,"19/8/57",NA,1957-03-15,NA,NA,1957-08-19,NA,157,NA,NA,NA,NA
"3846","PinotNoir","193","193Mtp28","",1958,"29/3/58",NA,NA,"18/8/58",NA,1958-03-29,NA,NA,1958-08-18,NA,142,NA,NA,NA,NA
"3847","PinotNoir","193","193Mtp28","",1976,NA,NA,"5/8/1976",NA,NA,NA,NA,1976-08-05,NA,NA,NA,NA,NA,NA,NA
"3848","PinotNoir","193","193Mtp28","",1977,NA,NA,"8/8/1977",NA,NA,NA,NA,1977-08-08,NA,NA,NA,NA,NA,NA,NA
"3849","PinotNoir","193","193Mtp28","",1978,NA,NA,"12/8/1978",NA,NA,NA,NA,1978-08-12,NA,NA,NA,NA,NA,NA,NA
"3850","PinotNoir","193","193Mtp28","",1979,NA,NA,"30/7/79",NA,NA,NA,NA,1979-07-30,NA,NA,NA,NA,NA,NA,NA
"3851","PinotNoir","193","193Mtp28","",1980,NA,NA,"4/8/1980",NA,NA,NA,NA,1980-08-04,NA,NA,NA,NA,NA,NA,NA
"3852","PinotNoir","193","193Mtp28","",1982,NA,NA,"22/7/82",NA,NA,NA,NA,1982-07-22,NA,NA,NA,NA,NA,NA,NA
"3853","PinotNoir","193","193Mtp28","",1983,NA,NA,"2/8/1983",NA,NA,NA,NA,1983-08-02,NA,NA,NA,NA,NA,NA,NA
"3854","PinotNoir","193","193Mtp28","",1984,NA,NA,"9/8/1984",NA,NA,NA,NA,1984-08-09,NA,NA,NA,NA,NA,NA,NA
"3855","PinotNoir","193","193Mtp28","",1985,NA,NA,"4/8/1985",NA,NA,NA,NA,1985-08-04,NA,NA,NA,NA,NA,NA,NA
"3856","PinotNoir","193","193Mtp28","",1996,NA,"26/5/96",NA,NA,NA,NA,1996-05-26,NA,NA,NA,NA,NA,NA,NA,NA
"3857","PinotNoir","193","193Mtp29","",1956,"30/3/56",NA,NA,"14/8/56",NA,1956-03-30,NA,NA,1956-08-14,NA,137,NA,NA,NA,NA
"3858","PinotNoir","193","193Mtp29","",1957,"13/3/57",NA,NA,"19/8/57",NA,1957-03-13,NA,NA,1957-08-19,NA,159,NA,NA,NA,NA
"3859","PinotNoir","193","193Mtp29","",1958,"29/3/58",NA,NA,"21/8/58",NA,1958-03-29,NA,NA,1958-08-21,NA,145,NA,NA,NA,NA
"3860","PinotNoir","193","193Mtp30","",1956,"30/3/56",NA,NA,"3/9/1956",NA,1956-03-30,NA,NA,1956-09-03,NA,157,NA,NA,NA,NA
"3861","PinotNoir","193","193Mtp30","",1957,"11/3/1957",NA,NA,"19/8/57",NA,1957-03-11,NA,NA,1957-08-19,NA,161,NA,NA,NA,NA
"3862","PinotNoir","193","193Mtp30","",1958,"24/3/58",NA,NA,"18/8/58",NA,1958-03-24,NA,NA,1958-08-18,NA,147,NA,NA,NA,NA
"3863","PinotNoir","193","193Mtp31","",1956,"27/3/56",NA,NA,"14/8/56",NA,1956-03-27,NA,NA,1956-08-14,NA,140,NA,NA,NA,NA
"3864","PinotNoir","193","193Mtp31","",1957,"13/3/57",NA,NA,"19/8/57",NA,1957-03-13,NA,NA,1957-08-19,NA,159,NA,NA,NA,NA
"3865","PinotNoir","193","193Mtp31","",1958,"25/3/58",NA,NA,"18/8/58",NA,1958-03-25,NA,NA,1958-08-18,NA,146,NA,NA,NA,NA
"3866","PinotNoir","193","193Mtp31","",1976,NA,NA,"29/7/76",NA,NA,NA,NA,1976-07-29,NA,NA,NA,NA,NA,NA,NA
"3867","PinotNoir","193","193Mtp31","",1977,NA,NA,"8/8/1977",NA,NA,NA,NA,1977-08-08,NA,NA,NA,NA,NA,NA,NA
"3868","PinotNoir","193","193Mtp31","",1978,NA,NA,"8/8/1978",NA,NA,NA,NA,1978-08-08,NA,NA,NA,NA,NA,NA,NA
"3869","PinotNoir","193","193Mtp31","",1979,NA,NA,"30/7/79",NA,NA,NA,NA,1979-07-30,NA,NA,NA,NA,NA,NA,NA
"3870","PinotNoir","193","193Mtp31","",1980,NA,NA,"4/8/1980",NA,NA,NA,NA,1980-08-04,NA,NA,NA,NA,NA,NA,NA
"3871","PinotNoir","193","193Mtp31","",1982,NA,NA,"26/7/82",NA,NA,NA,NA,1982-07-26,NA,NA,NA,NA,NA,NA,NA
"3872","PinotNoir","193","193Mtp31","",1983,NA,NA,"6/8/1983",NA,NA,NA,NA,1983-08-06,NA,NA,NA,NA,NA,NA,NA
"3873","PinotNoir","193","193Mtp31","",1984,NA,NA,"9/8/1984",NA,NA,NA,NA,1984-08-09,NA,NA,NA,NA,NA,NA,NA
"3874","PinotNoir","193","193Mtp31","",1985,NA,NA,"1/8/1985",NA,NA,NA,NA,1985-08-01,NA,NA,NA,NA,NA,NA,NA
"3875","PinotNoir","193","193Mtp31","",1987,NA,"3/6/1987","30/7/87","24/8/87",NA,NA,1987-06-03,1987-07-30,1987-08-24,NA,NA,NA,57,25,NA
"3876","PinotNoir","193","193Mtp31","",1988,"20/3/88","26/5/88","28/7/88","16/8/88",NA,1988-03-20,1988-05-26,1988-07-28,1988-08-16,NA,149,67,63,19,130
"3877","PinotNoir","193","193Mtp31","",1989,NA,"23/5/89","24/7/89",NA,NA,NA,1989-05-23,1989-07-24,NA,NA,NA,NA,62,NA,NA
"3878","PinotNoir","193","193Mtp31","",1990,NA,"19/5/90","23/7/90",NA,NA,NA,1990-05-19,1990-07-23,NA,NA,NA,NA,65,NA,NA
"3879","PinotNoir","193","193Mtp31","",1991,NA,"1/6/1991","5/8/1991",NA,NA,NA,1991-06-01,1991-08-05,NA,NA,NA,NA,65,NA,NA
"3880","PinotNoir","193","193Mtp31","",1992,"23/3/92","22/5/92","27/7/92","17/8/92",NA,1992-03-23,1992-05-22,1992-07-27,1992-08-17,NA,147,60,66,21,126
"3881","PinotNoir","193","193Mtp31","",1994,"7/3/1994","20/5/94","25/7/94","22/8/94",NA,1994-03-07,1994-05-20,1994-07-25,1994-08-22,NA,168,74,66,28,140
"3882","PinotNoir","193","193Mtp31","",1995,"13/3/95","23/5/95","1/8/1995","21/8/95",NA,1995-03-13,1995-05-23,1995-08-01,1995-08-21,NA,161,71,70,20,141
"3883","PinotNoir","193","193Mtp31","",1996,"18/3/96","26/5/96","26/7/96","20/8/96",NA,1996-03-18,1996-05-26,1996-07-26,1996-08-20,NA,155,69,61,25,130
"3884","PinotNoir","193","193Mtp31","",1997,"7/3/1997","17/5/97","13/7/97","11/8/1997",NA,1997-03-07,1997-05-17,1997-07-13,1997-08-11,NA,157,71,57,29,128
"3885","PinotNoir","193","193Mtp32","",1956,"30/3/56",NA,NA,"10/9/1956",NA,1956-03-30,NA,NA,1956-09-10,NA,164,NA,NA,NA,NA
"3886","PinotNoir","193","193Mtp32","",1957,"13/3/57",NA,NA,"2/9/1957",NA,1957-03-13,NA,NA,1957-09-02,NA,173,NA,NA,NA,NA
"3887","PinotNoir","193","193Mtp32","",1958,"29/3/58",NA,NA,"27/8/58",NA,1958-03-29,NA,NA,1958-08-27,NA,151,NA,NA,NA,NA
"3888","PinotNoir","193","193Mtp33","",1956,"26/3/56",NA,NA,"4/9/1956",NA,1956-03-26,NA,NA,1956-09-04,NA,162,NA,NA,NA,NA
"3889","PinotNoir","193","193Mtp33","",1957,"10/3/1957",NA,NA,"14/8/57",NA,1957-03-10,NA,NA,1957-08-14,NA,157,NA,NA,NA,NA
"3890","PinotNoir","193","193Mtp33","",1958,"28/3/58",NA,NA,"22/8/58",NA,1958-03-28,NA,NA,1958-08-22,NA,147,NA,NA,NA,NA
"3891","PinotNoir","193","193Mtp33","",1959,"19/3/59",NA,NA,NA,NA,1959-03-19,NA,NA,NA,NA,NA,NA,NA,NA,NA
"3892","PinotNoir","193","193Mtp33","",1976,NA,NA,"29/7/76",NA,NA,NA,NA,1976-07-29,NA,NA,NA,NA,NA,NA,NA
"3893","PinotNoir","193","193Mtp33","",1977,NA,NA,"5/8/1977",NA,NA,NA,NA,1977-08-05,NA,NA,NA,NA,NA,NA,NA
"3894","PinotNoir","193","193Mtp33","",1978,NA,NA,"8/8/1978",NA,NA,NA,NA,1978-08-08,NA,NA,NA,NA,NA,NA,NA
"3895","PinotNoir","193","193Mtp33","",1979,NA,NA,"30/7/79",NA,NA,NA,NA,1979-07-30,NA,NA,NA,NA,NA,NA,NA
"3896","PinotNoir","193","193Mtp33","",1980,NA,NA,"4/8/1980",NA,NA,NA,NA,1980-08-04,NA,NA,NA,NA,NA,NA,NA
"3897","PinotNoir","193","193Mtp33","",1982,NA,NA,"22/7/82",NA,NA,NA,NA,1982-07-22,NA,NA,NA,NA,NA,NA,NA
"3898","PinotNoir","193","193Mtp33","",1983,NA,NA,"2/8/1983",NA,NA,NA,NA,1983-08-02,NA,NA,NA,NA,NA,NA,NA
"3899","PinotNoir","193","193Mtp33","",1984,NA,NA,"6/8/1984",NA,NA,NA,NA,1984-08-06,NA,NA,NA,NA,NA,NA,NA
"3900","PinotNoir","193","193Mtp33","",1985,NA,NA,"1/8/1985",NA,NA,NA,NA,1985-08-01,NA,NA,NA,NA,NA,NA,NA
"3901","PinotNoir","193","193Mtp33","",1987,NA,"3/6/1987","30/7/87","17/8/87",NA,NA,1987-06-03,1987-07-30,1987-08-17,NA,NA,NA,57,18,NA
"3902","PinotNoir","193","193Mtp33","",1988,"20/3/88","26/5/88","28/7/88","16/8/88",NA,1988-03-20,1988-05-26,1988-07-28,1988-08-16,NA,149,67,63,19,130
"3903","PinotNoir","193","193Mtp33","",1989,NA,"22/5/89","24/7/89",NA,NA,NA,1989-05-22,1989-07-24,NA,NA,NA,NA,63,NA,NA
"3904","PinotNoir","193","193Mtp33","",1990,NA,"19/5/90","19/7/90",NA,NA,NA,1990-05-19,1990-07-19,NA,NA,NA,NA,61,NA,NA
"3905","PinotNoir","193","193Mtp33","",1991,NA,"1/6/1991","5/8/1991",NA,NA,NA,1991-06-01,1991-08-05,NA,NA,NA,NA,65,NA,NA
"3906","PinotNoir","193","193Mtp33","",1992,"23/3/92","22/5/92","27/7/92","17/8/92",NA,1992-03-23,1992-05-22,1992-07-27,1992-08-17,NA,147,60,66,21,126
"3907","PinotNoir","193","193Mtp33","",1994,"3/3/1994","18/5/94","25/7/94","22/8/94",NA,1994-03-03,1994-05-18,1994-07-25,1994-08-22,NA,172,76,68,28,144
"3908","PinotNoir","193","193Mtp33","",1995,"13/3/95","23/5/95","24/7/95","21/8/95",NA,1995-03-13,1995-05-23,1995-07-24,1995-08-21,NA,161,71,62,28,133
"3909","PinotNoir","193","193Mtp33","",1996,"18/3/96","26/5/96","26/7/96","20/8/96",NA,1996-03-18,1996-05-26,1996-07-26,1996-08-20,NA,155,69,61,25,130
"3910","PinotNoir","193","193Mtp33","",1997,"7/3/1997","17/5/97","13/7/97","11/8/1997",NA,1997-03-07,1997-05-17,1997-07-13,1997-08-11,NA,157,71,57,29,128
"3911","PinotNoir","193","193Mtp35","",1956,"28/3/56",NA,NA,"28/8/56",NA,1956-03-28,NA,NA,1956-08-28,NA,153,NA,NA,NA,NA
"3912","PinotNoir","193","193Mtp35","",1957,"11/3/1957",NA,NA,"19/8/57",NA,1957-03-11,NA,NA,1957-08-19,NA,161,NA,NA,NA,NA
"3913","PinotNoir","193","193Mtp35","",1958,"26/3/58",NA,NA,"18/8/58",NA,1958-03-26,NA,NA,1958-08-18,NA,145,NA,NA,NA,NA
"3914","PinotNoir","193","193Mtp37","",1956,"28/3/56",NA,NA,"27/8/56",NA,1956-03-28,NA,NA,1956-08-27,NA,152,NA,NA,NA,NA
"3915","PinotNoir","193","193Mtp37","",1957,"11/3/1957",NA,NA,"20/8/57",NA,1957-03-11,NA,NA,1957-08-20,NA,162,NA,NA,NA,NA
"3916","PinotNoir","193","193Mtp37","",1958,"27/3/58",NA,NA,"4/9/1958",NA,1958-03-27,NA,NA,1958-09-04,NA,161,NA,NA,NA,NA
"3917","PinotNoir","193","193Mtp38","",1956,"28/3/56",NA,NA,"14/8/56",NA,1956-03-28,NA,NA,1956-08-14,NA,139,NA,NA,NA,NA
"3918","PinotNoir","193","193Mtp38","",1957,"16/3/57",NA,NA,"19/8/57",NA,1957-03-16,NA,NA,1957-08-19,NA,156,NA,NA,NA,NA
"3919","PinotNoir","193","193Mtp38","",1958,"25/3/58",NA,NA,"18/8/58",NA,1958-03-25,NA,NA,1958-08-18,NA,146,NA,NA,NA,NA
"3920","PinotNoir","193","193Mtp38","",1959,"20/3/59",NA,NA,NA,NA,1959-03-20,NA,NA,NA,NA,NA,NA,NA,NA,NA
"3921","PinotNoir","193","193Mtp38","",1976,NA,NA,"29/7/76",NA,NA,NA,NA,1976-07-29,NA,NA,NA,NA,NA,NA,NA
"3922","PinotNoir","193","193Mtp38","",1977,NA,NA,"5/8/1977",NA,NA,NA,NA,1977-08-05,NA,NA,NA,NA,NA,NA,NA
"3923","PinotNoir","193","193Mtp38","",1978,NA,NA,"8/8/1978",NA,NA,NA,NA,1978-08-08,NA,NA,NA,NA,NA,NA,NA
"3924","PinotNoir","193","193Mtp38","",1979,NA,NA,"30/7/79",NA,NA,NA,NA,1979-07-30,NA,NA,NA,NA,NA,NA,NA
"3925","PinotNoir","193","193Mtp38","",1980,NA,NA,"4/8/1980",NA,NA,NA,NA,1980-08-04,NA,NA,NA,NA,NA,NA,NA
"3926","PinotNoir","193","193Mtp38","",1982,NA,NA,"22/7/82",NA,NA,NA,NA,1982-07-22,NA,NA,NA,NA,NA,NA,NA
"3927","PinotNoir","193","193Mtp38","",1983,NA,NA,"2/8/1983",NA,NA,NA,NA,1983-08-02,NA,NA,NA,NA,NA,NA,NA
"3928","PinotNoir","193","193Mtp38","",1984,NA,NA,"6/8/1984",NA,NA,NA,NA,1984-08-06,NA,NA,NA,NA,NA,NA,NA
"3929","PinotNoir","193","193Mtp38","",1985,NA,NA,"1/8/1985",NA,NA,NA,NA,1985-08-01,NA,NA,NA,NA,NA,NA,NA
"3930","PinotNoir","193","193Mtp38","",1987,NA,"2/6/1987","30/7/87","24/8/87",NA,NA,1987-06-02,1987-07-30,1987-08-24,NA,NA,NA,58,25,NA
"3931","PinotNoir","193","193Mtp38","",1988,"20/3/88","26/5/88","28/7/88","16/8/88",NA,1988-03-20,1988-05-26,1988-07-28,1988-08-16,NA,149,67,63,19,130
"3932","PinotNoir","193","193Mtp38","",1996,NA,"26/5/96",NA,NA,NA,NA,1996-05-26,NA,NA,NA,NA,NA,NA,NA,NA
"3933","PinotNoir","193","193Mtp39","",1958,"28/3/58",NA,NA,"28/8/58",NA,1958-03-28,NA,NA,1958-08-28,NA,153,NA,NA,NA,NA
"3934","PinotNoir","193","193Mtp39","",1959,"16/3/59",NA,NA,"17/8/59",NA,1959-03-16,NA,NA,1959-08-17,NA,154,NA,NA,NA,NA
"3935","PinotNoir","193","193Mtp39","",1960,"14/3/60",NA,NA,"8/8/1960",NA,1960-03-14,NA,NA,1960-08-08,NA,147,NA,NA,NA,NA
"3936","PinotNoir","193","193Mtp39","",1961,"9/3/1961",NA,NA,NA,NA,1961-03-09,NA,NA,NA,NA,NA,NA,NA,NA,NA
"3937","PinotNoir","193","193Mtp39","",1976,NA,NA,"29/7/76",NA,NA,NA,NA,1976-07-29,NA,NA,NA,NA,NA,NA,NA
"3938","PinotNoir","193","193Mtp39","",1977,NA,NA,"1/8/1977",NA,NA,NA,NA,1977-08-01,NA,NA,NA,NA,NA,NA,NA
"3939","PinotNoir","193","193Mtp39","",1978,NA,NA,"9/8/1978",NA,NA,NA,NA,1978-08-09,NA,NA,NA,NA,NA,NA,NA
"3940","PinotNoir","193","193Mtp39","",1979,NA,NA,"26/7/79",NA,NA,NA,NA,1979-07-26,NA,NA,NA,NA,NA,NA,NA
"3941","PinotNoir","193","193Mtp39","",1980,NA,NA,"31/7/80",NA,NA,NA,NA,1980-07-31,NA,NA,NA,NA,NA,NA,NA
"3942","PinotNoir","193","193Mtp39","",1982,NA,NA,"22/7/82",NA,NA,NA,NA,1982-07-22,NA,NA,NA,NA,NA,NA,NA
"3943","PinotNoir","193","193Mtp39","",1983,NA,NA,"2/8/1983",NA,NA,NA,NA,1983-08-02,NA,NA,NA,NA,NA,NA,NA
"3944","PinotNoir","193","193Mtp39","",1984,NA,NA,"6/8/1984",NA,NA,NA,NA,1984-08-06,NA,NA,NA,NA,NA,NA,NA
"3945","PinotNoir","193","193Mtp39","",1985,NA,NA,"26/7/85",NA,NA,NA,NA,1985-07-26,NA,NA,NA,NA,NA,NA,NA
"3946","PinotNoir","193","193Mtp39","",1994,NA,"19/5/94",NA,NA,NA,NA,1994-05-19,NA,NA,NA,NA,NA,NA,NA,NA
"3947","PinotNoir","193","193Mtp39","",1995,NA,"27/5/95",NA,NA,NA,NA,1995-05-27,NA,NA,NA,NA,NA,NA,NA,NA
"3948","PinotNoir","193","193Mtp39","",1996,NA,"26/5/96",NA,NA,NA,NA,1996-05-26,NA,NA,NA,NA,NA,NA,NA,NA
"3949","PinotNoir","193","193Mtp40","",1958,"30/3/58",NA,NA,"19/8/58",NA,1958-03-30,NA,NA,1958-08-19,NA,142,NA,NA,NA,NA
"3950","PinotNoir","193","193Mtp40","",1959,"19/3/59",NA,NA,"10/8/1959",NA,1959-03-19,NA,NA,1959-08-10,NA,144,NA,NA,NA,NA
"3951","PinotNoir","193","193Mtp40","",1960,"24/3/60",NA,NA,"16/8/60",NA,1960-03-24,NA,NA,1960-08-16,NA,145,NA,NA,NA,NA
"3952","PinotNoir","193","193Mtp40","",1961,"16/3/61",NA,NA,NA,NA,1961-03-16,NA,NA,NA,NA,NA,NA,NA,NA,NA
"3953","PinotNoir","193","193Mtp40","",1962,"5/4/1962",NA,NA,NA,NA,1962-04-05,NA,NA,NA,NA,NA,NA,NA,NA,NA
"3954","PinotNoir","193","193Mtp40","",1976,NA,NA,"29/7/76",NA,NA,NA,NA,1976-07-29,NA,NA,NA,NA,NA,NA,NA
"3955","PinotNoir","193","193Mtp40","",1977,NA,NA,"1/8/1977",NA,NA,NA,NA,1977-08-01,NA,NA,NA,NA,NA,NA,NA
"3956","PinotNoir","193","193Mtp40","",1978,NA,NA,"9/8/1978",NA,NA,NA,NA,1978-08-09,NA,NA,NA,NA,NA,NA,NA
"3957","PinotNoir","193","193Mtp40","",1979,NA,NA,"30/7/79",NA,NA,NA,NA,1979-07-30,NA,NA,NA,NA,NA,NA,NA
"3958","PinotNoir","193","193Mtp40","",1980,NA,NA,"28/7/80",NA,NA,NA,NA,1980-07-28,NA,NA,NA,NA,NA,NA,NA
"3959","PinotNoir","193","193Mtp40","",1982,NA,NA,"19/7/82",NA,NA,NA,NA,1982-07-19,NA,NA,NA,NA,NA,NA,NA
"3960","PinotNoir","193","193Mtp40","",1983,NA,NA,"2/8/1983",NA,NA,NA,NA,1983-08-02,NA,NA,NA,NA,NA,NA,NA
"3961","PinotNoir","193","193Mtp40","",1984,NA,NA,"30/7/84",NA,NA,NA,NA,1984-07-30,NA,NA,NA,NA,NA,NA,NA
"3962","PinotNoir","193","193Mtp40","",1985,NA,NA,"26/7/85",NA,NA,NA,NA,1985-07-26,NA,NA,NA,NA,NA,NA,NA
"3963","PinotNoir","193","193Mtp40","",1996,NA,"26/5/96",NA,NA,NA,NA,1996-05-26,NA,NA,NA,NA,NA,NA,NA,NA
"3964","PinotNoir","193","193Mtp40","",2002,"15/3/02","23/5/02","22/7/02","20/8/02",NA,2002-03-15,2002-05-23,2002-07-22,2002-08-20,NA,158,69,60,29,129
"3965","PinotNoir","193","193Mtp40","",2003,"19/3/03","23/5/03","22/7/03","13/8/03",NA,2003-03-19,2003-05-23,2003-07-22,2003-08-13,NA,147,65,60,22,125
"3966","PinotNoir","193","193Mtp40","",2004,"24/3/04","2/6/2004","28/7/04","19/8/04",NA,2004-03-24,2004-06-02,2004-07-28,2004-08-19,NA,148,70,56,22,126
"3967","PinotNoir","193","193Mtp40","",2005,"4/4/2005","30/5/05","25/7/05","22/8/05",NA,2005-04-04,2005-05-30,2005-07-25,2005-08-22,NA,140,56,56,28,112
"3968","PinotNoir","193","193Mtp40","",2006,"27/3/06","24/5/06","17/7/06","8/8/2006",NA,2006-03-27,2006-05-24,2006-07-17,2006-08-08,NA,134,58,54,22,112
"3969","PinotNoir","193","193Mtp40","",2007,"7/3/2007","15/5/07","12/7/2007","13/8/07",NA,2007-03-07,2007-05-15,2007-07-12,2007-08-13,NA,159,69,58,32,127
"3970","PinotNoir","193","193Mtp40","",2008,"15/3/08","22/5/08","25/7/08","13/8/08",NA,2008-03-15,2008-05-22,2008-07-25,2008-08-13,NA,151,68,64,19,132
"3971","PinotNoir","193","193Mtp40","",2009,"21/3/09","22/5/09","17/7/09","18/8/09",NA,2009-03-21,2009-05-22,2009-07-17,2009-08-18,NA,150,62,56,32,118
"3972","PinotNoir","193","193Mtp40","",2010,"27/3/10","26/5/10","19/7/10","26/8/10",NA,2010-03-27,2010-05-26,2010-07-19,2010-08-26,NA,152,60,54,38,114
"3973","PinotNoir","193","193Mtp40","",2011,"18/3/11","11/5/2011","12/7/2011","17/8/11",NA,2011-03-18,2011-05-11,2011-07-12,2011-08-17,NA,152,54,62,36,116
"3974","PinotNoir","193","193Mtp40","",2012,"26/3/12","25/5/12","23/7/12","23/8/12",NA,2012-03-26,2012-05-25,2012-07-23,2012-08-23,NA,150,60,59,31,119
"3975","PinotNoir","193","193Mtp41","",1958,"2/4/1958",NA,NA,NA,NA,1958-04-02,NA,NA,NA,NA,NA,NA,NA,NA,NA
"3976","PinotNoir","193","193Mtp41","",1959,NA,NA,NA,"17/8/59",NA,NA,NA,NA,1959-08-17,NA,NA,NA,NA,NA,NA
"3977","PinotNoir","193","193Mtp41","",1960,"14/3/60",NA,NA,"1/8/1960",NA,1960-03-14,NA,NA,1960-08-01,NA,140,NA,NA,NA,NA
"3978","PinotNoir","193","193Mtp41","",1961,"14/3/61",NA,NA,"14/8/61",NA,1961-03-14,NA,NA,1961-08-14,NA,153,NA,NA,NA,NA
"3979","PinotNoir","193","193Mtp41","",1962,"5/4/1962",NA,NA,"13/8/62",NA,1962-04-05,NA,NA,1962-08-13,NA,130,NA,NA,NA,NA
"3980","PinotNoir","193","193Mtp41","",1963,NA,NA,NA,"19/8/63",NA,NA,NA,NA,1963-08-19,NA,NA,NA,NA,NA,NA
"3981","PinotNoir","193","193Mtp41","",1976,NA,NA,"29/7/76",NA,NA,NA,NA,1976-07-29,NA,NA,NA,NA,NA,NA,NA
"3982","PinotNoir","193","193Mtp41","",1977,NA,NA,"1/8/1977",NA,NA,NA,NA,1977-08-01,NA,NA,NA,NA,NA,NA,NA
"3983","PinotNoir","193","193Mtp41","",1978,NA,NA,"9/8/1978",NA,NA,NA,NA,1978-08-09,NA,NA,NA,NA,NA,NA,NA
"3984","PinotNoir","193","193Mtp41","",1979,NA,NA,"26/7/79",NA,NA,NA,NA,1979-07-26,NA,NA,NA,NA,NA,NA,NA
"3985","PinotNoir","193","193Mtp41","",1980,NA,NA,"31/7/80",NA,NA,NA,NA,1980-07-31,NA,NA,NA,NA,NA,NA,NA
"3986","PinotNoir","193","193Mtp41","",1982,NA,NA,"19/7/82",NA,NA,NA,NA,1982-07-19,NA,NA,NA,NA,NA,NA,NA
"3987","PinotNoir","193","193Mtp41","",1983,NA,NA,"2/8/1983",NA,NA,NA,NA,1983-08-02,NA,NA,NA,NA,NA,NA,NA
"3988","PinotNoir","193","193Mtp41","",1984,NA,NA,"6/8/1984",NA,NA,NA,NA,1984-08-06,NA,NA,NA,NA,NA,NA,NA
"3989","PinotNoir","193","193Mtp41","",1985,NA,NA,"26/7/85",NA,NA,NA,NA,1985-07-26,NA,NA,NA,NA,NA,NA,NA
"3990","PinotNoir","193","193Mtp41","",1996,NA,"26/5/96",NA,NA,NA,NA,1996-05-26,NA,NA,NA,NA,NA,NA,NA,NA
"3991","PinotNoir","193","193Mtp41","",2002,"15/3/02","21/5/02","22/7/02","20/8/02",NA,2002-03-15,2002-05-21,2002-07-22,2002-08-20,NA,158,67,62,29,129
"3992","PinotNoir","193","193Mtp41","",2003,"21/3/03","23/5/03","22/7/03","13/8/03",NA,2003-03-21,2003-05-23,2003-07-22,2003-08-13,NA,145,63,60,22,123
"3993","PinotNoir","193","193Mtp41","",2004,"23/3/04","2/6/2004","28/7/04","24/8/04",NA,2004-03-23,2004-06-02,2004-07-28,2004-08-24,NA,154,71,56,27,127
"3994","PinotNoir","193","193Mtp41","",2005,"31/3/05","30/5/05","25/7/05","23/8/05",NA,2005-03-31,2005-05-30,2005-07-25,2005-08-23,NA,145,60,56,29,116
"3995","PinotNoir","193","193Mtp41","",2006,"27/3/06","24/5/06","20/7/06","8/8/2006",NA,2006-03-27,2006-05-24,2006-07-20,2006-08-08,NA,134,58,57,19,115
"3996","PinotNoir","193","193Mtp41","",2007,"6/3/2007","15/5/07","12/7/2007","13/8/07",NA,2007-03-06,2007-05-15,2007-07-12,2007-08-13,NA,160,70,58,32,128
"3997","PinotNoir","193","193Mtp41","",2008,"15/3/08","22/5/08","25/7/08","13/8/08",NA,2008-03-15,2008-05-22,2008-07-25,2008-08-13,NA,151,68,64,19,132
"3998","PinotNoir","193","193Mtp41","",2009,"18/3/09","22/5/09","17/7/09","14/8/09",NA,2009-03-18,2009-05-22,2009-07-17,2009-08-14,NA,149,65,56,28,121
"3999","PinotNoir","193","193Mtp41","",2010,"26/3/10","26/5/10","26/7/10","20/8/10",NA,2010-03-26,2010-05-26,2010-07-26,2010-08-20,NA,147,61,61,25,122
"4000","PinotNoir","193","193Mtp41","",2011,"17/3/11","11/5/2011","18/7/11","25/8/11",NA,2011-03-17,2011-05-11,2011-07-18,2011-08-25,NA,161,55,68,38,123
"4001","PinotNoir","193","193Mtp41","",2012,"26/3/12","25/5/12","23/7/12","23/8/12",NA,2012-03-26,2012-05-25,2012-07-23,2012-08-23,NA,150,60,59,31,119
"4002","PinotNoir","193","193Mtp42","",1956,"28/3/56",NA,NA,"28/8/56",NA,1956-03-28,NA,NA,1956-08-28,NA,153,NA,NA,NA,NA
"4003","PinotNoir","193","193Mtp42","",1957,"11/3/1957",NA,NA,"19/8/57",NA,1957-03-11,NA,NA,1957-08-19,NA,161,NA,NA,NA,NA
"4004","PinotNoir","193","193Mtp42","",1958,"27/3/58",NA,NA,"21/8/58",NA,1958-03-27,NA,NA,1958-08-21,NA,147,NA,NA,NA,NA
"4005","PinotNoir","193","193Mtp43","",1956,"27/3/56",NA,NA,"28/8/56",NA,1956-03-27,NA,NA,1956-08-28,NA,154,NA,NA,NA,NA
"4006","PinotNoir","193","193Mtp43","",1957,"10/3/1957",NA,NA,"19/8/57",NA,1957-03-10,NA,NA,1957-08-19,NA,162,NA,NA,NA,NA
"4007","PinotNoir","193","193Mtp43","",1958,"25/3/58",NA,NA,"21/8/58",NA,1958-03-25,NA,NA,1958-08-21,NA,149,NA,NA,NA,NA
"4008","PinotNoir","193","193Mtp44","",1956,"27/3/56",NA,NA,"21/8/56",NA,1956-03-27,NA,NA,1956-08-21,NA,147,NA,NA,NA,NA
"4009","PinotNoir","193","193Mtp44","",1957,"13/3/57",NA,NA,"19/8/57",NA,1957-03-13,NA,NA,1957-08-19,NA,159,NA,NA,NA,NA
"4010","PinotNoir","193","193Mtp44","",1958,"26/3/58",NA,NA,"21/8/58",NA,1958-03-26,NA,NA,1958-08-21,NA,148,NA,NA,NA,NA
"4011","PinotNoir","193","193Mtp45","",1956,"26/3/56",NA,NA,"28/8/56",NA,1956-03-26,NA,NA,1956-08-28,NA,155,NA,NA,NA,NA
"4012","PinotNoir","193","193Mtp45","",1957,"10/3/1957",NA,NA,"19/8/57",NA,1957-03-10,NA,NA,1957-08-19,NA,162,NA,NA,NA,NA
"4013","PinotNoir","193","193Mtp45","",1958,"23/3/58",NA,NA,"18/8/58",NA,1958-03-23,NA,NA,1958-08-18,NA,148,NA,NA,NA,NA
"4014","PinotNoir","193","193Mtp46","",1956,"26/3/56",NA,NA,"21/8/56",NA,1956-03-26,NA,NA,1956-08-21,NA,148,NA,NA,NA,NA
"4015","PinotNoir","193","193Mtp46","",1957,"11/3/1957",NA,NA,"19/8/57",NA,1957-03-11,NA,NA,1957-08-19,NA,161,NA,NA,NA,NA
"4016","PinotNoir","193","193Mtp46","",1958,"26/3/58",NA,NA,"4/9/1958",NA,1958-03-26,NA,NA,1958-09-04,NA,162,NA,NA,NA,NA
"4017","PinotNoir","193","193Mtp47","",1956,"28/3/56",NA,NA,"10/9/1956",NA,1956-03-28,NA,NA,1956-09-10,NA,166,NA,NA,NA,NA
"4018","PinotNoir","193","193Mtp47","",1957,"11/3/1957",NA,NA,"19/8/57",NA,1957-03-11,NA,NA,1957-08-19,NA,161,NA,NA,NA,NA
"4019","PinotNoir","193","193Mtp47","",1958,"26/3/58",NA,NA,"4/9/1958",NA,1958-03-26,NA,NA,1958-09-04,NA,162,NA,NA,NA,NA
"4020","PinotNoir","193","193Mtp48","",1958,"20/3/58",NA,NA,"19/8/58",NA,1958-03-20,NA,NA,1958-08-19,NA,152,NA,NA,NA,NA
"4021","PinotNoir","193","193Mtp48","",1959,"11/3/1959",NA,NA,"3/8/1959",NA,1959-03-11,NA,NA,1959-08-03,NA,145,NA,NA,NA,NA
"4022","PinotNoir","193","193Mtp48","",1960,"8/3/1960",NA,NA,"1/8/1960",NA,1960-03-08,NA,NA,1960-08-01,NA,146,NA,NA,NA,NA
"4023","PinotNoir","193","193Mtp49","",1958,"31/3/58",NA,NA,"19/8/58",NA,1958-03-31,NA,NA,1958-08-19,NA,141,NA,NA,NA,NA
"4024","PinotNoir","193","193Mtp49","",1959,"23/3/59",NA,NA,"24/8/59",NA,1959-03-23,NA,NA,1959-08-24,NA,154,NA,NA,NA,NA
"4025","PinotNoir","193","193Mtp49","",1960,"16/3/60",NA,NA,"1/8/1960",NA,1960-03-16,NA,NA,1960-08-01,NA,138,NA,NA,NA,NA
"4026","PinotNoir","193","193Mtp49","",1976,NA,NA,"28/7/76",NA,NA,NA,NA,1976-07-28,NA,NA,NA,NA,NA,NA,NA
"4027","PinotNoir","193","193Mtp49","",1977,NA,NA,"5/8/1977",NA,NA,NA,NA,1977-08-05,NA,NA,NA,NA,NA,NA,NA
"4028","PinotNoir","193","193Mtp49","",1978,NA,NA,"10/8/1978",NA,NA,NA,NA,1978-08-10,NA,NA,NA,NA,NA,NA,NA
"4029","PinotNoir","193","193Mtp49","",1979,NA,NA,"30/7/79",NA,NA,NA,NA,1979-07-30,NA,NA,NA,NA,NA,NA,NA
"4030","PinotNoir","193","193Mtp49","",1980,NA,NA,"28/7/80",NA,NA,NA,NA,1980-07-28,NA,NA,NA,NA,NA,NA,NA
"4031","PinotNoir","193","193Mtp49","",1982,NA,NA,"26/7/82",NA,NA,NA,NA,1982-07-26,NA,NA,NA,NA,NA,NA,NA
"4032","PinotNoir","193","193Mtp49","",1983,NA,NA,"2/8/1983",NA,NA,NA,NA,1983-08-02,NA,NA,NA,NA,NA,NA,NA
"4033","PinotNoir","193","193Mtp49","",1984,NA,NA,"6/8/1984",NA,NA,NA,NA,1984-08-06,NA,NA,NA,NA,NA,NA,NA
"4034","PinotNoir","193","193Mtp49","",1985,NA,NA,"1/8/1985",NA,NA,NA,NA,1985-08-01,NA,NA,NA,NA,NA,NA,NA
"4035","PinotNoir","193","193Mtp49","",1996,NA,"26/5/96",NA,NA,NA,NA,1996-05-26,NA,NA,NA,NA,NA,NA,NA,NA
"4036","PinotNoir","193","193Mtp50","",1958,"27/3/58",NA,NA,"19/8/58",NA,1958-03-27,NA,NA,1958-08-19,NA,145,NA,NA,NA,NA
"4037","PinotNoir","193","193Mtp50","",1959,"19/3/59",NA,NA,"3/8/1959",NA,1959-03-19,NA,NA,1959-08-03,NA,137,NA,NA,NA,NA
"4038","PinotNoir","193","193Mtp50","",1960,"14/3/60",NA,NA,"1/8/1960",NA,1960-03-14,NA,NA,1960-08-01,NA,140,NA,NA,NA,NA
"4039","PinotNoir","193","193Mtp50","",1968,"23/3/68",NA,NA,NA,NA,1968-03-23,NA,NA,NA,NA,NA,NA,NA,NA,NA
"4040","PinotNoir","193","193Mtp50","",1969,"23/3/69",NA,NA,NA,NA,1969-03-23,NA,NA,NA,NA,NA,NA,NA,NA,NA
"4041","PinotNoir","193","193Mtp50","",1970,"27/3/70",NA,NA,NA,NA,1970-03-27,NA,NA,NA,NA,NA,NA,NA,NA,NA
"4042","PinotNoir","193","193Mtp50","",1971,NA,NA,NA,"16/8/71",NA,NA,NA,NA,1971-08-16,NA,NA,NA,NA,NA,NA
"4043","PinotNoir","193","193Mtp50","",1972,NA,NA,NA,"21/8/72",NA,NA,NA,NA,1972-08-21,NA,NA,NA,NA,NA,NA
"4044","PinotNoir","193","193Mtp50","",1973,NA,NA,NA,"14/8/73",NA,NA,NA,NA,1973-08-14,NA,NA,NA,NA,NA,NA
"4045","PinotNoir","193","193Mtp51","",1958,"29/3/58",NA,NA,NA,NA,1958-03-29,NA,NA,NA,NA,NA,NA,NA,NA,NA
"4046","PinotNoir","193","193Mtp51","",1959,"19/3/59",NA,NA,"10/8/1959",NA,1959-03-19,NA,NA,1959-08-10,NA,144,NA,NA,NA,NA
"4047","PinotNoir","193","193Mtp51","",1960,"14/3/60",NA,NA,"8/8/1960",NA,1960-03-14,NA,NA,1960-08-08,NA,147,NA,NA,NA,NA
"4048","PinotNoir","193","193Mtp51","",1961,NA,NA,NA,"14/8/61",NA,NA,NA,NA,1961-08-14,NA,NA,NA,NA,NA,NA
"4049","PinotNoir","193","193Mtp51","",1968,"21/3/68",NA,NA,NA,NA,1968-03-21,NA,NA,NA,NA,NA,NA,NA,NA,NA
"4050","PinotNoir","193","193Mtp51","",1970,"27/3/70",NA,NA,NA,NA,1970-03-27,NA,NA,NA,NA,NA,NA,NA,NA,NA
"4051","PinotNoir","193","193Mtp51","",1971,"30/3/71",NA,NA,"16/8/71",NA,1971-03-30,NA,NA,1971-08-16,NA,139,NA,NA,NA,NA
"4052","PinotNoir","193","193Mtp51","",1972,NA,NA,NA,"21/8/72",NA,NA,NA,NA,1972-08-21,NA,NA,NA,NA,NA,NA
"4053","PinotNoir","193","193Mtp51","",1973,NA,NA,NA,"20/8/73",NA,NA,NA,NA,1973-08-20,NA,NA,NA,NA,NA,NA
"4054","PinotNoir","193","193Mtp52","",1956,"26/3/56",NA,NA,"3/9/1956",NA,1956-03-26,NA,NA,1956-09-03,NA,161,NA,NA,NA,NA
"4055","PinotNoir","193","193Mtp52","",1957,"14/3/57",NA,NA,"20/8/57",NA,1957-03-14,NA,NA,1957-08-20,NA,159,NA,NA,NA,NA
"4056","PinotNoir","193","193Mtp52","",1958,"29/3/58",NA,NA,"21/8/58",NA,1958-03-29,NA,NA,1958-08-21,NA,145,NA,NA,NA,NA
"4057","PinotNoir","193","193Mtp52","",1959,"23/3/59",NA,NA,NA,NA,1959-03-23,NA,NA,NA,NA,NA,NA,NA,NA,NA
"4058","PinotNoir","193","193Mtp52","",1976,NA,NA,"29/7/76",NA,NA,NA,NA,1976-07-29,NA,NA,NA,NA,NA,NA,NA
"4059","PinotNoir","193","193Mtp52","",1977,NA,NA,"1/8/1977",NA,NA,NA,NA,1977-08-01,NA,NA,NA,NA,NA,NA,NA
"4060","PinotNoir","193","193Mtp52","",1978,NA,NA,"8/8/1978",NA,NA,NA,NA,1978-08-08,NA,NA,NA,NA,NA,NA,NA
"4061","PinotNoir","193","193Mtp52","",1979,NA,NA,"30/7/79",NA,NA,NA,NA,1979-07-30,NA,NA,NA,NA,NA,NA,NA
"4062","PinotNoir","193","193Mtp52","",1980,NA,NA,"4/8/1980",NA,NA,NA,NA,1980-08-04,NA,NA,NA,NA,NA,NA,NA
"4063","PinotNoir","193","193Mtp52","",1982,NA,NA,"26/7/82",NA,NA,NA,NA,1982-07-26,NA,NA,NA,NA,NA,NA,NA
"4064","PinotNoir","193","193Mtp52","",1983,NA,NA,"2/8/1983",NA,NA,NA,NA,1983-08-02,NA,NA,NA,NA,NA,NA,NA
"4065","PinotNoir","193","193Mtp52","",1984,NA,NA,"6/8/1984",NA,NA,NA,NA,1984-08-06,NA,NA,NA,NA,NA,NA,NA
"4066","PinotNoir","193","193Mtp52","",1987,NA,"3/6/1987","30/7/87","24/8/87",NA,NA,1987-06-03,1987-07-30,1987-08-24,NA,NA,NA,57,25,NA
"4067","PinotNoir","193","193Mtp52","",1988,"22/3/88","26/5/88","25/7/88","16/8/88",NA,1988-03-22,1988-05-26,1988-07-25,1988-08-16,NA,147,65,60,22,125
"4068","PinotNoir","193","193Mtp53","",1956,"28/3/56",NA,NA,"22/8/56",NA,1956-03-28,NA,NA,1956-08-22,NA,147,NA,NA,NA,NA
"4069","PinotNoir","193","193Mtp53","",1957,"8/3/1957",NA,NA,"19/8/57",NA,1957-03-08,NA,NA,1957-08-19,NA,164,NA,NA,NA,NA
"4070","PinotNoir","193","193Mtp53","",1958,"26/3/58",NA,NA,"19/8/58",NA,1958-03-26,NA,NA,1958-08-19,NA,146,NA,NA,NA,NA
"4071","PinotNoir","193","193Mtp53","",1976,NA,NA,"29/7/76",NA,NA,NA,NA,1976-07-29,NA,NA,NA,NA,NA,NA,NA
"4072","PinotNoir","193","193Mtp53","",1977,NA,NA,"1/8/1977",NA,NA,NA,NA,1977-08-01,NA,NA,NA,NA,NA,NA,NA
"4073","PinotNoir","193","193Mtp53","",1978,NA,NA,"8/8/1978",NA,NA,NA,NA,1978-08-08,NA,NA,NA,NA,NA,NA,NA
"4074","PinotNoir","193","193Mtp53","",1979,NA,NA,"26/7/79",NA,NA,NA,NA,1979-07-26,NA,NA,NA,NA,NA,NA,NA
"4075","PinotNoir","193","193Mtp53","",1980,NA,NA,"28/7/80",NA,NA,NA,NA,1980-07-28,NA,NA,NA,NA,NA,NA,NA
"4076","PinotNoir","193","193Mtp53","",1982,NA,NA,"19/7/82",NA,NA,NA,NA,1982-07-19,NA,NA,NA,NA,NA,NA,NA
"4077","PinotNoir","193","193Mtp53","",1983,NA,NA,"2/8/1983",NA,NA,NA,NA,1983-08-02,NA,NA,NA,NA,NA,NA,NA
"4078","PinotNoir","193","193Mtp53","",1984,NA,NA,"6/8/1984",NA,NA,NA,NA,1984-08-06,NA,NA,NA,NA,NA,NA,NA
"4079","PinotNoir","193","193Mtp53","",1985,NA,NA,"1/8/1985",NA,NA,NA,NA,1985-08-01,NA,NA,NA,NA,NA,NA,NA
"4080","PinotNoir","193","193Mtp53","",1987,NA,"3/6/1987","30/7/87","24/8/87",NA,NA,1987-06-03,1987-07-30,1987-08-24,NA,NA,NA,57,25,NA
"4081","PinotNoir","193","193Mtp53","",1988,"21/3/88","26/5/88","25/7/88","16/8/88",NA,1988-03-21,1988-05-26,1988-07-25,1988-08-16,NA,148,66,60,22,126
"4082","PinotNoir","193","193Mtp53","",1989,NA,"22/5/89","24/7/89",NA,NA,NA,1989-05-22,1989-07-24,NA,NA,NA,NA,63,NA,NA
"4083","PinotNoir","193","193Mtp53","",1990,NA,"19/5/90","20/7/90",NA,NA,NA,1990-05-19,1990-07-20,NA,NA,NA,NA,62,NA,NA
"4084","PinotNoir","193","193Mtp54","",1956,"30/3/56",NA,NA,"27/8/56",NA,1956-03-30,NA,NA,1956-08-27,NA,150,NA,NA,NA,NA
"4085","PinotNoir","193","193Mtp54","",1957,"9/3/1957",NA,NA,"19/8/57",NA,1957-03-09,NA,NA,1957-08-19,NA,163,NA,NA,NA,NA
"4086","PinotNoir","193","193Mtp54","",1958,"29/3/58",NA,NA,"21/8/58",NA,1958-03-29,NA,NA,1958-08-21,NA,145,NA,NA,NA,NA
"4087","PinotNoir","193","193Mtp54","",1959,"17/3/59",NA,NA,NA,NA,1959-03-17,NA,NA,NA,NA,NA,NA,NA,NA,NA
"4088","PinotNoir","193","193Mtp55","",1956,"26/3/56",NA,NA,"14/8/56",NA,1956-03-26,NA,NA,1956-08-14,NA,141,NA,NA,NA,NA
"4089","PinotNoir","193","193Mtp55","",1957,"11/3/1957",NA,NA,"12/8/1957",NA,1957-03-11,NA,NA,1957-08-12,NA,154,NA,NA,NA,NA
"4090","PinotNoir","193","193Mtp55","",1958,"24/3/58",NA,NA,"21/8/58",NA,1958-03-24,NA,NA,1958-08-21,NA,150,NA,NA,NA,NA
"4091","PinotNoir","193","193Mtp55","",1976,NA,NA,"29/7/76",NA,NA,NA,NA,1976-07-29,NA,NA,NA,NA,NA,NA,NA
"4092","PinotNoir","193","193Mtp55","",1977,NA,NA,"1/8/1977",NA,NA,NA,NA,1977-08-01,NA,NA,NA,NA,NA,NA,NA
"4093","PinotNoir","193","193Mtp55","",1978,NA,NA,"8/8/1978",NA,NA,NA,NA,1978-08-08,NA,NA,NA,NA,NA,NA,NA
"4094","PinotNoir","193","193Mtp55","",1979,NA,NA,"30/7/79",NA,NA,NA,NA,1979-07-30,NA,NA,NA,NA,NA,NA,NA
"4095","PinotNoir","193","193Mtp55","",1980,NA,NA,"4/8/1980",NA,NA,NA,NA,1980-08-04,NA,NA,NA,NA,NA,NA,NA
"4096","PinotNoir","193","193Mtp55","",1982,NA,NA,"19/7/82",NA,NA,NA,NA,1982-07-19,NA,NA,NA,NA,NA,NA,NA
"4097","PinotNoir","193","193Mtp55","",1983,NA,NA,"2/8/1983",NA,NA,NA,NA,1983-08-02,NA,NA,NA,NA,NA,NA,NA
"4098","PinotNoir","193","193Mtp55","",1984,NA,NA,"6/8/1984",NA,NA,NA,NA,1984-08-06,NA,NA,NA,NA,NA,NA,NA
"4099","PinotNoir","193","193Mtp55","",1985,NA,NA,"1/8/1985",NA,NA,NA,NA,1985-08-01,NA,NA,NA,NA,NA,NA,NA
"4100","PinotNoir","193","193Mtp55","",1987,NA,"2/6/1987","30/7/87","17/8/87",NA,NA,1987-06-02,1987-07-30,1987-08-17,NA,NA,NA,58,18,NA
"4101","PinotNoir","193","193Mtp55","",1988,"17/3/88","26/5/88","25/7/88","16/8/88",NA,1988-03-17,1988-05-26,1988-07-25,1988-08-16,NA,152,70,60,22,130
"4102","PinotNoir","193","193Mtp55","",1989,NA,"22/5/89","24/7/89",NA,NA,NA,1989-05-22,1989-07-24,NA,NA,NA,NA,63,NA,NA
"4103","PinotNoir","193","193Mtp55","",1990,NA,"19/5/90","19/7/90",NA,NA,NA,1990-05-19,1990-07-19,NA,NA,NA,NA,61,NA,NA
"4104","PinotNoir","193","193Mtp56","",1956,"26/3/56",NA,NA,"21/8/56",NA,1956-03-26,NA,NA,1956-08-21,NA,148,NA,NA,NA,NA
"4105","PinotNoir","193","193Mtp56","",1957,"11/3/1957",NA,NA,"19/8/57",NA,1957-03-11,NA,NA,1957-08-19,NA,161,NA,NA,NA,NA
"4106","PinotNoir","193","193Mtp56","",1958,"24/3/58",NA,NA,"18/8/58",NA,1958-03-24,NA,NA,1958-08-18,NA,147,NA,NA,NA,NA
"4107","PinotNoir","193","193Mtp57","",1956,"28/3/56",NA,NA,"28/8/56",NA,1956-03-28,NA,NA,1956-08-28,NA,153,NA,NA,NA,NA
"4108","PinotNoir","193","193Mtp57","",1957,"13/3/57",NA,NA,"19/8/57",NA,1957-03-13,NA,NA,1957-08-19,NA,159,NA,NA,NA,NA
"4109","PinotNoir","193","193Mtp57","",1958,"25/3/58",NA,NA,"21/8/58",NA,1958-03-25,NA,NA,1958-08-21,NA,149,NA,NA,NA,NA
"4110","PinotNoir","193","193Mtp58","",1956,"28/3/56",NA,NA,"28/8/56",NA,1956-03-28,NA,NA,1956-08-28,NA,153,NA,NA,NA,NA
"4111","PinotNoir","193","193Mtp58","",1957,"12/3/1957",NA,NA,"19/8/57",NA,1957-03-12,NA,NA,1957-08-19,NA,160,NA,NA,NA,NA
"4112","PinotNoir","193","193Mtp58","",1958,"26/3/58",NA,NA,"21/8/58",NA,1958-03-26,NA,NA,1958-08-21,NA,148,NA,NA,NA,NA
"4113","PinotNoir","193","193Mtp59","",1956,"28/3/56",NA,NA,"14/8/56",NA,1956-03-28,NA,NA,1956-08-14,NA,139,NA,NA,NA,NA
"4114","PinotNoir","193","193Mtp59","",1957,"11/3/1957",NA,NA,"19/8/57",NA,1957-03-11,NA,NA,1957-08-19,NA,161,NA,NA,NA,NA
"4115","PinotNoir","193","193Mtp59","",1958,"28/3/58",NA,NA,"21/8/58",NA,1958-03-28,NA,NA,1958-08-21,NA,146,NA,NA,NA,NA
"4116","PinotNoir","193","193Mtp60","",1956,"30/3/56",NA,NA,"21/8/56",NA,1956-03-30,NA,NA,1956-08-21,NA,144,NA,NA,NA,NA
"4117","PinotNoir","193","193Mtp60","",1957,"10/3/1957",NA,NA,"19/8/57",NA,1957-03-10,NA,NA,1957-08-19,NA,162,NA,NA,NA,NA
"4118","PinotNoir","193","193Mtp60","",1958,"28/3/58",NA,NA,"18/8/58",NA,1958-03-28,NA,NA,1958-08-18,NA,143,NA,NA,NA,NA
"4119","PinotNoir","193","193Mtp61","",1956,"25/3/56",NA,NA,NA,NA,1956-03-25,NA,NA,NA,NA,NA,NA,NA,NA,NA
"4120","PinotNoir","193","193Mtp61","",1957,"11/3/1957",NA,NA,"12/8/1957",NA,1957-03-11,NA,NA,1957-08-12,NA,154,NA,NA,NA,NA
"4121","PinotNoir","193","193Mtp61","",1958,"18/3/58",NA,NA,"18/8/58",NA,1958-03-18,NA,NA,1958-08-18,NA,153,NA,NA,NA,NA
"4122","PinotNoir","193","193Mtp61","",1959,"14/3/59",NA,NA,"11/8/1959",NA,1959-03-14,NA,NA,1959-08-11,NA,150,NA,NA,NA,NA
"4123","PinotNoir","193","193Mtp63","",1956,"26/3/56",NA,NA,"21/8/56",NA,1956-03-26,NA,NA,1956-08-21,NA,148,NA,NA,NA,NA
"4124","PinotNoir","193","193Mtp63","",1957,"11/3/1957",NA,NA,"12/8/1957",NA,1957-03-11,NA,NA,1957-08-12,NA,154,NA,NA,NA,NA
"4125","PinotNoir","193","193Mtp63","",1958,"25/3/58",NA,NA,"18/8/58",NA,1958-03-25,NA,NA,1958-08-18,NA,146,NA,NA,NA,NA
"4126","PinotNoir","193","193Mtp64","",1959,"16/3/59",NA,NA,"17/8/59",NA,1959-03-16,NA,NA,1959-08-17,NA,154,NA,NA,NA,NA
"4127","PinotNoir","193","193Mtp64","",1960,"14/3/60",NA,NA,"5/9/1960",NA,1960-03-14,NA,NA,1960-09-05,NA,175,NA,NA,NA,NA
"4128","PinotNoir","193","193Mtp64","",1961,"12/3/1961",NA,NA,"21/8/61",NA,1961-03-12,NA,NA,1961-08-21,NA,162,NA,NA,NA,NA
"4129","PinotNoir","193","193Mtp64","",1962,"5/4/1962",NA,NA,"28/8/62",NA,1962-04-05,NA,NA,1962-08-28,NA,145,NA,NA,NA,NA
"4130","PinotNoir","193","193Mtp64","",1976,NA,NA,"28/7/76",NA,NA,NA,NA,1976-07-28,NA,NA,NA,NA,NA,NA,NA
"4131","PinotNoir","193","193Mtp64","",1977,NA,NA,"1/8/1977",NA,NA,NA,NA,1977-08-01,NA,NA,NA,NA,NA,NA,NA
"4132","PinotNoir","193","193Mtp64","",1978,NA,NA,"10/8/1978",NA,NA,NA,NA,1978-08-10,NA,NA,NA,NA,NA,NA,NA
"4133","PinotNoir","193","193Mtp64","",1979,NA,NA,"30/7/79",NA,NA,NA,NA,1979-07-30,NA,NA,NA,NA,NA,NA,NA
"4134","PinotNoir","193","193Mtp64","",1980,NA,NA,"4/8/1980",NA,NA,NA,NA,1980-08-04,NA,NA,NA,NA,NA,NA,NA
"4135","PinotNoir","193","193Mtp64","",1982,NA,NA,"22/7/82",NA,NA,NA,NA,1982-07-22,NA,NA,NA,NA,NA,NA,NA
"4136","PinotNoir","193","193Mtp64","",1983,NA,NA,"2/8/1983",NA,NA,NA,NA,1983-08-02,NA,NA,NA,NA,NA,NA,NA
"4137","PinotNoir","193","193Mtp64","",1984,NA,NA,"6/8/1984",NA,NA,NA,NA,1984-08-06,NA,NA,NA,NA,NA,NA,NA
"4138","PinotNoir","193","193Mtp65","",1956,"27/3/56",NA,NA,"28/8/56",NA,1956-03-27,NA,NA,1956-08-28,NA,154,NA,NA,NA,NA
"4139","PinotNoir","193","193Mtp65","",1957,"11/3/1957",NA,NA,"19/8/57",NA,1957-03-11,NA,NA,1957-08-19,NA,161,NA,NA,NA,NA
"4140","PinotNoir","193","193Mtp65","",1958,"25/3/58",NA,NA,"18/8/58",NA,1958-03-25,NA,NA,1958-08-18,NA,146,NA,NA,NA,NA
"4141","PinotNoir","193","193Mtp66","",1968,"20/3/68",NA,NA,NA,NA,1968-03-20,NA,NA,NA,NA,NA,NA,NA,NA,NA
"4142","PinotNoir","193","193Mtp66","",1969,"22/3/69",NA,NA,"19/8/69",NA,1969-03-22,NA,NA,1969-08-19,NA,150,NA,NA,NA,NA
"4143","PinotNoir","193","193Mtp66","",1970,NA,NA,NA,"10/8/1970",NA,NA,NA,NA,1970-08-10,NA,NA,NA,NA,NA,NA
"4144","PinotNoir","193","193Mtp66","",1971,NA,NA,NA,"10/8/1971",NA,NA,NA,NA,1971-08-10,NA,NA,NA,NA,NA,NA
"4145","PinotNoir","193","193Mtp66","",1973,"28/3/73",NA,NA,NA,NA,1973-03-28,NA,NA,NA,NA,NA,NA,NA,NA,NA
"4146","PinotNoir","193","193Mtp66","",1976,NA,NA,"29/7/76",NA,NA,NA,NA,1976-07-29,NA,NA,NA,NA,NA,NA,NA
"4147","PinotNoir","193","193Mtp66","",1977,NA,NA,"1/8/1977",NA,NA,NA,NA,1977-08-01,NA,NA,NA,NA,NA,NA,NA
"4148","PinotNoir","193","193Mtp66","",1978,NA,NA,"1/8/1978",NA,NA,NA,NA,1978-08-01,NA,NA,NA,NA,NA,NA,NA
"4149","PinotNoir","193","193Mtp66","",1979,NA,NA,"30/7/79",NA,NA,NA,NA,1979-07-30,NA,NA,NA,NA,NA,NA,NA
"4150","PinotNoir","193","193Mtp66","",1980,NA,NA,"28/7/80",NA,NA,NA,NA,1980-07-28,NA,NA,NA,NA,NA,NA,NA
"4151","PinotNoir","193","193Mtp66","",1982,NA,NA,"19/7/82",NA,NA,NA,NA,1982-07-19,NA,NA,NA,NA,NA,NA,NA
"4152","PinotNoir","193","193Mtp66","",1983,NA,NA,"2/8/1983",NA,NA,NA,NA,1983-08-02,NA,NA,NA,NA,NA,NA,NA
"4153","PinotNoir","193","193Mtp66","",1984,NA,NA,"6/8/1984",NA,NA,NA,NA,1984-08-06,NA,NA,NA,NA,NA,NA,NA
"4154","PinotNoir","193","193Mtp66","",1985,NA,NA,"26/7/85",NA,NA,NA,NA,1985-07-26,NA,NA,NA,NA,NA,NA,NA
"4155","PinotNoir","193","193Mtp66","",1996,NA,"26/5/96",NA,NA,NA,NA,1996-05-26,NA,NA,NA,NA,NA,NA,NA,NA
"4156","PinotNoir","193","193Mtp67","",1961,"7/3/1961",NA,NA,"17/8/60",NA,1961-03-07,NA,NA,1960-08-17,NA,-202,NA,NA,NA,NA
"4157","PinotNoir","193","193Mtp67","",1962,NA,NA,NA,"14/8/61",NA,NA,NA,NA,1961-08-14,NA,NA,NA,NA,NA,NA
"4158","PinotNoir","193","193Mtp67","",1965,"1/4/1965",NA,NA,NA,NA,1965-04-01,NA,NA,NA,NA,NA,NA,NA,NA,NA
"4159","PinotNoir","193","193Mtp67","",1968,"15/3/68",NA,NA,NA,NA,1968-03-15,NA,NA,NA,NA,NA,NA,NA,NA,NA
"4160","PinotNoir","193","193Mtp67","",1969,"22/3/69",NA,NA,NA,NA,1969-03-22,NA,NA,NA,NA,NA,NA,NA,NA,NA
"4161","PinotNoir","193","193Mtp67","",1971,NA,NA,NA,"23/8/71",NA,NA,NA,NA,1971-08-23,NA,NA,NA,NA,NA,NA
"4162","PinotNoir","193","193Mtp67","",1977,NA,NA,"5/8/1977",NA,NA,NA,NA,1977-08-05,NA,NA,NA,NA,NA,NA,NA
"4163","PinotNoir","193","193Mtp67","",1978,NA,NA,"5/8/1978",NA,NA,NA,NA,1978-08-05,NA,NA,NA,NA,NA,NA,NA
"4164","PinotNoir","193","193Mtp67","",1979,NA,NA,"30/7/79",NA,NA,NA,NA,1979-07-30,NA,NA,NA,NA,NA,NA,NA
"4165","PinotNoir","193","193Mtp67","",1980,NA,NA,"4/8/1980",NA,NA,NA,NA,1980-08-04,NA,NA,NA,NA,NA,NA,NA
"4166","PinotNoir","193","193Mtp67","",1982,NA,NA,"26/7/82",NA,NA,NA,NA,1982-07-26,NA,NA,NA,NA,NA,NA,NA
"4167","PinotNoir","193","193Mtp67","",1983,NA,NA,"6/8/1983",NA,NA,NA,NA,1983-08-06,NA,NA,NA,NA,NA,NA,NA
"4168","PinotNoir","193","193Mtp67","",1984,NA,NA,"6/8/1984",NA,NA,NA,NA,1984-08-06,NA,NA,NA,NA,NA,NA,NA
"4169","PinotNoir","193","193Mtp67","",1985,NA,NA,"1/8/1985",NA,NA,NA,NA,1985-08-01,NA,NA,NA,NA,NA,NA,NA
"4170","PinotNoir","193","193Mtp68","",1961,"6/3/1961",NA,NA,"14/8/61",NA,1961-03-06,NA,NA,1961-08-14,NA,161,NA,NA,NA,NA
"4171","PinotNoir","193","193Mtp68","",1964,NA,NA,NA,"11/8/1964",NA,NA,NA,NA,1964-08-11,NA,NA,NA,NA,NA,NA
"4172","PinotNoir","193","193Mtp68","",1965,"1/4/1965",NA,NA,"10/8/1965",NA,1965-04-01,NA,NA,1965-08-10,NA,131,NA,NA,NA,NA
"4173","PinotNoir","193","193Mtp68","",1976,NA,NA,"29/7/76",NA,NA,NA,NA,1976-07-29,NA,NA,NA,NA,NA,NA,NA
"4174","PinotNoir","193","193Mtp68","",1977,NA,NA,"1/8/1977",NA,NA,NA,NA,1977-08-01,NA,NA,NA,NA,NA,NA,NA
"4175","PinotNoir","193","193Mtp68","",1978,NA,NA,"5/8/1978",NA,NA,NA,NA,1978-08-05,NA,NA,NA,NA,NA,NA,NA
"4176","PinotNoir","193","193Mtp68","",1979,NA,NA,"23/7/79",NA,NA,NA,NA,1979-07-23,NA,NA,NA,NA,NA,NA,NA
"4177","PinotNoir","193","193Mtp68","",1980,NA,NA,"31/7/80",NA,NA,NA,NA,1980-07-31,NA,NA,NA,NA,NA,NA,NA
"4178","PinotNoir","193","193Mtp68","",1982,NA,NA,"19/7/82",NA,NA,NA,NA,1982-07-19,NA,NA,NA,NA,NA,NA,NA
"4179","PinotNoir","193","193Mtp68","",1983,NA,NA,"2/8/1983",NA,NA,NA,NA,1983-08-02,NA,NA,NA,NA,NA,NA,NA
"4180","PinotNoir","193","193Mtp68","",1984,NA,NA,"6/8/1984",NA,NA,NA,NA,1984-08-06,NA,NA,NA,NA,NA,NA,NA
"4181","PinotNoir","193","193Mtp68","",1985,NA,NA,"26/7/85",NA,NA,NA,NA,1985-07-26,NA,NA,NA,NA,NA,NA,NA
"4182","PinotNoir","193","193Mtp68","",1996,NA,"26/5/96",NA,NA,NA,NA,1996-05-26,NA,NA,NA,NA,NA,NA,NA,NA
"4183","PinotNoir","193","193Mtp70","",1961,"5/3/1961",NA,NA,"14/8/61",NA,1961-03-05,NA,NA,1961-08-14,NA,162,NA,NA,NA,NA
"4184","PinotNoir","193","193Mtp70","",1964,NA,NA,NA,"30/7/64",NA,NA,NA,NA,1964-07-30,NA,NA,NA,NA,NA,NA
"4185","PinotNoir","193","193Mtp70","",1965,"27/3/65",NA,NA,"10/8/1965",NA,1965-03-27,NA,NA,1965-08-10,NA,136,NA,NA,NA,NA
"4186","PinotNoir","193","193Mtp70","",1976,NA,NA,"29/7/76",NA,NA,NA,NA,1976-07-29,NA,NA,NA,NA,NA,NA,NA
"4187","PinotNoir","193","193Mtp70","",1977,NA,NA,"1/8/1977",NA,NA,NA,NA,1977-08-01,NA,NA,NA,NA,NA,NA,NA
"4188","PinotNoir","193","193Mtp70","",1978,NA,NA,"9/8/1978",NA,NA,NA,NA,1978-08-09,NA,NA,NA,NA,NA,NA,NA
"4189","PinotNoir","193","193Mtp70","",1979,NA,NA,"30/7/79",NA,NA,NA,NA,1979-07-30,NA,NA,NA,NA,NA,NA,NA
"4190","PinotNoir","193","193Mtp70","",1980,NA,NA,"4/8/1980",NA,NA,NA,NA,1980-08-04,NA,NA,NA,NA,NA,NA,NA
"4191","PinotNoir","193","193Mtp70","",1982,NA,NA,"19/7/82",NA,NA,NA,NA,1982-07-19,NA,NA,NA,NA,NA,NA,NA
"4192","PinotNoir","193","193Mtp70","",1983,NA,NA,"2/8/1983",NA,NA,NA,NA,1983-08-02,NA,NA,NA,NA,NA,NA,NA
"4193","PinotNoir","193","193Mtp70","",1984,NA,NA,"6/8/1984",NA,NA,NA,NA,1984-08-06,NA,NA,NA,NA,NA,NA,NA
"4194","PinotNoir","193","193Mtp70","",1985,NA,NA,"1/8/1985",NA,NA,NA,NA,1985-08-01,NA,NA,NA,NA,NA,NA,NA
"4195","PinotNoir","193","193Mtp71","",1961,"5/3/1961",NA,NA,"14/8/61",NA,1961-03-05,NA,NA,1961-08-14,NA,162,NA,NA,NA,NA
"4196","PinotNoir","193","193Mtp71","",1964,NA,NA,NA,"4/8/1964",NA,NA,NA,NA,1964-08-04,NA,NA,NA,NA,NA,NA
"4197","PinotNoir","193","193Mtp71","",1965,"27/3/65",NA,NA,"10/8/1965",NA,1965-03-27,NA,NA,1965-08-10,NA,136,NA,NA,NA,NA
"4198","PinotNoir","193","193Mtp71","",1976,NA,NA,"29/7/76",NA,NA,NA,NA,1976-07-29,NA,NA,NA,NA,NA,NA,NA
"4199","PinotNoir","193","193Mtp71","",1977,NA,NA,"1/8/1977",NA,NA,NA,NA,1977-08-01,NA,NA,NA,NA,NA,NA,NA
"4200","PinotNoir","193","193Mtp71","",1978,NA,NA,"9/8/1978",NA,NA,NA,NA,1978-08-09,NA,NA,NA,NA,NA,NA,NA
"4201","PinotNoir","193","193Mtp71","",1979,NA,NA,"30/7/79",NA,NA,NA,NA,1979-07-30,NA,NA,NA,NA,NA,NA,NA
"4202","PinotNoir","193","193Mtp71","",1980,NA,NA,"31/7/80",NA,NA,NA,NA,1980-07-31,NA,NA,NA,NA,NA,NA,NA
"4203","PinotNoir","193","193Mtp71","",1982,NA,NA,"19/7/82",NA,NA,NA,NA,1982-07-19,NA,NA,NA,NA,NA,NA,NA
"4204","PinotNoir","193","193Mtp71","",1983,NA,NA,"2/8/1983",NA,NA,NA,NA,1983-08-02,NA,NA,NA,NA,NA,NA,NA
"4205","PinotNoir","193","193Mtp71","",1984,NA,NA,"6/8/1984",NA,NA,NA,NA,1984-08-06,NA,NA,NA,NA,NA,NA,NA
"4206","PinotNoir","193","193Mtp71","",1985,NA,NA,"26/7/85",NA,NA,NA,NA,1985-07-26,NA,NA,NA,NA,NA,NA,NA
"4207","PinotNoir","193","193Mtp72","",1961,"2/3/1961",NA,NA,"14/8/61",NA,1961-03-02,NA,NA,1961-08-14,NA,165,NA,NA,NA,NA
"4208","PinotNoir","193","193Mtp72","",1965,"27/3/65",NA,NA,"10/8/1965",NA,1965-03-27,NA,NA,1965-08-10,NA,136,NA,NA,NA,NA
"4209","PinotNoir","193","193Mtp72","",1976,NA,NA,"29/7/76",NA,NA,NA,NA,1976-07-29,NA,NA,NA,NA,NA,NA,NA
"4210","PinotNoir","193","193Mtp72","",1977,NA,NA,"1/8/1977",NA,NA,NA,NA,1977-08-01,NA,NA,NA,NA,NA,NA,NA
"4211","PinotNoir","193","193Mtp72","",1978,NA,NA,"9/8/1978",NA,NA,NA,NA,1978-08-09,NA,NA,NA,NA,NA,NA,NA
"4212","PinotNoir","193","193Mtp72","",1979,NA,NA,"26/7/79",NA,NA,NA,NA,1979-07-26,NA,NA,NA,NA,NA,NA,NA
"4213","PinotNoir","193","193Mtp72","",1980,NA,NA,"4/8/1980",NA,NA,NA,NA,1980-08-04,NA,NA,NA,NA,NA,NA,NA
"4214","PinotNoir","193","193Mtp72","",1982,NA,NA,"22/7/82",NA,NA,NA,NA,1982-07-22,NA,NA,NA,NA,NA,NA,NA
"4215","PinotNoir","193","193Mtp72","",1983,NA,NA,"2/8/1983",NA,NA,NA,NA,1983-08-02,NA,NA,NA,NA,NA,NA,NA
"4216","PinotNoir","193","193Mtp72","",1984,NA,NA,"6/8/1984",NA,NA,NA,NA,1984-08-06,NA,NA,NA,NA,NA,NA,NA
"4217","PinotNoir","193","193Mtp72","",1985,NA,NA,"1/8/1985",NA,NA,NA,NA,1985-08-01,NA,NA,NA,NA,NA,NA,NA
"4218","PinotNoir","193","193Mtp72","",1996,NA,"26/5/96",NA,NA,NA,NA,1996-05-26,NA,NA,NA,NA,NA,NA,NA,NA
"4219","PinotNoir","193","193Mtp73","",1961,NA,NA,NA,"7/8/1961",NA,NA,NA,NA,1961-08-07,NA,NA,NA,NA,NA,NA
"4220","PinotNoir","193","193Mtp73","",1964,NA,NA,NA,"4/8/1964",NA,NA,NA,NA,1964-08-04,NA,NA,NA,NA,NA,NA
"4221","PinotNoir","193","193Mtp73","",1965,"22/3/65",NA,NA,"5/8/1965",NA,1965-03-22,NA,NA,1965-08-05,NA,136,NA,NA,NA,NA
"4222","PinotNoir","193","193Mtp73","",1976,NA,NA,"23/7/76",NA,NA,NA,NA,1976-07-23,NA,NA,NA,NA,NA,NA,NA
"4223","PinotNoir","193","193Mtp73","",1977,NA,NA,"1/8/1977",NA,NA,NA,NA,1977-08-01,NA,NA,NA,NA,NA,NA,NA
"4224","PinotNoir","193","193Mtp73","",1978,NA,NA,"1/8/1978",NA,NA,NA,NA,1978-08-01,NA,NA,NA,NA,NA,NA,NA
"4225","PinotNoir","193","193Mtp73","",1979,NA,NA,"26/7/79",NA,NA,NA,NA,1979-07-26,NA,NA,NA,NA,NA,NA,NA
"4226","PinotNoir","193","193Mtp73","",1980,NA,NA,"28/7/80",NA,NA,NA,NA,1980-07-28,NA,NA,NA,NA,NA,NA,NA
"4227","PinotNoir","193","193Mtp73","",1982,NA,NA,"19/7/82",NA,NA,NA,NA,1982-07-19,NA,NA,NA,NA,NA,NA,NA
"4228","PinotNoir","193","193Mtp73","",1983,NA,NA,"2/8/1983",NA,NA,NA,NA,1983-08-02,NA,NA,NA,NA,NA,NA,NA
"4229","PinotNoir","193","193Mtp73","",1984,NA,NA,"6/8/1984",NA,NA,NA,NA,1984-08-06,NA,NA,NA,NA,NA,NA,NA
"4230","PinotNoir","193","193Mtp73","",1985,NA,NA,"1/8/1985",NA,NA,NA,NA,1985-08-01,NA,NA,NA,NA,NA,NA,NA
"4231","PinotNoir","193","193Mtp74","",1960,NA,NA,NA,"2/8/1960",NA,NA,NA,NA,1960-08-02,NA,NA,NA,NA,NA,NA
"4232","PinotNoir","193","193Mtp74","",1961,NA,NA,NA,"14/8/61",NA,NA,NA,NA,1961-08-14,NA,NA,NA,NA,NA,NA
"4233","PinotNoir","193","193Mtp74","",1965,"27/3/65",NA,NA,NA,NA,1965-03-27,NA,NA,NA,NA,NA,NA,NA,NA,NA
"4234","PinotNoir","193","193Mtp74","",1976,NA,NA,"29/7/76",NA,NA,NA,NA,1976-07-29,NA,NA,NA,NA,NA,NA,NA
"4235","PinotNoir","193","193Mtp74","",1977,NA,NA,"1/8/1977",NA,NA,NA,NA,1977-08-01,NA,NA,NA,NA,NA,NA,NA
"4236","PinotNoir","193","193Mtp74","",1978,NA,NA,"5/8/1978",NA,NA,NA,NA,1978-08-05,NA,NA,NA,NA,NA,NA,NA
"4237","PinotNoir","193","193Mtp74","",1979,NA,NA,"30/7/79",NA,NA,NA,NA,1979-07-30,NA,NA,NA,NA,NA,NA,NA
"4238","PinotNoir","193","193Mtp74","",1980,NA,NA,"28/7/80",NA,NA,NA,NA,1980-07-28,NA,NA,NA,NA,NA,NA,NA
"4239","PinotNoir","193","193Mtp74","",1982,NA,NA,"19/7/82",NA,NA,NA,NA,1982-07-19,NA,NA,NA,NA,NA,NA,NA
"4240","PinotNoir","193","193Mtp74","",1983,NA,NA,"2/8/1983",NA,NA,NA,NA,1983-08-02,NA,NA,NA,NA,NA,NA,NA
"4241","PinotNoir","193","193Mtp74","",1984,NA,NA,"6/8/1984",NA,NA,NA,NA,1984-08-06,NA,NA,NA,NA,NA,NA,NA
"4242","PinotNoir","193","193Mtp74","",1985,NA,NA,"26/7/85",NA,NA,NA,NA,1985-07-26,NA,NA,NA,NA,NA,NA,NA
"4243","PinotNoir","193","193Mtp75","",1967,"13/3/67",NA,NA,NA,NA,1967-03-13,NA,NA,NA,NA,NA,NA,NA,NA,NA
"4244","PinotNoir","193","193Mtp75","",1968,"15/3/68",NA,NA,NA,NA,1968-03-15,NA,NA,NA,NA,NA,NA,NA,NA,NA
"4245","PinotNoir","193","193Mtp75","",1969,"22/3/69",NA,NA,"26/8/69",NA,1969-03-22,NA,NA,1969-08-26,NA,157,NA,NA,NA,NA
"4246","PinotNoir","193","193Mtp75","",1970,NA,NA,NA,"10/8/1970",NA,NA,NA,NA,1970-08-10,NA,NA,NA,NA,NA,NA
"4247","PinotNoir","193","193Mtp75","",1971,NA,NA,NA,"16/8/71",NA,NA,NA,NA,1971-08-16,NA,NA,NA,NA,NA,NA
"4248","PinotNoir","193","193Mtp75","",1976,NA,NA,"29/7/76",NA,NA,NA,NA,1976-07-29,NA,NA,NA,NA,NA,NA,NA
